<!DOCTYPE HTML PUBLIC "-//W3C//DTD HTML 4.01 Transitional//EN" "http://www.w3.org/TR/html4/loose.dtd">
<html>
<head>
<title>1973 Setlists</title>
</head>
<body>
<div align="center">
<div id="container">
<div><img src="/images/banner.jpg"></div>

<div id="nav"><!--START NAV-->
	<div class="link"><a href="/my">My DeadBase</a></div>
    <div class="link" onmouseover="showDrop('lists_60s');" onmouseout="hideDrop('lists_60s');"><ul id="lists_60s">
    	<li><a href="/1965/setlists">1965</a></li><li><a href="/1966/setlists">1966</a></li><li><a href="/1967/setlists">1967</a></li><li><a href="/1968/setlists">1968</a></li><li><a href="/1969/setlists">1969</a></li>    </ul><a href="/setlists">60s Setlists</a></div>
    <div class="link" onmouseover="showDrop('lists_70s');" onmouseout="hideDrop('lists_70s');"><a href="/setlists">70s Setlists</a><ul id="lists_70s">
    	<li><a href="/1970/setlists">1970</a></li><li><a href="/1971/setlists">1971</a></li><li><a href="/1972/setlists">1972</a></li><li><a href="/1973/setlists">1973</a></li><li><a href="/1974/setlists">1974</a></li><li><a href="/1975/setlists">1975</a></li><li><a href="/1976/setlists">1976</a></li><li><a href="/1977/setlists">1977</a></li><li><a href="/1978/setlists">1978</a></li><li><a href="/1979/setlists">1979</a></li>    </ul></div>
    <div class="link" onmouseover="showDrop('lists_80s');" onmouseout="hideDrop('lists_80s');"><a href="/setlists">80s Setlists</a><ul id="lists_80s">
    	<li><a href="/1980/setlists">1980</a></li><li><a href="/1981/setlists">1981</a></li><li><a href="/1982/setlists">1982</a></li><li><a href="/1983/setlists">1983</a></li><li><a href="/1984/setlists">1984</a></li><li><a href="/1985/setlists">1985</a></li><li><a href="/1986/setlists">1986</a></li><li><a href="/1987/setlists">1987</a></li><li><a href="/1988/setlists">1988</a></li><li><a href="/1989/setlists">1989</a></li>    </ul></div>
    <div class="link" onmouseover="showDrop('lists_90s');" onmouseout="hideDrop('lists_90s');"><a href="/setlists">90s Setlists</a><ul id="lists_90s">
    	<li><a href="/1990/setlists">1990</a></li><li><a href="/1991/setlists">1991</a></li><li><a href="/1992/setlists">1992</a></li><li><a href="/1993/setlists">1993</a></li><li><a href="/1994/setlists">1994</a></li><li><a href="/1995/setlists">1995</a></li>    </ul></div>
    <div class="link"><a href="/songs">Songbook</a></div>
    <div class="link"><a href="/stuff">Odds &amp; Ends</a></div>
    <div class="link"><a href="/community">Community</a></div>
    <div class="clear"></div>
</div>

<div id="logbar"><!--START LOGIN-->
You are logged in as Dave R [<a href="">Log Out</a>]<span class="space">|</span><a href="/my">My DeadBase Options and Shows</a><span class="space">|</span>Shows I own are currently highlighted. [<span onmouseover="document.getElementById('highoptions').style.display='block';" onmouseout="document.getElementById('highoptions').style.display='none'; return false;"><a href="#" onclick="return false;">Change</a><div id="highoptions" class="highoptions" style="display:none;">
		<a href="/1973/setlists&highlight=went">Shows I attended</a>
		<a href="/1973/setlists&highlight=own">Shows I own</a>
		<a href="/1973/setlists&highlight=looking">Shows I'm looking for</a>
		<a href="/1973/setlists&highlight=favorite">My favorite shows</a>
	</div></span>] 
</div>

<div><!--START main-->
<div id="mainc"><div id="main">
	<div class="page_title">1973 Setlists</div>

<script language="Javascript" type="text/javascript">
<!--
function showtab () {
document.getElementById('hide').style.display = 'none';
document.getElementById('show').style.display = 'block';
}
function hidetab () {
document.getElementById('show').style.display = 'none';
document.getElementById('hide').style.display = 'block';
}
-->
</script>
<p>February:  <a href="#0209">9</a> <a href="#0215">15</a> <a href="#0217">17</a> <a href="#0219">19</a> <a href="#0221">21</a> <a href="#0222">22</a> <a href="#0224">24</a> <a href="#0226">26</a> <a href="#0228">28</a><br>
March: <a href="#0315">15</a> <a href="#0316">16</a> <a href="#0317">17</a> <a href="#0318">18</a> <a href="#0319">19</a> <a href="#0321">21</a> <a href="#0322">22</a> <a href="#0324">24</a> <a href="#0326">26</a> <a href="#0328">28</a> <a href="#0330">30</a> <a href="#0331">31</a><br>
April: <a href="#0402">2</a><br>
May: <a href="#0513">13</a> <a href="#0520">20</a> <a href="#0522">22</a> <a href="#0523">23</a> <a href="#0526">26</a> <a href="#0527">27</a><br>
June: <a href="#0602">2</a> <a href="#0603">3</a> <a href="#0609">9</a> <a href="#0610">10</a> <a href="#0622">22</a> <a href="#0624">24</a> <a href="#0626">26</a> <a href="#0629">29</a> <a href="#0630">30</a><br>
July: <a href="#0701">1</a> <a href="#0720">20</a> <a href="#0727">27</a> <a href="#0728">28</a> <a href="#0730">30</a> <a href="#0731">31</a><br>
August: <a href="#0801">1</a> <a href="#0804">4</a> <a href="#0807">7</a> <a href="#0808">8</a> <a href="#0811">11</a><br>
September: <a href="#0907">7</a> <a href="#0908">8</a> <a href="#0911">11</a> <a href="#0912">12</a> <a href="#0914">14</a> <a href="#0915">15</a> <a href="#0917">17</a> <a href="#0918">18</a> <a href="#0920">20</a> <a href="#0921">21</a> <a href="#0924">24</a> <a href="#0926">26</a><br>
October: <a href="#1017">17</a> <a href="#1019">19</a> <a href="#1021">21</a> <a href="#1023">23</a> <a href="#1025">25</a> <a href="#1027">27</a> <a href="#1029">29</a> <a href="#1030">30</a><br>
November: <a href="#1101">1</a> <a href="#1109">9</a> <a href="#1110">10</a> <a href="#1111">11</a> <a href="#1114">14</a> <a href="#1117">17</a> <a href="#1120">20</a> <a href="#1121">21</a> <a href="#1123">23</a> <a href="#1125">25</a> <a href="#1130">30</a><br>
December: <a href="#1201">1</a> <a href="#1202">2</a> <a href="#1204">4</a> <a href="#1206">6</a> <a href="#1208">8</a> <a href="#1210">10</a> <a href="#1212">12</a> <a href="#1218">18</a> <a href="#1219">19</a></p>
<div class="setlist_table"><table border="0" cellspacing="0" cellpadding="0"><tr class="header"><td><span><a name="0209"></a><a href="/1973-02-09">2/9/1973 Roscoe Maples Pavilion, Stanford U., Palo Alto, CA</a></span> [<a href="http://www.archive.org/search.php?query=creator:%22Grateful Dead%22%20date:1973-02-09*">Listen/Download</a>]<tr><td>I: Promised, Row Jimmy, B. T. Wind, Deal, Me  and  My Uncle, Sugaree, L. L. Rain, Loose Lucy, Mexicali, B. E. Women, El Paso, H. C. Sunshine, Playin</td></tr>
<tr><td>II: China Cat > I Know You Rider, Jack Straw, TLEO, Truckin > Eyes > China Doll, Big River, Ramble On, Box Of Rain, Wave That Flag, Sugar Magnolia, Uncle John, Around</td></tr>
<tr><td>E: Casey Jones</td></tr>
<tr class="notes"><td>First ''China Doll''; First ''Eyes''; First ''H. C. Sunshine''; First ''Loose Lucy''; First ''Row Jimmy''; First ''TLEO''; First ''Wave That Flag''; Previous ''L. L. Rain'' 7/16/1972 [54 shows]</i></td></tr>
<tr class="notes"><td>"Beer Barrel Polka" tuning before "Mexicali."</i></td></tr>
</table></div>
<div class="setlist_table"><table border="0" cellspacing="0" cellpadding="0"><tr class="header"><td><span><a name="0215"></a><a href="/1973-02-15">2/15/1973 Dane County Coliseum, Madison, WI</a></span> [<a href="http://www.archive.org/search.php?query=creator:%22Grateful Dead%22%20date:1973-02-15*">Listen/Download</a>]<tr><td>I: Loose Lucy, BIODTL, B. E. Women, Mexicali, Tennessee Jed, L. L. Rain, Box Of Rain, Row Jimmy, Jack Straw, China Cat > I Know You Rider, Me  and  My Uncle, Bertha, Playin, Casey Jones</td></tr>
<tr><td>II: H. C. Sunshine, El Paso, You Ain't Woman Enough, TLEO, Big River, Dark Star > Eyes > China Doll, Promised, Sugaree, Sugar Magnolia</td></tr>
<tr><td>E: Uncle John, Saturday Night</td></tr>
<tr class="notes"><td>First ''You Ain't Woman Enough''</i></td></tr>
<tr class="notes"><td>Soundcheck: "Loose Lucy," "Jack Straw," "Box Of Rain," "Uncle John."</i></td></tr>
</table></div>
<div class="setlist_table"><table border="0" cellspacing="0" cellpadding="0"><tr class="header"><td><span><a name="0217"></a><a href="/1973-02-17">2/17/1973 St. Paul Auditorium, St. Paul, MN</a></span> [<a href="http://www.archive.org/search.php?query=creator:%22Grateful Dead%22%20date:1973-02-17*">Listen/Download</a>]<tr><td>I: Promised, He's Gone, L. L. Rain, Box Of Rain, Wave That Flag, Mexicali, Bird Song, BIODTL, Loose Lucy, Bobby McGee, Stella Blue, El Paso, TLEO, Playin</td></tr>
<tr><td>II: Truckin, Row Jimmy, Big River, You Ain't Woman Enough, H. C. Sunshine > China Cat > I Know You Rider, Around, NFA > GDTRFB > NFA, Saturday Night</td></tr>
<tr><td>E: Casey Jones</td></tr>
<tr class="notes"><td>"Beer Barrel Polka" tuning before "BIODTL."</i></td></tr>
</table></div>
<div class="setlist_table"><table border="0" cellspacing="0" cellpadding="0"><tr class="header"><td><span><a name="0219"></a><a href="/1973-02-19">2/19/1973 International Amphitheatre, Chicago, IL</a></span> [<a href="http://www.archive.org/search.php?query=creator:%22Grateful Dead%22%20date:1973-02-19*">Listen/Download</a>]<tr><td>I: Promised, Box Of Rain, B. E. Women, El Paso</td></tr>
<tr><td>II: He's Gone > Truckin > Other One > Eyes > China Doll, Sugar Magnolia, Casey Jones</td></tr>
<tr class="notes"><td>Also: NRPS. "Casey Jones" is probably the encore. Only the second set jam circulates, and no recording of the rest of the show is known to exist.</i></td></tr>
</table></div>
<div class="setlist_table"><table border="0" cellspacing="0" cellpadding="0"><tr class="header"><td><span><a name="0221"></a><a href="/1973-02-21">2/21/1973 Assembly Hall, U. of Il., Champaign-Urbana, IL</a></span> [<a href="http://www.archive.org/search.php?query=creator:%22Grateful Dead%22%20date:1973-02-21*">Listen/Download</a>]<tr><td>I: Wave That Flag, Me  and  My Uncle, B. E. Women, BIODTL, Loser, L. L. Rain, Row Jimmy, You Ain't Woman Enough, Box Of Rain, Mexicali, Sugaree, Around, China Cat > I Know You Rider</td></tr>
<tr><td>II: Jack Straw, Half Step, Truckin > Drums and Bass > Eyes > Stella Blue, Sugar Magnolia, Casey Jones</td></tr>
<tr><td>E: Johnny B. Goode</td></tr>
</table></div>
<div class="setlist_table"><table border="0" cellspacing="0" cellpadding="0"><tr class="header"><td><span><a name="0222"></a><a href="/1973-02-22">2/22/1973 Assembly Hall, U. of Il., Champaign-Urbana, IL</a></span> [<a href="http://www.archive.org/search.php?query=creator:%22Grateful Dead%22%20date:1973-02-22*">Listen/Download</a>]<tr><td>I: Promised, TLEO, El Paso, Bird Song, Mexicali, Deal, L. L. Rain, Tennessee Jed, Box Of Rain, Playin, Row Jimmy, You Ain’t Woman Enough, China Cat > I Know You Rider</td></tr>
<tr><td>II: Wave That Flag, Me  and  My Uncle, Dark Star > Eyes > China Doll, Around, GDTRFB > Saturday Night</td></tr>
<tr><td>E: Casey Jones</td></tr>
</table></div>
<div class="setlist_table"><table border="0" cellspacing="0" cellpadding="0"><tr class="header"><td><span><a name="0224"></a><a href="/1973-02-24">2/24/1973 Fieldhouse, University of Iowa, Iowa City, IA</a></span> [<a href="http://www.archive.org/search.php?query=creator:%22Grateful Dead%22%20date:1973-02-24*">Listen/Download</a>]<tr><td>I: Bertha, Mexicali, B. E. Women, L. L. Rain, Loose Lucy, BIODTL, China Cat > I Know You Rider, Jack Straw, H. C. Sunshine, El Paso, Box Of Rain, Tennessee Jed, Playin</td></tr>
<tr><td>II: TLEO, Greatest, Row Jimmy, Big River, Ramble On, Bobby McGee, Wave That Flag, You Ain't Woman Enough, Truckin > Nobody's Jam > Eyes > Sugar Magnolia</td></tr>
<tr><td>E: Johnny B. Goode</td></tr>
<tr class="notes"><td>"Feelin’ Groovy" jam between Eyes of the World and Sugar Magnolia.</i></td></tr>
</table></div>
<div class="setlist_table"><table border="0" cellspacing="0" cellpadding="0"><tr class="header"><td><span><a name="0226"></a><a href="/1973-02-26">2/26/1973 Pershing Municipal Auditorium, Lincoln, NE</a></span> [<a href="http://www.archive.org/search.php?query=creator:%22Grateful Dead%22%20date:1973-02-26*">Listen/Download</a>]<tr><td>I: Promised <span class="setlist_small">*</span>, Deal, Mexicali, Loser <span class="setlist_small">*</span>, Jack Straw <span class="setlist_small">*</span>, Don't Ease <span class="setlist_small">*</span>, Box Of Rain, China Cat > I Know You Rider, L. L. Rain <span class="setlist_small">*</span>, Loose Lucy <span class="setlist_small">*</span>, BIODTL, Row Jimmy, El Paso, Big RxR Blues <span class="setlist_small">*</span>, Playin <span class="setlist_small">*</span></td></tr>
<tr><td>II: TLEO <span class="setlist_small">*</span>, Big River <span class="setlist_small">*</span>, Tennessee Jed <span class="setlist_small">*</span>, Greatest <span class="setlist_small">*</span>, Dark Star <span class="setlist_small">*</span> > Eyes <span class="setlist_small">*</span> > Half Step <span class="setlist_small">*</span>, Me  and  My Uncle <span class="setlist_small">*</span>, NFA <span class="setlist_small">*</span> > GDTRFB <span class="setlist_small">*</span> > NFA <span class="setlist_small">*</span></td></tr>
<tr class="notes"><td>*appears on "Dick’s Picks Volume 28."</i></td></tr>
</table></div>
<div class="setlist_table"><table border="0" cellspacing="0" cellpadding="0"><tr class="header"><td><span><a name="0228"></a><a href="/1973-02-28">2/28/1973 Salt Palace, Salt Lake City, UT</a></span> [<a href="http://www.archive.org/search.php?query=creator:%22Grateful Dead%22%20date:1973-02-28*">Listen/Download</a>]<tr><td>I: Cold Rain, BIODTL, TLEO, Mexicali, Sugaree, Box Of Rain, El Paso, He's Gone, Jack Straw</td></tr>
<tr><td>II: China Cat > I Know You Rider, Big River, Row Jimmy, Promised, Truckin > Other One > Eyes > Morning Dew, Sugar Magnolia</td></tr>
<tr><td>E: We Bid You Goodnight</td></tr>
<tr class="notes"><td>Previous ''We Bid You Goodnight'' 8/15/1971 [127 shows]</i></td></tr>
<tr class="notes"><td>Setlist is complete. Entire show except "Promised Land" appears on Dick’s Picks Volume 28.</i></td></tr>
</table></div>
<div class="setlist_table"><table border="0" cellspacing="0" cellpadding="0"><tr class="header"><td><span><a name="0315"></a><a href="/1973-03-15">3/15/1973 Nassau Veterans Memorial Coliseum, Uniondale, NY</a></span> [<a href="http://www.archive.org/search.php?query=creator:%22Grateful Dead%22%20date:1973-03-15*">Listen/Download</a>]<tr><td>I: Promised, Half Step, Mexicali, TLEO, L. L. Rain, Deal, BIODTL, Box Of Rain, Row Jimmy, Me  and  My Uncle, Tennessee Jed, El Paso, H. C. Sunshine, Playin</td></tr>
<tr><td>II: Loose Lucy, Big River, Sugaree, Jack Straw, Stella Blue, Truckin > Other One > Eyes > China Doll, You Ain't Woman Enough, Sugar Magnolia, Casey Jones</td></tr>
<tr class="notes"><td>"A Swell Dance Concert." Phil Lesh's 33rd birthday. Billing: GD; Sons Of Champlin.</i></td></tr>
</table></div>
<div class="setlist_table"><table border="0" cellspacing="0" cellpadding="0"><tr class="header"><td><span><a name="0316"></a><a href="/1973-03-16">3/16/1973 Nassau Veterans Memorial Coliseum, Uniondale, NY</a></span> [<a href="http://www.archive.org/search.php?query=creator:%22Grateful Dead%22%20date:1973-03-16*">Listen/Download</a>]<tr><td>I: China Cat > I Know You Rider, Jack Straw, Wave That Flag, L. L. Rain, Ramble On, Box Of Rain, BIODTL, TLEO, El Paso, Row Jimmy, Mexicali, Bird Song, Playin</td></tr>
<tr><td>II: Promised > Bertha > Greatest, Loser, Big River, Don't Ease, Me  and  My Uncle, Dark Star > Truckin > Morning Dew, Sugar Magnolia</td></tr>
<tr class="notes"><td>"A Swell Dance Concert." Billing: GD; Sons Of Champlin.</i></td></tr>
</table></div>
<div class="setlist_table"><table border="0" cellspacing="0" cellpadding="0"><tr class="header"><td><span><a name="0317"></a><a href="/1973-03-17">3/17/1973 Nassau Veterans Memorial Coliseum, Uniondale, NY</a></span> [<a href="http://www.archive.org/search.php?query=creator:%22Grateful Dead%22%20date:1973-03-17*">Listen/Download</a>]<tr><td></td></tr>
</table></div>
<div class="setlist_table"><table border="0" cellspacing="0" cellpadding="0"><tr class="header"><td><span><a name="0318"></a><a href="/1973-03-18">3/18/1973 Nassau Veterans Memorial Coliseum, Uniondale, NY</a></span> [<a href="http://www.archive.org/search.php?query=creator:%22Grateful Dead%22%20date:1973-03-18*">Listen/Download</a>]<tr><td></td></tr>
</table></div>
<div class="setlist_table"><table border="0" cellspacing="0" cellpadding="0"><tr class="header"><td><span><a name="0319"></a><a href="/1973-03-19">3/19/1973 Nassau Veterans Memorial Coliseum, Uniondale, NY</a></span> [<a href="http://www.archive.org/search.php?query=creator:%22Grateful Dead%22%20date:1973-03-19*">Listen/Download</a>]<tr><td>I: Promised, He's Gone, Mexicali, TLEO, L. L. Rain, Wave That Flag, Box Of Rain, Race Is On, Row Jimmy, El Paso, China Cat > I Know You Rider, Around, Tennessee Jed, Playin</td></tr>
<tr><td>II: Loose Lucy, Me  and  My Uncle, B. E. Women, Big River, Half Step > Stella Blue, Jack Straw, Truckin > Nobody's Jam > Drums > Other One > Eyes > China Doll, Johnny B. Goode</td></tr>
<tr><td>E1: Casey Jones</td></tr>
<tr><td>E2: Saturday Night</td></tr>
<tr class="notes"><td>Previous ''Race Is On'' 5/1/1970 [267 shows]</i></td></tr>
<tr class="notes"><td>NRPS opened</i></td></tr>
</table></div>
<div class="setlist_table"><table border="0" cellspacing="0" cellpadding="0"><tr class="header"><td><span><a name="0321"></a><a href="/1973-03-21">3/21/1973 Utica Memorial Auditorium, Utica, NY</a></span> [<a href="http://www.archive.org/search.php?query=creator:%22Grateful Dead%22%20date:1973-03-21*">Listen/Download</a>]<tr><td>I: Bertha, Me  and  My Uncle, Wave That Flag, L. L. Rain, Tennessee Jed, Box Of Rain, You Ain't Woman Enough, Jack Straw, Row Jimmy, BIODTL, H. C. Sunshine, Race Is On, Loser, El Paso, China Cat > I Know You Rider, Playin</td></tr>
<tr><td>II: Greatest, TLEO, Mexicali, B. E. Women, Big River, Brokedown, Bobby McGee, WRS Prelude > Dark Star > Eyes > Wharf Rat, Sugar Magnolia, Casey Jones</td></tr>
</table></div>
<div class="setlist_table"><table border="0" cellspacing="0" cellpadding="0"><tr class="header"><td><span><a name="0322"></a><a href="/1973-03-22">3/22/1973 Utica Memorial Auditorium, Utica, NY</a></span> [<a href="http://www.archive.org/search.php?query=creator:%22Grateful Dead%22%20date:1973-03-22*">Listen/Download</a>]<tr><td>I: Promised, Sugaree, Mexicali, TLEO, L. L. Rain, Deal, BIODTL, Bird Song, Jack Straw, Box Of Rain, You Ain't Woman Enough, Race Is On, Row Jimmy, El Paso, China Cat > I Know You Rider, Playin</td></tr>
<tr><td>II: Big River, Wave That Flag, Me  and  My Uncle, H. C. Sunshine, Truckin > Nobody's Jam > Other One > Eyes > China Doll, Sugar Magnolia</td></tr>
<tr><td>E1: Saturday Night</td></tr>
<tr><td>E2: Casey Jones</td></tr>
</table></div>
<div class="setlist_table"><table border="0" cellspacing="0" cellpadding="0"><tr class="header"><td><span><a name="0324"></a><a href="/1973-03-24">3/24/1973 The Spectrum, Philadelphia, PA</a></span> [<a href="http://www.archive.org/search.php?query=creator:%22Grateful Dead%22%20date:1973-03-24*">Listen/Download</a>]<tr><td>I: Bertha, BIODTL, Don't Ease, Race Is On, Cumberland, Box Of Rain, Row Jimmy, Jack Straw, TLEO, Mexicali, Tennessee Jed, L. L. Rain, Wave That Flag, El Paso, H. C. Sunshine, Bobby McGee, Loser, Playin</td></tr>
<tr><td>II: Promised, China Cat > I Know You Rider, Big River, Stella Blue, Me  and  My Uncle, He's Gone > Truckin > Spanish Jam > Space > Dark Star > Sing Me Back Home > Sugar Magnolia</td></tr>
<tr><td>E: Johnny B. Goode</td></tr>
<tr class="notes"><td>Previous ''Space'' 8/21/1972 [60 shows]</i></td></tr>
</table></div>
<div class="setlist_table"><table border="0" cellspacing="0" cellpadding="0"><tr class="header"><td><span><a name="0326"></a><a href="/1973-03-26">3/26/1973 Baltimore Civic Center, Baltimore, MD</a></span> [<a href="http://www.archive.org/search.php?query=creator:%22Grateful Dead%22%20date:1973-03-26*">Listen/Download</a>]<tr><td>I: Promised, Half Step, Race Is On, Wave That Flag, Jack Straw, Sugaree, Mexicali, Box Of Rain, Row Jimmy, BIODTL, B. E. Women, El Paso, China Cat > I Know You Rider, L. L. Rain, Don't Ease, Playin</td></tr>
<tr><td>II: Ramble On, Big River, H. C. Sunshine, Greatest, Candyman, Me  and  My Uncle, He's Gone > Truckin > WRS Prelude > Wharf Rat > Bobby McGee > Eyes > Morning Dew, Saturday Night</td></tr>
<tr class="notes"><td>Wolfman Jack introduced the band before the second set.</i></td></tr>
</table></div>
<div class="setlist_table"><table border="0" cellspacing="0" cellpadding="0"><tr class="header"><td><span><a name="0328"></a><a href="/1973-03-28">3/28/1973 Springfield Civic Center Arena, Springfield, MA</a></span> [<a href="http://www.archive.org/search.php?query=creator:%22Grateful Dead%22%20date:1973-03-28*">Listen/Download</a>]<tr><td>I: Cumberland, H. C. Sunshine, Mexicali, Wave That Flag, BIODTL, Loser, Jack Straw, Box Of Rain, TLEO, El Paso, Row Jimmy, Around, B. E. Women, You Ain't Woman Enough, L. L. Rain, China Cat > I Know You Rider</td></tr>
<tr><td>II: Promised, Loose Lucy, Me  and  My Uncle, Don't Ease, Race Is On, Stella Blue, Big River, Half Step, WRS Prelude > Dark Star > Eyes > Playin, Johnny B. Goode</td></tr>
</table></div>
<div class="setlist_table"><table border="0" cellspacing="0" cellpadding="0"><tr class="header"><td><span><a name="0330"></a><a href="/1973-03-30">3/30/1973 Community War Memorial, Rochester, NY</a></span> [<a href="http://www.archive.org/search.php?query=creator:%22Grateful Dead%22%20date:1973-03-30*">Listen/Download</a>]<tr><td>I: Promised, Deal, L. L. Rain, TLEO, Mexicali, Box Of Rain, Cumberland, Candyman, BIODTL, Don't Ease, El Paso, Row Jimmy, Race Is On, Bird Song, Playin</td></tr>
<tr><td>II: China Cat > I Know You Rider, Jack Straw, Wave That Flag, Greatest, Truckin > Eyes > NFA > GDTRFB > Saturday Night</td></tr>
<tr class="notes"><td>Next ''Candyman'' 12/8/1973 [50 shows]</i></td></tr>
</table></div>
<div class="setlist_table"><table border="0" cellspacing="0" cellpadding="0"><tr class="header"><td><span><a name="0331"></a><a href="/1973-03-31">3/31/1973 War Memorial Auditorium, Buffalo, NY</a></span> [<a href="http://www.archive.org/search.php?query=creator:%22Grateful Dead%22%20date:1973-03-31*">Listen/Download</a>]<tr><td>I: Half Step, Race Is On, Sugaree, Mexicali, Box Of Rain, Tennessee Jed, Jack Straw, Big RxR Blues, El Paso, Row Jimmy, L. L. Rain, TLEO, Playin</td></tr>
<tr><td>II: Promised > Bertha > Greatest, He's Gone > Truckin > Drums > Other One > I Know You Rider, Sugar Magnolia</td></tr>
<tr><td>E: Casey Jones</td></tr>
<tr class="notes"><td>"Feelin’ Groovy" jam during "The Other One," which also contains hints of a "Spanish Jam" that never fully develops.; Donna Jean Godchaux's 100th Show</i></td></tr>
</table></div>
<div class="setlist_table"><table border="0" cellspacing="0" cellpadding="0"><tr class="header"><td><span><a name="0402"></a><a href="/1973-04-02">4/2/1973 Boston Garden, Boston, MA</a></span> [<a href="http://www.archive.org/search.php?query=creator:%22Grateful Dead%22%20date:1973-04-02*">Listen/Download</a>]<tr><td>I: Promised, Deal, Mexicali, B. E. Women, BIODTL, Row Jimmy, L. L. Rain, Wave That Flag, Box Of Rain, Big River, China Cat > I Know You Rider, You Ain't Woman Enough, Jack Straw, Don't Ease, Playin</td></tr>
<tr><td>II: Ramble On, Me  and  My Uncle, Half Step, Greatest, Loose Lucy, El Paso, Stella Blue, Around, H. C. Sunshine > Space > Bobby McGee > WRS Prelude > Eyes > China Doll, Sugar Magnolia, Casey Jones</td></tr>
<tr><td>E: Johnny B. Goode > We Bid You Goodnight</td></tr>
<tr class="notes"><td>Next ''Space'' 5/25/1974 [62 shows]</i></td></tr>
<tr class="notes"><td>"Tico Tico" tuning before 10-beat "BIODTL." </i></td></tr>
</table></div>
<div class="setlist_table"><table border="0" cellspacing="0" cellpadding="0"><tr class="header"><td><span><a name="0513"></a><a href="/1973-05-13">5/13/1973 State Fairgrounds, Des Moines, IA</a></span> [<a href="http://www.archive.org/search.php?query=creator:%22Grateful Dead%22%20date:1973-05-13*">Listen/Download</a>]<tr><td>I: Promised, Deal, Mexicali, TLEO, Box Of Rain, Loser, BIODTL, China Cat > I Know You Rider, El Paso, Row Jimmy, Me  and  My Uncle, Don't Ease > Around</td></tr>
<tr><td>II: Tennessee Jed, Big River, Bertha, Jack Straw, Sugaree, L. L. Rain, H. C. Sunshine, Playin</td></tr>
<tr><td>III: Half Step, Greatest, B. E. Women, He's Gone > Truckin > Drums and Bass > Other One > Eyes > China Doll, Sugar Magnolia</td></tr>
<tr><td>E: Casey Jones</td></tr>
</table></div>
<div class="setlist_table"><table border="0" cellspacing="0" cellpadding="0"><tr class="header"><td><span><a name="0520"></a><a href="/1973-05-20">5/20/1973 Campus Stadium, U.C.S.B., Santa Barbara, CA</a></span> [<a href="http://www.archive.org/search.php?query=creator:%22Grateful Dead%22%20date:1973-05-20*">Listen/Download</a>]<tr><td>I: Bertha, Me  and  My Uncle, Box Of Rain, Deal, L. L. Rain, Tennessee Jed, Race Is On, China Cat > I Know You Rider, BIODTL, TLEO, Playin</td></tr>
<tr><td>II: Promised, B. E. Women, Mexicali, Row Jimmy, Jack Straw, Big RxR Blues, Greatest, H. C. Sunshine, Big River, Loser, El Paso, Casey Jones</td></tr>
<tr><td>III: Truckin > Nonody's Jam > Other One > Eyes > Stella Blue, Sugar Magnolia</td></tr>
<tr><td>E: Johnny B. Goode</td></tr>
<tr class="notes"><td>Afternoon concert. Also: NRPS</i></td></tr>
</table></div>
<div class="setlist_table"><table border="0" cellspacing="0" cellpadding="0"><tr class="header"><td><span><a name="0522"></a><a href="/1973-05-22">5/22/1973 Cow Palace, Daly City, CA</a></span> [<a href="http://www.archive.org/search.php?query=creator:%22Grateful Dead%22%20date:1973-05-22*">Listen/Download</a>]<tr><td></td></tr>
<tr class="notes"><td>Both nights cancelled in favor of one day at Kezar Stadium.</i></td></tr>
</table></div>
<div class="setlist_table"><table border="0" cellspacing="0" cellpadding="0"><tr class="header"><td><span><a name="0523"></a><a href="/1973-05-23">5/23/1973 , , </a></span> [<a href="http://www.archive.org/search.php?query=creator:%22Grateful Dead%22%20date:1973-05-23*">Listen/Download</a>]<tr><td></td></tr>
<tr class="notes"><td>Both nights cancelled in favor of one day at Kezar Stadium.</i></td></tr>
</table></div>
<div class="setlist_table"><table border="0" cellspacing="0" cellpadding="0"><tr class="header"><td><span><a name="0526"></a><a href="/1973-05-26">5/26/1973 Kezar Stadium, San Francisco, CA</a></span> [<a href="http://www.archive.org/search.php?query=creator:%22Grateful Dead%22%20date:1973-05-26*">Listen/Download</a>]<tr><td>I: Promised, Deal, Jack Straw, Tennessee Jed, Race Is On, Sugaree, Mexicali, Row Jimmy, L. L. Rain, TLEO, Playin</td></tr>
<tr><td>II: H. C. Sunshine, El Paso, Loser, BIODTL, You Ain't Woman Enough, Box Of Rain, China Cat > I Know You Rider, Big River, Bertha, Around</td></tr>
<tr><td>III: Half Step, Me  and  My Uncle, He's Gone > Truckin > Drums and Bass > Other One > Eyes > China Doll, Sugar Magnolia</td></tr>
<tr><td>E: Casey Jones</td></tr>
<tr class="notes"><td>afternoon concert - billing: GD; NRPS; Waylon Jennings</i></td></tr>
</table></div>
<div class="setlist_table"><table border="0" cellspacing="0" cellpadding="0"><tr class="header"><td><span><a name="0527"></a><a href="/1973-05-27">5/27/1973 Ontario Speedway, Ontario, CA</a></span> [<a href="http://www.archive.org/search.php?query=creator:%22Grateful Dead%22%20date:1973-05-27*">Listen/Download</a>]<tr><td></td></tr>
</table></div>
<div class="setlist_table"><table border="0" cellspacing="0" cellpadding="0"><tr class="header"><td><span><a name="0602"></a><a href="/1973-06-02">6/2/1973 Kansas City Memorial Auditorium, Kansas City, MO</a></span> [<a href="http://www.archive.org/search.php?query=creator:%22Grateful Dead%22%20date:1973-06-02*">Listen/Download</a>]<tr><td></td></tr>
<tr class="notes"><td>Venue might have been the Kansas City Municipal Auditorium Arena.</i></td></tr>
</table></div>
<div class="setlist_table"><table border="0" cellspacing="0" cellpadding="0"><tr class="header"><td><span><a name="0603"></a><a href="/1973-06-03">6/3/1973 Kansas City Memorial Auditorium, Kansas City, MO</a></span> [<a href="http://www.archive.org/search.php?query=creator:%22Grateful Dead%22%20date:1973-06-03*">Listen/Download</a>]<tr><td></td></tr>
<tr class="notes"><td>Venue might have been the Kansas City Municipal Auditorium Arena.</i></td></tr>
</table></div>
<div class="setlist_table"><table border="0" cellspacing="0" cellpadding="0"><tr class="header"><td><span><a name="0609"></a><a href="/1973-06-09">6/9/1973 Robert F. Kennedy Stadium, Washington, DC</a></span> [<a href="http://www.archive.org/search.php?query=creator:%22Grateful Dead%22%20date:1973-06-09*">Listen/Download</a>]<tr><td>I: Promised, Deal, L. L. Rain, TLEO, Jack Straw, Loose Lucy, Mexicali, Row Jimmy, El Paso, Box Of Rain, Sugaree, BIODTL, Tennessee Jed, Greatest, China Cat > I Know You Rider</td></tr>
<tr><td>II: He's Gone > Truckin > Playin, Loser, Me  and  My Uncle, Half Step, Big River, Eyes > China Doll, Sugar Magnolia</td></tr>
<tr class="notes"><td>Doug Sahm opened; Allman Brothers Band closed. Soundcheck: "China Cat" > "I Know You Rider." </i></td></tr>
</table></div>
<div class="setlist_table"><table border="0" cellspacing="0" cellpadding="0"><tr class="header"><td><span><a name="0610"></a><a href="/1973-06-10">6/10/1973 Robert F. Kennedy Stadium, Washington, DC</a></span> [<a href="http://www.archive.org/search.php?query=creator:%22Grateful Dead%22%20date:1973-06-10*">Listen/Download</a>]<tr><td>I: Morning Dew, BIODTL, Ramble On, Jack Straw, Wave That Flag, L. L. Rain, Box Of Rain, TLEO, Race Is On, Row Jimmy, El Paso, Bird Song, Playin</td></tr>
<tr><td>II: Eyes > Stella Blue, Big River, H. C. Sunshine, Around, Dark Star > He's Gone > Wharf Rat > Truckin, Sugar Magnolia</td></tr>
<tr><td>III: Train To Cry<span class="setlist_small">*+</span>, That's Alright Mama<span class="setlist_small">*</span>, Promised<span class="setlist_small">*</span>, NFA<span class="setlist_small">*</span> > GDTRFB<span class="setlist_small">*</span> > Drums<span class="setlist_small">*</span> > NFA<span class="setlist_small">*</span>, Johnny B. Goode<span class="setlist_small">*</span></td></tr>
<tr class="notes"><td>First ''That's Alright Mama''; First ''Train To Cry''; Next ''Train To Cry'' 5/12/1991 [1164 shows]; Final ''Wave That Flag''</i></td></tr>
<tr class="notes"><td>Wet Willie, then Allman Brothers Band opened. *with Allman Brothers Band and Merl Saunders. +appears on "Postcards from the Hanging." "Half Step" appears on some tapes but is likely from a different show</i></td></tr>
</table></div>
<div class="setlist_table"><table border="0" cellspacing="0" cellpadding="0"><tr class="header"><td><span><a name="0622"></a><a href="/1973-06-22">6/22/1973 P.N.E. Coliseum, Vancouver, B.C., Canada</a></span> [<a href="http://www.archive.org/search.php?query=creator:%22Grateful Dead%22%20date:1973-06-22*">Listen/Download</a>]<tr><td>I: Bertha, BIODTL, Deal, Mexicali, Box Of Rain, Bird Song, Race Is On, Sugaree, L. L. Rain, Row Jimmy, Jack Straw, China Cat > I Know You Rider, Big River, Tennessee Jed, Playin</td></tr>
<tr><td>II: H. C. Sunshine, Promised, B. E. Women, El Paso, Black Peter, Greatest, Big RxR Blues, He's Gone > Truckin > Nobody's Jam > Drums and Bass > Other One > Wharf Rat > Sugar Magnolia, Casey Jones</td></tr>
<tr><td>E: Johnny B. Goode</td></tr>
<tr class="notes"><td>Previous ''Black Peter'' 10/17/1972 [50 shows]</i></td></tr>
</table></div>
<div class="setlist_table"><table border="0" cellspacing="0" cellpadding="0"><tr class="header"><td><span><a name="0624"></a><a href="/1973-06-24">6/24/1973 Portland Memorial Coliseum, Portland, OR</a></span> [<a href="http://www.archive.org/search.php?query=creator:%22Grateful Dead%22%20date:1973-06-24*">Listen/Download</a>]<tr><td>I: Promised, Loser, Mexicali, TLEO, L. L. Rain, Box Of Rain, Big RxR Blues, Jack Straw, Sugaree, Race Is On, Row Jimmy, BIODTL, China Cat > I Know You Rider, Around</td></tr>
<tr><td>II: Half Step, You Ain't Woman Enough, El Paso, Stella Blue, Greatest > Bertha, Big River, Dark Star > Eyes > China Doll, Sugar Magnolia, </td></tr>
<tr><td>E: Saturday Night</td></tr>
</table></div>
<div class="setlist_table"><table border="0" cellspacing="0" cellpadding="0"><tr class="header"><td><span><a name="0626"></a><a href="/1973-06-26">6/26/1973 Seattle Center Arena, Seattle, WA</a></span> [<a href="http://www.archive.org/search.php?query=creator:%22Grateful Dead%22%20date:1973-06-26*">Listen/Download</a>]<tr><td>I: Casey Jones > Greatest, B. E. Women, Jack Straw, Box Of Rain, Deal, Mexicali, You Ain't Woman Enough, Row Jimmy, Race Is On, China Cat > I Know You Rider, BIODTL, Loser, Playin</td></tr>
<tr><td>II: Bertha > Promised, TLEO, El Paso, Black Peter, Big River, H. C. Sunshine, Me  and  My Uncle, He's Gone > Truckin > Drums > Other One > Bobby McGee > Other One > Sugar Magnolia</td></tr>
<tr><td>E: Johnny B. Goode</td></tr>
</table></div>
<div class="setlist_table"><table border="0" cellspacing="0" cellpadding="0"><tr class="header"><td><span><a name="0629"></a><a href="/1973-06-29">6/29/1973 Universal Amphitheatre, Universal City, CA</a></span> [<a href="http://www.archive.org/search.php?query=creator:%22Grateful Dead%22%20date:1973-06-29*">Listen/Download</a>]<tr><td>I: Bertha, Me  and  My Uncle, Sugaree, Race Is On, L. L. Rain, Don't Ease, Big River, Row Jimmy, Loose Lucy, China Cat > I Know You Rider, Jack Straw, Deal, Playin</td></tr>
<tr><td>II: Half Step, El Paso, B. E. Women, Promised, He's Gone > Truckin > Other One > Morning Dew, Around, Casey Jones</td></tr>
<tr class="notes"><td>First set order uncertain except last three songs-even now nothing before "Jack Straw" circulates.</i></td></tr>
</table></div>
<div class="setlist_table"><table border="0" cellspacing="0" cellpadding="0"><tr class="header"><td><span><a name="0630"></a><a href="/1973-06-30">6/30/1973 Universal Amphitheatre, Universal City, CA</a></span> [<a href="http://www.archive.org/search.php?query=creator:%22Grateful Dead%22%20date:1973-06-30*">Listen/Download</a>]<tr><td>I: Promised, TLEO, Mexicali, Tennessee Jed, L. L. Rain, Bird Song, Cumberland, Row Jimmy, Jack Straw, Deal, BIODTL, Black Peter, Playin</td></tr>
<tr><td>II: Greatest, Ramble On, El Paso, Dark Star > Eyes > Stella Blue, Sugar Magnolia</td></tr>
<tr><td>E: Saturday Night</td></tr>
<tr class="notes"><td>Total solar eclipse (not total at show)).</i></td></tr>
</table></div>
<div class="setlist_table"><table border="0" cellspacing="0" cellpadding="0"><tr class="header"><td><span><a name="0701"></a><a href="/1973-07-01">7/1/1973 Universal Amphitheatre, Universal City, CA</a></span> [<a href="http://www.archive.org/search.php?query=creator:%22Grateful Dead%22%20date:1973-07-01*">Listen/Download</a>]<tr><td>I: Half Step, Me  and  My Uncle, Sugaree, Race Is On, B. E. Women, L. L. Rain, Don't Ease, Big River, China Cat > I Know You Rider, Around</td></tr>
<tr><td>II: Playin, Row Jimmy, El Paso, Loose Lucy, Truckin > Drums > Other One > Wharf Rat > Bobby McGee, Casey Jones</td></tr>
</table></div>
<div class="setlist_table"><table border="0" cellspacing="0" cellpadding="0"><tr class="header"><td><span><a name="0720"></a><a href="/1973-07-20">7/20/1973 Cameron Indoor Stadium, Duke U., Durham, NC</a></span> [<a href="http://www.archive.org/search.php?query=creator:%22Grateful Dead%22%20date:1973-07-20*">Listen/Download</a>]<tr><td></td></tr>
<tr class="notes"><td>Venue might have been outdoors.</i></td></tr>
</table></div>
<div class="setlist_table"><table border="0" cellspacing="0" cellpadding="0"><tr class="header"><td><span><a name="0727"></a><a href="/1973-07-27">7/27/1973 Grand Prix Racecourse, Watkins Glen, NY</a></span> [<a href="http://www.archive.org/search.php?query=creator:%22Grateful Dead%22%20date:1973-07-27*">Listen/Download</a>]<tr><td>I: Promised, Sugaree, Mexicali, Bird Song, Big River, Tennessee</td></tr>
<tr><td>II: Helf Step, Me and My Uncle, Jam <span class="setlist_small">*</span>> Wharf Rat, Around</td></tr>
<tr class="notes"><td>Soundcheck for the following day's show. *appears on "So Many Roads (1965-1995)."</i></td></tr>
</table></div>
<div class="setlist_table"><table border="0" cellspacing="0" cellpadding="0"><tr class="header"><td><span><a name="0728"></a><a href="/1973-07-28">7/28/1973 Grand Prix Racecourse, Watkins Glen, NY</a></span> [<a href="http://www.archive.org/search.php?query=creator:%22Grateful Dead%22%20date:1973-07-28*">Listen/Download</a>]<tr><td>I: Bertha, BIODTL, B. E. Women, Mexicali, Box Of Rain, H. C. Sunshine, L. L. Rain, Row Jimmy, Jack Straw, Deal, Playin</td></tr>
<tr><td>II: Around, Loose Lucy, Big River, He's Gone > Truckin > Nobody's Jam > El Paso, China Cat > I Know You Rider, Stella Blue, Eyes > Sugar Magnolia</td></tr>
<tr><td>E1: Sing Me Back Home</td></tr>
<tr><td>E2: NFA<span class="setlist_small">*</span>, Mountain Jam<span class="setlist_small">*</span>, Johnny B. Goode<span class="setlist_small">*</span></td></tr>
<tr class="notes"><td>Next ''Box Of Rain'' 3/20/1986 [777 shows]; Previous ''Mountain Jam'' 11/6/1970 [222 shows]; Final ''Mountain Jam''</i></td></tr>
<tr class="notes"><td>"Summer Jam." Billing: GD; Allman Brothers Band; The Band.*with Allman Brothers and The Band. </i></td></tr>
</table></div>
<div class="setlist_table"><table border="0" cellspacing="0" cellpadding="0"><tr class="header"><td><span><a name="0730"></a><a href="/1973-07-30">7/30/1973 Roosevelt Stadium, Jersey City, NJ</a></span> [<a href="http://www.archive.org/search.php?query=creator:%22Grateful Dead%22%20date:1973-07-30*">Listen/Download</a>]<tr><td></td></tr>
</table></div>
<div class="setlist_table"><table border="0" cellspacing="0" cellpadding="0"><tr class="header"><td><span><a name="0731"></a><a href="/1973-07-31">7/31/1973 Roosevelt Stadium, Jersey City, NJ</a></span> [<a href="http://www.archive.org/search.php?query=creator:%22Grateful Dead%22%20date:1973-07-31*">Listen/Download</a>]<tr><td>I: Ramble On, Me  and  My Uncle, Don't Ease, BIODTL, B. E. Women, Mexicali, Loser, Jack Straw, TLEO, L. L. Rain, Tennessee Jed, El Paso, Row Jimmy, Playin</td></tr>
<tr><td>II: China Cat > I Know You Rider, Promised > Bertha > Greatest, Black Peter, Big River, Loose Lucy, Bobby McGee, Truckin > Jam > GDTRFB > Johnny B. Goode</td></tr>
<tr class="notes"><td>Also: The Band.</i></td></tr>
</table></div>
<div class="setlist_table"><table border="0" cellspacing="0" cellpadding="0"><tr class="header"><td><span><a name="0801"></a><a href="/1973-08-01">8/1/1973 Roosevelt Stadium, Jersey City, NJ</a></span> [<a href="http://www.archive.org/search.php?query=creator:%22Grateful Dead%22%20date:1973-08-01*">Listen/Download</a>]<tr><td>I: Promised, Sugaree, Race Is On, You Ain't Woman Enough, Bird Song, Mexicali, TLEO, Jack Straw, Stella Blue, Big River, Casey Jones</td></tr>
<tr><td>II: Around, Half Step, Me  and  My Uncle, Row Jimmy, Dark Star > El Paso > Eyes > Morning Dew, Sugar Magnolia > GDTRFB > Saturday Night</td></tr>
<tr class="notes"><td>Also: The Band. Jerry Garcia's 31st birthday. </i></td></tr>
</table></div>
<div class="setlist_table"><table border="0" cellspacing="0" cellpadding="0"><tr class="header"><td><span><a name="0804"></a><a href="/1973-08-04">8/4/1973 Record Plant, Sausalito, CA</a></span> [<a href="http://www.archive.org/search.php?query=creator:%22Grateful Dead%22%20date:1973-08-04*">Listen/Download</a>]<tr><td>WRS Prelude <span class="setlist_small">*</span>> WRS Part 1 <span class="setlist_small">*</span>> Let It Grow <span class="setlist_small">*</span>, Pride of Cucamonga <span class="setlist_small">+</span></td></tr>
<tr class="notes"><td>Studio session for "Wake of the Flood." *appears as a "Wake of the Flood" bonus track on "Beyond Description (1973-1989)." +appears as a "Mars Hotel" bonus track in "Beyond Description (1973-1989)." In addition, outtakes of most of this album's songs circulate, all of which date from August of 1973.</i></td></tr>
</table></div>
<div class="setlist_table"><table border="0" cellspacing="0" cellpadding="0"><tr class="header"><td><span><a name="0807"></a><a href="/1973-08-07">8/7/1973 Record Plant, Sausalito, CA</a></span> [<a href="http://www.archive.org/search.php?query=creator:%22Grateful Dead%22%20date:1973-08-07*">Listen/Download</a>]<tr><td>Loose Lucy <span class="setlist_small">*</span></td></tr>
<tr class="notes"><td>Studio session for "Wake of the Flood." *appears as a "Mars Hotel" bonus track on "Beyond description (1973-1989)."</i></td></tr>
</table></div>
<div class="setlist_table"><table border="0" cellspacing="0" cellpadding="0"><tr class="header"><td><span><a name="0808"></a><a href="/1973-08-08">8/8/1973 Record Plant, Sausalito, CA</a></span> [<a href="http://www.archive.org/search.php?query=creator:%22Grateful Dead%22%20date:1973-08-08*">Listen/Download</a>]<tr><td>China Doll <span class="setlist_small">*</span></td></tr>
<tr class="notes"><td>Studio session for "Wake of the Flood." *appears as a "Wake of the Flood" bonus track on "Beyond description (1973-1989)."</i></td></tr>
</table></div>
<div class="setlist_table"><table border="0" cellspacing="0" cellpadding="0"><tr class="header"><td><span><a name="0811"></a><a href="/1973-08-11">8/11/1973 Record Plant, Sausalito, CA</a></span> [<a href="http://www.archive.org/search.php?query=creator:%22Grateful Dead%22%20date:1973-08-11*">Listen/Download</a>]<tr><td>Unbroken Chain <span class="setlist_small">*</span></td></tr>
<tr class="notes"><td>Studio session for "Wake of the Flood." *appears as a "Mars Hotel" bonus track in "Beyond Description (1973-1989)."</i></td></tr>
</table></div>
<div class="setlist_table"><table border="0" cellspacing="0" cellpadding="0"><tr class="header"><td><span><a name="0907"></a><a href="/1973-09-07">9/7/1973 Nassau Veterans Memorial Coliseum, Uniondale, NY</a></span> [<a href="http://www.archive.org/search.php?query=creator:%22Grateful Dead%22%20date:1973-09-07*">Listen/Download</a>]<tr><td>I: Promised, Sugaree, Mexicali, TLEO, Jack Straw, Row Jimmy, L. L. Rain, Deal, El Paso, Bird Song, Playin</td></tr>
<tr><td>II: H. C. Sunshine, Me  and  My Uncle, Loser, Let It Grow > Stella Blue, Truckin > Drums > Other One Jam > Eyes <span class="setlist_small">*</span> > Sugar Magnolia</td></tr>
<tr><td>E: Around</td></tr>
<tr class="notes"><td>First ''Let It Grow''</i></td></tr>
<tr class="notes"><td>"Beer Barrel Polka" tuning before "Here Comes Sunshine." *appears as a "Wake of the Flood" bonus track in "Beyond Description (1973-1989)."</i></td></tr>
</table></div>
<div class="setlist_table"><table border="0" cellspacing="0" cellpadding="0"><tr class="header"><td><span><a name="0908"></a><a href="/1973-09-08">9/8/1973 Nassau Veterans Memorial Coliseum, Uniondale, NY</a></span> [<a href="http://www.archive.org/search.php?query=creator:%22Grateful Dead%22%20date:1973-09-08*">Listen/Download</a>]<tr><td>I: Bertha, Me  and  My Uncle, Sugaree, BIODTL, Tennessee Jed, L. L. Rain, B. E. Women, Jack Straw, Row Jimmy, WRS Prelude > WRS Part 1 > Let It Grow, Eyes > China Doll</td></tr>
<tr><td>II: Greatest, Ramble On, Big River, Let Me Sing, China Cat > I Know You Rider, El Paso, He's Gone > Truckin > NFA > GDTRFB > NFA</td></tr>
<tr><td>E: Stella Blue > Saturday Night</td></tr>
<tr class="notes"><td>First ''Let Me Sing''; First ''WRS Part 1''</i></td></tr>
<tr class="notes"><td>"Beer Barrel Polka" tuning before "Eyes of the World."</i></td></tr>
</table></div>
<div class="setlist_table"><table border="0" cellspacing="0" cellpadding="0"><tr class="header"><td><span><a name="0911"></a><a href="/1973-09-11">9/11/1973 College Of William and Mary, Williamsburg, VA</a></span> [<a href="http://www.archive.org/search.php?query=creator:%22Grateful Dead%22%20date:1973-09-11*">Listen/Download</a>]<tr><td>I: Promised, Sugaree, Race Is On, Loser, L. L. Rain, Tennessee Jed, Jack Straw, China Cat > I Know You Rider, El Paso, Half Step, Playin</td></tr>
<tr><td>II: Let Me Sing<span class="setlist_small">*</span>, WRS Prelude > WRS Part 1 > Let It Grow<span class="setlist_small">*</span>, Row Jimmy, Big River, Deal, BIODTL, Dark Star > Morning Dew, Sugar Magnolia</td></tr>
<tr class="notes"><td>Doug Sahm opened. *with Martin Fierro and Joe Ellis on horns. Mickey Hart's 30th birthday.</i></td></tr>
</table></div>
<div class="setlist_table"><table border="0" cellspacing="0" cellpadding="0"><tr class="header"><td><span><a name="0912"></a><a href="/1973-09-12">9/12/1973 College Of William and Mary, Williamsburg, VA</a></span> [<a href="http://www.archive.org/search.php?query=creator:%22Grateful Dead%22%20date:1973-09-12*">Listen/Download</a>]<tr><td>I: Bertha, Mexicali, B. E. Women, El Paso, Don't Ease, L. L. Rain</td></tr>
<tr><td>II: Ramble On, Me and My Uncle, Bird Song, Jack Straw, Loose Lucy, Big River, Row Jimmy, Let Me Sing <span class="setlist_small">*</span>, WRS Prelude > WRS Part 1 > Let It Grow <span class="setlist_small">*</span></td></tr>
<tr><td>III: Around, Eyes<span class="setlist_small">*</span> > Stella Blue, BIODTL, Casey Jones</td></tr>
<tr><td>E: Saturday Night</td></tr>
<tr class="notes"><td>Doug Sahm opened. *with Martin Fierro and Joe Ellis on horns. Equipment break after "L. L. Rain." "Beer Barrel Polka" tuning before "Ramble On Rose."  </i></td></tr>
</table></div>
<div class="setlist_table"><table border="0" cellspacing="0" cellpadding="0"><tr class="header"><td><span><a name="0914"></a><a href="/1973-09-14">9/14/1973 Providence Civic Center, Providence, RI</a></span> [<a href="http://www.archive.org/search.php?query=creator:%22Grateful Dead%22%20date:1973-09-14*">Listen/Download</a>]<tr><td></td></tr>
<tr class="notes"><td>Show cancelled due to Lesh's illness.</i></td></tr>
</table></div>
<div class="setlist_table"><table border="0" cellspacing="0" cellpadding="0"><tr class="header"><td><span><a name="0915"></a><a href="/1973-09-15">9/15/1973 Providence Civic Center, Providence, RI</a></span> [<a href="http://www.archive.org/search.php?query=creator:%22Grateful Dead%22%20date:1973-09-15*">Listen/Download</a>]<tr><td>I: BIODTL, Sugaree, Greatest, B. E. Women, Me  and  My Uncle, Ramble On, L. L. Rain, Deal, Jack Straw, Tennessee Jed, El Paso, Bird Song, Playin</td></tr>
<tr><td>II: Half Step, Big River, Row Jimmy, Truckin<span class="setlist_small">*</span> > Drums > Eyes<span class="setlist_small">*</span>, Let Me Sing<span class="setlist_small">*</span>, WRS Prelude > WRS Part 1 > Let It Grow<span class="setlist_small">*</span> > Space <span class="setlist_small">*</span>> Stella Blue, Sugar Magnolia<span class="setlist_small">*</span></td></tr>
<tr><td>E: Saturday Night<span class="setlist_small">*</span></td></tr>
<tr class="notes"><td>Next ''Bird Song'' 9/25/1980 [382 shows]</i></td></tr>
<tr class="notes"><td>Doug Sahm opened. *with Martin Fierro and Joe Ellis on horns.</i></td></tr>
</table></div>
<div class="setlist_table"><table border="0" cellspacing="0" cellpadding="0"><tr class="header"><td><span><a name="0917"></a><a href="/1973-09-17">9/17/1973 Onondaga County War Memorial, Syracuse, NY</a></span> [<a href="http://www.archive.org/search.php?query=creator:%22Grateful Dead%22%20date:1973-09-17*">Listen/Download</a>]<tr><td>I: Tennessee Jed, Me  and  My Uncle, TLEO, BIODTL, Sugaree, Mexicali, Loser, L. L. Rain, Row Jimmy, Jack Straw, Loose Lucy, You Ain't Woman Enough, El Paso, Casey Jones</td></tr>
<tr><td>II: Half Step, Let Me Sing<span class="setlist_small">*</span>, Truckin <span class="setlist_small">*</span> > Eyes<span class="setlist_small">*</span> > WRS Prelude > WRS Part 1 > Let It Grow<span class="setlist_small">*</span> > Stella Blue, Sugar Magnolia <span class="setlist_small">*</span></td></tr>
<tr class="notes"><td>Doug Sahm opened. *with Martin Fierro and Joe Ellis on horns.</i></td></tr>
</table></div>
<div class="setlist_table"><table border="0" cellspacing="0" cellpadding="0"><tr class="header"><td><span><a name="0918"></a><a href="/1973-09-18">9/18/1973 Onondaga County War Memorial, Syracuse, NY</a></span> [<a href="http://www.archive.org/search.php?query=creator:%22Grateful Dead%22%20date:1973-09-18*">Listen/Download</a>]<tr><td></td></tr>
</table></div>
<div class="setlist_table"><table border="0" cellspacing="0" cellpadding="0"><tr class="header"><td><span><a name="0920"></a><a href="/1973-09-20">9/20/1973 The Spectrum, Philadelphia, PA</a></span> [<a href="http://www.archive.org/search.php?query=creator:%22Grateful Dead%22%20date:1973-09-20*">Listen/Download</a>]<tr><td>I: Promised, Tennessee Jed, Mexicali, TLEO, L. L. Rain, Loser, BIODTL, China Cat > I Know You Rider, El Paso, Row Jimmy, Greatest > Deal, Around</td></tr>
<tr><td>II: Truckin <span class="setlist_small">*</span> > Nobody's Jam <span class="setlist_small">*</span>  > Eyes<span class="setlist_small">*</span> > Stella Blue, Sugar Magnolia <span class="setlist_small">*</span></td></tr>
<tr class="notes"><td>Doug Sahm opened. *with Mart?n Fierro and Joe Ellis on horns.</i></td></tr>
</table></div>
<div class="setlist_table"><table border="0" cellspacing="0" cellpadding="0"><tr class="header"><td><span><a name="0921"></a><a href="/1973-09-21">9/21/1973 The Spectrum, Philadelphia, PA</a></span> [<a href="http://www.archive.org/search.php?query=creator:%22Grateful Dead%22%20date:1973-09-21*">Listen/Download</a>]<tr><td>I: Big RxR Blues, Me  and  My Uncle, B. E. Women, BIODTL, Sugaree, Big River, H. C. Sunshine, El Paso, Loose Lucy, Jack Straw, Black Peter, Playin</td></tr>
<tr><td>II: Let Me Sing <span class="setlist_small">*</span>, WRS Prelude > WRS Part 1 > Let It Grow<span class="setlist_small">*</span>, He's Gone > Truckin > Other One > Wharf Rat > Row Jimmy, Saturday Night <span class="setlist_small">*</span></td></tr>
<tr><td>E: Casey Jones</td></tr>
<tr class="notes"><td>Next ''Black Peter'' 8/6/1974 [57 shows]; Final ''Let Me Sing''</i></td></tr>
<tr class="notes"><td>Doug Sahm opened. *with Martin Fierro and Joe Ellis on horns. "Hideaway" tuning before "Playing in the Band." </i></td></tr>
</table></div>
<div class="setlist_table"><table border="0" cellspacing="0" cellpadding="0"><tr class="header"><td><span><a name="0924"></a><a href="/1973-09-24">9/24/1973 Pittsburgh Civic Arena, Pittsburgh, PA</a></span> [<a href="http://www.archive.org/search.php?query=creator:%22Grateful Dead%22%20date:1973-09-24*">Listen/Download</a>]<tr><td>I: Promised, Sugaree, Jack Straw, TLEO, Mexicali, Loose Lucy, L. L. Rain, Row Jimmy, Big River, China Cat > I Know You Rider, Around</td></tr>
<tr><td>II: Ramble On, El Paso, Half Step, Greatest, China Doll, Truckin <span class="setlist_small">*</span> > Nobody's Fault <span class="setlist_small">*</span> > Eyes<span class="setlist_small">*</span> > WRS Prelude > WRS Part 1 > Let It Grow<span class="setlist_small">*</span>, Sugar Magnolia <span class="setlist_small">*</span></td></tr>
<tr class="notes"><td>Previous ''Nobody's Fault'' 7/17/1966 [796 shows]</i></td></tr>
<tr class="notes"><td>Doug Sahm opened. *with Martin Fierro and Joe Ellis on horns. "Merry-Go-Round Broke Down" tuning before "Greatest."</i></td></tr>
</table></div>
<div class="setlist_table"><table border="0" cellspacing="0" cellpadding="0"><tr class="header"><td><span><a name="0926"></a><a href="/1973-09-26">9/26/1973 War Memorial Auditorium, Buffalo, NY</a></span> [<a href="http://www.archive.org/search.php?query=creator:%22Grateful Dead%22%20date:1973-09-26*">Listen/Download</a>]<tr><td>I: H. C. Sunshine, BIODTL, Deal, L. L. Rain, Tennessee Jed, Mexicali, Loser, Big River, B. E. Women, Race Is On, Row Jimmy, El Paso, China Cat > I Know You Rider, Around</td></tr>
<tr><td>II: Playin, Sing Me Back Home, Me  and  My Uncle, He's Gone > Truckin <span class="setlist_small">*</span> > Eyes<span class="setlist_small">*</span> > WRS Prelude > WRS Part 1 > Let It Grow<span class="setlist_small">*</span>, Sugar Magnolia<span class="setlist_small">*</span></td></tr>
<tr><td>E: Saturday Night<span class="setlist_small">*</span></td></tr>
<tr class="notes"><td>Final ''Sing Me Back Home''</i></td></tr>
<tr class="notes"><td>Doug Sahm opened. *with Martin Fierro and Joe Ellis on horns.</i></td></tr>
</table></div>
<div class="setlist_table"><table border="0" cellspacing="0" cellpadding="0"><tr class="header"><td><span><a name="1017"></a><a href="/1973-10-17">10/17/1973 Tarrant County Convention Center, Fort Worth, TX</a></span> [<a href="http://www.archive.org/search.php?query=creator:%22Grateful Dead%22%20date:1973-10-17*">Listen/Download</a>]<tr><td></td></tr>
<tr class="notes"><td>A flier exists for this show with Doug Sahm opening, which was subsequently cancelled. And it may be appropriate here to point out that some unknown but clever individual years ago made a compilation of first-set tunes from various 1973 shows and labeled it "Grateful Dead: Lima, Peru." Some fans who acquired this recording thought that this actually meant "Lima, Ohio," and attributed it to the October 1973 tour.  </i></td></tr>
</table></div>
<div class="setlist_table"><table border="0" cellspacing="0" cellpadding="0"><tr class="header"><td><span><a name="1019"></a><a href="/1973-10-19">10/19/1973 Oklahoma City Fairgrounds Arena, Oklahoma City, OK</a></span> [<a href="http://www.archive.org/search.php?query=creator:%22Grateful Dead%22%20date:1973-10-19*">Listen/Download</a>]<tr><td>I: Promised, Sugaree, Mexicali, Tennessee Jed, L. L. Rain, Don't Ease, Jack Straw, TLEO, El Paso, Row Jimmy, Playin</td></tr>
<tr><td>II: China Cat > I Know You Rider, Me  and  My Uncle, Half Step, Big River, Dark Star > Mind Left Body Jam > Morning Dew, Sugar Magnolia</td></tr>
<tr><td>E1: Eyes > Stella Blue</td></tr>
<tr><td>E2: Johnny B. Goode</td></tr>
<tr class="notes"><td>Previous ''Mind Left Body Jam'' 9/21/1972 [79 shows]</i></td></tr>
<tr class="notes"><td>Entire show released as "Dick’s Picks Volume 19."</i></td></tr>
</table></div>
<div class="setlist_table"><table border="0" cellspacing="0" cellpadding="0"><tr class="header"><td><span><a name="1021"></a><a href="/1973-10-21">10/21/1973 Omaha Civic Auditorium, Omaha, NE</a></span> [<a href="http://www.archive.org/search.php?query=creator:%22Grateful Dead%22%20date:1973-10-21*">Listen/Download</a>]<tr><td>I: H. C. Sunshine, BIODTL, Loser, B. T. Wind, TLEO, Cumberland, El Paso, You Ain't Woman Enough, WRS Prelude > WRS Part 1 > Let It Grow</td></tr>
<tr><td>II: Playin > Half Step > Big River > Playin, He's Gone > Truckin > Wharf Rat > Sugar Magnolia > GDTRFB > Saturday Night</td></tr>
<tr class="notes"><td>Final ''You Ain't Woman Enough''</i></td></tr>
</table></div>
<div class="setlist_table"><table border="0" cellspacing="0" cellpadding="0"><tr class="header"><td><span><a name="1023"></a><a href="/1973-10-23">10/23/1973 Metropolitan Sports Center, Bloomington, MN</a></span> [<a href="http://www.archive.org/search.php?query=creator:%22Grateful Dead%22%20date:1973-10-23*">Listen/Download</a>]<tr><td>I: Promised, Sugaree, B. T. Wind, Loose Lucy, Mexicali, China Cat > I Know You Rider, BIODTL, B. E. Women, Bobby McGee, Row Jimmy, Jack Straw, Ramble On, Big River</td></tr>
<tr><td>II: Truckin > Nobody’s Jam > Other One > Drums > Jam > WRS Prelude > WRS Part 1 > Let It Grow > Sugar Magnolia</td></tr>
<tr><td>E1: Casey Jones</td></tr>
<tr><td>E2: Saturday Night</td></tr>
<tr class="notes"><td>Soundcheck: "Wang Dang Doodle."</i></td></tr>
</table></div>
<div class="setlist_table"><table border="0" cellspacing="0" cellpadding="0"><tr class="header"><td><span><a name="1025"></a><a href="/1973-10-25">10/25/1973 Dane County Coliseum, Madison, WI</a></span> [<a href="http://www.archive.org/search.php?query=creator:%22Grateful Dead%22%20date:1973-10-25*">Listen/Download</a>]<tr><td>I: Bertha, Big River, H. C. Sunshine, B. T. Wind, TLEO, Mexicali, Tennessee Jed, L. L. Rain, Deal, El Paso, Row Jimmy, Playin</td></tr>
<tr><td>II: China Cat > I Know You Rider, Me  and  My Uncle, Dark Star > Mind Left Body Jam > Dark Star > Eyes > Stella Blue, WRS Prelude > WRS Part 1 > Let It Grow > GDTRFB > Saturday Night</td></tr>
<tr><td>E: Uncle John</td></tr>
</table></div>
<div class="setlist_table"><table border="0" cellspacing="0" cellpadding="0"><tr class="header"><td><span><a name="1027"></a><a href="/1973-10-27">10/27/1973 State Fair Coliseum, Indianapolis, IN</a></span> [<a href="http://www.archive.org/search.php?query=creator:%22Grateful Dead%22%20date:1973-10-27*">Listen/Download</a>]<tr><td>I: Promised, Sugaree, Mexicali, Loser, B. T. Wind, TLEO, Jack Straw, Ramble On, El Paso, B. E. Women, Greatest, Loose Lucy, BIODTL, China Cat > I Know You Rider</td></tr>
<tr><td>II: Me  and  My Uncle > Bertha, Bobby McGee, Tennessee Jed, Playin > Half Step > Big River > Playin, He's Gone > Truckin > Nobody's Jam > Wharf Rat > Stella Blue, Sugar Magnolia</td></tr>
<tr><td>E: Uncle John</td></tr>
</table></div>
<div class="setlist_table"><table border="0" cellspacing="0" cellpadding="0"><tr class="header"><td><span><a name="1029"></a><a href="/1973-10-29">10/29/1973 Kiel Auditorium, St. Louis, MO</a></span> [<a href="http://www.archive.org/search.php?query=creator:%22Grateful Dead%22%20date:1973-10-29*">Listen/Download</a>]<tr><td>I: Cold Rain, BIODTL, B. E. Women, Mexicali, Don't Ease, B. T. Wind, Tennessee Jed, Race Is On, Row Jimmy, El Paso, Eyes > China Doll, Around</td></tr>
<tr><td>II: Promised > Bertha > Greatest, Loser, Big River, Brokedown, Truckin > Drums > Other One > Wharf Rat, Sugar Magnolia</td></tr>
<tr><td>E: Casey Jones</td></tr>
</table></div>
<div class="setlist_table"><table border="0" cellspacing="0" cellpadding="0"><tr class="header"><td><span><a name="1030"></a><a href="/1973-10-30">10/30/1973 Kiel Auditorium, St. Louis, MO</a></span> [<a href="http://www.archive.org/search.php?query=creator:%22Grateful Dead%22%20date:1973-10-30*">Listen/Download</a>]<tr><td>I: H. C. Sunshine, Me  and  My Uncle, Ramble On, L. L. Rain, Deal, Mexicali, TLEO, El Paso, Row Jimmy, Jack Straw, China Cat > I Know You Rider, Playin</td></tr>
<tr><td>II: Half Step, Big River, Dark Star > Stella Blue > Eyes > WRS Prelude > WRS Part 1 > Let It Grow, GDTRFB > Johnny B. Goode</td></tr>
<tr><td>E: Saturday Night</td></tr>
</table></div>
<div class="setlist_table"><table border="0" cellspacing="0" cellpadding="0"><tr class="header"><td><span><a name="1101"></a><a href="/1973-11-01">11/1/1973 McGaw Memorial Hall, Northwestern U., Evanston, IL</a></span> [<a href="http://www.archive.org/search.php?query=creator:%22Grateful Dead%22%20date:1973-11-01*">Listen/Download</a>]<tr><td>I: Promised, Sugaree, Bobby McGee, B. E. Women, B. T. Wind, China Cat > I Know You Rider, Mexicali, Brokedown, BIODTL, Loose Lucy, El Paso, TLEO, WRS Prelude > WRS Part 1 > Let It Grow</td></tr>
<tr><td>II: Morning Dew > Playin > Uncle John > Playin, Half Step > He's Gone > Truckin > Jam > Wharf Rat, Sugar Magnolia</td></tr>
</table></div>
<div class="setlist_table"><table border="0" cellspacing="0" cellpadding="0"><tr class="header"><td><span><a name="1109"></a><a href="/1973-11-09">11/9/1973 Winterland Arena, San Francisco, CA</a></span> [<a href="http://www.archive.org/search.php?query=creator:%22Grateful Dead%22%20date:1973-11-09*">Listen/Download</a>]<tr><td>I: Promised Land, B. E. Women, Bobby McGee, TLEO, B. T. Wind, Don’t Ease, Mexicali, Row Jimmy, Race is On, China Cat > I Know You Rider, Playin</td></tr>
<tr><td>II: H. C. Sunshine, Me and My Uncle, To Lay Me Down, Big River, Half Step, Greatest > Bertha, WRS Prelude > WRS Part 1 > Let It Grow > Eyes > China Doll, Around, GDTRFB > Johnny B. Goode</td></tr>
<tr><td>E: Uncle John</td></tr>
<tr class="notes"><td>Previous ''To Lay Me Down'' 9/20/1970 [262 shows]</i></td></tr>
<tr class="notes"><td>Entire show except encore appears on "Winterland 1973: The Complete Recordings."</i></td></tr>
</table></div>
<div class="setlist_table"><table border="0" cellspacing="0" cellpadding="0"><tr class="header"><td><span><a name="1110"></a><a href="/1973-11-10">11/10/1973 Winterland Arena, San Francisco, CA</a></span> [<a href="http://www.archive.org/search.php?query=creator:%22Grateful Dead%22%20date:1973-11-10*">Listen/Download</a>]<tr><td>I: Bertha, Jack Straw, Loser, L. L. Rain, Deal, Mexicali, Tennessee Jed, El Paso, Brokedown, BIODTL, Row Jimmy, WRS Prelude > WRS Part 1 > Let It Grow</td></tr>
<tr><td>II: Playin > Uncle John > Morning Dew > Uncle John > Playin, Big River, Stella Blue, Truckin > Nobody's Jam > Wharf Rat > Sugar Magnolia</td></tr>
<tr><td>E1: Saturday Night</td></tr>
<tr><td>E2: Casey Jones</td></tr>
<tr class="notes"><td>"Tico Tico" tuning before "Playin." Entire show appears on "Winterland 1973: The Complete Recordings." </i></td></tr>
</table></div>
<div class="setlist_table"><table border="0" cellspacing="0" cellpadding="0"><tr class="header"><td><span><a name="1111"></a><a href="/1973-11-11">11/11/1973 Winterland Arena, San Francisco, CA</a></span> [<a href="http://www.archive.org/search.php?query=creator:%22Grateful Dead%22%20date:1973-11-11*">Listen/Download</a>]<tr><td>I: Promised > Bertha > Greatest, Sugaree, B. T. Wind, To Lay Me Down, El Paso, Ramble On, Bobby McGee, China Cat > I Know You Rider, Me  and  My Uncle, Loose Lucy, WRS Prelude > WRS Part 1 > Let It Grow</td></tr>
<tr><td>II: Half Step, Big River, Dark Star > Mind Left Body Jam > Eyes > China Doll, Sugar Magnolia</td></tr>
<tr><td>E1: Uncle John</td></tr>
<tr><td>E2: Johnny B. Goode > We Bid You Goodnight</td></tr>
<tr class="notes"><td>Entire show appears on "Winterland 1973: The Complete Recordings."</i></td></tr>
</table></div>
<div class="setlist_table"><table border="0" cellspacing="0" cellpadding="0"><tr class="header"><td><span><a name="1114"></a><a href="/1973-11-14">11/14/1973 San Diego Sports Arena, San Diego, CA</a></span> [<a href="http://www.archive.org/search.php?query=creator:%22Grateful Dead%22%20date:1973-11-14*">Listen/Download</a>]<tr><td>I: Big RxR Blues, Jack Straw, Sugaree, Mexicali, H. C. Sunshine, B. T. Wind, Cumberland, Row Jimmy, Race Is On, B. E. Women, BIODTL, Tennessee Jed, El Paso, China Cat > I Know You Rider, Around</td></tr>
<tr><td>II: Truckin > Other One > Big River > Other One > Eyes > Other One > Wharf Rat, Me  and  My Uncle, GDTRFB > Saturday Night</td></tr>
</table></div>
<div class="setlist_table"><table border="0" cellspacing="0" cellpadding="0"><tr class="header"><td><span><a name="1117"></a><a href="/1973-11-17">11/17/1973 Pauley Pavilion, U.C.L.A., Los Angeles, CA</a></span> [<a href="http://www.archive.org/search.php?query=creator:%22Grateful Dead%22%20date:1973-11-17*">Listen/Download</a>]<tr><td>I: Me  and  My Uncle, H. C. Sunshine, L. L. Rain, Deal, Mexicali, Tennessee Jed, Race Is On, China Cat > I Know You Rider, Big River, B. E. Women, Around</td></tr>
<tr><td>II: Row Jimmy, Jack Straw, Ramble On, Playin > Uncle John > Morning Dew > Uncle John > Playin, Stella Blue, El Paso, Eyes > Sugar Magnolia</td></tr>
<tr><td>E: Casey Jones</td></tr>
<tr class="notes"><td>Entire show released as "Dave's Pick's Volume 5."</i></td></tr>
</table></div>
<div class="setlist_table"><table border="0" cellspacing="0" cellpadding="0"><tr class="header"><td><span><a name="1120"></a><a href="/1973-11-20">11/20/1973 Denver Coliseum, Denver, CO</a></span> [<a href="http://www.archive.org/search.php?query=creator:%22Grateful Dead%22%20date:1973-11-20*">Listen/Download</a>]<tr><td>I: Ramble On, Mexicali, Don't Ease, B. T. Wind, B. E. Women, BIODTL, To Lay Me Down, Race Is On, TLEO, Bobby McGee, Tennessee Jed, Big River, Row Jimmy, WRS Prelude > WRS Part 1 > Let It Grow, Casey Jones</td></tr>
<tr><td>II: Promised > Bertha > Greatest, Half Step > Dire Wolf, L. L. Rain, China Cat > I Know You Rider, Truckin <span class="setlist_small">*</span> > Drums and Bass <span class="setlist_small">*</span> > Other One <span class="setlist_small">*</span> > Mind Left Body Jam <span class="setlist_small">*</span> > Stella Blue <span class="setlist_small">*</span>, Sugar Magnolia</td></tr>
<tr><td>E: Uncle John</td></tr>
<tr class="notes"><td>Previous ''Dire Wolf'' 10/19/1972 [81 shows]</i></td></tr>
<tr class="notes"><td>*appears on "Road Trips Vol. 4 No. 3."</i></td></tr>
</table></div>
<div class="setlist_table"><table border="0" cellspacing="0" cellpadding="0"><tr class="header"><td><span><a name="1121"></a><a href="/1973-11-21">11/21/1973 Denver Coliseum, Denver, CO</a></span> [<a href="http://www.archive.org/search.php?query=creator:%22Grateful Dead%22%20date:1973-11-21*">Listen/Download</a>]<tr><td>I: Me  and  My Uncle, Sugaree, Jack Straw, Dire Wolf, B. T. Wind, Big RxR Blues, Mexicali, TLEO, L. L. Rain, H. C. Sunshine, Big River, Brokedown, WRS Prelude > WRS Part 1 > Let It Grow</td></tr>
<tr><td>II: Half Step > Playin > El Paso > Playin > Wharf Rat > Playin > Morning Dew, Truckin > Nobody's Fault > GDTRFB > Saturday Night</td></tr>
<tr><td>E: Uncle John</td></tr>
<tr class="notes"><td>Entire show appears on "Road Trips Vol. 4 No. 3." Some consider the long intro to "Wharf Rat" a "Dark Star Jam"; it could be taken either way but the "Dark Star" theme is never stated. </i></td></tr>
</table></div>
<div class="setlist_table"><table border="0" cellspacing="0" cellpadding="0"><tr class="header"><td><span><a name="1123"></a><a href="/1973-11-23">11/23/1973 County Coliseum, El Paso, TX</a></span> [<a href="http://www.archive.org/search.php?query=creator:%22Grateful Dead%22%20date:1973-11-23*">Listen/Download</a>]<tr><td>I: Bertha, Mexicali, Deal, L. L. Rain, Don't Ease, Race Is On, Loser, Jack Straw, China Cat > I Know You Rider, El Paso, Tennessee Jed, Big River, Row Jimmy, WRS Prelude > WRS Part 1 > Let It Grow</td></tr>
<tr><td>II: Greatest, Sugaree, Me  and  My Uncle, He's Gone > Truckin > Other One > Bobby McGee, Eyes, Around > GDTRFB > Casey Jones</td></tr>
<tr><td>E: Johnny B. Goode</td></tr>
</table></div>
<div class="setlist_table"><table border="0" cellspacing="0" cellpadding="0"><tr class="header"><td><span><a name="1125"></a><a href="/1973-11-25">11/25/1973 Feyline Field, Tempe, AZ</a></span> [<a href="http://www.archive.org/search.php?query=creator:%22Grateful Dead%22%20date:1973-11-25*">Listen/Download</a>]<tr><td>I: Promised, Sugaree, BIODTL, Don't Ease, B. T. Wind, Tennessee Jed, Mexicali, China Cat > I Know You Rider, Big River, Row Jimmy, Me  and  My Uncle, B. E. Women, Playin</td></tr>
<tr><td>II: Around, Eyes > WRS Prelude > WRS Part 1 > Let It Grow, Casey Jones, Sugar Magnolia > GDTRFB > Saturday Night</td></tr>
<tr><td>E: We Bid You Goodnight</td></tr>
</table></div>
<div class="setlist_table"><table border="0" cellspacing="0" cellpadding="0"><tr class="header"><td><span><a name="1130"></a><a href="/1973-11-30">11/30/1973 Boston Music Hall, Boston, MA</a></span> [<a href="http://www.archive.org/search.php?query=creator:%22Grateful Dead%22%20date:1973-11-30*">Listen/Download</a>]<tr><td>I: Morning Dew<span class="setlist_small">*</span>, Mexicali<span class="setlist_small">*</span>, Dire Wolf<span class="setlist_small">*</span>, BIODTL, B. E. Women, B. T. Wind<span class="setlist_small">*</span>, Don't Ease<span class="setlist_small">*</span>, El Paso, TLEO<span class="setlist_small">*</span>, Big River<span class="setlist_small">*</span>, Loser, Playin<span class="setlist_small">*</span></td></tr>
<tr><td>II: Bertha > Promised, Row Jimmy, Jack Straw, H. C. Sunshine<span class="setlist_small">*</span>, WRS Prelude<span class="setlist_small">*</span> > WRS Part 1<span class="setlist_small">*</span> > Let It Grow<span class="setlist_small">*</span> > Dark Star Jam<span class="setlist_small">*</span> > Eyes<span class="setlist_small">*</span> > Sugar Magnolia<span class="setlist_small">*</span></td></tr>
<tr class="notes"><td>*appears on "Dick's Picks Vol 14"</i></td></tr>
</table></div>
<div class="setlist_table"><table border="0" cellspacing="0" cellpadding="0"><tr class="header"><td><span><a name="1201"></a><a href="/1973-12-01">12/1/1973 Boston Music Hall, Boston, MA</a></span> [<a href="http://www.archive.org/search.php?query=creator:%22Grateful Dead%22%20date:1973-12-01*">Listen/Download</a>]<tr><td>I: Promised, Sugaree, Mexicali, Tennessee Jed, L. L. Rain, China Cat > I Know You Rider, Big River, Brokedown, WRS Prelude > WRS Part 1 > Let It Grow, Casey Jones</td></tr>
<tr><td>II: Around, TLEO, Me  and  My Uncle, Don't Ease, Bobby McGee, Half Step > Playin > Uncle John > Playin, Row Jimmy, Greatest, NFA > GDTRFB > Saturday Night</td></tr>
</table></div>
<div class="setlist_table"><table border="0" cellspacing="0" cellpadding="0"><tr class="header"><td><span><a name="1202"></a><a href="/1973-12-02">12/2/1973 Boston Music Hall, Boston, MA</a></span> [<a href="http://www.archive.org/search.php?query=creator:%22Grateful Dead%22%20date:1973-12-02*">Listen/Download</a>]<tr><td>I: Cold Rain<span class="setlist_small">*</span>, BIODTL<span class="setlist_small">*</span>, Dire Wolf, Race Is On, B. E. Women<span class="setlist_small">*</span>, Jack Straw<span class="setlist_small">*</span>, Ramble On<span class="setlist_small">*</span>, El Paso, Row Jimmy, Big River, Deal, WRS Prelude<span class="setlist_small">*</span> > WRS Part 1<span class="setlist_small">*</span> > Let It Grow<span class="setlist_small">*</span></td></tr>
<tr><td>II: Wharf Rat<span class="setlist_small">*</span> > Half Step<span class="setlist_small">*</span> > Playin<span class="setlist_small">*</span> > Mind Left Body Jam<span class="setlist_small">*</span> > He's Gone<span class="setlist_small">*</span> > Truckin<span class="setlist_small">*</span> > Stella Blue<span class="setlist_small">*</span>, Sugar Magnolia</td></tr>
<tr><td>E: Morning Dew<span class="setlist_small">*</span></td></tr>
<tr class="notes"><td>*appears on "Dick's Picks Vol 14." "Merry-Go-Round Broke Down"  and  "Beer Barrel Polka" tunings before "Jack Straw."</i></td></tr>
</table></div>
<div class="setlist_table"><table border="0" cellspacing="0" cellpadding="0"><tr class="header"><td><span><a name="1204"></a><a href="/1973-12-04">12/4/1973 Cincinnati Gardens, Cincinnati, OH</a></span> [<a href="http://www.archive.org/search.php?query=creator:%22Grateful Dead%22%20date:1973-12-04*">Listen/Download</a>]<tr><td>I: Johnny B. Goode, Sugaree, Me  and  My Uncle, China Cat <span class="setlist_small">*</span> > I Know You Rider <span class="setlist_small">*</span>, El Paso, Deal, Big River, Tennessee Jed, Truckin <span class="setlist_small">*</span> > Stella Blue <span class="setlist_small">*</span>, Around</td></tr>
<tr><td>II: Eyes <span class="setlist_small">*</span> > Sugar Magnolia <span class="setlist_small">*</span> > GDTRFB <span class="setlist_small">*</span> > Casey Jones <span class="setlist_small">*</span></td></tr>
<tr><td>E: Saturday Night</td></tr>
<tr class="notes"><td>*appears on the "Winterland 1973:The Complete Recordings bonus disc."</i></td></tr>
</table></div>
<div class="setlist_table"><table border="0" cellspacing="0" cellpadding="0"><tr class="header"><td><span><a name="1206"></a><a href="/1973-12-06">12/6/1973 Cleveland Convention Center, Cleveland, OH</a></span> [<a href="http://www.archive.org/search.php?query=creator:%22Grateful Dead%22%20date:1973-12-06*">Listen/Download</a>]<tr><td>I: Bertha, Mexicali, Loser, B. T. Wind, TLEO, BIODTL, Deal, El Paso, Row Jimmy, Greatest <span class="setlist_small">*</span>, China Cat <span class="setlist_small">*</span> > I Know You Rider <span class="setlist_small">*</span>, Around</td></tr>
<tr><td>II: Ramble On, Me  and  My Uncle, H. C. Sunshine, Big River, Dark Star <span class="setlist_small">*</span> > Eyes <span class="setlist_small">*</span> > Stella Blue, Sugar Magnolia</td></tr>
<tr class="notes"><td>*appears on the "Road Trips 2011" bonus disc.</i></td></tr>
</table></div>
<div class="setlist_table"><table border="0" cellspacing="0" cellpadding="0"><tr class="header"><td><span><a name="1208"></a><a href="/1973-12-08">12/8/1973 Cameron Indoor Stadium, Duke U., Durham, NC</a></span> [<a href="http://www.archive.org/search.php?query=creator:%22Grateful Dead%22%20date:1973-12-08*">Listen/Download</a>]<tr><td>I: Me  and  My Uncle, Sugaree, Mexicali, Dire Wolf, B. T. Wind, TLEO, Bobby McGee, Don't Ease, Race Is On, B. E. Women, Big River, Candyman, WRS Prelude > WRS Part 1 > Let It Grow, China Cat > I Know You Rider</td></tr>
<tr><td>II: Around, Ramble On, El Paso, Row Jimmy, Greatest > Bertha, He's Gone > Truckin > Nobody's Fault > Other One > Wharf Rat > Stella Blue, Johnny B. Goode > Uncle John</td></tr>
<tr><td>E: Saturday Night</td></tr>
<tr class="notes"><td>Previous ''Candyman'' 3/30/1973 [50 shows]</i></td></tr>
<tr class="notes"><td>"Tico Tico" tuning before "Around and Around."</i></td></tr>
</table></div>
<div class="setlist_table"><table border="0" cellspacing="0" cellpadding="0"><tr class="header"><td><span><a name="1210"></a><a href="/1973-12-10">12/10/1973 Charlotte Coliseum, Charlotte, NC</a></span> [<a href="http://www.archive.org/search.php?query=creator:%22Grateful Dead%22%20date:1973-12-10*">Listen/Download</a>]<tr><td>I: Bertha <span class="setlist_small">*</span>, Mexicali <span class="setlist_small">*</span>, Deal <span class="setlist_small">*</span>, Jack Straw, Tennessee Jed, Big River<span class="setlist_small">*</span>, Don't Ease <span class="setlist_small">*</span>, El Paso, B. E. Women, Playin <span class="setlist_small">*</span></td></tr>
<tr><td>II: Promised <span class="setlist_small">*</span>, Peggy-O <span class="setlist_small">*</span>, Me  and  My Uncle, Row Jimmy <span class="setlist_small">*</span>, Bobby McGee <span class="setlist_small">*</span>, Big RxR Blues <span class="setlist_small">*</span>, Truckin <span class="setlist_small">*</span> > Nobody's Fault <span class="setlist_small">*</span> > Eyes <span class="setlist_small">*</span> > Brokedown <span class="setlist_small">*</span>, China Cat <span class="setlist_small">*</span> > I Know You Rider <span class="setlist_small">*</span>, Sugar Magnolia <span class="setlist_small">*</span> > GDTRFB <span class="setlist_small">*</span> > Sunshine Daydream <span class="setlist_small">*</span></td></tr>
<tr><td>E: Casey Jones <span class="setlist_small">*</span></td></tr>
<tr class="notes"><td>First ''Peggy-O''; First ''Sunshine Daydream''</i></td></tr>
<tr class="notes"><td>Full moon. Partial lunar eclipse.First split "Sugar Magnolia." *appears on "Grateful Dead Download Series Volume 8."   </i></td></tr>
</table></div>
<div class="setlist_table"><table border="0" cellspacing="0" cellpadding="0"><tr class="header"><td><span><a name="1212"></a><a href="/1973-12-12">12/12/1973 The Omni, Atlanta, GA</a></span> [<a href="http://www.archive.org/search.php?query=creator:%22Grateful Dead%22%20date:1973-12-12*">Listen/Download</a>]<tr><td>I: Promised, Sugaree, Mexicali, Tennessee Jed, Jack Straw, Don't Ease, L. L. Rain, TLEO, El Paso, Peggy-O, BIODTL, B. E. Women, Big River, Deal, Playin</td></tr>
<tr><td>II: Half Step > Bobby McGee, China Cat > I Know You Rider, Greatest, Row Jimmy, WRS Prelude > WRS Part 1 > Let It Grow, Wharf Rat > Me  and  My Uncle, Eyes > Morning Dew, Sugar Magnolia</td></tr>
<tr><td>E: Casey Jones</td></tr>
<tr class="notes"><td>Soundcheck: "Rip It Up," "Blue Suede Shoes," "Peggy-O," "Jack Straw," "Cumberland," "30 Days." Some circulating recordings of this soundcheck also contain studio recordings of "Unbroken Chain" and "Pride of Cucamonga."</i></td></tr>
</table></div>
<div class="setlist_table"><table border="0" cellspacing="0" cellpadding="0"><tr class="header"><td><span><a name="1218"></a><a href="/1973-12-18">12/18/1973 Curtis Hixon Convention Hall, Tampa, FL</a></span> [<a href="http://www.archive.org/search.php?query=creator:%22Grateful Dead%22%20date:1973-12-18*">Listen/Download</a>]<tr><td>I: Tennessee Jed, Me  and  My Uncle, Don't Ease, L. L. Rain, TLEO, Bobby McGee, B. E. Women, BIODTL > Peggy-O, El Paso, Deal, Jack Straw, China Cat > I Know You Rider</td></tr>
<tr><td>II: Promised > Bertha > Greatest, Row Jimmy, WRS Prelude > WRS Part 1 > Let It Grow > Dark Star > Drums > Eyes > Wharf Rat > Sugar Magnolia</td></tr>
<tr><td>E: Uncle John</td></tr>
</table></div>
<div class="setlist_table"><table border="0" cellspacing="0" cellpadding="0"><tr class="header"><td><span><a name="1219"></a><a href="/1973-12-19">12/19/1973 Curtis Hixon Convention Hall, Tampa, FL</a></span> [<a href="http://www.archive.org/search.php?query=creator:%22Grateful Dead%22%20date:1973-12-19*">Listen/Download</a>]<tr><td>I: Promised, Sugaree, Mexicali, Dire Wolf, B. T. Wind, Candyman, Jack Straw, Big RxR Blues<span class="setlist_small">*</span>, Big River<span class="setlist_small">*</span>, H. C. Sunshine<span class="setlist_small">*</span>, El Paso, Ramble On, Playin<span class="setlist_small">*</span></td></tr>
<tr><td>II: Half Step<span class="setlist_small">*</span> > Bobby McGee, Row Jimmy, WRS Prelude<span class="setlist_small">*</span> > WRS Part 1<span class="setlist_small">*</span> > Let It Grow<span class="setlist_small">*</span>, He's Gone<span class="setlist_small">*</span> > Truckin<span class="setlist_small">*</span> > Nobody's Fault<span class="setlist_small">*</span> > Other One<span class="setlist_small">*</span> > Jam<span class="setlist_small">*</span> > Stella Blue<span class="setlist_small">*</span> > Around<span class="setlist_small">*</span></td></tr>
<tr><td>E: Casey Jones</td></tr>
<tr class="notes"><td>*appears on "Dick's Picks Vol. 1."</i></td></tr>
</table></div>

  </div>
 </div><!--END main-->

</div><!--END container -->
</div><!--END centering div-->
</body>
</html>