<!DOCTYPE HTML PUBLIC "-//W3C//DTD HTML 4.01 Transitional//EN" "http://www.w3.org/TR/html4/loose.dtd">
<html>
<head>
<title>1989 Setlists</title>
</head>
<body>
<div align="center">
<div id="container">
<div id="logbar"><!--START LOGIN-->
You are logged in as Dave R [<a href="">Log Out</a>]<span class="space">|</span><a href="/my">My DeadBase Options and Shows</a><span class="space">|</span>Shows I own are currently highlighted. [<span onmouseover="document.getElementById('highoptions').style.display='block';" onmouseout="document.getElementById('highoptions').style.display='none'; return false;"><a href="#" onclick="return false;">Change</a><div id="highoptions" class="highoptions" style="display:none;">
		<a href="/1989/setlists&highlight=went">Shows I attended</a>
		<a href="/1989/setlists&highlight=own">Shows I own</a>
		<a href="/1989/setlists&highlight=looking">Shows I'm looking for</a>
		<a href="/1989/setlists&highlight=favorite">My favorite shows</a>
	</div></span>] 
</div>

<div><!--START main-->
<div id="mainc"><div id="main">
	<div class="page_title">1989 Setlists</div>

<script language="Javascript" type="text/javascript">
<!--
function showtab () {
document.getElementById('hide').style.display = 'none';
document.getElementById('show').style.display = 'block';
}
function hidetab () {
document.getElementById('show').style.display = 'none';
document.getElementById('hide').style.display = 'block';
}
-->
</script>
<p>February:  <a href="#0205">5</a> <a href="#0206">6</a> <a href="#0207">7</a> <a href="#0210">10</a> <a href="#0211">11</a> <a href="#0212">12</a><br>
March: <a href="#0316">16</a> <a href="#0317">17</a> <a href="#0318">18</a> <a href="#0322">22</a> <a href="#0327">27</a> <a href="#0328">28</a> <a href="#0330">30</a> <a href="#0331">31</a><br>
April: <a href="#0402">2</a> <a href="#0403">3</a> <a href="#0405">5</a> <a href="#0406">6</a> <a href="#0408">8</a> <a href="#0409">9</a> <a href="#0411">11</a> <a href="#0412">12</a> <a href="#0413">13</a> <a href="#0415">15</a> <a href="#0416">16</a> <a href="#0417">17</a> <a href="#0428">28</a> <a href="#0429">29</a> <a href="#0430">30</a><br>
May: <a href="#0506">6</a> <a href="#0507">7</a> <a href="#0527">27</a> <a href="#0527">27</a><br>
June: <a href="#0618">18</a> <a href="#0619">19</a> <a href="#0621">21</a><br>
July: <a href="#0702">2</a> <a href="#0704">4</a> <a href="#0707">7</a> <a href="#0709">9</a> <a href="#0710">10</a> <a href="#0712">12</a> <a href="#0713">13</a> <a href="#0715">15</a> <a href="#0717">17</a> <a href="#0718">18</a> <a href="#0719">19</a><br>
August: <a href="#0804">4</a> <a href="#0805">5</a> <a href="#0806">6</a> <a href="#0817">17</a> <a href="#0818">18</a> <a href="#0819">19</a> <a href="#0820">20</a><br>
September: <a href="#0929">29</a> <a href="#0930">30</a><br>
October: <a href="#1001">1</a> <a href="#1008">8</a> <a href="#1009">9</a> <a href="#1011">11</a> <a href="#1012">12</a> <a href="#1013">13</a> <a href="#1014">14</a> <a href="#1015">15</a> <a href="#1016">16</a> <a href="#1018">18</a> <a href="#1019">19</a> <a href="#1020">20</a> <a href="#1022">22</a> <a href="#1023">23</a> <a href="#1025">25</a> <a href="#1026">26</a><br>
December: <a href="#1206">6</a> <a href="#1208">8</a> <a href="#1209">9</a> <a href="#1210">10</a> <a href="#1227">27</a> <a href="#1228">28</a> <a href="#1230">30</a> <a href="#1231">31</a></p>
<div class="setlist_table"><table border="0" cellspacing="0" cellpadding="0"><tr class="header"><td><span><a name="0205"></a><a href="/1989-02-05">2/5/1989 Henry J. Kaiser Convention Center, Oakland, CA</a></span> [<a href="http://www.archive.org/search.php?query=creator:%22Grateful Dead%22%20date:1989-02-05*">Listen/Download</a>]<tr><td>I: Touch > Stranger > Franklin's > Rooster, Althea, We Can Run, Desolation Row > Don't Ease</td></tr>
<tr><td>II: Cold Rain > Woman Smarter, SOTM > Playin > Drumz > Take You Home > He's Gone > Miracle > Morning Dew</td></tr>
<tr><td>E: Johnny B. Goode</td></tr>
<tr class="notes"><td>First ''SOTM''; First ''We Can Run''</i></td></tr>
<tr class="notes"><td>Soundcheck: "SOTM." "Memphis Blues" tease before "Desolation Row."  </i></td></tr>
</table></div>
<div class="setlist_table"><table border="0" cellspacing="0" cellpadding="0"><tr class="header"><td><span><a name="0206"></a><a href="/1989-02-06">2/6/1989 Henry J. Kaiser Convention Center, Oakland, CA</a></span> [<a href="http://www.archive.org/search.php?query=creator:%22Grateful Dead%22%20date:1989-02-06*">Listen/Download</a>]<tr><td>I: NFA, Sugaree > Wang Dang Doodle, Jack A Roe, Queen Jane, B. E. Women, Cassidy > Tennessee Jed</td></tr>
<tr><td>II: Bucket > Scarlet > L. L. Rain > Terrapin > Drumz > Other One > Stella Blue > Lovelight</td></tr>
<tr><td>E: Black Muddy River</td></tr>
<tr class="notes"><td>The Chinese Symphony Orchestra opened. "Beer Barrel Polka" tuning before "NFA." Dragon dance during Drumz.</i></td></tr>
</table></div>
<div class="setlist_table"><table border="0" cellspacing="0" cellpadding="0"><tr class="header"><td><span><a name="0207"></a><a href="/1989-02-07">2/7/1989 Henry J. Kaiser Convention Center, Oakland, CA</a></span> [<a href="http://www.archive.org/search.php?query=creator:%22Grateful Dead%22%20date:1989-02-07*">Listen/Download</a>]<tr><td>I: Hey Pocky Way, Jack Straw > Loser, Walking Blues, Little Light, SOTM, Memphis Blues, Bird Song</td></tr>
<tr><td>II: Iko Iko, Victim, We Can Run > Uncle John > Drumz > Wheel > Throwing Stones > Foolish Heart > Good Lovin</td></tr>
<tr><td>E: Heaven's Door</td></tr>
<tr class="notes"><td>First ''Little Light''</i></td></tr>
<tr class="notes"><td>Al Rapone and the Zydeco Express opened. False start on "Victim."</i></td></tr>
</table></div>
<div class="setlist_table"><table border="0" cellspacing="0" cellpadding="0"><tr class="header"><td><span><a name="0210"></a><a href="/1989-02-10">2/10/1989 Great Western Forum, Inglewood, CA</a></span> [<a href="http://www.archive.org/search.php?query=creator:%22Grateful Dead%22%20date:1989-02-10*">Listen/Download</a>]<tr><td>I: Stranger > Franklin's > Walking Blues, To Lay Me Down, Masterpiece, FOTD, Let It Grow</td></tr>
<tr><td>II: Little Light<span class="setlist_small">*</span>, Truckin > Crazy Fingers > Playin > Drumz > Wheel > Gimme Some Lovin > Wharf Rat > Sugar Magnolia</td></tr>
<tr><td>E: Baby Blue</td></tr>
<tr class="notes"><td>*without Weir. Venue used to be called "The Forum."</i></td></tr>
</table></div>
<div class="setlist_table"><table border="0" cellspacing="0" cellpadding="0"><tr class="header"><td><span><a name="0211"></a><a href="/1989-02-11">2/11/1989 Great Western Forum, Inglewood, CA</a></span> [<a href="http://www.archive.org/search.php?query=creator:%22Grateful Dead%22%20date:1989-02-11*">Listen/Download</a>]<tr><td>I: Half Step > Minglewood, Candyman, Big River, Built To Last, Queen Jane, We Can Run, Bird Song</td></tr>
<tr><td>II: China Cat > I Know You Rider, Woman Smarter, SOTM, Estimated > Take You Home > Drumz<span class="setlist_small">*</span> > Eyes > Miracle > Black Peter > Lovelight</td></tr>
<tr><td>E: Box Of Rain</td></tr>
<tr class="notes"><td>*with Airto Moreira, Flora Purim and Diana Moreira.</i></td></tr>
</table></div>
<div class="setlist_table"><table border="0" cellspacing="0" cellpadding="0"><tr class="header"><td><span><a name="0212"></a><a href="/1989-02-12">2/12/1989 Great Western Forum, Inglewood, CA</a></span> [<a href="http://www.archive.org/search.php?query=creator:%22Grateful Dead%22%20date:1989-02-12*">Listen/Download</a>]<tr><td>I: Cold Rain, Bucket, Row Jimmy, BIODTL > Promised, West L. A., How Long Blues<span class="setlist_small">*</span>, Gimme Some Lovin<span class="setlist_small">*</span></td></tr>
<tr><td>II: Iko Iko<span class="setlist_small">+</span>, Monkey  and  Engineer<span class="setlist_small">+</span>, Alabama<span class="setlist_small">+</span>, Dire Wolf<span class="setlist_small">+</span>, Cassidy<span class="setlist_small">+</span>, Memphis Blues<span class="setlist_small">+</span> > Drumz<span class="setlist_small">#</span> > Other One > Stella Blue > Foolish Heart</td></tr>
<tr><td>E: NFA<span class="setlist_small">+</span>, Heaven's Door<span class="setlist_small">+</span></td></tr>
<tr class="notes"><td>Next ''BIODTL'' 10/22/1989 [56 shows]; Previous ''How Long Blues'' 8/19/1970 [1234 shows]; Previous ''Monkey  and  Engineer'' 10/16/1981 [495 shows]; Final ''How Long Blues''; Final ''Monkey  and  Engineer''</i></td></tr>
<tr class="notes"><td>*with Spencer Davis.  +with Bob Dylan.  #with Kodo drummer.</i></td></tr>
</table></div>
<div class="setlist_table"><table border="0" cellspacing="0" cellpadding="0"><tr class="header"><td><span><a name="0316"></a><a href="/1989-03-16">3/16/1989 Henry J. Kaiser Convention Center, Oakland, CA</a></span> [<a href="http://www.archive.org/search.php?query=creator:%22Grateful Dead%22%20date:1989-03-16*">Listen/Download</a>]<tr><td></td></tr>
<tr class="notes"><td>Cancelled due to neighborhood opposition.</i></td></tr>
</table></div>
<div class="setlist_table"><table border="0" cellspacing="0" cellpadding="0"><tr class="header"><td><span><a name="0317"></a><a href="/1989-03-17">3/17/1989 Henry J. Kaiser Convention Center, Oakland, CA</a></span> [<a href="http://www.archive.org/search.php?query=creator:%22Grateful Dead%22%20date:1989-03-17*">Listen/Download</a>]<tr><td></td></tr>
<tr class="notes"><td>Cancelled due to neighborhood opposition.</i></td></tr>
</table></div>
<div class="setlist_table"><table border="0" cellspacing="0" cellpadding="0"><tr class="header"><td><span><a name="0318"></a><a href="/1989-03-18">3/18/1989 Henry J. Kaiser Convention Center, Oakland, CA</a></span> [<a href="http://www.archive.org/search.php?query=creator:%22Grateful Dead%22%20date:1989-03-18*">Listen/Download</a>]<tr><td></td></tr>
<tr class="notes"><td>Cancelled due to neighborhood opposition.</i></td></tr>
</table></div>
<div class="setlist_table"><table border="0" cellspacing="0" cellpadding="0"><tr class="header"><td><span><a name="0322"></a><a href="/1989-03-22">3/22/1989 Gift Center, San Francisco, CA</a></span> [<a href="http://www.archive.org/search.php?query=creator:%22Grateful Dead%22%20date:1989-03-22*">Listen/Download</a>]<tr><td>Deep Elem <span class="setlist_small">@</span>, Wang Dang Doodle <span class="setlist_small">@</span>, Wind & Rain <span class="setlist_small">@</span>, Masterpiece <span class="setlist_small">@</span>, Bird Song <span class="setlist_small">@</span>, Easy To Slip <span class="setlist_small">@</span></td></tr>
<tr class="notes"><td>Benefit for Artist Rights Today. Garcia, Weir & Kahn. Also: Country Joe McDonald with Garcia, Dinosaurs, Nick Gravenites & Animal Mind. </i></td></tr>
</table></div>
<div class="setlist_table"><table border="0" cellspacing="0" cellpadding="0"><tr class="header"><td><span><a name="0327"></a><a href="/1989-03-27">3/27/1989 The Omni, Atlanta, GA</a></span> [<a href="http://www.archive.org/search.php?query=creator:%22Grateful Dead%22%20date:1989-03-27*">Listen/Download</a>]<tr><td>I: Half Step > Walking Blues, Built To Last, We Can Run, Queen Jane, Candyman, Cassidy, Touch</td></tr>
<tr><td>II: Scarlet > Fire, Estimated > Eyes > Drumz > Wheel > Miracle > SOTM > Lovelight</td></tr>
<tr><td>E: U. S. Blues</td></tr>
</table></div>
<div class="setlist_table"><table border="0" cellspacing="0" cellpadding="0"><tr class="header"><td><span><a name="0328"></a><a href="/1989-03-28">3/28/1989 The Omni, Atlanta, GA</a></span> [<a href="http://www.archive.org/search.php?query=creator:%22Grateful Dead%22%20date:1989-03-28*">Listen/Download</a>]<tr><td>I: LTGTR > Franklin's > Stranger, Stagger Lee, Memphis Blues, Ramble On, Let It Grow > Don't Ease</td></tr>
<tr><td>II: Samson, Ship Of Fools, Playin > Foolish Heart > Drumz > Gimme Some Lovin > Wharf Rat > Throwing Stones > NFA</td></tr>
<tr><td>E: Box Of Rain</td></tr>
</table></div>
<div class="setlist_table"><table border="0" cellspacing="0" cellpadding="0"><tr class="header"><td><span><a name="0330"></a><a href="/1989-03-30">3/30/1989 Greensboro Coliseum, Greensboro, NC</a></span> [<a href="http://www.archive.org/search.php?query=creator:%22Grateful Dead%22%20date:1989-03-30*">Listen/Download</a>]<tr><td>I: Bertha > Jack Straw, Row Jimmy, Blow Away, Masterpiece, Bird Song > Promised</td></tr>
<tr><td>II: China Cat > I Know You Rider, L. L. Rain > He's Gone > Drumz > Other One > Stella Blue > Sugar Magnolia</td></tr>
<tr><td>E: Heaven's Door</td></tr>
</table></div>
<div class="setlist_table"><table border="0" cellspacing="0" cellpadding="0"><tr class="header"><td><span><a name="0331"></a><a href="/1989-03-31">3/31/1989 Greensboro Coliseum, Greensboro, NC</a></span> [<a href="http://www.archive.org/search.php?query=creator:%22Grateful Dead%22%20date:1989-03-31*">Listen/Download</a>]<tr><td>I: Bucket > Sugaree > Minglewood, Peggy-O, Me  and  My Uncle > Big River, Loser, Victim, SOTM</td></tr>
<tr><td>II: Hey Pocky Way <span class="setlist_small">*</span>, Truckin > Terrapin > Drumz > Take You Home > Watchtower > Morning Dew > Good Lovin</td></tr>
<tr><td>E: Brokedown</td></tr>
<tr class="notes"><td>*appears on "So Many Roads (1965-1995)."</i></td></tr>
</table></div>
<div class="setlist_table"><table border="0" cellspacing="0" cellpadding="0"><tr class="header"><td><span><a name="0402"></a><a href="/1989-04-02">4/2/1989 Pittsburgh Civic Arena, Pittsburgh, PA</a></span> [<a href="http://www.archive.org/search.php?query=creator:%22Grateful Dead%22%20date:1989-04-02*">Listen/Download</a>]<tr><td>I: Iko Iko, Rooster, Dire Wolf, All Over Now, We Can Run, B. E. Women, Queen Jane, Tennessee Jed > Music</td></tr>
<tr><td>II: Shakedown, Woman Smarter, Foolish Heart > Drumz > Wheel > Mr. Fantasy > Hey Jude Finale<span class="setlist_small">*</span> > Around > GDTRFB > Lovelight</td></tr>
<tr><td>E: Baby Blue</td></tr>
<tr class="notes"><td>Soundcheck: Help > Slipknot > Franklin's. *with extra lyrics from Brent. Entire show appears on "Grateful Dead Download Series Volume 9."</i></td></tr>
</table></div>
<div class="setlist_table"><table border="0" cellspacing="0" cellpadding="0"><tr class="header"><td><span><a name="0403"></a><a href="/1989-04-03">4/3/1989 Pittsburgh Civic Arena, Pittsburgh, PA</a></span> [<a href="http://www.archive.org/search.php?query=creator:%22Grateful Dead%22%20date:1989-04-03*">Listen/Download</a>]<tr><td>I: Greatest > Bertha > Walking Blues, Jack A Roe, El Paso, Built To Last, Victim, Tom Thumb Blues, Don't Ease</td></tr>
<tr><td>II: Blow Away, Estimated > Crazy Fingers > Uncle John > Drumz > Gimme Some Lovin > Miracle > Stella Blue > Sugar Magnolia</td></tr>
<tr><td>E: Johnny B. Goode > Black Muddy River</td></tr>
<tr class="notes"><td>Next ''El Paso'' 9/20/1990 [113 shows]</i></td></tr>
<tr class="notes"><td>"Beer Barrel Polka" tuning after "Jack A Roe." Entire show appears on "Grateful Dead Download Series Volume 9."</i></td></tr>
</table></div>
<div class="setlist_table"><table border="0" cellspacing="0" cellpadding="0"><tr class="header"><td><span><a name="0405"></a><a href="/1989-04-05">4/5/1989 Crisler Arena, U. of Michigan, Ann Arbor, MI</a></span> [<a href="http://www.archive.org/search.php?query=creator:%22Grateful Dead%22%20date:1989-04-05*">Listen/Download</a>]<tr><td>I: Stranger > Franklin's, Minglewood, Candyman, Memphis Blues, Far From Me, Dupree's, Let It Grow > U. S. Blues</td></tr>
<tr><td>II: Samson > Cumberland, Woman Smarter, Terrapin > Drumz > China Doll > Throwing Stones > NFA</td></tr>
<tr><td>E: Mighty Quinn</td></tr>
<tr class="notes"><td>Next ''Dupree's'' 3/26/1990 [73 shows]</i></td></tr>
</table></div>
<div class="setlist_table"><table border="0" cellspacing="0" cellpadding="0"><tr class="header"><td><span><a name="0406"></a><a href="/1989-04-06">4/6/1989 Crisler Arena, U. of Michigan, Ann Arbor, MI</a></span> [<a href="http://www.archive.org/search.php?query=creator:%22Grateful Dead%22%20date:1989-04-06*">Listen/Download</a>]<tr><td>I: Touch, Rooster, B. E. Women, Mama Tried > Mexicali, Althea, Masterpiece, Bird Song, Promised</td></tr>
<tr><td>II: Scarlet > Fire, Playin > Built To Last > Drumz > Take You Home > Other One > Wharf Rat > Around > Playin</td></tr>
<tr><td>E: Brokedown</td></tr>
</table></div>
<div class="setlist_table"><table border="0" cellspacing="0" cellpadding="0"><tr class="header"><td><span><a name="0408"></a><a href="/1989-04-08">4/8/1989 Riverfront Arena, Cincinnati, OH</a></span> [<a href="http://www.archive.org/search.php?query=creator:%22Grateful Dead%22%20date:1989-04-08*">Listen/Download</a>]<tr><td>I: LTGTR > Wang Dang Doodle > West L. A., Blow Away > Queen Jane, Loser, Cassidy > Don't Ease</td></tr>
<tr><td>II: China Cat > I Know You Rider, L. L. Rain > Eyes > Drumz > Wheel > Mr. Fantasy > Hey Jude Finale > Miracle > Black Peter > Saturday Night</td></tr>
<tr><td>E: Box Of Rain</td></tr>
</table></div>
<div class="setlist_table"><table border="0" cellspacing="0" cellpadding="0"><tr class="header"><td><span><a name="0409"></a><a href="/1989-04-09">4/9/1989 Freedom Hall, Louisville, KY</a></span> [<a href="http://www.archive.org/search.php?query=creator:%22Grateful Dead%22%20date:1989-04-09*">Listen/Download</a>]<tr><td>I: Bucket > Sugaree, Walking Blues, Roses, Me  and  My Uncle > Big River, Ramble On, Desolation Row, Foolish Heart</td></tr>
<tr><td>II: Louie Louie, Woman Smarter, Ship Of Fools, Estimated > Uncle John > Drumz > Other One > Stella Blue > Sugar Magnolia</td></tr>
<tr><td>E: Heaven's Door</td></tr>
<tr class="notes"><td>Next ''Roses'' 3/22/1990 [67 shows]; Final ''Louie Louie''</i></td></tr>
</table></div>
<div class="setlist_table"><table border="0" cellspacing="0" cellpadding="0"><tr class="header"><td><span><a name="0411"></a><a href="/1989-04-11">4/11/1989 Rosemont Horizon, Rosemont, IL</a></span> [<a href="http://www.archive.org/search.php?query=creator:%22Grateful Dead%22%20date:1989-04-11*">Listen/Download</a>]<tr><td>I: Shakedown, Rooster, FOTD, Victim, Built To Last, We Can Run, Memphis Blues, Deal</td></tr>
<tr><td>II: Samson, Crazy Fingers, Playin > Terrapin > Drumz > Gimme Some Lovin > SOTM > Throwing Stones > NFA</td></tr>
<tr><td>E: U. S. Blues</td></tr>
</table></div>
<div class="setlist_table"><table border="0" cellspacing="0" cellpadding="0"><tr class="header"><td><span><a name="0412"></a><a href="/1989-04-12">4/12/1989 Rosemont Horizon, Rosemont, IL</a></span> [<a href="http://www.archive.org/search.php?query=creator:%22Grateful Dead%22%20date:1989-04-12*">Listen/Download</a>]<tr><td>I: Jack Straw, Row Jimmy, Minglewood, Tennessee Jed, Masterpiece, Cumberland, Let It Grow</td></tr>
<tr><td>II: Touch > Truckin > Smokestack > Spoonful > Smokestack > He's Gone > Drumz > Take You Home > Watchtower > Wharf Rat > Lovelight</td></tr>
<tr><td>E: Black Muddy River</td></tr>
<tr class="notes"><td>Previous ''Spoonful'' 9/7/1987 [124 shows]</i></td></tr>
</table></div>
<div class="setlist_table"><table border="0" cellspacing="0" cellpadding="0"><tr class="header"><td><span><a name="0413"></a><a href="/1989-04-13">4/13/1989 Rosemont Horizon, Rosemont, IL</a></span> [<a href="http://www.archive.org/search.php?query=creator:%22Grateful Dead%22%20date:1989-04-13*">Listen/Download</a>]<tr><td>I: Iko Iko, Greatest, Peggy-O, All Over Now, To Lay Me Down, Cassidy > Don't Ease</td></tr>
<tr><td>II: Foolish Heart > L. L. Rain > Eyes > Drumz > Wheel > Miracle > Mr. Fantasy > Hey Jude Finale > GDTRFB > Good Lovin</td></tr>
<tr><td>E: Baby Blue</td></tr>
</table></div>
<div class="setlist_table"><table border="0" cellspacing="0" cellpadding="0"><tr class="header"><td><span><a name="0415"></a><a href="/1989-04-15">4/15/1989 The Mecca, Milwaukee, WI</a></span> [<a href="http://www.archive.org/search.php?query=creator:%22Grateful Dead%22%20date:1989-04-15*">Listen/Download</a>]<tr><td>I: Half Step, Stranger > Franklin's, Walking Blues, Push, Queen Jane, Blow Away > Promised</td></tr>
<tr><td>II: China Cat > I Know You Rider, Playin > Terrapin > Drumz > Take You Home > Watchtower > Morning Dew</td></tr>
<tr><td>E: Saturday Night</td></tr>
</table></div>
<div class="setlist_table"><table border="0" cellspacing="0" cellpadding="0"><tr class="header"><td><span><a name="0416"></a><a href="/1989-04-16">4/16/1989 The Mecca, Milwaukee, WI</a></span> [<a href="http://www.archive.org/search.php?query=creator:%22Grateful Dead%22%20date:1989-04-16*">Listen/Download</a>]<tr><td>I: Bucket > TLEO, Rooster, Stagger Lee, Mama Tried > Mexicali, Bird Song</td></tr>
<tr><td>II: Scarlet > Fire, Saint > Truckin > Drumz > Other One > Stella Blue > Throwing Stones > Lovelight</td></tr>
<tr><td>E: Box Of Rain</td></tr>
</table></div>
<div class="setlist_table"><table border="0" cellspacing="0" cellpadding="0"><tr class="header"><td><span><a name="0417"></a><a href="/1989-04-17">4/17/1989 Metropolitan Sports Center, Bloomington, MN</a></span> [<a href="http://www.archive.org/search.php?query=creator:%22Grateful Dead%22%20date:1989-04-17*">Listen/Download</a>]<tr><td>I: Iko Iko, Minglewood, Row Jimmy, Far From Me, Built To Last, Victim, Bertha</td></tr>
<tr><td>II: Cold Rain, Samson, Crazy Fingers > Estimated > Eyes > Drumz > Wheel > Gimme Some Lovin > Wharf Rat > NFA</td></tr>
<tr><td>E: Heaven's Door</td></tr>
</table></div>
<div class="setlist_table"><table border="0" cellspacing="0" cellpadding="0"><tr class="header"><td><span><a name="0428"></a><a href="/1989-04-28">4/28/1989 Irvine Meadows Amphitheatre, Irvine, CA</a></span> [<a href="http://www.archive.org/search.php?query=creator:%22Grateful Dead%22%20date:1989-04-28*">Listen/Download</a>]<tr><td>I: Cold Rain, Rooster, Peggy-O, Queen Jane, Little Light, Ramble On, Picasso Moon, Bird Song</td></tr>
<tr><td>II: Crazy Fingers > Playin > Uncle John > Playin > Terrapin > Drumz > Wheel > Miracle > SOTM > Sugar Magnolia > Touch</td></tr>
<tr><td>E: Mighty Quinn</td></tr>
<tr class="notes"><td>First ''Picasso Moon''</i></td></tr>
</table></div>
<div class="setlist_table"><table border="0" cellspacing="0" cellpadding="0"><tr class="header"><td><span><a name="0429"></a><a href="/1989-04-29">4/29/1989 Irvine Meadows Amphitheatre, Irvine, CA</a></span> [<a href="http://www.archive.org/search.php?query=creator:%22Grateful Dead%22%20date:1989-04-29*">Listen/Download</a>]<tr><td>I: Bucket > Sugaree, Walking Blues, B. E. Women, Memphis Blues, Built To Last, Blow Away > Saturday Night</td></tr>
<tr><td>II: China Cat > I Know You Rider, L. L. Rain, He's Gone > Spoonful > Drumz > Take You Home > Other One > Wharf Rat > Throwing Stones > Lovelight</td></tr>
<tr><td>E: U. S. Blues</td></tr>
<tr class="notes"><td>Next ''Spoonful'' 2/27/1990 [52 shows]</i></td></tr>
<tr class="notes"><td>"Funiculi Funicula" tuning before "Memphis Blues."</i></td></tr>
</table></div>
<div class="setlist_table"><table border="0" cellspacing="0" cellpadding="0"><tr class="header"><td><span><a name="0430"></a><a href="/1989-04-30">4/30/1989 Irvine Meadows Amphitheatre, Irvine, CA</a></span> [<a href="http://www.archive.org/search.php?query=creator:%22Grateful Dead%22%20date:1989-04-30*">Listen/Download</a>]<tr><td>I: Half Step > Wang Dang Doodle, Stagger Lee, Masterpiece, Tennessee Jed, We Can Run, Picasso Moon > Deal</td></tr>
<tr><td>II: Box Of Rain, Iko Iko, Estimated > Eyes > Drumz > Truckin > Gimme Some Lovin > Stella Blue > Around > Good Lovin</td></tr>
<tr><td>E: Baby Blue</td></tr>
</table></div>
<div class="setlist_table"><table border="0" cellspacing="0" cellpadding="0"><tr class="header"><td><span><a name="0506"></a><a href="/1989-05-06">5/6/1989 Frost Amphitheatre, Stanford U., Palo Alto, CA</a></span> [<a href="http://www.archive.org/search.php?query=creator:%22Grateful Dead%22%20date:1989-05-06*">Listen/Download</a>]<tr><td>I: Jack Straw, Peggy-O, Walking Blues, TLEO, Race Is On<span class="setlist_small">*</span>, West L. A., Little Light, Queen Jane, China Cat > I Know You Rider</td></tr>
<tr><td>II: LTGTR, Hey Pocky Way, Samson, Ship Of Fools > Playin > Eyes > Drumz > Take You Home > Wheel > Miracle > Wharf Rat > Around > NFA</td></tr>
<tr><td>E: Black Muddy River</td></tr>
<tr class="notes"><td>Next ''TLEO'' 6/23/1990 [75 shows]</i></td></tr>
<tr class="notes"><td>Rex Foundation benefit. FM broadcast KZSU-Palo Alto. *Kentucky Derby day.</i></td></tr>
</table></div>
<div class="setlist_table"><table border="0" cellspacing="0" cellpadding="0"><tr class="header"><td><span><a name="0507"></a><a href="/1989-05-07">5/7/1989 Frost Amphitheatre, Stanford U., Palo Alto, CA</a></span> [<a href="http://www.archive.org/search.php?query=creator:%22Grateful Dead%22%20date:1989-05-07*">Listen/Download</a>]<tr><td>I: Iko Iko, Rooster, Bertha, Me  and  My Uncle > Mexicali, Built To Last, Picasso Moon, Bird Song</td></tr>
<tr><td>II: Foolish Heart > Victim, Crazy Fingers > Woman Smarter > He's Gone > Drumz > Other One > Black Peter > Lovelight</td></tr>
<tr><td>E: Heaven's Door</td></tr>
<tr class="notes"><td>Rex Foundation benefit. Bill Kreutzmann's 43rd birthday. FM broadcast KZSU-Palo Alto.</i></td></tr>
</table></div>
<div class="setlist_table"><table border="0" cellspacing="0" cellpadding="0"><tr class="header"><td><span><a name="0527"></a><a href="/1989-05-27">5/27/1989 Oakland Coliseum Stadium, Oakland, CA</a></span> [<a href="http://www.archive.org/search.php?query=creator:%22Grateful Dead%22%20date:1989-05-27*">Listen/Download</a>]<tr><td>I: Touch > Greatest, Althea, Walking Blues, Iko Iko<span class="setlist_small">*</span>, Memphis Blues<span class="setlist_small">*</span>, Bird Song<span class="setlist_small">*</span> > Promised<span class="setlist_small">*</span></td></tr>
<tr><td>II: Bucket<span class="setlist_small">*</span> > Fire<span class="setlist_small">*</span>, Blow Away<span class="setlist_small">*</span>, Truckin<span class="setlist_small">*</span> > Drumz > Take You Home > Other One > Wharf Rat > Lovelight<span class="setlist_small">*</span></td></tr>
<tr><td>E: Brokedown<span class="setlist_small">*</span></td></tr>
<tr class="notes"><td>In Concert Against AIDS. Also: Tower Of Power; Joe Satriani; Los Lobos; John Fogerty; Tracy Chapman. John Fogerty's band included Bob and Jerry on guitar and vocals, Randy Jackson on bass, Steve Jordan on drums; Clarence Clemons joined for Fogerty's encore. *with Clarence Clemons. </i></td></tr>
</table></div>
<div class="setlist_table"><table border="0" cellspacing="0" cellpadding="0"><tr class="header"><td><span><a name="0527"></a><a href="/1989-05-27">5/27/1989 Oakland Coliseum Stadium, Oakland, CA</a></span> [<a href="http://www.archive.org/search.php?query=creator:%22Grateful Dead%22%20date:1989-05-27*">Listen/Download</a>]<tr><td>Born On The Bayou, Green River, Down On The Corner, Rock And Roll Girls, Centerfield, Proud Mary, Midnight Special, Bad Moon Rising, Fortunate Son</td></tr>
<tr><td>E: Suzy Q. <span class="setlist_small">*</span>, Long Tall Sally <span class="setlist_small">*</span></td></tr>
<tr class="notes"><td>In Concert Against AIDS. John Fogerty, Jerry garcia, Bob Weir, Randy Jackson & Steve Jordan. Also: The Grateful Dead, Tower of Power, Joe Satriani, Los Lobos, Tracy Chapman. *with Clarence Clemons.  </i></td></tr>
</table></div>
<div class="setlist_table"><table border="0" cellspacing="0" cellpadding="0"><tr class="header"><td><span><a name="0618"></a><a href="/1989-06-18">6/18/1989 Shoreline Amphitheatre, Mountain View, CA</a></span> [<a href="http://www.archive.org/search.php?query=creator:%22Grateful Dead%22%20date:1989-06-18*">Listen/Download</a>]<tr><td>I: Foolish Heart, Jack Straw, Alabama, Queen Jane, Cold Rain, Rooster, Hey Pocky Way > Iko Iko</td></tr>
<tr><td>II: Samson > Cumberland, Saint > He's Gone > Drumz > Wheel > Miracle > Stella Blue > Around > Good Lovin</td></tr>
<tr><td>E: U. S. Blues</td></tr>
<tr class="notes"><td>Next ''Saint'' 10/27/1990 [103 shows]</i></td></tr>
</table></div>
<div class="setlist_table"><table border="0" cellspacing="0" cellpadding="0"><tr class="header"><td><span><a name="0619"></a><a href="/1989-06-19">6/19/1989 Shoreline Amphitheatre, Mountain View, CA</a></span> [<a href="http://www.archive.org/search.php?query=creator:%22Grateful Dead%22%20date:1989-06-19*">Listen/Download</a>]<tr><td>I: Stranger > Franklin's > Walking Blues, Candyman, We Can Run, Push, Memphis Blues, Bird Song</td></tr>
<tr><td>II: China Cat > I Know You Rider > Playin > Crazy Fingers > Playin > Drumz > Take You Home > Watchtower > Black Peter > Throwing Stones > NFA</td></tr>
<tr><td>E: Heaven's Door</td></tr>
</table></div>
<div class="setlist_table"><table border="0" cellspacing="0" cellpadding="0"><tr class="header"><td><span><a name="0621"></a><a href="/1989-06-21">6/21/1989 Shoreline Amphitheatre, Mountain View, CA</a></span> [<a href="http://www.archive.org/search.php?query=creator:%22Grateful Dead%22%20date:1989-06-21*">Listen/Download</a>]<tr><td>I: Hideaway, Touch > Minglewood, Ramble On, Box Of Rain, Dire Wolf, Masterpiece, Row Jimmy, Cassidy, Deal</td></tr>
<tr><td>II: Scarlet > Bucket<span class="setlist_small">*</span>, Ship Of Fools<span class="setlist_small">*</span>, Estimated<span class="setlist_small">*</span> > Eyes<span class="setlist_small">*</span> > Drumz > Truckin<span class="setlist_small">*</span> > Other One<span class="setlist_small">*</span> > Morning Dew<span class="setlist_small">*</span> > Lovelight<span class="setlist_small">*</span></td></tr>
<tr><td>E: Brokedown<span class="setlist_small">*</span></td></tr>
<tr class="notes"><td>Previous ''Hideaway'' 11/7/1971 [1147 shows]; Final ''Hideaway''</i></td></tr>
<tr class="notes"><td>Pay-per-view TV broadcast - national FM broadcast - TV  and  FM broadcast cut during "Brokedown. " *with Clarence Clemons.</i></td></tr>
</table></div>
<div class="setlist_table"><table border="0" cellspacing="0" cellpadding="0"><tr class="header"><td><span><a name="0702"></a><a href="/1989-07-02">7/2/1989 Sullivan Stadium, Foxboro, MA</a></span> [<a href="http://www.archive.org/search.php?query=creator:%22Grateful Dead%22%20date:1989-07-02*">Listen/Download</a>]<tr><td>I: Playin > Crazy Fingers > Wang Dang Doodle, We Can Run, Tennessee Jed, Queen Jane, To Lay Me Down, Cassidy > Don't Ease</td></tr>
<tr><td>II: FOTD, Truckin > He's Gone > Eyes > Drumz > Wheel > Mr. Fantasy > Hey Jude Finale > Sugar Magnolia</td></tr>
<tr><td>E: Mighty Quinn <span class="setlist_small">*</span></td></tr>
<tr class="notes"><td>Venue used to be called "Schaefer Stadium." Los Lobos opened. Last 1st-set "Playin": 07-04-87 [156] or 12-27-86 [200] - last 1st-set "Crazy Fingers": 04-04-86 [225]. *appears on "Garcia Plays Dylan." </i></td></tr>
</table></div>
<div class="setlist_table"><table border="0" cellspacing="0" cellpadding="0"><tr class="header"><td><span><a name="0704"></a><a href="/1989-07-04">7/4/1989 Rich Stadium, Orchard Park, NY</a></span> [<a href="http://www.archive.org/search.php?query=creator:%22Grateful Dead%22%20date:1989-07-04*">Listen/Download</a>]<tr><td>I: Bertha > Greatest, Cold Rain, Walking Blues, Row Jimmy, Masterpiece, Stagger Lee, L. L. Rain > Deal</td></tr>
<tr><td>II: Touch > Woman Smarter, Ship Of Fools > Playin Reprise > Terrapin > Drumz > Take You Home > Watchtower <span class="setlist_small">*</span> > Morning Dew > NFA</td></tr>
<tr><td>E: U. S. Blues</td></tr>
<tr class="notes"><td>Next ''Playin Reprise'' 9/20/1990 [92 shows]</i></td></tr>
<tr class="notes"><td>10,000 Maniacs opened. Last 1st set "L. L. Rain": 07-10-87 [153] or 06-28-86 [211]. *appears on "Postcards from the Hanging." Entire show released as "Truckin’ Up To Buffalo" on CD and DVD.  </i></td></tr>
</table></div>
<div class="setlist_table"><table border="0" cellspacing="0" cellpadding="0"><tr class="header"><td><span><a name="0707"></a><a href="/1989-07-07">7/7/1989 John F. Kennedy Stadium, Philadelphia, PA</a></span> [<a href="http://www.archive.org/search.php?query=creator:%22Grateful Dead%22%20date:1989-07-07*">Listen/Download</a>]<tr><td>I: Bucket > Iko Iko, Rooster, Ramble On, Memphis Blues, Loser > Let It Grow, Blow Away <span class="setlist_small">*</span></td></tr>
<tr><td>II: Box Of Rain, Scarlet > Fire, Estimated > SOTM > Drumz > Other One > Wharf Rat > Lovelight</td></tr>
<tr><td>E: Heaven's Door</td></tr>
<tr class="notes"><td>Bruce Hornsby  and  The Range opened. Final concert held at J. F. K. Stadium. *appears as a "Built to Last" bonus track in "Beyond Description (1973-1989)." Entire show released as "Crimson, White and Indigo" on DVD and CD.
 </i></td></tr>
</table></div>
<div class="setlist_table"><table border="0" cellspacing="0" cellpadding="0"><tr class="header"><td><span><a name="0709"></a><a href="/1989-07-09">7/9/1989 Giants Stadium, East Rutherford, NJ</a></span> [<a href="http://www.archive.org/search.php?query=creator:%22Grateful Dead%22%20date:1989-07-09*">Listen/Download</a>]<tr><td>I: Shakedown, Jack Straw, West L. A., Victim, B. E. Women, Queen Jane, Bird Song</td></tr>
<tr><td>II: China Cat > I Know You Rider, Samson, Built To Last, Truckin > Drumz > Gimme Some Lovin > GDTRFB > Throwing Stones > NFA</td></tr>
<tr><td>E: Brokedown</td></tr>
<tr class="notes"><td>Los Lobos opened. "Addams Family" tuning before "Shakedown." </i></td></tr>
</table></div>
<div class="setlist_table"><table border="0" cellspacing="0" cellpadding="0"><tr class="header"><td><span><a name="0710"></a><a href="/1989-07-10">7/10/1989 Giants Stadium, East Rutherford, NJ</a></span> [<a href="http://www.archive.org/search.php?query=creator:%22Grateful Dead%22%20date:1989-07-10*">Listen/Download</a>]<tr><td>I: Stranger > Franklin's, Walking Blues, Jack A Roe, Masterpiece, Tennessee Jed, Music > Don't Ease</td></tr>
<tr><td>II: Foolish Heart, Little Light, Playin > Uncle John > Drumz<span class="setlist_small">*</span> > Iko Iko<span class="setlist_small">*</span> > Watchtower<span class="setlist_small">*</span> > Morning Dew<span class="setlist_small">*</span> > Sugar Magnolia<span class="setlist_small">*</span></td></tr>
<tr><td>E: Heaven's Door<span class="setlist_small">*</span></td></tr>
<tr class="notes"><td>Los Lobos opened. "Mexican Hat Dance" tuning before "Stranger." *with The Neville Brothers.</i></td></tr>
</table></div>
<div class="setlist_table"><table border="0" cellspacing="0" cellpadding="0"><tr class="header"><td><span><a name="0712"></a><a href="/1989-07-12">7/12/1989 Robert F. Kennedy Stadium, Washington, DC</a></span> [<a href="http://www.archive.org/search.php?query=creator:%22Grateful Dead%22%20date:1989-07-12*">Listen/Download</a>]<tr><td>I: Touch, Minglewood, Half Step, Tom Thumb Blues <span class="setlist_small">*</span>, Far From Me, Cassidy, FOTD, Promised</td></tr>
<tr><td>II: Sugaree<span class="setlist_small">+</span>, Woman Smarter<span class="setlist_small">+</span>, Ship Of Fools, Estimated > Eyes > Drumz > Miracle > Mr. Fantasy > Black Peter > Lovelight</td></tr>
<tr><td>E: Black Muddy River</td></tr>
<tr class="notes"><td>Bruce Hornsby  and  The Range opened. *appears on "Postcards from the Hanging." +with Bruce Hornsby.  </i></td></tr>
</table></div>
<div class="setlist_table"><table border="0" cellspacing="0" cellpadding="0"><tr class="header"><td><span><a name="0713"></a><a href="/1989-07-13">7/13/1989 Robert F. Kennedy Stadium, Washington, DC</a></span> [<a href="http://www.archive.org/search.php?query=creator:%22Grateful Dead%22%20date:1989-07-13*">Listen/Download</a>]<tr><td>I: Bucket, Cold Rain, Rooster, Tennessee Jed<span class="setlist_small">*</span>, Memphis Blues<span class="setlist_small">*</span>, To Lay Me Down, Let It Grow</td></tr>
<tr><td>II: He's Gone > L. L. Rain > Terrapin > Drumz > Take You Home > Other One > Wharf Rat > Throwing Stones > Good Lovin</td></tr>
<tr><td>E: U. S. Blues</td></tr>
<tr class="notes"><td>Next ''To Lay Me Down'' 4/1/1990 [52 shows]</i></td></tr>
<tr class="notes"><td>Bruce Hornsby  and  The Range opened. *with Bruce Hornsby.</i></td></tr>
</table></div>
<div class="setlist_table"><table border="0" cellspacing="0" cellpadding="0"><tr class="header"><td><span><a name="0715"></a><a href="/1989-07-15">7/15/1989 Deer Creek Music Center, Noblesville, IN</a></span> [<a href="http://www.archive.org/search.php?query=creator:%22Grateful Dead%22%20date:1989-07-15*">Listen/Download</a>]<tr><td>I: Bertha > Greatest, Candyman, Walking Blues, Peggy-O, Queen Jane, We Can Run, Bird Song</td></tr>
<tr><td>II: Foolish Heart > Victim > Crazy Fingers > Truckin > Smokestack > Drumz > China Doll > Watchtower > Stella Blue > Sugar Magnolia</td></tr>
<tr><td>E: Brokedown</td></tr>
</table></div>
<div class="setlist_table"><table border="0" cellspacing="0" cellpadding="0"><tr class="header"><td><span><a name="0717"></a><a href="/1989-07-17">7/17/1989 Alpine Valley Music Theatre, East Troy, WI</a></span> [<a href="http://www.archive.org/search.php?query=creator:%22Grateful Dead%22%20date:1989-07-17*">Listen/Download</a>]<tr><td>I: LTGTR <span class="setlist_small">+</span>, Stranger <span class="setlist_small">+</span>, Built To Last <span class="setlist_small">+</span>, Me  and  My Uncle <span class="setlist_small">+</span> > Cumberland <span class="setlist_small">+</span>, All Over Now <span class="setlist_small">+</span>, Row Jimmy, Masterpiece, Push, Music <span class="setlist_small">*</span></td></tr>
<tr><td>II: China Cat <span class="setlist_small">+</span> > I Know You Rider <span class="setlist_small">+</span> > Playin <span class="setlist_small">+</span> > Uncle John <span class="setlist_small">+</span> > SOTM <span class="setlist_small">+</span> > Drumz <span class="setlist_small">+</span> > Wheel <span class="setlist_small">+</span> > Gimme Some Lovin <span class="setlist_small">+</span> > GDTRFB <span class="setlist_small">+</span> > NFA <span class="setlist_small">+</span>, We Bid You Goodnight <span class="setlist_small">+</span></td></tr>
<tr><td>E: Johnny B. Goode <span class="setlist_small">+}</td></tr>
<tr class="notes"><td>Previous ''We Bid You Goodnight'' 12/31/1978 [756 shows]; Final ''Push''</i></td></tr>
<tr class="notes"><td>"Close Encounters" space before "Wheel." *appears on "Fallout From The Phil Zone." +appears on the "Downhill from Here" DVD. </i></td></tr>
</table></div>
<div class="setlist_table"><table border="0" cellspacing="0" cellpadding="0"><tr class="header"><td><span><a name="0718"></a><a href="/1989-07-18">7/18/1989 Alpine Valley Music Theatre, East Troy, WI</a></span> [<a href="http://www.archive.org/search.php?query=creator:%22Grateful Dead%22%20date:1989-07-18*">Listen/Download</a>]<tr><td>I: Touch, Jack Straw, Jack A Roe, Minglewood, FOTD, Memphis Blues, Bird Song > Promised</td></tr>
<tr><td>II: Sugar Magnolia > Scarlet > Woman Smarter > Eyes > Drumz > China Doll > Mr. Fantasy > Hey Jude Finale > Throwing Stones > Sunshine Daydream</td></tr>
<tr><td>E: Mighty Quinn</td></tr>
</table></div>
<div class="setlist_table"><table border="0" cellspacing="0" cellpadding="0"><tr class="header"><td><span><a name="0719"></a><a href="/1989-07-19">7/19/1989 Alpine Valley Music Theatre, East Troy, WI</a></span> [<a href="http://www.archive.org/search.php?query=creator:%22Grateful Dead%22%20date:1989-07-19*">Listen/Download</a>]<tr><td>I: Bucket > Sugaree, Mama Tried > Mexicali, Althea, Victim, West L. A., Desolation Row <span class="setlist_small">+</span> > Deal <span class="setlist_small">+}</td></tr>
<tr><td>II: Box Of Rain <span class="setlist_small">*</span>, Foolish Heart <span class="setlist_small">#</span> > L. L. Rain > Terrapin > Drumz > Other One > Wheel > Morning Dew</td></tr>
<tr><td>E: Lovelight</td></tr>
<tr class="notes"><td>*appears on "Fallout From The Phil Zone." +appears on the "Downhill from Here" DVD. #appears as a "Built to Last" bonus track in "Beyond Description (1973-1989)."</i></td></tr>
</table></div>
<div class="setlist_table"><table border="0" cellspacing="0" cellpadding="0"><tr class="header"><td><span><a name="0804"></a><a href="/1989-08-04">8/4/1989 Cal Expo Amphitheatre, Sacramento, CA</a></span> [<a href="http://www.archive.org/search.php?query=creator:%22Grateful Dead%22%20date:1989-08-04*">Listen/Download</a>]<tr><td>I: Bertha > Greatest, Althea, Mama Tried > Mexicali, Good Times, Built To Last, Queen Jane, Jack A Roe, Cassidy, Deal</td></tr>
<tr><td>II: Truckin > Wang Dang Doodle > Crazy Fingers > Cumberland > Eyes > Drumz > Wheel > Miracle > Stella Blue > Sugar Magnolia</td></tr>
<tr><td>E: Baby Blue</td></tr>
<tr class="notes"><td>Previous ''Good Times'' 10/16/1988 [52 shows]</i></td></tr>
<tr class="notes"><td>soundcheck: Touch, Shakedown.</i></td></tr>
</table></div>
<div class="setlist_table"><table border="0" cellspacing="0" cellpadding="0"><tr class="header"><td><span><a name="0805"></a><a href="/1989-08-05">8/5/1989 Cal Expo Amphitheatre, Sacramento, CA</a></span> [<a href="http://www.archive.org/search.php?query=creator:%22Grateful Dead%22%20date:1989-08-05*">Listen/Download</a>]<tr><td>I: Saturday Night, Cold Rain, We Can Run, Stagger Lee, Memphis Blues, Row Jimmy, Let It Grow</td></tr>
<tr><td>II: Hey Pocky Way > Playin > I Know You Rider > Terrapin > Drumz > SOTM > Throwing Stones > NFA</td></tr>
<tr><td>E: U. S. Blues</td></tr>
</table></div>
<div class="setlist_table"><table border="0" cellspacing="0" cellpadding="0"><tr class="header"><td><span><a name="0806"></a><a href="/1989-08-06">8/6/1989 Cal Expo Amphitheatre, Sacramento, CA</a></span> [<a href="http://www.archive.org/search.php?query=creator:%22Grateful Dead%22%20date:1989-08-06*">Listen/Download</a>]<tr><td>I: LTGTR, Stranger > Franklin's, Walking Blues, Ramble On, Masterpiece, Bird Song</td></tr>
<tr><td>II: Scarlet > Fire, Samson, Ship Of Fools, Woman Smarter > Drumz > Take You Home > Other One > Wharf Rat > Lovelight</td></tr>
<tr><td>E: Johnny B. Goode > We Bid You Goodnight</td></tr>
</table></div>
<div class="setlist_table"><table border="0" cellspacing="0" cellpadding="0"><tr class="header"><td><span><a name="0817"></a><a href="/1989-08-17">8/17/1989 Greek Theatre, U. of California, Berkeley, CA</a></span> [<a href="http://www.archive.org/search.php?query=creator:%22Grateful Dead%22%20date:1989-08-17*">Listen/Download</a>]<tr><td>I: Bucket > Sugaree, Walking Blues, Jack A Roe, Queen Jane, Candyman, Music > Don't Ease</td></tr>
<tr><td>II: Touch > Woman Smarter, Ship Of Fools, Estimated > Eyes > Drumz > Wheel > Gimme Some Lovin > GDTRFB > Good Lovin</td></tr>
<tr><td>E: Mighty Quinn</td></tr>
<tr class="notes"><td>Rex Foundation benefit. FM broadcast KPFA-Berkeley.</i></td></tr>
</table></div>
<div class="setlist_table"><table border="0" cellspacing="0" cellpadding="0"><tr class="header"><td><span><a name="0818"></a><a href="/1989-08-18">8/18/1989 Greek Theatre, U. of California, Berkeley, CA</a></span> [<a href="http://www.archive.org/search.php?query=creator:%22Grateful Dead%22%20date:1989-08-18*">Listen/Download</a>]<tr><td>I: Cold Rain, Minglewood, Row Jimmy, Masterpiece, Built To Last, Victim > Bird Song, Promised</td></tr>
<tr><td>II: Iko Iko, L. L. Rain, Terrapin > Drumz > Crazy Fingers > Miracle > Stella Blue > Throwing Stones > Lovelight</td></tr>
<tr><td>E1: Black Muddy River</td></tr>
<tr><td>E2: We Bid You Goodnight</td></tr>
<tr class="notes"><td>Rex Foundation benefit. FM broadcast KPFA-Berkeley.</i></td></tr>
</table></div>
<div class="setlist_table"><table border="0" cellspacing="0" cellpadding="0"><tr class="header"><td><span><a name="0819"></a><a href="/1989-08-19">8/19/1989 Greek Theatre, U. of California, Berkeley, CA</a></span> [<a href="http://www.archive.org/search.php?query=creator:%22Grateful Dead%22%20date:1989-08-19*">Listen/Download</a>]<tr><td>I: LTGTR, Jack Straw, We Can Run, Tennessee Jed, All Over Now, Loser, Memphis Blues, Box Of Rain</td></tr>
<tr><td>II: China Cat > I Know You Rider, Playin > Uncle John > Playin Jam > Drumz > Other One > Wharf Rat > NFA</td></tr>
<tr><td>E: Foolish Heart</td></tr>
<tr class="notes"><td>Rex Foundation benefit. FM broadcast KPFA-Berkeley.</i></td></tr>
</table></div>
<div class="setlist_table"><table border="0" cellspacing="0" cellpadding="0"><tr class="header"><td><span><a name="0820"></a><a href="/1989-08-20">8/20/1989 Greek Theatre, U. of California, Berkeley, CA</a></span> [<a href="http://www.archive.org/search.php?query=creator:%22Grateful Dead%22%20date:1989-08-20*">Listen/Download</a>]<tr><td></td></tr>
<tr class="notes"><td>The 1989 Greek shows were originally scheduled for the usual Friday through Sunday of August 18, 19 & 20, but were almost cancelled outright because the UC Berkeley administration did not want the Grateful Dead playing on oreintation day. The powers-that-be finally relented and allowed the shows to be moved back one day.</i></td></tr>
</table></div>
<div class="setlist_table"><table border="0" cellspacing="0" cellpadding="0"><tr class="header"><td><span><a name="0929"></a><a href="/1989-09-29">9/29/1989 Shoreline Amphitheatre, Mountain View, CA</a></span> [<a href="http://www.archive.org/search.php?query=creator:%22Grateful Dead%22%20date:1989-09-29*">Listen/Download</a>]<tr><td>I: LTGTR, Stranger > Franklin's, Wang Dang Doodle, Jack A Roe, Memphis Blues, We Can Run, Bird Song > Promised</td></tr>
<tr><td>II: China Cat > I Know You Rider, Blow Away, Playin > Terrapin > Drumz > Miracle > Death Don't <span class="setlist_small">*</span> > Sugar Magnolia</td></tr>
<tr><td>E: Mighty Quinn</td></tr>
<tr class="notes"><td>Previous ''Death Don't'' 4/26/1970 [1318 shows]</i></td></tr>
<tr class="notes"><td>Equipment break after "Blow Away." *appears on "So Many Roads (1965-1995)."</i></td></tr>
</table></div>
<div class="setlist_table"><table border="0" cellspacing="0" cellpadding="0"><tr class="header"><td><span><a name="0930"></a><a href="/1989-09-30">9/30/1989 Shoreline Amphitheatre, Mountain View, CA</a></span> [<a href="http://www.archive.org/search.php?query=creator:%22Grateful Dead%22%20date:1989-09-30*">Listen/Download</a>]<tr><td>I: Bertha > Greatest, West L. A., Queen Jane, Row Jimmy, Let It Grow</td></tr>
<tr><td>II: Iko Iko, Estimated, Truckin > Smokestack > Drumz > Take You Home > Wheel > Watchtower > Touch</td></tr>
<tr><td>E: U. S. Blues</td></tr>
<tr class="notes"><td>Next ''Smokestack'' 7/23/1990 [64 shows]</i></td></tr>
</table></div>
<div class="setlist_table"><table border="0" cellspacing="0" cellpadding="0"><tr class="header"><td><span><a name="1001"></a><a href="/1989-10-01">10/1/1989 Shoreline Amphitheatre, Mountain View, CA</a></span> [<a href="http://www.archive.org/search.php?query=creator:%22Grateful Dead%22%20date:1989-10-01*">Listen/Download</a>]<tr><td>I: Jack Straw, Ramble On, Walking Blues, Built To Last, Masterpiece, Little Light, Cassidy > Don't Ease</td></tr>
<tr><td>II: Bucket > Scarlet > Woman Smarter, He's Gone > Drumz > Other One > Wharf Rat > Lovelight</td></tr>
<tr><td>E: Heaven's Door</td></tr>
</table></div>
<div class="setlist_table"><table border="0" cellspacing="0" cellpadding="0"><tr class="header"><td><span><a name="1008"></a><a href="/1989-10-08">10/8/1989 Hampton Coliseum, Hampton, VA</a></span> [<a href="http://www.archive.org/search.php?query=creator:%22Grateful Dead%22%20date:1989-10-08*">Listen/Download</a>]<tr><td>I: Foolish Heart > Walking Blues, Candyman, Me  and  My Uncle > Big River, Stagger Lee, Queen Jane, Bird Song > Promised</td></tr>
<tr><td>II: Help > Slipknot > Franklin's, Victim > Eyes > Drumz > Miracle > Wheel > Gimme Some Lovin > Morning Dew</td></tr>
<tr><td>E: We Bid You Goodnight</td></tr>
<tr class="notes"><td>Previous ''Help'' 9/12/1985 [284 shows]; Previous ''Slipknot'' 9/12/1985 [284 shows]</i></td></tr>
<tr class="notes"><td>Show billed as "Formerly The Warlocks." Entire show appears on "Warlocks Brand Finest Quality."</i></td></tr>
</table></div>
<div class="setlist_table"><table border="0" cellspacing="0" cellpadding="0"><tr class="header"><td><span><a name="1009"></a><a href="/1989-10-09">10/9/1989 Hampton Coliseum, Hampton, VA</a></span> [<a href="http://www.archive.org/search.php?query=creator:%22Grateful Dead%22%20date:1989-10-09*">Listen/Download</a>]<tr><td>I: Stranger <span class="setlist_small">*</span>, Built To Last, Rooster, Ramble On, We Can Run, Jack A Roe, Memphis Blues, Row Jimmy, Music</td></tr>
<tr><td>II: Playin > Uncle John > Playin > Dark Star > Drumz > Death Don't > Mr. Fantasy > Hey Jude Finale > Throwing Stones > Good Lovin</td></tr>
<tr><td>E: Attics</td></tr>
<tr class="notes"><td>Previous ''Attics'' 10/28/1972 [1082 shows]; Previous ''Dark Star'' 7/13/1984 [359 shows]</i></td></tr>
<tr class="notes"><td>Show billed as "Formerly The Warlocks." *appears on "Without A Net." Entire show appears on "Warlocks Brand Finest Quality."</i></td></tr>
</table></div>
<div class="setlist_table"><table border="0" cellspacing="0" cellpadding="0"><tr class="header"><td><span><a name="1011"></a><a href="/1989-10-11">10/11/1989 Meadowlands Arena, East Rutherford, NJ</a></span> [<a href="http://www.archive.org/search.php?query=creator:%22Grateful Dead%22%20date:1989-10-11*">Listen/Download</a>]<tr><td>I: LTGTR > Bertha > Greatest, Loser, Masterpiece <span class="setlist_small">*</span>, Althea, Cassidy, Little Light > Don't Ease</td></tr>
<tr><td>II: China Cat > I Know You Rider, Estimated > Terrapin > Drumz > Wheel > Watchtower > Black Peter > Lovelight</td></tr>
<tr><td>E: Baby Blue</td></tr>
<tr class="notes"><td>*appears on "Postcards From the Hanging."</i></td></tr>
</table></div>
<div class="setlist_table"><table border="0" cellspacing="0" cellpadding="0"><tr class="header"><td><span><a name="1012"></a><a href="/1989-10-12">10/12/1989 Meadowlands Arena, East Rutherford, NJ</a></span> [<a href="http://www.archive.org/search.php?query=creator:%22Grateful Dead%22%20date:1989-10-12*">Listen/Download</a>]<tr><td>I: Bucket > Sugaree, Blow Away, Tennessee Jed, Queen Jane, Bird Song, Jack Straw</td></tr>
<tr><td>II: Hey Pocky Way > Cumberland > L. L. Rain > He's Gone > Drumz > Other One > Wharf Rat > Sugar Magnolia</td></tr>
<tr><td>E: Brokedown</td></tr>
</table></div>
<div class="setlist_table"><table border="0" cellspacing="0" cellpadding="0"><tr class="header"><td><span><a name="1013"></a><a href="/1989-10-13">10/13/1989 NBC Studios, New York, NY</a></span> [<a href="http://www.archive.org/search.php?query=creator:%22Grateful Dead%22%20date:1989-10-13*">Listen/Download</a>]<tr><td>Second That Emotion</td></tr>
<tr class="notes"><td>"Late Night with David Letterman" TV broadcast. Garcia & Weir. Rehearsal: Second That Emotion x4.</i></td></tr>
</table></div>
<div class="setlist_table"><table border="0" cellspacing="0" cellpadding="0"><tr class="header"><td><span><a name="1014"></a><a href="/1989-10-14">10/14/1989 Meadowlands Arena, East Rutherford, NJ</a></span> [<a href="http://www.archive.org/search.php?query=creator:%22Grateful Dead%22%20date:1989-10-14*">Listen/Download</a>]<tr><td>I: Touch, Minglewood, We Can Run, FOTD, Mama Tried > Mexicali, Help > Slipknot > Franklin's</td></tr>
<tr><td>II: Foolish Heart > Woman Smarter, Scarlet > Truckin > Drumz > China Doll > Saturday Night</td></tr>
<tr><td>E: Black Muddy River</td></tr>
<tr class="notes"><td>Last first-set "Help > Slipknot > Franklin's": 10-11-77 [868].</i></td></tr>
</table></div>
<div class="setlist_table"><table border="0" cellspacing="0" cellpadding="0"><tr class="header"><td><span><a name="1015"></a><a href="/1989-10-15">10/15/1989 Meadowlands Arena, East Rutherford, NJ</a></span> [<a href="http://www.archive.org/search.php?query=creator:%22Grateful Dead%22%20date:1989-10-15*">Listen/Download</a>]<tr><td>I: LTGTR > Iko Iko, Walking Blues, Far From Me, Row Jimmy, Victim <span class="setlist_small">*</span> > SOTM</td></tr>
<tr><td>II: Samson, Little Light > Crazy Fingers > Estimated > Eyes > Drumz > Stella Blue > Throwing Stones > NFA</td></tr>
<tr><td>E: NFA, Box Of Rain</td></tr>
<tr class="notes"><td>*appears on "Without a Net."</i></td></tr>
</table></div>
<div class="setlist_table"><table border="0" cellspacing="0" cellpadding="0"><tr class="header"><td><span><a name="1016"></a><a href="/1989-10-16">10/16/1989 Meadowlands Arena, East Rutherford, NJ</a></span> [<a href="http://www.archive.org/search.php?query=creator:%22Grateful Dead%22%20date:1989-10-16*">Listen/Download</a>]<tr><td>I: Picasso Moon > Half Step, Stranger, Good Times, Built To Last, Memphis Blues, Let It Grow > Deal</td></tr>
<tr><td>II: Dark Star > Playin > Uncle John > Playin Jam > Drumz > Take You Home > Miracle > Dark Star > Attics > Playin</td></tr>
<tr><td>E: We Bid You Goodnight</td></tr>
<tr class="notes"><td>Bob Weir's 42nd birthday. Entire show released as "Nightfall of Diamonds." </i></td></tr>
</table></div>
<div class="setlist_table"><table border="0" cellspacing="0" cellpadding="0"><tr class="header"><td><span><a name="1018"></a><a href="/1989-10-18">10/18/1989 The Spectrum, Philadelphia, PA</a></span> [<a href="http://www.archive.org/search.php?query=creator:%22Grateful Dead%22%20date:1989-10-18*">Listen/Download</a>]<tr><td>I: Shakedown, Rooster, Peggy-O, Queen Jane, Bird Song > Music</td></tr>
<tr><td>II: China Cat > I Know You Rider, Ship Of Fools > Woman Smarter > Terrapin > Drumz > Gimme Some Lovin > Watchtower > Black Peter > Around > Good Lovin</td></tr>
<tr><td>E: U. S. Blues</td></tr>
</table></div>
<div class="setlist_table"><table border="0" cellspacing="0" cellpadding="0"><tr class="header"><td><span><a name="1019"></a><a href="/1989-10-19">10/19/1989 The Spectrum, Philadelphia, PA</a></span> [<a href="http://www.archive.org/search.php?query=creator:%22Grateful Dead%22%20date:1989-10-19*">Listen/Download</a>]<tr><td>I: Bucket, West L. A., Victim, Built To Last, Blow Away, Masterpiece, Cumberland, Cassidy <span class="setlist_small">*</span> > Don't Ease</td></tr>
<tr><td>II: Help > Slipknot > Franklin's, Estimated > Eyes > Drumz > Wheel > Mr. Fantasy > Hey Jude Finale > Death Don't > Lovelight</td></tr>
<tr><td>E: Baby Blue</td></tr>
<tr class="notes"><td>*appears on "Without a Net."</i></td></tr>
</table></div>
<div class="setlist_table"><table border="0" cellspacing="0" cellpadding="0"><tr class="header"><td><span><a name="1020"></a><a href="/1989-10-20">10/20/1989 The Spectrum, Philadelphia, PA</a></span> [<a href="http://www.archive.org/search.php?query=creator:%22Grateful Dead%22%20date:1989-10-20*">Listen/Download</a>]<tr><td>I: Touch > Greatest, Candyman, Picasso Moon, Little Light, Tennessee Jed, Memphis Blues, Stagger Lee, Promised, California Earthquake <span class="setlist_small">*</span></td></tr>
<tr><td>II: Hey Pocky Way, Scarlet > Fire > Truckin > Other One Jam > Drumz > Take You Home > Other One > Wharf Rat > Sugar Magnolia</td></tr>
<tr><td>E: Brokedown</td></tr>
<tr class="notes"><td>First ''California Earthquake''</i></td></tr>
<tr class="notes"><td>*appears as a "Built to Last" bonus track in "Beyond Description (1973-1989)."</i></td></tr>
</table></div>
<div class="setlist_table"><table border="0" cellspacing="0" cellpadding="0"><tr class="header"><td><span><a name="1022"></a><a href="/1989-10-22">10/22/1989 Charlotte Coliseum, Charlotte, NC</a></span> [<a href="http://www.archive.org/search.php?query=creator:%22Grateful Dead%22%20date:1989-10-22*">Listen/Download</a>]<tr><td>I: Foolish Heart, Minglewood, Half Step, Queen Jane, Ramble On, BIODTL, Bird Song, Johnny B. Goode</td></tr>
<tr><td>II: Blow Away, Samson > Help > Slipknot > Franklin's > Drumz > Miracle > Stella Blue > Throwing Stones > NFA</td></tr>
<tr><td>E: Black Muddy River</td></tr>
<tr class="notes"><td>Previous ''BIODTL'' 2/12/1989 [56 shows]</i></td></tr>
</table></div>
<div class="setlist_table"><table border="0" cellspacing="0" cellpadding="0"><tr class="header"><td><span><a name="1023"></a><a href="/1989-10-23">10/23/1989 Charlotte Coliseum, Charlotte, NC</a></span> [<a href="http://www.archive.org/search.php?query=creator:%22Grateful Dead%22%20date:1989-10-23*">Listen/Download</a>]<tr><td>I: California Earthquake, Stranger, Loser, Walking Blues, Bertha, Masterpiece, Tennessee Jed, Let It Grow</td></tr>
<tr><td>II: Touch > L. L. Rain, We Can Run > Crazy Fingers > Terrapin > Drumz > Take You Home > GDTRFB > SOTM > Lovelight</td></tr>
<tr><td>E: Attics</td></tr>
<tr class="notes"><td>Final ''California Earthquake''</i></td></tr>
</table></div>
<div class="setlist_table"><table border="0" cellspacing="0" cellpadding="0"><tr class="header"><td><span><a name="1025"></a><a href="/1989-10-25">10/25/1989 Miami Arena, Miami, FL</a></span> [<a href="http://www.archive.org/search.php?query=creator:%22Grateful Dead%22%20date:1989-10-25*">Listen/Download</a>]<tr><td>I: Bucket > Sugaree, Little Light, FOTD, Memphis Blues, Cold Rain > Picasso Moon, Deal</td></tr>
<tr><td>II: Playin > Uncle John > Playin > SOTM > Truckin > Drumz > Gimme Some Lovin > Wharf Rat > Sugar Magnolia</td></tr>
<tr><td>E: U. S. Blues</td></tr>
</table></div>
<div class="setlist_table"><table border="0" cellspacing="0" cellpadding="0"><tr class="header"><td><span><a name="1026"></a><a href="/1989-10-26">10/26/1989 Miami Arena, Miami, FL</a></span> [<a href="http://www.archive.org/search.php?query=creator:%22Grateful Dead%22%20date:1989-10-26*">Listen/Download</a>]<tr><td>I: Foolish Heart, Rooster, Stagger Lee, Me  and  My Uncle > Big River, B. E. Women, Victim > Don't Ease</td></tr>
<tr><td>II: Estimated > Blow Away, Dark Star > Drumz > Wheel > Watchtower > Stella Blue > NFA</td></tr>
<tr><td>E: We Bid You Goodnight</td></tr>
<tr class="notes"><td>Extended tuning jam before "Dark Star." "Close Encounters" space before "Wheel."</i></td></tr>
</table></div>
<div class="setlist_table"><table border="0" cellspacing="0" cellpadding="0"><tr class="header"><td><span><a name="1206"></a><a href="/1989-12-06">12/6/1989 Oakland Coliseum Arena, Oakland, CA</a></span> [<a href="http://www.archive.org/search.php?query=creator:%22Grateful Dead%22%20date:1989-12-06*">Listen/Download</a>]<tr><td>I: Shakedown > Walking Blues, FOTD, Queen Jane, Jack A Roe, Little Light, Victim, Don't Ease</td></tr>
<tr><td>II: Scarlet > Sugar Magnolia > Ship Of Fools<span class="setlist_small">*</span> > Terrapin<span class="setlist_small">*</span> > Drumz > Wheel<span class="setlist_small">*</span> > Watchtower<span class="setlist_small">*</span> > SOTM<span class="setlist_small">*</span> > Sunshine Daydream<span class="setlist_small">*</span></td></tr>
<tr><td>E: Black Muddy River</td></tr>
<tr class="notes"><td>"Earthquake Relief Fund" benefit. 20th anniversary of Altamont. *with Clarence Clemons.</i></td></tr>
</table></div>
<div class="setlist_table"><table border="0" cellspacing="0" cellpadding="0"><tr class="header"><td><span><a name="1208"></a><a href="/1989-12-08">12/8/1989 Great Western Forum, Inglewood, CA</a></span> [<a href="http://www.archive.org/search.php?query=creator:%22Grateful Dead%22%20date:1989-12-08*">Listen/Download</a>]<tr><td>I: LTGTR > Stranger, Stagger Lee, BIODTL, Ramble On, Cassidy, Blow Away</td></tr>
<tr><td>II: Help > Slipknot > Franklin's, L. L. Rain > He's Gone > Drumz > Take You Home > Other One > Wharf Rat > Throwing Stones > NFA</td></tr>
<tr><td>E: U. S. Blues</td></tr>
<tr class="notes"><td>"Other One" teases before and after "Drumz."</i></td></tr>
</table></div>
<div class="setlist_table"><table border="0" cellspacing="0" cellpadding="0"><tr class="header"><td><span><a name="1209"></a><a href="/1989-12-09">12/9/1989 Great Western Forum, Inglewood, CA</a></span> [<a href="http://www.archive.org/search.php?query=creator:%22Grateful Dead%22%20date:1989-12-09*">Listen/Download</a>]<tr><td>I: Touch, Minglewood, Row Jimmy, Mexicali > Cumberland, Bird Song, Saturday Night</td></tr>
<tr><td>II: Foolish Heart, Playin > Crazy Fingers > Uncle John > Playin > Drumz > Mr. Fantasy > Hey Jude Finale > Lovelight</td></tr>
<tr><td>E: Heaven's Door</td></tr>
<tr class="notes"><td>"Bird Song" appears on "Without A Net."</i></td></tr>
</table></div>
<div class="setlist_table"><table border="0" cellspacing="0" cellpadding="0"><tr class="header"><td><span><a name="1210"></a><a href="/1989-12-10">12/10/1989 Great Western Forum, Inglewood, CA</a></span> [<a href="http://www.archive.org/search.php?query=creator:%22Grateful Dead%22%20date:1989-12-10*">Listen/Download</a>]<tr><td>I: Bucket, Sugaree<span class="setlist_small">*</span>, We Can Run, Masterpiece, Loser, Victim, C. C. Rider<span class="setlist_small">*+</span>, I'm A Man<span class="setlist_small">*+</span></td></tr>
<tr><td>II: Jack Straw<span class="setlist_small">*</span> > China Cat<span class="setlist_small">*</span> > I Know You Rider<span class="setlist_small">*</span>, Woman Smarter<span class="setlist_small">*</span> > Drumz > Wheel > Miracle > Stella Blue > Good Lovin<span class="setlist_small">*</span></td></tr>
<tr><td>E: Baby Blue</td></tr>
<tr class="notes"><td>Only ''I'm A Man''; Next ''C. C. Rider'' 5/12/1991 [107 shows]</i></td></tr>
<tr class="notes"><td>*with Bruce Hornsby. +with Spencer Davis. Bruce Hornsby also sang a verse of "Good Lovin." "C. C. Rider" sung as "Easy Rider" with other variations by Spencer Davis. Only "I'm A Man." Extended introduction on "Baby Blue."</i></td></tr>
</table></div>
<div class="setlist_table"><table border="0" cellspacing="0" cellpadding="0"><tr class="header"><td><span><a name="1227"></a><a href="/1989-12-27">12/27/1989 Oakland Coliseum Arena, Oakland, CA</a></span> [<a href="http://www.archive.org/search.php?query=creator:%22Grateful Dead%22%20date:1989-12-27*">Listen/Download</a>]<tr><td>I: Cold Rain, Greatest, Good Times, Althea, Me  and  My Uncle > Big River, Tom Thumb Blues, Bird Song > Promised</td></tr>
<tr><td>II: Iko Iko<span class="setlist_small">*</span>, Playin<span class="setlist_small">*</span> > Crazy Fingers > Uncle John > Drumz > Wheel<span class="setlist_small">*</span> > Miracle<span class="setlist_small">*</span> > Morning Dew</td></tr>
<tr><td>E: Johnny B. Goode > Black Muddy River</td></tr>
<tr class="notes"><td>Next ''Johnny B. Goode'' 12/31/1990 [77 shows]</i></td></tr>
<tr class="notes"><td>*with Clarence Clemons</i></td></tr>
</table></div>
<div class="setlist_table"><table border="0" cellspacing="0" cellpadding="0"><tr class="header"><td><span><a name="1228"></a><a href="/1989-12-28">12/28/1989 Oakland Coliseum Arena, Oakland, CA</a></span> [<a href="http://www.archive.org/search.php?query=creator:%22Grateful Dead%22%20date:1989-12-28*">Listen/Download</a>]<tr><td>I: LTGTR, Stranger, Dire Wolf, Rooster, Ramble On, Queen Jane, Little Light, Let It Grow</td></tr>
<tr><td>II: Foolish Heart > L. L. Rain, Eyes > Drumz<span class="setlist_small">*</span> > Gimme Some Lovin > Watchtower > Stella Blue > Lovelight</td></tr>
<tr><td>E: U. S. Blues</td></tr>
<tr class="notes"><td>*with Willie Green of the Neville Brothers. Part of "Drumz" appears on "Infrared Roses."</i></td></tr>
</table></div>
<div class="setlist_table"><table border="0" cellspacing="0" cellpadding="0"><tr class="header"><td><span><a name="1230"></a><a href="/1989-12-30">12/30/1989 Oakland Coliseum Arena, Oakland, CA</a></span> [<a href="http://www.archive.org/search.php?query=creator:%22Grateful Dead%22%20date:1989-12-30*">Listen/Download</a>]<tr><td>I: Bertha > Good Lovin > Sugaree<span class="setlist_small">*</span>, Walking Blues<span class="setlist_small">*</span>, Jack A Roe<span class="setlist_small">*</span>, Masterpiece<span class="setlist_small">*</span>, West L. A.<span class="setlist_small">*</span> > Music<span class="setlist_small">*</span></td></tr>
<tr><td>II: Jack Straw > China Cat<span class="setlist_small">*</span> > I Know You Rider<span class="setlist_small">*</span>, Estimated<span class="setlist_small">*</span> > Terrapin<span class="setlist_small">*</span> > Drumz<span class="setlist_small">*</span> > Take You Home<span class="setlist_small">*</span> > Other One<span class="setlist_small">*</span> > SOTM<span class="setlist_small">*</span> > Saturday Night<span class="setlist_small">*</span></td></tr>
<tr><td>E: Baby Blue</td></tr>
<tr class="notes"><td>*with Airto Moreira.</i></td></tr>
</table></div>
<div class="setlist_table"><table border="0" cellspacing="0" cellpadding="0"><tr class="header"><td><span><a name="1231"></a><a href="/1989-12-31">12/31/1989 Oakland Coliseum Arena, Oakland, CA</a></span> [<a href="http://www.archive.org/search.php?query=creator:%22Grateful Dead%22%20date:1989-12-31*">Listen/Download</a>]<tr><td>I: Sugar Magnolia > Touch > Woman Smarter, Big Boss Man<span class="setlist_small">*</span>, Memphis Blues, Shakedown</td></tr>
<tr><td>II: Iko Iko<span class="setlist_small">+</span>, Victim<span class="setlist_small">#</span> > Dark Star<span class="setlist_small">#</span> > Drumz<span class="setlist_small">#</span> > Mr. Fantasy > Hey Jude Finale > GDTRFB > Throwing Stones, NFA</td></tr>
<tr><td>E1: Brokedown > Sunshine Daydream</td></tr>
<tr><td>E2: Midnight Hour</td></tr>
<tr class="notes"><td>Next ''Midnight Hour'' 9/18/1991 [136 shows]</i></td></tr>
<tr class="notes"><td>Bill Graham, dressed as a chicken landed on and cracked a giant egg at midnight. Two baby "New Years" hatched, one of whom was Bill Graham's son, Alex. New Grass Revival then Bonnie Raitt opened. FM broadcast KPFA-Berkeley. *with Bonnie Raitt.  +with Taro Hart.  #with Airto Moreira.  </i></td></tr>
</table></div>

  </div>
 </div><!--END main-->

</div><!--END container -->
</div><!--END centering div-->
</body>
</html>