<!DOCTYPE HTML PUBLIC "-//W3C//DTD HTML 4.01 Transitional//EN"
"http://www.w3.org/TR/html4/loose.dtd">
<html>
  <head>
    <meta http-equiv="Content-Type" content="text/html; charset=utf-8">
    <title>
      1979 Setlists
    </title>
  </head>
  <body>
    <div id="main">
      <div>
        1979 Setlists
      </div><script language="Javascript" type="text/javascript">
<!--
      function showtab () {
      document.getElementById('hide').style.display = 'none';
      document.getElementById('show').style.display = 'block';
      }
      function hidetab () {
      document.getElementById('show').style.display = 'none';
      document.getElementById('hide').style.display = 'block';
      }
      -->
      </script>
      <p>
        January: <a href="#0105">5</a> <a href="#0107">7</a> <a href="#0108">8</a> <a href="#0110">10</a> <a href="#0111">11</a> <a href="#0112">12</a> <a href="#0114">14</a> <a href="#0115">15</a> <a href="#0117">17</a> <a href="#0118">18</a> <a href="#0120">20</a> <a href="#0121">21</a>
        <br>
        February: <a href="#0203">3</a> <a href="#0204">4</a> <a href="#0206">6</a> <a href="#0207">7</a> <a href="#0209">9</a> <a href="#0210">10</a> <a href="#0211">11</a> <a href="#0217">17</a>
        <br>
        April: <a href="#0416">16</a> <a href="#0421">21</a> <a href="#0422">22</a>
        <br>
        May: <a href="#0503">3</a> <a href="#0504">4</a> <a href="#0505">5</a> <a href="#0507">7</a> <a href="#0508">8</a> <a href="#0509">9</a> <a href="#0511">11</a> <a href="#0512">12</a> <a href="#0513">13</a>
        <br>
        June: <a href="#0628">28</a> <a href="#0630">30</a> <a href="#06xx">xx</a>
        <br>
        July: <a href="#0701">1</a> <a href="#0714">14</a> <a href="#0716">16</a> <a href="#07xx">xx</a>
        <br>
        August: <a href="#0804">4</a> <a href="#0805">5</a> <a href="#0812">12</a> <a href="#0813">13</a> <a href="#0813">13</a> <a href="#0814">14</a> <a href="#0814">14</a> <a href="#0831">31</a>
        <br>
        September: <a href="#0901">1</a> <a href="#0902">2</a> <a href="#0904">4</a> <a href="#0905">5</a> <a href="#0906">6</a>
        <br>
        October: <a href="#1024">24</a> <a href="#1025">25</a> <a href="#1027">27</a> <a href="#1028">28</a> <a href="#1029">29</a> <a href="#1031">31</a>
        <br>
        November: <a href="#1101">1</a> <a href="#1102">2</a> <a href="#1104">4</a> <a href="#1105">5</a> <a href="#1106">6</a> <a href="#1108">8</a> <a href="#1109">9</a> <a href="#1110">10</a> <a href="#1123">23</a> <a href="#1124">24</a> <a href="#1125">25</a> <a href="#1129">29</a> <a href="#1130">30</a>
        <br>
        December: <a href="#1201">1</a> <a href="#1203">3</a> <a href="#1204">4</a> <a href="#1205">5</a> <a href="#1207">7</a> <a href="#1209">9</a> <a href="#1210">10</a> <a href="#1211">11</a> <a href="#1213">13</a> <a href="#1214">14</a> <a href="#1226">26</a> <a href="#1227">27</a> <a href="#1228">28</a> <a href="#1230">30</a> <a href="#1231">31</a>
      </p>
      <div>
        <table border="0" cellspacing="0" cellpadding="0">
          <tr>
            <td id="0105">
              <a href="/1979-01-05">1/5/1979 The Spectrum, Philadelphia, PA</a> [<a href="http://www.archive.org/search.php?query=creator:%22Grateful%20Dead%22%20date:1979-01-05*">Listen/Download</a>]
            </td>
          </tr>
          <tr>
            <td>
              I: Sugaree, Minglewood, Candyman, Mama Tried &gt; Mexicali, Heart Of Me, B. E. Women, All Over Now, Stagger Lee, Music
            </td>
          </tr>
          <tr>
            <td>
              II: Bertha &gt; Good Lovin, Roses, Estimated &gt; Eyes &gt; Drumz &gt; Truckin &gt; Nobody's Fault &gt; Black Peter &gt; Around
            </td>
          </tr>
          <tr>
            <td>
              E: Johnny B. Goode
            </td>
          </tr>
          <tr>
            <td>
              Next ''Nobody's Fault'' 5/4/1981 [182 shows]
            </td>
          </tr>
        </table>
      </div>
      <div>
        <table border="0" cellspacing="0" cellpadding="0">
          <tr>
            <td id="0107">
              <a href="/1979-01-07">1/7/1979 Madison Square Garden, New York, NY</a> [<a href="http://www.archive.org/search.php?query=creator:%22Grateful%20Dead%22%20date:1979-01-07*">Listen/Download</a>]
            </td>
          </tr>
          <tr>
            <td>
              I: Jack Straw, TLEO, Cassidy, Jack A Roe, L. L. Rain, Tennessee Jed, El Paso, Stagger Lee, Passenger
            </td>
          </tr>
          <tr>
            <td>
              II: Miracle &gt; Shakedown, Heart Of Me, Estimated &gt; Eyes &gt; Drumz &gt; NFA &gt; Black Peter &gt; Around
            </td>
          </tr>
          <tr>
            <td>
              E: Good Lovin
            </td>
          </tr>
        </table>
      </div>
      <div>
        <table border="0" cellspacing="0" cellpadding="0">
          <tr>
            <td id="0108">
              <a href="/1979-01-08">1/8/1979 Madison Square Garden, New York, NY</a> [<a href="http://www.archive.org/search.php?query=creator:%22Grateful%20Dead%22%20date:1979-01-08*">Listen/Download</a>]
            </td>
          </tr>
          <tr>
            <td>
              I: Half Step &gt; Franklin's, Minglewood, Candyman, Me and My Uncle &gt; Big River, FOTD, All Over Now, B. E. Women, Lazy Lightning &gt; Supplication
            </td>
          </tr>
          <tr>
            <td>
              II: Scarlet &gt; Fire, Samson, Terrapin &gt; Playin &gt; Drumz &gt; Other One &gt; Wharf Rat &gt; Good Lovin
            </td>
          </tr>
          <tr>
            <td>
              E: U. S. Blues
            </td>
          </tr>
        </table>
      </div>
      <div>
        <table border="0" cellspacing="0" cellpadding="0">
          <tr>
            <td id="0110">
              <a href="/1979-01-10">1/10/1979 Nassau Veterans Memorial Coliseum, Uniondale, NY</a> [<a href="http://www.archive.org/search.php?query=creator:%22Grateful%20Dead%22%20date:1979-01-10*">Listen/Download</a>]
            </td>
          </tr>
          <tr>
            <td>
              I: Promised, Dire Wolf, Mama Tried &gt; Mexicali, Tennessee Jed, L. L. Rain, Stagger Lee, El Paso, Row Jimmy, Passenger, Loser, Music
            </td>
          </tr>
          <tr>
            <td>
              II: Shakedown, Miracle &gt; Bertha &gt; Good Lovin, Dark Star &gt; Drumz &gt; Wharf Rat &gt; St. Stephen &gt; Around
            </td>
          </tr>
          <tr>
            <td>
              E: Johnny B. Goode
            </td>
          </tr>
          <tr>
            <td>
              Next ''St. Stephen'' 10/11/1983 [352 shows]
            </td>
          </tr>
        </table>
      </div>
      <div>
        <table border="0" cellspacing="0" cellpadding="0">
          <tr>
            <td id="0111">
              <a href="/1979-01-11">1/11/1979 Nassau Veterans Memorial Coliseum, Uniondale, NY</a> [<a href="http://www.archive.org/search.php?query=creator:%22Grateful%20Dead%22%20date:1979-01-11*">Listen/Download</a>]
            </td>
          </tr>
          <tr>
            <td>
              I: Sugaree, Me and My Uncle &gt; Big River, Peggy-O, Cassidy, FOTD, Minglewood, Heart Of Me, Ramble On, Jack Straw &gt; Deal
            </td>
          </tr>
          <tr>
            <td>
              II: Miracle, Ship Of Fools, Estimated &gt; He's Gone &gt; Drumz &gt; Truckin &gt; Other One &gt; Stella Blue &gt; Good Lovin
            </td>
          </tr>
          <tr>
            <td>
              E: Casey Jones
            </td>
          </tr>
        </table>
      </div>
      <div>
        <table border="0" cellspacing="0" cellpadding="0">
          <tr>
            <td id="0112">
              <a href="/1979-01-12">1/12/1979 The Spectrum, Philadelphia, PA</a> [<a href="http://www.archive.org/search.php?query=creator:%22Grateful%20Dead%22%20date:1979-01-12*">Listen/Download</a>]
            </td>
          </tr>
          <tr>
            <td>
              I: Jack Straw, Candyman, El Paso, Tennessee Jed, BIODTL, Peggy-O, Passenger, Deal
            </td>
          </tr>
          <tr>
            <td>
              II: Samson, Roses, Dancin &gt; Drumz &gt; NFA &gt; GDTRFB &gt; Sugar Magnolia
            </td>
          </tr>
          <tr>
            <td>
              E: U. S. Blues
            </td>
          </tr>
          <tr>
            <td>
              Next ''Roses'' 9/25/1980 [118 shows]
            </td>
          </tr>
        </table>
      </div>
      <div>
        <table border="0" cellspacing="0" cellpadding="0">
          <tr>
            <td id="0114">
              <a href="/1979-01-14">1/14/1979 Utica Memorial Auditorium, Utica, NY</a> [<a href="http://www.archive.org/search.php?query=creator:%22Grateful%20Dead%22%20date:1979-01-14*">Listen/Download</a>]
            </td>
          </tr>
          <tr>
            <td>
              I: Cold Rain, Minglewood, Dire Wolf, Me and My Uncle &gt; Big River, TLEO, L. L. Rain, B. E. Women, All Over Now, Jack A Roe, Lazy Lightning &gt; Supplication
            </td>
          </tr>
          <tr>
            <td>
              II: Miracle &gt; Bertha &gt; Good Lovin, Stagger Lee, Estimated &gt; Eyes &gt; Drumz &gt; Iko Iko &gt; Other One &gt; Black Peter &gt; Around
            </td>
          </tr>
          <tr>
            <td>
              Next ''Cold Rain'' 11/10/1979 [50 shows]
            </td>
          </tr>
        </table>
      </div>
      <div>
        <table border="0" cellspacing="0" cellpadding="0">
          <tr>
            <td id="0115">
              <a href="/1979-01-15">1/15/1979 Springfield Civic Center Arena, Springfield, MA</a> [<a href="http://www.archive.org/search.php?query=creator:%22Grateful%20Dead%22%20date:1979-01-15*">Listen/Download</a>]
            </td>
          </tr>
          <tr>
            <td>
              I: Jack Straw, Jack A Roe, Cassidy, Row Jimmy, Mama Tried &gt; Mexicali, Stagger Lee, Passenger, Deal
            </td>
          </tr>
          <tr>
            <td>
              II: Miracle &gt; Shakedown, Heart Of Me, Terrapin &gt; Playin &gt; Drumz &gt; Playin &gt; Casey Jones
            </td>
          </tr>
          <tr>
            <td>
              E: Johnny B. Goode
            </td>
          </tr>
        </table>
      </div>
      <div>
        <table border="0" cellspacing="0" cellpadding="0">
          <tr>
            <td id="0117">
              <a href="/1979-01-17">1/17/1979 Veterans Memorial Coliseum, New Haven, CT</a> [<a href="http://www.archive.org/search.php?query=creator:%22Grateful%20Dead%22%20date:1979-01-17*">Listen/Download</a>]
            </td>
          </tr>
          <tr>
            <td>
              I: Shakedown, Me and My Uncle &gt; Big River, Peggy-O, BIODTL, Stagger Lee, Minglewood, B. E. Women, Heart Of Me, Miracle
            </td>
          </tr>
          <tr>
            <td>
              II: Scarlet &gt; Fire, Estimated &gt; Eyes &gt; Drumz &gt; NFA &gt; Black Peter &gt; Around &gt; Good Lovin
            </td>
          </tr>
          <tr>
            <td>
              E: Casey Jones
            </td>
          </tr>
        </table>
      </div>
      <div>
        <table border="0" cellspacing="0" cellpadding="0">
          <tr>
            <td id="0118">
              <a href="/1979-01-18">1/18/1979 Providence Civic Center, Providence, RI</a> [<a href="http://www.archive.org/search.php?query=creator:%22Grateful%20Dead%22%20date:1979-01-18*">Listen/Download</a>]
            </td>
          </tr>
          <tr>
            <td>
              I: Promised, TLEO, Mama Tried &gt; Mexicali, FOTD, Cassidy, Jack A Roe, L. L. Rain, Ramble On, Minglewood, Deal
            </td>
          </tr>
          <tr>
            <td>
              II: Miracle &gt; Bertha &gt; Good Lovin, Heart Of Me, Ship Of Fools, He's Gone &gt; Truckin &gt; Other One &gt; Wharf Rat &gt; Around
            </td>
          </tr>
          <tr>
            <td>
              E: U. S. Blues
            </td>
          </tr>
        </table>
      </div>
      <div>
        <table border="0" cellspacing="0" cellpadding="0">
          <tr>
            <td id="0120">
              <a href="/1979-01-20">1/20/1979 Shea's Buffalo Theatre, Buffalo, NY</a> [<a href="http://www.archive.org/search.php?query=creator:%22Grateful%20Dead%22%20date:1979-01-20*">Listen/Download</a>]
            </td>
          </tr>
          <tr>
            <td>
              I: Promised, Sugaree, El Paso, Peggy-O, All Over Now, Jack A Roe, Minglewood, Stagger Lee, Jack Straw
            </td>
          </tr>
          <tr>
            <td>
              II: Miracle &gt; Bertha &gt; Good Lovin, Loser, Estimated &gt; Other One &gt; Drumz &gt; Other One &gt; Dark Star &gt; NFA &gt; Sugar Magnolia
            </td>
          </tr>
          <tr>
            <td>
              E: Saturday Night
            </td>
          </tr>
          <tr>
            <td>
              Next ''Dark Star'' 12/31/1981 [232 shows]
            </td>
          </tr>
          <tr>
            <td>
              Donna was absent
            </td>
          </tr>
        </table>
      </div>
      <div>
        <table border="0" cellspacing="0" cellpadding="0">
          <tr>
            <td id="0121">
              <a href="/1979-01-21">1/21/1979 Masonic Temple, Detroit, MI</a> [<a href="http://www.archive.org/search.php?query=creator:%22Grateful%20Dead%22%20date:1979-01-21*">Listen/Download</a>]
            </td>
          </tr>
          <tr>
            <td>
              I: Sugaree, Me and My Uncle &gt; Big River, TLEO, BIODTL, Dire Wolf, L. L. Rain, B. E. Women, Minglewood, FOTD, Jack Straw, Deal
            </td>
          </tr>
          <tr>
            <td>
              II: Samson, Terrapin &gt; Playin &gt; Drumz &gt; Truckin &gt; Stella Blue &gt; Good Lovin
            </td>
          </tr>
          <tr>
            <td>
              E: U. S. Blues
            </td>
          </tr>
          <tr>
            <td>
              Donna was absent
            </td>
          </tr>
        </table>
      </div>
      <div>
        <table border="0" cellspacing="0" cellpadding="0">
          <tr>
            <td id="0203">
              <a href="/1979-02-03">2/3/1979 Market Square Arena, Indianapolis, IN</a> [<a href="http://www.archive.org/search.php?query=creator:%22Grateful%20Dead%22%20date:1979-02-03*">Listen/Download</a>]
            </td>
          </tr>
          <tr>
            <td>
              I: Promised, Candyman, Mama Tried &gt; Mexicali, B.E. Women, Cassidy, China Cat &gt; I Know You Rider, Minglewood, Stagger Lee, Heart Of Me, Music
            </td>
          </tr>
          <tr>
            <td>
              II: Scarlet &gt; Fire, Estimated &gt; Eyes &gt; Drumz &gt; Other One &gt; Wharf Rat &gt; Miracle &gt; Casey Jones
            </td>
          </tr>
          <tr>
            <td>
              E: Saturday Night
            </td>
          </tr>
          <tr>
            <td>
              Previous ''China Cat'' 12/29/1977 [95 shows]; Previous ''I Know You Rider'' 12/29/1977 [95 shows]
            </td>
          </tr>
        </table>
      </div>
      <div>
        <table border="0" cellspacing="0" cellpadding="0">
          <tr>
            <td id="0204">
              <a href="/1979-02-04">2/4/1979 Dane County Coliseum, Madison, WI</a> [<a href="http://www.archive.org/search.php?query=creator:%22Grateful%20Dead%22%20date:1979-02-04*">Listen/Download</a>]
            </td>
          </tr>
          <tr>
            <td>
              I: Half Step &gt; Franklin's, Me and My Uncle &gt; Big River, Peggy-O, Cassidy, FOTD, El Paso, Tennessee Jed, Lazy Lightning &gt; Supplication
            </td>
          </tr>
          <tr>
            <td>
              II: Shakedown, Samson, Heart Of Me, Terrapin &gt; Playin &gt; Drumz &gt; Iko Iko &gt; Black Peter &gt; Around
            </td>
          </tr>
          <tr>
            <td>
              E: U. S. Blues
            </td>
          </tr>
          <tr>
            <td>
              Next ''Iko Iko'' 8/16/1980 [94 shows]
            </td>
          </tr>
        </table>
      </div>
      <div>
        <table border="0" cellspacing="0" cellpadding="0">
          <tr>
            <td id="0206">
              <a href="/1979-02-06">2/6/1979 Tulsa Fairgrounds Pavilion, Tulsa, OK</a> [<a href="http://www.archive.org/search.php?query=creator:%22Grateful%20Dead%22%20date:1979-02-06*">Listen/Download</a>]
            </td>
          </tr>
          <tr>
            <td>
              I: Jack Straw, Loser, BIODTL, Peggy-O, All Over Now, China Cat &gt; I Know You Rider, Heart Of Me, Minglewood, Deal
            </td>
          </tr>
          <tr>
            <td>
              II: Miracle &gt; Bertha &gt; Good Lovin, Ship Of Fools, Estimated &gt; Eyes &gt; Drumz &gt; NFA &gt; Black Peter &gt; Around
            </td>
          </tr>
          <tr>
            <td>
              E: Johnny B. Goode
            </td>
          </tr>
          <tr>
            <td>
              Next ''BIODTL'' 12/27/1979 [57 shows]
            </td>
          </tr>
          <tr>
            <td>
              DeadLists has "Stagger Lee" and "Passenger" between "Minglewood" and "Deal," but since no recording of this show is known to exist, the accuracy of that or the rest of the setlist is impossible to determine.
            </td>
          </tr>
        </table>
      </div>
      <div>
        <table border="0" cellspacing="0" cellpadding="0">
          <tr>
            <td id="0207">
              <a href="/1979-02-07">2/7/1979 SIU Arena, U. of Southern Illinois, Carbondale, IL</a> [<a href="http://www.archive.org/search.php?query=creator:%22Grateful%20Dead%22%20date:1979-02-07*">Listen/Download</a>]
            </td>
          </tr>
          <tr>
            <td>
              Don't Ease, Mama Tried &gt; Mexicali, Jack A Roe, L. L. Rain, TLEO, Minglewood, Stagger Lee, Dancin &gt; Drumz &gt; Miracle &gt; Bertha
            </td>
          </tr>
          <tr>
            <td>
              Previous ''Don't Ease'' 8/6/1974 [213 shows]
            </td>
          </tr>
          <tr>
            <td>
              Dead roadie Steve Parish, in his book "Home Before Daylight," cites this as the show where Garcia gobbled four valiums before taking the stage. A gentleman named Tom F. on the Internet Archive claims to have gotten a soundboard master of the first set of this performance two nights later in Kansas City, which is the supposed source of the recording from which the above list originates. Garcia certainly sounds like he is progressively losing it during the set, so it might have made sense for the band to veer into a drum break to give him a chance to straighten up (and he does sound somewhat more together afterwards). What, if anything, happened after "Bertha" (which ends the set and does not segue into "Good Lovin") is unknown. Unfortunately, there are cuts on the recording between "Stagger Lee" and "Dancin," and between "Drumz" and "I Need a Miracle," meaning that there is no conclusive proof that "Dancin" into "Drumz" took place in the opening set and not later.
            </td>
          </tr>
        </table>
      </div>
      <div>
        <table border="0" cellspacing="0" cellpadding="0">
          <tr>
            <td id="0209">
              <a href="/1979-02-09">2/9/1979 Soldiers and Sailors Memorial Hall, Kansas City, KS</a> [<a href="http://www.archive.org/search.php?query=creator:%22Grateful%20Dead%22%20date:1979-02-09*">Listen/Download</a>]
            </td>
          </tr>
          <tr>
            <td>
              I: Promised, Candyman, Cassidy, Tennessee Jed, El Paso, Jack A Roe, L. L. Rain, Stagger Lee, Passenger, China Cat &gt; I Know You Rider
            </td>
          </tr>
          <tr>
            <td>
              II: NFA &gt; Miracle &gt; Bertha &gt; Good Lovin, Heart Of Me, He's Gone &gt; Drumz &gt; Truckin &gt; Comes A Time &gt; Around
            </td>
          </tr>
          <tr>
            <td>
              E: Shakedown
            </td>
          </tr>
          <tr>
            <td>
              Next ''Comes A Time'' 5/10/1980 [71 shows]
            </td>
          </tr>
        </table>
      </div>
      <div>
        <table border="0" cellspacing="0" cellpadding="0">
          <tr>
            <td id="0210">
              <a href="/1979-02-10">2/10/1979 Soldiers and Sailors Memorial Hall, Kansas City, KS</a> [<a href="http://www.archive.org/search.php?query=creator:%22Grateful%20Dead%22%20date:1979-02-10*">Listen/Download</a>]
            </td>
          </tr>
          <tr>
            <td>
              I: Don't Ease, Me and My Uncle &gt; Big River, TLEO, Minglewood, B. E. Women, All Over Now, Deal, Jack Straw
            </td>
          </tr>
          <tr>
            <td>
              II: Scarlet &gt; Fire, Heart Of Me, Estimated &gt; Eyes &gt; Drumz &gt; Other One &gt; Wharf Rat &gt; Sugar Magnolia
            </td>
          </tr>
          <tr>
            <td>
              E1: Saturday Night
            </td>
          </tr>
          <tr>
            <td>
              E2: Miracle
            </td>
          </tr>
        </table>
      </div>
      <div>
        <table border="0" cellspacing="0" cellpadding="0">
          <tr>
            <td id="0211">
              <a href="/1979-02-11">2/11/1979 Kiel Auditorium, St. Louis, MO</a> [<a href="http://www.archive.org/search.php?query=creator:%22Grateful%20Dead%22%20date:1979-02-11*">Listen/Download</a>]
            </td>
          </tr>
          <tr>
            <td>
              I: Promised, Sugaree, Mama Tried &gt; Mexicali, FOTD, Lazy Lightning &gt; Supplication, Might As Well, Music
            </td>
          </tr>
          <tr>
            <td>
              II: Samson, China Cat &gt; I Know You Rider, Heart Of Me, Terrapin &gt; Playin &gt; Drumz &gt; NFA &gt; Stella Blue &gt; Miracle &gt; Good Lovin
            </td>
          </tr>
          <tr>
            <td>
              E: U. S. Blues
            </td>
          </tr>
          <tr>
            <td>
              Previous ''Might As Well'' 11/2/1977 [106 shows]
            </td>
          </tr>
        </table>
      </div>
      <div>
        <table border="0" cellspacing="0" cellpadding="0">
          <tr>
            <td id="0217">
              <a href="/1979-02-17">2/17/1979 Oakland Coliseum Arena, Oakland, CA</a> [<a href="http://www.archive.org/search.php?query=creator:%22Grateful%20Dead%22%20date:1979-02-17*">Listen/Download</a>]
            </td>
          </tr>
          <tr>
            <td>
              I: Greatest, Don't Ease, Mama Tried &gt; Mexicali, FOTD, Passenger, High Time, L. L. Rain, Jack A Roe, Lazy Lightning &gt; Supplication
            </td>
          </tr>
          <tr>
            <td>
              II: Might As Well, Miracle &gt; Bertha &gt; Good Lovin, Heart Of Me, Big RxR Blues, Terrapin &gt; Playin &gt; Space &gt; Drumz &gt; Wheel &gt; Shakedown &gt; Space &gt; Playin &gt; Sugar Magnolia
            </td>
          </tr>
          <tr>
            <td>
              E: Saturday Night
            </td>
          </tr>
          <tr>
            <td>
              Next ''Wheel'' 8/17/1980 [89 shows]; Final ''Heart Of Me''
            </td>
          </tr>
          <tr>
            <td>
              Keith and Donna's last concert. "Rock for Life" benefit to end environmental cancer. House lights stayed on during "Greatest."; Keith Godchaux's Last Show; Donna Jean Godchaux's Last Show
            </td>
          </tr>
        </table>
      </div>
      <div>
        <table border="0" cellspacing="0" cellpadding="0">
          <tr>
            <td id="0416">
              <a href="/1979-04-16">4/16/1979 Le Club Front, San Rafael, CA</a> [<a href="http://www.archive.org/search.php?query=creator:%22Grateful%20Dead%22%20date:1979-04-16*">Listen/Download</a>]
            </td>
          </tr>
          <tr>
            <td>
              jam &gt; NFA &gt; JAM &gt; SPACE &gt; DRUMZ, Passenger x2, Bertha, Good Lovin &gt; Jam, Miracle, Jam, Scarlet &gt; Fire, Space, Gloria &gt; Linda Lu, Jams, Jack Straw
            </td>
          </tr>
          <tr>
            <td>
              Rehearsal.
            </td>
          </tr>
        </table>
      </div>
      <div>
        <table border="0" cellspacing="0" cellpadding="0">
          <tr>
            <td id="0421">
              <a href="/1979-04-21">4/21/1979 Le Club Front, San Rafael, CA</a> [<a href="http://www.archive.org/search.php?query=creator:%22Grateful%20Dead%22%20date:1979-04-21*">Listen/Download</a>]
            </td>
          </tr>
          <tr>
            <td>
              Shakedown
            </td>
          </tr>
          <tr>
            <td>
              Rehearsal.
            </td>
          </tr>
        </table>
      </div>
      <div>
        <table border="0" cellspacing="0" cellpadding="0">
          <tr>
            <td id="0422">
              <a href="/1979-04-22">4/22/1979 Spartan Stadium, San Jose, CA</a> [<a href="http://www.archive.org/search.php?query=creator:%22Grateful%20Dead%22%20date:1979-04-22*">Listen/Download</a>]
            </td>
          </tr>
          <tr>
            <td>
              I: Jack Straw, Tennessee Jed, Mama Tried &gt; Mexicali, Sugaree, Minglewood, B. E. Women, L. L. Rain, Stagger Lee, Passenger, Deal
            </td>
          </tr>
          <tr>
            <td>
              II: Miracle &gt; Bertha &gt; Good Lovin, Scarlet &gt; Fire, Estimated &gt; He's Gone &gt; Drumz &gt; Other One &gt; Wharf Rat &gt; Around
            </td>
          </tr>
          <tr>
            <td>
              E1: U. S. Blues
            </td>
          </tr>
          <tr>
            <td>
              E2: Shakedown
            </td>
          </tr>
          <tr>
            <td>
              Brent Mydland's first concert - billing: GD; Charlie Daniels; Greg Kihn Band; Brent Mydland's First Show
            </td>
          </tr>
        </table>
      </div>
      <div>
        <table border="0" cellspacing="0" cellpadding="0">
          <tr>
            <td id="0503">
              <a href="/1979-05-03">5/3/1979 Charlotte Coliseum, Charlotte, NC</a> [<a href="http://www.archive.org/search.php?query=creator:%22Grateful%20Dead%22%20date:1979-05-03*">Listen/Download</a>]
            </td>
          </tr>
          <tr>
            <td>
              I: Promised, B. E. Women, Me and My Uncle &gt; Big River, Stagger Lee, L. L. Rain, Row Jimmy, All Over Now, Deal
            </td>
          </tr>
          <tr>
            <td>
              II: Samson, Tennessee Jed, Terrapin &gt; Playin &gt; Drumz &gt; Black Peter &gt; NFA &gt; Playin
            </td>
          </tr>
          <tr>
            <td>
              E: U. S. Blues
            </td>
          </tr>
        </table>
      </div>
      <div>
        <table border="0" cellspacing="0" cellpadding="0">
          <tr>
            <td id="0504">
              <a href="/1979-05-04">5/4/1979 Hampton Coliseum, Hampton, VA</a> [<a href="http://www.archive.org/search.php?query=creator:%22Grateful%20Dead%22%20date:1979-05-04*">Listen/Download</a>]
            </td>
          </tr>
          <tr>
            <td>
              I: Half Step &gt; Franklin's, Mama Tried &gt; Mexicali, Candyman, Lazy Lightning &gt; Supplication, Loser, Minglewood, Don't Ease, Passenger
            </td>
          </tr>
          <tr>
            <td>
              II: Miracle &gt; Bertha &gt; Good Lovin, Ship Of Fools, Estimated &gt; Eyes &gt; Drumz &gt; Truckin &gt; Stella Blue &gt; Around
            </td>
          </tr>
        </table>
      </div>
      <div>
        <table border="0" cellspacing="0" cellpadding="0">
          <tr>
            <td id="0505">
              <a href="/1979-05-05">5/5/1979 Baltimore Civic Center, Baltimore, MD</a> [<a href="http://www.archive.org/search.php?query=creator:%22Grateful%20Dead%22%20date:1979-05-05*">Listen/Download</a>]
            </td>
          </tr>
          <tr>
            <td>
              I: Jack Straw, Sugaree, El Paso, FOTD, All Over Now, Tennessee Jed, Dancin
            </td>
          </tr>
          <tr>
            <td>
              II: Scarlet &gt; Fire, Samson, He's Gone &gt; Drumz &gt; Other One &gt; Wharf Rat &gt; Sugar Magnolia
            </td>
          </tr>
          <tr>
            <td>
              E: Saturday Night
            </td>
          </tr>
        </table>
      </div>
      <div>
        <table border="0" cellspacing="0" cellpadding="0">
          <tr>
            <td id="0507">
              <a href="/1979-05-07">5/7/1979 Kirby Fieldhouse, Lafayette College, Easton, PA</a> [<a href="http://www.archive.org/search.php?query=creator:%22Grateful%20Dead%22%20date:1979-05-07*">Listen/Download</a>]
            </td>
          </tr>
          <tr>
            <td>
              I: Don't Ease, Me and My Uncle &gt; Big River, Candyman, L. L. Rain, Tennessee Jed, Minglewood, Peggy-O, Passenger
            </td>
          </tr>
          <tr>
            <td>
              II: Shakedown, Jack Straw, Stagger Lee, Estimated &gt; Eyes &gt; Drumz &gt; NFA* &gt; Black Peter* &gt; Around*
            </td>
          </tr>
          <tr>
            <td>
              E: U. S. Blues
            </td>
          </tr>
          <tr>
            <td>
              Bill Kreutzmann's 33rd birthday. *with John Cipollina.
            </td>
          </tr>
        </table>
      </div>
      <div>
        <table border="0" cellspacing="0" cellpadding="0">
          <tr>
            <td id="0508">
              <a href="/1979-05-08">5/8/1979 Recreation Hall, Penn. State U., State College, PA</a> [<a href="http://www.archive.org/search.php?query=creator:%22Grateful%20Dead%22%20date:1979-05-08*">Listen/Download</a>]
            </td>
          </tr>
          <tr>
            <td>
              I: Promised, TLEO, Mama Tried &gt; Mexicali, B. E. Women, All Over Now, Row Jimmy, El Paso, Stagger Lee, Lazy Lightning &gt; Supplication, Deal
            </td>
          </tr>
          <tr>
            <td>
              II: Scarlet &gt; Fire, Samson, Terrapin &gt; Playin &gt; Drumz &gt; Other One &gt; China Doll &gt; Playin &gt; Good Lovin
            </td>
          </tr>
          <tr>
            <td>
              E: Shakedown
            </td>
          </tr>
          <tr>
            <td>
              Next ''China Doll'' 9/26/1980 [99 shows]
            </td>
          </tr>
          <tr>
            <td>
              Soundcheck: China Doll (2x))*
            </td>
          </tr>
        </table>
      </div>
      <div>
        <table border="0" cellspacing="0" cellpadding="0">
          <tr>
            <td id="0509">
              <a href="/1979-05-09">5/9/1979 Broome County Arena, Binghamton, NY</a> [<a href="http://www.archive.org/search.php?query=creator:%22Grateful%20Dead%22%20date:1979-05-09*">Listen/Download</a>]
            </td>
          </tr>
          <tr>
            <td>
              I: Sugaree, Me and My Uncle, Loser, Minglewood, FOTD, L. L. Rain, Stagger Lee, Jack Straw
            </td>
          </tr>
          <tr>
            <td>
              II: China Cat &gt; I Know You Rider, He's Gone &gt; Truckin &gt; Drumz &gt; Wharf Rat &gt; Sugar Magnolia
            </td>
          </tr>
          <tr>
            <td>
              E: Johnny B. Goode
            </td>
          </tr>
          <tr>
            <td>
              "Around" intro before "Sugar Magnolia."
            </td>
          </tr>
        </table>
      </div>
      <div>
        <table border="0" cellspacing="0" cellpadding="0">
          <tr>
            <td id="0511">
              <a href="/1979-05-11">5/11/1979 Billerica Forum, Billerica, MA</a> [<a href="http://www.archive.org/search.php?query=creator:%22Grateful%20Dead%22%20date:1979-05-11*">Listen/Download</a>]
            </td>
          </tr>
          <tr>
            <td>
              I: Half Step &gt; Franklin's, Mama Tried &gt; Mexicali, Peggy-O, All Over Now, B. E. Women, Lazy Lightning &gt; Supplication
            </td>
          </tr>
          <tr>
            <td>
              II: Shakedown, Passenger, Ship Of Fools, Estimated &gt; Eyes &gt; Drumz &gt; Black Peter &gt; Miracle &gt; Bertha &gt; Good Lovin
            </td>
          </tr>
        </table>
      </div>
      <div>
        <table border="0" cellspacing="0" cellpadding="0">
          <tr>
            <td id="0512">
              <a href="/1979-05-12">5/12/1979 Alumni Stadium, U. of Massachusetts, Amherst, MA</a> [<a href="http://www.archive.org/search.php?query=creator:%22Grateful%20Dead%22%20date:1979-05-12*">Listen/Download</a>]
            </td>
          </tr>
          <tr>
            <td>
              I: Jack Straw, TLEO, Me and My Uncle &gt; Big River, Tennessee Jed, Minglewood, Stagger Lee, L. L. Rain, Deal
            </td>
          </tr>
          <tr>
            <td>
              II: Don't Ease, Samson, FOTD, Terrapin &gt; Playin &gt; Drumz &gt; NFA &gt; Stella Blue &gt; Good Lovin
            </td>
          </tr>
          <tr>
            <td>
              E: Shakedown &gt; Saturday Night
            </td>
          </tr>
          <tr>
            <td>
              Roy Ayers Ubiquity, then Patti Smith opened
            </td>
          </tr>
        </table>
      </div>
      <div>
        <table border="0" cellspacing="0" cellpadding="0">
          <tr>
            <td id="0513">
              <a href="/1979-05-13">5/13/1979 Cumberland County Civic Center, Portland, ME</a> [<a href="http://www.archive.org/search.php?query=creator:%22Grateful%20Dead%22%20date:1979-05-13*">Listen/Download</a>]
            </td>
          </tr>
          <tr>
            <td>
              I: Sugaree, Mama Tried &gt; Mexicali, Jack A Roe, All Over Now, Candyman, El Paso, Row Jimmy, Jack Straw
            </td>
          </tr>
          <tr>
            <td>
              II: Scarlet &gt; Fire, Estimated &gt; He's Gone &gt; Truckin &gt; Drumz &gt; Wharf Rat &gt; Around
            </td>
          </tr>
          <tr>
            <td>
              E: U. S. Blues
            </td>
          </tr>
        </table>
      </div>
      <div>
        <table border="0" cellspacing="0" cellpadding="0">
          <tr>
            <td id="0628">
              <a href="/1979-06-28">6/28/1979 Sacramento Memorial Auditorium, Sacramento, CA</a> [<a href="http://www.archive.org/search.php?query=creator:%22Grateful%20Dead%22%20date:1979-06-28*">Listen/Download</a>]
            </td>
          </tr>
          <tr>
            <td>
              I: Don't Ease, Minglewood, TLEO, Mama Tried &gt; Mexicali, Peggy-O, All Over Now, Stagger Lee, Passenger, Loser, Music
            </td>
          </tr>
          <tr>
            <td>
              II: Scarlet &gt; Fire, Samson, Ship Of Fools, Playin &gt; Eyes &gt; Drumz &gt; NFA &gt; Black Peter &gt; Around
            </td>
          </tr>
          <tr>
            <td>
              E: U. S. Blues
            </td>
          </tr>
        </table>
      </div>
      <div>
        <table border="0" cellspacing="0" cellpadding="0">
          <tr>
            <td id="0630">
              <a href="/1979-06-30">6/30/1979 Portland International Raceway, Portland, OR</a> [<a href="http://www.archive.org/search.php?query=creator:%22Grateful%20Dead%22%20date:1979-06-30*">Listen/Download</a>]
            </td>
          </tr>
          <tr>
            <td>
              I: Jack Straw, Candyman, Me and My Uncle &gt; Big River, Tennessee Jed, L. L. Rain, Deal
            </td>
          </tr>
          <tr>
            <td>
              II: Miracle &gt; Bertha &gt; Good Lovin, FOTD, Estimated &gt; He's Gone &gt; Drumz &gt; Other One &gt; Wharf Rat &gt; Sugar Magnolia
            </td>
          </tr>
          <tr>
            <td>
              E: Saturday Night
            </td>
          </tr>
          <tr>
            <td>
              Also: McGuinn, Clark and Hillman; David Bromberg.
            </td>
          </tr>
        </table>
      </div>
      <div>
        <table border="0" cellspacing="0" cellpadding="0">
          <tr>
            <td id="06xx">
              <a href="/1979-06-xx">6/xx/1979 Le Club Front, San Rafael, CA</a> [<a href="http://www.archive.org/search.php?query=creator:%22Grateful%20Dead%22%20date:1979-06-xx*">Listen/Download</a>]
            </td>
          </tr>
          <tr>
            <td>
              Dancin
            </td>
          </tr>
          <tr>
            <td>
              Rehearsal.
            </td>
          </tr>
        </table>
      </div>
      <div>
        <table border="0" cellspacing="0" cellpadding="0">
          <tr>
            <td id="0701">
              <a href="/1979-07-01">7/1/1979 Seattle Center Memorial Coliseum, Seattle, WA</a> [<a href="http://www.archive.org/search.php?query=creator:%22Grateful%20Dead%22%20date:1979-07-01*">Listen/Download</a>]
            </td>
          </tr>
          <tr>
            <td>
              I: Half Step &gt; Franklin's, Mama Tried &gt; Mexicali, Peggy-O, Minglewood, Stagger Lee, El Paso, B. E. Women, Passenger
            </td>
          </tr>
          <tr>
            <td>
              II: Don't Ease, Samson, Sugaree, Terrapin &gt; Playin &gt; Drumz &gt; Stella Blue &gt; Truckin &gt; Around
            </td>
          </tr>
          <tr>
            <td>
              E: Shakedown
            </td>
          </tr>
        </table>
      </div>
      <div>
        <table border="0" cellspacing="0" cellpadding="0">
          <tr>
            <td id="0714">
              <a href="/1979-07-14">7/14/1979 Le Club Front, San Rafael, CA</a> [<a href="http://www.archive.org/search.php?query=creator:%22Grateful%20Dead%22%20date:1979-07-14*">Listen/Download</a>]
            </td>
          </tr>
          <tr>
            <td>
              Jack A Roe
            </td>
          </tr>
          <tr>
            <td>
              Rehearsal. Appears as a "Go to Heaven" bonus track in "Beyond Description (1973-1989)."
            </td>
          </tr>
        </table>
      </div>
      <div>
        <table border="0" cellspacing="0" cellpadding="0">
          <tr>
            <td id="0716">
              <a href="/1979-07-16">7/16/1979 Le Club Front, San Rafael, CA</a> [<a href="http://www.archive.org/search.php?query=creator:%22Grateful%20Dead%22%20date:1979-07-16*">Listen/Download</a>]
            </td>
          </tr>
          <tr>
            <td>
              What'll You Raise, Peggy-O
            </td>
          </tr>
          <tr>
            <td>
              Rehearsal. Appear as a "Go to Heaven" bonus tracks in "Beyond Description (1973-1989)."
            </td>
          </tr>
        </table>
      </div>
      <div>
        <table border="0" cellspacing="0" cellpadding="0">
          <tr>
            <td id="07xx">
              <a href="/1979-07-xx">7/xx/1979 Le Club Front, San Rafael, CA</a> [<a href="http://www.archive.org/search.php?query=creator:%22Grateful%20Dead%22%20date:1979-07-xx*">Listen/Download</a>]
            </td>
          </tr>
          <tr>
            <td>
              Easy To Love You, Sailor, Easy To Love You, Althea, Saint, Sailor x3, Don't Ease, Saint, Far From Me, Stranger x2, Easy To Love You, Alabama, Far From Me, Althea
            </td>
          </tr>
          <tr>
            <td>
              Rehearsals. The above was recorded over a period of about July through November 1979.
            </td>
          </tr>
        </table>
      </div>
      <div>
        <table border="0" cellspacing="0" cellpadding="0">
          <tr>
            <td id="0804">
              <a href="/1979-08-04">8/4/1979 Oakland Auditorium Arena, Oakland, CA</a> [<a href="http://www.archive.org/search.php?query=creator:%22Grateful%20Dead%22%20date:1979-08-04*">Listen/Download</a>]
            </td>
          </tr>
          <tr>
            <td>
              I: Jack Straw, TLEO, Mama Tried &gt; Mexicali, Peggy-O, Minglewood, Tennessee Jed, El Paso, Althea, Sailor &gt; Deal
            </td>
          </tr>
          <tr>
            <td>
              II: Passenger, FOTD, Samson, Shakedown &gt; Playin &gt; Drumz &gt; Stella Blue &gt; Sugar Magnolia
            </td>
          </tr>
          <tr>
            <td>
              E: U. S. Blues
            </td>
          </tr>
          <tr>
            <td>
              First ''Althea''; First ''Sailor''
            </td>
          </tr>
        </table>
      </div>
      <div>
        <table border="0" cellspacing="0" cellpadding="0">
          <tr>
            <td id="0805">
              <a href="/1979-08-05">8/5/1979 Oakland Auditorium Arena, Oakland, CA</a> [<a href="http://www.archive.org/search.php?query=creator:%22Grateful%20Dead%22%20date:1979-08-05*">Listen/Download</a>]
            </td>
          </tr>
          <tr>
            <td>
              I: Half Step &gt; Franklin's &gt; Me and My Uncle &gt; Big River, Candyman, All Over Now, B. E. Women, Sailor &gt; Althea &gt; Promised
            </td>
          </tr>
          <tr>
            <td>
              II: Scarlet &gt; Fire, Estimated &gt; Eyes &gt; Drumz &gt; Ollin Arageed* &gt; NFA &gt; Wharf Rat &gt; Around
            </td>
          </tr>
          <tr>
            <td>
              E1: Bertha &gt; Good Lovin
            </td>
          </tr>
          <tr>
            <td>
              E2: Johnny B. Goode
            </td>
          </tr>
          <tr>
            <td>
              Next ''Ollin Arageed'' 3/13/1985 [406 shows]
            </td>
          </tr>
          <tr>
            <td>
              *with Hamza El-Din.
            </td>
          </tr>
        </table>
      </div>
      <div>
        <table border="0" cellspacing="0" cellpadding="0">
          <tr>
            <td id="0812">
              <a href="/1979-08-12">8/12/1979 Red Rocks Amphitheatre, Morrison, CO</a> [<a href="http://www.archive.org/search.php?query=creator:%22Grateful%20Dead%22%20date:1979-08-12*">Listen/Download</a>]
            </td>
          </tr>
          <tr>
            <td>
              I: Promised, TLEO, Mama Tried &gt; Mexicali, Peggy-O, Lazy Lightning &gt; Supplication, B. E. Women, L. L. Rain, Althea &gt; Passenger
            </td>
          </tr>
          <tr>
            <td>
              II: China Cat &gt; I Know You Rider, Sailor, Don't Ease, Estimated * &gt; Eyes &gt; Drumz &gt; NFA &gt; Black Peter &gt; Around
            </td>
          </tr>
          <tr>
            <td>
              E: U. S. Blues
            </td>
          </tr>
          <tr>
            <td>
              *appears on "So Many Roads (1965-1995)."
            </td>
          </tr>
        </table>
      </div>
      <div>
        <table border="0" cellspacing="0" cellpadding="0">
          <tr>
            <td id="0813">
              <a href="/1979-08-13">8/13/1979 McNichols Sports Arena, Denver, CO</a> [<a href="http://www.archive.org/search.php?query=creator:%22Grateful%20Dead%22%20date:1979-08-13*">Listen/Download</a>]
            </td>
          </tr>
          <tr>
            <td>
              I: Shakedown *, Me and My Uncle &gt; Big River, Candyman, El Paso, FOTD, Minglewood, Althea, Sailor &gt; Deal
            </td>
          </tr>
          <tr>
            <td>
              II: Miracle &gt; Bertha &gt; Good Lovin, He's Gone &gt; Other One &gt; Drumz &gt; Wharf Rat &gt; Truckin &gt; Nobody's Jam &gt; Truckin
            </td>
          </tr>
          <tr>
            <td>
              E: Sugar Magnolia
            </td>
          </tr>
          <tr>
            <td>
              *appears on the "Beyond Description (1973-1989)" bonus disc.
            </td>
          </tr>
        </table>
      </div>
      <div>
        <table border="0" cellspacing="0" cellpadding="0">
          <tr>
            <td id="0813">
              <a href="/1979-08-13">8/13/1979 Red Rocks Amphitheatre, Morrison, CO</a> [<a href="http://www.archive.org/search.php?query=creator:%22Grateful%20Dead%22%20date:1979-08-13*">Listen/Download</a>]
            </td>
          </tr>
          <tr>
            <td></td>
          </tr>
          <tr>
            <td>
              Moved to McNichols Arena due to rain.
            </td>
          </tr>
        </table>
      </div>
      <div>
        <table border="0" cellspacing="0" cellpadding="0">
          <tr>
            <td id="0814">
              <a href="/1979-08-14">8/14/1979 McNichols Sports Arena, Denver, CO</a> [<a href="http://www.archive.org/search.php?query=creator:%22Grateful%20Dead%22%20date:1979-08-14*">Listen/Download</a>]
            </td>
          </tr>
          <tr>
            <td>
              I: Jack Straw, Jack A Roe, Mama Tried &gt; Mexicali, Tennessee Jed, Easy To Love You, Passenger, Stagger Lee, Music
            </td>
          </tr>
          <tr>
            <td>
              II: Promised, Ship Of Fools, Samson, Terrapin &gt; Playin &gt; Drumz &gt; NFA &gt; Stella Blue &gt; Good Lovin
            </td>
          </tr>
          <tr>
            <td>
              E: U. S. Blues &gt; Johnny B. Goode
            </td>
          </tr>
          <tr>
            <td>
              First ''Easy To Love You''
            </td>
          </tr>
        </table>
      </div>
      <div>
        <table border="0" cellspacing="0" cellpadding="0">
          <tr>
            <td id="0814">
              <a href="/1979-08-14">8/14/1979 Red Rocks Amphitheatre, Morrison, CO</a> [<a href="http://www.archive.org/search.php?query=creator:%22Grateful%20Dead%22%20date:1979-08-14*">Listen/Download</a>]
            </td>
          </tr>
          <tr>
            <td></td>
          </tr>
          <tr>
            <td>
              Moved to McNichols Arena due to rain.
            </td>
          </tr>
        </table>
      </div>
      <div>
        <table border="0" cellspacing="0" cellpadding="0">
          <tr>
            <td id="0831">
              <a href="/1979-08-31">8/31/1979 Glens Falls Civic Center, Glens Falls, NY</a> [<a href="http://www.archive.org/search.php?query=creator:%22Grateful%20Dead%22%20date:1979-08-31*">Listen/Download</a>]
            </td>
          </tr>
          <tr>
            <td>
              I: Promised, Dire Wolf, Cassidy, Loser, El Paso, Peggy-O, Easy To Love You, Minglewood, Althea, Sailor &gt; Saint &gt; Deal
            </td>
          </tr>
          <tr>
            <td>
              II: Shakedown, Greatest, Ship Of Fools, Estimated &gt; Eyes &gt; Drumz &gt; NFA &gt; Black Peter &gt; Around
            </td>
          </tr>
          <tr>
            <td>
              First ''Saint''
            </td>
          </tr>
        </table>
      </div>
      <div>
        <table border="0" cellspacing="0" cellpadding="0">
          <tr>
            <td id="0901">
              <a href="/1979-09-01">9/1/1979 Holleder Memorial Stadium, Rochester, NY</a> [<a href="http://www.archive.org/search.php?query=creator:%22Grateful%20Dead%22%20date:1979-09-01*">Listen/Download</a>]
            </td>
          </tr>
          <tr>
            <td>
              I: Half Step &gt; Franklin's, Me and My Uncle &gt; Big River, FOTD, L. L. Rain, Don't Ease, Sailor &gt; Saint
            </td>
          </tr>
          <tr>
            <td>
              II: Scarlet &gt; Fire &gt; Drumz &gt; Wharf Rat &gt; Miracle &gt; Bertha &gt; Good Lovin
            </td>
          </tr>
          <tr>
            <td>
              E: Saturday Night
            </td>
          </tr>
          <tr>
            <td>
              Greg Kihn, then Good Rats opened.
            </td>
          </tr>
        </table>
      </div>
      <div>
        <table border="0" cellspacing="0" cellpadding="0">
          <tr>
            <td id="0902">
              <a href="/1979-09-02">9/2/1979 Augusta Civic Center, Augusta, ME</a> [<a href="http://www.archive.org/search.php?query=creator:%22Grateful%20Dead%22%20date:1979-09-02*">Listen/Download</a>]
            </td>
          </tr>
          <tr>
            <td>
              I: Jack Straw, TLEO, Mama Tried &gt; Mexicali, Stagger Lee, Cassidy, Row Jimmy, Minglewood, Jack A Roe, Music
            </td>
          </tr>
          <tr>
            <td>
              II: Samson, Ramble On, Terrapin &gt; Let It Grow &gt; Drumz &gt; Stella Blue &gt; Truckin &gt; Nobody's Jam &gt; Around
            </td>
          </tr>
          <tr>
            <td>
              E: U. S. Blues
            </td>
          </tr>
          <tr>
            <td>
              Previous ''Let It Grow'' 5/14/1978 [82 shows]
            </td>
          </tr>
        </table>
      </div>
      <div>
        <table border="0" cellspacing="0" cellpadding="0">
          <tr>
            <td id="0904">
              <a href="/1979-09-04">9/4/1979 Madison Square Garden, New York, NY</a> [<a href="http://www.archive.org/search.php?query=creator:%22Grateful%20Dead%22%20date:1979-09-04*">Listen/Download</a>]
            </td>
          </tr>
          <tr>
            <td>
              I: Jack Straw, Sugaree, Me and My Uncle &gt; Big River, Candyman, Minglewood, Tennessee Jed, Sailor &gt; Saint &gt; Deal
            </td>
          </tr>
          <tr>
            <td>
              II: China Cat &gt; I Know You Rider, L. L. Rain, He's Gone &gt; Drumz &gt; Wharf Rat &gt; Around
            </td>
          </tr>
          <tr>
            <td>
              E: Shakedown
            </td>
          </tr>
        </table>
      </div>
      <div>
        <table border="0" cellspacing="0" cellpadding="0">
          <tr>
            <td id="0905">
              <a href="/1979-09-05">9/5/1979 Madison Square Garden, New York, NY</a> [<a href="http://www.archive.org/search.php?query=creator:%22Grateful%20Dead%22%20date:1979-09-05*">Listen/Download</a>]
            </td>
          </tr>
          <tr>
            <td>
              I: Half Step &gt; Franklin's, Mama Tried &gt; Mexicali, Peggy-O, Cassidy, Loser, Promised
            </td>
          </tr>
          <tr>
            <td>
              II: Scarlet &gt; Fire, Estimated &gt; Eyes &gt; Drumz &gt; Black Peter &gt; Miracle &gt; Bertha &gt; Good Lovin
            </td>
          </tr>
          <tr>
            <td>
              E: U. S. Blues
            </td>
          </tr>
        </table>
      </div>
      <div>
        <table border="0" cellspacing="0" cellpadding="0">
          <tr>
            <td id="0906">
              <a href="/1979-09-06">9/6/1979 Madison Square Garden, New York, NY</a> [<a href="http://www.archive.org/search.php?query=creator:%22Grateful%20Dead%22%20date:1979-09-06*">Listen/Download</a>]
            </td>
          </tr>
          <tr>
            <td>
              I: Minglewood, Dire Wolf, El Paso, B. E. Women, All Over Now, Don't Ease, L. L. Rain, Althea, Sailor &gt; Saint
            </td>
          </tr>
          <tr>
            <td>
              II: China Cat &gt; I Know You Rider, Easy To Love You, Ramble On, Terrapin &gt; Playin &gt; Drumz &gt; NFA &gt; Stella Blue &gt; Sugar Magnolia
            </td>
          </tr>
          <tr>
            <td>
              E: Johnny B. Goode
            </td>
          </tr>
        </table>
      </div>
      <div>
        <table border="0" cellspacing="0" cellpadding="0">
          <tr>
            <td id="1024">
              <a href="/1979-10-24">10/24/1979 Springfield Civic Center Arena, Springfield, MA</a> [<a href="http://www.archive.org/search.php?query=creator:%22Grateful%20Dead%22%20date:1979-10-24*">Listen/Download</a>]
            </td>
          </tr>
          <tr>
            <td>
              I: Promised, Loser, Mama Tried &gt; Mexicali, TLEO, Minglewood, Dire Wolf, Easy To Love You, Sailor &gt; Saint
            </td>
          </tr>
          <tr>
            <td>
              II: Scarlet &gt; Fire, Samson, Terrapin &gt; Playin &gt; Drumz &gt; Wharf Rat &gt; Playin
            </td>
          </tr>
          <tr>
            <td>
              E: Johnny B. Goode
            </td>
          </tr>
        </table>
      </div>
      <div>
        <table border="0" cellspacing="0" cellpadding="0">
          <tr>
            <td id="1025">
              <a href="/1979-10-25">10/25/1979 Veterans Memorial Coliseum, New Haven, CT</a> [<a href="http://www.archive.org/search.php?query=creator:%22Grateful%20Dead%22%20date:1979-10-25*">Listen/Download</a>]
            </td>
          </tr>
          <tr>
            <td>
              I: Don't Ease, Cassidy, Peggy-O, El Paso, B. E. Women, All Over Now, Tennessee Jed, L. L. Rain, Deal
            </td>
          </tr>
          <tr>
            <td>
              II: Shakedown *, Passenger, FOTD, Estimated &gt; Eyes &gt; Drumz &gt; Stella Blue &gt; Good Lovin
            </td>
          </tr>
          <tr>
            <td>
              E: U. S. Blues
            </td>
          </tr>
          <tr>
            <td>
              *appears on "Road Trips Vol. 1 No. 1."
            </td>
          </tr>
        </table>
      </div>
      <div>
        <table border="0" cellspacing="0" cellpadding="0">
          <tr>
            <td id="1027">
              <a href="/1979-10-27">10/27/1979 Cape Cod Coliseum, South Yarmouth, MA</a> [<a href="http://www.archive.org/search.php?query=creator:%22Grateful%20Dead%22%20date:1979-10-27*">Listen/Download</a>]
            </td>
          </tr>
          <tr>
            <td>
              I: Jack Straw, Candyman, Me and My Uncle &gt; Big River, B. E. Women, Easy To Love You, Minglewood, Stagger Lee, Sailor &gt; Saint &gt; Deal
            </td>
          </tr>
          <tr>
            <td>
              II: Dancin &gt; Franklin's, He's Gone &gt; Caution Jam &gt; Other One &gt; Drumz &gt; NFA &gt; Black Peter &gt; Around
            </td>
          </tr>
          <tr>
            <td>
              E: Saturday Night
            </td>
          </tr>
        </table>
      </div>
      <div>
        <table border="0" cellspacing="0" cellpadding="0">
          <tr>
            <td id="1028">
              <a href="/1979-10-28">10/28/1979 Cape Cod Coliseum, South Yarmouth, MA</a> [<a href="http://www.archive.org/search.php?query=creator:%22Grateful%20Dead%22%20date:1979-10-28*">Listen/Download</a>]
            </td>
          </tr>
          <tr>
            <td>
              I: Half Step &gt; Franklin's, Mama Tried &gt; Mexicali, Althea, Passenger, Ramble On, Music
            </td>
          </tr>
          <tr>
            <td>
              II: China Cat &gt; I Know You Rider, Samson, Ship Of Fools, Playin &gt; Drumz &gt; Stella Blue &gt; Sugar Magnolia
            </td>
          </tr>
          <tr>
            <td>
              E: U. S. Blues
            </td>
          </tr>
        </table>
      </div>
      <div>
        <table border="0" cellspacing="0" cellpadding="0">
          <tr>
            <td id="1029">
              <a href="/1979-10-29">10/29/1979 Capitol Theatre, Passaic, NJ</a> [<a href="http://www.archive.org/search.php?query=creator:%22Grateful%20Dead%22%20date:1979-10-29*">Listen/Download</a>]
            </td>
          </tr>
          <tr>
            <td></td>
          </tr>
        </table>
      </div>
      <div>
        <table border="0" cellspacing="0" cellpadding="0">
          <tr>
            <td id="1031">
              <a href="/1979-10-31">10/31/1979 Nassau Veterans Memorial Coliseum, Uniondale, NY</a> [<a href="http://www.archive.org/search.php?query=creator:%22Grateful%20Dead%22%20date:1979-10-31*">Listen/Download</a>]
            </td>
          </tr>
          <tr>
            <td>
              I: China Cat * &gt; I Know You Rider *, Cassidy, Loser, Me and My Uncle &gt; Big River, Althea *, Sailor &gt; Saint
            </td>
          </tr>
          <tr>
            <td>
              II: Shakedown, Passenger, Ramble On, Estimated &gt; Eyes &gt; Drumz &gt; Wharf Rat &gt; Truckin
            </td>
          </tr>
          <tr>
            <td>
              E: Johnny B. Goode
            </td>
          </tr>
          <tr>
            <td>
              "Take A Step Back" before "Me and My Uncle" and before "Althea." *appears on the "Road Trips Vol. 1 No. 1" bonus disc.
            </td>
          </tr>
        </table>
      </div>
      <div>
        <table border="0" cellspacing="0" cellpadding="0">
          <tr>
            <td id="1101">
              <a href="/1979-11-01">11/1/1979 Nassau Veterans Memorial Coliseum, Uniondale, NY</a> [<a href="http://www.archive.org/search.php?query=creator:%22Grateful%20Dead%22%20date:1979-11-01*">Listen/Download</a>]
            </td>
          </tr>
          <tr>
            <td>
              I: Jack Straw, TLEO, Mama Tried &gt; Mexicali, Peggy-O, Minglewood, Candyman, L. L. Rain, Don't Ease, Easy To Love You, Promised
            </td>
          </tr>
          <tr>
            <td>
              II: Scarlet * &gt; Fire *, Samson, Terrapin &gt; Playin &gt; Drumz &gt; Black Peter &gt; Good Lovin
            </td>
          </tr>
          <tr>
            <td>
              E: U. S. Blues
            </td>
          </tr>
          <tr>
            <td>
              *appears as a hidden track on "Dicks Picks Volume 13."
            </td>
          </tr>
        </table>
      </div>
      <div>
        <table border="0" cellspacing="0" cellpadding="0">
          <tr>
            <td id="1102">
              <a href="/1979-11-02">11/2/1979 Nassau Veterans Memorial Coliseum, Uniondale, NY</a> [<a href="http://www.archive.org/search.php?query=creator:%22Grateful%20Dead%22%20date:1979-11-02*">Listen/Download</a>]
            </td>
          </tr>
          <tr>
            <td>
              I: Half Step &gt; Franklin's, El Paso &gt; Mexicali, Tennessee Jed, Lazy Lightning &gt; Supplication, Deal
            </td>
          </tr>
          <tr>
            <td>
              II: Miracle &gt; Bertha &gt; Sailor &gt; Saint &gt; Jam &gt; Drumz &gt; NFA &gt; Stella Blue &gt; Sugar Magnolia
            </td>
          </tr>
          <tr>
            <td>
              E: Casey Jones
            </td>
          </tr>
        </table>
      </div>
      <div>
        <table border="0" cellspacing="0" cellpadding="0">
          <tr>
            <td id="1104">
              <a href="/1979-11-04">11/4/1979 Providence Civic Center, Providence, RI</a> [<a href="http://www.archive.org/search.php?query=creator:%22Grateful%20Dead%22%20date:1979-11-04*">Listen/Download</a>]
            </td>
          </tr>
          <tr>
            <td>
              I: Minglewood, TLEO, Me and My Uncle &gt; Big River, Althea, Easy To Love You, B. E. Women, Sailor &gt; Saint &gt; Deal
            </td>
          </tr>
          <tr>
            <td>
              II: Alabama &gt; Greatest, Ship Of Fools, Estimated &gt; He's Gone &gt; Drumz &gt; Other One &gt; Wharf Rat &gt; Around
            </td>
          </tr>
          <tr>
            <td>
              E: U. S. Blues
            </td>
          </tr>
          <tr>
            <td>
              First ''Alabama''
            </td>
          </tr>
        </table>
      </div>
      <div>
        <table border="0" cellspacing="0" cellpadding="0">
          <tr>
            <td id="1105">
              <a href="/1979-11-05">11/5/1979 The Spectrum, Philadelphia, PA</a> [<a href="http://www.archive.org/search.php?query=creator:%22Grateful%20Dead%22%20date:1979-11-05*">Listen/Download</a>]
            </td>
          </tr>
          <tr>
            <td>
              I: China Cat &gt; I Know You Rider, Cassidy, FOTD, El Paso, Stagger Lee, Passenger, Peggy-O, Music
            </td>
          </tr>
          <tr>
            <td>
              II: Althea, Easy To Love You, Eyes &gt; Estimated &gt; Franklin's &gt; Drumz &gt; Sailor &gt; Saint &gt; Sugar Magnolia
            </td>
          </tr>
          <tr>
            <td>
              E: Casey Jones
            </td>
          </tr>
          <tr>
            <td>
              Entire show released as "Road Trips Download: Philadelphia, Nov 5, 1979."
            </td>
          </tr>
        </table>
      </div>
      <div>
        <table border="0" cellspacing="0" cellpadding="0">
          <tr>
            <td id="1106">
              <a href="/1979-11-06">11/6/1979 The Spectrum, Philadelphia, PA</a> [<a href="http://www.archive.org/search.php?query=creator:%22Grateful%20Dead%22%20date:1979-11-06*">Listen/Download</a>]
            </td>
          </tr>
          <tr>
            <td>
              I: Alabama &gt; Promised, Tennessee Jed, Me and My Uncle &gt; Mexicali, Candyman, Easy To Love You, L. L. Rain, Jack A Roe, Jack Straw * &gt; Deal *
            </td>
          </tr>
          <tr>
            <td>
              II: Terrapin * &gt; Playin * &gt; Drumz &gt; Black Peter &gt; Good Lovin
            </td>
          </tr>
          <tr>
            <td>
              E: U. S. Blues
            </td>
          </tr>
          <tr>
            <td>
              *appears on "Road Trips Vol. 1 No. 1." Entire show released as "Road Trips Download: Philadelphia, Nov 6, 1979."
            </td>
          </tr>
        </table>
      </div>
      <div>
        <table border="0" cellspacing="0" cellpadding="0">
          <tr>
            <td id="1108">
              <a href="/1979-11-08">11/8/1979 Capital Centre, Landover, MD</a> [<a href="http://www.archive.org/search.php?query=creator:%22Grateful%20Dead%22%20date:1979-11-08*">Listen/Download</a>]
            </td>
          </tr>
          <tr>
            <td>
              I: Minglewood, Stagger Lee, Mama Tried &gt; Mexicali, China Cat &gt; I Know You Rider, All Over Now, Don't Ease, L. L. Rain &gt; Deal
            </td>
          </tr>
          <tr>
            <td>
              II: Scarlet &gt; Fire, Sailor + &gt; Saint + &gt; Jam + &gt; Drumz &gt; NFA * &gt; Morning Dew *
            </td>
          </tr>
          <tr>
            <td>
              E: Johnny B. Goode
            </td>
          </tr>
          <tr>
            <td>
              Previous ''Morning Dew'' 4/15/1978 [110 shows]
            </td>
          </tr>
          <tr>
            <td>
              *appears on "Road Trips Vol. 1 No. 1." +appears on the "Road Trips Vol. 1 No. 1" bonus disc.
            </td>
          </tr>
        </table>
      </div>
      <div>
        <table border="0" cellspacing="0" cellpadding="0">
          <tr>
            <td id="1109">
              <a href="/1979-11-09">11/9/1979 War Memorial Auditorium, Buffalo, NY</a> [<a href="http://www.archive.org/search.php?query=creator:%22Grateful%20Dead%22%20date:1979-11-09*">Listen/Download</a>]
            </td>
          </tr>
          <tr>
            <td>
              I: Alabama &gt; Promised, TLEO, Cassidy, Loser, Lazy Lightning &gt; Supplication, Althea, Easy To Love You, Jack Straw
            </td>
          </tr>
          <tr>
            <td>
              II: Dancin * &gt; Franklin's *, Estimated + &gt; He's Gone + &gt; Gloria Jam + &gt; Drumz &gt; Wharf Rat * &gt; Miracle * &gt; Bertha * &gt; Good Lovin *
            </td>
          </tr>
          <tr>
            <td>
              E: U. S. Blues
            </td>
          </tr>
          <tr>
            <td>
              *appears on "Road Trips Vol. 1 No. 1." +appears on the "Road Trips Vol. 1 No. 1" bonus disc.
            </td>
          </tr>
        </table>
      </div>
      <div>
        <table border="0" cellspacing="0" cellpadding="0">
          <tr>
            <td id="1110">
              <a href="/1979-11-10">11/10/1979 Crisler Arena, U. of Michigan, Ann Arbor, MI</a> [<a href="http://www.archive.org/search.php?query=creator:%22Grateful%20Dead%22%20date:1979-11-10*">Listen/Download</a>]
            </td>
          </tr>
          <tr>
            <td>
              I: Cold Rain &gt; Minglewood, Peggy-O, El Paso, High Time, Me and My Uncle &gt; Big River, Ramble On, L. L. Rain, Dire Wolf, Passenger *, Deal
            </td>
          </tr>
          <tr>
            <td>
              II: Alabama * &gt; Promised *, Ship Of Fools, Samson, Terrapin &gt; Playin &gt; Drumz &gt; NFA &gt; Black Peter &gt; Sugar Magnolia
            </td>
          </tr>
          <tr>
            <td>
              E: Saturday Night
            </td>
          </tr>
          <tr>
            <td>
              Previous ''Cold Rain'' 1/14/1979 [50 shows]
            </td>
          </tr>
          <tr>
            <td>
              *appears on "Road Trips Vol. 1 No. 1."
            </td>
          </tr>
        </table>
      </div>
      <div>
        <table border="0" cellspacing="0" cellpadding="0">
          <tr>
            <td id="1123">
              <a href="/1979-11-23">11/23/1979 Golden Hall, Community Concourse, San Diego, CA</a> [<a href="http://www.archive.org/search.php?query=creator:%22Grateful%20Dead%22%20date:1979-11-23*">Listen/Download</a>]
            </td>
          </tr>
          <tr>
            <td>
              I: Alabama &gt; Promised, TLEO, Me and My Uncle &gt; Big River, High Time, Minglewood, Stagger Lee, Easy To Love You, L. L. Rain &gt; Deal
            </td>
          </tr>
          <tr>
            <td>
              II: Music &gt; Sugaree, Estimated &gt; Eyes &gt; Drumz &gt; NFA &gt; Black Peter &gt; Good Lovin
            </td>
          </tr>
          <tr>
            <td>
              E: U. S. Blues
            </td>
          </tr>
        </table>
      </div>
      <div>
        <table border="0" cellspacing="0" cellpadding="0">
          <tr>
            <td id="1124">
              <a href="/1979-11-24">11/24/1979 Golden Hall, Community Concourse, San Diego, CA</a> [<a href="http://www.archive.org/search.php?query=creator:%22Grateful%20Dead%22%20date:1979-11-24*">Listen/Download</a>]
            </td>
          </tr>
          <tr>
            <td>
              I: China Cat &gt; I Know You Rider, Mama Tried &gt; Mexicali, Peggy-O, Cassidy, Easy To Love You &gt; Althea, Passenger
            </td>
          </tr>
          <tr>
            <td>
              II: Alabama &gt; Greatest, Ship Of Fools, Terrapin &gt; Playin &gt; Drumz &gt; Sailor &gt; Saint &gt; Wharf Rat &gt; Sugar Magnolia
            </td>
          </tr>
          <tr>
            <td>
              E: Saturday Night
            </td>
          </tr>
        </table>
      </div>
      <div>
        <table border="0" cellspacing="0" cellpadding="0">
          <tr>
            <td id="1125">
              <a href="/1979-11-25">11/25/1979 Pauley Pavilion, U.C.L.A., Los Angeles, CA</a> [<a href="http://www.archive.org/search.php?query=creator:%22Grateful%20Dead%22%20date:1979-11-25*">Listen/Download</a>]
            </td>
          </tr>
          <tr>
            <td>
              I: Jack Straw, Tennessee Jed, Me and My Uncle &gt; Big River, Loser, Minglewood, Easy To Love You, Althea, Sailor &gt; Saint &gt; Deal
            </td>
          </tr>
          <tr>
            <td>
              II: Shakedown &gt; Bertha, L. L. Rain, He's Gone &gt; Other One &gt; Drumz &gt; Truckin &gt; Stella Blue &gt; Good Lovin
            </td>
          </tr>
          <tr>
            <td>
              E: Johnny B. Goode
            </td>
          </tr>
          <tr>
            <td>
              "Mind Left Body Jam" tease before "Stella Blue."
            </td>
          </tr>
        </table>
      </div>
      <div>
        <table border="0" cellspacing="0" cellpadding="0">
          <tr>
            <td id="1129">
              <a href="/1979-11-29">11/29/1979 Cleveland Public Hall, Cleveland, OH</a> [<a href="http://www.archive.org/search.php?query=creator:%22Grateful%20Dead%22%20date:1979-11-29*">Listen/Download</a>]
            </td>
          </tr>
          <tr>
            <td>
              I: Alabama &gt; Promised, Candyman, Mama Tried &gt; Mexicali, TLEO, Minglewood, Easy To Love You, B. E. Women, L. L. Rain &gt; Don't Ease
            </td>
          </tr>
          <tr>
            <td>
              II: Shakedown &gt; Samson, High Time, Estimated &gt; Eyes &gt; Drumz &gt; Black Peter &gt; Around &gt; Johnny B. Goode
            </td>
          </tr>
          <tr>
            <td>
              E: U. S. Blues
            </td>
          </tr>
        </table>
      </div>
      <div>
        <table border="0" cellspacing="0" cellpadding="0">
          <tr>
            <td id="1130">
              <a href="/1979-11-30">11/30/1979 Stanley Theatre, Pittsburgh, PA</a> [<a href="http://www.archive.org/search.php?query=creator:%22Grateful%20Dead%22%20date:1979-11-30*">Listen/Download</a>]
            </td>
          </tr>
          <tr>
            <td>
              I: Alabama &gt; Greatest, Peggy-O, Cassidy, FOTD, Easy To Love You &gt; El Paso, Tennessee Jed, Dancin &gt; Deal
            </td>
          </tr>
          <tr>
            <td>
              II: Scarlet &gt; Fire, Passenger, Terrapin &gt; Playin &gt; Drumz &gt; Sailor &gt; Saint &gt; Wharf Rat &gt; Good Lovin
            </td>
          </tr>
          <tr>
            <td>
              E: Don't Ease
            </td>
          </tr>
        </table>
      </div>
      <div>
        <table border="0" cellspacing="0" cellpadding="0">
          <tr>
            <td id="1201">
              <a href="/1979-12-01">12/1/1979 Stanley Theatre, Pittsburgh, PA</a> [<a href="http://www.archive.org/search.php?query=creator:%22Grateful%20Dead%22%20date:1979-12-01*">Listen/Download</a>]
            </td>
          </tr>
          <tr>
            <td>
              I: Jack Straw &gt; Sugaree, Me and My Uncle &gt; Big River, Loser, Easy To Love You, Minglewood, Althea, Music
            </td>
          </tr>
          <tr>
            <td>
              II: China Cat &gt; I Know You Rider, L. L. Rain, He's Gone &gt; Gloria Jam &gt; C. C. Rider &gt; Drumz &gt; NFA &gt; Black Peter &gt; Sugar Magnolia
            </td>
          </tr>
          <tr>
            <td>
              E: Saturday Night
            </td>
          </tr>
          <tr>
            <td>
              First ''C. C. Rider''
            </td>
          </tr>
        </table>
      </div>
      <div>
        <table border="0" cellspacing="0" cellpadding="0">
          <tr>
            <td id="1203">
              <a href="/1979-12-03">12/3/1979 Uptown Theatre, Chicago, IL</a> [<a href="http://www.archive.org/search.php?query=creator:%22Grateful%20Dead%22%20date:1979-12-03*">Listen/Download</a>]
            </td>
          </tr>
          <tr>
            <td>
              I: Alabama &gt; Promised, B. E. Women, El Paso, Ramble On, All Over Now, Jack A Roe, Lazy Lightning &gt; Supplication, Althea, Music
            </td>
          </tr>
          <tr>
            <td>
              II: Scarlet &gt; Fire, Samson, Terrapin &gt; Playin &gt; Drumz &gt; Sailor &gt; Saint &gt; Wharf Rat &gt; Truckin
            </td>
          </tr>
          <tr>
            <td>
              E: Johnny B. Goode
            </td>
          </tr>
          <tr>
            <td>
              Next ''Jack A Roe'' 9/25/1980 [60 shows]
            </td>
          </tr>
        </table>
      </div>
      <div>
        <table border="0" cellspacing="0" cellpadding="0">
          <tr>
            <td id="1204">
              <a href="/1979-12-04">12/4/1979 Uptown Theatre, Chicago, IL</a> [<a href="http://www.archive.org/search.php?query=creator:%22Grateful%20Dead%22%20date:1979-12-04*">Listen/Download</a>]
            </td>
          </tr>
          <tr>
            <td>
              I: Jack Straw, Peggy-O, Mama Tried &gt; Mexicali, TLEO, Minglewood, Stagger Lee, Passenger &gt; Deal
            </td>
          </tr>
          <tr>
            <td>
              II: China Cat &gt; I Know You Rider, L. L. Rain, Estimated &gt; Franklin's &gt; Drumz &gt; NFA &gt; Stella Blue &gt; Sugar Magnolia
            </td>
          </tr>
          <tr>
            <td>
              E: U. S. Blues
            </td>
          </tr>
          <tr>
            <td>
              Next ''Stagger Lee'' 8/4/1982 [212 shows]
            </td>
          </tr>
        </table>
      </div>
      <div>
        <table border="0" cellspacing="0" cellpadding="0">
          <tr>
            <td id="1205">
              <a href="/1979-12-05">12/5/1979 Uptown Theatre, Chicago, IL</a> [<a href="http://www.archive.org/search.php?query=creator:%22Grateful%20Dead%22%20date:1979-12-05*">Listen/Download</a>]
            </td>
          </tr>
          <tr>
            <td>
              I: Alabama &gt; Greatest, Dire Wolf, Me and My Uncle &gt; Big River, Cold Rain, Easy To Love You, Althea &gt; Sailor &gt; Saint
            </td>
          </tr>
          <tr>
            <td>
              II: Shakedown &gt; Samson, Ship Of Fools, He's Gone &gt; Other One &gt; Drumz &gt; Black Peter &gt; Miracle &gt; Bertha &gt; Good Lovin
            </td>
          </tr>
          <tr>
            <td>
              E: Johnny B. Goode, Don't Ease
            </td>
          </tr>
        </table>
      </div>
      <div>
        <table border="0" cellspacing="0" cellpadding="0">
          <tr>
            <td id="1207">
              <a href="/1979-12-07">12/7/1979 Indiana Convention Center, Indianapolis, IN</a> [<a href="http://www.archive.org/search.php?query=creator:%22Grateful%20Dead%22%20date:1979-12-07*">Listen/Download</a>]
            </td>
          </tr>
          <tr>
            <td>
              I: Minglewood, Tennessee Jed, Me and My Uncle &gt; Big River, Don't Ease &gt; El Paso, Big RxR Blues, Easy To Love You &gt; All Over Now, Althea, Music
            </td>
          </tr>
          <tr>
            <td>
              II: China Cat &gt; I Know You Rider, Eyes &gt; Sailor &gt; Saint &gt; Drumz &gt; Wharf Rat &gt; Around &gt; Johnny B. Goode
            </td>
          </tr>
          <tr>
            <td>
              E: U. S. Blues
            </td>
          </tr>
        </table>
      </div>
      <div>
        <table border="0" cellspacing="0" cellpadding="0">
          <tr>
            <td id="1209">
              <a href="/1979-12-09">12/9/1979 Kiel Auditorium, St. Louis, MO</a> [<a href="http://www.archive.org/search.php?query=creator:%22Grateful%20Dead%22%20date:1979-12-09*">Listen/Download</a>]
            </td>
          </tr>
          <tr>
            <td>
              I: Alabama &gt; Promised, B. E. Women, Cassidy, Row Jimmy, Minglewood, Candyman, Lazy Lightning &gt; Supplication, Deal
            </td>
          </tr>
          <tr>
            <td>
              II: Shakedown &gt; Samson, High Time, Easy To Love You, Terrapin &gt; Sailor &gt; Saint &gt; Drumz &gt; Black Peter &gt; Miracle &gt; Bertha &gt; Good Lovin
            </td>
          </tr>
          <tr>
            <td>
              E: Don't Ease
            </td>
          </tr>
        </table>
      </div>
      <div>
        <table border="0" cellspacing="0" cellpadding="0">
          <tr>
            <td id="1210">
              <a href="/1979-12-10">12/10/1979 Soldiers and Sailors Memorial Hall, Kansas City, KS</a> [<a href="http://www.archive.org/search.php?query=creator:%22Grateful%20Dead%22%20date:1979-12-10*">Listen/Download</a>]
            </td>
          </tr>
          <tr>
            <td>
              I: Cold Rain &gt; Greatest, Peggy-O, Mama Tried &gt; Mexicali, Tennessee Jed, Dancin &gt; Franklin's &gt; L. L. Rain &gt; Deal
            </td>
          </tr>
          <tr>
            <td>
              II: Scarlet &gt; Fire, Easy To Love You &gt; Let It Grow &gt; He's Gone &gt; Truckin &gt; Drumz &gt; Wharf Rat &gt; Johnny B. Goode
            </td>
          </tr>
          <tr>
            <td>
              E: U. S. Blues
            </td>
          </tr>
          <tr>
            <td>
              Next ''Dancin'' 7/7/1981 [128 shows]
            </td>
          </tr>
        </table>
      </div>
      <div>
        <table border="0" cellspacing="0" cellpadding="0">
          <tr>
            <td id="1211">
              <a href="/1979-12-11">12/11/1979 Soldiers and Sailors Memorial Hall, Kansas City, KS</a> [<a href="http://www.archive.org/search.php?query=creator:%22Grateful%20Dead%22%20date:1979-12-11*">Listen/Download</a>]
            </td>
          </tr>
          <tr>
            <td>
              I: Jack Straw, Loser, Me and My Uncle &gt; Big River, Althea, Easy To Love You &gt; Minglewood, China Cat &gt; I Know You Rider
            </td>
          </tr>
          <tr>
            <td>
              II: Shakedown &gt; Samson, Ship Of Fools, Terrapin &gt; Sailor, Saint &gt; Estimated Prophet Jam &gt; Drumz &gt; NFA &gt; Black Peter &gt; Sugar Magnolia
            </td>
          </tr>
          <tr>
            <td>
              E: Alabama &gt; Promised
            </td>
          </tr>
        </table>
      </div>
      <div>
        <table border="0" cellspacing="0" cellpadding="0">
          <tr>
            <td id="1213">
              <a href="/1979-12-13">12/13/1979 Milwaukee Auditorium, Milwaukee, WI</a> [<a href="http://www.archive.org/search.php?query=creator:%22Grateful%20Dead%22%20date:1979-12-13*">Listen/Download</a>]
            </td>
          </tr>
          <tr>
            <td></td>
          </tr>
          <tr>
            <td>
              Backstage passes exist.
            </td>
          </tr>
        </table>
      </div>
      <div>
        <table border="0" cellspacing="0" cellpadding="0">
          <tr>
            <td id="1214">
              <a href="/1979-12-14">12/14/1979 St. Paul Civic Center Arena, St. Paul, MN</a> [<a href="http://www.archive.org/search.php?query=creator:%22Grateful%20Dead%22%20date:1979-12-14*">Listen/Download</a>]
            </td>
          </tr>
          <tr>
            <td></td>
          </tr>
          <tr>
            <td>
              Backstage passes exist.
            </td>
          </tr>
        </table>
      </div>
      <div>
        <table border="0" cellspacing="0" cellpadding="0">
          <tr>
            <td id="1226">
              <a href="/1979-12-26">12/26/1979 Oakland Auditorium Arena, Oakland, CA</a> [<a href="http://www.archive.org/search.php?query=creator:%22Grateful%20Dead%22%20date:1979-12-26*">Listen/Download</a>]
            </td>
          </tr>
          <tr>
            <td>
              I: Cold Rain, C. C. Rider, Dire Wolf, Me and My Uncle &gt; Big River, B. E. Women, Minglewood, FOTD, L. L. Rain, Alabama &gt; Promised
            </td>
          </tr>
          <tr>
            <td>
              II: Uncle John &gt; Estimated &gt; Jam &gt; He's Gone &gt; Other One &gt; Drumz &gt; NFA &gt; Brokedown &gt; Around &gt; Johnny B. Goode
            </td>
          </tr>
          <tr>
            <td>
              E: Shakedown &gt; Uncle John
            </td>
          </tr>
          <tr>
            <td>
              Previous ''Brokedown'' 10/14/1977 [165 shows]; Previous ''Uncle John'' 10/6/1977 [170 shows]
            </td>
          </tr>
          <tr>
            <td>
              SEVA benefit. Soundcheck: B. T. Wind, Brokedown, Minglewood. Entire show released as "Dick's Picks Vol 5"
            </td>
          </tr>
        </table>
      </div>
      <div>
        <table border="0" cellspacing="0" cellpadding="0">
          <tr>
            <td id="1227">
              <a href="/1979-12-27">12/27/1979 Oakland Auditorium Arena, Oakland, CA</a> [<a href="http://www.archive.org/search.php?query=creator:%22Grateful%20Dead%22%20date:1979-12-27*">Listen/Download</a>]
            </td>
          </tr>
          <tr>
            <td>
              I: Jack Straw, TLEO, Cassidy, Peggy-O &gt; El Paso, Don't Ease, BIODTL, Deal
            </td>
          </tr>
          <tr>
            <td>
              II: China Cat &gt; I Know You Rider, Samson, Eyes &gt; Sailor &gt; Saint &gt; Jam &gt; Drumz &gt; Black Peter &gt; Sugar Magnolia
            </td>
          </tr>
          <tr>
            <td>
              E1: U. S. Blues
            </td>
          </tr>
          <tr>
            <td>
              E2: Brokedown
            </td>
          </tr>
          <tr>
            <td>
              Previous ''BIODTL'' 2/6/1979 [57 shows]
            </td>
          </tr>
        </table>
      </div>
      <div>
        <table border="0" cellspacing="0" cellpadding="0">
          <tr>
            <td id="1228">
              <a href="/1979-12-28">12/28/1979 Oakland Auditorium Arena, Oakland, CA</a> [<a href="http://www.archive.org/search.php?query=creator:%22Grateful%20Dead%22%20date:1979-12-28*">Listen/Download</a>]
            </td>
          </tr>
          <tr>
            <td>
              I: Sugaree, Mama Tried &gt; Mexicali, Row Jimmy, All Over Now, High Time, Music
            </td>
          </tr>
          <tr>
            <td>
              II: Alabama &gt; Greatest, Terrapin &gt; Playin &gt; Drumz &gt; Uncle John &gt; Miracle &gt; Bertha &gt; Good Lovin
            </td>
          </tr>
          <tr>
            <td>
              E1: Casey Jones
            </td>
          </tr>
          <tr>
            <td>
              E2: Saturday Night
            </td>
          </tr>
          <tr>
            <td>
              Entire show released as "Road Trips Vol. 3 No. 1."
            </td>
          </tr>
        </table>
      </div>
      <div>
        <table border="0" cellspacing="0" cellpadding="0">
          <tr>
            <td id="1230">
              <a href="/1979-12-30">12/30/1979 Oakland Auditorium Arena, Oakland, CA</a> [<a href="http://www.archive.org/search.php?query=creator:%22Grateful%20Dead%22%20date:1979-12-30*">Listen/Download</a>]
            </td>
          </tr>
          <tr>
            <td>
              I: Minglewood *, Candyman *, Me and My Uncle &gt; Big River, Ramble On *, Lazy Lightning * &gt; Supplication * &gt; Deal
            </td>
          </tr>
          <tr>
            <td>
              II: Scarlet * &gt; Fire * &gt; Let It Grow * &gt; Drumz &gt; Truckin * &gt; Wharf Rat * &gt; Around &gt; Johnny B. Goode
            </td>
          </tr>
          <tr>
            <td>
              E1: Don't Ease
            </td>
          </tr>
          <tr>
            <td>
              E2: Brokedown
            </td>
          </tr>
          <tr>
            <td>
              *released as "Road Trips Vol. 3 No. 1" bonus disc.
            </td>
          </tr>
        </table>
      </div>
      <div>
        <table border="0" cellspacing="0" cellpadding="0">
          <tr>
            <td id="1231">
              <a href="/1979-12-31">12/31/1979 Oakland Auditorium Arena, Oakland, CA</a> [<a href="http://www.archive.org/search.php?query=creator:%22Grateful%20Dead%22%20date:1979-12-31*">Listen/Download</a>]
            </td>
          </tr>
          <tr>
            <td>
              I: Jack Straw &gt; Franklin's, Mama Tried &gt; Mexicali, Tennessee Jed, L. L. Rain &gt; Alabama &gt; Promised
            </td>
          </tr>
          <tr>
            <td>
              II: Sugar Magnolia &gt; China Cat &gt; I Know You Rider, Samson, Ship Of Fools, Sailor &gt; Saint &gt; Deal
            </td>
          </tr>
          <tr>
            <td>
              III: Althea &gt; Minglewood, Uncle John &gt; Drumz &gt; NFA* &gt; Stella Blue* &gt; Sunshine Daydream*
            </td>
          </tr>
          <tr>
            <td>
              E: Good Lovin
            </td>
          </tr>
          <tr>
            <td>
              Next ''Sunshine Daydream'' 12/31/1980 [86 shows]
            </td>
          </tr>
          <tr>
            <td>
              Bill Graham flew out of a truck at midnight dressed as a butterfly. Also: Richard Olson; Flying Karamazov Brothers. *with John Cipollina.
            </td>
          </tr>
        </table>
      </div>
    </div>
  </body>
</html>
