<!DOCTYPE HTML PUBLIC "-//W3C//DTD HTML 4.01 Transitional//EN" "http://www.w3.org/TR/html4/loose.dtd">
<html>
<head>
<title>1982 Setlists</title>
</head>
<body>
<div align="center">
<div id="container">
<div id="logbar"><!--START LOGIN-->
You are logged in as Dave R [<a href="">Log Out</a>]<span class="space">|</span><a href="/my">My DeadBase Options and Shows</a><span class="space">|</span>Shows I own are currently highlighted. [<span onmouseover="document.getElementById('highoptions').style.display='block';" onmouseout="document.getElementById('highoptions').style.display='none'; return false;"><a href="#" onclick="return false;">Change</a><div id="highoptions" class="highoptions" style="display:none;">
		<a href="/1982/setlists&highlight=went">Shows I attended</a>
		<a href="/1982/setlists&highlight=own">Shows I own</a>
		<a href="/1982/setlists&highlight=looking">Shows I'm looking for</a>
		<a href="/1982/setlists&highlight=favorite">My favorite shows</a>
	</div></span>] 
</div>

<div><!--START main-->
<div id="mainc"><div id="main">
	<div class="page_title">1982 Setlists</div>

<script language="Javascript" type="text/javascript">
<!--
function showtab () {
document.getElementById('hide').style.display = 'none';
document.getElementById('show').style.display = 'block';
}
function hidetab () {
document.getElementById('show').style.display = 'none';
document.getElementById('hide').style.display = 'block';
}
-->
</script>
<p>February:  <a href="#0216">16</a> <a href="#0217">17</a> <a href="#0219">19</a> <a href="#0220">20</a> <a href="#0221">21</a><br>
March: <a href="#0313">13</a> <a href="#0314">14</a> <a href="#03xx">xx</a><br>
April: <a href="#0402">2</a> <a href="#0403">3</a> <a href="#0405">5</a> <a href="#0406">6</a> <a href="#0408">8</a> <a href="#0409">9</a> <a href="#0411">11</a> <a href="#0412">12</a> <a href="#0413">13</a> <a href="#0414">14</a> <a href="#0415">15</a> <a href="#0417">17</a> <a href="#0418">18</a> <a href="#0419">19</a><br>
May: <a href="#0521">21</a> <a href="#0522">22</a> <a href="#0523">23</a> <a href="#0528">28</a><br>
July: <a href="#0717">17</a> <a href="#0718">18</a> <a href="#0725">25</a> <a href="#0727">27</a> <a href="#0728">28</a> <a href="#0729">29</a> <a href="#0731">31</a><br>
August: <a href="#0801">1</a> <a href="#0803">3</a> <a href="#0804">4</a> <a href="#0806">6</a> <a href="#0807">7</a> <a href="#0808">8</a> <a href="#0810">10</a> <a href="#0822">22</a> <a href="#0828">28</a> <a href="#0829">29</a><br>
September: <a href="#0905">5</a> <a href="#0908">8</a> <a href="#0909">9</a> <a href="#0911">11</a> <a href="#0911">11</a> <a href="#0912">12</a> <a href="#0912">12</a> <a href="#0914">14</a> <a href="#0915">15</a> <a href="#0917">17</a> <a href="#0918">18</a> <a href="#0920">20</a> <a href="#0921">21</a> <a href="#0923">23</a> <a href="#0924">24</a><br>
October: <a href="#1009">9</a> <a href="#1010">10</a> <a href="#1017">17</a><br>
November: <a href="#1125">25</a><br>
December: <a href="#1226">26</a> <a href="#1227">27</a> <a href="#1228">28</a> <a href="#1230">30</a> <a href="#1231">31</a></p>
<div class="setlist_table"><table border="0" cellspacing="0" cellpadding="0"><tr class="header"><td><span><a name="0216"></a><a href="/1982-02-16">2/16/1982 Warfield Theater, San Francisco, CA</a></span> [<a href="http://www.archive.org/search.php?query=creator:%22Grateful Dead%22%20date:1982-02-16*">Listen/Download</a>]<tr><td>I: Shakedown > Greatest, FOTD > Rooster, Peggy-O > Me  and  My Uncle > Big River, Althea, L. L. Rain, Might As Well</td></tr>
<tr><td>II: China Cat > I Know You Rider > Playin > Terrapin > Drumz > Truckin > Nobody's Jam > Black Peter > Playin > Around > Good Lovin</td></tr>
<tr><td>E: Don't Ease</td></tr>
<tr class="notes"><td>Benefit concert.</i></td></tr>
</table></div>
<div class="setlist_table"><table border="0" cellspacing="0" cellpadding="0"><tr class="header"><td><span><a name="0217"></a><a href="/1982-02-17">2/17/1982 Warfield Theater, San Francisco, CA</a></span> [<a href="http://www.archive.org/search.php?query=creator:%22Grateful Dead%22%20date:1982-02-17*">Listen/Download</a>]<tr><td>I: Minglewood > Sugaree, On The Road Again, Bird Song > C. C. Rider, Tennessee Jed, All Over Now, Loser, Woman Smarter</td></tr>
<tr><td>II: Scarlet > Fire > Estimated > Eyes > Drumz > Wheel > NFA > Wharf Rat > Sugar Magnolia</td></tr>
<tr><td>E: Satisfaction</td></tr>
<tr class="notes"><td>Benefit concert.</i></td></tr>
</table></div>
<div class="setlist_table"><table border="0" cellspacing="0" cellpadding="0"><tr class="header"><td><span><a name="0219"></a><a href="/1982-02-19">2/19/1982 Golden Hall, Community Concourse, San Diego, CA</a></span> [<a href="http://www.archive.org/search.php?query=creator:%22Grateful Dead%22%20date:1982-02-19*">Listen/Download</a>]<tr><td>I: Bertha > Greatest, Dire Wolf, Rooster, B. E. Women > Cassidy, Candyman, El Paso, Althea, Minglewood</td></tr>
<tr><td>II: Alabama > Promised, Ship Of Fools, Sailor > Saint > Jam > Drumz > Other One > Stella Blue > Woman Smarter > Johnny B. Goode</td></tr>
<tr><td>E: U. S. Blues</td></tr>
</table></div>
<div class="setlist_table"><table border="0" cellspacing="0" cellpadding="0"><tr class="header"><td><span><a name="0220"></a><a href="/1982-02-20">2/20/1982 Golden Hall, Community Concourse, San Diego, CA</a></span> [<a href="http://www.archive.org/search.php?query=creator:%22Grateful Dead%22%20date:1982-02-20*">Listen/Download</a>]<tr><td>I: Jack Straw, TLEO > C. C. Rider, Tennessee Jed, Mama Tried > Mexicali, To Lay Me Down > Let It Grow</td></tr>
<tr><td>II: Franklin's > Samson, Big RxR Blues, Playin > Drumz > Truckin > Black Peter > Around > Saturday Night</td></tr>
<tr><td>E: Baby Blue</td></tr>
</table></div>
<div class="setlist_table"><table border="0" cellspacing="0" cellpadding="0"><tr class="header"><td><span><a name="0221"></a><a href="/1982-02-21">2/21/1982 Pauley Pavilion, U.C.L.A., Los Angeles, CA</a></span> [<a href="http://www.archive.org/search.php?query=creator:%22Grateful Dead%22%20date:1982-02-21*">Listen/Download</a>]<tr><td>I: Shakedown > Minglewood, FOTD > Me  and  My Uncle > Big River, Bird Song > Rooster, Bertha > Woman Smarter</td></tr>
<tr><td>II: China Cat > I Know You Rider > Estimated > Eyes > Drumz > NFA > Stella Blue > Sugar Magnolia</td></tr>
<tr><td>E: Brokedown</td></tr>
</table></div>
<div class="setlist_table"><table border="0" cellspacing="0" cellpadding="0"><tr class="header"><td><span><a name="0313"></a><a href="/1982-03-13">3/13/1982 Centennial Coliseum, Reno, NV</a></span> [<a href="http://www.archive.org/search.php?query=creator:%22Grateful Dead%22%20date:1982-03-13*">Listen/Download</a>]<tr><td>I: Alabama > Greatest, FOTD > C. C. Rider, B. E. Women > Cassidy, Roses, Minglewood > China Cat > I Know You Rider</td></tr>
<tr><td>II: Stranger > Franklin's, Estimated > Eyes > Drumz > Other One > Dear Prudence Jam > Black Peter > Around > Good Lovin</td></tr>
<tr><td>E: Don't Ease</td></tr>
<tr class="notes"><td>Only "Dear Prudence Jam."</i></td></tr>
</table></div>
<div class="setlist_table"><table border="0" cellspacing="0" cellpadding="0"><tr class="header"><td><span><a name="0314"></a><a href="/1982-03-14">3/14/1982 Recreational Hall, U. of California, Davis, CA</a></span> [<a href="http://www.archive.org/search.php?query=creator:%22Grateful Dead%22%20date:1982-03-14*">Listen/Download</a>]<tr><td>I: Saturday Night > Sugaree, Me  and  My Uncle > Mexicali, Bird Song > Rooster, Ramble On > L. L. Rain, Althea, Let It Grow</td></tr>
<tr><td>II: Samson, Ship Of Fools, Playin > Scarlet > Fire > Drumz > NFA > Wharf Rat > Sugar Magnolia</td></tr>
<tr><td>E: U. S. Blues</td></tr>
</table></div>
<div class="setlist_table"><table border="0" cellspacing="0" cellpadding="0"><tr class="header"><td><span><a name="03xx"></a><a href="/1982-03-xx">3/xx/1982 Le Club Front, San Rafael, CA</a></span> [<a href="http://www.archive.org/search.php?query=creator:%22Grateful Dead%22%20date:1982-03-xx*">Listen/Download</a>]<tr><td>Jam, Jam, Crazy Fingers</td></tr>
<tr class="notes"><td>Rehearsal.</i></td></tr>
</table></div>
<div class="setlist_table"><table border="0" cellspacing="0" cellpadding="0"><tr class="header"><td><span><a name="0402"></a><a href="/1982-04-02">4/2/1982 Cameron Indoor Stadium, Duke U., Durham, NC</a></span> [<a href="http://www.archive.org/search.php?query=creator:%22Grateful Dead%22%20date:1982-04-02*">Listen/Download</a>]<tr><td>I: Minglewood > Sugaree, Mama Tried > Mexicali, Loser, Rooster, Candyman, L. L. Rain > China Cat > I Know You Rider</td></tr>
<tr><td>II: Samson, Roses, Woman Smarter, He's Gone > Truckin > Drumz > Other One > Black Peter > Sugar Magnolia</td></tr>
<tr><td>E: Don't Ease</td></tr>
<tr class="notes"><td>Jerry  and  Phil swap sides.</i></td></tr>
</table></div>
<div class="setlist_table"><table border="0" cellspacing="0" cellpadding="0"><tr class="header"><td><span><a name="0403"></a><a href="/1982-04-03">4/3/1982 The Scope, Norfolk, VA</a></span> [<a href="http://www.archive.org/search.php?query=creator:%22Grateful Dead%22%20date:1982-04-03*">Listen/Download</a>]<tr><td>I: Alabama > Greatest, TLEO, Me  and  My Uncle > Big River, Peggy-O > C. C. Rider, Bird Song, All Over Now, Althea > Let It Grow</td></tr>
<tr><td>II: Scarlet > Fire, Estimated > Eyes > Good Times > Drumz > NFA > Stella Blue > Saturday Night</td></tr>
<tr><td>E: U. S. Blues</td></tr>
</table></div>
<div class="setlist_table"><table border="0" cellspacing="0" cellpadding="0"><tr class="header"><td><span><a name="0405"></a><a href="/1982-04-05">4/5/1982 The Spectrum, Philadelphia, PA</a></span> [<a href="http://www.archive.org/search.php?query=creator:%22Grateful Dead%22%20date:1982-04-05*">Listen/Download</a>]<tr><td>I: Jack Straw, FOTD > El Paso, Deep Elem <span class="setlist_small">*</span>, Cassidy, Tennessee Jed > Rooster, Althea <span class="setlist_small">*</span>, Woman Smarter <span class="setlist_small">*</span></td></tr>
<tr><td>II: Bertha <span class="setlist_small">*</span> > Playin <span class="setlist_small">*</span> > Ship Of Fools <span class="setlist_small">*</span> > Jam > Drumz > Wheel > Playin <span class="setlist_small">*</span> > Wharf Rat > Good Lovin</td></tr>
<tr><td>E: Don't Ease</td></tr>
<tr class="notes"><td>*appears on "Road Trips Vol. 4 No. 4."</i></td></tr>
</table></div>
<div class="setlist_table"><table border="0" cellspacing="0" cellpadding="0"><tr class="header"><td><span><a name="0406"></a><a href="/1982-04-06">4/6/1982 The Spectrum, Philadelphia, PA</a></span> [<a href="http://www.archive.org/search.php?query=creator:%22Grateful Dead%22%20date:1982-04-06*">Listen/Download</a>]<tr><td>I: Cold Rain > Promised, Candyman > C. C. Rider, B. E. Women, Mama Tried > Mexicali, Big RxR Blues, L. L. Rain, Jack A Roe, All Over Now, Might As Well</td></tr>
<tr><td>II: Shakedown > Sailor > Saint > Terrapin > Drumz > Truckin > Other One > Morning Dew > Sugar Magnolia</td></tr>
<tr><td>E: Baby Blue</td></tr>
<tr class="notes"><td>"Other One" is second verse only. Entire show appears on "Road Trips Vol. 4 No. 4." </i></td></tr>
</table></div>
<div class="setlist_table"><table border="0" cellspacing="0" cellpadding="0"><tr class="header"><td><span><a name="0408"></a><a href="/1982-04-08">4/8/1982 Onondaga County War Memorial, Syracuse, NY</a></span> [<a href="http://www.archive.org/search.php?query=creator:%22Grateful Dead%22%20date:1982-04-08*">Listen/Download</a>]<tr><td>I: Stranger, TLEO, Me  and  My Uncle > Big River, FOTD, Rooster, Ramble On, Let It Grow</td></tr>
<tr><td>II: Playin > Uncle John > Estimated > Eyes > Drumz > NFA > Black Peter > Playin > Johnny B. Goode</td></tr>
<tr><td>E: U. S. Blues</td></tr>
<tr class="notes"><td>Previous ''Uncle John'' 7/10/1981 [56 shows]</i></td></tr>
<tr class="notes"><td>"Funiculi Funicula" tuning into "Playin." Soundcheck: Uncle John.</i></td></tr>
</table></div>
<div class="setlist_table"><table border="0" cellspacing="0" cellpadding="0"><tr class="header"><td><span><a name="0409"></a><a href="/1982-04-09">4/9/1982 Community War Memorial, Rochester, NY</a></span> [<a href="http://www.archive.org/search.php?query=creator:%22Grateful Dead%22%20date:1982-04-09*">Listen/Download</a>]<tr><td>I: Alabama > Greatest, Dire Wolf > C. C. Rider, Bird Song, All Over Now, Loser, Minglewood, China Cat > I Know You Rider</td></tr>
<tr><td>II: Woman Smarter, To Lay Me Down, Sailor > Saint > Drumz > Other One > Stella Blue > GDTRFB > Satisfaction</td></tr>
<tr><td>E: Brokedown</td></tr>
<tr class="notes"><td>Soundcheck: Crazy Fingers</i></td></tr>
</table></div>
<div class="setlist_table"><table border="0" cellspacing="0" cellpadding="0"><tr class="header"><td><span><a name="0411"></a><a href="/1982-04-11">4/11/1982 Nassau Veterans Memorial Coliseum, Uniondale, NY</a></span> [<a href="http://www.archive.org/search.php?query=creator:%22Grateful Dead%22%20date:1982-04-11*">Listen/Download</a>]<tr><td>I: Half Step > Franklin's > El Paso, Candyman > Rooster, Althea > BIODTL, Row Jimmy, Let It Grow</td></tr>
<tr><td>II: Bertha > Samson, Good Times, He's Gone > Truckin > Drumz > NFA > Black Peter > Around > Good Lovin</td></tr>
<tr><td>E: Don't Ease</td></tr>
</table></div>
<div class="setlist_table"><table border="0" cellspacing="0" cellpadding="0"><tr class="header"><td><span><a name="0412"></a><a href="/1982-04-12">4/12/1982 Nassau Veterans Memorial Coliseum, Uniondale, NY</a></span> [<a href="http://www.archive.org/search.php?query=creator:%22Grateful Dead%22%20date:1982-04-12*">Listen/Download</a>]<tr><td>I: Iko Iko > Minglewood, Peggy-O, Mama Tried > Mexicali, Bird Song > C. C. Rider, Tennessee Jed, L. L. Rain, Deal</td></tr>
<tr><td>II: Woman Smarter > Sugaree, Estimated > Uncle John > Drumz > Other One > Stella Blue > Sugar Magnolia</td></tr>
<tr><td>E: Satisfaction</td></tr>
<tr class="notes"><td>"Other One" is second verse only, sung twice</i></td></tr>
</table></div>
<div class="setlist_table"><table border="0" cellspacing="0" cellpadding="0"><tr class="header"><td><span><a name="0413"></a><a href="/1982-04-13">4/13/1982 NBC Studios, New York, NY</a></span> [<a href="http://www.archive.org/search.php?query=creator:%22Grateful Dead%22%20date:1982-04-13*">Listen/Download</a>]<tr><td>I: Deep Elem <span class="setlist_small">@</span></td></tr>
<tr><td>II: Monkey & Engineer <span class="setlist_small">@</span></td></tr>
<tr class="notes"><td>"The David Letterman Show" TV broadcast. Garcia & Weir.</i></td></tr>
</table></div>
<div class="setlist_table"><table border="0" cellspacing="0" cellpadding="0"><tr class="header"><td><span><a name="0414"></a><a href="/1982-04-14">4/14/1982 Glens Falls Civic Center, Glens Falls, NY</a></span> [<a href="http://www.archive.org/search.php?query=creator:%22Grateful Dead%22%20date:1982-04-14*">Listen/Download</a>]<tr><td>I: Jack Straw, TLEO, Me  and  My Uncle > Big River, Deep Elem, Rooster, B. E. Women, Lazy Lightning > Supplication > Bertha</td></tr>
<tr><td>II: China Cat > I Know You Rider > Playin > Drumz > Wheel > Miracle > Black Peter > Playin > Johnny B. Goode</td></tr>
<tr><td>E: U. S. Blues</td></tr>
<tr class="notes"><td>Next ''Deep Elem'' 8/27/1983 [81 shows]</i></td></tr>
</table></div>
<div class="setlist_table"><table border="0" cellspacing="0" cellpadding="0"><tr class="header"><td><span><a name="0415"></a><a href="/1982-04-15">4/15/1982 Providence Civic Center, Providence, RI</a></span> [<a href="http://www.archive.org/search.php?query=creator:%22Grateful Dead%22%20date:1982-04-15*">Listen/Download</a>]<tr><td>I: Alabama > Greatest, Candyman > C. C. Rider, Ramble On, BIODTL, Peggy-O > Cassidy, Althea > L. L. Rain > Deal</td></tr>
<tr><td>II: Scarlet > Fire, Estimated > He's Gone > Drumz > Truckin > Morning Dew > Good Lovin</td></tr>
<tr><td>E: Don't Ease</td></tr>
</table></div>
<div class="setlist_table"><table border="0" cellspacing="0" cellpadding="0"><tr class="header"><td><span><a name="0417"></a><a href="/1982-04-17">4/17/1982 Hartford Civic Center, Hartford, CT</a></span> [<a href="http://www.archive.org/search.php?query=creator:%22Grateful Dead%22%20date:1982-04-17*">Listen/Download</a>]<tr><td>I: Minglewood > Sugaree > El Paso, Jack A Roe > Rooster, Tennessee Jed, All Over Now, Bird Song > Woman Smarter</td></tr>
<tr><td>II: Shakedown > Sailor > Saint > Spanish Jam<span class="setlist_small">*</span> > Drumz > Uncle John > NFA > Wharf Rat > Around > Saturday Night</td></tr>
<tr><td>E: Baby Blue</td></tr>
<tr class="notes"><td>Next ''Jack A Roe'' 10/12/1984 [159 shows]</i></td></tr>
<tr class="notes"><td>*without Jerry</i></td></tr>
</table></div>
<div class="setlist_table"><table border="0" cellspacing="0" cellpadding="0"><tr class="header"><td><span><a name="0418"></a><a href="/1982-04-18">4/18/1982 Hartford Civic Center, Hartford, CT</a></span> [<a href="http://www.archive.org/search.php?query=creator:%22Grateful Dead%22%20date:1982-04-18*">Listen/Download</a>]<tr><td>I: Bertha > Promised, FOTD > C. C. Rider, Ramble On, Me  and  My Uncle > Mexicali, Althea > L. L. Rain, Big RxR Blues, Let It Grow</td></tr>
<tr><td>II: Cold Rain > Samson, Ship Of Fools, Playin > Eyes > Drumz > Phil's Earthquake Space > Other One > Black Peter > Sugar Magnolia > Playin > Sunshine Daydream</td></tr>
<tr><td>E: Don't Ease</td></tr>
<tr class="notes"><td>Only ''Phil's Earthquake Space''; Previous ''Space'' 1/30/1978 [330 shows]</i></td></tr>
</table></div>
<div class="setlist_table"><table border="0" cellspacing="0" cellpadding="0"><tr class="header"><td><span><a name="0419"></a><a href="/1982-04-19">4/19/1982 Baltimore Civic Center, Baltimore, MD</a></span> [<a href="http://www.archive.org/search.php?query=creator:%22Grateful Dead%22%20date:1982-04-19*">Listen/Download</a>]<tr><td>I: Jack Straw, TLEO, On The Road Again, Peggy-O, Cassidy, Roses, Rooster, Cumberland, Woman Smarter, Might As Well</td></tr>
<tr><td>II: Stranger > Franklin's > Estimated > Terrapin > Drumz > The Raven Space > Wheel > Truckin > Stella Blue > Around > Good Lovin</td></tr>
<tr><td>E: Brokedown</td></tr>
<tr class="notes"><td>Only ''The Raven Space''; Next ''Space'' 10/31/1985 [227 shows]</i></td></tr>
</table></div>
<div class="setlist_table"><table border="0" cellspacing="0" cellpadding="0"><tr class="header"><td><span><a name="0521"></a><a href="/1982-05-21">5/21/1982 Greek Theatre, U. of California, Berkeley, CA</a></span> [<a href="http://www.archive.org/search.php?query=creator:%22Grateful Dead%22%20date:1982-05-21*">Listen/Download</a>]<tr><td>I: Bertha > Greatest, FOTD, Me  and  My Uncle > Big River, Bird Song > C. C. Rider, Althea > L. L. Rain, Might As Well</td></tr>
<tr><td>II: Playin > Uncle John > Drumz > Wheel > Playin > Black Peter > Sugar Magnolia</td></tr>
<tr><td>E: Don't Ease</td></tr>
</table></div>
<div class="setlist_table"><table border="0" cellspacing="0" cellpadding="0"><tr class="header"><td><span><a name="0522"></a><a href="/1982-05-22">5/22/1982 Greek Theatre, U. of California, Berkeley, CA</a></span> [<a href="http://www.archive.org/search.php?query=creator:%22Grateful Dead%22%20date:1982-05-22*">Listen/Download</a>]<tr><td>I: Jack Straw > Sugaree, Cassidy, Tennessee Jed > Minglewood, Cumberland, Lazy Lightning > Supplication > Deal</td></tr>
<tr><td>II: China Cat > I Know You Rider > Woman Smarter, Good Times, Sailor > Saint > He's Gone > Drumz > NFA > Wharf Rat > Around > Good Lovin</td></tr>
<tr><td>E: U. S. Blues</td></tr>
</table></div>
<div class="setlist_table"><table border="0" cellspacing="0" cellpadding="0"><tr class="header"><td><span><a name="0523"></a><a href="/1982-05-23">5/23/1982 Greek Theatre, U. of California, Berkeley, CA</a></span> [<a href="http://www.archive.org/search.php?query=creator:%22Grateful Dead%22%20date:1982-05-23*">Listen/Download</a>]<tr><td>I: Shakedown > Promised, TLEO, Mama Tried > Mexicali, Loser > Rooster, Ramble On, Let It Grow</td></tr>
<tr><td>II: Scarlet > Fire, Samson, Ship Of Fools, Estimated > Eyes > Drumz > Other One > Stella Blue > Miracle > Casey Jones</td></tr>
<tr><td>E: Satisfaction > Brokedown</td></tr>
<tr class="notes"><td>Motorcycle space before "Other One."</i></td></tr>
</table></div>
<div class="setlist_table"><table border="0" cellspacing="0" cellpadding="0"><tr class="header"><td><span><a name="0528"></a><a href="/1982-05-28">5/28/1982 Moscone Convention Center, San Francisco, CA</a></span> [<a href="http://www.archive.org/search.php?query=creator:%22Grateful Dead%22%20date:1982-05-28*">Listen/Download</a>]<tr><td>I: Alabama > Greatest, Althea, Rooster, Tennessee Jed, Truckin > Drumz<span class="setlist_small">+</span> > GDTRFB > NFA</td></tr>
<tr><td>II: Walking Blues<span class="setlist_small">*</span>, A Mind To Give Up Livin<span class="setlist_small">*</span>, Lovelight<span class="setlist_small">*</span> > Johnny B. Goode<span class="setlist_small">*</span></td></tr>
<tr class="notes"><td>Only ''A Mind To Give Up Livin''; First ''Walking Blues''; Next ''Walking Blues'' 6/16/1985 [195 shows]</i></td></tr>
<tr class="notes"><td>Vietnam Vets benefit. Lineup: Country Joe; GD; Jefferson Starship. *with Boz Scaggs  and  John Cipollina. +with Flora Purim and Airto Moreira. Only "A Mind To Give Up Livin."</i></td></tr>
</table></div>
<div class="setlist_table"><table border="0" cellspacing="0" cellpadding="0"><tr class="header"><td><span><a name="0717"></a><a href="/1982-07-17">7/17/1982 County Fairgrounds, Ventura, CA</a></span> [<a href="http://www.archive.org/search.php?query=creator:%22Grateful Dead%22%20date:1982-07-17*">Listen/Download</a>]<tr><td>I: Bertha > Greatest, TLEO, Me  and  My Uncle > Big River, Althea > Rooster, Tennessee Jed > Truckin</td></tr>
<tr><td>II: Playin > China Cat > I Know You Rider > Estimated > Jam > Drumz > Wheel > Playin > Around > Saturday Night</td></tr>
<tr><td>E: Baby Blue</td></tr>
</table></div>
<div class="setlist_table"><table border="0" cellspacing="0" cellpadding="0"><tr class="header"><td><span><a name="0718"></a><a href="/1982-07-18">7/18/1982 County Fairgrounds, Ventura, CA</a></span> [<a href="http://www.archive.org/search.php?query=creator:%22Grateful Dead%22%20date:1982-07-18*">Listen/Download</a>]<tr><td>I: Minglewood, FOTD, Mama Tried > Mexicali, Loser, Cassidy, Ramble On, L. L. Rain > Deal</td></tr>
<tr><td>II: Samson > Franklin's, Woman Smarter, Ship Of Fools, Crazy Fingers > Drumz > NFA > Other One > Wharf Rat > Sugar Magnolia</td></tr>
<tr><td>E: Satisfaction > Brokedown</td></tr>
<tr class="notes"><td>Previous ''Crazy Fingers'' 9/30/1976 [417 shows]</i></td></tr>
</table></div>
<div class="setlist_table"><table border="0" cellspacing="0" cellpadding="0"><tr class="header"><td><span><a name="0725"></a><a href="/1982-07-25">7/25/1982 Compton Terrace Amphitheatre, Tempe, AZ</a></span> [<a href="http://www.archive.org/search.php?query=creator:%22Grateful Dead%22%20date:1982-07-25*">Listen/Download</a>]<tr><td>I: Half Step > Franklin's > C. C. Rider, Bird Song, El Paso, Candyman, Sailor > Saint > Deal</td></tr>
<tr><td>II: Scarlet > Fire > Drums > Samson, Crazy Fingers > Estimated > Jam > Drumz > NFA > Black Peter > Good Lovin</td></tr>
<tr><td>E: Don't Ease</td></tr>
<tr class="notes"><td>Brent Mydland's 250th Show</i></td></tr>
</table></div>
<div class="setlist_table"><table border="0" cellspacing="0" cellpadding="0"><tr class="header"><td><span><a name="0727"></a><a href="/1982-07-27">7/27/1982 Red Rocks Amphitheatre, Morrison, CO</a></span> [<a href="http://www.archive.org/search.php?query=creator:%22Grateful Dead%22%20date:1982-07-27*">Listen/Download</a>]<tr><td>I: Jack Straw > Sugaree, On The Road Again, Roses, Me  and  My Uncle > Big River, Peggy-O > Rooster, China Cat > I Know You Rider</td></tr>
<tr><td>II: Playin > Terrapin > Drumz > Wheel > Other One > Stella Blue > Playin</td></tr>
<tr><td>E: U. S. Blues</td></tr>
</table></div>
<div class="setlist_table"><table border="0" cellspacing="0" cellpadding="0"><tr class="header"><td><span><a name="0728"></a><a href="/1982-07-28">7/28/1982 Red Rocks Amphitheatre, Morrison, CO</a></span> [<a href="http://www.archive.org/search.php?query=creator:%22Grateful Dead%22%20date:1982-07-28*">Listen/Download</a>]<tr><td>I: Shakedown, BIODTL > Greatest, TLEO, Mama Tried > Mexicali, Big RxR Blues, Lazy Lightning > Supplication, Deal</td></tr>
<tr><td>II: Woman Smarter, Althea, Let It Grow > He's Gone > Truckin > Jam > Drumz > Spanish Jam > NFA > Black Peter > Sugar Magnolia</td></tr>
<tr><td>E: Baby Blue</td></tr>
<tr class="notes"><td>"C. C. Rider" tease Before "Lazy Lightning."</i></td></tr>
</table></div>
<div class="setlist_table"><table border="0" cellspacing="0" cellpadding="0"><tr class="header"><td><span><a name="0729"></a><a href="/1982-07-29">7/29/1982 Red Rocks Amphitheatre, Morrison, CO</a></span> [<a href="http://www.archive.org/search.php?query=creator:%22Grateful Dead%22%20date:1982-07-29*">Listen/Download</a>]<tr><td>I: Minglewood > FOTD, Cassidy, Loser, Stranger, Tennessee Jed > L. L. Rain, Might As Well</td></tr>
<tr><td>II: Cold Rain > Samson, Crazy Fingers > Miracle > Drumz > Other One > GDTRFB > Wharf Rat > Around > Good Lovin</td></tr>
<tr><td>E: Brokedown</td></tr>
</table></div>
<div class="setlist_table"><table border="0" cellspacing="0" cellpadding="0"><tr class="header"><td><span><a name="0731"></a><a href="/1982-07-31">7/31/1982 Manor Downs, Austin, TX</a></span> [<a href="http://www.archive.org/search.php?query=creator:%22Grateful Dead%22%20date:1982-07-31*">Listen/Download</a>]<tr><td>I: Alabama > Promised, Candyman, El Paso, Bird Song > Rooster, Ramble On, All Over Now, B. E. Women > Music, Deal</td></tr>
<tr><td>II: Scarlet > Fire > Estimated > Eyes > Jam > Drumz > Uncle John > Truckin > Morning Dew > Saturday Night</td></tr>
<tr><td>E: Don't Ease</td></tr>
</table></div>
<div class="setlist_table"><table border="0" cellspacing="0" cellpadding="0"><tr class="header"><td><span><a name="0801"></a><a href="/1982-08-01">8/1/1982 Zoo Amphitheatre, Oklahoma City, OK</a></span> [<a href="http://www.archive.org/search.php?query=creator:%22Grateful Dead%22%20date:1982-08-01*">Listen/Download</a>]<tr><td>I: Jack Straw, TLEO, C. C. Rider, Tennessee Jed, Me  and  My Uncle > Big River, China Cat > I Know You Rider</td></tr>
<tr><td>II: Playin > Iko Iko > Playin Jam > Sailor > Saint > Drumz > Wheel > Playin > Black Peter > Around > Johnny B. Goode</td></tr>
<tr><td>E: U. S. Blues</td></tr>
<tr class="notes"><td>Jerry Garcia's 40th birthday</i></td></tr>
</table></div>
<div class="setlist_table"><table border="0" cellspacing="0" cellpadding="0"><tr class="header"><td><span><a name="0803"></a><a href="/1982-08-03">8/3/1982 Starlight Theatre, Kansas City, MO</a></span> [<a href="http://www.archive.org/search.php?query=creator:%22Grateful Dead%22%20date:1982-08-03*">Listen/Download</a>]<tr><td>I: Half Step > Franklin's > Minglewood, Peggy-O, El Paso, Cumberland, Althea > Cassidy > Big RxR Blues, Woman Smarter, Might As Well</td></tr>
<tr><td>II: Shakedown > Samson, To Lay Me Down > Let It Grow > Drumz > He's Gone > Other One > Stella Blue > Sugar Magnolia</td></tr>
<tr><td>E: Casey Jones</td></tr>
<tr class="notes"><td>Next ''To Lay Me Down'' 10/17/1983 [84 shows]</i></td></tr>
</table></div>
<div class="setlist_table"><table border="0" cellspacing="0" cellpadding="0"><tr class="header"><td><span><a name="0804"></a><a href="/1982-08-04">8/4/1982 Kiel Auditorium, St. Louis, MO</a></span> [<a href="http://www.archive.org/search.php?query=creator:%22Grateful Dead%22%20date:1982-08-04*">Listen/Download</a>]<tr><td>I: Stranger, FOTD > C. C. Rider, B. E. Women, Mama Tried > Mexicali, Row Jimmy > L. L. Rain, Stagger Lee, Promised</td></tr>
<tr><td>II: Good Times > Estimated > Terrapin > Drumz > NFA > Black Peter > Around > Good Lovin</td></tr>
<tr><td>E: U. S. Blues</td></tr>
<tr class="notes"><td>Previous ''Stagger Lee'' 12/4/1979 [212 shows]</i></td></tr>
</table></div>
<div class="setlist_table"><table border="0" cellspacing="0" cellpadding="0"><tr class="header"><td><span><a name="0806"></a><a href="/1982-08-06">8/6/1982 St. Paul Civic Center Arena, St. Paul, MN</a></span> [<a href="http://www.archive.org/search.php?query=creator:%22Grateful Dead%22%20date:1982-08-06*">Listen/Download</a>]<tr><td>I: Bertha > Minglewood > Candyman, Rooster, Bird Song, El Paso, Tennessee Jed, All Over Now, Lazy Lightning > Supplication > Might As Well</td></tr>
<tr><td>II: Scarlet > Fire, Sailor > Saint > Jam > Drumz > Truckin > Wharf Rat > Around > GDTRFB > Johnny B. Goode</td></tr>
<tr><td>E: Baby Blue</td></tr>
</table></div>
<div class="setlist_table"><table border="0" cellspacing="0" cellpadding="0"><tr class="header"><td><span><a name="0807"></a><a href="/1982-08-07">8/7/1982 Alpine Valley Music Theatre, East Troy, WI</a></span> [<a href="http://www.archive.org/search.php?query=creator:%22Grateful Dead%22%20date:1982-08-07*">Listen/Download</a>]<tr><td>I: Music > Sugaree > Music, Me  and  My Uncle > Big River, Roses, C. C. Rider, Ramble On, BIODTL > On The Road Again, Althea, Let It Grow</td></tr>
<tr><td>II: China Cat > I Know You Rider, Woman Smarter, Ship Of Fools, Playin > Drumz > Wheel > Playin > Morning Dew > Saturday Night</td></tr>
<tr><td>E: U. S. Blues</td></tr>
<tr class="notes"><td>Entire show released as "Dick’s Picks Volume 32."</i></td></tr>
</table></div>
<div class="setlist_table"><table border="0" cellspacing="0" cellpadding="0"><tr class="header"><td><span><a name="0808"></a><a href="/1982-08-08">8/8/1982 Alpine Valley Music Theatre, East Troy, WI</a></span> [<a href="http://www.archive.org/search.php?query=creator:%22Grateful Dead%22%20date:1982-08-08*">Listen/Download</a>]<tr><td>I: Alabama > Promised, TLEO, Mama Tried > Mexicali, Loser > Rooster, B. E. Women, L. L. Rain, Peggy-O, Samson</td></tr>
<tr><td>II: Far From Me > Scarlet > Fire > Estimated > Drumz<span class="setlist_small">*</span> > Other One<span class="setlist_small">*</span> > NFA<span class="setlist_small">*+</span> > Wharf Rat<span class="setlist_small">*+</span> > Good Lovin<span class="setlist_small">*+</span></td></tr>
<tr><td>E: Satisfaction<span class="setlist_small">*+</span> > Brokedown<span class="setlist_small">*+</span></td></tr>
<tr class="notes"><td>Previous ''Far From Me'' 10/15/1981 [54 shows]</i></td></tr>
<tr class="notes"><td>*with Zakir Hussain.  +with John Cipollina. "Wang Dang Doodle" lyrics sung during "Satisfaction."</i></td></tr>
</table></div>
<div class="setlist_table"><table border="0" cellspacing="0" cellpadding="0"><tr class="header"><td><span><a name="0810"></a><a href="/1982-08-10">8/10/1982 Fieldhouse, University of Iowa, Iowa City, IA</a></span> [<a href="http://www.archive.org/search.php?query=creator:%22Grateful Dead%22%20date:1982-08-10*">Listen/Download</a>]<tr><td>I: Stranger, FOTD, Minglewood, Tennessee Jed, Cassidy, Roses, On The Road Again > BIODTL, Stagger Lee, Miracle > Bertha</td></tr>
<tr><td>II: China Cat > I Know You Rider, Sailor > Saint > Eyes > Drumz > Iko Iko > Truckin > Stella Blue > Sugar Magnolia</td></tr>
<tr><td>E: Baby Blue > Johnny B. Goode</td></tr>
<tr class="notes"><td>Next ''Stagger Lee'' 6/21/1985 [182 shows]</i></td></tr>
<tr class="notes"><td>Last concert at the fieldhouse. "Beer Barrel Polka" tuning into "On The Road Again." "Around" tease before "Sugar Magnolia." </i></td></tr>
</table></div>
<div class="setlist_table"><table border="0" cellspacing="0" cellpadding="0"><tr class="header"><td><span><a name="0822"></a><a href="/1982-08-22">8/22/1982 Le Club Front, San Rafael, CA</a></span> [<a href="http://www.archive.org/search.php?query=creator:%22Grateful Dead%22%20date:1982-08-22*">Listen/Download</a>]<tr><td>West L. A., Dupree x2, Touch x2, Day Job x2</td></tr>
<tr class="notes"><td>Rehearsal. One of these versions of "Touch of Grey" appears as an "In the Dark" bonus track in "Beyond Description (1973-1989)."</i></td></tr>
</table></div>
<div class="setlist_table"><table border="0" cellspacing="0" cellpadding="0"><tr class="header"><td><span><a name="0828"></a><a href="/1982-08-28">8/28/1982 Oregon Country Fair Site, Veneta, OR</a></span> [<a href="http://www.archive.org/search.php?query=creator:%22Grateful Dead%22%20date:1982-08-28*">Listen/Download</a>]<tr><td>I: Bertha > Minglewood, Tennessee Jed, Me  and  My Uncle > Big River, Althea, All Over Now, China Cat > I Know You Rider</td></tr>
<tr><td>II: Day Job > Woman Smarter, West L. A., Far From Me > Playin > Drumz > Wheel > Other One > Truckin > Black Peter > Playin > Saturday Night</td></tr>
<tr><td>E: Dupree's</td></tr>
<tr class="notes"><td>First ''Day Job''; First ''West L. A.''; Previous ''Dupree's'' 4/14/1978 [338 shows]</i></td></tr>
<tr class="notes"><td>"Springfield Creamery Presents The Second Decadenal Field Trip" - opposite end of 08-27-72 site. Also: Peter Rowan; The Flying Karamazov Brothers; Strangers With Candy; Robert Cray Band; Tatoo.</i></td></tr>
</table></div>
<div class="setlist_table"><table border="0" cellspacing="0" cellpadding="0"><tr class="header"><td><span><a name="0829"></a><a href="/1982-08-29">8/29/1982 Seattle Center Memorial Coliseum, Seattle, WA</a></span> [<a href="http://www.archive.org/search.php?query=creator:%22Grateful Dead%22%20date:1982-08-29*">Listen/Download</a>]<tr><td>I: Jack Straw > Big RxR Blues, Mama Tried > Mexicali, West L. A. > Rooster, Loser, Cassidy, Roses > Let It Grow</td></tr>
<tr><td>II: Day Job > Samson, He's Gone > Drumz > NFA > Wharf Rat > Sugar Magnolia</td></tr>
<tr><td>E: U. S. Blues</td></tr>
</table></div>
<div class="setlist_table"><table border="0" cellspacing="0" cellpadding="0"><tr class="header"><td><span><a name="0905"></a><a href="/1982-09-05">9/5/1982 Glen Helen Regional Park, Devore, CA</a></span> [<a href="http://www.archive.org/search.php?query=creator:%22Grateful Dead%22%20date:1982-09-05*">Listen/Download</a>]<tr><td>I: Playin > Shakedown > Minglewood, Samson, China Cat > I Know You Rider</td></tr>
<tr><td>II: Sugaree > Woman Smarter, Truckin > Drumz > NFA > Black Peter > Sugar Magnolia</td></tr>
<tr><td>E1: U. S. Blues</td></tr>
<tr><td>E2: Satisfaction</td></tr>
<tr class="notes"><td>US Festival. 9:30 AM. Also: Fleetwood Mac; Jackson Browne; Jimmy Buffet  and  The Coral Reefer Band; Jerry Jeff Walker.</i></td></tr>
</table></div>
<div class="setlist_table"><table border="0" cellspacing="0" cellpadding="0"><tr class="header"><td><span><a name="0908"></a><a href="/1982-09-08">9/8/1982 Saenger Performing Arts Center, New Orleans, LA</a></span> [<a href="http://www.archive.org/search.php?query=creator:%22Grateful Dead%22%20date:1982-09-08*">Listen/Download</a>]<tr><td></td></tr>
</table></div>
<div class="setlist_table"><table border="0" cellspacing="0" cellpadding="0"><tr class="header"><td><span><a name="0909"></a><a href="/1982-09-09">9/9/1982 Saenger Performing Arts Center, New Orleans, LA</a></span> [<a href="http://www.archive.org/search.php?query=creator:%22Grateful Dead%22%20date:1982-09-09*">Listen/Download</a>]<tr><td>I: Half Step > Franklin's, Stranger, West L. A., Mama Tried > Mexicali, Althea</td></tr>
<tr><td>II: Uncle John > Samson > Uncle John > Estimated > Eyes > Drumz > Wheel > Other One > Wharf Rat > Good Lovin</td></tr>
<tr><td>E: Day Job > Johnny B. Goode</td></tr>
</table></div>
<div class="setlist_table"><table border="0" cellspacing="0" cellpadding="0"><tr class="header"><td><span><a name="0911"></a><a href="/1982-09-11">9/11/1982 West Palm Beach Auditorium, West Palm Beach, FL</a></span> [<a href="http://www.archive.org/search.php?query=creator:%22Grateful Dead%22%20date:1982-09-11*">Listen/Download</a>]<tr><td>I: Minglewood, TLEO, Me  and  My Uncle > Big River, Dupree's, C. C. Rider, Loser, L. L. Rain, Tennessee Jed, Let It Grow</td></tr>
<tr><td>II: Scarlet > Fire > Sailor > Saint > Terrapin > Drumz > Truckin > Stella Blue > Around > Saturday Night</td></tr>
<tr><td>E: Baby Blue</td></tr>
<tr class="notes"><td>Mickey Hart's 39th birthday.</i></td></tr>
</table></div>
<div class="setlist_table"><table border="0" cellspacing="0" cellpadding="0"><tr class="header"><td><span><a name="0911"></a><a href="/1982-09-11">9/11/1982 (unknown), Tampa, FL</a></span> [<a href="http://www.archive.org/search.php?query=creator:%22Grateful Dead%22%20date:1982-09-11*">Listen/Download</a>]<tr><td></td></tr>
<tr class="notes"><td>The Dead played West Palm Beach instead.</i></td></tr>
</table></div>
<div class="setlist_table"><table border="0" cellspacing="0" cellpadding="0"><tr class="header"><td><span><a name="0912"></a><a href="/1982-09-12">9/12/1982 Lakeland Civic Center Arena, Lakeland, FL</a></span> [<a href="http://www.archive.org/search.php?query=creator:%22Grateful Dead%22%20date:1982-09-12*">Listen/Download</a>]<tr><td>I: Alabama > Greatest, FOTD, Cassidy, West L. A. > Rooster, B. E. Women, All Over Now, Might As Well</td></tr>
<tr><td>II: Woman Smarter, Ship Of Fools, Playin > Drumz > Wheel > NFA > Morning Dew > Sugar Magnolia</td></tr>
<tr><td>E: Don't Ease</td></tr>
</table></div>
<div class="setlist_table"><table border="0" cellspacing="0" cellpadding="0"><tr class="header"><td><span><a name="0912"></a><a href="/1982-09-12">9/12/1982 (unknown), Gainesville, FL</a></span> [<a href="http://www.archive.org/search.php?query=creator:%22Grateful Dead%22%20date:1982-09-12*">Listen/Download</a>]<tr><td></td></tr>
<tr class="notes"><td>The Dead played Lakeland instead.</i></td></tr>
</table></div>
<div class="setlist_table"><table border="0" cellspacing="0" cellpadding="0"><tr class="header"><td><span><a name="0914"></a><a href="/1982-09-14">9/14/1982 University of Virginia, Charlottesville, VA</a></span> [<a href="http://www.archive.org/search.php?query=creator:%22Grateful Dead%22%20date:1982-09-14*">Listen/Download</a>]<tr><td>I: Jack Straw, Peggy-O > C. C. Rider, Big RxR Blues, El Paso, Bird Song, Lazy Lightning > Supplication > Deal</td></tr>
<tr><td>II: China Cat > I Know You Rider, Samson, High Time, Estimated > He's Gone > Drumz > Iko Iko > Truckin > Black Peter > Miracle > Bertha</td></tr>
<tr><td>E: Johnny B. Goode</td></tr>
<tr class="notes"><td>Previous ''High Time'' 10/6/1981 [67 shows]</i></td></tr>
</table></div>
<div class="setlist_table"><table border="0" cellspacing="0" cellpadding="0"><tr class="header"><td><span><a name="0915"></a><a href="/1982-09-15">9/15/1982 Capital Centre, Landover, MD</a></span> [<a href="http://www.archive.org/search.php?query=creator:%22Grateful Dead%22%20date:1982-09-15*">Listen/Download</a>]<tr><td>I: Playin > Crazy Fingers > Playin Jam > Rooster, Dupree's > BIODTL, Roses > Playin Jam > Let It Grow > Day Job</td></tr>
<tr><td>II: Shakedown > Playin Jam > Sailor > Saint > Drumz > NFA > Stella Blue > Around > Good Lovin</td></tr>
<tr><td>E: Touch</td></tr>
<tr class="notes"><td>First ''Touch''</i></td></tr>
</table></div>
<div class="setlist_table"><table border="0" cellspacing="0" cellpadding="0"><tr class="header"><td><span><a name="0917"></a><a href="/1982-09-17">9/17/1982 Cumberland County Civic Center, Portland, ME</a></span> [<a href="http://www.archive.org/search.php?query=creator:%22Grateful Dead%22%20date:1982-09-17*">Listen/Download</a>]<tr><td>I: Bertha > Promised, Candyman > C. C. Rider, Althea, Me  and  My Uncle > Big River, Dupree's, All Over Now, West L. A., Throwing Stones > Deal</td></tr>
<tr><td>II: Touch > Woman Smarter, High Time, Estimated > Eyes > Drumz > Spanish Jam > Other One > GDTRFB > Morning Dew > Sugar Magnolia</td></tr>
<tr><td>E: U. S. Blues</td></tr>
<tr class="notes"><td>First ''Throwing Stones''</i></td></tr>
</table></div>
<div class="setlist_table"><table border="0" cellspacing="0" cellpadding="0"><tr class="header"><td><span><a name="0918"></a><a href="/1982-09-18">9/18/1982 Boston Garden, Boston, MA</a></span> [<a href="http://www.archive.org/search.php?query=creator:%22Grateful Dead%22%20date:1982-09-18*">Listen/Download</a>]<tr><td>I: Jack Straw > Sugaree, Mama Tried > Mexicali, West L. A. > Rooster, Dupree's, Cassidy, Far From Me</td></tr>
<tr><td>II: Samson, Uncle John > Playin > Drumz > Throwing Stones > Wheel > Truckin > Wharf Rat > Around > Saturday Night</td></tr>
<tr><td>E: Baby Blue</td></tr>
<tr class="notes"><td>The jam out of "Playing in the Band" contains hints of "All Along the Watchtower."</i></td></tr>
</table></div>
<div class="setlist_table"><table border="0" cellspacing="0" cellpadding="0"><tr class="header"><td><span><a name="0920"></a><a href="/1982-09-20">9/20/1982 Madison Square Garden, New York, NY</a></span> [<a href="http://www.archive.org/search.php?query=creator:%22Grateful Dead%22%20date:1982-09-20*">Listen/Download</a>]<tr><td>I: Shakedown > Minglewood, Candyman > El Paso, Dupree's, All Over Now, Good Times, Row Jimmy, Throwing Stones > Day Job</td></tr>
<tr><td>II: Scarlet > Fire, Woman Smarter, Terrapin > Drumz > Spanish Jam > Truckin > Other One > Stella Blue > Sugar Magnolia</td></tr>
<tr><td>E: Touch</td></tr>
</table></div>
<div class="setlist_table"><table border="0" cellspacing="0" cellpadding="0"><tr class="header"><td><span><a name="0921"></a><a href="/1982-09-21">9/21/1982 Madison Square Garden, New York, NY</a></span> [<a href="http://www.archive.org/search.php?query=creator:%22Grateful Dead%22%20date:1982-09-21*">Listen/Download</a>]<tr><td>I: Playin > Crazy Fingers > Me  and  My Uncle > Big River, West L. A., BIODTL > Loser, L. L. Rain, China Cat > I Know You Rider</td></tr>
<tr><td>II: Touch > Samson, High Time, Estimated > He's Gone > Drumz > Throwing Stones > NFA > Black Peter > Good Lovin</td></tr>
<tr><td>E: U. S. Blues</td></tr>
<tr class="notes"><td>Next ''High Time'' 4/27/1984 [94 shows]</i></td></tr>
</table></div>
<div class="setlist_table"><table border="0" cellspacing="0" cellpadding="0"><tr class="header"><td><span><a name="0923"></a><a href="/1982-09-23">9/23/1982 Veterans Memorial Coliseum, New Haven, CT</a></span> [<a href="http://www.archive.org/search.php?query=creator:%22Grateful Dead%22%20date:1982-09-23*">Listen/Download</a>]<tr><td>I: Alabama > Greatest, Peggy-O > Rooster, Tennessee Jed, Mama Tried > Mexicali, Althea > Let It Grow</td></tr>
<tr><td>II: Touch > Sailor > Saint > Ship Of Fools, Throwing Stones > Drumz > Wheel > Other One > Wharf Rat > Around > Johnny B. Goode</td></tr>
<tr><td>E: Baby Blue</td></tr>
</table></div>
<div class="setlist_table"><table border="0" cellspacing="0" cellpadding="0"><tr class="header"><td><span><a name="0924"></a><a href="/1982-09-24">9/24/1982 Carrier Dome, Syracuse University, Syracuse, NY</a></span> [<a href="http://www.archive.org/search.php?query=creator:%22Grateful Dead%22%20date:1982-09-24*">Listen/Download</a>]<tr><td>I: Jack Straw, FOTD > C. C. Rider, Ramble On, Minglewood, Bird Song > L. L. Rain, China Cat > I Know You Rider</td></tr>
<tr><td>II: Far From Me > Playin > Crazy Fingers > Playin Jam > Throwing Stones > Drumz > Iko Iko > Truckin > GDTRFB > Black Peter > Around > Sugar Magnolia</td></tr>
<tr><td>E: Brokedown</td></tr>
</table></div>
<div class="setlist_table"><table border="0" cellspacing="0" cellpadding="0"><tr class="header"><td><span><a name="1009"></a><a href="/1982-10-09">10/9/1982 Frost Amphitheatre, Stanford U., Palo Alto, CA</a></span> [<a href="http://www.archive.org/search.php?query=creator:%22Grateful Dead%22%20date:1982-10-09*">Listen/Download</a>]<tr><td>I: Alabama > Greatest, TLEO, On The Road Again > BIODTL, West L. A., Me  and  My Uncle > Big River, Dupree's, Music > Deal</td></tr>
<tr><td>II: Throwing Stones > Touch, Estimated > Eyes > Drumz > Truckin > Other One > Morning Dew, Saturday Night</td></tr>
<tr><td>E: U. S. Blues</td></tr>
</table></div>
<div class="setlist_table"><table border="0" cellspacing="0" cellpadding="0"><tr class="header"><td><span><a name="1010"></a><a href="/1982-10-10">10/10/1982 Frost Amphitheatre, Stanford U., Palo Alto, CA</a></span> [<a href="http://www.archive.org/search.php?query=creator:%22Grateful Dead%22%20date:1982-10-10*">Listen/Download</a>]<tr><td>I: Minglewood > Sugaree > Rooster, Tennessee Jed, Cassidy, Loser, Far From Me, L. L. Rain > China Cat > I Know You Rider</td></tr>
<tr><td>II: Playin > Crazy Fingers > Jam > Sailor > Saint > Touch > Drumz > Wheel > Throwing Stones > NFA > Black Peter > Sugar Magnolia</td></tr>
<tr><td>E: Satisfaction > Baby Blue</td></tr>
<tr class="notes"><td>Next ''Crazy Fingers'' 10/8/1983 [57 shows]</i></td></tr>
</table></div>
<div class="setlist_table"><table border="0" cellspacing="0" cellpadding="0"><tr class="header"><td><span><a name="1017"></a><a href="/1982-10-17">10/17/1982 Downs of Santa Fe, Santa Fe, NM</a></span> [<a href="http://www.archive.org/search.php?query=creator:%22Grateful Dead%22%20date:1982-10-17*">Listen/Download</a>]<tr><td>I: Half Step > Franklin's > Minglewood, Candyman, Me  and  My Uncle > Mexicali, Althea, Woman Smarter, Ramble On, Let It Grow > Deal</td></tr>
<tr><td>II: Shakedown > Samson, Good Times, Estimated > He's Gone > Drumz > Throwing Stones > GDTRFB > Wheel > Other One > Wharf Rat > Good Lovin</td></tr>
<tr><td>E: Don't Ease</td></tr>
<tr class="notes"><td>Next ''Half Step'' 3/27/1985 [148 shows]</i></td></tr>
</table></div>
<div class="setlist_table"><table border="0" cellspacing="0" cellpadding="0"><tr class="header"><td><span><a name="1125"></a><a href="/1982-11-25">11/25/1982 Montego Bay, Freeport Zone, Jamaica</a></span> [<a href="http://www.archive.org/search.php?query=creator:%22Grateful Dead%22%20date:1982-11-25*">Listen/Download</a>]<tr><td>I: Sugaree, Minglewood, Loser, Woman Smarter, Althea, Let It Grow</td></tr>
<tr><td>II: Samson, Scarlet > Fire > Drumz > Throwing Stones > NFA > Black Peter > Good Lovin</td></tr>
<tr class="notes"><td>Jamaica World Music Festival. The Dead performed 4:30 to 7:00 AM in the early hours of 11-26-82. 11/25: Wailers; Toots  and  The Maytals; B-52s; Glady Knight  and  The Pips; Jimmy Cliff; Grateful Dead. 11/26: English Beat; Stacy Lattisaw; Aretha Franklin; Black Uhuru; Skeeter Davis; Beach Boys; Yellowman; Bobby  and  The Midnights; Joe Jackson; Rita Marley  and  The Melody Makers; Rick James; Squeeze; The Clash; Peter Tosh.</i></td></tr>
</table></div>
<div class="setlist_table"><table border="0" cellspacing="0" cellpadding="0"><tr class="header"><td><span><a name="1226"></a><a href="/1982-12-26">12/26/1982 Oakland Auditorium Arena, Oakland, CA</a></span> [<a href="http://www.archive.org/search.php?query=creator:%22Grateful Dead%22%20date:1982-12-26*">Listen/Download</a>]<tr><td>I: Minglewood, Peggy-O, Mama Tried > Mexicali, Althea, Cassidy, Candyman > All Over Now, China Cat > I Know You Rider</td></tr>
<tr><td>II: Touch, Far From Me > Estimated > Eyes > Drumz > Throwing Stones > Wharf Rat > Around > Good Lovin</td></tr>
<tr><td>E: Day Job</td></tr>
</table></div>
<div class="setlist_table"><table border="0" cellspacing="0" cellpadding="0"><tr class="header"><td><span><a name="1227"></a><a href="/1982-12-27">12/27/1982 Oakland Auditorium Arena, Oakland, CA</a></span> [<a href="http://www.archive.org/search.php?query=creator:%22Grateful Dead%22%20date:1982-12-27*">Listen/Download</a>]<tr><td>I: Bertha > Greatest, Bird Song > BIODTL, TLEO, Me  and  My Uncle > Big River, B. E. Women > Let It Grow</td></tr>
<tr><td>II: Scarlet > Fire > Playin > Drumz > Wheel > Other One > Black Peter > Sugar Magnolia</td></tr>
<tr><td>E: U. S. Blues</td></tr>
</table></div>
<div class="setlist_table"><table border="0" cellspacing="0" cellpadding="0"><tr class="header"><td><span><a name="1228"></a><a href="/1982-12-28">12/28/1982 Oakland Auditorium Arena, Oakland, CA</a></span> [<a href="http://www.archive.org/search.php?query=creator:%22Grateful Dead%22%20date:1982-12-28*">Listen/Download</a>]<tr><td>I: Jack Straw, Tennessee Jed > El Paso, FOTD, On The Road Again > Touch, Woman Smarter, Dire Wolf, Lazy Lightning > Supplication > Deal</td></tr>
<tr><td>II: Shakedown > Samson, Good Times, Terrapin > Drumz > Throwing Stones > NFA > Morning Dew</td></tr>
<tr><td>E1: Satisfaction</td></tr>
<tr><td>E2: Baby Blue</td></tr>
<tr class="notes"><td>Next ''Good Times'' 4/26/1984 [84 shows]</i></td></tr>
</table></div>
<div class="setlist_table"><table border="0" cellspacing="0" cellpadding="0"><tr class="header"><td><span><a name="1230"></a><a href="/1982-12-30">12/30/1982 Oakland Auditorium Arena, Oakland, CA</a></span> [<a href="http://www.archive.org/search.php?query=creator:%22Grateful Dead%22%20date:1982-12-30*">Listen/Download</a>]<tr><td>I: Alabama > Promised, Loser > Rooster, Big RxR Blues, Stranger, Dupree's, Music > Don't Ease</td></tr>
<tr><td>II: Touch, Throwing Stones > Franklin's, Sailor > Saint > He's Gone > Drumz > Truckin > Stella Blue > GDTRFB > Johnny B. Goode</td></tr>
<tr><td>E: Hard To Handle<span class="setlist_small">*</span>, Tell Mama<span class="setlist_small">*</span></td></tr>
<tr class="notes"><td>First ''Tell Mama''; Previous ''Hard To Handle'' 8/26/1971 [715 shows]</i></td></tr>
<tr class="notes"><td>*with Etta James  and  Tower Of Power horns. Soundcheck: Midnight Hour*, Hard To Handle*, Lovelight*, Tell Mama*</i></td></tr>
</table></div>
<div class="setlist_table"><table border="0" cellspacing="0" cellpadding="0"><tr class="header"><td><span><a name="1231"></a><a href="/1982-12-31">12/31/1982 Oakland Auditorium Arena, Oakland, CA</a></span> [<a href="http://www.archive.org/search.php?query=creator:%22Grateful Dead%22%20date:1982-12-31*">Listen/Download</a>]<tr><td>I: Cold Rain, C. C. Rider<span class="setlist_small">#</span>, Cumberland, Far From Me, Cassidy, Ramble On, L. L. Rain, Day Job</td></tr>
<tr><td>II: Sugar Magnolia > Sugaree > Woman Smarter, Ship Of Fools, Playin > Drumz > NFA<span class="setlist_small">+</span>, Deal<span class="setlist_small">+</span> > Sunshine Daydream<span class="setlist_small">+</span></td></tr>
<tr><td>III: Lovelight<span class="setlist_small">*</span> > Tell Mama<span class="setlist_small">*</span>, Baby What You Want<span class="setlist_small">*</span>, Hard To Handle<span class="setlist_small">*</span>, Midnight Hour<span class="setlist_small">*</span></td></tr>
<tr><td>E: Brokedown</td></tr>
<tr class="notes"><td>Next ''Sunshine Daydream'' 3/22/1987 [254 shows]; Final ''Hard To Handle''; Final ''Tell Mama''</i></td></tr>
<tr class="notes"><td>Bill Graham rides in at midnighton a giant mushroom. Also: Dinosaurs; Batucaje. *with Etta James  and  Tower Of Power horns. +with John Cipollina. #with Matt Kelly. FM broadcast KQAK-San Francisco. </i></td></tr>
</table></div>

  </div>
 </div><!--END main-->

</div><!--END container -->
</div><!--END centering div-->
</body>
</html>