<!DOCTYPE HTML PUBLIC "-//W3C//DTD HTML 4.01 Transitional//EN"
"http://www.w3.org/TR/html4/loose.dtd">
<html>
  <head>
    <meta http-equiv="Content-Type" content="text/html; charset=utf-8">
    <title>
      1992 Setlists
    </title>
  </head>
  <body>
    <div id="main">
      <div>
        1992 Setlists
      </div><script language="Javascript" type="text/javascript">
<!--
      function showtab () {
      document.getElementById('hide').style.display = 'none';
      document.getElementById('show').style.display = 'block';
      }
      function hidetab () {
      document.getElementById('show').style.display = 'none';
      document.getElementById('hide').style.display = 'block';
      }
      -->
      </script>
      <p>
        February: <a href="#0221">21</a> <a href="#0222">22</a> <a href="#0223">23</a> <a href="#0224">24</a>
        <br>
        March: <a href="#0301">1</a> <a href="#0302">2</a> <a href="#0303">3</a> <a href="#0305">5</a> <a href="#0306">6</a> <a href="#0308">8</a> <a href="#0309">9</a> <a href="#0311">11</a> <a href="#0312">12</a> <a href="#0313">13</a> <a href="#0316">16</a> <a href="#0317">17</a> <a href="#0318">18</a> <a href="#0320">20</a> <a href="#0321">21</a> <a href="#0323">23</a> <a href="#0324">24</a>
        <br>
        May: <a href="#0519">19</a> <a href="#0520">20</a> <a href="#0521">21</a> <a href="#0523">23</a> <a href="#0524">24</a> <a href="#0525">25</a> <a href="#0529">29</a> <a href="#0530">30</a> <a href="#0531">31</a>
        <br>
        June: <a href="#0606">6</a> <a href="#0608">8</a> <a href="#0609">9</a> <a href="#0611">11</a> <a href="#0612">12</a> <a href="#0614">14</a> <a href="#0615">15</a> <a href="#0617">17</a> <a href="#0618">18</a> <a href="#0620">20</a> <a href="#0622">22</a> <a href="#0623">23</a> <a href="#0625">25</a> <a href="#0626">26</a> <a href="#0628">28</a> <a href="#0629">29</a>
        <br>
        July: <a href="#0701">1</a>
        <br>
        August: <a href="#0822">22</a> <a href="#0823">23</a> <a href="#0825">25</a> <a href="#0826">26</a> <a href="#0827">27</a>
        <br>
        September: <a href="#0909">9</a> <a href="#0910">10</a> <a href="#0911">11</a> <a href="#0913">13</a> <a href="#0914">14</a> <a href="#0915">15</a> <a href="#0917">17</a> <a href="#0918">18</a> <a href="#0919">19</a> <a href="#0921">21</a> <a href="#0922">22</a> <a href="#0923">23</a> <a href="#0925">25</a> <a href="#0926">26</a> <a href="#0927">27</a> <a href="#0929">29</a> <a href="#0930">30</a>
        <br>
        October: <a href="#1001">1</a>
        <br>
        December: <a href="#1202">2</a> <a href="#1203">3</a> <a href="#1205">5</a> <a href="#1206">6</a> <a href="#1211">11</a> <a href="#1212">12</a> <a href="#1213">13</a> <a href="#1216">16</a> <a href="#1217">17</a>
      </p>
      <div>
        <table border="0" cellspacing="0" cellpadding="0">
          <tr>
            <td id="0221">
              <a href="/1992-02-21">2/21/1992 Le Club Front, San Rafael, CA</a> [<a href="http://www.archive.org/search.php?query=creator:%22Grateful%20Dead%22%20date:1992-02-21*">Listen/Download</a>]
            </td>
          </tr>
          <tr>
            <td>
              Corina, So Many Roads chord changes x5, So Many Roads intro x4, So Many Roads x4, So Many Roads harmonies, Got A Horse, Along The Navajo Trail, Topsy I, Wave To The Wind x2, Topsy I, It's A Man's World, Wave To The Wind
            </td>
          </tr>
          <tr>
            <td>
              Rehearsal.
            </td>
          </tr>
        </table>
      </div>
      <div>
        <table border="0" cellspacing="0" cellpadding="0">
          <tr>
            <td id="0222">
              <a href="/1992-02-22">2/22/1992 Oakland Coliseum Arena, Oakland, CA</a> [<a href="http://www.archive.org/search.php?query=creator:%22Grateful%20Dead%22%20date:1992-02-22*">Listen/Download</a>]
            </td>
          </tr>
          <tr>
            <td>
              I: Bertha &gt; Promised, Stagger Lee, Wang Dang Doodle, So Many Roads, Queen Jane, Loose Lucy, Wave To The Wind, Don't Ease
            </td>
          </tr>
          <tr>
            <td>
              II: Saturday Night, Half Step &gt; Estimated &gt; He's Gone &gt; Jam &gt; Drumz &gt; Wheel &gt; Watchtower &gt; Black Peter &gt; Sugar Magnolia
            </td>
          </tr>
          <tr>
            <td>
              E: U. S. Blues
            </td>
          </tr>
          <tr>
            <td>
              First ''So Many Roads''; First ''Wave To The Wind''
            </td>
          </tr>
          <tr>
            <td>
              Without Bruce Hornsby.
            </td>
          </tr>
        </table>
      </div>
      <div>
        <table border="0" cellspacing="0" cellpadding="0">
          <tr>
            <td id="0223">
              <a href="/1992-02-23">2/23/1992 Oakland Coliseum Arena, Oakland, CA</a> [<a href="http://www.archive.org/search.php?query=creator:%22Grateful%20Dead%22%20date:1992-02-23*">Listen/Download</a>]
            </td>
          </tr>
          <tr>
            <td>
              I: Bucket, Peggy-O, Walking Blues, Ramble On, Way To Go, B. T. Wind, Corinna
            </td>
          </tr>
          <tr>
            <td>
              II: China Cat &gt; I Know You Rider, Playin &gt; Terrapin &gt; Drumz* &gt; Miracle &gt; Stella Blue &gt; Throwing Stones &gt; NFA
            </td>
          </tr>
          <tr>
            <td>
              E: Box Of Rain
            </td>
          </tr>
          <tr>
            <td>
              First ''Corinna''; First ''Way To Go''
            </td>
          </tr>
          <tr>
            <td>
              *with Baba Olatunji. Without Bruce Hornsby.
            </td>
          </tr>
        </table>
      </div>
      <div>
        <table border="0" cellspacing="0" cellpadding="0">
          <tr>
            <td id="0224">
              <a href="/1992-02-24">2/24/1992 Oakland Coliseum Arena, Oakland, CA</a> [<a href="http://www.archive.org/search.php?query=creator:%22Grateful%20Dead%22%20date:1992-02-24*">Listen/Download</a>]
            </td>
          </tr>
          <tr>
            <td>
              I: Touch, Stranger, FOTD, Masterpiece, Althea, Cassidy
            </td>
          </tr>
          <tr>
            <td>
              II: Iko Iko &gt; Corinna &gt; Other One &gt; Way To Go &gt; Same Thing &gt; Drumz &gt; Wave To The Wind &gt; Other One &gt; So Many Roads &gt; Lovelight
            </td>
          </tr>
          <tr>
            <td>
              E: Mighty Quinn
            </td>
          </tr>
          <tr>
            <td>
              Without Bruce Hornsby. "Other One" tease before "Same Thing."
            </td>
          </tr>
        </table>
      </div>
      <div>
        <table border="0" cellspacing="0" cellpadding="0">
          <tr>
            <td id="0301">
              <a href="/1992-03-01">3/1/1992 The Omni, Atlanta, GA</a> [<a href="http://www.archive.org/search.php?query=creator:%22Grateful%20Dead%22%20date:1992-03-01*">Listen/Download</a>]
            </td>
          </tr>
          <tr>
            <td>
              I: Jack Straw, Althea, Wang Dang Doodle, Row Jimmy, Memphis Blues, So Many Roads, Picasso Moon, Don't Ease
            </td>
          </tr>
          <tr>
            <td>
              II: Saint, Way To Go &gt; Scarlet &gt; Fire &gt; Drumz &gt; Last Time &gt; Black Peter &gt; Sugar Magnolia
            </td>
          </tr>
          <tr>
            <td>
              E: The Weight
            </td>
          </tr>
        </table>
      </div>
      <div>
        <table border="0" cellspacing="0" cellpadding="0">
          <tr>
            <td id="0302">
              <a href="/1992-03-02">3/2/1992 The Omni, Atlanta, GA</a> [<a href="http://www.archive.org/search.php?query=creator:%22Grateful%20Dead%22%20date:1992-03-02*">Listen/Download</a>]
            </td>
          </tr>
          <tr>
            <td>
              I: Cold Rain, Rooster, B. E. Women, All Over Now, Loser, Masterpiece &gt; Deal
            </td>
          </tr>
          <tr>
            <td>
              II: China Cat &gt; I Know You Rider, Woman Smarter &gt; Terrapin &gt; Jam &gt; Drumz &gt; Other One &gt; Stella Blue &gt; Around
            </td>
          </tr>
          <tr>
            <td>
              E: Heaven's Door
            </td>
          </tr>
          <tr>
            <td>
              Jackhammer during "Drumz."
            </td>
          </tr>
        </table>
      </div>
      <div>
        <table border="0" cellspacing="0" cellpadding="0">
          <tr>
            <td id="0303">
              <a href="/1992-03-03">3/3/1992 The Omni, Atlanta, GA</a> [<a href="http://www.archive.org/search.php?query=creator:%22Grateful%20Dead%22%20date:1992-03-03*">Listen/Download</a>]
            </td>
          </tr>
          <tr>
            <td>
              I: Bucket, Sugaree, Walking Blues, Candyman, Queen Jane, Tennessee Jed, Corinna
            </td>
          </tr>
          <tr>
            <td>
              II: Iko Iko, Playin &gt; Uncle John &gt; Wave To The Wind &gt; Drumz &gt; China Doll &gt; Throwing Stones &gt; Lovelight
            </td>
          </tr>
          <tr>
            <td>
              E: Brokedown
            </td>
          </tr>
        </table>
      </div>
      <div>
        <table border="0" cellspacing="0" cellpadding="0">
          <tr>
            <td id="0305">
              <a href="/1992-03-05">3/5/1992 Hampton Coliseum, Hampton, VA</a> [<a href="http://www.archive.org/search.php?query=creator:%22Grateful%20Dead%22%20date:1992-03-05*">Listen/Download</a>]
            </td>
          </tr>
          <tr>
            <td>
              I: Help &gt; Slipknot &gt; Franklin's &gt; Same Thing, Jack A Roe, Tom Thumb Blues, Let It Grow
            </td>
          </tr>
          <tr>
            <td>
              II: Eyes &gt; Way To Go, Estimated &gt; He's Gone &gt; Drumz &gt; Wheel &gt; Miracle &gt; So Many Roads &gt; Good Lovin
            </td>
          </tr>
          <tr>
            <td>
              E: U. S. Blues
            </td>
          </tr>
        </table>
      </div>
      <div>
        <table border="0" cellspacing="0" cellpadding="0">
          <tr>
            <td id="0306">
              <a href="/1992-03-06">3/6/1992 Hampton Coliseum, Hampton, VA</a> [<a href="http://www.archive.org/search.php?query=creator:%22Grateful%20Dead%22%20date:1992-03-06*">Listen/Download</a>]
            </td>
          </tr>
          <tr>
            <td>
              I: Stranger, FOTD, Mexicali &gt; Maggie's Farm, Stagger Lee, Picasso Moon &gt; Bird Song
            </td>
          </tr>
          <tr>
            <td>
              II: New Speedway &gt; Truckin &gt; Crazy Fingers &gt; Corinna &gt; Drumz &gt; Last Time &gt; Wharf Rat &gt; Sugar Magnolia
            </td>
          </tr>
          <tr>
            <td>
              E: The Weight
            </td>
          </tr>
          <tr>
            <td>
              Various tuning jams before "Stranger" including "The Entertainer" and "Happy Birthday."
            </td>
          </tr>
        </table>
      </div>
      <div>
        <table border="0" cellspacing="0" cellpadding="0">
          <tr>
            <td id="0308">
              <a href="/1992-03-08">3/8/1992 Capital Centre, Landover, MD</a> [<a href="http://www.archive.org/search.php?query=creator:%22Grateful%20Dead%22%20date:1992-03-08*">Listen/Download</a>]
            </td>
          </tr>
          <tr>
            <td>
              I: LTGTR, Touch, Minglewood, Ramble On, B. T. Wind, Loose Lucy, Desolation Row, Big RxR Blues, Music
            </td>
          </tr>
          <tr>
            <td>
              II: Samson, Way To Go, Foolish Heart &gt; L. L. Rain, Wave To The Wind &gt; Drumz &gt; Watchtower &gt; So Many Roads &gt; Throwing Stones &gt; NFA
            </td>
          </tr>
          <tr>
            <td>
              E: Mighty Quinn
            </td>
          </tr>
        </table>
      </div>
      <div>
        <table border="0" cellspacing="0" cellpadding="0">
          <tr>
            <td id="0309">
              <a href="/1992-03-09">3/9/1992 Capital Centre, Landover, MD</a> [<a href="http://www.archive.org/search.php?query=creator:%22Grateful%20Dead%22%20date:1992-03-09*">Listen/Download</a>]
            </td>
          </tr>
          <tr>
            <td>
              I: Jack Straw &gt; West L. A., Me and My Uncle &gt; Big River, Row Jimmy, Cassidy &gt; Deal
            </td>
          </tr>
          <tr>
            <td>
              II: Victim &gt; Iko Iko &gt; Corinna &gt; Dark Star &gt; Drumz &gt; Miracle &gt; Morning Dew
            </td>
          </tr>
          <tr>
            <td>
              E: Satisfaction
            </td>
          </tr>
          <tr>
            <td>
              Previous ''Satisfaction'' 7/7/1986 [406 shows]
            </td>
          </tr>
          <tr>
            <td>
              "Dark Star" is first verse only. "Shenandoah" theme during "Space."
            </td>
          </tr>
        </table>
      </div>
      <div>
        <table border="0" cellspacing="0" cellpadding="0">
          <tr>
            <td id="0311">
              <a href="/1992-03-11">3/11/1992 Nassau Veterans Memorial Coliseum, Uniondale, NY</a> [<a href="http://www.archive.org/search.php?query=creator:%22Grateful%20Dead%22%20date:1992-03-11*">Listen/Download</a>]
            </td>
          </tr>
          <tr>
            <td>
              I: Cold Rain, Wang Dang Doodle, Dire Wolf, Queen Jane, Althea, All Over Now, So Many Roads, Picasso Moon
            </td>
          </tr>
          <tr>
            <td>
              II: China Cat &gt; I Know You Rider, Playin &gt; Terrapin &gt; Drumz &gt; Last Time &gt; Black Peter &gt; Around
            </td>
          </tr>
          <tr>
            <td>
              E: Heaven's Door
            </td>
          </tr>
        </table>
      </div>
      <div>
        <table border="0" cellspacing="0" cellpadding="0">
          <tr>
            <td id="0312">
              <a href="/1992-03-12">3/12/1992 Nassau Veterans Memorial Coliseum, Uniondale, NY</a> [<a href="http://www.archive.org/search.php?query=creator:%22Grateful%20Dead%22%20date:1992-03-12*">Listen/Download</a>]
            </td>
          </tr>
          <tr>
            <td>
              I: Greatest &gt; Bertha, Walking Blues, Stagger Lee, BIODTL, Tom Thumb Blues, Tennessee Jed &gt; Promised
            </td>
          </tr>
          <tr>
            <td>
              II: Saint &gt; Ship Of Fools, Corinna &gt; Playin Reprise &gt; Drumz &gt; Other One &gt; Stella Blue &gt; Sugar Magnolia
            </td>
          </tr>
          <tr>
            <td>
              E: Baby Blue
            </td>
          </tr>
          <tr>
            <td>
              Next ''Baby Blue'' 3/10/1993 [51 shows]
            </td>
          </tr>
        </table>
      </div>
      <div>
        <table border="0" cellspacing="0" cellpadding="0">
          <tr>
            <td id="0313">
              <a href="/1992-03-13">3/13/1992 Nassau Veterans Memorial Coliseum, Uniondale, NY</a> [<a href="http://www.archive.org/search.php?query=creator:%22Grateful%20Dead%22%20date:1992-03-13*">Listen/Download</a>]
            </td>
          </tr>
          <tr>
            <td>
              I: Half Step, Same Thing, B. E. Women, El Paso, Candyman, Masterpiece, Bird Song
            </td>
          </tr>
          <tr>
            <td>
              II: Way To Go, Crazy Fingers &gt; Woman Smarter, Wave To The Wind &gt; Drumz &gt; Wheel &gt; Wharf Rat &gt; Throwing Stones &gt; Lovelight
            </td>
          </tr>
          <tr>
            <td>
              E: Box Of Rain
            </td>
          </tr>
          <tr>
            <td>
              Previous ''El Paso'' 5/12/1991 [61 shows]
            </td>
          </tr>
          <tr>
            <td>
              First locomotive airhorn during "Drumz."
            </td>
          </tr>
        </table>
      </div>
      <div>
        <table border="0" cellspacing="0" cellpadding="0">
          <tr>
            <td id="0316">
              <a href="/1992-03-16">3/16/1992 The Spectrum, Philadelphia, PA</a> [<a href="http://www.archive.org/search.php?query=creator:%22Grateful%20Dead%22%20date:1992-03-16*">Listen/Download</a>]
            </td>
          </tr>
          <tr>
            <td>
              I: LTGTR, Stranger, FOTD, C. C. Rider &gt; Train To Cry, B. T. Wind, Ramble On, Let It Grow
            </td>
          </tr>
          <tr>
            <td>
              II: Corinna &gt; Scarlet &gt; Fire &gt; Estimated &gt; Drumz &gt; Watchtower &gt; Morning Dew
            </td>
          </tr>
          <tr>
            <td>
              E: Johnny B. Goode
            </td>
          </tr>
          <tr>
            <td>
              Final ''C. C. Rider''; Final ''Train To Cry''
            </td>
          </tr>
        </table>
      </div>
      <div>
        <table border="0" cellspacing="0" cellpadding="0">
          <tr>
            <td id="0317">
              <a href="/1992-03-17">3/17/1992 The Spectrum, Philadelphia, PA</a> [<a href="http://www.archive.org/search.php?query=creator:%22Grateful%20Dead%22%20date:1992-03-17*">Listen/Download</a>]
            </td>
          </tr>
          <tr>
            <td>
              I: Box Of Rain, Minglewood, Loser, Memphis Blues, Tennessee Jed, Cassidy
            </td>
          </tr>
          <tr>
            <td>
              II: Way To Go, Truckin &gt; Spoonful &gt; He's Gone &gt; Drumz &gt; Miracle &gt; So Many Roads &gt; Sugar Magnolia
            </td>
          </tr>
          <tr>
            <td>
              E: The Weight
            </td>
          </tr>
        </table>
      </div>
      <div>
        <table border="0" cellspacing="0" cellpadding="0">
          <tr>
            <td id="0318">
              <a href="/1992-03-18">3/18/1992 The Spectrum, Philadelphia, PA</a> [<a href="http://www.archive.org/search.php?query=creator:%22Grateful%20Dead%22%20date:1992-03-18*">Listen/Download</a>]
            </td>
          </tr>
          <tr>
            <td>
              I: Touch &gt; Wang Dang Doodle, Jack A Roe, All Over Now, Row Jimmy, Picasso Moon, Deal
            </td>
          </tr>
          <tr>
            <td>
              II: Eyes &gt; Corinna &gt; Playin Reprise &gt; Uncle John &gt; Jam &gt; Drumz &gt; Wave To The Wind &gt; Wharf Rat &gt; Throwing Stones &gt; NFA
            </td>
          </tr>
          <tr>
            <td>
              E: Brokedown
            </td>
          </tr>
          <tr>
            <td>
              Locomotive airhorn during "Drumz."
            </td>
          </tr>
        </table>
      </div>
      <div>
        <table border="0" cellspacing="0" cellpadding="0">
          <tr>
            <td id="0320">
              <a href="/1992-03-20">3/20/1992 Copps Coliseum, Hamilton, Ontario, Canada</a> [<a href="http://www.archive.org/search.php?query=creator:%22Grateful%20Dead%22%20date:1992-03-20*">Listen/Download</a>]
            </td>
          </tr>
          <tr>
            <td>
              I: Bucket, Althea, Same Thing, B. E. Women, Mexicali &gt; Maggie's Farm, Bird Song &gt; Promised
            </td>
          </tr>
          <tr>
            <td>
              II: Shakedown, Woman Smarter, Dark Star &gt; Drumz &gt; Other One &gt; SOTM &gt; Lovelight
            </td>
          </tr>
          <tr>
            <td>
              E: U. S. Blues
            </td>
          </tr>
          <tr>
            <td>
              "Dark Star" first verse sung, instrumental second verse.
            </td>
          </tr>
        </table>
      </div>
      <div>
        <table border="0" cellspacing="0" cellpadding="0">
          <tr>
            <td id="0321">
              <a href="/1992-03-21">3/21/1992 Copps Coliseum, Hamilton, Ontario, Canada</a> [<a href="http://www.archive.org/search.php?query=creator:%22Grateful%20Dead%22%20date:1992-03-21*">Listen/Download</a>]
            </td>
          </tr>
          <tr>
            <td>
              I: Help &gt; Slipknot &gt; Franklin's, Rooster, Peggy-O, Queen Jane, So Many Roads
            </td>
          </tr>
          <tr>
            <td>
              II: Way To Go, Corinna &gt; Terrapin &gt; Drumz &gt; Last Time &gt; Black Peter &gt; Saturday Night
            </td>
          </tr>
          <tr>
            <td>
              E: Box Of Rain
            </td>
          </tr>
          <tr>
            <td>
              Short "Shenandoah" theme during "Space."; Bruce Hornsby's 100th Show
            </td>
          </tr>
        </table>
      </div>
      <div>
        <table border="0" cellspacing="0" cellpadding="0">
          <tr>
            <td id="0323">
              <a href="/1992-03-23">3/23/1992 The Palace, Auburn Hills, MI</a> [<a href="http://www.archive.org/search.php?query=creator:%22Grateful%20Dead%22%20date:1992-03-23*">Listen/Download</a>]
            </td>
          </tr>
          <tr>
            <td>
              I: Jack Straw, Cold Rain, Walking Blues, Loose Lucy, Masterpiece, West L. A., BIODTL, Tennessee Jed &gt; Music
            </td>
          </tr>
          <tr>
            <td>
              II: Victim, Wave To The Wind, Crazy Fingers &gt; Uncle John &gt; Drumz &gt; Wheel &gt; Watchtower &gt; Morning Dew
            </td>
          </tr>
          <tr>
            <td>
              E: Gloria
            </td>
          </tr>
          <tr>
            <td>
              Previous ''Gloria'' 11/1/1985 [468 shows]
            </td>
          </tr>
        </table>
      </div>
      <div>
        <table border="0" cellspacing="0" cellpadding="0">
          <tr>
            <td id="0324">
              <a href="/1992-03-24">3/24/1992 The Palace, Auburn Hills, MI</a> [<a href="http://www.archive.org/search.php?query=creator:%22Grateful%20Dead%22%20date:1992-03-24*">Listen/Download</a>]
            </td>
          </tr>
          <tr>
            <td>
              I: Touch &gt; Greatest, New Speedway, Me and My Uncle &gt; Big River, Way To Go, So Many Roads &gt; Corinna
            </td>
          </tr>
          <tr>
            <td>
              II: China Cat &gt; I Know You Rider, Saint &gt; Foolish Heart &gt; Drumz &gt; Miracle &gt; Stella Blue &gt; Throwing Stones &gt; NFA
            </td>
          </tr>
          <tr>
            <td>
              E: The Weight
            </td>
          </tr>
          <tr>
            <td>
              Bruce Hornsby's last show as a member of the Grateful Dead. Locomotive airhorn during "Drumz."; Bruce Hornsby's Last Show
            </td>
          </tr>
        </table>
      </div>
      <div>
        <table border="0" cellspacing="0" cellpadding="0">
          <tr>
            <td id="0519">
              <a href="/1992-05-19">5/19/1992 Cal Expo Amphitheatre, Sacramento, CA</a> [<a href="http://www.archive.org/search.php?query=creator:%22Grateful%20Dead%22%20date:1992-05-19*">Listen/Download</a>]
            </td>
          </tr>
          <tr>
            <td>
              I: Cold Rain, Rooster, Althea, Queen Jane, Tennessee Jed, Let It Grow
            </td>
          </tr>
          <tr>
            <td>
              II: China Cat &gt; I Know You Rider, L. L. Rain, Way To Go, Terrapin &gt; Drumz &gt; Miracle &gt; Black Peter &gt; Sugar Magnolia
            </td>
          </tr>
          <tr>
            <td>
              E: Baba O'Riley &gt; TNK
            </td>
          </tr>
          <tr>
            <td>
              First ''Baba O'Riley''; First ''TNK''
            </td>
          </tr>
          <tr>
            <td>
              Rex Foundation benefit. David Grisman Quintet opened.
            </td>
          </tr>
        </table>
      </div>
      <div>
        <table border="0" cellspacing="0" cellpadding="0">
          <tr>
            <td id="0520">
              <a href="/1992-05-20">5/20/1992 Cal Expo Amphitheatre, Sacramento, CA</a> [<a href="http://www.archive.org/search.php?query=creator:%22Grateful%20Dead%22%20date:1992-05-20*">Listen/Download</a>]
            </td>
          </tr>
          <tr>
            <td>
              I: Jack Straw, Bertha, Walking Blues, B. E. Women, Desolation Row, Stagger Lee, Promised
            </td>
          </tr>
          <tr>
            <td>
              II: Box Of Rain, Truckin &gt; Crazy Fingers &gt; Saint &gt; Drumz &gt; Other One &gt; Wharf Rat &gt; Around
            </td>
          </tr>
          <tr>
            <td>
              E: U. S. Blues
            </td>
          </tr>
          <tr>
            <td>
              Rex Foundation benefit. The Heiroglyphics Ensemble opened.
            </td>
          </tr>
        </table>
      </div>
      <div>
        <table border="0" cellspacing="0" cellpadding="0">
          <tr>
            <td id="0521">
              <a href="/1992-05-21">5/21/1992 Cal Expo Amphitheatre, Sacramento, CA</a> [<a href="http://www.archive.org/search.php?query=creator:%22Grateful%20Dead%22%20date:1992-05-21*">Listen/Download</a>]
            </td>
          </tr>
          <tr>
            <td>
              I: Touch, Wang Dang Doodle, Row Jimmy, Me and My Uncle &gt; Maggie's Farm, Bird Song
            </td>
          </tr>
          <tr>
            <td>
              II: Scarlet &gt; Fire, Estimated &gt; He's Gone &gt; Drumz &gt; Watchtower &gt; SOTM &gt; Lovelight
            </td>
          </tr>
          <tr>
            <td>
              E: Gloria
            </td>
          </tr>
          <tr>
            <td>
              Rex Foundation benefit. Pharoah Sanders opened.
            </td>
          </tr>
        </table>
      </div>
      <div>
        <table border="0" cellspacing="0" cellpadding="0">
          <tr>
            <td id="0523">
              <a href="/1992-05-23">5/23/1992 Shoreline Amphitheatre, Mountain View, CA</a> [<a href="http://www.archive.org/search.php?query=creator:%22Grateful%20Dead%22%20date:1992-05-23*">Listen/Download</a>]
            </td>
          </tr>
          <tr>
            <td>
              I: Bucket &gt; Sugaree, Minglewood, Candyman, Cassidy, Loose Lucy, Music
            </td>
          </tr>
          <tr>
            <td>
              II: Box Of Rain, Woman Smarter, Ship Of Fools, Playin &gt; Uncle John &gt; Drumz &gt; Wheel &gt; Stella Blue &gt; Saturday Night
            </td>
          </tr>
          <tr>
            <td>
              E: Heaven's Door
            </td>
          </tr>
        </table>
      </div>
      <div>
        <table border="0" cellspacing="0" cellpadding="0">
          <tr>
            <td id="0524">
              <a href="/1992-05-24">5/24/1992 Shoreline Amphitheatre, Mountain View, CA</a> [<a href="http://www.archive.org/search.php?query=creator:%22Grateful%20Dead%22%20date:1992-05-24*">Listen/Download</a>]
            </td>
          </tr>
          <tr>
            <td>
              I: Shakedown, Same Thing, Dire Wolf, Masterpiece, Loser, All Over Now, Foolish Heart
            </td>
          </tr>
          <tr>
            <td>
              II: Eyes &gt; Samson, So Many Roads, Way To Go &gt; Corinna &gt; Drumz &gt; Last Time &gt; Morning Dew
            </td>
          </tr>
          <tr>
            <td>
              E: Johnny B. Goode
            </td>
          </tr>
        </table>
      </div>
      <div>
        <table border="0" cellspacing="0" cellpadding="0">
          <tr>
            <td id="0525">
              <a href="/1992-05-25">5/25/1992 Shoreline Amphitheatre, Mountain View, CA</a> [<a href="http://www.archive.org/search.php?query=creator:%22Grateful%20Dead%22%20date:1992-05-25*">Listen/Download</a>]
            </td>
          </tr>
          <tr>
            <td>
              I: LTGTR, Stranger, West L. A., Mexicali &gt; Big River, Tom Thumb Blues, Tennessee Jed, Picasso Moon
            </td>
          </tr>
          <tr>
            <td>
              II: Victim &gt; Iko Iko, Spoonful &gt; New Speedway &gt; Drumz &gt; Throwing Stones &gt; Attics &gt; NFA
            </td>
          </tr>
          <tr>
            <td>
              E: Baba O'Riley &gt; TNK
            </td>
          </tr>
          <tr>
            <td>
              Locomotive airhorn during "Drumz."
            </td>
          </tr>
        </table>
      </div>
      <div>
        <table border="0" cellspacing="0" cellpadding="0">
          <tr>
            <td id="0529">
              <a href="/1992-05-29">5/29/1992 Sam Boyd Silver Bowl, U.N.L.V., Las Vegas, NV</a> [<a href="http://www.archive.org/search.php?query=creator:%22Grateful%20Dead%22%20date:1992-05-29*">Listen/Download</a>]
            </td>
          </tr>
          <tr>
            <td>
              I: Half Step, Walking Blues, Peggy-O, B. T. Wind, TLEO, Memphis Blues, Jack A Roe, Promised
            </td>
          </tr>
          <tr>
            <td>
              II: China Cat &gt; I Know You Rider &gt; L. L. Rain, Crazy Fingers &gt; Playin &gt; Drumz &gt; Watchtower &gt; China Doll &gt; Sugar Magnolia
            </td>
          </tr>
          <tr>
            <td>
              E: The Weight
            </td>
          </tr>
          <tr>
            <td>
              Steve Miller opened.
            </td>
          </tr>
        </table>
      </div>
      <div>
        <table border="0" cellspacing="0" cellpadding="0">
          <tr>
            <td id="0530">
              <a href="/1992-05-30">5/30/1992 Sam Boyd Silver Bowl, U.N.L.V., Las Vegas, NV</a> [<a href="http://www.archive.org/search.php?query=creator:%22Grateful%20Dead%22%20date:1992-05-30*">Listen/Download</a>]
            </td>
          </tr>
          <tr>
            <td>
              I: Jack Straw &gt; Sugaree, Wang Dang Doodle, High Time, Maggie's Farm, Cumberland, Cassidy, Don't Ease
            </td>
          </tr>
          <tr>
            <td>
              II: Eyes &gt; Way To Go, Truckin &gt; Smokestack &gt; Terrapin &gt; Drumz &gt; Spanish Jam &gt; Miracle &gt; SOTM &gt; Saturday Night
            </td>
          </tr>
          <tr>
            <td>
              E: Heaven's Door
            </td>
          </tr>
          <tr>
            <td>
              Previous ''Smokestack'' 9/5/1991 [53 shows]
            </td>
          </tr>
          <tr>
            <td>
              Steve Miller opened.
            </td>
          </tr>
        </table>
      </div>
      <div>
        <table border="0" cellspacing="0" cellpadding="0">
          <tr>
            <td id="0531">
              <a href="/1992-05-31">5/31/1992 Sam Boyd Silver Bowl, U.N.L.V., Las Vegas, NV</a> [<a href="http://www.archive.org/search.php?query=creator:%22Grateful%20Dead%22%20date:1992-05-31*">Listen/Download</a>]
            </td>
          </tr>
          <tr>
            <td>
              I: Help &gt; Slipknot &gt; Franklin's, Minglewood, Roses, Queen Jane, Bird Song, Picasso Moon
            </td>
          </tr>
          <tr>
            <td>
              II: Scarlet &gt; Fire, Woman Smarter, So Many Roads, Saint &gt; He's Gone &gt; Drumz &gt; Attics &gt; Spoonful* &gt; Other One* &gt; Morning Dew*
            </td>
          </tr>
          <tr>
            <td>
              E: Baba O'Riley* &gt; TNK*
            </td>
          </tr>
          <tr>
            <td>
              Steve Miller opened. *with Steve Miller. Locomotive airhorn during "Drumz."
            </td>
          </tr>
        </table>
      </div>
      <div>
        <table border="0" cellspacing="0" cellpadding="0">
          <tr>
            <td id="0606">
              <a href="/1992-06-06">6/6/1992 Rich Stadium, Orchard Park, NY</a> [<a href="http://www.archive.org/search.php?query=creator:%22Grateful%20Dead%22%20date:1992-06-06*">Listen/Download</a>]
            </td>
          </tr>
          <tr>
            <td>
              I: Touch &gt; Greatest, Althea, All Over Now, FOTD, Masterpiece, Ramble On, Let It Grow
            </td>
          </tr>
          <tr>
            <td>
              II: Iko Iko, Estimated &gt; Same Thing, He's Gone &gt; Drumz &gt; Other One &gt; Wheel &gt; Throwing Stones &gt; Saturday Night
            </td>
          </tr>
          <tr>
            <td>
              E: Baba O'Riley &gt; TNK
            </td>
          </tr>
          <tr>
            <td>
              Steve Miller opened. "Take A Step Back" before "Ramble On." Locomotive airhorn during "Drumz."
            </td>
          </tr>
        </table>
      </div>
      <div>
        <table border="0" cellspacing="0" cellpadding="0">
          <tr>
            <td id="0608">
              <a href="/1992-06-08">6/8/1992 Richfield Coliseum, Richfield, OH</a> [<a href="http://www.archive.org/search.php?query=creator:%22Grateful%20Dead%22%20date:1992-06-08*">Listen/Download</a>]
            </td>
          </tr>
          <tr>
            <td>
              I: Stranger, Loser, Rooster, So Many Roads, Tom Thumb Blues, B. T. Wind, Don't Ease
            </td>
          </tr>
          <tr>
            <td>
              II: China Cat &gt; I Know You Rider &gt; Crazy Fingers &gt; Corinna &gt; Mind Left Body Jam &gt; Drumz &gt; Dark Star &gt; Last Time &gt; Stella Blue &gt; Sugar Magnolia
            </td>
          </tr>
          <tr>
            <td>
              E: U. S. Blues
            </td>
          </tr>
          <tr>
            <td>
              Previous ''Mind Left Body Jam'' 3/24/1990 [171 shows]
            </td>
          </tr>
          <tr>
            <td>
              "Dark Star" is first verse only.
            </td>
          </tr>
        </table>
      </div>
      <div>
        <table border="0" cellspacing="0" cellpadding="0">
          <tr>
            <td id="0609">
              <a href="/1992-06-09">6/9/1992 Richfield Coliseum, Richfield, OH</a> [<a href="http://www.archive.org/search.php?query=creator:%22Grateful%20Dead%22%20date:1992-06-09*">Listen/Download</a>]
            </td>
          </tr>
          <tr>
            <td>
              I: Cold Rain, Wang Dang Doodle, Peggy-O, Me and My Uncle &gt; Big River, Stagger Lee, Cassidy &gt; Deal
            </td>
          </tr>
          <tr>
            <td>
              II: Victim &gt; Ship Of Fools, Way To Go, Eyes &gt; Drumz &gt; Watchtower &gt; Black Peter &gt; Lovelight
            </td>
          </tr>
          <tr>
            <td>
              E: Brokedown
            </td>
          </tr>
          <tr>
            <td>
              "Shangri-La" tuning before "Cold Rain."
            </td>
          </tr>
        </table>
      </div>
      <div>
        <table border="0" cellspacing="0" cellpadding="0">
          <tr>
            <td id="0611">
              <a href="/1992-06-11">6/11/1992 Knickerbocker Arena, Albany, NY</a> [<a href="http://www.archive.org/search.php?query=creator:%22Grateful%20Dead%22%20date:1992-06-11*">Listen/Download</a>]
            </td>
          </tr>
          <tr>
            <td>
              I: Bertha, Minglewood, Row Jimmy, Queen Jane, Dire Wolf, BIODTL, Loose Lucy, Music
            </td>
          </tr>
          <tr>
            <td>
              II: Foolish Heart &gt; Playin &gt; Uncle John &gt; Drumz &gt; Miracle &gt; Wharf Rat &gt; Around
            </td>
          </tr>
          <tr>
            <td>
              E: Mighty Quinn
            </td>
          </tr>
          <tr>
            <td>
              Next ''Mighty Quinn'' 7/29/1994 [151 shows]
            </td>
          </tr>
        </table>
      </div>
      <div>
        <table border="0" cellspacing="0" cellpadding="0">
          <tr>
            <td id="0612">
              <a href="/1992-06-12">6/12/1992 Knickerbocker Arena, Albany, NY</a> [<a href="http://www.archive.org/search.php?query=creator:%22Grateful%20Dead%22%20date:1992-06-12*">Listen/Download</a>]
            </td>
          </tr>
          <tr>
            <td>
              I: Jack Straw, Sugaree, Mexicali &gt; Maggie's Farm, B. E. Women, B. T. Wind, New Speedway &gt; Promised
            </td>
          </tr>
          <tr>
            <td>
              II: Scarlet &gt; Fire, Way To Go, Truckin &gt; Smokestack &gt; Drumz &gt; Last Time &gt; China Doll &gt; Sugar Magnolia
            </td>
          </tr>
          <tr>
            <td>
              E: Attics
            </td>
          </tr>
        </table>
      </div>
      <div>
        <table border="0" cellspacing="0" cellpadding="0">
          <tr>
            <td id="0614">
              <a href="/1992-06-14">6/14/1992 Giants Stadium, East Rutherford, NJ</a> [<a href="http://www.archive.org/search.php?query=creator:%22Grateful%20Dead%22%20date:1992-06-14*">Listen/Download</a>]
            </td>
          </tr>
          <tr>
            <td>
              I: Shakedown, Walking Blues, Candyman, Desolation Row, Jack A Roe, Picasso Moon &gt; Don't Ease
            </td>
          </tr>
          <tr>
            <td>
              II: Samson, Ship Of Fools, Way To Go &gt; Corinna &gt; Drumz &gt; Spoonful* &gt; Other One* &gt; Morning Dew*
            </td>
          </tr>
          <tr>
            <td>
              E: Baba O'Riley* &gt; TNK*
            </td>
          </tr>
          <tr>
            <td>
              Steve Miller opened. *with Steve Miller. Locomotive airhorn during "Drumz." "Smokestack" tease before "Spoonful."
            </td>
          </tr>
        </table>
      </div>
      <div>
        <table border="0" cellspacing="0" cellpadding="0">
          <tr>
            <td id="0615">
              <a href="/1992-06-15">6/15/1992 Giants Stadium, East Rutherford, NJ</a> [<a href="http://www.archive.org/search.php?query=creator:%22Grateful%20Dead%22%20date:1992-06-15*">Listen/Download</a>]
            </td>
          </tr>
          <tr>
            <td>
              I: Bucket, Sugaree, Same Thing, Tennessee Jed, Masterpiece, Bird Song
            </td>
          </tr>
          <tr>
            <td>
              II: Box Of Rain, Saint &gt; So Many Roads &gt; Terrapin &gt; Drumz &gt; Miracle* &gt; SOTM* &gt; Throwing Stones &gt; NFA*
            </td>
          </tr>
          <tr>
            <td>
              E: Heaven's Door*
            </td>
          </tr>
          <tr>
            <td>
              Steve Miller opened. *with Steve Miller. Locomotive airhorn during "Drumz."
            </td>
          </tr>
        </table>
      </div>
      <div>
        <table border="0" cellspacing="0" cellpadding="0">
          <tr>
            <td id="0617">
              <a href="/1992-06-17">6/17/1992 Charlotte Coliseum, Charlotte, NC</a> [<a href="http://www.archive.org/search.php?query=creator:%22Grateful%20Dead%22%20date:1992-06-17*">Listen/Download</a>]
            </td>
          </tr>
          <tr>
            <td>
              I: Touch &gt; Greatest, West L. A., Mama Tried &gt; Big River, Jack A Roe, All Over Now, Deal
            </td>
          </tr>
          <tr>
            <td>
              II: China Cat &gt; I Know You Rider, Way To Go, Estimated &gt; Drumz &gt; Wheel &gt; Black Peter &gt; Good Lovin
            </td>
          </tr>
          <tr>
            <td>
              E: U. S. Blues
            </td>
          </tr>
        </table>
      </div>
      <div>
        <table border="0" cellspacing="0" cellpadding="0">
          <tr>
            <td id="0618">
              <a href="/1992-06-18">6/18/1992 Charlotte Coliseum, Charlotte, NC</a> [<a href="http://www.archive.org/search.php?query=creator:%22Grateful%20Dead%22%20date:1992-06-18*">Listen/Download</a>]
            </td>
          </tr>
          <tr>
            <td>
              I: Stranger, Peggy-O, Rooster, Althea, Tom Thumb Blues, Let It Grow
            </td>
          </tr>
          <tr>
            <td>
              II: Woman Smarter, Eyes, L. L. Rain &gt; He's Gone &gt; Drumz &gt; Dark Star Jam &gt; Watchtower &gt; Morning Dew
            </td>
          </tr>
          <tr>
            <td>
              E: Satisfaction
            </td>
          </tr>
          <tr>
            <td>
              Next ''Satisfaction'' 8/1/1994 [148 shows]
            </td>
          </tr>
          <tr>
            <td>
              "Dark Star Jam" includes an instrumental verse.
            </td>
          </tr>
        </table>
      </div>
      <div>
        <table border="0" cellspacing="0" cellpadding="0">
          <tr>
            <td id="0620">
              <a href="/1992-06-20">6/20/1992 Robert F. Kennedy Stadium, Washington, DC</a> [<a href="http://www.archive.org/search.php?query=creator:%22Grateful%20Dead%22%20date:1992-06-20*">Listen/Download</a>]
            </td>
          </tr>
          <tr>
            <td>
              I: Cold Rain, Wang Dang Doodle, FOTD, Mexicali &gt; Maggie's Farm, Row Jimmy, Picasso Moon, Tennessee Jed &gt; Promised
            </td>
          </tr>
          <tr>
            <td>
              II: Corinna &gt; Crazy Fingers &gt; Playin &gt; Uncle John &gt; Drumz &gt; Casey Jones &gt; Throwing Stones &gt; Saturday Night*
            </td>
          </tr>
          <tr>
            <td>
              E: Baba O'Riley* &gt; TNK*
            </td>
          </tr>
          <tr>
            <td>
              Previous ''Casey Jones'' 11/2/1984 [549 shows]
            </td>
          </tr>
          <tr>
            <td>
              Steve Miller opened. *with Steve Miller. With Bruce Hornsby on accordion. Locomotive airhorn during "Drumz," also to begin "Casey Jones." "Shenandoah" theme during "Space." Soundcheck: "Baba O'Riley" &gt; "TNK," "Casey Jones," "Way To Go."
            </td>
          </tr>
        </table>
      </div>
      <div>
        <table border="0" cellspacing="0" cellpadding="0">
          <tr>
            <td id="0622">
              <a href="/1992-06-22">6/22/1992 Star Lake Amphitheatre, Burgettstown, PA</a> [<a href="http://www.archive.org/search.php?query=creator:%22Grateful%20Dead%22%20date:1992-06-22*">Listen/Download</a>]
            </td>
          </tr>
          <tr>
            <td>
              I: Jack Straw, Loser, Walking Blues, Roses, Queen Jane, Ramble On, BIODTL, Deal
            </td>
          </tr>
          <tr>
            <td>
              II: Scarlet &gt; Fire, Victim &gt; Dark Star &gt; Drumz &gt; Spanish Jam &gt; Other One &gt; Stella Blue &gt; GDTRFB &gt; Around
            </td>
          </tr>
          <tr>
            <td>
              E: Heaven's Door
            </td>
          </tr>
          <tr>
            <td>
              Previous ''GDTRFB'' 9/16/1991 [57 shows]
            </td>
          </tr>
          <tr>
            <td>
              "Dark Star" is second verse only.
            </td>
          </tr>
        </table>
      </div>
      <div>
        <table border="0" cellspacing="0" cellpadding="0">
          <tr>
            <td id="0623">
              <a href="/1992-06-23">6/23/1992 Star Lake Amphitheatre, Burgettstown, PA</a> [<a href="http://www.archive.org/search.php?query=creator:%22Grateful%20Dead%22%20date:1992-06-23*">Listen/Download</a>]
            </td>
          </tr>
          <tr>
            <td>
              I: Help &gt; Slipknot &gt; Franklin's, Minglewood, Stagger Lee, B. T. Wind, Big RxR Blues, Memphis Blues &gt; New Speedway
            </td>
          </tr>
          <tr>
            <td>
              II: Truckin &gt; Spoonful &gt; So Many Roads, Way To Go, Corinna &gt; Drumz &gt; Last Time &gt; SOTM &gt; Sugar Magnolia
            </td>
          </tr>
          <tr>
            <td>
              E: Brokedown
            </td>
          </tr>
          <tr>
            <td>
              Next ''Big RxR Blues'' 6/8/1994 [119 shows]
            </td>
          </tr>
        </table>
      </div>
      <div>
        <table border="0" cellspacing="0" cellpadding="0">
          <tr>
            <td id="0625">
              <a href="/1992-06-25">6/25/1992 Soldier Field, Chicago, IL</a> [<a href="http://www.archive.org/search.php?query=creator:%22Grateful%20Dead%22%20date:1992-06-25*">Listen/Download</a>]
            </td>
          </tr>
          <tr>
            <td>
              I: Bertha &gt; Greatest, West L. A., Me and My Uncle &gt; Big River, Ramble On, Masterpiece, B. E. Women &gt; Music
            </td>
          </tr>
          <tr>
            <td>
              II: Iko Iko*, Schoolgirl*+, Way To Go, Saint &gt; He's Gone &gt; Drumz &gt; Wheel &gt; So Many Roads &gt; Watchtower* &gt; Lovelight*+
            </td>
          </tr>
          <tr>
            <td>
              E: Gloria*+
            </td>
          </tr>
          <tr>
            <td>
              Next ''Schoolgirl'' 8/21/1993 [64 shows]
            </td>
          </tr>
          <tr>
            <td>
              *with Steve Miller. +with James Cotton on harmonica. Steve Miller opened.
            </td>
          </tr>
        </table>
      </div>
      <div>
        <table border="0" cellspacing="0" cellpadding="0">
          <tr>
            <td id="0626">
              <a href="/1992-06-26">6/26/1992 Soldier Field, Chicago, IL</a> [<a href="http://www.archive.org/search.php?query=creator:%22Grateful%20Dead%22%20date:1992-06-26*">Listen/Download</a>]
            </td>
          </tr>
          <tr>
            <td>
              I: Bucket, Peggy-O, Same Thing, Loose Lucy, Mexicali &gt; Maggie's Farm, Tennessee Jed, Picasso Moon
            </td>
          </tr>
          <tr>
            <td>
              II: Corinna &gt; Crazy Fingers, Playin &gt; Uncle John &gt; Drumz &gt; Miracle &gt; Wharf Rat &gt; Throwing Stones &gt; NFA
            </td>
          </tr>
          <tr>
            <td>
              E: The Weight
            </td>
          </tr>
          <tr>
            <td>
              Steve Miller opened.
            </td>
          </tr>
        </table>
      </div>
      <div>
        <table border="0" cellspacing="0" cellpadding="0">
          <tr>
            <td id="0628">
              <a href="/1992-06-28">6/28/1992 Deer Creek Music Center, Noblesville, IN</a> [<a href="http://www.archive.org/search.php?query=creator:%22Grateful%20Dead%22%20date:1992-06-28*">Listen/Download</a>]
            </td>
          </tr>
          <tr>
            <td>
              I: Help &gt; Slipknot &gt; Franklin's &gt; Wang Dang Doodle, Tom Thumb Blues, To Lay Me Down, El Paso, New Speedway &gt; Smokestack
            </td>
          </tr>
          <tr>
            <td>
              II: China Cat &gt; I Know You Rider, Estimated &gt; Way To Go &gt; Drumz &gt; Last Time &gt; China Doll &gt; Around
            </td>
          </tr>
          <tr>
            <td>
              E: Casey Jones
            </td>
          </tr>
          <tr>
            <td>
              Next ''El Paso'' 9/30/1993 [84 shows]; Previous ''To Lay Me Down'' 12/14/1990 [125 shows]; Final ''To Lay Me Down''
            </td>
          </tr>
        </table>
      </div>
      <div>
        <table border="0" cellspacing="0" cellpadding="0">
          <tr>
            <td id="0629">
              <a href="/1992-06-29">6/29/1992 Deer Creek Music Center, Noblesville, IN</a> [<a href="http://www.archive.org/search.php?query=creator:%22Grateful%20Dead%22%20date:1992-06-29*">Listen/Download</a>]
            </td>
          </tr>
          <tr>
            <td>
              I: Stranger, Althea, Rooster, So Many Roads, Desolation Row, Deal
            </td>
          </tr>
          <tr>
            <td>
              II: Box Of Rain, Victim &gt; Ship Of Fools, Corinna &gt; Drumz &gt; Other One &gt; Stella Blue &gt; Sugar Magnolia
            </td>
          </tr>
          <tr>
            <td>
              E: Brokedown
            </td>
          </tr>
        </table>
      </div>
      <div>
        <table border="0" cellspacing="0" cellpadding="0">
          <tr>
            <td id="0701">
              <a href="/1992-07-01">7/1/1992 Buckeye Lake Music Center, Hebron, OH</a> [<a href="http://www.archive.org/search.php?query=creator:%22Grateful%20Dead%22%20date:1992-07-01*">Listen/Download</a>]
            </td>
          </tr>
          <tr>
            <td>
              I: Touch &gt; Greatest, Stagger Lee, Masterpiece, B. E. Women, Picasso Moon, Bird Song &gt; Promised
            </td>
          </tr>
          <tr>
            <td>
              II: Saint, Midnight Hour*, West L. A.*, Truckin* &gt; Spoonful* &gt; Drumz &gt; Miracle &gt; Wharf Rat &gt; Lovelight
            </td>
          </tr>
          <tr>
            <td>
              E: Baba O'Riley &gt; TNK
            </td>
          </tr>
          <tr>
            <td>
              Previous ''Midnight Hour'' 9/18/1991 [61 shows]
            </td>
          </tr>
          <tr>
            <td>
              Steve Miller opened. *with Steve Miller and Norton Buffalo. Locomotive airhorn during "Drumz."
            </td>
          </tr>
        </table>
      </div>
      <div>
        <table border="0" cellspacing="0" cellpadding="0">
          <tr>
            <td id="0822">
              <a href="/1992-08-22">8/22/1992 Oregon Country Fair Site, Veneta, OR</a> [<a href="http://www.archive.org/search.php?query=creator:%22Grateful%20Dead%22%20date:1992-08-22*">Listen/Download</a>]
            </td>
          </tr>
          <tr>
            <td></td>
          </tr>
          <tr>
            <td>
              Cancelled due to Garcia's illness.
            </td>
          </tr>
        </table>
      </div>
      <div>
        <table border="0" cellspacing="0" cellpadding="0">
          <tr>
            <td id="0823">
              <a href="/1992-08-23">8/23/1992 Oregon Country Fair Site, Veneta, OR</a> [<a href="http://www.archive.org/search.php?query=creator:%22Grateful%20Dead%22%20date:1992-08-23*">Listen/Download</a>]
            </td>
          </tr>
          <tr>
            <td></td>
          </tr>
          <tr>
            <td>
              Cancelled due to Garcia's illness.
            </td>
          </tr>
        </table>
      </div>
      <div>
        <table border="0" cellspacing="0" cellpadding="0">
          <tr>
            <td id="0825">
              <a href="/1992-08-25">8/25/1992 Shoreline Amphitheatre, Mountain View, CA</a> [<a href="http://www.archive.org/search.php?query=creator:%22Grateful%20Dead%22%20date:1992-08-25*">Listen/Download</a>]
            </td>
          </tr>
          <tr>
            <td></td>
          </tr>
          <tr>
            <td>
              Cancelled due to Garcia's illness.
            </td>
          </tr>
        </table>
      </div>
      <div>
        <table border="0" cellspacing="0" cellpadding="0">
          <tr>
            <td id="0826">
              <a href="/1992-08-26">8/26/1992 Shoreline Amphitheatre, Mountain View, CA</a> [<a href="http://www.archive.org/search.php?query=creator:%22Grateful%20Dead%22%20date:1992-08-26*">Listen/Download</a>]
            </td>
          </tr>
          <tr>
            <td></td>
          </tr>
          <tr>
            <td>
              Cancelled due to Garcia's illness.
            </td>
          </tr>
        </table>
      </div>
      <div>
        <table border="0" cellspacing="0" cellpadding="0">
          <tr>
            <td id="0827">
              <a href="/1992-08-27">8/27/1992 Shoreline Amphitheatre, Mountain View, CA</a> [<a href="http://www.archive.org/search.php?query=creator:%22Grateful%20Dead%22%20date:1992-08-27*">Listen/Download</a>]
            </td>
          </tr>
          <tr>
            <td></td>
          </tr>
          <tr>
            <td>
              Cancelled due to Garcia's illness.
            </td>
          </tr>
        </table>
      </div>
      <div>
        <table border="0" cellspacing="0" cellpadding="0">
          <tr>
            <td id="0909">
              <a href="/1992-09-09">9/9/1992 Capital Centre, Landover, MD</a> [<a href="http://www.archive.org/search.php?query=creator:%22Grateful%20Dead%22%20date:1992-09-09*">Listen/Download</a>]
            </td>
          </tr>
          <tr>
            <td></td>
          </tr>
          <tr>
            <td>
              Cancelled due to Garcia's illness.
            </td>
          </tr>
        </table>
      </div>
      <div>
        <table border="0" cellspacing="0" cellpadding="0">
          <tr>
            <td id="0910">
              <a href="/1992-09-10">9/10/1992 Capital Centre, Landover, MD</a> [<a href="http://www.archive.org/search.php?query=creator:%22Grateful%20Dead%22%20date:1992-09-10*">Listen/Download</a>]
            </td>
          </tr>
          <tr>
            <td></td>
          </tr>
          <tr>
            <td>
              Cancelled due to Garcia's illness.
            </td>
          </tr>
        </table>
      </div>
      <div>
        <table border="0" cellspacing="0" cellpadding="0">
          <tr>
            <td id="0911">
              <a href="/1992-09-11">9/11/1992 Capital Centre, Landover, MD</a> [<a href="http://www.archive.org/search.php?query=creator:%22Grateful%20Dead%22%20date:1992-09-11*">Listen/Download</a>]
            </td>
          </tr>
          <tr>
            <td></td>
          </tr>
          <tr>
            <td>
              Cancelled due to Garcia's illness.
            </td>
          </tr>
        </table>
      </div>
      <div>
        <table border="0" cellspacing="0" cellpadding="0">
          <tr>
            <td id="0913">
              <a href="/1992-09-13">9/13/1992 The Spectrum, Philadelphia, PA</a> [<a href="http://www.archive.org/search.php?query=creator:%22Grateful%20Dead%22%20date:1992-09-13*">Listen/Download</a>]
            </td>
          </tr>
          <tr>
            <td></td>
          </tr>
          <tr>
            <td>
              Cancelled due to Garcia's illness.
            </td>
          </tr>
        </table>
      </div>
      <div>
        <table border="0" cellspacing="0" cellpadding="0">
          <tr>
            <td id="0914">
              <a href="/1992-09-14">9/14/1992 The Spectrum, Philadelphia, PA</a> [<a href="http://www.archive.org/search.php?query=creator:%22Grateful%20Dead%22%20date:1992-09-14*">Listen/Download</a>]
            </td>
          </tr>
          <tr>
            <td></td>
          </tr>
          <tr>
            <td>
              Cancelled due to Garcia's illness.
            </td>
          </tr>
        </table>
      </div>
      <div>
        <table border="0" cellspacing="0" cellpadding="0">
          <tr>
            <td id="0915">
              <a href="/1992-09-15">9/15/1992 The Spectrum, Philadelphia, PA</a> [<a href="http://www.archive.org/search.php?query=creator:%22Grateful%20Dead%22%20date:1992-09-15*">Listen/Download</a>]
            </td>
          </tr>
          <tr>
            <td></td>
          </tr>
          <tr>
            <td>
              Cancelled due to Garcia's illness.
            </td>
          </tr>
        </table>
      </div>
      <div>
        <table border="0" cellspacing="0" cellpadding="0">
          <tr>
            <td id="0917">
              <a href="/1992-09-17">9/17/1992 Madison Square Garden, New York, NY</a> [<a href="http://www.archive.org/search.php?query=creator:%22Grateful%20Dead%22%20date:1992-09-17*">Listen/Download</a>]
            </td>
          </tr>
          <tr>
            <td></td>
          </tr>
          <tr>
            <td>
              Cancelled due to Garcia's illness.
            </td>
          </tr>
        </table>
      </div>
      <div>
        <table border="0" cellspacing="0" cellpadding="0">
          <tr>
            <td id="0918">
              <a href="/1992-09-18">9/18/1992 Madison Square Garden, New York, NY</a> [<a href="http://www.archive.org/search.php?query=creator:%22Grateful%20Dead%22%20date:1992-09-18*">Listen/Download</a>]
            </td>
          </tr>
          <tr>
            <td></td>
          </tr>
          <tr>
            <td>
              Cancelled due to Garcia's illness.
            </td>
          </tr>
        </table>
      </div>
      <div>
        <table border="0" cellspacing="0" cellpadding="0">
          <tr>
            <td id="0919">
              <a href="/1992-09-19">9/19/1992 Madison Square Garden, New York, NY</a> [<a href="http://www.archive.org/search.php?query=creator:%22Grateful%20Dead%22%20date:1992-09-19*">Listen/Download</a>]
            </td>
          </tr>
          <tr>
            <td></td>
          </tr>
          <tr>
            <td>
              Cancelled due to Garcia's illness.
            </td>
          </tr>
        </table>
      </div>
      <div>
        <table border="0" cellspacing="0" cellpadding="0">
          <tr>
            <td id="0921">
              <a href="/1992-09-21">9/21/1992 Madison Square Garden, New York, NY</a> [<a href="http://www.archive.org/search.php?query=creator:%22Grateful%20Dead%22%20date:1992-09-21*">Listen/Download</a>]
            </td>
          </tr>
          <tr>
            <td></td>
          </tr>
          <tr>
            <td>
              Cancelled due to Garcia's illness.
            </td>
          </tr>
        </table>
      </div>
      <div>
        <table border="0" cellspacing="0" cellpadding="0">
          <tr>
            <td id="0922">
              <a href="/1992-09-22">9/22/1992 Madison Square Garden, New York, NY</a> [<a href="http://www.archive.org/search.php?query=creator:%22Grateful%20Dead%22%20date:1992-09-22*">Listen/Download</a>]
            </td>
          </tr>
          <tr>
            <td></td>
          </tr>
          <tr>
            <td>
              Cancelled due to Garcia's illness.
            </td>
          </tr>
        </table>
      </div>
      <div>
        <table border="0" cellspacing="0" cellpadding="0">
          <tr>
            <td id="0923">
              <a href="/1992-09-23">9/23/1992 Madison Square Garden, New York, NY</a> [<a href="http://www.archive.org/search.php?query=creator:%22Grateful%20Dead%22%20date:1992-09-23*">Listen/Download</a>]
            </td>
          </tr>
          <tr>
            <td></td>
          </tr>
          <tr>
            <td>
              Cancelled due to Garcia's illness.
            </td>
          </tr>
        </table>
      </div>
      <div>
        <table border="0" cellspacing="0" cellpadding="0">
          <tr>
            <td id="0925">
              <a href="/1992-09-25">9/25/1992 Boston Garden, Boston, MA</a> [<a href="http://www.archive.org/search.php?query=creator:%22Grateful%20Dead%22%20date:1992-09-25*">Listen/Download</a>]
            </td>
          </tr>
          <tr>
            <td></td>
          </tr>
          <tr>
            <td>
              Cancelled due to Garcia's illness.
            </td>
          </tr>
        </table>
      </div>
      <div>
        <table border="0" cellspacing="0" cellpadding="0">
          <tr>
            <td id="0926">
              <a href="/1992-09-26">9/26/1992 Boston Garden, Boston, MA</a> [<a href="http://www.archive.org/search.php?query=creator:%22Grateful%20Dead%22%20date:1992-09-26*">Listen/Download</a>]
            </td>
          </tr>
          <tr>
            <td></td>
          </tr>
          <tr>
            <td>
              Cancelled due to Garcia's illness.
            </td>
          </tr>
        </table>
      </div>
      <div>
        <table border="0" cellspacing="0" cellpadding="0">
          <tr>
            <td id="0927">
              <a href="/1992-09-27">9/27/1992 Boston Garden, Boston, MA</a> [<a href="http://www.archive.org/search.php?query=creator:%22Grateful%20Dead%22%20date:1992-09-27*">Listen/Download</a>]
            </td>
          </tr>
          <tr>
            <td></td>
          </tr>
          <tr>
            <td>
              Cancelled due to Garcia's illness.
            </td>
          </tr>
        </table>
      </div>
      <div>
        <table border="0" cellspacing="0" cellpadding="0">
          <tr>
            <td id="0929">
              <a href="/1992-09-29">9/29/1992 Boston Garden, Boston, MA</a> [<a href="http://www.archive.org/search.php?query=creator:%22Grateful%20Dead%22%20date:1992-09-29*">Listen/Download</a>]
            </td>
          </tr>
          <tr>
            <td></td>
          </tr>
          <tr>
            <td>
              Cancelled due to Garcia's illness.
            </td>
          </tr>
        </table>
      </div>
      <div>
        <table border="0" cellspacing="0" cellpadding="0">
          <tr>
            <td id="0930">
              <a href="/1992-09-30">9/30/1992 Boston Garden, Boston, MA</a> [<a href="http://www.archive.org/search.php?query=creator:%22Grateful%20Dead%22%20date:1992-09-30*">Listen/Download</a>]
            </td>
          </tr>
          <tr>
            <td></td>
          </tr>
          <tr>
            <td>
              Cancelled due to Garcia's illness.
            </td>
          </tr>
        </table>
      </div>
      <div>
        <table border="0" cellspacing="0" cellpadding="0">
          <tr>
            <td id="1001">
              <a href="/1992-10-01">10/1/1992 Boston Garden, Boston, MA</a> [<a href="http://www.archive.org/search.php?query=creator:%22Grateful%20Dead%22%20date:1992-10-01*">Listen/Download</a>]
            </td>
          </tr>
          <tr>
            <td></td>
          </tr>
          <tr>
            <td>
              Cancelled due to Garcia's illness.
            </td>
          </tr>
        </table>
      </div>
      <div>
        <table border="0" cellspacing="0" cellpadding="0">
          <tr>
            <td id="1202">
              <a href="/1992-12-02">12/2/1992 McNichols Sports Arena, Denver, CO</a> [<a href="http://www.archive.org/search.php?query=creator:%22Grateful%20Dead%22%20date:1992-12-02*">Listen/Download</a>]
            </td>
          </tr>
          <tr>
            <td>
              I: Stranger, TLEO, Same Thing, Jack A Roe, All Over Now, So Many Roads, Let It Grow
            </td>
          </tr>
          <tr>
            <td>
              II: China Cat &gt; I Know You Rider, Way To Go, Truckin &gt; He's Gone &gt; Drumz &gt; Miracle &gt; Wharf Rat &gt; Lovelight
            </td>
          </tr>
          <tr>
            <td>
              E: Rain
            </td>
          </tr>
          <tr>
            <td>
              "Woody Woodpecker" and "Funiculi Funicula" tunings before second set. Bob left the stage for a moment during Wharf Rat for a technical problem.
            </td>
          </tr>
        </table>
      </div>
      <div>
        <table border="0" cellspacing="0" cellpadding="0">
          <tr>
            <td id="1203">
              <a href="/1992-12-03">12/3/1992 McNichols Sports Arena, Denver, CO</a> [<a href="http://www.archive.org/search.php?query=creator:%22Grateful%20Dead%22%20date:1992-12-03*">Listen/Download</a>]
            </td>
          </tr>
          <tr>
            <td>
              I: Touch, Rooster, Peggy-O, Queen Jane, Ramble On, Cassidy &gt; Don't Ease
            </td>
          </tr>
          <tr>
            <td>
              II: Playin &gt; Eyes &gt; Corinna &gt; Terrapin &gt; Drumz &gt; Other One &gt; Morning Dew
            </td>
          </tr>
          <tr>
            <td>
              E: Gloria
            </td>
          </tr>
        </table>
      </div>
      <div>
        <table border="0" cellspacing="0" cellpadding="0">
          <tr>
            <td id="1205">
              <a href="/1992-12-05">12/5/1992 Compton Terrace Amphitheatre, Chandler, AZ</a> [<a href="http://www.archive.org/search.php?query=creator:%22Grateful%20Dead%22%20date:1992-12-05*">Listen/Download</a>]
            </td>
          </tr>
          <tr>
            <td>
              I: LTGTR, Bucket &gt; Sugaree, Minglewood, Tennessee Jed, Tom Thumb Blues, Candyman, Music
            </td>
          </tr>
          <tr>
            <td>
              II: Scarlet &gt; Fire &gt; Estimated &gt; Drumz &gt; Wheel &gt; Watchtower &gt; Black Peter &gt; Saturday Night
            </td>
          </tr>
          <tr>
            <td>
              E: The Weight
            </td>
          </tr>
        </table>
      </div>
      <div>
        <table border="0" cellspacing="0" cellpadding="0">
          <tr>
            <td id="1206">
              <a href="/1992-12-06">12/6/1992 Compton Terrace Amphitheatre, Chandler, AZ</a> [<a href="http://www.archive.org/search.php?query=creator:%22Grateful%20Dead%22%20date:1992-12-06*">Listen/Download</a>]
            </td>
          </tr>
          <tr>
            <td>
              I: H. C. Sunshine, Greatest, FOTD, Me and My Uncle &gt; Maggie's Farm, Althea, Masterpiece, Deal
            </td>
          </tr>
          <tr>
            <td>
              II: Samson, Crazy Fingers &gt; Uncle John &gt; Playin Reprise &gt; Drumz &gt; Last Time &gt; China Doll &gt; Throwing Stones &gt; NFA
            </td>
          </tr>
          <tr>
            <td>
              E: Brokedown
            </td>
          </tr>
          <tr>
            <td>
              Previous ''H. C. Sunshine'' 2/23/1974 [1213 shows]
            </td>
          </tr>
        </table>
      </div>
      <div>
        <table border="0" cellspacing="0" cellpadding="0">
          <tr>
            <td id="1211">
              <a href="/1992-12-11">12/11/1992 Oakland Coliseum Arena, Oakland, CA</a> [<a href="http://www.archive.org/search.php?query=creator:%22Grateful%20Dead%22%20date:1992-12-11*">Listen/Download</a>]
            </td>
          </tr>
          <tr>
            <td>
              I: Cold Rain, Wang Dang Doodle, Althea, Masterpiece, Stagger Lee, Cassidy &gt; Deal
            </td>
          </tr>
          <tr>
            <td>
              II: Iko Iko, L. L. Rain &gt; Eyes &gt; Corinna &gt; Drumz &gt; Wheel &gt; Stella Blue &gt; Sugar Magnolia
            </td>
          </tr>
          <tr>
            <td>
              E: U. S. Blues
            </td>
          </tr>
        </table>
      </div>
      <div>
        <table border="0" cellspacing="0" cellpadding="0">
          <tr>
            <td id="1212">
              <a href="/1992-12-12">12/12/1992 Oakland Coliseum Arena, Oakland, CA</a> [<a href="http://www.archive.org/search.php?query=creator:%22Grateful%20Dead%22%20date:1992-12-12*">Listen/Download</a>]
            </td>
          </tr>
          <tr>
            <td>
              I: Jack Straw &gt; Bertha, Rooster, FOTD, Desolation Row, Bird Song
            </td>
          </tr>
          <tr>
            <td>
              II: Picasso Moon, Crazy Fingers &gt; Woman Smarter, Dark Star &gt; Drumz &gt; Jam &gt; Miracle &gt; SOTM &gt; Saturday Night
            </td>
          </tr>
          <tr>
            <td>
              E: Rain
            </td>
          </tr>
          <tr>
            <td>
              Yothu Yandi opened. "Dark Star" is first verse only. "Dark Star" quote during end of "Drumz."
            </td>
          </tr>
        </table>
      </div>
      <div>
        <table border="0" cellspacing="0" cellpadding="0">
          <tr>
            <td id="1213">
              <a href="/1992-12-13">12/13/1992 Oakland Coliseum Arena, Oakland, CA</a> [<a href="http://www.archive.org/search.php?query=creator:%22Grateful%20Dead%22%20date:1992-12-13*">Listen/Download</a>]
            </td>
          </tr>
          <tr>
            <td>
              I: Half Step &gt; All Over Now, West L. A., Me and My Uncle &gt; Maggie's Farm, Tennessee Jed &gt; Promised
            </td>
          </tr>
          <tr>
            <td>
              II: H. C. Sunshine &gt; Way To Go, Victim &gt; Terrapin &gt; Drumz &gt; Other One &gt; Morning Dew
            </td>
          </tr>
          <tr>
            <td>
              E: The Weight
            </td>
          </tr>
        </table>
      </div>
      <div>
        <table border="0" cellspacing="0" cellpadding="0">
          <tr>
            <td id="1216">
              <a href="/1992-12-16">12/16/1992 Oakland Coliseum Arena, Oakland, CA</a> [<a href="http://www.archive.org/search.php?query=creator:%22Grateful%20Dead%22%20date:1992-12-16*">Listen/Download</a>]
            </td>
          </tr>
          <tr>
            <td>
              I: Stranger, B. E. Women, Same Thing, Loose Lucy, Memphis Blues, Row Jimmy, Let It Grow
            </td>
          </tr>
          <tr>
            <td>
              II: Shakedown &gt; Samson, Ship Of Fools &gt; Playin &gt; Drumz &gt; Dark Star &gt; Watchtower &gt; Stella Blue &gt; Good Lovin
            </td>
          </tr>
          <tr>
            <td>
              E: Casey Jones
            </td>
          </tr>
          <tr>
            <td>
              "Dark Star" is second verse only. Entire show appears on "Dicks Picks Volume 27."
            </td>
          </tr>
        </table>
      </div>
      <div>
        <table border="0" cellspacing="0" cellpadding="0">
          <tr>
            <td id="1217">
              <a href="/1992-12-17">12/17/1992 Oakland Coliseum Arena, Oakland, CA</a> [<a href="http://www.archive.org/search.php?query=creator:%22Grateful%20Dead%22%20date:1992-12-17*">Listen/Download</a>]
            </td>
          </tr>
          <tr>
            <td>
              I: Touch, Walking Blues, Loser, Queen Jane, So Many Roads, Music
            </td>
          </tr>
          <tr>
            <td>
              II: Scarlet &gt; Fire, Way To Go, Corinna &gt; Uncle John &gt; Playin Reprise &gt; Drumz &gt; Last Time &gt; H. C. Sunshine &gt; Throwing Stones * &gt; NFA *
            </td>
          </tr>
          <tr>
            <td>
              E: Baba O'Riley * &gt; TNK *
            </td>
          </tr>
          <tr>
            <td>
              *appears on "Dicks Picks Volume 27."
            </td>
          </tr>
        </table>
      </div>
    </div>
  </body>
</html>
