<!DOCTYPE HTML PUBLIC "-//W3C//DTD HTML 4.01 Transitional//EN" "http://www.w3.org/TR/html4/loose.dtd">
<html>
<head>
<title>1981 Setlists</title>
</head>
<body>
<div align="center">
<div id="main">
	<div class="page_title">1981 Setlists</div>

<script language="Javascript" type="text/javascript">
<!--
function showtab () {
document.getElementById('hide').style.display = 'none';
document.getElementById('show').style.display = 'block';
}
function hidetab () {
document.getElementById('show').style.display = 'none';
document.getElementById('hide').style.display = 'block';
}
-->
</script>
<p>February:  <a href="#0226">26</a> <a href="#0227">27</a> <a href="#0228">28</a><br>
March: <a href="#0302">2</a> <a href="#0303">3</a> <a href="#0305">5</a> <a href="#0306">6</a> <a href="#0307">7</a> <a href="#0309">9</a> <a href="#0310">10</a> <a href="#0312">12</a> <a href="#0313">13</a> <a href="#0314">14</a> <a href="#0320">20</a> <a href="#0321">21</a> <a href="#0323">23</a> <a href="#0324">24</a> <a href="#0328">28</a><br>
April: <a href="#0425">25</a> <a href="#0430">30</a><br>
May: <a href="#0501">1</a> <a href="#0502">2</a> <a href="#0504">4</a> <a href="#0505">5</a> <a href="#0506">6</a> <a href="#0507">7</a> <a href="#0508">8</a> <a href="#0509">9</a> <a href="#0511">11</a> <a href="#0512">12</a> <a href="#0513">13</a> <a href="#0515">15</a> <a href="#0516">16</a> <a href="#0517">17</a> <a href="#0522">22</a><br>
July: <a href="#0702">2</a> <a href="#0704">4</a> <a href="#0705">5</a> <a href="#0707">7</a> <a href="#0708">8</a> <a href="#0710">10</a> <a href="#0711">11</a> <a href="#0713">13</a> <a href="#0714">14</a><br>
August: <a href="#0812">12</a> <a href="#0814">14</a> <a href="#0815">15</a> <a href="#0816">16</a> <a href="#0827">27</a> <a href="#0828">28</a> <a href="#0830">30</a> <a href="#0831">31</a><br>
September: <a href="#0911">11</a> <a href="#0912">12</a> <a href="#0913">13</a> <a href="#0925">25</a> <a href="#0926">26</a> <a href="#0927">27</a> <a href="#0930">30</a><br>
October: <a href="#1002">2</a> <a href="#1003">3</a> <a href="#1004">4</a> <a href="#1006">6</a> <a href="#1008">8</a> <a href="#1010">10</a> <a href="#1011">11</a> <a href="#1012">12</a> <a href="#1013">13</a> <a href="#1015">15</a> <a href="#1015">15</a> <a href="#1016">16</a> <a href="#1016">16</a> <a href="#1017">17</a> <a href="#1019">19</a><br>
November: <a href="#1127">27</a> <a href="#1129">29</a> <a href="#1130">30</a><br>
December: <a href="#1202">2</a> <a href="#1203">3</a> <a href="#1205">5</a> <a href="#1206">6</a> <a href="#1207">7</a> <a href="#1209">9</a> <a href="#1212">12</a> <a href="#1226">26</a> <a href="#1227">27</a> <a href="#1228">28</a> <a href="#1230">30</a> <a href="#1231">31</a></p>
<div class="setlist_table"><table border="0" cellspacing="0" cellpadding="0"><tr class="header"><td><span><a name="0226"></a><a href="/1981-02-26">2/26/1981 Uptown Theatre, Chicago, IL</a></span> [<a href="http://www.archive.org/search.php?query=creator:%22Grateful Dead%22%20date:1981-02-26*">Listen/Download</a>]<tr><td>I: Stranger, Althea > Rooster, Bird Song, Me  and  My Uncle > Big River, Peggy-O, Passenger, Tennessee Jed, Music</td></tr>
<tr><td>II: China Cat > I Know You Rider, Samson, He's Gone > Drumz > Truckin > Black Peter > GDTRFB > Johnny B. Goode</td></tr>
<tr><td>E: U. S. Blues</td></tr>
</table></div>
<div class="setlist_table"><table border="0" cellspacing="0" cellpadding="0"><tr class="header"><td><span><a name="0227"></a><a href="/1981-02-27">2/27/1981 Uptown Theatre, Chicago, IL</a></span> [<a href="http://www.archive.org/search.php?query=creator:%22Grateful Dead%22%20date:1981-02-27*">Listen/Download</a>]<tr><td>I: Alabama > Promised, FOTD, Cassidy, Loser, C. C. Rider, Roses > Minglewood</td></tr>
<tr><td>II: Scarlet > Fire > Estimated > Eyes > Drumz > NFA > Wharf Rat > Sugar Magnolia</td></tr>
<tr><td>E: Don't Ease</td></tr>
</table></div>
<div class="setlist_table"><table border="0" cellspacing="0" cellpadding="0"><tr class="header"><td><span><a name="0228"></a><a href="/1981-02-28">2/28/1981 Uptown Theatre, Chicago, IL</a></span> [<a href="http://www.archive.org/search.php?query=creator:%22Grateful Dead%22%20date:1981-02-28*">Listen/Download</a>]<tr><td>I: Jack Straw, TLEO, Mama Tried > Mexicali, Candyman > Rooster, Big RxR Blues, L. L. Rain, Althea, Let It Grow > Deal</td></tr>
<tr><td>II: Cold Rain > Greatest, Ship Of Fools, Sailor > Saint > Terrapin > Drumz > Other One > Stella Blue > Around > Good Lovin</td></tr>
<tr><td>E: Saturday Night</td></tr>
</table></div>
<div class="setlist_table"><table border="0" cellspacing="0" cellpadding="0"><tr class="header"><td><span><a name="0302"></a><a href="/1981-03-02">3/2/1981 Cleveland Music Hall, Cleveland, OH</a></span> [<a href="http://www.archive.org/search.php?query=creator:%22Grateful Dead%22%20date:1981-03-02*">Listen/Download</a>]<tr><td>I: Shakedown > Minglewood, Dire Wolf > Cassidy, Althea > El Paso, Jack A Roe, Lazy Lightning > Supplication, Don't Ease > Promised</td></tr>
<tr><td>II: Ramble On, Playin > China Doll > Jam > Drumz > Playin > Wheel > Around > Johnny B. Goode</td></tr>
<tr><td>E: U. S. Blues</td></tr>
</table></div>
<div class="setlist_table"><table border="0" cellspacing="0" cellpadding="0"><tr class="header"><td><span><a name="0303"></a><a href="/1981-03-03">3/3/1981 Cleveland Music Hall, Cleveland, OH</a></span> [<a href="http://www.archive.org/search.php?query=creator:%22Grateful Dead%22%20date:1981-03-03*">Listen/Download</a>]<tr><td>I: Stranger, Peggy-O, Me  and  My Uncle > Big River, Bird Song > L. L. Rain, Big RxR Blues > Rooster > Deal</td></tr>
<tr><td>II: China Cat > I Know You Rider > Samson, He's Gone > Drumz > Sailor > Saint > Black Peter > Good Lovin</td></tr>
<tr><td>E: Casey Jones</td></tr>
</table></div>
<div class="setlist_table"><table border="0" cellspacing="0" cellpadding="0"><tr class="header"><td><span><a name="0305"></a><a href="/1981-03-05">3/5/1981 Stanley Theatre, Pittsburgh, PA</a></span> [<a href="http://www.archive.org/search.php?query=creator:%22Grateful Dead%22%20date:1981-03-05*">Listen/Download</a>]<tr><td>I: Alabama > Greatest, FOTD, C. C. Rider, Althea, Mama Tried > Mexicali, To Lay Me Down > Minglewood, Tennessee Jed > Music</td></tr>
<tr><td>II: Jam > Passenger<span class="setlist_small">*</span> > Scarlet > Fire, Playin > Drumz > NFA > Wharf Rat > Around > Johnny B. Goode</td></tr>
<tr><td>E: U. S. Blues</td></tr>
<tr class="notes"><td>*without Jerry</i></td></tr>
</table></div>
<div class="setlist_table"><table border="0" cellspacing="0" cellpadding="0"><tr class="header"><td><span><a name="0306"></a><a href="/1981-03-06">3/6/1981 Stanley Theatre, Pittsburgh, PA</a></span> [<a href="http://www.archive.org/search.php?query=creator:%22Grateful Dead%22%20date:1981-03-06*">Listen/Download</a>]<tr><td>I: Jack Straw, Peggy-O, Cassidy, TLEO > El Paso, Row Jimmy > Rooster, B. E. Women, Let It Grow > Deal</td></tr>
<tr><td>II: Samson, Roses, Estimated > Franklin's > Drumz > Other One > Stella Blue > Sugar Magnolia</td></tr>
<tr><td>E: Don't Ease</td></tr>
</table></div>
<div class="setlist_table"><table border="0" cellspacing="0" cellpadding="0"><tr class="header"><td><span><a name="0307"></a><a href="/1981-03-07">3/7/1981 Cole Field House, U. of Maryland, College Park, MD</a></span> [<a href="http://www.archive.org/search.php?query=creator:%22Grateful Dead%22%20date:1981-03-07*">Listen/Download</a>]<tr><td>I: Alabama > Greatest, Dire Wolf, Me  and  My Uncle > Big River, Candyman > C. C. Rider, Jack A Roe, Passenger, Bird Song > L. L. Rain > Deal</td></tr>
<tr><td>II: Iko Iko > Sailor > Saint > Jam > Drumz > Truckin > Black Peter > Around > Johnny B. Goode</td></tr>
<tr><td>E: Saturday Night</td></tr>
<tr class="notes"><td>"Uncle John" tease after "Saint"</i></td></tr>
</table></div>
<div class="setlist_table"><table border="0" cellspacing="0" cellpadding="0"><tr class="header"><td><span><a name="0309"></a><a href="/1981-03-09">3/9/1981 Madison Square Garden, New York, NY</a></span> [<a href="http://www.archive.org/search.php?query=creator:%22Grateful Dead%22%20date:1981-03-09*">Listen/Download</a>]<tr><td>I: Stranger, Althea > C. C. Rider, Ramble On > El Paso, Deep Elem, BIODTL, Bird Song, Minglewood</td></tr>
<tr><td>II: China Cat > I Know You Rider > Samson, Ship Of Fools, Estimated > Uncle John > Drumz > Other One > Stella Blue > Good Lovin</td></tr>
<tr><td>E: U. S. Blues</td></tr>
<tr class="notes"><td>Next ''Deep Elem'' 12/3/1981 [63 shows]</i></td></tr>
<tr class="notes"><td>"Wheel" tease before "Good Lovin"</i></td></tr>
</table></div>
<div class="setlist_table"><table border="0" cellspacing="0" cellpadding="0"><tr class="header"><td><span><a name="0310"></a><a href="/1981-03-10">3/10/1981 Madison Square Garden, New York, NY</a></span> [<a href="http://www.archive.org/search.php?query=creator:%22Grateful Dead%22%20date:1981-03-10*">Listen/Download</a>]<tr><td>I: Half Step > Franklin's > Me  and  My Uncle, Roses > Rooster, Don't Ease, Lazy Lightning > Supplication, B. E. Women > L. L. Rain > Deal</td></tr>
<tr><td>II: Scarlet > Fire > Sailor > Saint > Drumz > Wheel > China Doll > Truckin > Sugar Magnolia</td></tr>
<tr><td>E: Satisfaction > Brokedown</td></tr>
<tr class="notes"><td>"Smokestack" tease after "Truckin"</i></td></tr>
</table></div>
<div class="setlist_table"><table border="0" cellspacing="0" cellpadding="0"><tr class="header"><td><span><a name="0312"></a><a href="/1981-03-12">3/12/1981 Boston Garden, Boston, MA</a></span> [<a href="http://www.archive.org/search.php?query=creator:%22Grateful Dead%22%20date:1981-03-12*">Listen/Download</a>]<tr><td>I: Jack Straw, Tennessee Jed, Mama Tried > Mexicali, Bird Song > C. C. Rider, Althea, Let It Grow > Franklin's</td></tr>
<tr><td>II: Terrapin > Playin > He's Gone > Drumz > NFA > Black Peter > Around > Johnny B. Goode</td></tr>
<tr><td>E: U. S. Blues</td></tr>
</table></div>
<div class="setlist_table"><table border="0" cellspacing="0" cellpadding="0"><tr class="header"><td><span><a name="0313"></a><a href="/1981-03-13">3/13/1981 Utica Memorial Auditorium, Utica, NY</a></span> [<a href="http://www.archive.org/search.php?query=creator:%22Grateful Dead%22%20date:1981-03-13*">Listen/Download</a>]<tr><td>I: Shakedown > Minglewood, TLEO > El Paso, Jack A Roe, Rooster, High Time, Cassidy > Althea, Music</td></tr>
<tr><td>II: Cold Rain > Samson, Roses, Estimated > Eyes > Drumz > Sailor > Saint > Wharf Rat > Sugar Magnolia</td></tr>
<tr><td>E: Don't Ease</td></tr>
</table></div>
<div class="setlist_table"><table border="0" cellspacing="0" cellpadding="0"><tr class="header"><td><span><a name="0314"></a><a href="/1981-03-14">3/14/1981 Hartford Civic Center, Hartford, CT</a></span> [<a href="http://www.archive.org/search.php?query=creator:%22Grateful Dead%22%20date:1981-03-14*">Listen/Download</a>]<tr><td>I: Stranger, Sugaree, Me  and  My Uncle > Big River, Peggy-O > C. C. Rider, Althea, Passenger, China Cat > I Know You Rider</td></tr>
<tr><td>II: Alabama > Greatest, Ship Of Fools, Sailor > Saint > Drumz > Other One > Stella Blue > Miracle > Bertha > Good Lovin</td></tr>
<tr><td>E: Saturday Night</td></tr>
</table></div>
<div class="setlist_table"><table border="0" cellspacing="0" cellpadding="0"><tr class="header"><td><span><a name="0320"></a><a href="/1981-03-20">3/20/1981 Rainbow Theater, London, England</a></span> [<a href="http://www.archive.org/search.php?query=creator:%22Grateful Dead%22%20date:1981-03-20*">Listen/Download</a>]<tr><td>I: Stranger, FOTD, C. C. Rider, Althea, Mama Tried > Mexicali, Loser, Minglewood, Candyman > L. L. Rain > Deal</td></tr>
<tr><td>II: Scarlet > Fire > Sailor > Saint > He's Gone > Drumz > Truckin > Wharf Rat > Around > Johnny B. Goode</td></tr>
<tr><td>E: U. S. Blues</td></tr>
</table></div>
<div class="setlist_table"><table border="0" cellspacing="0" cellpadding="0"><tr class="header"><td><span><a name="0321"></a><a href="/1981-03-21">3/21/1981 Rainbow Theater, London, England</a></span> [<a href="http://www.archive.org/search.php?query=creator:%22Grateful Dead%22%20date:1981-03-21*">Listen/Download</a>]<tr><td>I: Alabama > Promised, Peggy-O, Me  and  My Uncle > Big River, Tennessee Jed > Rooster, Althea, Let It Grow > China Cat > I Know You Rider</td></tr>
<tr><td>II: Jack Straw, Ship Of Fools, Estimated > Eyes > Drumz > NFA > Black Peter > Saturday Night</td></tr>
<tr><td>E: Don't Ease</td></tr>
</table></div>
<div class="setlist_table"><table border="0" cellspacing="0" cellpadding="0"><tr class="header"><td><span><a name="0323"></a><a href="/1981-03-23">3/23/1981 Rainbow Theater, London, England</a></span> [<a href="http://www.archive.org/search.php?query=creator:%22Grateful Dead%22%20date:1981-03-23*">Listen/Download</a>]<tr><td>I: Jack Straw, TLEO, Cassidy, Roses > El Paso, Ramble On, Minglewood, Sugaree, Lazy Lightning > Supplication</td></tr>
<tr><td>II: Bird Song, Samson, To Lay Me Down, Terrapin > Playin > Drumz > Other One > Stella Blue > Sugar Magnolia</td></tr>
<tr><td>E: Casey Jones</td></tr>
</table></div>
<div class="setlist_table"><table border="0" cellspacing="0" cellpadding="0"><tr class="header"><td><span><a name="0324"></a><a href="/1981-03-24">3/24/1981 Rainbow Theater, London, England</a></span> [<a href="http://www.archive.org/search.php?query=creator:%22Grateful Dead%22%20date:1981-03-24*">Listen/Download</a>]<tr><td>I: Half Step > Franklin's, BIODTL > Greatest, Row Jimmy, Me  and  My Uncle > Big River, High Time > Rooster, China Cat > I Know You Rider</td></tr>
<tr><td>II: Shakedown, Sailor > Saint > He's Gone > Drumz<span class="setlist_small">*</span> > Wheel > Truckin > Wharf Rat > Around > Good Lovin</td></tr>
<tr><td>E: Brokedown</td></tr>
<tr class="notes"><td>*with The Flying Karamazov Brothers - double start for "Brokedown"</i></td></tr>
</table></div>
<div class="setlist_table"><table border="0" cellspacing="0" cellpadding="0"><tr class="header"><td><span><a name="0328"></a><a href="/1981-03-28">3/28/1981 Grugahalle, Essen, West Germany</a></span> [<a href="http://www.archive.org/search.php?query=creator:%22Grateful Dead%22%20date:1981-03-28*">Listen/Download</a>]<tr><td>I: Alabama > Greatest > Sugaree, Me  and  My Uncle > Mexicali, Shakedown, Rooster, Althea > L. L. Rain > Deal</td></tr>
<tr><td>II: Samson, Ship Of Fools, Estimated > He's Gone > Other One > Drumz<span class="setlist_small">+</span> > NFA<span class="setlist_small">*</span> > Wharf Rat<span class="setlist_small">*</span> > Around<span class="setlist_small">*</span> > Good Lovin<span class="setlist_small">*</span></td></tr>
<tr><td>E: Saturday Night<span class="setlist_small">*</span></td></tr>
<tr class="notes"><td>TV and FM broadcast over Europe. Also: The Who. *with Pete Townshend. +with The Flying Karamazov Brothers.</i></td></tr>
</table></div>
<div class="setlist_table"><table border="0" cellspacing="0" cellpadding="0"><tr class="header"><td><span><a name="0425"></a><a href="/1981-04-25">4/25/1981 Berkeley Community Theatre, Berkeley, CA</a></span> [<a href="http://www.archive.org/search.php?query=creator:%22Grateful Dead%22%20date:1981-04-25*">Listen/Download</a>]<tr><td>I: Deel Elem <span class="setlist_small">@</span>, Dark Hollow <span class="setlist_small">@</span>, Jack A Roe <span class="setlist_small">@</span>, Monkey & Engineer <span class="setlist_small">@</span>, FOTD <span class="setlist_small">@</span>, El Paso <span class="setlist_small">@</span>, Ain't No Lie <span class="setlist_small">@</span>, On The Road Again <span class="setlist_small">@</span></td></tr>
<tr><td>II: Drums</td></tr>
<tr><td>E: Oh Boy <span class="setlist_small">@</span></td></tr>
<tr class="notes"><td>"Sing Out For Sight" benefit. Garcia & Weir, with Kahn, Hart, and Kreutzmann. Also: Country Joe McDonald, Odetta, Rosalie Sorrels, Kate Wolf. "Drums" took place after the encore.</i></td></tr>
</table></div>
<div class="setlist_table"><table border="0" cellspacing="0" cellpadding="0"><tr class="header"><td><span><a name="0430"></a><a href="/1981-04-30">4/30/1981 Greensboro Coliseum, Greensboro, NC</a></span> [<a href="http://www.archive.org/search.php?query=creator:%22Grateful Dead%22%20date:1981-04-30*">Listen/Download</a>]<tr><td>I: Jack Straw, Peggy-O > C. C. Rider, Alabama > Greatest, Loser > L. L. Rain, China Cat > I Know You Rider</td></tr>
<tr><td>II: Shakedown > Samson, Roses, Estimated > Eyes > Drumz > Truckin > Black Peter > Around > Johnny B. Goode</td></tr>
<tr><td>E: Casey Jones</td></tr>
</table></div>
<div class="setlist_table"><table border="0" cellspacing="0" cellpadding="0"><tr class="header"><td><span><a name="0501"></a><a href="/1981-05-01">5/1/1981 Hampton Coliseum, Hampton, VA</a></span> [<a href="http://www.archive.org/search.php?query=creator:%22Grateful Dead%22%20date:1981-05-01*">Listen/Download</a>]<tr><td>I: Alabama > Promised, FOTD > Me  and  My Uncle > Big River, Althea > Rooster, Tennessee Jed > Let It Grow > Deal</td></tr>
<tr><td>II: Stranger > Franklin's > Sailor > Saint > He's Gone > Other One > Drumz > Wheel > Wharf Rat > Sugar Magnolia</td></tr>
<tr><td>E: U. S. Blues</td></tr>
</table></div>
<div class="setlist_table"><table border="0" cellspacing="0" cellpadding="0"><tr class="header"><td><span><a name="0502"></a><a href="/1981-05-02">5/2/1981 The Spectrum, Philadelphia, PA</a></span> [<a href="http://www.archive.org/search.php?query=creator:%22Grateful Dead%22%20date:1981-05-02*">Listen/Download</a>]<tr><td>I: Jack Straw > Sugaree > El Paso, Bird Song, Cassidy, Candyman > Minglewood, Althea, Promised</td></tr>
<tr><td>II: Scarlet > Fire, Estimated > Terrapin > Drumz > NFA > Stella Blue > Around > Good Lovin</td></tr>
<tr><td>E: Saturday Night</td></tr>
</table></div>
<div class="setlist_table"><table border="0" cellspacing="0" cellpadding="0"><tr class="header"><td><span><a name="0504"></a><a href="/1981-05-04">5/4/1981 The Spectrum, Philadelphia, PA</a></span> [<a href="http://www.archive.org/search.php?query=creator:%22Grateful Dead%22%20date:1981-05-04*">Listen/Download</a>]<tr><td>I: Don't Ease > BIODTL, Jack A Roe > Rooster, Cold Rain, Mama Tried > Mexicali, Althea > L. L. Rain, Bertha > Greatest</td></tr>
<tr><td>II: China Cat > I Know You Rider > Samson, To Lay Me Down, Playin > Drumz > Nobody's Fault > Sailor > Saint > Black Peter > Sugar Magnolia</td></tr>
<tr><td>E: Brokedown</td></tr>
<tr class="notes"><td>Next ''Nobody's Fault'' 9/3/1985 [295 shows]</i></td></tr>
<tr class="notes"><td>"Camptown Races > Merry-Go-Round Broke Down" tuning into "Playin."</i></td></tr>
</table></div>
<div class="setlist_table"><table border="0" cellspacing="0" cellpadding="0"><tr class="header"><td><span><a name="0505"></a><a href="/1981-05-05">5/5/1981 Glens Falls Civic Center, Glens Falls, NY</a></span> [<a href="http://www.archive.org/search.php?query=creator:%22Grateful Dead%22%20date:1981-05-05*">Listen/Download</a>]<tr><td>I: Stranger, Peggy-O > El Paso, Ramble On, C. C. Rider, B. E. Women, Passenger, Althea, Music > Don't Ease</td></tr>
<tr><td>II: Scarlet > Fire, Estimated > Eyes > Drumz > Uncle John > Truckin > Alabama > Johnny B. Goode</td></tr>
<tr><td>E: U. S. Blues</td></tr>
</table></div>
<div class="setlist_table"><table border="0" cellspacing="0" cellpadding="0"><tr class="header"><td><span><a name="0506"></a><a href="/1981-05-06">5/6/1981 Nassau Veterans Memorial Coliseum, Uniondale, NY</a></span> [<a href="http://www.archive.org/search.php?query=creator:%22Grateful Dead%22%20date:1981-05-06*">Listen/Download</a>]<tr><td>I: Alabama > Greatest, TLEO, Cassidy, Jack A Roe > Rooster, Dire Wolf > L. L. Rain, Big RxR Blues, Let It Grow > Deal</td></tr>
<tr><td>II: Minglewood, High Time > Sailor > Saint, He's Gone<span class="setlist_small">*</span> > Jam > Drumz > Other One > GDTRFB > Wharf Rat > Good Lovin</td></tr>
<tr><td>E: Don't Ease</td></tr>
<tr class="notes"><td>Show originally scheduled for 05-07-81. *for Bobby Sands. Regarding the jam out of "He's Gone": The first part does not develop into a full-fledged "Caution"; the second part, while displaying a Spanish flavor, bears no relation to Miles Davis’ "Solea." Entire show appears on "Dick's Picks Vol 13."</i></td></tr>
</table></div>
<div class="setlist_table"><table border="0" cellspacing="0" cellpadding="0"><tr class="header"><td><span><a name="0507"></a><a href="/1981-05-07">5/7/1981 NBC Studios, New York, NY</a></span> [<a href="http://www.archive.org/search.php?query=creator:%22Grateful Dead%22%20date:1981-05-07*">Listen/Download</a>]<tr><td>I: On the Road Again <span class="setlist_small">@</span></td></tr>
<tr><td>II: Dire Wolf <span class="setlist_small">@</span> > Deep Elem <span class="setlist_small">@</span></td></tr>
<tr><td>III: Cassidy <span class="setlist_small">@</span></td></tr>
<tr class="notes"><td>"The Tomorrow Show" TV broadcast. Appears on "The Tomorrow Show: Tom Snyder’s Electric Kool-Aid Talk Show" DVD.</i></td></tr>
</table></div>
<div class="setlist_table"><table border="0" cellspacing="0" cellpadding="0"><tr class="header"><td><span><a name="0508"></a><a href="/1981-05-08">5/8/1981 Nassau Veterans Memorial Coliseum, Uniondale, NY</a></span> [<a href="http://www.archive.org/search.php?query=creator:%22Grateful Dead%22%20date:1981-05-08*">Listen/Download</a>]<tr><td>I: Jack Straw, Peggy-O, Me  and  My Uncle > Big River, Loser, C. C. Rider, Althea > Let It Grow > Don't Ease</td></tr>
<tr><td>II: Shakedown > Samson, Terrapin > Playin > Drumz<span class="setlist_small">*</span> > NFA > Nobody's Jam > Stella Blue > Sugar Magnolia</td></tr>
<tr><td>E: U. S. Blues<span class="setlist_small">*</span></td></tr>
<tr class="notes"><td>*with Ken Kesey on harmonica</i></td></tr>
</table></div>
<div class="setlist_table"><table border="0" cellspacing="0" cellpadding="0"><tr class="header"><td><span><a name="0509"></a><a href="/1981-05-09">5/9/1981 Nassau Veterans Memorial Coliseum, Uniondale, NY</a></span> [<a href="http://www.archive.org/search.php?query=creator:%22Grateful Dead%22%20date:1981-05-09*">Listen/Download</a>]<tr><td>I: Half Step > Franklin's > Stranger, Bird Song, Rooster, Candyman, Mama Tried > Mexicali, L. L. Rain > China Cat > I Know You Rider</td></tr>
<tr><td>II: Sailor > Saint > Ship Of Fools, Estimated > Eyes > Drumz > Nobody's Jam > Truckin > Black Peter > Around > Saturday Night</td></tr>
<tr><td>E: Brokedown</td></tr>
<tr class="notes"><td>Double start for "Brokedown." Segue between "Bird Song" and "Rooster" is borderline.</i></td></tr>
</table></div>
<div class="setlist_table"><table border="0" cellspacing="0" cellpadding="0"><tr class="header"><td><span><a name="0511"></a><a href="/1981-05-11">5/11/1981 Veterans Memorial Coliseum, New Haven, CT</a></span> [<a href="http://www.archive.org/search.php?query=creator:%22Grateful Dead%22%20date:1981-05-11*">Listen/Download</a>]<tr><td>I: Minglewood > Sugaree > El Paso, Jack A Roe, BIODTL, Row Jimmy, All Over Now, Althea, Lazy Lightning > Supplication > Don't Ease</td></tr>
<tr><td>II: Scarlet > Fire > C. C. Rider, To Lay Me Down, Playin > Drumz > Wheel > Playin > China Doll > Around > Good Lovin</td></tr>
<tr><td>E: Satisfaction</td></tr>
<tr class="notes"><td>Next ''All Over Now'' 12/26/1981 [51 shows]</i></td></tr>
</table></div>
<div class="setlist_table"><table border="0" cellspacing="0" cellpadding="0"><tr class="header"><td><span><a name="0512"></a><a href="/1981-05-12">5/12/1981 Veterans Memorial Coliseum, New Haven, CT</a></span> [<a href="http://www.archive.org/search.php?query=creator:%22Grateful Dead%22%20date:1981-05-12*">Listen/Download</a>]<tr><td>I: Alabama > Greatest, Peggy-O, Cassidy, Roses, Me  and  My Uncle > Big River, Althea > Rooster, China Cat > I Know You Rider</td></tr>
<tr><td>II: Shakedown > L. L. Rain, Ship Of Fools, Estimated > He's Gone<span class="setlist_small">*</span> > Drumz > Other One > Wharf Rat > Sugar Magnolia</td></tr>
<tr><td>E: Don't Ease</td></tr>
<tr class="notes"><td>*for Bob Marley</i></td></tr>
</table></div>
<div class="setlist_table"><table border="0" cellspacing="0" cellpadding="0"><tr class="header"><td><span><a name="0513"></a><a href="/1981-05-13">5/13/1981 Providence Civic Center, Providence, RI</a></span> [<a href="http://www.archive.org/search.php?query=creator:%22Grateful Dead%22%20date:1981-05-13*">Listen/Download</a>]<tr><td>I: Jack Straw, Tennessee Jed > C. C. Rider, FOTD, Mama Tried > Mexicali, Bird Song > Let It Grow > Deal</td></tr>
<tr><td>II: Samson, Terrapin > Sailor > Saint > Drumz > Iko Iko > Miracle > Stella Blue > Good Lovin</td></tr>
<tr><td>E: Brokedown</td></tr>
<tr class="notes"><td>Next ''Iko Iko'' 12/31/1981 [53 shows]</i></td></tr>
</table></div>
<div class="setlist_table"><table border="0" cellspacing="0" cellpadding="0"><tr class="header"><td><span><a name="0515"></a><a href="/1981-05-15">5/15/1981 Rutgers Athletic Center, Piscataway, NJ</a></span> [<a href="http://www.archive.org/search.php?query=creator:%22Grateful Dead%22%20date:1981-05-15*">Listen/Download</a>]<tr><td>I: Half Step > Franklin's > Minglewood, Dire Wolf, Cassidy, Candyman > Rooster, Jack A Roe, El Paso, Ramble On > L. L. Rain > Don't Ease</td></tr>
<tr><td>II: Scarlet > Fire > Estimated > Eyes > Drumz > NFA > Black Peter > Sugar Magnolia</td></tr>
<tr><td>E: U. S. Blues</td></tr>
</table></div>
<div class="setlist_table"><table border="0" cellspacing="0" cellpadding="0"><tr class="header"><td><span><a name="0516"></a><a href="/1981-05-16">5/16/1981 Barton Hall, Cornell University, Ithaca, NY</a></span> [<a href="http://www.archive.org/search.php?query=creator:%22Grateful Dead%22%20date:1981-05-16*">Listen/Download</a>]<tr><td>I: Stranger, FOTD, Me  and  My Uncle > Big River, Althea > C. C. Rider, B. E. Women, Passenger, High Time > Let It Grow > Don't Ease</td></tr>
<tr><td>II: Shakedown > Bertha > Sailor > Saint > Spanish Jam > Drumz > Truckin > Nobody's Jam > Stella Blue > GDTRFB > Saturday Night</td></tr>
<tr><td>E: Uncle John</td></tr>
</table></div>
<div class="setlist_table"><table border="0" cellspacing="0" cellpadding="0"><tr class="header"><td><span><a name="0517"></a><a href="/1981-05-17">5/17/1981 Onondaga County War Memorial, Syracuse, NY</a></span> [<a href="http://www.archive.org/search.php?query=creator:%22Grateful Dead%22%20date:1981-05-17*">Listen/Download</a>]<tr><td>I: Alabama > Promised, Peggy-O > Mama Tried > Mexicali, TLEO > Minglewood, Candyman > L. L. Rain, Big RxR Blues > Rooster, China Cat > I Know You Rider</td></tr>
<tr><td>II: Cold Rain > Samson, Ship Of Fools, Estimated > He's Gone > Other One > Drumz > Saint > Wharf Rat > Sugar Magnolia</td></tr>
<tr><td>E: Satisfaction</td></tr>
</table></div>
<div class="setlist_table"><table border="0" cellspacing="0" cellpadding="0"><tr class="header"><td><span><a name="0522"></a><a href="/1981-05-22">5/22/1981 Warfield Theater, San Francisco, CA</a></span> [<a href="http://www.archive.org/search.php?query=creator:%22Grateful Dead%22%20date:1981-05-22*">Listen/Download</a>]<tr><td>Deep Elem <span class="setlist_small">@</span>, Race Is On <span class="setlist_small">@</span>, FOTD <span class="setlist_small">@</span>, Cassidy <span class="setlist_small">@</span>, To Lay Me Down <span class="setlist_small">@</span>, Monkey & Engineer <span class="setlist_small">@</span>, Ain't No Lie <span class="setlist_small">@</span>, On The Road Again <span class="setlist_small">@</span>, Bird Song <span class="setlist_small">@</span> >  Ripple <span class="setlist_small">@</span> > Drumz <span class="setlist_small">@</span> > Oh Boy <span class="setlist_small">@</span></td></tr>
<tr class="notes"><td>Nuclear Disarmament benefit. Jerry Garcia, Bob Weir, Mickey Hart & Friends. Garcia, Weir, Hart, Kreutzmann, Mydland, and Kahn. Merl Saunders & Norton Buffalo (with Michael Hinton, Bobby Vega, Mickey Hart, and Vicki Randle) opened. Country Joe McDonald (backed by Merl Saunders, Norton Buffalo, Kate Wolf, and Holly Near) played second.</i></td></tr>
</table></div>
<div class="setlist_table"><table border="0" cellspacing="0" cellpadding="0"><tr class="header"><td><span><a name="0702"></a><a href="/1981-07-02">7/2/1981 The Summit, Houston, TX</a></span> [<a href="http://www.archive.org/search.php?query=creator:%22Grateful Dead%22%20date:1981-07-02*">Listen/Download</a>]<tr><td>I: Alabama > Greatest, FOTD > C. C. Rider, Althea, El Paso, Jack A Roe, L. L. Rain, Dire Wolf, Sailor > Saint</td></tr>
<tr><td>II: Scarlet > Fire, Woman Smarter, Roses, Estimated > Eyes > Drumz > Wheel > Truckin > Black Peter > Around > Good Lovin</td></tr>
<tr><td>E: U. S. Blues</td></tr>
<tr class="notes"><td>First ''Woman Smarter''</i></td></tr>
</table></div>
<div class="setlist_table"><table border="0" cellspacing="0" cellpadding="0"><tr class="header"><td><span><a name="0704"></a><a href="/1981-07-04">7/4/1981 Manor Downs, Austin, TX</a></span> [<a href="http://www.archive.org/search.php?query=creator:%22Grateful Dead%22%20date:1981-07-04*">Listen/Download</a>]<tr><td>I: Jack Straw, Peggy-O, Me  and  My Uncle > Big River, Loser, Rooster, Tennessee Jed > Minglewood, China Cat > I Know You Rider</td></tr>
<tr><td>II: Stranger, Bird Song, Playin > Drumz > NFA > Wharf Rat > Sugar Magnolia</td></tr>
<tr><td>E: Saturday Night<span class="setlist_small">*</span></td></tr>
<tr class="notes"><td>*One More Fourth Of July</i></td></tr>
</table></div>
<div class="setlist_table"><table border="0" cellspacing="0" cellpadding="0"><tr class="header"><td><span><a name="0705"></a><a href="/1981-07-05">7/5/1981 Zoo Amphitheatre, Oklahoma City, OK</a></span> [<a href="http://www.archive.org/search.php?query=creator:%22Grateful Dead%22%20date:1981-07-05*">Listen/Download</a>]<tr><td>I: Shakedown > Promised, Candyman > Cassidy, B. E. Women > C. C. Rider, TLEO, Mama Tried > Mexicali, Althea > Let It Grow</td></tr>
<tr><td>II: Samson, Don't Ease > Music, Ship Of Fools, Sailor > Saint > He's Gone > Drumz > Other One > Stella Blue > Around > Johnny B. Goode</td></tr>
<tr><td>E: U. S. Blues</td></tr>
</table></div>
<div class="setlist_table"><table border="0" cellspacing="0" cellpadding="0"><tr class="header"><td><span><a name="0707"></a><a href="/1981-07-07">7/7/1981 Kansas City Municipal Auditorium Arena, Kansas City, MO</a></span> [<a href="http://www.archive.org/search.php?query=creator:%22Grateful Dead%22%20date:1981-07-07*">Listen/Download</a>]<tr><td>I: Minglewood > Bertha > Dancin, Big RxR Blues > El Paso, To Lay Me Down, Lazy Lightning > Supplication, Bird Song > L. L. Rain > Deal</td></tr>
<tr><td>II: Woman Smarter, Candyman, Estimated > Eyes > Drumz > Truckin > GDTRFB > Black Peter > Miracle > Good Lovin</td></tr>
<tr><td>E: Don't Ease</td></tr>
<tr class="notes"><td>Next ''Dancin'' 6/24/1984 [203 shows]</i></td></tr>
</table></div>
<div class="setlist_table"><table border="0" cellspacing="0" cellpadding="0"><tr class="header"><td><span><a name="0708"></a><a href="/1981-07-08">7/8/1981 Kiel Auditorium, St. Louis, MO</a></span> [<a href="http://www.archive.org/search.php?query=creator:%22Grateful Dead%22%20date:1981-07-08*">Listen/Download</a>]<tr><td>I: Half Step > Stranger, Peggy-O > Rooster, Althea, Me  and  My Uncle > Big River, Don't Ease, Minglewood, China Cat > I Know You Rider</td></tr>
<tr><td>II: Scarlet > Fire, Sailor > Saint > Franklin's > Drumz > NFA > Wharf Rat > Sugar Magnolia</td></tr>
<tr><td>E: U. S. Blues</td></tr>
</table></div>
<div class="setlist_table"><table border="0" cellspacing="0" cellpadding="0"><tr class="header"><td><span><a name="0710"></a><a href="/1981-07-10">7/10/1981 St. Paul Civic Center Arena, St. Paul, MN</a></span> [<a href="http://www.archive.org/search.php?query=creator:%22Grateful Dead%22%20date:1981-07-10*">Listen/Download</a>]<tr><td>I: Jack Straw, Sugaree, Mama Tried > Mexicali, Loser, Cassidy, B. E. Women > C. C. Rider, Ramble On, Let It Grow > Don't Ease</td></tr>
<tr><td>II: Samson, Althea, Estimated > Eyes > Drumz > Uncle John > Playin > China Doll > Uncle John > Playin > Around > Good Lovin</td></tr>
<tr><td>E: Casey Jones</td></tr>
<tr class="notes"><td>Next ''Uncle John'' 4/8/1982 [56 shows]</i></td></tr>
</table></div>
<div class="setlist_table"><table border="0" cellspacing="0" cellpadding="0"><tr class="header"><td><span><a name="0711"></a><a href="/1981-07-11">7/11/1981 Alpine Valley Music Theatre, East Troy, WI</a></span> [<a href="http://www.archive.org/search.php?query=creator:%22Grateful Dead%22%20date:1981-07-11*">Listen/Download</a>]<tr><td>I: Alabama > Greatest, Peggy-O > Rooster, Bird Song, Me  and  My Uncle > Big River, Tennessee Jed > Minglewood, China Cat > I Know You Rider</td></tr>
<tr><td>II: Sailor > Saint > Ship Of Fools, He's Gone > Truckin > Drumz > Other One > Stella Blue > Miracle > GDTRFB > Saturday Night</td></tr>
<tr><td>E: Brokedown</td></tr>
</table></div>
<div class="setlist_table"><table border="0" cellspacing="0" cellpadding="0"><tr class="header"><td><span><a name="0713"></a><a href="/1981-07-13">7/13/1981 McNichols Sports Arena, Denver, CO</a></span> [<a href="http://www.archive.org/search.php?query=creator:%22Grateful Dead%22%20date:1981-07-13*">Listen/Download</a>]<tr><td>I: Stranger, TLEO > El Paso, Jack A Roe > BIODTL, Roses > C. C. Rider, Althea > L. L. Rain > Deal</td></tr>
<tr><td>II: Woman Smarter, Scarlet > Fire, Estimated > Terrapin > Drumz > NFA > Black Peter > Sugar Magnolia</td></tr>
<tr><td>E: Satisfaction</td></tr>
</table></div>
<div class="setlist_table"><table border="0" cellspacing="0" cellpadding="0"><tr class="header"><td><span><a name="0714"></a><a href="/1981-07-14">7/14/1981 McNichols Sports Arena, Denver, CO</a></span> [<a href="http://www.archive.org/search.php?query=creator:%22Grateful Dead%22%20date:1981-07-14*">Listen/Download</a>]<tr><td>I: Cold Rain > Minglewood, FOTD, Cassidy, To Lay Me Down > Me  and  My Uncle > Mexicali, Big RxR Blues, Rooster, Bird Song > Sailor > Saint > Don't Ease</td></tr>
<tr><td>II: Shakedown > Samson, High Time, Truckin > Eyes > Drumz > Other One > Wharf Rat > Good Lovin</td></tr>
<tr><td>E: U. S. Blues</td></tr>
<tr class="notes"><td>"Miracle" tease before "Good Lovin."</i></td></tr>
</table></div>
<div class="setlist_table"><table border="0" cellspacing="0" cellpadding="0"><tr class="header"><td><span><a name="0812"></a><a href="/1981-08-12">8/12/1981 Salt Palace, Salt Lake City, UT</a></span> [<a href="http://www.archive.org/search.php?query=creator:%22Grateful Dead%22%20date:1981-08-12*">Listen/Download</a>]<tr><td>I: Alabama > Greatest, FOTD, Mama Tried > Mexicali, Jack A Roe > C. C. Rider, Althea > Sailor > Saint</td></tr>
<tr><td>II: Might As Well > Woman Smarter, Scarlet > Fire, Estimated > Eyes > Drumz > Spanish Jam > Truckin > Morning Dew > Around > Good Lovin</td></tr>
<tr><td>E: U. S. Blues</td></tr>
<tr class="notes"><td>Previous ''Might As Well'' 2/17/1979 [183 shows]; Previous ''Morning Dew'' 10/14/1980 [65 shows]</i></td></tr>
<tr class="notes"><td>Brent solo to begin "Drumz."</i></td></tr>
</table></div>
<div class="setlist_table"><table border="0" cellspacing="0" cellpadding="0"><tr class="header"><td><span><a name="0814"></a><a href="/1981-08-14">8/14/1981 Seattle Center Memorial Coliseum, Seattle, WA</a></span> [<a href="http://www.archive.org/search.php?query=creator:%22Grateful Dead%22%20date:1981-08-14*">Listen/Download</a>]<tr><td>I: Minglewood > Sugaree > On The Road Again, Peggy-O > BIODTL, B. E. Women > Rooster, Don't Ease > L. L. Rain, Bertha > Promised</td></tr>
<tr><td>II: Might As Well > Samson, Ship Of Fools, Playin > China Cat > I Know You Rider > Drumz > Playin > Wharf Rat > Miracle > GDTRFB > Johnny B. Goode</td></tr>
<tr><td>E: Baby Blue</td></tr>
<tr class="notes"><td>Previous ''Baby Blue'' 2/24/1974 [426 shows]</i></td></tr>
</table></div>
<div class="setlist_table"><table border="0" cellspacing="0" cellpadding="0"><tr class="header"><td><span><a name="0815"></a><a href="/1981-08-15">8/15/1981 Portland Memorial Coliseum, Portland, OR</a></span> [<a href="http://www.archive.org/search.php?query=creator:%22Grateful Dead%22%20date:1981-08-15*">Listen/Download</a>]<tr><td>I: Shakedown > Me  and  My Uncle > Big River, Tennessee Jed, Cassidy, Candyman > C. C. Rider, Althea, Let It Grow</td></tr>
<tr><td>II: Might As Well, Woman Smarter, To Lay Me Down > Sailor > Saint > Terrapin > Drumz > NFA > Black Peter > Sugar Magnolia</td></tr>
<tr><td>E: Saturday Night</td></tr>
</table></div>
<div class="setlist_table"><table border="0" cellspacing="0" cellpadding="0"><tr class="header"><td><span><a name="0816"></a><a href="/1981-08-16">8/16/1981 McArthur Court, University of Oregon, Eugene, OR</a></span> [<a href="http://www.archive.org/search.php?query=creator:%22Grateful Dead%22%20date:1981-08-16*">Listen/Download</a>]<tr><td>I: Jack Straw, FOTD > El Paso, Loser, Minglewood, Peggy-O > Rooster, Deal</td></tr>
<tr><td>II: Stranger, Scarlet > Fire > Estimated > Eyes > Drumz<span class="setlist_small">*</span> > Other One > Stella Blue > Around > Good Lovin</td></tr>
<tr><td>E: Baby Blue</td></tr>
<tr class="notes"><td>*with Ken Kesey, Zane Kesey, Ken Babbs and The Thunder Machine.</i></td></tr>
</table></div>
<div class="setlist_table"><table border="0" cellspacing="0" cellpadding="0"><tr class="header"><td><span><a name="0827"></a><a href="/1981-08-27">8/27/1981 Long Beach Arena, Long Beach, CA</a></span> [<a href="http://www.archive.org/search.php?query=creator:%22Grateful Dead%22%20date:1981-08-27*">Listen/Download</a>]<tr><td>I: Alabama > Promised, FOTD > C. C. Rider, Peggy-O > El Paso, Bird Song, Passenger, Cumberland > L. L. Rain, Might As Well</td></tr>
<tr><td>II: Samson, Scarlet > Fire, Estimated > Eyes > Drumz > NFA > Black Peter > Good Lovin</td></tr>
<tr><td>E: Don't Ease</td></tr>
<tr class="notes"><td>Previous ''Cumberland'' 10/18/1974 [394 shows]</i></td></tr>
</table></div>
<div class="setlist_table"><table border="0" cellspacing="0" cellpadding="0"><tr class="header"><td><span><a name="0828"></a><a href="/1981-08-28">8/28/1981 Long Beach Arena, Long Beach, CA</a></span> [<a href="http://www.archive.org/search.php?query=creator:%22Grateful Dead%22%20date:1981-08-28*">Listen/Download</a>]<tr><td>I: Jack Straw, TLEO, Me  and  My Uncle > Big River, Althea > Rooster, B. E. Women, Let It Grow > China Cat > I Know You Rider</td></tr>
<tr><td>II: Shakedown > Sailor > Saint > Wheel > Jam > Good Times > Drumz > Spanish Jam > Truckin > Wharf Rat > Sugar Magnolia</td></tr>
<tr><td>E: U. S. Blues</td></tr>
<tr class="notes"><td>First ''Good Times''</i></td></tr>
</table></div>
<div class="setlist_table"><table border="0" cellspacing="0" cellpadding="0"><tr class="header"><td><span><a name="0830"></a><a href="/1981-08-30">8/30/1981 Compton Terrace Amphitheatre, Tempe, AZ</a></span> [<a href="http://www.archive.org/search.php?query=creator:%22Grateful Dead%22%20date:1981-08-30*">Listen/Download</a>]<tr><td>I: Half Step > Franklin's > Minglewood, Tennessee Jed, Mama Tried > Mexicali, Roses, BIODTL, Cumberland > L. L. Rain, Might As Well</td></tr>
<tr><td>II: Samson, Ship Of Fools, Estimated > He's Gone > Drumz > Other One > Stella Blue > GDTRFB > Good Lovin</td></tr>
<tr><td>E: Don't Ease</td></tr>
</table></div>
<div class="setlist_table"><table border="0" cellspacing="0" cellpadding="0"><tr class="header"><td><span><a name="0831"></a><a href="/1981-08-31">8/31/1981 Aladdin Theatre, Las Vegas, NV</a></span> [<a href="http://www.archive.org/search.php?query=creator:%22Grateful Dead%22%20date:1981-08-31*">Listen/Download</a>]<tr><td>I: Stranger, Jack A Roe > El Paso, Candyman > Rooster, Loser, Cassidy, Althea, Let It Grow > Deal</td></tr>
<tr><td>II: Sailor > Saint > Scarlet > Fire, Playin > Drumz > Good Times > Morning Dew > Playin > Around > Johnny B. Goode</td></tr>
<tr><td>E: U. S. Blues</td></tr>
</table></div>
<div class="setlist_table"><table border="0" cellspacing="0" cellpadding="0"><tr class="header"><td><span><a name="0911"></a><a href="/1981-09-11">9/11/1981 Greek Theatre, U. of California, Berkeley, CA</a></span> [<a href="http://www.archive.org/search.php?query=creator:%22Grateful Dead%22%20date:1981-09-11*">Listen/Download</a>]<tr><td>I: Minglewood, TLEO, Mama Tried > Mexicali, Candyman > Rooster, Cumberland > BIODTL, Althea, Sailor > Saint > Deal</td></tr>
<tr><td>II: Stranger > Franklin's, Woman Smarter, He's Gone > Truckin > Drumz > Other One > Morning Dew > Johnny B. Goode</td></tr>
<tr><td>E: Don't Ease</td></tr>
<tr class="notes"><td>Mickey Hart's 38th birthday.</i></td></tr>
</table></div>
<div class="setlist_table"><table border="0" cellspacing="0" cellpadding="0"><tr class="header"><td><span><a name="0912"></a><a href="/1981-09-12">9/12/1981 Greek Theatre, U. of California, Berkeley, CA</a></span> [<a href="http://www.archive.org/search.php?query=creator:%22Grateful Dead%22%20date:1981-09-12*">Listen/Download</a>]<tr><td>I: Shakedown > Greatest, FOTD > El Paso, Bird Song > Cassidy, Tennessee Jed > L. L. Rain, China Cat > I Know You Rider</td></tr>
<tr><td>II: Scarlet > Fire > C. C. Rider, Estimated > Eyes > Drumz > NFA > Wharf Rat > Around > Saturday Night</td></tr>
<tr><td>E1: Baby Blue</td></tr>
<tr><td>E2: Good Lovin</td></tr>
</table></div>
<div class="setlist_table"><table border="0" cellspacing="0" cellpadding="0"><tr class="header"><td><span><a name="0913"></a><a href="/1981-09-13">9/13/1981 Greek Theatre, U. of California, Berkeley, CA</a></span> [<a href="http://www.archive.org/search.php?query=creator:%22Grateful Dead%22%20date:1981-09-13*">Listen/Download</a>]<tr><td>I: Jack Straw > Bertha, Me  and  My Uncle > Big River, To Lay Me Down > Rooster, Loser, Passenger, Ramble On > Let It Grow > Might As Well</td></tr>
<tr><td>II: Cold Rain > Samson, Roses, Sailor > Saint > Terrapin > Good Times > Drumz > Wheel > Miracle > GDTRFB > Sugar Magnolia</td></tr>
<tr><td>E: Satisfaction > Brokedown</td></tr>
</table></div>
<div class="setlist_table"><table border="0" cellspacing="0" cellpadding="0"><tr class="header"><td><span><a name="0925"></a><a href="/1981-09-25">9/25/1981 Stabler Arena, Lehigh University, Bethlehem, PA</a></span> [<a href="http://www.archive.org/search.php?query=creator:%22Grateful Dead%22%20date:1981-09-25*">Listen/Download</a>]<tr><td>I: Minglewood, FOTD > El Paso, Peggy-O > Rooster, Bird Song > BIODTL, Cumberland, Passenger, Althea, Music</td></tr>
<tr><td>II: Might As Well > Samson, Scarlet > Fire, Good Times > Sailor > Saint > Drumz > Wheel > Sugar Magnolia > Black Peter > Around > Sunshine Daydream</td></tr>
<tr><td>E: U. S. Blues</td></tr>
<tr class="notes"><td>Previous ''Sunshine Daydream'' 12/31/1980 [53 shows]</i></td></tr>
</table></div>
<div class="setlist_table"><table border="0" cellspacing="0" cellpadding="0"><tr class="header"><td><span><a name="0926"></a><a href="/1981-09-26">9/26/1981 War Memorial Auditorium, Buffalo, NY</a></span> [<a href="http://www.archive.org/search.php?query=creator:%22Grateful Dead%22%20date:1981-09-26*">Listen/Download</a>]<tr><td>I: Shakedown > C. C. Rider, TLEO, Cassidy, Jack A Roe, On The Road Again, Ramble On > L. L. Rain, B. E. Women > Let It Grow > Don't Ease</td></tr>
<tr><td>II: Playin > Bertha > Estimated > GDTRFB > Drumz > NFA > Morning Dew > Playin > Saturday Night</td></tr>
<tr><td>E: Johnny B. Goode</td></tr>
</table></div>
<div class="setlist_table"><table border="0" cellspacing="0" cellpadding="0"><tr class="header"><td><span><a name="0927"></a><a href="/1981-09-27">9/27/1981 Capital Centre, Landover, MD</a></span> [<a href="http://www.archive.org/search.php?query=creator:%22Grateful Dead%22%20date:1981-09-27*">Listen/Download</a>]<tr><td>I: Jack Straw, Alabama > Promised, Candyman > Rooster, Althea, Me  and  My Uncle > Mexicali, Roses, Sailor > Saint</td></tr>
<tr><td>II: China Cat > I Know You Rider, Woman Smarter, He's Gone > Truckin > Drumz > Spanish Jam > Wharf Rat > Miracle > Good Lovin</td></tr>
<tr><td>E: Baby Blue</td></tr>
</table></div>
<div class="setlist_table"><table border="0" cellspacing="0" cellpadding="0"><tr class="header"><td><span><a name="0930"></a><a href="/1981-09-30">9/30/1981 The Playhouse, Edinburgh, Scotland</a></span> [<a href="http://www.archive.org/search.php?query=creator:%22Grateful Dead%22%20date:1981-09-30*">Listen/Download</a>]<tr><td>I: Alabama > Greatest, TLEO, Rooster, Candyman, Me  and  My Uncle > Big River, Loser, Minglewood, Althea > Let It Grow > Don't Ease</td></tr>
<tr><td>II: Stranger, Ship Of Fools, Samson, Good Times, Estimated > Eyes > Drumz > Other One > Stella Blue > Good Lovin</td></tr>
<tr><td>E: U. S. Blues</td></tr>
</table></div>
<div class="setlist_table"><table border="0" cellspacing="0" cellpadding="0"><tr class="header"><td><span><a name="1002"></a><a href="/1981-10-02">10/2/1981 Rainbow Theater, London, England</a></span> [<a href="http://www.archive.org/search.php?query=creator:%22Grateful Dead%22%20date:1981-10-02*">Listen/Download</a>]<tr><td>I: Minglewood, Sugaree > C. C. Rider, Cumberland, Cassidy, Dire Wolf, Mama Tried > Mexicali, Althea > Sailor > Saint</td></tr>
<tr><td>II: Playin > Shakedown > Bertha > Jam > Drumz > Spanish Jam > Truckin > Black Peter > Sugar Magnolia</td></tr>
<tr><td>E: U. S. Blues</td></tr>
<tr class="notes"><td>"Teddy Bear's Picnic" tuning before "Althea."</i></td></tr>
</table></div>
<div class="setlist_table"><table border="0" cellspacing="0" cellpadding="0"><tr class="header"><td><span><a name="1003"></a><a href="/1981-10-03">10/3/1981 Rainbow Theater, London, England</a></span> [<a href="http://www.archive.org/search.php?query=creator:%22Grateful Dead%22%20date:1981-10-03*">Listen/Download</a>]<tr><td>I: Alabama > Promised, Peggy-O, Me  and  My Uncle > Big River, Tennessee Jed > Rooster, Bird Song, L. L. Rain, China Cat > I Know You Rider</td></tr>
<tr><td>II: Stranger > Franklin's > Estimated > Terrapin > Drumz > NFA > Morning Dew > Around > Saturday Night</td></tr>
<tr><td>E: Brokedown</td></tr>
</table></div>
<div class="setlist_table"><table border="0" cellspacing="0" cellpadding="0"><tr class="header"><td><span><a name="1004"></a><a href="/1981-10-04">10/4/1981 Rainbow Theater, London, England</a></span> [<a href="http://www.archive.org/search.php?query=creator:%22Grateful Dead%22%20date:1981-10-04*">Listen/Download</a>]<tr><td>I: Jam > Jack Straw, FOTD > El Paso, Jack A Roe, BIODTL, B. E. Women > Minglewood, Row Jimmy, Let It Grow > Deal</td></tr>
<tr><td>II: Cold Rain > Samson, Scarlet > Fire, Sailor > Saint > Drumz > Spanish Jam > Other One > Wharf Rat > Sugar Magnolia</td></tr>
<tr><td>E: Don't Ease</td></tr>
</table></div>
<div class="setlist_table"><table border="0" cellspacing="0" cellpadding="0"><tr class="header"><td><span><a name="1006"></a><a href="/1981-10-06">10/6/1981 Rainbow Theater, London, England</a></span> [<a href="http://www.archive.org/search.php?query=creator:%22Grateful Dead%22%20date:1981-10-06*">Listen/Download</a>]<tr><td>I: Shakedown > Minglewood, Roses, Rooster, Althea, Me  and  My Uncle > Mexicali, Good Times, Cumberland > L. L. Rain > Might As Well</td></tr>
<tr><td>II: Woman Smarter, High Time, Estimated > He's Gone > Drumz > Blues For Allah Jam > Wheel > Sugar Magnolia > Stella Blue > Good Lovin</td></tr>
<tr><td>E: Sunshine Daydream > Brokedown</td></tr>
<tr class="notes"><td>Next ''High Time'' 9/14/1982 [67 shows]</i></td></tr>
</table></div>
<div class="setlist_table"><table border="0" cellspacing="0" cellpadding="0"><tr class="header"><td><span><a name="1008"></a><a href="/1981-10-08">10/8/1981 The Forum Theater, Copenhagen, Denmark</a></span> [<a href="http://www.archive.org/search.php?query=creator:%22Grateful Dead%22%20date:1981-10-08*">Listen/Download</a>]<tr><td>I: Stranger, TLEO > C. C. Rider, Cumberland, Cassidy, Loser > Mama Tried > Mexicali, Althea > Music</td></tr>
<tr><td>II: Scarlet > Fire, Playin > Terrapin > Drumz > NFA > Black Peter > Around > Johnny B. Goode</td></tr>
<tr><td>E: U. S. Blues</td></tr>
</table></div>
<div class="setlist_table"><table border="0" cellspacing="0" cellpadding="0"><tr class="header"><td><span><a name="1010"></a><a href="/1981-10-10">10/10/1981 Stadthalle IV, Bremen, West Germany</a></span> [<a href="http://www.archive.org/search.php?query=creator:%22Grateful Dead%22%20date:1981-10-10*">Listen/Download</a>]<tr><td>I: Shakedown > Bertha > Minglewood, FOTD > El Paso, Tennessee Jed, Me  and  My Uncle > Big River, Bird Song > Let It Grow > Deal</td></tr>
<tr><td>II: Woman Smarter, Sugaree, Sailor > Saint > Eyes > Drumz > Truckin > Other One > Wharf Rat > Saturday Night</td></tr>
<tr><td>E: Casey Jones</td></tr>
</table></div>
<div class="setlist_table"><table border="0" cellspacing="0" cellpadding="0"><tr class="header"><td><span><a name="1011"></a><a href="/1981-10-11">10/11/1981 Melk Weg, Amsterdam, The Netherlands</a></span> [<a href="http://www.archive.org/search.php?query=creator:%22Grateful Dead%22%20date:1981-10-11*">Listen/Download</a>]<tr><td>Monkey & Engineer <span class="setlist_small">@</span>, All Around This World <span class="setlist_small">@</span>, Cassidy <span class="setlist_small">@</span>, Jack A Roe <span class="setlist_small">@</span>, On The Road Aagin <span class="setlist_small">@</span>, Bird Song <span class="setlist_small">@</span>, Ain't No Lie <span class="setlist_small">@</span></td></tr>
<tr class="notes"><td>Jerry Garcia & Bob Weir.</i></td></tr>
</table></div>
<div class="setlist_table"><table border="0" cellspacing="0" cellpadding="0"><tr class="header"><td><span><a name="1012"></a><a href="/1981-10-12">10/12/1981 Olympiahalle, Muenchen, West Germany</a></span> [<a href="http://www.archive.org/search.php?query=creator:%22Grateful Dead%22%20date:1981-10-12*">Listen/Download</a>]<tr><td>I: Jack Straw, Candyman > Rooster, Cumberland > BIODTL, Ramble On, Mama Tried > Mexicali, Althea, Passenger, China Cat > I Know You Rider</td></tr>
<tr><td>II: Bertha > Samson, Ship Of Fools, Estimated > GDTRFB > Good Times > Drumz > NFA > Stella Blue > Around > Good Lovin</td></tr>
<tr><td>E: U. S. Blues</td></tr>
</table></div>
<div class="setlist_table"><table border="0" cellspacing="0" cellpadding="0"><tr class="header"><td><span><a name="1013"></a><a href="/1981-10-13">10/13/1981 Walter Koebel Halle, Ruesselsheim, West Germany</a></span> [<a href="http://www.archive.org/search.php?query=creator:%22Grateful Dead%22%20date:1981-10-13*">Listen/Download</a>]<tr><td>I: Alabama > Greatest, TLEO, C. C. Rider, Peggy-O, Cassidy, To Lay Me Down, Minglewood, Bird Song > L. L. Rain > Don't Ease</td></tr>
<tr><td>II: Cold Rain, Sailor > Saint > Jam > Drumz > Spanish Jam > Wheel > Sugar Magnolia > Black Peter > Sunshine Daydream</td></tr>
<tr><td>E: Satisfaction</td></tr>
</table></div>
<div class="setlist_table"><table border="0" cellspacing="0" cellpadding="0"><tr class="header"><td><span><a name="1015"></a><a href="/1981-10-15">10/15/1981 Melk Weg, Amsterdam, The Netherlands</a></span> [<a href="http://www.archive.org/search.php?query=creator:%22Grateful Dead%22%20date:1981-10-15*">Listen/Download</a>]<tr><td>I: Minglewood, TLEO > El Paso, FOTD > Rooster, Althea, BIODTL, Far From Me > Alabama > Promised</td></tr>
<tr><td>II: Woman Smarter, He's Gone > Spoonful > Drumz > Other One > Wharf Rat > Around > Johnny B. Goode</td></tr>
<tr><td>E: Baby Blue</td></tr>
<tr class="notes"><td>First ''Spoonful''; Next ''Spoonful'' 4/22/1983 [94 shows]</i></td></tr>
<tr class="notes"><td>OOPS Concert. Cindy Peress opened.</i></td></tr>
</table></div>
<div class="setlist_table"><table border="0" cellspacing="0" cellpadding="0"><tr class="header"><td><span><a name="1015"></a><a href="/1981-10-15">10/15/1981 (unknown), Nancy, France, </a></span> [<a href="http://www.archive.org/search.php?query=creator:%22Grateful Dead%22%20date:1981-10-15*">Listen/Download</a>]<tr><td></td></tr>
<tr class="notes"><td>Cancelled due to lack of ticket sales. The Dead played the Melk Weg in Amsterdam instead. </i></td></tr>
</table></div>
<div class="setlist_table"><table border="0" cellspacing="0" cellpadding="0"><tr class="header"><td><span><a name="1016"></a><a href="/1981-10-16">10/16/1981 Melk Weg, Amsterdam, The Netherlands</a></span> [<a href="http://www.archive.org/search.php?query=creator:%22Grateful Dead%22%20date:1981-10-16*">Listen/Download</a>]<tr><td>I: On The Road Again<span class="setlist_small">@</span>, Dire Wolf<span class="setlist_small">@</span>, Monkey  and  Engineer<span class="setlist_small">@</span>, Bird Song<span class="setlist_small">@</span>, Cassidy<span class="setlist_small">@</span>, Ain't No Lie<span class="setlist_small">@</span>, Race Is On<span class="setlist_small">@</span>, Ripple<span class="setlist_small">@</span></td></tr>
<tr><td>II: Playin > Hully Gully > Wheel > Samson, Gloria > Lovelight > GDTRFB > Playin > Black Peter > Sugar Magnolia</td></tr>
<tr class="notes"><td>Only ''Hully Gully''; Next ''Ripple'' 9/3/1988 [459 shows]</i></td></tr>
<tr class="notes"><td>OOPS Concert. Bob Weir's 34th birthday. Cindy Peress opened. Only "Hully Gully."</i></td></tr>
</table></div>
<div class="setlist_table"><table border="0" cellspacing="0" cellpadding="0"><tr class="header"><td><span><a name="1016"></a><a href="/1981-10-16">10/16/1981 (unknown), Frejus, France, </a></span> [<a href="http://www.archive.org/search.php?query=creator:%22Grateful Dead%22%20date:1981-10-16*">Listen/Download</a>]<tr><td></td></tr>
<tr class="notes"><td>Cancelled due to lack of ticket sales. The Dead played the Melk Weg in Amsterdam instead.</i></td></tr>
</table></div>
<div class="setlist_table"><table border="0" cellspacing="0" cellpadding="0"><tr class="header"><td><span><a name="1017"></a><a href="/1981-10-17">10/17/1981 The Hippodrome, Paris, France</a></span> [<a href="http://www.archive.org/search.php?query=creator:%22Grateful Dead%22%20date:1981-10-17*">Listen/Download</a>]<tr><td>I: Shakedown > Minglewood, Candyman > Me  and  My Uncle > Big River, Althea > Rooster, B. E. Women > L. L. Rain, Don't Ease</td></tr>
<tr><td>II: Truckin > Bird Song > Good Times > Estimated > Eyes > Drumz > NFA > Morning Dew > Around > Saturday Night</td></tr>
<tr><td>E: U. S. Blues</td></tr>
</table></div>
<div class="setlist_table"><table border="0" cellspacing="0" cellpadding="0"><tr class="header"><td><span><a name="1019"></a><a href="/1981-10-19">10/19/1981 Sports Palace, Barcelona, Spain</a></span> [<a href="http://www.archive.org/search.php?query=creator:%22Grateful Dead%22%20date:1981-10-19*">Listen/Download</a>]<tr><td>I: Jack Straw > Franklin's, Mama Tried > Mexicali, Loser, C. C. Rider, Tennessee Jed, Passenger, Althea > Let It Grow</td></tr>
<tr><td>II: Scarlet > Fire, Sailor > Saint > Drumz > Spanish Jam > Other One > Stella Blue > Sugar Magnolia</td></tr>
<tr><td>E: Don't Ease</td></tr>
</table></div>
<div class="setlist_table"><table border="0" cellspacing="0" cellpadding="0"><tr class="header"><td><span><a name="1127"></a><a href="/1981-11-27">11/27/1981 Orange Bowl, Miami, FL</a></span> [<a href="http://www.archive.org/search.php?query=creator:%22Grateful Dead%22%20date:1981-11-27*">Listen/Download</a>]<tr><td></td></tr>
<tr class="notes"><td>The Dead would have played this gig with the Allman Brothers and the Outlaws.</i></td></tr>
</table></div>
<div class="setlist_table"><table border="0" cellspacing="0" cellpadding="0"><tr class="header"><td><span><a name="1129"></a><a href="/1981-11-29">11/29/1981 Pittsburgh Civic Arena, Pittsburgh, PA</a></span> [<a href="http://www.archive.org/search.php?query=creator:%22Grateful Dead%22%20date:1981-11-29*">Listen/Download</a>]<tr><td>I: Shakedown > Greatest, FOTD > C. C. Rider, Candyman, Me  and  My Uncle > Big River, Althea, L. L. Rain, Might As Well</td></tr>
<tr><td>II: Samson, Ship Of Fools, Sailor > Saint > He's Gone > Drumz > Truckin > Black Peter > Satisfaction</td></tr>
<tr><td>E: U. S. Blues</td></tr>
</table></div>
<div class="setlist_table"><table border="0" cellspacing="0" cellpadding="0"><tr class="header"><td><span><a name="1130"></a><a href="/1981-11-30">11/30/1981 Hara Arena, Dayton, OH</a></span> [<a href="http://www.archive.org/search.php?query=creator:%22Grateful Dead%22%20date:1981-11-30*">Listen/Download</a>]<tr><td>I: Minglewood, Mack The Knife, Bird Song > Rooster, TLEO, Cassidy, Tennessee Jed, Let It Grow > Don't Ease</td></tr>
<tr><td>II: Woman Smarter, Roses, Estimated > Eyes > Drumz > Other One > Wharf Rat > Sugar Magnolia</td></tr>
<tr><td>E: Might As Well</td></tr>
<tr class="notes"><td>Only ''Mack The Knife''</i></td></tr>
<tr class="notes"><td>Only "Mack The Knife."</i></td></tr>
</table></div>
<div class="setlist_table"><table border="0" cellspacing="0" cellpadding="0"><tr class="header"><td><span><a name="1202"></a><a href="/1981-12-02">12/2/1981 Assembly Hall, U. of Il., Champaign-Urbana, IL</a></span> [<a href="http://www.archive.org/search.php?query=creator:%22Grateful Dead%22%20date:1981-12-02*">Listen/Download</a>]<tr><td>I: Bertha > Greatest, Peggy-O, Mama Tried > Mexicali, B. E. Women, Passenger, Good Times, Cumberland, L. L. Rain, China Cat > I Know You Rider</td></tr>
<tr><td>II: Stranger > Franklin's, Sailor > Saint > Terrapin > Drumz > NFA > Stella Blue > Around > Good Lovin</td></tr>
<tr><td>E: Don't Ease</td></tr>
</table></div>
<div class="setlist_table"><table border="0" cellspacing="0" cellpadding="0"><tr class="header"><td><span><a name="1203"></a><a href="/1981-12-03">12/3/1981 Dane County Coliseum, Madison, WI</a></span> [<a href="http://www.archive.org/search.php?query=creator:%22Grateful Dead%22%20date:1981-12-03*">Listen/Download</a>]<tr><td>I: Jack Straw, TLEO, Me  and  My Uncle > Big River, Loser > C. C. Rider, Althea, BIODTL, Cassidy, Deep Elem, Miracle > Bertha</td></tr>
<tr><td>II: Scarlet > Fire, Estimated > He's Gone > Drumz > Spanish Jam > Truckin > Black Peter > Around > Johnny B. Goode</td></tr>
<tr><td>E: Baby Blue <span class="setlist_small">*</span></td></tr>
<tr class="notes"><td>Previous ''Deep Elem'' 3/9/1981 [63 shows]</i></td></tr>
<tr class="notes"><td>*appears on "Postcards from the Hanging." </i></td></tr>
</table></div>
<div class="setlist_table"><table border="0" cellspacing="0" cellpadding="0"><tr class="header"><td><span><a name="1205"></a><a href="/1981-12-05">12/5/1981 Market Square Arena, Indianapolis, IN</a></span> [<a href="http://www.archive.org/search.php?query=creator:%22Grateful Dead%22%20date:1981-12-05*">Listen/Download</a>]<tr><td>I: Alabama > Promised, FOTD > C. C. Rider, Cumberland > El Paso, Ramble On, Passenger, Bird Song > Let It Grow</td></tr>
<tr><td>II: Shakedown > Sailor > Saint, Big RxR Blues > Playin > Drumz > Wheel > Playin > Stella Blue > Sugar Magnolia</td></tr>
<tr><td>E: Saturday Night</td></tr>
</table></div>
<div class="setlist_table"><table border="0" cellspacing="0" cellpadding="0"><tr class="header"><td><span><a name="1206"></a><a href="/1981-12-06">12/6/1981 Rosemont Horizon, Rosemont, IL</a></span> [<a href="http://www.archive.org/search.php?query=creator:%22Grateful Dead%22%20date:1981-12-06*">Listen/Download</a>]<tr><td>I: Minglewood > Sugaree, Mama Tried > Mexicali, Candyman > Rooster, Tennessee Jed, L. L. Rain, Jack A Roe, BIODTL, China Cat > I Know You Rider</td></tr>
<tr><td>II: Samson, To Lay Me Down, Estimated > Eyes > Drumz > NFA > Wharf Rat > Good Lovin</td></tr>
<tr><td>E: Brokedown</td></tr>
</table></div>
<div class="setlist_table"><table border="0" cellspacing="0" cellpadding="0"><tr class="header"><td><span><a name="1207"></a><a href="/1981-12-07">12/7/1981 Des Moines Civic Center, Des Moines, IA</a></span> [<a href="http://www.archive.org/search.php?query=creator:%22Grateful Dead%22%20date:1981-12-07*">Listen/Download</a>]<tr><td>I: Bertha > Greatest, FOTD > C. C. Rider, Dire Wolf, Me  and  My Uncle > Big River, Deep Elem, Cassidy, Althea, Music</td></tr>
<tr><td>II: Half Step > Franklin's, Sailor > Saint > Jam > Drumz > Truckin > Nobody's Jam > Black Peter > Sugar Magnolia</td></tr>
<tr><td>E: Don't Ease</td></tr>
</table></div>
<div class="setlist_table"><table border="0" cellspacing="0" cellpadding="0"><tr class="header"><td><span><a name="1209"></a><a href="/1981-12-09">12/9/1981 Events Center, University of Colorado, Boulder, CO</a></span> [<a href="http://www.archive.org/search.php?query=creator:%22Grateful Dead%22%20date:1981-12-09*">Listen/Download</a>]<tr><td>I: Cold Rain > Jack Straw, FOTD > Rooster, Bird Song, Mama Tried > Mexicali, Candyman, Cassidy, L. L. Rain, China Cat > I Know You Rider</td></tr>
<tr><td>II: Scarlet > Fire > Estimated > He's Gone > Drumz > Other One > Stella Blue > Around > Good Lovin</td></tr>
<tr><td>E: U. S. Blues > Satisfaction</td></tr>
</table></div>
<div class="setlist_table"><table border="0" cellspacing="0" cellpadding="0"><tr class="header"><td><span><a name="1212"></a><a href="/1981-12-12">12/12/1981 Fiesta Hall, County Fairgrounds, San Mateo, CA</a></span> [<a href="http://www.archive.org/search.php?query=creator:%22Grateful Dead%22%20date:1981-12-12*">Listen/Download</a>]<tr><td>I: Bobby McGee<span class="setlist_small">@</span>, Children Of The 80s<span class="setlist_small">@</span>, Lucifer's Eyes<span class="setlist_small">@</span>, Warriors Of The Sun<span class="setlist_small">@</span>, Bye Bye Love<span class="setlist_small">@</span>, Barbara Allen<span class="setlist_small">@</span>, Marriott USA<span class="setlist_small">@</span>, Heroes Gone<span class="setlist_small">@</span>, Oh Boy<span class="setlist_small">@</span>, Lady Di<span class="setlist_small">+@</span>, The Boxer<span class="setlist_small">+@</span></td></tr>
<tr><td>II: Minglewood<span class="setlist_small">*</span> > Rooster<span class="setlist_small">*</span>, Deep Elem, Me  and  My Uncle > Mexicali, Dire Wolf, Cold Rain > Around<span class="setlist_small">*</span> > Saturday Night</td></tr>
<tr><td>E: Baby Blue<span class="setlist_small">#</span></td></tr>
<tr class="notes"><td>Only ''Barbara Allen''; First ''Bye Bye Love''; First ''Children Of The 80s''; Only ''Heroes Gone''; Only ''Lady Di''; First ''Lucifer's Eyes''; Only ''The Boxer''; Only ''Warriors Of The Sun''; Only ''You Won't Find Me''; Previous ''Bobby McGee'' 10/16/1974 [427 shows]; Previous ''Oh Boy'' 4/6/1971 [681 shows]; Final ''Oh Boy''</i></td></tr>
<tr class="notes"><td>Joan Baez  and  Friends - "Dance for Disarmament." *with Matt Kelly  +without Jerry.  #with Joan Baez, without Jerry  and  Brent. Acoustic set was also with Joan, without Brent. High Noon opened. (Merl Saunders, Mickey Hart, Michael Hinton, Jim McPherson and Chuck Rainey?) - They were joined by Bill Kreutzmann on percussion and later by Joan Baez on vocals - only "Heroes Gone" - only "The Boxer" - only "Warriors Of The Sun" - only "Marriott USA"</i></td></tr>
</table></div>
<div class="setlist_table"><table border="0" cellspacing="0" cellpadding="0"><tr class="header"><td><span><a name="1226"></a><a href="/1981-12-26">12/26/1981 Oakland Auditorium Arena, Oakland, CA</a></span> [<a href="http://www.archive.org/search.php?query=creator:%22Grateful Dead%22%20date:1981-12-26*">Listen/Download</a>]<tr><td>I: Alabama > Promised, Candyman > Rooster, Big Boss Man, Me  and  My Uncle > Big River, Bird Song, All Over Now, Big RxR Blues, Let It Grow</td></tr>
<tr><td>II: Scarlet > Fire > Estimated > He's Gone > Drumz > The Eleven Jam > Truckin > Black Peter > Around > Saturday Night</td></tr>
<tr><td>E: Don't Ease</td></tr>
<tr class="notes"><td>Next ''Big Boss Man'' 12/31/1983 [131 shows]</i></td></tr>
<tr class="notes"><td>Soundcheck: "Big Boss Man," "Cumberland." "A Day At The Dentist" during Drumz." Since there appears to be some controversy over the status of the "Eleven Jam," we will here point out that DeadBase author Mike Dolgushkin attended this show, was situated very close to the stage, and saw Mickey turn to Phil and say “The Eleven”, after which Phil nodded eagerly and the band began playing it. 
  </i></td></tr>
</table></div>
<div class="setlist_table"><table border="0" cellspacing="0" cellpadding="0"><tr class="header"><td><span><a name="1227"></a><a href="/1981-12-27">12/27/1981 Oakland Auditorium Arena, Oakland, CA</a></span> [<a href="http://www.archive.org/search.php?query=creator:%22Grateful Dead%22%20date:1981-12-27*">Listen/Download</a>]<tr><td>I: Minglewood > Sugaree, Cassidy, Deep Elem > C. C. Rider, FOTD, Passenger, Althea > L. L. Rain > Deal</td></tr>
<tr><td>II: Samson, To Lay Me Down > Playin > Drumz > Wheel > Playin > Wharf Rat > Sugar Magnolia</td></tr>
<tr><td>E: Baby Blue</td></tr>
<tr class="notes"><td>Final ''Passenger''</i></td></tr>
</table></div>
<div class="setlist_table"><table border="0" cellspacing="0" cellpadding="0"><tr class="header"><td><span><a name="1228"></a><a href="/1981-12-28">12/28/1981 Oakland Auditorium Arena, Oakland, CA</a></span> [<a href="http://www.archive.org/search.php?query=creator:%22Grateful Dead%22%20date:1981-12-28*">Listen/Download</a>]<tr><td>I: Bertha > Greatest, Peggy-O > El Paso, Loser, Mama Tried > Mexicali, Tennessee Jed > BIODTL, Good Times, Sailor > Saint</td></tr>
<tr><td>II: China Cat > I Know You Rider, Woman Smarter, Ship Of Fools, Eyes > Drumz > Other One > Stella Blue > Around > Good Lovin</td></tr>
<tr><td>E: U. S. Blues</td></tr>
</table></div>
<div class="setlist_table"><table border="0" cellspacing="0" cellpadding="0"><tr class="header"><td><span><a name="1230"></a><a href="/1981-12-30">12/30/1981 Oakland Auditorium Arena, Oakland, CA</a></span> [<a href="http://www.archive.org/search.php?query=creator:%22Grateful Dead%22%20date:1981-12-30*">Listen/Download</a>]<tr><td>I: Jack Straw, TLEO, On The Road Again, Dire Wolf > Rooster, Cumberland, All Over Now, Althea, Lazy Lightning > Supplication > Might As Well</td></tr>
<tr><td>II: Bobby McGee <span class="setlist_small">*</span>, Lady Di <span class="setlist_small">*</span>, Barbara Allen <span class="setlist_small">*</span>, Stranger<span class="setlist_small">+</span>, Ramble On > Estimated > Drumz > NFA > Black Peter > Johnny B. Goode</td></tr>
<tr><td>E: Casey Jones</td></tr>
<tr class="notes"><td>*with Joan Baez, without Brent   +without Brent</i></td></tr>
</table></div>
<div class="setlist_table"><table border="0" cellspacing="0" cellpadding="0"><tr class="header"><td><span><a name="1231"></a><a href="/1981-12-31">12/31/1981 Oakland Auditorium Arena, Oakland, CA</a></span> [<a href="http://www.archive.org/search.php?query=creator:%22Grateful Dead%22%20date:1981-12-31*">Listen/Download</a>]<tr><td>I: Bobby McGee<span class="setlist_small">*@</span>, Bye Bye Love<span class="setlist_small">*@</span>, Lucifer's Eyes<span class="setlist_small">*@</span>, Children Of The 80s<span class="setlist_small">*@</span>, Banks Of The Ohio<span class="setlist_small">*@</span></td></tr>
<tr><td>II: Shakedown, Me and My Uncle > Mexicali, Cold Rain, C.C. Rider <span class="setlist_small">+</span>, Roses <span class="setlist_small">*</span>, BIODTL, Big Boss Man <span class="setlist_small">+</span> > Minglewood <span class="setlist_small">+</span>, Don't Ease</td></tr>
<tr><td>III: Iko Iko<span class="setlist_small">*</span>, Playin > Terrapin > Playin > Drumz > Other One<span class="setlist_small">#</span> > NFA<span class="setlist_small">#</span> > GDTRFB<span class="setlist_small">#</span> > Morning Dew</td></tr>
<tr><td>E: Dark Star > Bertha > Good Lovin, Baby Blue<span class="setlist_small">*</span></td></tr>
<tr class="notes"><td>Only ''Banks Of The Ohio''; Next ''Dark Star'' 7/13/1984 [167 shows]; Previous ''Iko Iko'' 5/13/1981 [53 shows]; Final ''Bobby McGee''; Final ''Bye Bye Love''; Final ''Children Of The 80s''; Final ''Lucifer's Eyes''</i></td></tr>
<tr class="notes"><td>Bill Graham flies in on a joint - also: NRPS. *with Joan Baez.   +with Matt Kelly. #with John Cipollina. Only "Banks Of The Ohio." Slight "Eleven" hint during "Dark Star."</i></td></tr>
</table></div>

  </div>
</div>
</div>
</div>
</body>
</html>