<!DOCTYPE HTML PUBLIC "-//W3C//DTD HTML 4.01 Transitional//EN" "http://www.w3.org/TR/html4/loose.dtd">
<html>
<head>
<title>Grateful Dead 1987 Setlists | DeadBase Online | Grateful Dead Setlists</title>
<meta name="description" content="Complete Grateful Dead setlists and info from DeadBase Online">
<meta name="keywords" content="grateful dead setlists, grateful dead stats, dead lists, deadbase">
<meta http-equiv="Content-Type" content="text/html; charset=iso-8859-1">
<link href="/inc_style.css" rel="stylesheet" type="text/css">
</head>
<script language="JavaScript">self.onError = null; if( top.location != location ) { top.location.href = location.href; }</script>
<script language="JavaScript">function goto(object) { window.location.href = object.options[object.selectedIndex].value; }</script>
<script>
function showDrop(id) {
	document.getElementById(id).style.display='block';
}
function hideDrop(id) {
	document.getElementById(id).style.display='none';
}
</script>
<style type="text/css">
</style>
<body>
<div align="center">
<div id="container">
<div><img src="/images/banner.jpg"></div>

<div id="nav"><!--START NAV-->
	<div class="link"><a href="/my">My DeadBase</a></div>
    <div class="link" onmouseover="showDrop('lists_60s');" onmouseout="hideDrop('lists_60s');"><ul id="lists_60s">
    	<li><a href="/1965/setlists">1965</a></li><li><a href="/1966/setlists">1966</a></li><li><a href="/1967/setlists">1967</a></li><li><a href="/1968/setlists">1968</a></li><li><a href="/1969/setlists">1969</a></li>    </ul><a href="/setlists">60s Setlists</a></div>
    <div class="link" onmouseover="showDrop('lists_70s');" onmouseout="hideDrop('lists_70s');"><a href="/setlists">70s Setlists</a><ul id="lists_70s">
    	<li><a href="/1970/setlists">1970</a></li><li><a href="/1971/setlists">1971</a></li><li><a href="/1972/setlists">1972</a></li><li><a href="/1973/setlists">1973</a></li><li><a href="/1974/setlists">1974</a></li><li><a href="/1975/setlists">1975</a></li><li><a href="/1976/setlists">1976</a></li><li><a href="/1977/setlists">1977</a></li><li><a href="/1978/setlists">1978</a></li><li><a href="/1979/setlists">1979</a></li>    </ul></div>
    <div class="link" onmouseover="showDrop('lists_80s');" onmouseout="hideDrop('lists_80s');"><a href="/setlists">80s Setlists</a><ul id="lists_80s">
    	<li><a href="/1980/setlists">1980</a></li><li><a href="/1981/setlists">1981</a></li><li><a href="/1982/setlists">1982</a></li><li><a href="/1983/setlists">1983</a></li><li><a href="/1984/setlists">1984</a></li><li><a href="/1985/setlists">1985</a></li><li><a href="/1986/setlists">1986</a></li><li><a href="/1987/setlists">1987</a></li><li><a href="/1988/setlists">1988</a></li><li><a href="/1989/setlists">1989</a></li>    </ul></div>
    <div class="link" onmouseover="showDrop('lists_90s');" onmouseout="hideDrop('lists_90s');"><a href="/setlists">90s Setlists</a><ul id="lists_90s">
    	<li><a href="/1990/setlists">1990</a></li><li><a href="/1991/setlists">1991</a></li><li><a href="/1992/setlists">1992</a></li><li><a href="/1993/setlists">1993</a></li><li><a href="/1994/setlists">1994</a></li><li><a href="/1995/setlists">1995</a></li>    </ul></div>
    <div class="link"><a href="/songs">Songbook</a></div>
    <div class="link"><a href="/stuff">Odds &amp; Ends</a></div>
    <div class="link"><a href="/community">Community</a></div>
    <div class="clear"></div>
</div>

<div id="logbar"><!--START LOGIN-->
You are logged in as Dave R [<a href="">Log Out</a>]<span class="space">|</span><a href="/my">My DeadBase Options and Shows</a><span class="space">|</span>Shows I own are currently highlighted. [<span onmouseover="document.getElementById('highoptions').style.display='block';" onmouseout="document.getElementById('highoptions').style.display='none'; return false;"><a href="#" onclick="return false;">Change</a><div id="highoptions" class="highoptions" style="display:none;">
		<a href="/1987/setlists&highlight=went">Shows I attended</a>
		<a href="/1987/setlists&highlight=own">Shows I own</a>
		<a href="/1987/setlists&highlight=looking">Shows I'm looking for</a>
		<a href="/1987/setlists&highlight=favorite">My favorite shows</a>
	</div></span>] 
</div>

<div><!--START main-->
<div id="mainc"><div id="main">
	<div class="page_title">1987 Setlists</div>

<script language="Javascript" type="text/javascript">
<!--
function showtab () {
document.getElementById('hide').style.display = 'none';
document.getElementById('show').style.display = 'block';
}
function hidetab () {
document.getElementById('show').style.display = 'none';
document.getElementById('hide').style.display = 'block';
}
-->
</script>
<p>January:  <a href="#0128">28</a> <a href="#0129">29</a> <a href="#0130">30</a><br>
March: <a href="#0301">1</a> <a href="#0302">2</a> <a href="#0303">3</a> <a href="#0322">22</a> <a href="#0323">23</a> <a href="#0324">24</a> <a href="#0326">26</a> <a href="#0327">27</a> <a href="#0329">29</a> <a href="#0330">30</a> <a href="#0331">31</a><br>
April: <a href="#0402">2</a> <a href="#0403">3</a> <a href="#0404">4</a> <a href="#0406">6</a> <a href="#0407">7</a> <a href="#0409">9</a> <a href="#0410">10</a> <a href="#0411">11</a> <a href="#0417">17</a> <a href="#0418">18</a> <a href="#0419">19</a><br>
May: <a href="#0502">2</a> <a href="#0503">3</a> <a href="#0509">9</a> <a href="#0510">10</a> <a href="#05xx">xx</a><br>
June: <a href="#0612">12</a> <a href="#0613">13</a> <a href="#0614">14</a> <a href="#0619">19</a> <a href="#0620">20</a> <a href="#0621">21</a> <a href="#0626">26</a> <a href="#0627">27</a> <a href="#0628">28</a> <a href="#0630">30</a><br>
July: <a href="#0702">2</a> <a href="#0704">4</a> <a href="#0706">6</a> <a href="#0707">7</a> <a href="#0708">8</a> <a href="#0710">10</a> <a href="#0711">11</a> <a href="#0712">12</a> <a href="#0712">12</a> <a href="#0713">13</a> <a href="#0719">19</a> <a href="#0724">24</a> <a href="#0726">26</a><br>
August: <a href="#0811">11</a> <a href="#0812">12</a> <a href="#0813">13</a> <a href="#0815">15</a> <a href="#0816">16</a> <a href="#0818">18</a> <a href="#0820">20</a> <a href="#0822">22</a> <a href="#0823">23</a><br>
September: <a href="#0907">7</a> <a href="#0908">8</a> <a href="#0909">9</a> <a href="#0911">11</a> <a href="#0912">12</a> <a href="#0913">13</a> <a href="#0915">15</a> <a href="#0916">16</a> <a href="#0917">17</a> <a href="#0918">18</a> <a href="#0919">19</a> <a href="#0920">20</a> <a href="#0922">22</a> <a href="#0923">23</a> <a href="#0924">24</a><br>
October: <a href="#1002">2</a> <a href="#1003">3</a> <a href="#1004">4</a><br>
November: <a href="#1106">6</a> <a href="#1107">7</a> <a href="#1108">8</a> <a href="#1113">13</a> <a href="#1114">14</a> <a href="#1115">15</a> <a href="#1117">17</a> <a href="#1118">18</a> <a href="#1120">20</a> <a href="#1121">21</a><br>
December: <a href="#1217">17</a> <a href="#1227">27</a> <a href="#1228">28</a> <a href="#1230">30</a> <a href="#1231">31</a></p>
<div class="setlist_table"><table border="0" cellspacing="0" cellpadding="0"><tr class="header"><td><span><a name="0128"></a><a href="/1987-01-28">1/28/1987 San Francisco Civic Auditorium, San Francisco, CA</a></span> [<a href="http://www.archive.org/search.php?query=creator:%22Grateful Dead%22%20date:1987-01-28*">Listen/Download</a>]<tr><td>I: Shakedown, Get Back, Peggy-O, Walking Blues, Roses, All Over Now, Row Jimmy, Esau, Bird Song, Jack Straw</td></tr>
<tr><td>II: Push > Samson > Black Muddy River > He's Gone > Spoonful > Drumz<span class="setlist_small">*</span> > Eyes > Black Peter > Around > Sugar Magnolia</td></tr>
<tr><td>E: U. S. Blues</td></tr>
<tr class="notes"><td>Only ''Get Back''; Previous ''Walking Blues'' 7/13/1985 [80 shows]</i></td></tr>
<tr class="notes"><td>*with extra drummers, no Space. Only "Get Back."</i></td></tr>
</table></div>
<div class="setlist_table"><table border="0" cellspacing="0" cellpadding="0"><tr class="header"><td><span><a name="0129"></a><a href="/1987-01-29">1/29/1987 San Francisco Civic Auditorium, San Francisco, CA</a></span> [<a href="http://www.archive.org/search.php?query=creator:%22Grateful Dead%22%20date:1987-01-29*">Listen/Download</a>]<tr><td>I: Bucket > Sugaree, El Paso, Loser, Rooster, B. E. Women, Cassidy > Don't Ease</td></tr>
<tr><td>II: Scarlet > Fire, L. L. Rain, Terrapin > Drumz > Miracle > Stella Blue > GDTRFB > Johnny B. Goode</td></tr>
<tr><td>E: Baby Blue</td></tr>
<tr class="notes"><td>Chinese New Year - the Chinese Symphony Orchestra opened. "Funiculi Funicula"  and  "Tico Tico" tunings before "Bucket." </i></td></tr>
</table></div>
<div class="setlist_table"><table border="0" cellspacing="0" cellpadding="0"><tr class="header"><td><span><a name="0130"></a><a href="/1987-01-30">1/30/1987 San Francisco Civic Auditorium, San Francisco, CA</a></span> [<a href="http://www.archive.org/search.php?query=creator:%22Grateful Dead%22%20date:1987-01-30*">Listen/Download</a>]<tr><td>I: Touch, Minglewood, Candyman, Me  and  My Uncle > Mexicali, Push, BIODTL > Promised > China Cat > I Know You Rider</td></tr>
<tr><td>II: Iko Iko > Woman Smarter, Ship Of Fools, Estimated > Truckin > Drumz > Other One > Wharf Rat > Throwing Stones > NFA</td></tr>
<tr><td>E: NFA > Brokedown</td></tr>
</table></div>
<div class="setlist_table"><table border="0" cellspacing="0" cellpadding="0"><tr class="header"><td><span><a name="0301"></a><a href="/1987-03-01">3/1/1987 Henry J. Kaiser Convention Center, Oakland, CA</a></span> [<a href="http://www.archive.org/search.php?query=creator:%22Grateful Dead%22%20date:1987-03-01*">Listen/Download</a>]<tr><td>I: Touch > Rooster, Peggy-O, Me  and  My Uncle > Mexicali, Push, All Over Now, Row Jimmy > Let It Grow</td></tr>
<tr><td>II: Bucket > Scarlet > Fire, Samson, Black Muddy River > He's Gone > Drumz > Other One > Black Peter > Around > Good Lovin</td></tr>
<tr><td>E: Don't Ease</td></tr>
</table></div>
<div class="setlist_table"><table border="0" cellspacing="0" cellpadding="0"><tr class="header"><td><span><a name="0302"></a><a href="/1987-03-02">3/2/1987 Henry J. Kaiser Convention Center, Oakland, CA</a></span> [<a href="http://www.archive.org/search.php?query=creator:%22Grateful Dead%22%20date:1987-03-02*">Listen/Download</a>]<tr><td>I: Jack Straw, Althea, C. C. Rider, Bird Song, BIODTL, Ramble On, Stranger</td></tr>
<tr><td>II: China Cat > I Know You Rider > Woman Smarter, Ship Of Fools, Estimated > Eyes > Drumz > Truckin > Morning Dew</td></tr>
<tr><td>E: Johnny B. Goode</td></tr>
<tr class="notes"><td>"Funiculi Funicula" tuning before "Jack Straw."</i></td></tr>
</table></div>
<div class="setlist_table"><table border="0" cellspacing="0" cellpadding="0"><tr class="header"><td><span><a name="0303"></a><a href="/1987-03-03">3/3/1987 Henry J. Kaiser Convention Center, Oakland, CA</a></span> [<a href="http://www.archive.org/search.php?query=creator:%22Grateful Dead%22%20date:1987-03-03*">Listen/Download</a>]<tr><td>I: Mighty Quinn, Greatest, Loser, Minglewood, Tons Of Steel, Cassidy, Half Step > Promised</td></tr>
<tr><td>II: Drums <span class="setlist_small">*</span> > Iko Iko<span class="setlist_small">*</span>, Saint, Terrapin > Drumz > Gimme Some Lovin > Wharf Rat > Throwing Stones > Touch</td></tr>
<tr><td>E: Brokedown</td></tr>
<tr class="notes"><td>Next ''Drums'' 2/16/1988 [82 shows]</i></td></tr>
<tr class="notes"><td>Mardi Gras. Dirty Dozen Brass Band opened.*with members of the Dirty Dozen Brass Band. </i></td></tr>
</table></div>
<div class="setlist_table"><table border="0" cellspacing="0" cellpadding="0"><tr class="header"><td><span><a name="0322"></a><a href="/1987-03-22">3/22/1987 Hampton Coliseum, Hampton, VA</a></span> [<a href="http://www.archive.org/search.php?query=creator:%22Grateful Dead%22%20date:1987-03-22*">Listen/Download</a>]<tr><td>I: Bucket > Sugaree, All Over Now, West L. A., El Paso, Push, Cassidy > Deal</td></tr>
<tr><td>II: Sugar Magnolia > Scarlet > Fire > Estimated > Drumz > Wheel > Black Peter > Sunshine Daydream</td></tr>
<tr><td>E: Baby Blue</td></tr>
<tr class="notes"><td>Previous ''Sunshine Daydream'' 12/31/1982 [254 shows]</i></td></tr>
</table></div>
<div class="setlist_table"><table border="0" cellspacing="0" cellpadding="0"><tr class="header"><td><span><a name="0323"></a><a href="/1987-03-23">3/23/1987 Hampton Coliseum, Hampton, VA</a></span> [<a href="http://www.archive.org/search.php?query=creator:%22Grateful Dead%22%20date:1987-03-23*">Listen/Download</a>]<tr><td>I: Touch, Rooster, Althea, Me  and  My Uncle > Big River, Iko Iko, Tons Of Steel, Stranger, Don't Ease</td></tr>
<tr><td>II: Box Of Rain > Woman Smarter, Ship Of Fools, Truckin > Drumz > Other One > Stella Blue > Throwing Stones > Lovelight</td></tr>
<tr><td>E: U. S. Blues</td></tr>
</table></div>
<div class="setlist_table"><table border="0" cellspacing="0" cellpadding="0"><tr class="header"><td><span><a name="0324"></a><a href="/1987-03-24">3/24/1987 Hampton Coliseum, Hampton, VA</a></span> [<a href="http://www.archive.org/search.php?query=creator:%22Grateful Dead%22%20date:1987-03-24*">Listen/Download</a>]<tr><td>I: Jack Straw, Candyman, Minglewood, Loser, Mama Tried > Mexicali, Ramble On, Let It Grow</td></tr>
<tr><td>II: Gimme Some Lovin > Black Muddy River, Playin > Terrapin > Drumz > Mr. Fantasy > Wharf Rat > NFA</td></tr>
<tr><td>E: Brokedown</td></tr>
</table></div>
<div class="setlist_table"><table border="0" cellspacing="0" cellpadding="0"><tr class="header"><td><span><a name="0326"></a><a href="/1987-03-26">3/26/1987 Hartford Civic Center, Hartford, CT</a></span> [<a href="http://www.archive.org/search.php?query=creator:%22Grateful Dead%22%20date:1987-03-26*">Listen/Download</a>]<tr><td>I: Midnight Hour > Cold Rain, C. C. Rider, Row Jimmy, Esau > Push, Desolation Row > Bird Song > Promised</td></tr>
<tr><td>II: China Cat > I Know You Rider, L. L. Rain, He's Gone > Drumz > Miracle > Black Peter > Around > Good Lovin</td></tr>
<tr><td>E: Mighty Quinn</td></tr>
<tr class="notes"><td>Soundcheck: Cumberland, Far From Me.</i></td></tr>
</table></div>
<div class="setlist_table"><table border="0" cellspacing="0" cellpadding="0"><tr class="header"><td><span><a name="0327"></a><a href="/1987-03-27">3/27/1987 Hartford Civic Center, Hartford, CT</a></span> [<a href="http://www.archive.org/search.php?query=creator:%22Grateful Dead%22%20date:1987-03-27*">Listen/Download</a>]<tr><td>I: Alabama > Greatest, West L. A., Rooster, B. E. Women, BIODTL, Tennessee Jed, Music</td></tr>
<tr><td>II: Touch > Samson, Cumberland, Estimated > Eyes > Drumz > Uncle John > Morning Dew</td></tr>
<tr><td>E: Johnny B. Goode</td></tr>
<tr class="notes"><td>"Crazy Fingers" tease before "Uncle John."</i></td></tr>
</table></div>
<div class="setlist_table"><table border="0" cellspacing="0" cellpadding="0"><tr class="header"><td><span><a name="0329"></a><a href="/1987-03-29">3/29/1987 The Spectrum, Philadelphia, PA</a></span> [<a href="http://www.archive.org/search.php?query=creator:%22Grateful Dead%22%20date:1987-03-29*">Listen/Download</a>]<tr><td>I: Bucket > Bertha > Rooster, Far From Me, FOTD > El Paso, Push > Let It Grow</td></tr>
<tr><td>II: Half Step > Playin > China Doll > Woman Smarter > Drumz > Wheel > GDTRFB > Playin > Black Muddy River > Sugar Magnolia</td></tr>
<tr><td>E: Mighty Quinn</td></tr>
<tr class="notes"><td>Previous ''Far From Me'' 10/30/1984 [135 shows]</i></td></tr>
</table></div>
<div class="setlist_table"><table border="0" cellspacing="0" cellpadding="0"><tr class="header"><td><span><a name="0330"></a><a href="/1987-03-30">3/30/1987 The Spectrum, Philadelphia, PA</a></span> [<a href="http://www.archive.org/search.php?query=creator:%22Grateful Dead%22%20date:1987-03-30*">Listen/Download</a>]<tr><td>I: Shakedown, All Over Now, Stagger Lee, Good Times, Box Of Rain, Loser, Cassidy</td></tr>
<tr><td>II: Iko Iko, Saint > He's Gone > Drumz > Truckin > Other One > Wharf Rat > Throwing Stones > NFA</td></tr>
<tr><td>E: Baby Blue</td></tr>
</table></div>
<div class="setlist_table"><table border="0" cellspacing="0" cellpadding="0"><tr class="header"><td><span><a name="0331"></a><a href="/1987-03-31">3/31/1987 The Spectrum, Philadelphia, PA</a></span> [<a href="http://www.archive.org/search.php?query=creator:%22Grateful Dead%22%20date:1987-03-31*">Listen/Download</a>]<tr><td>I: Jack Straw > Franklin's, C. C. Rider, Ramble On, Tons Of Steel, Mama Tried > Big River, Candyman, Desolation Row, Don't Ease</td></tr>
<tr><td>II: Touch > Estimated > Terrapin > Drumz > Uncle John > Miracle > Stella Blue > Around > Lovelight</td></tr>
<tr><td>E: Brokedown</td></tr>
<tr class="notes"><td>FM broadcast WMMR-Philadelphia.</i></td></tr>
</table></div>
<div class="setlist_table"><table border="0" cellspacing="0" cellpadding="0"><tr class="header"><td><span><a name="0402"></a><a href="/1987-04-02">4/2/1987 The Centrum, Worcester, MA</a></span> [<a href="http://www.archive.org/search.php?query=creator:%22Grateful Dead%22%20date:1987-04-02*">Listen/Download</a>]<tr><td>I: Cold Rain > Minglewood, Dupree's, Far From Me, Me  and  My Uncle > Mexicali, Push, BIODTL, Bird Song, Music</td></tr>
<tr><td>II: Scarlet > Fire, L. L. Rain > Eyes > Drumz > Gimme Some Lovin > Wheel > Black Peter > Around > Good Lovin</td></tr>
<tr><td>E: Black Muddy River</td></tr>
<tr class="notes"><td>FM broadcast WCUW.</i></td></tr>
</table></div>
<div class="setlist_table"><table border="0" cellspacing="0" cellpadding="0"><tr class="header"><td><span><a name="0403"></a><a href="/1987-04-03">4/3/1987 The Centrum, Worcester, MA</a></span> [<a href="http://www.archive.org/search.php?query=creator:%22Grateful Dead%22%20date:1987-04-03*">Listen/Download</a>]<tr><td>I: Bucket > Sugaree, C. C. Rider, Roses, All Over Now, Big RxR Blues, Let It Grow > Don't Ease</td></tr>
<tr><td>II: China Cat > I Know You Rider, Woman Smarter > Crazy Fingers > Samson > Drumz > Other One > Wharf Rat > Throwing Stones > NFA</td></tr>
<tr><td>E: U. S. Blues</td></tr>
<tr class="notes"><td>Next ''C. C. Rider'' 12/10/1989 [218 shows]</i></td></tr>
<tr class="notes"><td>FM broadcast WCUW.</i></td></tr>
</table></div>
<div class="setlist_table"><table border="0" cellspacing="0" cellpadding="0"><tr class="header"><td><span><a name="0404"></a><a href="/1987-04-04">4/4/1987 The Centrum, Worcester, MA</a></span> [<a href="http://www.archive.org/search.php?query=creator:%22Grateful Dead%22%20date:1987-04-04*">Listen/Download</a>]<tr><td>I: Touch > Greatest, Althea, El Paso, Tennessee Jed, Cassidy, Good Times, Box Of Rain, Promised</td></tr>
<tr><td>II: Iko Iko, Playin > Comes A Time > Hand Jive > Drumz > Truckin > Playin > Morning Dew</td></tr>
<tr><td>E: Saturday Night</td></tr>
<tr class="notes"><td>Final ''Hand Jive''</i></td></tr>
<tr class="notes"><td>FM broadcast WCUW.</i></td></tr>
</table></div>
<div class="setlist_table"><table border="0" cellspacing="0" cellpadding="0"><tr class="header"><td><span><a name="0406"></a><a href="/1987-04-06">4/6/1987 Meadowlands Arena, East Rutherford, NJ</a></span> [<a href="http://www.archive.org/search.php?query=creator:%22Grateful Dead%22%20date:1987-04-06*">Listen/Download</a>]<tr><td>I: Dancin > Franklin's, Rooster, Peggy-O, Me  and  My Uncle > Mexicali, Push, Jack Straw > Deal</td></tr>
<tr><td>II: Stranger, Cumberland, Tons Of Steel, Saint > Drumz > Terrapin > Other One > Stella Blue > Sugar Magnolia</td></tr>
<tr><td>E: Black Muddy River</td></tr>
<tr class="notes"><td>Final ''Dancin''</i></td></tr>
</table></div>
<div class="setlist_table"><table border="0" cellspacing="0" cellpadding="0"><tr class="header"><td><span><a name="0407"></a><a href="/1987-04-07">4/7/1987 Meadowlands Arena, East Rutherford, NJ</a></span> [<a href="http://www.archive.org/search.php?query=creator:%22Grateful Dead%22%20date:1987-04-07*">Listen/Download</a>]<tr><td>I: Touch, Minglewood, FOTD, BIODTL, Stagger Lee, Mama Tried > Big River, West L. A., Bucket > Don't Ease</td></tr>
<tr><td>II: Box Of Rain, Miracle > Bertha, Ship Of Fools, Woman Smarter > Drumz > Gimme Some Lovin > Morning Dew > Throwing Stones > NFA</td></tr>
<tr><td>E: Mighty Quinn</td></tr>
<tr class="notes"><td>false start on "Bucket." FM broadcast WNEW-New York  and  WXRK.</i></td></tr>
</table></div>
<div class="setlist_table"><table border="0" cellspacing="0" cellpadding="0"><tr class="header"><td><span><a name="0409"></a><a href="/1987-04-09">4/9/1987 UIC Pavilion, Chicago, IL</a></span> [<a href="http://www.archive.org/search.php?query=creator:%22Grateful Dead%22%20date:1987-04-09*">Listen/Download</a>]<tr><td>I: Greatest > Promised, Push, Good Times, El Paso, Row Jimmy, Esau, Far From Me, Deal</td></tr>
<tr><td>II: Scarlet > Fire, Playin > Uncle John > Drumz > China Doll > Playin Jam > GDTRFB > Sugar Magnolia</td></tr>
<tr><td>E: U. S. Blues</td></tr>
<tr class="notes"><td>Next ''El Paso'' 4/3/1989 [157 shows]</i></td></tr>
</table></div>
<div class="setlist_table"><table border="0" cellspacing="0" cellpadding="0"><tr class="header"><td><span><a name="0410"></a><a href="/1987-04-10">4/10/1987 UIC Pavilion, Chicago, IL</a></span> [<a href="http://www.archive.org/search.php?query=creator:%22Grateful Dead%22%20date:1987-04-10*">Listen/Download</a>]<tr><td>I: Shakedown, Rooster, Candyman, Me  and  My Uncle > Mexicali, B. E. Women, Cassidy > Don't Ease</td></tr>
<tr><td>II: Iko Iko, L. L. Rain, Box Of Rain > He's Gone > Drumz > Other One > Black Peter > Around > Lovelight</td></tr>
<tr><td>E: Baby Blue</td></tr>
</table></div>
<div class="setlist_table"><table border="0" cellspacing="0" cellpadding="0"><tr class="header"><td><span><a name="0411"></a><a href="/1987-04-11">4/11/1987 UIC Pavilion, Chicago, IL</a></span> [<a href="http://www.archive.org/search.php?query=creator:%22Grateful Dead%22%20date:1987-04-11*">Listen/Download</a>]<tr><td>I: Bucket > Sugaree, Minglewood, Loser, Tons Of Steel, Desolation Row, Big RxR Blues, Music</td></tr>
<tr><td>II: Touch > Woman Smarter, Terrapin > Drumz > Truckin > Wharf Rat > Throwing Stones > NFA</td></tr>
<tr><td>E: NFA > Black Muddy River</td></tr>
<tr class="notes"><td>FM broadcast WXRT.</i></td></tr>
</table></div>
<div class="setlist_table"><table border="0" cellspacing="0" cellpadding="0"><tr class="header"><td><span><a name="0417"></a><a href="/1987-04-17">4/17/1987 Irvine Meadows Amphitheatre, Irvine, CA</a></span> [<a href="http://www.archive.org/search.php?query=creator:%22Grateful Dead%22%20date:1987-04-17*">Listen/Download</a>]<tr><td>I: Cold Rain, Rooster, FOTD, All Over Now, Push, Desolation Row > Deal</td></tr>
<tr><td>II: Touch > Samson, Ship Of Fools, Estimated > Eyes > Drumz > Wheel > Truckin > Stella Blue > Around > Good Lovin</td></tr>
<tr><td>E: Mighty Quinn</td></tr>
</table></div>
<div class="setlist_table"><table border="0" cellspacing="0" cellpadding="0"><tr class="header"><td><span><a name="0418"></a><a href="/1987-04-18">4/18/1987 Irvine Meadows Amphitheatre, Irvine, CA</a></span> [<a href="http://www.archive.org/search.php?query=creator:%22Grateful Dead%22%20date:1987-04-18*">Listen/Download</a>]<tr><td>I: Bucket > Sugaree, Me  and  My Uncle > Mexicali, West L. A., Far From Me, Row Jimmy, Let It Grow > Don't Ease</td></tr>
<tr><td>II: Iko Iko > Playin > Terrapin > Drumz > Gimme Some Lovin > Morning Dew > Throwing Stones > Lovelight</td></tr>
<tr><td>E: Black Muddy River</td></tr>
<tr class="notes"><td>"Tico Tico" tuning before "Let It Grow."</i></td></tr>
</table></div>
<div class="setlist_table"><table border="0" cellspacing="0" cellpadding="0"><tr class="header"><td><span><a name="0419"></a><a href="/1987-04-19">4/19/1987 Irvine Meadows Amphitheatre, Irvine, CA</a></span> [<a href="http://www.archive.org/search.php?query=creator:%22Grateful Dead%22%20date:1987-04-19*">Listen/Download</a>]<tr><td>I: Half Step > Franklin's, Minglewood, Ramble On, Tons Of Steel, Box Of Rain, Cassidy, Alabama > Promised</td></tr>
<tr><td>II: China Cat > I Know You Rider > Woman Smarter > Black Muddy River > Miracle > Cumberland > Drumz > Other One > Wharf Rat > NFA</td></tr>
<tr><td>E: NFA, Brokedown</td></tr>
</table></div>
<div class="setlist_table"><table border="0" cellspacing="0" cellpadding="0"><tr class="header"><td><span><a name="0502"></a><a href="/1987-05-02">5/2/1987 Frost Amphitheatre, Stanford U., Palo Alto, CA</a></span> [<a href="http://www.archive.org/search.php?query=creator:%22Grateful Dead%22%20date:1987-05-02*">Listen/Download</a>]<tr><td>I: Bucket, West L. A., BIODTL, Stagger Lee, Rooster, Dire Wolf, Far From Me, Jack Straw > Push, Saturday Night</td></tr>
<tr><td>II: China Cat > I Know You Rider, Playin > Terrapin > Drumz > Truckin > Morning Dew > Around > Lovelight</td></tr>
<tr><td>E: Black Muddy River</td></tr>
<tr class="notes"><td>Next ''BIODTL'' 9/6/1988 [111 shows]; Previous ''Dire Wolf'' 4/4/1986 [54 shows]</i></td></tr>
</table></div>
<div class="setlist_table"><table border="0" cellspacing="0" cellpadding="0"><tr class="header"><td><span><a name="0503"></a><a href="/1987-05-03">5/3/1987 Frost Amphitheatre, Stanford U., Palo Alto, CA</a></span> [<a href="http://www.archive.org/search.php?query=creator:%22Grateful Dead%22%20date:1987-05-03*">Listen/Download</a>]<tr><td>I: Touch, Promised, Row Jimmy, Peggy-O, Good Times, Cassidy, Don't Ease</td></tr>
<tr><td>II: Iko Iko, Stranger, Ship Of Fools, Estimated > Drumz > Other One > Black Peter > Throwing Stones > NFA</td></tr>
<tr><td>E: NFA > Mighty Quinn</td></tr>
<tr class="notes"><td>"Little Bunny Foo-Foo" tuning with vocals by Brent before "Peggy-O." FM broadcast KZSU-Palo Alto.</i></td></tr>
</table></div>
<div class="setlist_table"><table border="0" cellspacing="0" cellpadding="0"><tr class="header"><td><span><a name="0509"></a><a href="/1987-05-09">5/9/1987 Laguna Seca Recreation Area, Monterey, CA</a></span> [<a href="http://www.archive.org/search.php?query=creator:%22Grateful Dead%22%20date:1987-05-09*">Listen/Download</a>]<tr><td>I: Sugar Magnolia > Sugaree, Me  and  My Uncle > Mexicali, Push, Tons Of Steel, Esau, Tennessee Jed, Let It Grow</td></tr>
<tr><td>II: Touch > L. L. Rain > He's Gone > Drumz > Wheel > Other One > Wharf Rat > Around > Sunshine Daydream</td></tr>
<tr><td>E: Iko Iko</td></tr>
<tr class="notes"><td>Bruce Hornsby  and  The Range, then Ry Cooder opened.</i></td></tr>
</table></div>
<div class="setlist_table"><table border="0" cellspacing="0" cellpadding="0"><tr class="header"><td><span><a name="0510"></a><a href="/1987-05-10">5/10/1987 Laguna Seca Recreation Area, Monterey, CA</a></span> [<a href="http://www.archive.org/search.php?query=creator:%22Grateful Dead%22%20date:1987-05-10*">Listen/Download</a>]<tr><td>I: Half Step > Stranger, West L. A., Minglewood, Row Jimmy, Box Of Rain > Desolation Row > Don't Ease</td></tr>
<tr><td>II: Bucket > Scarlet > Fire > Woman Smarter > Drumz > China Doll > Playin > Throwing Stones > Lovelight</td></tr>
<tr><td>E: NFA, Black Muddy River</td></tr>
<tr class="notes"><td>Bruce Hornsby  and  The Range, then Ry Cooder opened.</i></td></tr>
</table></div>
<div class="setlist_table"><table border="0" cellspacing="0" cellpadding="0"><tr class="header"><td><span><a name="05xx"></a><a href="/1987-05-xx">5/xx/1987 Le Club Front, San Rafael, CA</a></span> [<a href="http://www.archive.org/search.php?query=creator:%22Grateful Dead%22%20date:1987-05-xx*">Listen/Download</a>]<tr><td>The French Girl > Blues Stay Away From Me, John Hardy, Jam, I’m So Lonseome I Could Cry > Blues Stay Away From Me, Times A Changin, Masterpiece, Man Of Peace, Baby Tonight, The Ballad Of Ira Hayes, I Want You, Thin Man, Memphis Blues Again, Dead Man, Queen Jane, The French Girl, In The Summertime, Man Of Peace, Union Sundown, Baby Blue, Joey, If Not For You, Slow Train, Tomorrow Is A Long Time, Walkin’ Down The Line, Serve Somebody, Gonna Change My Way Of Thinking, Maggie’s Farm, Chimes Of Freedom, All I Really Want To Do, John Brown, Heart Of Mine, Rolling In My Sweet Baby’s Arms, John Hardy, Judas Priest, John Brown, Baby Tonight, Don’t Keep Me Waiting Too Long, Stealin’, I Want You, Oh Boy, Tangled Up, Simple Twist, The Boy In The Bubble, Heart Of Mine, Pledging My Time, Senor, Wicked Messenger, Watching The River Flow, Under Your Spell, I’m So Lonesome I Could Cry, Blues Stay Away From Me, If Not For You, Judas Priest, Senor, I’Baby Tonight, I’m Free, They Killed Him, Pledging My Time, Oh Boy</td></tr>
<tr class="notes"><td>Rehearsals with Bob Dylan. The above tunes were performed at several sessions-it is not certain what the correct sequence is , how the sessions break down, how many there were, or what the exact dates are. They definitely took place, however, during May and June of 1987. One of the versions of "Man of Peace" appears on "Postcards from the Hanging" dated 06-09-87.</i></td></tr>
</table></div>
<div class="setlist_table"><table border="0" cellspacing="0" cellpadding="0"><tr class="header"><td><span><a name="0612"></a><a href="/1987-06-12">6/12/1987 County Fairgrounds, Ventura, CA</a></span> [<a href="http://www.archive.org/search.php?query=creator:%22Grateful Dead%22%20date:1987-06-12*">Listen/Download</a>]<tr><td>I: Jack Straw, West L. A., Mama Tried > Big River, Candyman, Esau, Bird Song, Desolation Row, Don't Ease</td></tr>
<tr><td>II: China Cat > I Know You Rider, Far From Me, Woman Smarter > He's Gone > Drumz > Wheel > Miracle > Black Peter > Around > Good Lovin</td></tr>
<tr><td>E: Touch</td></tr>
</table></div>
<div class="setlist_table"><table border="0" cellspacing="0" cellpadding="0"><tr class="header"><td><span><a name="0613"></a><a href="/1987-06-13">6/13/1987 County Fairgrounds, Ventura, CA</a></span> [<a href="http://www.archive.org/search.php?query=creator:%22Grateful Dead%22%20date:1987-06-13*">Listen/Download</a>]<tr><td>I: Half Step > Walking Blues, Row Jimmy, Masterpiece, Push, Cassidy, FOTD, Let It Grow</td></tr>
<tr><td>II: Shakedown, Saint, Ship Of Fools, Estimated > Eyes > Drumz > Other One > Morning Dew > Sugar Magnolia</td></tr>
<tr><td>E: Black Muddy River</td></tr>
<tr class="notes"><td>First ''Masterpiece''</i></td></tr>
</table></div>
<div class="setlist_table"><table border="0" cellspacing="0" cellpadding="0"><tr class="header"><td><span><a name="0614"></a><a href="/1987-06-14">6/14/1987 County Fairgrounds, Ventura, CA</a></span> [<a href="http://www.archive.org/search.php?query=creator:%22Grateful Dead%22%20date:1987-06-14*">Listen/Download</a>]<tr><td>I: Bucket > Sugaree, Tons Of Steel, Ramble On, Me  and  My Uncle > Mexicali, Althea, Stranger > Might As Well</td></tr>
<tr><td>II: Scarlet > Fire, Playin > Terrapin > Drumz > Truckin > Wharf Rat > Throwing Stones > NFA</td></tr>
<tr><td>E: Mighty Quinn</td></tr>
</table></div>
<div class="setlist_table"><table border="0" cellspacing="0" cellpadding="0"><tr class="header"><td><span><a name="0619"></a><a href="/1987-06-19">6/19/1987 Greek Theatre, U. of California, Berkeley, CA</a></span> [<a href="http://www.archive.org/search.php?query=creator:%22Grateful Dead%22%20date:1987-06-19*">Listen/Download</a>]<tr><td>I: Touch, Rooster, Cold Rain, Mama Tried > Big River, B. E. Women, Desolation Row, Push, Music</td></tr>
<tr><td>II: Bertha > Greatest, Roses, Samson > Terrapin > Drumz > Miracle > GDTRFB > Stella Blue > Lovelight</td></tr>
<tr><td>E: Black Muddy River</td></tr>
</table></div>
<div class="setlist_table"><table border="0" cellspacing="0" cellpadding="0"><tr class="header"><td><span><a name="0620"></a><a href="/1987-06-20">6/20/1987 Greek Theatre, U. of California, Berkeley, CA</a></span> [<a href="http://www.archive.org/search.php?query=creator:%22Grateful Dead%22%20date:1987-06-20*">Listen/Download</a>]<tr><td>I: Bucket > Franklin's, Minglewood, Loser, Esau, Bird Song</td></tr>
<tr><td>II: Space > Iko Iko, L. L. Rain > Deal > Drumz > Gimme Some Lovin > Watchtower > Wheel > Other One > Wharf Rat > Sugar Magnolia</td></tr>
<tr><td>E: Saturday Night</td></tr>
<tr class="notes"><td>First ''Watchtower''</i></td></tr>
<tr class="notes"><td>FM broadcast KFOG-San Francisco.</i></td></tr>
</table></div>
<div class="setlist_table"><table border="0" cellspacing="0" cellpadding="0"><tr class="header"><td><span><a name="0621"></a><a href="/1987-06-21">6/21/1987 Greek Theatre, U. of California, Berkeley, CA</a></span> [<a href="http://www.archive.org/search.php?query=creator:%22Grateful Dead%22%20date:1987-06-21*">Listen/Download</a>]<tr><td>I: Alabama > Promised, West L. A., Walking Blues, Far From Me, Cumberland > Mexicali, Box Of Rain, Don't Ease</td></tr>
<tr><td>II: Woman Smarter > Crazy Fingers > Saint > China Doll > Playin > Drumz > Masterpiece > Black Peter > Throwing Stones > NFA</td></tr>
<tr><td>E: Brokedown</td></tr>
<tr class="notes"><td>Next ''Alabama'' 3/16/1988 [55 shows]</i></td></tr>
<tr class="notes"><td>afternoon concert (3:00 PM))*</i></td></tr>
</table></div>
<div class="setlist_table"><table border="0" cellspacing="0" cellpadding="0"><tr class="header"><td><span><a name="0626"></a><a href="/1987-06-26">6/26/1987 Alpine Valley Music Theatre, East Troy, WI</a></span> [<a href="http://www.archive.org/search.php?query=creator:%22Grateful Dead%22%20date:1987-06-26*">Listen/Download</a>]<tr><td>I: Stranger > Franklin's, Walking Blues, Row Jimmy, Tons Of Steel, Push, Cassidy, Deal</td></tr>
<tr><td>II: China Cat > I Know You Rider, Estimated > Eyes > Drumz > Gimme Some Lovin > Wheel > Watchtower > Black Peter > Around > Sugar Magnolia</td></tr>
<tr><td>E: Touch</td></tr>
</table></div>
<div class="setlist_table"><table border="0" cellspacing="0" cellpadding="0"><tr class="header"><td><span><a name="0627"></a><a href="/1987-06-27">6/27/1987 Alpine Valley Music Theatre, East Troy, WI</a></span> [<a href="http://www.archive.org/search.php?query=creator:%22Grateful Dead%22%20date:1987-06-27*">Listen/Download</a>]<tr><td>I: Iko Iko, Greatest, Stagger Lee, Minglewood, FOTD, Tom Thumb Blues, West L. A., Esau, Tennessee Jed, Let It Grow</td></tr>
<tr><td>II: Uncle John > Playin > Terrapin > Drumz > Truckin > Other One > Wharf Rat > Lovelight</td></tr>
<tr><td>E: Black Muddy River</td></tr>
</table></div>
<div class="setlist_table"><table border="0" cellspacing="0" cellpadding="0"><tr class="header"><td><span><a name="0628"></a><a href="/1987-06-28">6/28/1987 Alpine Valley Music Theatre, East Troy, WI</a></span> [<a href="http://www.archive.org/search.php?query=creator:%22Grateful Dead%22%20date:1987-06-28*">Listen/Download</a>]<tr><td>I: Bucket > Sugaree, Me  and  My Uncle > Mexicali, Althea, Rooster, Bird Song, Jack Straw</td></tr>
<tr><td>II: Half Step, Woman Smarter, Ship Of Fools, Saint > Drumz > Miracle > Morning Dew > Throwing Stones > NFA</td></tr>
<tr><td>E: NFA > Mighty Quinn</td></tr>
</table></div>
<div class="setlist_table"><table border="0" cellspacing="0" cellpadding="0"><tr class="header"><td><span><a name="0630"></a><a href="/1987-06-30">6/30/1987 Kingswood Music Theatre, Maple, Ontario, Canada</a></span> [<a href="http://www.archive.org/search.php?query=creator:%22Grateful Dead%22%20date:1987-06-30*">Listen/Download</a>]<tr><td>I: Touch, Greatest, Loser, Minglewood, Candyman, Far From Me, Mama Tried > Big River, Ramble On, Masterpiece, Don't Ease</td></tr>
<tr><td>II: Scarlet > Fire, Estimated > Eyes > Jam > Drumz > Spanish Jam > Other One > China Doll > Mr. Fantasy > Around > Good Lovin</td></tr>
<tr><td>E: Box Of Rain</td></tr>
</table></div>
<div class="setlist_table"><table border="0" cellspacing="0" cellpadding="0"><tr class="header"><td><span><a name="0702"></a><a href="/1987-07-02">7/2/1987 Silver Stadium, Rochester, NY</a></span> [<a href="http://www.archive.org/search.php?query=creator:%22Grateful Dead%22%20date:1987-07-02*">Listen/Download</a>]<tr><td>I: Bucket > Bertha, Walking Blues, Dire Wolf, Esau, Push, Tons Of Steel, Me  and  My Uncle > Mexicali, B. E. Women, Cassidy, Deal</td></tr>
<tr><td>II: China Cat > I Know You Rider > Samson, L. L. Rain > He's Gone > Drumz > GDTRFB > Watchtower > Stella Blue > Sugar Magnolia</td></tr>
<tr><td>E: Black Muddy River</td></tr>
<tr class="notes"><td>"Take A Step Back" before "Esau." "Mexican Hat Dance" tuning before "China Cat."</i></td></tr>
</table></div>
<div class="setlist_table"><table border="0" cellspacing="0" cellpadding="0"><tr class="header"><td><span><a name="0704"></a><a href="/1987-07-04">7/4/1987 Schaefer Stadium, Foxboro, MA</a></span> [<a href="http://www.archive.org/search.php?query=creator:%22Grateful Dead%22%20date:1987-07-04*">Listen/Download</a>]<tr><td>I: Touch, Bucket, West L. A., Tons Of Steel, Rooster, Box Of Rain, Althea, Uncle John > Playin > Drumz > Truckin > Other One > Wharf Rat > Throwing Stones <span class="setlist_small">%</span></td></tr>
<tr><td>II: Times A Changin, Man of Peace, Baby Tonight <span class="setlist_small">*</span>, John Brown, I Want You, Thin Man, Memphis Blues, Queen Jane, Chimes Of Freedom, Slow Train <span class="setlist_small">#</span>, Joey <span class="setlist_small">#</span>, Watchtower</td></tr>
<tr><td>E: Heaven's Door<span class="setlist_small">+</span></td></tr>
<tr class="notes"><td>First ''Heaven's Door''</i></td></tr>
<tr class="notes"><td> Soundcheck: Times A Changin - Weir, Serve Somebody - Garcia - Memphis Blues - Dylan, Baby Tonight -Weir, Heaven's Door - Dylan  and  Garcia. *Garcia on pedal steel.  +Bob Dylan. #appears on "Dylan and the Dead." %appears as an "In the Dark" bonus track in "Beyond Description (1973-1989)."   </i></td></tr>
</table></div>
<div class="setlist_table"><table border="0" cellspacing="0" cellpadding="0"><tr class="header"><td><span><a name="0706"></a><a href="/1987-07-06">7/6/1987 Pittsburgh Civic Arena, Pittsburgh, PA</a></span> [<a href="http://www.archive.org/search.php?query=creator:%22Grateful Dead%22%20date:1987-07-06*">Listen/Download</a>]<tr><td>I: Stranger > Franklin's, Minglewood, Row Jimmy, Mama Tried > Big River, Far From Me, Stagger Lee, Desolation Row, Don't Ease</td></tr>
<tr><td>II: Shakedown, Samson, Iko Iko<span class="setlist_small">*</span> > Day-O<span class="setlist_small">*</span> > Woman Smarter<span class="setlist_small">*</span> > Drumz > Heaven's Door<span class="setlist_small">*</span> > Good Lovin<span class="setlist_small">*</span></td></tr>
<tr><td>E: Johnny B. Goode<span class="setlist_small">*</span></td></tr>
<tr class="notes"><td>First ''Day-O''; Next ''Johnny B. Goode'' 4/4/1988 [59 shows]</i></td></tr>
<tr class="notes"><td>*with members of the Neville Brothers.</i></td></tr>
</table></div>
<div class="setlist_table"><table border="0" cellspacing="0" cellpadding="0"><tr class="header"><td><span><a name="0707"></a><a href="/1987-07-07">7/7/1987 Roanoke Civic Center, Roanoke, VA</a></span> [<a href="http://www.archive.org/search.php?query=creator:%22Grateful Dead%22%20date:1987-07-07*">Listen/Download</a>]<tr><td>I: Half Step > Walking Blues, Candyman, Esau, Push, Me  and  My Uncle > Mexicali, Bird Song, Promised</td></tr>
<tr><td>II: West L. A., Cumberland, L. L. Rain > Eyes > Drumz > Wheel > Gimme Some Lovin > Morning Dew > Lovelight</td></tr>
<tr><td>E: U. S. Blues</td></tr>
<tr class="notes"><td>"Funiculi Funicula" tuning before "Half Step."</i></td></tr>
</table></div>
<div class="setlist_table"><table border="0" cellspacing="0" cellpadding="0"><tr class="header"><td><span><a name="0708"></a><a href="/1987-07-08">7/8/1987 Roanoke Civic Center, Roanoke, VA</a></span> [<a href="http://www.archive.org/search.php?query=creator:%22Grateful Dead%22%20date:1987-07-08*">Listen/Download</a>]<tr><td>I: Bucket > Sugaree, All Over Now, Dupree's, Good Times > Masterpiece, Big RxR Blues > Let It Grow</td></tr>
<tr><td>II: Scarlet > Fire, Estimated > He's Gone > Drumz > Crazy Fingers > Truckin > Comes A Time > Sugar Magnolia</td></tr>
<tr><td>E: Black Muddy River</td></tr>
<tr class="notes"><td>Next ''Comes A Time'' 12/27/1990 [265 shows]</i></td></tr>
</table></div>
<div class="setlist_table"><table border="0" cellspacing="0" cellpadding="0"><tr class="header"><td><span><a name="0710"></a><a href="/1987-07-10">7/10/1987 John F. Kennedy Stadium, Philadelphia, PA</a></span> [<a href="http://www.archive.org/search.php?query=creator:%22Grateful Dead%22%20date:1987-07-10*">Listen/Download</a>]<tr><td>I: Iko Iko, Jack Straw, Sugaree, Minglewood, Althea, Esau, Push, Cassidy, China Cat > I Know You Rider, L. L. Rain, Terrapin > Drumz > Miracle > Black Peter > Around > Saturday Night</td></tr>
<tr><td>II: Tangled Up, Baby Tonight <span class="setlist_small">*</span>, Man Of Peace, Judas Priest, John Brown, Simple Twist, Thin Man, Memphis Blues, Chimes Of Freedom, Queen Jane, Serve Somebody, Joey, Watchtower</td></tr>
<tr><td>E: Touch</td></tr>
<tr class="notes"><td>*Garcia on pedal steel. "Queen Jane" is only a fragment. </i></td></tr>
</table></div>
<div class="setlist_table"><table border="0" cellspacing="0" cellpadding="0"><tr class="header"><td><span><a name="0711"></a><a href="/1987-07-11">7/11/1987 Greek Theatre, U. of California, Berkeley, CA</a></span> [<a href="http://www.archive.org/search.php?query=creator:%22Grateful Dead%22%20date:1987-07-11*">Listen/Download</a>]<tr><td></td></tr>
<tr class="notes"><td>The 1987 Greek shows took place on June 19, 20 & 21 instead.</i></td></tr>
</table></div>
<div class="setlist_table"><table border="0" cellspacing="0" cellpadding="0"><tr class="header"><td><span><a name="0712"></a><a href="/1987-07-12">7/12/1987 Giants Stadium, East Rutherford, NJ</a></span> [<a href="http://www.archive.org/search.php?query=creator:%22Grateful Dead%22%20date:1987-07-12*">Listen/Download</a>]<tr><td>I: Bucket > West L. A., Greatest, Loser, Tons Of Steel, Ramble On, Masterpiece, Push, Promised > Bertha</td></tr>
<tr><td>II: Morning Dew, Playin > Drumz > Other One > Stella Blue > Throwing Stones > NFA</td></tr>
<tr><td>III: Slow Train, Memphis Blues, Tomorrow Is A Long Time <span class="setlist_small">*</span>, Highway 61, Baby Blue, Thin Man, John Brown, Wicked Messenger, Queen Jane, Chimes Of Freedom, Joey, Watchtower, Times A Changin</td></tr>
<tr><td>E: Touch<span class="setlist_small">+</span> > Heaven's Door<span class="setlist_small">+</span></td></tr>
<tr class="notes"><td>"Addams Family" tuning before "Morning Dew." Only "Tomorrow Is A Long Time." Only "Wicked Messenger." *Garcia on pedal steel.  +with Bob Dylan. </i></td></tr>
</table></div>
<div class="setlist_table"><table border="0" cellspacing="0" cellpadding="0"><tr class="header"><td><span><a name="0712"></a><a href="/1987-07-12">7/12/1987 Greek Theatre, U. of California, Berkeley, CA</a></span> [<a href="http://www.archive.org/search.php?query=creator:%22Grateful Dead%22%20date:1987-07-12*">Listen/Download</a>]<tr><td></td></tr>
<tr class="notes"><td>The 1987 Greek shows took place on June 19, 20 & 21 instead.</i></td></tr>
</table></div>
<div class="setlist_table"><table border="0" cellspacing="0" cellpadding="0"><tr class="header"><td><span><a name="0713"></a><a href="/1987-07-13">7/13/1987 Greek Theatre, U. of California, Berkeley, CA</a></span> [<a href="http://www.archive.org/search.php?query=creator:%22Grateful Dead%22%20date:1987-07-13*">Listen/Download</a>]<tr><td></td></tr>
<tr class="notes"><td>The 1987 Greek shows took place on June 19, 20 & 21 instead.</i></td></tr>
</table></div>
<div class="setlist_table"><table border="0" cellspacing="0" cellpadding="0"><tr class="header"><td><span><a name="0719"></a><a href="/1987-07-19">7/19/1987 Autzen Stadium, U. of Oregon, Eugene, OR</a></span> [<a href="http://www.archive.org/search.php?query=creator:%22Grateful Dead%22%20date:1987-07-19*">Listen/Download</a>]<tr><td>I: Iko Iko, Stranger, Franklin's, Minglewood, Peggy-O, Masterpiece, West L. A., Let It Grow</td></tr>
<tr><td>II: Gimme Some Lovin > Playin > He's Gone > Spoonful > Drumz > Wheel > Truckin > Wharf Rat > Lovelight</td></tr>
<tr><td>III: Maggie's Farm, Dead Man, Watching The River Flow, Simple Twist, Judas Priest, Memphis Blues, Heart Of Mine, Baby Blue, Rainy Day Women, Queen Jane <span class="setlist_small">+</span>, Thin Man, Highway 61, Tangled Up</td></tr>
<tr><td>E: Touch<span class="setlist_small">*</span> > Watchtower<span class="setlist_small">*</span></td></tr>
<tr class="notes"><td>"Addams Family" tuning before "Masterpiece" - only "Heart Of Mine" *with Bob Dylan. +appears on "Dylan and the Dead."</i></td></tr>
</table></div>
<div class="setlist_table"><table border="0" cellspacing="0" cellpadding="0"><tr class="header"><td><span><a name="0724"></a><a href="/1987-07-24">7/24/1987 Oakland Coliseum Stadium, Oakland, CA</a></span> [<a href="http://www.archive.org/search.php?query=creator:%22Grateful Dead%22%20date:1987-07-24*">Listen/Download</a>]<tr><td>I: Jack Straw > Half Step, Esau, FOTD, Me  and  My Uncle > Big River, Push, Far From Me, Cassidy > Deal</td></tr>
<tr><td>II: Bucket > Scarlet, Playin > Drumz > Uncle John > Mr. Fantasy > Miracle > Bertha > Sugar Magnolia</td></tr>
<tr><td>III: Times A Changin, Man Of Peace, Maggie's Farm, Baby Tonight <span class="setlist_small">+</span>, I Want You <span class="setlist_small">#</span>, Highway 61, Baby Blue, Memphis Blues, Thin Man, Shelter From The Storm, Slow Train, Heaven's Door </td></tr>
<tr><td>E: Touch<span class="setlist_small">*</span> > Watchtower<span class="setlist_small">*</span></td></tr>
<tr class="notes"><td> "Funiculi Funicula"  and  "Tico Tico" tunings before "Jack Straw." Only "Shelter From The Storm." *with Bob Dylan. +Garcia on pedal steel. #appears on "Dylan and the Dead." The first and second sets except "FOTD" through "Big River" appear on the "View from the Vault IV" DVD, and the entire first and second sets appear on the "View From the Vault IV Soundtrack" on CD.  </i></td></tr>
</table></div>
<div class="setlist_table"><table border="0" cellspacing="0" cellpadding="0"><tr class="header"><td><span><a name="0726"></a><a href="/1987-07-26">7/26/1987 Anaheim Stadium, Anaheim, CA</a></span> [<a href="http://www.archive.org/search.php?query=creator:%22Grateful Dead%22%20date:1987-07-26*">Listen/Download</a>]<tr><td>I: Iko Iko, Minglewood, Tons Of Steel, West L. A., Masterpiece > Mexicali, Bird Song > Promised</td></tr>
<tr><td>II: Shakedown > L. L. Rain > Terrapin > Drumz > Other One > Stella Blue > Throwing Stones > NFA</td></tr>
<tr><td>III: Tambourine Man, Dead Man, Maggie's Farm, Simple Twist, Watching The River Flow, Baby Blue, Chimes Of Freedom, Queen Jane, Memphis Blues, Thin Man, Rainy Day Women, Serve Somebody <span class="setlist_small">+</span>, Watchtower <span class="setlist_small">+</span></td></tr>
<tr><td>E: Touch<span class="setlist_small">*</span> > Heaven's Door<span class="setlist_small">*+</span></td></tr>
<tr class="notes"><td> Only "Tambourine Man." *with Bob Dylan. +appears on "Dylan and the Dead." The first and second sets appear on the "View from the Vault IV" DVD and its accompanying CD soundtrack. </i></td></tr>
</table></div>
<div class="setlist_table"><table border="0" cellspacing="0" cellpadding="0"><tr class="header"><td><span><a name="0811"></a><a href="/1987-08-11">8/11/1987 Red Rocks Amphitheatre, Morrison, CO</a></span> [<a href="http://www.archive.org/search.php?query=creator:%22Grateful Dead%22%20date:1987-08-11*">Listen/Download</a>]<tr><td>I: Cold Rain > Rooster, Tons Of Steel, High Time, Masterpiece, Push, Let It Grow</td></tr>
<tr><td>II: Crazy Fingers > Samson, Ship Of Fools, Playin > China Doll > Drumz > Watchtower > GDTRFB > Around > Sugar Magnolia</td></tr>
<tr><td>E: Black Muddy River</td></tr>
<tr class="notes"><td>Previous ''High Time'' 5/3/1986 [71 shows]</i></td></tr>
<tr class="notes"><td>"Funiculi Funicula" tuning before "Masterpiece."</i></td></tr>
</table></div>
<div class="setlist_table"><table border="0" cellspacing="0" cellpadding="0"><tr class="header"><td><span><a name="0812"></a><a href="/1987-08-12">8/12/1987 Red Rocks Amphitheatre, Morrison, CO</a></span> [<a href="http://www.archive.org/search.php?query=creator:%22Grateful Dead%22%20date:1987-08-12*">Listen/Download</a>]<tr><td>I: Bucket > Sugaree, Good Times, Cumberland > Mexicali, FOTD, Esau, Bird Song > Music</td></tr>
<tr><td>II: China Cat > I Know You Rider, Woman Smarter > Terrapin > Drumz > Other One > Mr. Fantasy > Wharf Rat > Lovelight</td></tr>
<tr><td>E: Mighty Quinn</td></tr>
<tr class="notes"><td>Next ''Good Times'' 4/4/1988 [50 shows]</i></td></tr>
<tr class="notes"><td>"Camptown Races" tuning before "Good Times."</i></td></tr>
</table></div>
<div class="setlist_table"><table border="0" cellspacing="0" cellpadding="0"><tr class="header"><td><span><a name="0813"></a><a href="/1987-08-13">8/13/1987 Red Rocks Amphitheatre, Morrison, CO</a></span> [<a href="http://www.archive.org/search.php?query=creator:%22Grateful Dead%22%20date:1987-08-13*">Listen/Download</a>]<tr><td>I: Big Boss Man, Jack Straw, Row Jimmy, All Over Now, Loser, Cassidy, Far From Me, Box Of Rain</td></tr>
<tr><td>II: Uncle John > Estimated > He's Gone > Drumz > Wheel > Gimme Some Lovin > Stella Blue > Throwing Stones > NFA</td></tr>
<tr><td>E: NFA > Touch > Heaven's Door</td></tr>
<tr class="notes"><td>Previous ''Big Boss Man'' 4/8/1985 [148 shows]</i></td></tr>
</table></div>
<div class="setlist_table"><table border="0" cellspacing="0" cellpadding="0"><tr class="header"><td><span><a name="0815"></a><a href="/1987-08-15">8/15/1987 Town Park, Telluride, CO</a></span> [<a href="http://www.archive.org/search.php?query=creator:%22Grateful Dead%22%20date:1987-08-15*">Listen/Download</a>]<tr><td>I: Stranger > Franklin's, Minglewood, Candyman, Me  and  My Uncle > Big River, Tennessee Jed, Desolation Row > Deal</td></tr>
<tr><td>II: Scarlet > Fire > L. L. Rain, Eyes > Drumz > Miracle > Bertha > Morning Dew > Saturday Night</td></tr>
<tr><td>E: Baby Blue</td></tr>
<tr class="notes"><td>FM broadcast KOTO. Olatunji and the Drums of Passion opened.</i></td></tr>
</table></div>
<div class="setlist_table"><table border="0" cellspacing="0" cellpadding="0"><tr class="header"><td><span><a name="0816"></a><a href="/1987-08-16">8/16/1987 Town Park, Telluride, CO</a></span> [<a href="http://www.archive.org/search.php?query=creator:%22Grateful Dead%22%20date:1987-08-16*">Listen/Download</a>]<tr><td>I: Half Step > Rooster, Iko Iko, Far From Me, West L. A., Masterpiece > Big RxR Blues > Promised</td></tr>
<tr><td>II: Push > Samson, He's Gone > Drumz > Other One > Truckin > Black Peter > Good Lovin</td></tr>
<tr><td>E: Touch, Brokedown</td></tr>
<tr class="notes"><td>FM broadcast KOTO. Olatunji and the Drums of Passion opened. "Beer Barrel Polka" tuning before "Far From Me." Double start for "Brokedown." </i></td></tr>
</table></div>
<div class="setlist_table"><table border="0" cellspacing="0" cellpadding="0"><tr class="header"><td><span><a name="0818"></a><a href="/1987-08-18">8/18/1987 Compton Terrace Amphitheatre, Chandler, AZ</a></span> [<a href="http://www.archive.org/search.php?query=creator:%22Grateful Dead%22%20date:1987-08-18*">Listen/Download</a>]<tr><td>I: Bucket > Sugaree, Walking Blues, Ramble On, Esau, Peggy-O, Greatest > Bertha</td></tr>
<tr><td>II: Crazy Fingers > Playin > Terrapin > Drumz > Mr. Fantasy > Wharf Rat > Throwing Stones > Lovelight</td></tr>
<tr><td>E: Black Muddy River</td></tr>
<tr class="notes"><td>New location for venue at Firebird Lake, Gila River Indian Reservation.</i></td></tr>
</table></div>
<div class="setlist_table"><table border="0" cellspacing="0" cellpadding="0"><tr class="header"><td><span><a name="0820"></a><a href="/1987-08-20">8/20/1987 Park West Ski Resort, Park West, UT</a></span> [<a href="http://www.archive.org/search.php?query=creator:%22Grateful Dead%22%20date:1987-08-20*">Listen/Download</a>]<tr><td>I: Big Boss Man > Promised, Dire Wolf, Minglewood, Row Jimmy, All Over Now, Loser, Cassidy, Push</td></tr>
<tr><td>II: China Cat > I Know You Rider, Woman Smarter, Ship Of Fools, Truckin > Smokestack > Drumz > Wheel > Gimme Some Lovin > Watchtower > Stella Blue > Sugar Magnolia</td></tr>
<tr><td>E: Mighty Quinn</td></tr>
<tr class="notes"><td>Previous ''Smokestack'' 12/27/1986 [59 shows]</i></td></tr>
<tr class="notes"><td>"Addams Family" tuning before "Big Boss Man."</i></td></tr>
</table></div>
<div class="setlist_table"><table border="0" cellspacing="0" cellpadding="0"><tr class="header"><td><span><a name="0822"></a><a href="/1987-08-22">8/22/1987 Calaveras County Fairgrounds, Angel's Camp, CA</a></span> [<a href="http://www.archive.org/search.php?query=creator:%22Grateful Dead%22%20date:1987-08-22*">Listen/Download</a>]<tr><td>I: Touch > Rooster, Tons Of Steel, FOTD, Esau, Tennessee Jed, Masterpiece, Bird Song, Schoolgirl<span class="setlist_small">*</span>, Midnight Hour<span class="setlist_small">*</span></td></tr>
<tr><td>II: Bucket, Push, Estimated > Eyes > Drumz > Other One > GDTRFB > Throwing Stones > Lovelight</td></tr>
<tr><td>E: U. S. Blues</td></tr>
<tr class="notes"><td>Next ''Schoolgirl'' 6/25/1992 [374 shows]</i></td></tr>
<tr class="notes"><td>"Mountain Aire Music Festival." David Lindley  and  El Rayo-X, then Santana opened. *with Carlos Santana.</i></td></tr>
</table></div>
<div class="setlist_table"><table border="0" cellspacing="0" cellpadding="0"><tr class="header"><td><span><a name="0823"></a><a href="/1987-08-23">8/23/1987 Calaveras County Fairgrounds, Angel's Camp, CA</a></span> [<a href="http://www.archive.org/search.php?query=creator:%22Grateful Dead%22%20date:1987-08-23*">Listen/Download</a>]<tr><td>I: Box Of Rain > Jack Straw, West L. A., Me  and  My Uncle > Mexicali, High Time, Walking Blues, Iko Iko<span class="setlist_small">*</span>, Watchtower<span class="setlist_small">*</span></td></tr>
<tr><td>II: Scarlet > Fire, Playin > Drumz > Miracle > Mr. Fantasy > Playin > Morning Dew</td></tr>
<tr><td>E: NFA > Brokedown</td></tr>
<tr class="notes"><td>"Mountain Aire Music Festival." David Lindley  and  El Rayo-X, then Santana opened. *with Carlos Santana. </i></td></tr>
</table></div>
<div class="setlist_table"><table border="0" cellspacing="0" cellpadding="0"><tr class="header"><td><span><a name="0907"></a><a href="/1987-09-07">9/7/1987 Providence Civic Center, Providence, RI</a></span> [<a href="http://www.archive.org/search.php?query=creator:%22Grateful Dead%22%20date:1987-09-07*">Listen/Download</a>]<tr><td>I: Stranger > Franklin's, Walking Blues, Push, Esau, Roses, Far From Me, Let It Grow</td></tr>
<tr><td>II: Iko Iko, Saint, Ship Of Fools, Uncle John > Playin Jam > Drumz > Truckin > Spoonful > Black Peter > Around > Good Lovin > La Bamba > Good Lovin</td></tr>
<tr><td>E: Heaven's Door</td></tr>
<tr class="notes"><td>First ''La Bamba''; Next ''Spoonful'' 4/12/1989 [124 shows]</i></td></tr>
</table></div>
<div class="setlist_table"><table border="0" cellspacing="0" cellpadding="0"><tr class="header"><td><span><a name="0908"></a><a href="/1987-09-08">9/8/1987 Providence Civic Center, Providence, RI</a></span> [<a href="http://www.archive.org/search.php?query=creator:%22Grateful Dead%22%20date:1987-09-08*">Listen/Download</a>]<tr><td>I: Half Step > Rooster, TLEO, Queen Jane, Row Jimmy, Music > Don't Ease</td></tr>
<tr><td>II: Bucket > Fire, L. L. Rain > Terrapin > Drumz > Other One > Stella Blue > Lovelight</td></tr>
<tr><td>E: Black Muddy River</td></tr>
<tr class="notes"><td>First ''Queen Jane''; Previous ''TLEO'' 7/2/1986 [70 shows]</i></td></tr>
</table></div>
<div class="setlist_table"><table border="0" cellspacing="0" cellpadding="0"><tr class="header"><td><span><a name="0909"></a><a href="/1987-09-09">9/9/1987 Providence Civic Center, Providence, RI</a></span> [<a href="http://www.archive.org/search.php?query=creator:%22Grateful Dead%22%20date:1987-09-09*">Listen/Download</a>]<tr><td>I: Hey Pocky Way, Jack Straw > West L. A., Masterpiece, FOTD, Cassidy, Althea, Greatest > Blue Dress > Good Golly > Blue Dress</td></tr>
<tr><td>II: China Cat > I Know You Rider > Playin > China Doll > Drumz > Wheel > Gimme Some Lovin > Throwing Stones > NFA</td></tr>
<tr><td>E: NFA, Mighty Quinn</td></tr>
<tr class="notes"><td>First ''Blue Dress''; First ''Good Golly''; First ''Hey Pocky Way''; Next ''China Doll'' 9/19/1988 [85 shows]</i></td></tr>
</table></div>
<div class="setlist_table"><table border="0" cellspacing="0" cellpadding="0"><tr class="header"><td><span><a name="0911"></a><a href="/1987-09-11">9/11/1987 Capital Centre, Landover, MD</a></span> [<a href="http://www.archive.org/search.php?query=creator:%22Grateful Dead%22%20date:1987-09-11*">Listen/Download</a>]<tr><td>I: Bertha > Promised, Candyman, Minglewood, Push, Tons Of Steel, Desolation Row, Deal</td></tr>
<tr><td>II: Sugar Magnolia > Sugaree, Estimated > Eyes > Drumz > GDTRFB > Mr. Fantasy > Watchtower > Wharf Rat > Sunshine Daydream</td></tr>
<tr><td>E: Touch</td></tr>
<tr class="notes"><td>Mickey Hart's 44th birthday.</i></td></tr>
</table></div>
<div class="setlist_table"><table border="0" cellspacing="0" cellpadding="0"><tr class="header"><td><span><a name="0912"></a><a href="/1987-09-12">9/12/1987 Capital Centre, Landover, MD</a></span> [<a href="http://www.archive.org/search.php?query=creator:%22Grateful Dead%22%20date:1987-09-12*">Listen/Download</a>]<tr><td>I: Bucket, Loser, Me  and  My Uncle > Big River, Ramble On, Tom Thumb Blues, Hey Pocky Way, Cassidy, Might As Well</td></tr>
<tr><td>II: Cumberland > Samson, Ship Of Fools, Woman Smarter > Drumz > Truckin > Miracle > Morning Dew > Lovelight</td></tr>
<tr><td>E: Saturday Night > Black Muddy River</td></tr>
</table></div>
<div class="setlist_table"><table border="0" cellspacing="0" cellpadding="0"><tr class="header"><td><span><a name="0913"></a><a href="/1987-09-13">9/13/1987 Capital Centre, Landover, MD</a></span> [<a href="http://www.archive.org/search.php?query=creator:%22Grateful Dead%22%20date:1987-09-13*">Listen/Download</a>]<tr><td>I: Iko Iko, Rooster, B. E. Women, Fever, Stagger Lee, Masterpiece, Bird Song, Promised</td></tr>
<tr><td>II: Scarlet > Fire, Playin > Drumz > Other One > Stella Blue > Throwing Stones > Good Lovin > La Bamba > Good Lovin</td></tr>
<tr><td>E: Heaven's Door</td></tr>
<tr class="notes"><td>Only ''Fever''</i></td></tr>
<tr class="notes"><td>Only "Fever."</i></td></tr>
</table></div>
<div class="setlist_table"><table border="0" cellspacing="0" cellpadding="0"><tr class="header"><td><span><a name="0915"></a><a href="/1987-09-15">9/15/1987 Madison Square Garden, New York, NY</a></span> [<a href="http://www.archive.org/search.php?query=creator:%22Grateful Dead%22%20date:1987-09-15*">Listen/Download</a>]<tr><td>I: Hey Pocky Way, Minglewood, Push, Me  and  My Uncle > Mexicali, Row Jimmy, Queen Jane, Tennessee Jed, Music</td></tr>
<tr><td>II: China Cat > I Know You Rider, Estimated > Eyes > Drumz > Wheel > Gimme Some Lovin > Black Peter > Sugar Magnolia</td></tr>
<tr><td>E: Baby Blue</td></tr>
<tr class="notes"><td>"Beer Barrel Polka" tuning before "Me  and  My Uncle." "Watchtower" tease between "Gimme Some Lovin" and "Black Peter."</i></td></tr>
</table></div>
<div class="setlist_table"><table border="0" cellspacing="0" cellpadding="0"><tr class="header"><td><span><a name="0916"></a><a href="/1987-09-16">9/16/1987 Madison Square Garden, New York, NY</a></span> [<a href="http://www.archive.org/search.php?query=creator:%22Grateful Dead%22%20date:1987-09-16*">Listen/Download</a>]<tr><td>I: Touch > Scarlet, Rooster, Dire Wolf, Esau, High Time > Let It Grow > Don't Ease</td></tr>
<tr><td>II: Bertha > Greatest > Blue Dress > Good Golly > Blue Dress > He's Gone > Drumz > Truckin > Wharf Rat > Throwing Stones > NFA</td></tr>
<tr><td>E: Black Muddy River</td></tr>
<tr class="notes"><td>New York City Percussion Ensemble opened. Encore began with "GDTRFB" closing. </i></td></tr>
</table></div>
<div class="setlist_table"><table border="0" cellspacing="0" cellpadding="0"><tr class="header"><td><span><a name="0917"></a><a href="/1987-09-17">9/17/1987 NBC Studios, New York, NY</a></span> [<a href="http://www.archive.org/search.php?query=creator:%22Grateful Dead%22%20date:1987-09-17*">Listen/Download</a>]<tr><td>Masterpiece</td></tr>
<tr class="notes"><td>"Late Night with David Letterman" TV broadcast. Garcia & Weir with the Late Night Band. </i></td></tr>
</table></div>
<div class="setlist_table"><table border="0" cellspacing="0" cellpadding="0"><tr class="header"><td><span><a name="0918"></a><a href="/1987-09-18">9/18/1987 Madison Square Garden, New York, NY</a></span> [<a href="http://www.archive.org/search.php?query=creator:%22Grateful Dead%22%20date:1987-09-18*">Listen/Download</a>]<tr><td>I: Bucket > Sugaree, Walking Blues, Candyman, Masterpiece, Bird Song</td></tr>
<tr><td>II: Shakedown > Woman Smarter > Terrapin > Drumz > GDTRFB > Watchtower > Morning Dew > Good Lovin > La Bamba > Good Lovin</td></tr>
<tr><td>E: Heaven's Door</td></tr>
</table></div>
<div class="setlist_table"><table border="0" cellspacing="0" cellpadding="0"><tr class="header"><td><span><a name="0919"></a><a href="/1987-09-19">9/19/1987 Madison Square Garden, New York, NY</a></span> [<a href="http://www.archive.org/search.php?query=creator:%22Grateful Dead%22%20date:1987-09-19*">Listen/Download</a>]<tr><td>I: Half Step > All Over Now, High Time, Mexicali > Big River, Push, Box Of Rain > Don't Ease</td></tr>
<tr><td>II: Crazy Fingers > Uncle John > Playin > Drumz > Miracle<span class="setlist_small">*</span> > Maggie's Farm<span class="setlist_small">*</span> > Black Peter<span class="setlist_small">*</span> > Around > Lovelight</td></tr>
<tr><td>E: Black Muddy River</td></tr>
<tr class="notes"><td>First ''Maggie's Farm''</i></td></tr>
<tr class="notes"><td>*TV broadcast for Farm Aid III.</i></td></tr>
</table></div>
<div class="setlist_table"><table border="0" cellspacing="0" cellpadding="0"><tr class="header"><td><span><a name="0920"></a><a href="/1987-09-20">9/20/1987 Madison Square Garden, New York, NY</a></span> [<a href="http://www.archive.org/search.php?query=creator:%22Grateful Dead%22%20date:1987-09-20*">Listen/Download</a>]<tr><td>I: Jack Straw > West L. A., Esau, Far From Me, Roses, Desolation Row, Might As Well > Promised</td></tr>
<tr><td>II: Bucket > Iko Iko > L. L. Rain > He's Gone > Drumz > Other One > Wharf Rat > Throwing Stones > NFA</td></tr>
<tr><td>E: Touch > Brokedown</td></tr>
<tr class="notes"><td>"Funiculi Funicula"  and  "Addams Family" tunings before "Jack Straw."</i></td></tr>
</table></div>
<div class="setlist_table"><table border="0" cellspacing="0" cellpadding="0"><tr class="header"><td><span><a name="0922"></a><a href="/1987-09-22">9/22/1987 The Spectrum, Philadelphia, PA</a></span> [<a href="http://www.archive.org/search.php?query=creator:%22Grateful Dead%22%20date:1987-09-22*">Listen/Download</a>]<tr><td>I: Hey Pocky Way, Althea, Rooster, Push, Masterpiece, Ramble On, Cassidy > Deal</td></tr>
<tr><td>II: Gimme Some Lovin<span class="setlist_small">*</span>, China Cat > I Know You Rider > Samson > Terrapin > Drumz > Two Soldiers Jam > Wheel > Truckin > Stella Blue > Sugar Magnolia</td></tr>
<tr><td>E: Baby Blue</td></tr>
<tr class="notes"><td>"Addams Family" tuning before "Cassidy." *with Spencer Davis.</i></td></tr>
</table></div>
<div class="setlist_table"><table border="0" cellspacing="0" cellpadding="0"><tr class="header"><td><span><a name="0923"></a><a href="/1987-09-23">9/23/1987 The Spectrum, Philadelphia, PA</a></span> [<a href="http://www.archive.org/search.php?query=creator:%22Grateful Dead%22%20date:1987-09-23*">Listen/Download</a>]<tr><td>I: Stranger > Franklin's, Walking Blues, FOTD, Tons Of Steel, Desolation Row, Big RxR Blues > Music</td></tr>
<tr><td>II: Bertha > Cumberland > Playin > Uncle John > Playin Jam > Drumz > Miracle > Mr. Fantasy > Around > Good Lovin > La Bamba > Good Lovin</td></tr>
<tr><td>E: U. S. Blues</td></tr>
<tr class="notes"><td>Final ''La Bamba''; Final ''Tons Of Steel''</i></td></tr>
</table></div>
<div class="setlist_table"><table border="0" cellspacing="0" cellpadding="0"><tr class="header"><td><span><a name="0924"></a><a href="/1987-09-24">9/24/1987 The Spectrum, Philadelphia, PA</a></span> [<a href="http://www.archive.org/search.php?query=creator:%22Grateful Dead%22%20date:1987-09-24*">Listen/Download</a>]<tr><td>I: Touch > Minglewood, High Time, Me  and  My Uncle > Big River, Big Boss Man, Esau, Bird Song > Promised</td></tr>
<tr><td>II: Box Of Rain > Iko Iko, Bucket > Fire > Drumz > Other One > Black Peter > Throwing Stones > Lovelight</td></tr>
<tr><td>E: Heaven's Door</td></tr>
<tr class="notes"><td>"Mexicali" fake before "Big River."</i></td></tr>
</table></div>
<div class="setlist_table"><table border="0" cellspacing="0" cellpadding="0"><tr class="header"><td><span><a name="1002"></a><a href="/1987-10-02">10/2/1987 Shoreline Amphitheatre, Mountain View, CA</a></span> [<a href="http://www.archive.org/search.php?query=creator:%22Grateful Dead%22%20date:1987-10-02*">Listen/Download</a>]<tr><td>I: Cold Rain, Rooster, Stagger Lee, Me  and  My Uncle > Mexicali, Row Jimmy, Far From Me, Let It Grow</td></tr>
<tr><td>II: China Cat > I Know You Rider > Woman Smarter, Ship Of Fools, Truckin > Drumz > Wheel > Gimme Some Lovin > Watchtower, Don't Ease</td></tr>
<tr><td>E: Black Muddy River</td></tr>
</table></div>
<div class="setlist_table"><table border="0" cellspacing="0" cellpadding="0"><tr class="header"><td><span><a name="1003"></a><a href="/1987-10-03">10/3/1987 Shoreline Amphitheatre, Mountain View, CA</a></span> [<a href="http://www.archive.org/search.php?query=creator:%22Grateful Dead%22%20date:1987-10-03*">Listen/Download</a>]<tr><td>I: Hey Pocky Way <span class="setlist_small">*</span>, Minglewood <span class="setlist_small">*</span>, Candyman <span class="setlist_small">*</span>, Masterpiece <span class="setlist_small">*</span>, West L. A. <span class="setlist_small">*</span>, Esau <span class="setlist_small">*</span>, Bird Song, Music</td></tr>
<tr><td>II: Maggie's Farm <span class="setlist_small">+</span> > Cumberland > L. L. Rain > Terrapin > Drumz > Other One > Stella Blue > Throwing Stones > Lovelight</td></tr>
<tr><td>E: Mighty Quinn</td></tr>
<tr class="notes"><td>Final ''Esau''</i></td></tr>
<tr class="notes"><td>"Addams Family" tuning before "Masterpiece." *appears in the "View From the Vault III" DVD and its accompanying soundtrack CD. +appears on "Postcards from the Hanging."</i></td></tr>
</table></div>
<div class="setlist_table"><table border="0" cellspacing="0" cellpadding="0"><tr class="header"><td><span><a name="1004"></a><a href="/1987-10-04">10/4/1987 Shoreline Amphitheatre, Mountain View, CA</a></span> [<a href="http://www.archive.org/search.php?query=creator:%22Grateful Dead%22%20date:1987-10-04*">Listen/Download</a>]<tr><td>I: Jack Straw, Push, Walking Blues, High Time, Desolation Row, Iko Iko</td></tr>
<tr><td>II: Bucket, Blue Dress > Good Golly > Blue Dress > Estimated > Eyes > Drumz > Miracle > Mr. Fantasy > Wharf Rat > NFA</td></tr>
<tr><td>E: Touch, Brokedown</td></tr>
<tr class="notes"><td>Next ''High Time'' 12/9/1988 [85 shows]; Final ''Blue Dress''; Final ''Good Golly''</i></td></tr>
</table></div>
<div class="setlist_table"><table border="0" cellspacing="0" cellpadding="0"><tr class="header"><td><span><a name="1106"></a><a href="/1987-11-06">11/6/1987 Henry J. Kaiser Convention Center, Oakland, CA</a></span> [<a href="http://www.archive.org/search.php?query=creator:%22Grateful Dead%22%20date:1987-11-06*">Listen/Download</a>]<tr><td>I: Big Boss Man, Stranger, Roses, Minglewood, Push, Me  and  My Uncle > Cumberland, Let It Grow</td></tr>
<tr><td>II: Scarlet > Bucket, He's Gone > Drumz > Wheel > Gimme Some Lovin > Morning Dew > Watchtower</td></tr>
<tr><td>E: Black Muddy River</td></tr>
<tr class="notes"><td>Rex Foundation benefit.</i></td></tr>
</table></div>
<div class="setlist_table"><table border="0" cellspacing="0" cellpadding="0"><tr class="header"><td><span><a name="1107"></a><a href="/1987-11-07">11/7/1987 Henry J. Kaiser Convention Center, Oakland, CA</a></span> [<a href="http://www.archive.org/search.php?query=creator:%22Grateful Dead%22%20date:1987-11-07*">Listen/Download</a>]<tr><td>I: Hey Pocky Way > Jack Straw, Row Jimmy, Masterpiece, Dupree's, Box Of Rain, Cassidy > Might As Well</td></tr>
<tr><td>II: Uncle John > Playin > Terrapin > Drumz > Miracle > Black Peter > Throwing Stones > NFA</td></tr>
<tr><td>E1: NFA > Heaven's Door</td></tr>
<tr><td>E2: Saturday Night</td></tr>
<tr class="notes"><td>Next ''Dupree's'' 9/12/1988 [64 shows]</i></td></tr>
<tr class="notes"><td>Rex Foundation benefit.</i></td></tr>
</table></div>
<div class="setlist_table"><table border="0" cellspacing="0" cellpadding="0"><tr class="header"><td><span><a name="1108"></a><a href="/1987-11-08">11/8/1987 Henry J. Kaiser Convention Center, Oakland, CA</a></span> [<a href="http://www.archive.org/search.php?query=creator:%22Grateful Dead%22%20date:1987-11-08*">Listen/Download</a>]<tr><td>I: Iko Iko, Rooster, Stagger Lee, Mexicali > Big River, West L. A., Music > Don't Ease</td></tr>
<tr><td>II: China Cat > I Know You Rider, L. L. Rain, Crazy Fingers > Truckin > Drumz > Spanish Jam > Other One > Stella Blue > Lovelight</td></tr>
<tr><td>E: Tom Thumb Blues > Touch</td></tr>
<tr class="notes"><td>Next ''Tom Thumb Blues'' 9/22/1988 [70 shows]</i></td></tr>
<tr class="notes"><td>Rex Foundation benefit.</i></td></tr>
</table></div>
<div class="setlist_table"><table border="0" cellspacing="0" cellpadding="0"><tr class="header"><td><span><a name="1113"></a><a href="/1987-11-13">11/13/1987 Long Beach Arena, Long Beach, CA</a></span> [<a href="http://www.archive.org/search.php?query=creator:%22Grateful Dead%22%20date:1987-11-13*">Listen/Download</a>]<tr><td>I: Bucket > Sugaree, Minglewood, FOTD, Far From Me, Bird Song, Music</td></tr>
<tr><td>II: Bertha > Woman Smarter, Ship Of Fools, Estimated > Drumz > Wheel > Gimme Some Lovin > Wharf Rat > Sugar Magnolia</td></tr>
<tr><td>E: Heaven's Door</td></tr>
</table></div>
<div class="setlist_table"><table border="0" cellspacing="0" cellpadding="0"><tr class="header"><td><span><a name="1114"></a><a href="/1987-11-14">11/14/1987 Long Beach Arena, Long Beach, CA</a></span> [<a href="http://www.archive.org/search.php?query=creator:%22Grateful Dead%22%20date:1987-11-14*">Listen/Download</a>]<tr><td>I: Shakedown, Rooster, Althea, Masterpiece, Hey Pocky Way, Deal</td></tr>
<tr><td>II: Maggie's Farm > Cumberland, Playin > Terrapin > Drumz > Miracle > Stella Blue > Throwing Stones > Lovelight</td></tr>
<tr><td>E: Mighty Quinn</td></tr>
<tr class="notes"><td>Next ''Maggie's Farm'' 10/17/1990 [212 shows]</i></td></tr>
</table></div>
<div class="setlist_table"><table border="0" cellspacing="0" cellpadding="0"><tr class="header"><td><span><a name="1115"></a><a href="/1987-11-15">11/15/1987 Long Beach Arena, Long Beach, CA</a></span> [<a href="http://www.archive.org/search.php?query=creator:%22Grateful Dead%22%20date:1987-11-15*">Listen/Download</a>]<tr><td>I: Iko Iko, Walking Blues, Candyman, Me  and  My Uncle > Mexicali, West L. A., Cassidy, Don't Ease</td></tr>
<tr><td>II: Scarlet > Fire, L. L. Rain, He's Gone > Drumz > Other One > Morning Dew > Around > Watchtower</td></tr>
<tr><td>E: Black Muddy River</td></tr>
</table></div>
<div class="setlist_table"><table border="0" cellspacing="0" cellpadding="0"><tr class="header"><td><span><a name="1117"></a><a href="/1987-11-17">11/17/1987 Berkeley Community Theatre, Berkeley, CA</a></span> [<a href="http://www.archive.org/search.php?query=creator:%22Grateful Dead%22%20date:1987-11-17*">Listen/Download</a>]<tr><td></td></tr>
<tr class="notes"><td>These would have been Rex Foundation benefits.</i></td></tr>
</table></div>
<div class="setlist_table"><table border="0" cellspacing="0" cellpadding="0"><tr class="header"><td><span><a name="1118"></a><a href="/1987-11-18">11/18/1987 Berkeley Community Theatre, Berkeley, CA</a></span> [<a href="http://www.archive.org/search.php?query=creator:%22Grateful Dead%22%20date:1987-11-18*">Listen/Download</a>]<tr><td></td></tr>
<tr class="notes"><td>These would have been Rex Foundation benefits.</i></td></tr>
</table></div>
<div class="setlist_table"><table border="0" cellspacing="0" cellpadding="0"><tr class="header"><td><span><a name="1120"></a><a href="/1987-11-20">11/20/1987 Berkeley Community Theatre, Berkeley, CA</a></span> [<a href="http://www.archive.org/search.php?query=creator:%22Grateful Dead%22%20date:1987-11-20*">Listen/Download</a>]<tr><td></td></tr>
<tr class="notes"><td>These would have been Rex Foundation benefits.</i></td></tr>
</table></div>
<div class="setlist_table"><table border="0" cellspacing="0" cellpadding="0"><tr class="header"><td><span><a name="1121"></a><a href="/1987-11-21">11/21/1987 Berkeley Community Theatre, Berkeley, CA</a></span> [<a href="http://www.archive.org/search.php?query=creator:%22Grateful Dead%22%20date:1987-11-21*">Listen/Download</a>]<tr><td></td></tr>
<tr class="notes"><td>These would have been Rex Foundation benefits.</i></td></tr>
</table></div>
<div class="setlist_table"><table border="0" cellspacing="0" cellpadding="0"><tr class="header"><td><span><a name="1217"></a><a href="/1987-12-17">12/17/1987 Warfield Theater, San Francisco, CA</a></span> [<a href="http://www.archive.org/search.php?query=creator:%22Grateful Dead%22%20date:1987-12-17*">Listen/Download</a>]<tr><td>Masterpiece <span class="setlist_small">@</span>, Deep Elem <span class="setlist_small">@</span>, Victim <span class="setlist_small">@</span>, Bird Song <span class="setlist_small">@</span>, Dark Hollow <span class="setlist_small">@</span>, Turtle Dove <span class="setlist_small">@</span>, Heaven's Door <span class="setlist_small">@</span></td></tr>
<tr class="notes"><td>Humanitias International and BGP presents Joan baez and Friends, A Christmas Concert.Garcia, Weir & Kahn-also played on "Let It Be."</i></td></tr>
</table></div>
<div class="setlist_table"><table border="0" cellspacing="0" cellpadding="0"><tr class="header"><td><span><a name="1227"></a><a href="/1987-12-27">12/27/1987 Oakland Coliseum Arena, Oakland, CA</a></span> [<a href="http://www.archive.org/search.php?query=creator:%22Grateful Dead%22%20date:1987-12-27*">Listen/Download</a>]<tr><td>I: Touch > Jack Straw, Peggy-O, Walking Blues, Ramble On, Me  and  My Uncle > Big River, Roses, Desolation Row > Don't Ease</td></tr>
<tr><td>II: Playin > Uncle John > Estimated > Eyes > Drumz > Mr. Fantasy > Stella Blue > Throwing Stones > Lovelight</td></tr>
<tr><td>E: Mighty Quinn</td></tr>
<tr class="notes"><td>Soundcheck: Top Of The World.</i></td></tr>
</table></div>
<div class="setlist_table"><table border="0" cellspacing="0" cellpadding="0"><tr class="header"><td><span><a name="1228"></a><a href="/1987-12-28">12/28/1987 Oakland Coliseum Arena, Oakland, CA</a></span> [<a href="http://www.archive.org/search.php?query=creator:%22Grateful Dead%22%20date:1987-12-28*">Listen/Download</a>]<tr><td>I: Stranger > Franklin's, Minglewood, Row Jimmy, Far From Me, Masterpiece, Sugaree > Bucket</td></tr>
<tr><td>II: China Cat > I Know You Rider > Cumberland, Woman Smarter > Drumz > Wheel > Truckin > Smokestack > Black Peter > Sugar Magnolia</td></tr>
<tr><td>E: Black Muddy River</td></tr>
</table></div>
<div class="setlist_table"><table border="0" cellspacing="0" cellpadding="0"><tr class="header"><td><span><a name="1230"></a><a href="/1987-12-30">12/30/1987 Oakland Coliseum Arena, Oakland, CA</a></span> [<a href="http://www.archive.org/search.php?query=creator:%22Grateful Dead%22%20date:1987-12-30*">Listen/Download</a>]<tr><td>I: Hey Pocky Way > Big Boss Man, Greatest, FOTD, Mama Tried > Mexicali, Althea, Cassidy, West L. A., Let It Grow</td></tr>
<tr><td>II: Scarlet > Samson, Ship Of Fools, He's Gone > Drumz > Miracle > Gimme Some Lovin > Morning Dew > Watchtower</td></tr>
<tr><td>E: Baby Blue</td></tr>
</table></div>
<div class="setlist_table"><table border="0" cellspacing="0" cellpadding="0"><tr class="header"><td><span><a name="1231"></a><a href="/1987-12-31">12/31/1987 Oakland Coliseum Arena, Oakland, CA</a></span> [<a href="http://www.archive.org/search.php?query=creator:%22Grateful Dead%22%20date:1987-12-31*">Listen/Download</a>]<tr><td>I: Bertha > Promised, Cold Rain > Rooster, Push, Masterpiece, Bird Song > Music</td></tr>
<tr><td>II: Bucket > Uncle John > Terrapin > Drumz > Other One > Wharf Rat > Throwing Stones > NFA</td></tr>
<tr><td>III: Woman Smarter<span class="setlist_small">*</span> > Iko Iko<span class="setlist_small">*</span>, Day-O<span class="setlist_small">*</span> > Do You Wanna Dance<span class="setlist_small">*</span>, Heaven's Door<span class="setlist_small">*+</span></td></tr>
<tr class="notes"><td>Only ''Do You Wanna Dance''; Final ''Day-O''</i></td></tr>
<tr class="notes"><td>Bill Graham rides in at midnight on the Golden Gate Bridge. Mason Williams, The Neville Brothers, then The Looters opened. Pay-per-view TV broadcast and national radio broadcast.  *with members of The Neville Brothers.  +with Ramblin' Jack Elliot and David Nelson. Only "Do You Wanna Dance." Entire show except "Promised Land," "Man Smart Woman Smarter," "Iko Iko," "Day-O," and "Do You Wanna Dance" appears on the "Ticket to New Year’s" video. </i></td></tr>
</table></div>

  </div>
 </div><!--END main-->

</div><!--END container -->
</div><!--END centering div-->
</body>
</html>