<!DOCTYPE HTML PUBLIC "-//W3C//DTD HTML 4.01 Transitional//EN"
"http://www.w3.org/TR/html4/loose.dtd">
<html>
  <head>
    <meta http-equiv="Content-Type" content="text/html; charset=utf-8">
    <title>
      1985 Setlists
    </title>
  </head>
  <body>
    <div id="main">
      <div>
        1985 Setlists
      </div><script language="Javascript" type="text/javascript">
<!--
      function showtab () {
      document.getElementById('hide').style.display = 'none';
      document.getElementById('show').style.display = 'block';
      }
      function hidetab () {
      document.getElementById('show').style.display = 'none';
      document.getElementById('hide').style.display = 'block';
      }
      -->
      </script>
      <p>
        February: <a href="#0218">18</a> <a href="#0219">19</a> <a href="#0220">20</a> <a href="#02xx">xx</a>
        <br>
        March: <a href="#0309">9</a> <a href="#0310">10</a> <a href="#0312">12</a> <a href="#0313">13</a> <a href="#0321">21</a> <a href="#0322">22</a> <a href="#0324">24</a> <a href="#0325">25</a> <a href="#0327">27</a> <a href="#0328">28</a> <a href="#0329">29</a> <a href="#0331">31</a>
        <br>
        April: <a href="#0401">1</a> <a href="#0403">3</a> <a href="#0404">4</a> <a href="#0406">6</a> <a href="#0407">7</a> <a href="#0408">8</a> <a href="#0413">13</a> <a href="#0414">14</a> <a href="#0419">19</a> <a href="#0420">20</a> <a href="#0421">21</a> <a href="#0427">27</a> <a href="#0428">28</a>
        <br>
        June: <a href="#0608">8</a> <a href="#0609">9</a> <a href="#0614">14</a> <a href="#0615">15</a> <a href="#0616">16</a> <a href="#0621">21</a> <a href="#0622">22</a> <a href="#0624">24</a> <a href="#0625">25</a> <a href="#0627">27</a> <a href="#0628">28</a> <a href="#0630">30</a>
        <br>
        July: <a href="#0701">1</a> <a href="#0702">2</a> <a href="#0713">13</a> <a href="#0714">14</a>
        <br>
        August: <a href="#0824">24</a> <a href="#0830">30</a> <a href="#0831">31</a>
        <br>
        September: <a href="#0902">2</a> <a href="#0903">3</a> <a href="#0905">5</a> <a href="#0906">6</a> <a href="#0907">7</a> <a href="#0910">10</a> <a href="#0911">11</a> <a href="#0912">12</a> <a href="#0915">15</a>
        <br>
        October: <a href="#1025">25</a> <a href="#1026">26</a> <a href="#1028">28</a> <a href="#1029">29</a> <a href="#1031">31</a>
        <br>
        November: <a href="#1101">1</a> <a href="#1102">2</a> <a href="#1104">4</a> <a href="#1105">5</a> <a href="#1107">7</a> <a href="#1108">8</a> <a href="#1110">10</a> <a href="#1111">11</a> <a href="#1116">16</a> <a href="#1117">17</a> <a href="#1120">20</a> <a href="#1121">21</a> <a href="#1122">22</a> <a href="#1127">27</a>
        <br>
        December: <a href="#1229">29</a> <a href="#1230">30</a> <a href="#1231">31</a>
      </p>
      <div>
        <table border="0" cellspacing="0" cellpadding="0">
          <tr>
            <td id="0218">
              <a href="/1985-02-18">2/18/1985 Henry J. Kaiser Convention Center, Oakland, CA</a> [<a href="http://www.archive.org/search.php?query=creator:%22Grateful%20Dead%22%20date:1985-02-18*">Listen/Download</a>]
            </td>
          </tr>
          <tr>
            <td>
              I: Iko Iko &gt; C. C. Rider, Dire Wolf, Cassidy, Ramble On, Me and My Uncle &gt; Mexicali, China Cat &gt; I Know You Rider
            </td>
          </tr>
          <tr>
            <td>
              II: Samson, He's Gone &gt; Spoonful &gt; Eyes &gt; GDTRFB &gt; Drumz &gt; China Doll &gt; Baby What You Want &gt; Sugar Magnolia
            </td>
          </tr>
          <tr>
            <td>
              E: Day Job
            </td>
          </tr>
          <tr>
            <td>
              Previous ''Baby What You Want'' 12/31/1982 [131 shows]
            </td>
          </tr>
          <tr>
            <td>
              Venue used to be called "Oakland Auditorium Arena"
            </td>
          </tr>
        </table>
      </div>
      <div>
        <table border="0" cellspacing="0" cellpadding="0">
          <tr>
            <td id="0219">
              <a href="/1985-02-19">2/19/1985 Henry J. Kaiser Convention Center, Oakland, CA</a> [<a href="http://www.archive.org/search.php?query=creator:%22Grateful%20Dead%22%20date:1985-02-19*">Listen/Download</a>]
            </td>
          </tr>
          <tr>
            <td>
              I: Jack Straw, Dupree's, Minglewood, B. E. Women, Esau &gt; Bird Song, Bucket &gt; Might As Well
            </td>
          </tr>
          <tr>
            <td>
              II: Truckin &gt; Terrapin &gt; Woman Smarter* &gt; Drumz &gt; Throwing Stones &gt; Touch
            </td>
          </tr>
          <tr>
            <td>
              E: Johnny B. Goode
            </td>
          </tr>
          <tr>
            <td>
              The Chinese Symphony Orchestra opened. *with Gung Hay Fat Choy Iko Iko. Dragon Dance during "Drumz."
            </td>
          </tr>
        </table>
      </div>
      <div>
        <table border="0" cellspacing="0" cellpadding="0">
          <tr>
            <td id="0220">
              <a href="/1985-02-20">2/20/1985 Henry J. Kaiser Convention Center, Oakland, CA</a> [<a href="http://www.archive.org/search.php?query=creator:%22Grateful%20Dead%22%20date:1985-02-20*">Listen/Download</a>]
            </td>
          </tr>
          <tr>
            <td>
              I: Cold Rain &gt; Day Tripper, West L. A., Mama Tried &gt; Big River, Tennessee Jed, L. L. Rain &gt; Don't Ease
            </td>
          </tr>
          <tr>
            <td>
              II: Scarlet &gt; Fire &gt; Playin &gt; Drumz &gt; Wheel &gt; Black Peter &gt; Lovelight
            </td>
          </tr>
          <tr>
            <td>
              E: U. S. Blues
            </td>
          </tr>
          <tr>
            <td>
              Dragon Dance during "Drumz."
            </td>
          </tr>
        </table>
      </div>
      <div>
        <table border="0" cellspacing="0" cellpadding="0">
          <tr>
            <td id="02xx">
              <a href="/1985-02-xx">2/xx/1985 Le Club Front, San Rafael, CA</a> [<a href="http://www.archive.org/search.php?query=creator:%22Grateful%20Dead%22%20date:1985-02-xx*">Listen/Download</a>]
            </td>
          </tr>
          <tr>
            <td></td>
          </tr>
          <tr>
            <td>
              There are 8 tracks, all instrumental, on this "Twilight Zone" rehearsal tape. At least four of them seem to derive from the same recording of the same tune.
            </td>
          </tr>
        </table>
      </div>
      <div>
        <table border="0" cellspacing="0" cellpadding="0">
          <tr>
            <td id="0309">
              <a href="/1985-03-09">3/9/1985 Berkeley Community Theatre, Berkeley, CA</a> [<a href="http://www.archive.org/search.php?query=creator:%22Grateful%20Dead%22%20date:1985-03-09*">Listen/Download</a>]
            </td>
          </tr>
          <tr>
            <td>
              I: Bertha &gt; Saturday Night &gt; Sugaree, All Over Now, Row Jimmy, Let It Grow
            </td>
          </tr>
          <tr>
            <td>
              II: China Cat &gt; Cumberland &gt; Miracle &gt; Eyes &gt; Drumz* &gt; Other One* &gt; Wheel &gt; Sugar Magnolia
            </td>
          </tr>
          <tr>
            <td>
              E: Baby Blue
            </td>
          </tr>
          <tr>
            <td>
              Rex Foundation benefit. *with Merl Saunders. "Twilight Zone Theme" during "Drumz."
            </td>
          </tr>
        </table>
      </div>
      <div>
        <table border="0" cellspacing="0" cellpadding="0">
          <tr>
            <td id="0310">
              <a href="/1985-03-10">3/10/1985 Berkeley Community Theatre, Berkeley, CA</a> [<a href="http://www.archive.org/search.php?query=creator:%22Grateful%20Dead%22%20date:1985-03-10*">Listen/Download</a>]
            </td>
          </tr>
          <tr>
            <td>
              I: Stranger, Peggy-O, C. C. Rider &gt; Bird Song, Bucket &gt; Big RxR Blues
            </td>
          </tr>
          <tr>
            <td>
              II: Samson &gt; Terrapin &gt; Truckin &gt; Smokestack &gt; Drumz &gt; Stella Blue &gt; GDTRFB &gt; Around &gt; Johnny B. Goode
            </td>
          </tr>
          <tr>
            <td>
              E: Day Job
            </td>
          </tr>
          <tr>
            <td>
              Rex Foundation benefit.
            </td>
          </tr>
        </table>
      </div>
      <div>
        <table border="0" cellspacing="0" cellpadding="0">
          <tr>
            <td id="0312">
              <a href="/1985-03-12">3/12/1985 Berkeley Community Theatre, Berkeley, CA</a> [<a href="http://www.archive.org/search.php?query=creator:%22Grateful%20Dead%22%20date:1985-03-12*">Listen/Download</a>]
            </td>
          </tr>
          <tr>
            <td>
              I: Iko Iko, Rooster*, Dupree's, Me and My Uncle &gt; Big River, West L. A., L. L. Rain &gt; Don't Ease
            </td>
          </tr>
          <tr>
            <td>
              II: Touch, Playin &gt; Drumz &gt; He's Gone &gt; Throwing Stones &gt; NFA* &gt; Lovelight
            </td>
          </tr>
          <tr>
            <td>
              E: U. S. Blues
            </td>
          </tr>
          <tr>
            <td>
              Rex Foundation benefit. *with Matt Kelly.
            </td>
          </tr>
        </table>
      </div>
      <div>
        <table border="0" cellspacing="0" cellpadding="0">
          <tr>
            <td id="0313">
              <a href="/1985-03-13">3/13/1985 Berkeley Community Theatre, Berkeley, CA</a> [<a href="http://www.archive.org/search.php?query=creator:%22Grateful%20Dead%22%20date:1985-03-13*">Listen/Download</a>]
            </td>
          </tr>
          <tr>
            <td>
              I: Jack Straw &gt; Althea, Mama Tried &gt; Mexicali, FOTD, Minglewood*, Deal*
            </td>
          </tr>
          <tr>
            <td>
              II: Music &gt; Franklin's &gt; Estimated &gt; Spoonful* &gt; Drumz+ &gt; Ollin Arageed+ &gt; Woman Smarter+ &gt; Black Peter* &gt; Good Lovin
            </td>
          </tr>
          <tr>
            <td>
              E: Brokedown
            </td>
          </tr>
          <tr>
            <td>
              Previous ''Ollin Arageed'' 8/5/1979 [406 shows]; Final ''Ollin Arageed''
            </td>
          </tr>
          <tr>
            <td>
              Rex Foundation benefit. *with Matt Kelly. +with Hamza El-Din.
            </td>
          </tr>
        </table>
      </div>
      <div>
        <table border="0" cellspacing="0" cellpadding="0">
          <tr>
            <td id="0321">
              <a href="/1985-03-21">3/21/1985 Hampton Coliseum, Hampton, VA</a> [<a href="http://www.archive.org/search.php?query=creator:%22Grateful%20Dead%22%20date:1985-03-21*">Listen/Download</a>]
            </td>
          </tr>
          <tr>
            <td>
              I: Alabama &gt; Greatest, TLEO, El Paso &gt; Tennessee Jed, Bottom &gt; Superstitious, Dupree's &gt; L. L. Rain &gt; Might As Well
            </td>
          </tr>
          <tr>
            <td>
              II: China Cat &gt; I Know You Rider &gt; Playin &gt; Drumz &gt; Wheel &gt; Other One &gt; Wharf Rat &gt; Around &gt; Johnny B. Goode
            </td>
          </tr>
          <tr>
            <td>
              E: Day Job
            </td>
          </tr>
        </table>
      </div>
      <div>
        <table border="0" cellspacing="0" cellpadding="0">
          <tr>
            <td id="0322">
              <a href="/1985-03-22">3/22/1985 Hampton Coliseum, Hampton, VA</a> [<a href="http://www.archive.org/search.php?query=creator:%22Grateful%20Dead%22%20date:1985-03-22*">Listen/Download</a>]
            </td>
          </tr>
          <tr>
            <td>
              I: Stranger, Cold Rain, C. C. Rider, B. E. Women, Cassidy, Big RxR Blues, Esau, Don't Ease
            </td>
          </tr>
          <tr>
            <td>
              II: Scarlet &gt; Bucket, Ship Of Fools, Terrapin &gt; Drumz &gt; Spanish Jam &gt; Truckin &gt; Smokestack &gt; Black Peter &gt; Sugar Magnolia
            </td>
          </tr>
          <tr>
            <td>
              E: Baby Blue
            </td>
          </tr>
        </table>
      </div>
      <div>
        <table border="0" cellspacing="0" cellpadding="0">
          <tr>
            <td id="0324">
              <a href="/1985-03-24">3/24/1985 Springfield Civic Center Arena, Springfield, MA</a> [<a href="http://www.archive.org/search.php?query=creator:%22Grateful%20Dead%22%20date:1985-03-24*">Listen/Download</a>]
            </td>
          </tr>
          <tr>
            <td>
              I: Bertha &gt; Promised, Althea, Me and My Uncle &gt; Mexicali, Ramble On, Minglewood &gt; Deal
            </td>
          </tr>
          <tr>
            <td>
              II: Samson &gt; Cumberland, Woman Smarter &gt; He's Gone &gt; Spoonful &gt; Drumz &gt; Mr. Fantasy &gt; Throwing Stones &gt; NFA
            </td>
          </tr>
          <tr>
            <td>
              E: U. S. Blues
            </td>
          </tr>
        </table>
      </div>
      <div>
        <table border="0" cellspacing="0" cellpadding="0">
          <tr>
            <td id="0325">
              <a href="/1985-03-25">3/25/1985 Springfield Civic Center Arena, Springfield, MA</a> [<a href="http://www.archive.org/search.php?query=creator:%22Grateful%20Dead%22%20date:1985-03-25*">Listen/Download</a>]
            </td>
          </tr>
          <tr>
            <td>
              I: Jack Straw &gt; Sugaree &gt; Rooster, Bird Song, All Over Now, Roses &gt; Let It Grow
            </td>
          </tr>
          <tr>
            <td>
              II: Help &gt; Slipknot &gt; Franklin's &gt; Estimated &gt; Eyes &gt; Drumz &gt; Miracle &gt; China Doll &gt; GDTRFB &gt; Good Lovin
            </td>
          </tr>
          <tr>
            <td>
              E: Day Job
            </td>
          </tr>
        </table>
      </div>
      <div>
        <table border="0" cellspacing="0" cellpadding="0">
          <tr>
            <td id="0327">
              <a href="/1985-03-27">3/27/1985 Nassau Veterans Memorial Coliseum, Uniondale, NY</a> [<a href="http://www.archive.org/search.php?query=creator:%22Grateful%20Dead%22%20date:1985-03-27*">Listen/Download</a>]
            </td>
          </tr>
          <tr>
            <td>
              I: Half Step &gt; Bucket, West L. A., Mama Tried &gt; Big River, Tom Thumb Blues, B. E. Women, Tons Of Steel, Might As Well
            </td>
          </tr>
          <tr>
            <td>
              II: Shakedown, Uncle John &gt; Playin &gt; Drumz &gt; Stella Blue &gt; Lovelight
            </td>
          </tr>
          <tr>
            <td>
              E: Touch
            </td>
          </tr>
          <tr>
            <td>
              First ''Tom Thumb Blues''; Previous ''Half Step'' 10/17/1982 [148 shows]
            </td>
          </tr>
        </table>
      </div>
      <div>
        <table border="0" cellspacing="0" cellpadding="0">
          <tr>
            <td id="0328">
              <a href="/1985-03-28">3/28/1985 Nassau Veterans Memorial Coliseum, Uniondale, NY</a> [<a href="http://www.archive.org/search.php?query=creator:%22Grateful%20Dead%22%20date:1985-03-28*">Listen/Download</a>]
            </td>
          </tr>
          <tr>
            <td>
              I: Truckin &gt; Smokestack* &gt; High Time, El Paso, Peggy-O, Cassidy, China Cat &gt; I Know You Rider
            </td>
          </tr>
          <tr>
            <td>
              II: Scarlet &gt; Fire &gt; L. L. Rain &gt; Jam &gt; Drumz &gt; Gimme Some Lovin &gt; Other One &gt; Black Peter &gt; Sugar Magnolia
            </td>
          </tr>
          <tr>
            <td>
              E: Day Job
            </td>
          </tr>
          <tr>
            <td>
              *with Matt Kelly.
            </td>
          </tr>
        </table>
      </div>
      <div>
        <table border="0" cellspacing="0" cellpadding="0">
          <tr>
            <td id="0329">
              <a href="/1985-03-29">3/29/1985 Nassau Veterans Memorial Coliseum, Uniondale, NY</a> [<a href="http://www.archive.org/search.php?query=creator:%22Grateful%20Dead%22%20date:1985-03-29*">Listen/Download</a>]
            </td>
          </tr>
          <tr>
            <td>
              I: Cold Rain, Bottom* &gt; Superstitious*, FOTD, Supplication Jam &gt; Esau, Tennessee Jed, Minglewood, Don't Ease
            </td>
          </tr>
          <tr>
            <td>
              II: Terrapin &gt; Woman Smarter &gt; GDTRFB &gt; Baby What You Want &gt; Drumz &gt; Wharf Rat &gt; Throwing Stones &gt; Johnny B. Goode
            </td>
          </tr>
          <tr>
            <td>
              E: Brokedown
            </td>
          </tr>
          <tr>
            <td>
              *with Matt Kelly.
            </td>
          </tr>
        </table>
      </div>
      <div>
        <table border="0" cellspacing="0" cellpadding="0">
          <tr>
            <td id="0331">
              <a href="/1985-03-31">3/31/1985 Cumberland County Civic Center, Portland, ME</a> [<a href="http://www.archive.org/search.php?query=creator:%22Grateful%20Dead%22%20date:1985-03-31*">Listen/Download</a>]
            </td>
          </tr>
          <tr>
            <td>
              I: Music, Candyman &gt; C. C. Rider &gt; Loser, BIODTL, Dupree's, All Over Now &gt; Don't Ease
            </td>
          </tr>
          <tr>
            <td>
              II: Iko Iko &gt; Samson, He's Gone &gt; Miracle &gt; China Doll &gt; Drumz &gt; Wheel &gt; Playin &gt; Day Tripper
            </td>
          </tr>
          <tr>
            <td>
              E: U. S. Blues
            </td>
          </tr>
          <tr>
            <td>
              Inverted "Playin."
            </td>
          </tr>
        </table>
      </div>
      <div>
        <table border="0" cellspacing="0" cellpadding="0">
          <tr>
            <td id="0401">
              <a href="/1985-04-01">4/1/1985 Cumberland County Civic Center, Portland, ME</a> [<a href="http://www.archive.org/search.php?query=creator:%22Grateful%20Dead%22%20date:1985-04-01*">Listen/Download</a>]
            </td>
          </tr>
          <tr>
            <td>
              I: Bertha &gt; Greatest, West L. A., Rooster, Bird Song, Tom Thumb Blues, L. L. Rain &gt; Might As Well
            </td>
          </tr>
          <tr>
            <td>
              II: China Cat &gt; I Know You Rider, Estimated &gt; Eyes &gt; Drumz &gt; Other One &gt; Stella Blue &gt; Around &gt; NFA
            </td>
          </tr>
          <tr>
            <td>
              E: Baby Blue
            </td>
          </tr>
        </table>
      </div>
      <div>
        <table border="0" cellspacing="0" cellpadding="0">
          <tr>
            <td id="0403">
              <a href="/1985-04-03">4/3/1985 Providence Civic Center, Providence, RI</a> [<a href="http://www.archive.org/search.php?query=creator:%22Grateful%20Dead%22%20date:1985-04-03*">Listen/Download</a>]
            </td>
          </tr>
          <tr>
            <td>
              I: Bucket &gt; Sugaree, Me and My Uncle &gt; Mexicali, Ramble On, Bottom &gt; Superstitious, Row Jimmy, Let It Grow
            </td>
          </tr>
          <tr>
            <td>
              II: Terrapin &gt; Woman Smarter, Ship Of Fools, Truckin &gt; Spoonful &gt; Drumz &gt; Wharf Rat &gt; Throwing Stones &gt; Sugar Magnolia
            </td>
          </tr>
          <tr>
            <td>
              E: Day Job
            </td>
          </tr>
        </table>
      </div>
      <div>
        <table border="0" cellspacing="0" cellpadding="0">
          <tr>
            <td id="0404">
              <a href="/1985-04-04">4/4/1985 Providence Civic Center, Providence, RI</a> [<a href="http://www.archive.org/search.php?query=creator:%22Grateful%20Dead%22%20date:1985-04-04*">Listen/Download</a>]
            </td>
          </tr>
          <tr>
            <td>
              I: Alabama &gt; Jack Straw, Dire Wolf, El Paso, She Belongs To Me, Esau, FOTD, Sailor &gt; Saint &gt; Deal
            </td>
          </tr>
          <tr>
            <td>
              II: Miracle &gt; Crazy Fingers, Samson, He's Gone &gt; GDTRFB &gt; Drumz &gt; Wheel &gt; Black Peter &gt; Around &gt; Lovelight
            </td>
          </tr>
          <tr>
            <td>
              E: U. S. Blues
            </td>
          </tr>
          <tr>
            <td>
              Previous ''Crazy Fingers'' 10/8/1983 [98 shows]; Previous ''She Belongs To Me'' 1/7/1966 [1543 shows]
            </td>
          </tr>
        </table>
      </div>
      <div>
        <table border="0" cellspacing="0" cellpadding="0">
          <tr>
            <td id="0406">
              <a href="/1985-04-06">4/6/1985 The Spectrum, Philadelphia, PA</a> [<a href="http://www.archive.org/search.php?query=creator:%22Grateful%20Dead%22%20date:1985-04-06*">Listen/Download</a>]
            </td>
          </tr>
          <tr>
            <td>
              I: Stranger, TLEO, Minglewood, Dupree's, Mama Tried &gt; Big River, Big RxR Blues, L. L. Rain &gt; Don't Ease
            </td>
          </tr>
          <tr>
            <td>
              II: China Cat &gt; I Know You Rider &gt; Playin &gt; Uncle John &gt; Drumz &gt; Other One &gt; Throwing Stones &gt; NFA
            </td>
          </tr>
          <tr>
            <td>
              E: Saturday Night
            </td>
          </tr>
        </table>
      </div>
      <div>
        <table border="0" cellspacing="0" cellpadding="0">
          <tr>
            <td id="0407">
              <a href="/1985-04-07">4/7/1985 The Spectrum, Philadelphia, PA</a> [<a href="http://www.archive.org/search.php?query=creator:%22Grateful%20Dead%22%20date:1985-04-07*">Listen/Download</a>]
            </td>
          </tr>
          <tr>
            <td>
              I: Do It In The Road &gt; Half Step &gt; C. C. Rider, Bird Song, Dancin, Deal
            </td>
          </tr>
          <tr>
            <td>
              II: Shakedown &gt; Samson, She Belongs To Me &gt; Woman Smarter &gt; Drumz &gt; Gimme Some Lovin &gt; Truckin &gt; Smokestack &gt; Morning Dew &gt; Sugar Magnolia
            </td>
          </tr>
          <tr>
            <td>
              E: Day Job
            </td>
          </tr>
        </table>
      </div>
      <div>
        <table border="0" cellspacing="0" cellpadding="0">
          <tr>
            <td id="0408">
              <a href="/1985-04-08">4/8/1985 The Spectrum, Philadelphia, PA</a> [<a href="http://www.archive.org/search.php?query=creator:%22Grateful%20Dead%22%20date:1985-04-08*">Listen/Download</a>]
            </td>
          </tr>
          <tr>
            <td>
              I: Midnight Hour &gt; Walking The Dog &gt; Big Boss Man, Me and My Uncle &gt; Cumberland, Bottom &gt; Superstitious, Althea, Tons Of Steel &gt; Supplication Jam &gt; Might As Well
            </td>
          </tr>
          <tr>
            <td>
              II: Revolution, Bucket &gt; Touch, Estimated &gt; Eyes &gt; Drumz &gt; GDTRFB &gt; Stella Blue &gt; Around &gt; Lovelight
            </td>
          </tr>
          <tr>
            <td>
              E: Brokedown
            </td>
          </tr>
          <tr>
            <td>
              Next ''Big Boss Man'' 8/13/1987 [148 shows]; Previous ''Walking The Dog'' 3/29/1984 [83 shows]
            </td>
          </tr>
        </table>
      </div>
      <div>
        <table border="0" cellspacing="0" cellpadding="0">
          <tr>
            <td id="0413">
              <a href="/1985-04-13">4/13/1985 Irvine Meadows Amphitheatre, Irvine, CA</a> [<a href="http://www.archive.org/search.php?query=creator:%22Grateful%20Dead%22%20date:1985-04-13*">Listen/Download</a>]
            </td>
          </tr>
          <tr>
            <td>
              I: Do It In The Road &gt; Bertha &gt; Jack Straw, West L. A., Rooster, Peggy-O, Cassidy, Deal
            </td>
          </tr>
          <tr>
            <td>
              II: Terrapin &gt; Playin &gt; Crazy Fingers &gt; Truckin &gt; Drumz &gt; Wheel &gt; Throwing Stones &gt; Saturday Night
            </td>
          </tr>
          <tr>
            <td>
              E: Baby Blue
            </td>
          </tr>
          <tr>
            <td>
              Next ''Do It In The Road'' 3/30/1986 [63 shows]
            </td>
          </tr>
        </table>
      </div>
      <div>
        <table border="0" cellspacing="0" cellpadding="0">
          <tr>
            <td id="0414">
              <a href="/1985-04-14">4/14/1985 Irvine Meadows Amphitheatre, Irvine, CA</a> [<a href="http://www.archive.org/search.php?query=creator:%22Grateful%20Dead%22%20date:1985-04-14*">Listen/Download</a>]
            </td>
          </tr>
          <tr>
            <td>
              I: Touch &gt; Bucket &gt; Sugaree &gt; Bottom &gt; Superstitious, B. E. Women, Tons Of Steel, Big RxR Blues, L. L. Rain &gt; Don't Ease
            </td>
          </tr>
          <tr>
            <td>
              II: Miracle &gt; China Cat &gt; I Know You Rider, Woman Smarter &gt; He's Gone &gt; Drumz &gt; Mr. Fantasy &gt; Other One &gt; Wharf Rat &gt; Sugar Magnolia
            </td>
          </tr>
          <tr>
            <td>
              E: Gloria
            </td>
          </tr>
        </table>
      </div>
      <div>
        <table border="0" cellspacing="0" cellpadding="0">
          <tr>
            <td id="0419">
              <a href="/1985-04-19">4/19/1985 Marin County Veterans Auditorium, San Rafael, CA</a> [<a href="http://www.archive.org/search.php?query=creator:%22Grateful%20Dead%22%20date:1985-04-19*">Listen/Download</a>]
            </td>
          </tr>
          <tr>
            <td>
              Esau, West L. A., Bucket, Day Job, Hog For You Baby, Cassidy, Comes A Time
            </td>
          </tr>
          <tr>
            <td>
              Video taping session.
            </td>
          </tr>
        </table>
      </div>
      <div>
        <table border="0" cellspacing="0" cellpadding="0">
          <tr>
            <td id="0420">
              <a href="/1985-04-20">4/20/1985 Marin County Veterans Auditorium, San Rafael, CA</a> [<a href="http://www.archive.org/search.php?query=creator:%22Grateful%20Dead%22%20date:1985-04-20*">Listen/Download</a>]
            </td>
          </tr>
          <tr>
            <td>
              Cryptical &gt; Day Job, revolution, Throwing Stones x2, Hi-Heel Sneakers &gt; She Belongs To Me, Home On The Range *, Day Job +, Touch x3, Miracle &gt; Uncle John &gt; Comes A Time, Sailor, Goodnight Irene #, Drumz, Goodnight Irene, Bucket, Day Job, Drumz
            </td>
          </tr>
          <tr>
            <td>
              Video taping session. *sung by Lesh. +sung by Hart, #Garcia only.
            </td>
          </tr>
        </table>
      </div>
      <div>
        <table border="0" cellspacing="0" cellpadding="0">
          <tr>
            <td id="0421">
              <a href="/1985-04-21">4/21/1985 Marin County Veterans Auditorium, San Rafael, CA</a> [<a href="http://www.archive.org/search.php?query=creator:%22Grateful%20Dead%22%20date:1985-04-21*">Listen/Download</a>]
            </td>
          </tr>
          <tr>
            <td>
              Throwing Stones &gt; NFA, Green Onions &gt; Uncle John &gt; Playin, Uncle John &gt; Playin, B. E. Women x2, Jack Straw x2, Terrapin x2
            </td>
          </tr>
          <tr>
            <td>
              Video taping session.
            </td>
          </tr>
        </table>
      </div>
      <div>
        <table border="0" cellspacing="0" cellpadding="0">
          <tr>
            <td id="0427">
              <a href="/1985-04-27">4/27/1985 Frost Amphitheatre, Stanford U., Palo Alto, CA</a> [<a href="http://www.archive.org/search.php?query=creator:%22Grateful%20Dead%22%20date:1985-04-27*">Listen/Download</a>]
            </td>
          </tr>
          <tr>
            <td>
              I: Dancin &gt; Bertha, Rooster, B. E. Women, Esau, Ramble On, Tom Thumb Blues &gt; Cold Rain &gt; Music
            </td>
          </tr>
          <tr>
            <td>
              II: Scarlet &gt; Eyes &gt; GDTRFB &gt; Woman Smarter &gt; Drumz &gt; Wheel &gt; Truckin &gt; Other One &gt; Black Peter &gt; Around &gt; Saturday Night
            </td>
          </tr>
          <tr>
            <td>
              E: Day Job
            </td>
          </tr>
        </table>
      </div>
      <div>
        <table border="0" cellspacing="0" cellpadding="0">
          <tr>
            <td id="0428">
              <a href="/1985-04-28">4/28/1985 Frost Amphitheatre, Stanford U., Palo Alto, CA</a> [<a href="http://www.archive.org/search.php?query=creator:%22Grateful%20Dead%22%20date:1985-04-28*">Listen/Download</a>]
            </td>
          </tr>
          <tr>
            <td>
              I: Gimme Some Lovin &gt; Half Step &gt; Minglewood, Bird Song, Tons Of Steel &gt; China Cat &gt; I Know You Rider
            </td>
          </tr>
          <tr>
            <td>
              II: Bucket &gt; Crazy Fingers &gt; Playin &gt; China Doll &gt; Playin Jam &gt; Drumz &gt; Playin &gt; Wharf Rat &gt; Throwing Stones &gt; NFA
            </td>
          </tr>
          <tr>
            <td>
              E1: U. S. Blues
            </td>
          </tr>
          <tr>
            <td>
              E2: She Belongs To Me *
            </td>
          </tr>
          <tr>
            <td>
              *appears on "Garcia Plays Dylan."
            </td>
          </tr>
        </table>
      </div>
      <div>
        <table border="0" cellspacing="0" cellpadding="0">
          <tr>
            <td id="0608">
              <a href="/1985-06-08">6/8/1985 Cal Expo Amphitheatre, Sacramento, CA</a> [<a href="http://www.archive.org/search.php?query=creator:%22Grateful%20Dead%22%20date:1985-06-08*">Listen/Download</a>]
            </td>
          </tr>
          <tr>
            <td></td>
          </tr>
          <tr>
            <td>
              These shows were cancelled so that Lesh, Garcia, and Weir could attend performances of Wagner's "Ring of the Nibelung" in San Francisco. This gave rise to rumors that the Cal Expo shows were actually scraped so that the Dead could play a 20th anniversary free concert either in Golden Gate Park or at the Haight Street Fair. This did not occur, but free show rumors persisted through September.
            </td>
          </tr>
        </table>
      </div>
      <div>
        <table border="0" cellspacing="0" cellpadding="0">
          <tr>
            <td id="0609">
              <a href="/1985-06-09">6/9/1985 Cal Expo Amphitheatre, Sacramento, CA</a> [<a href="http://www.archive.org/search.php?query=creator:%22Grateful%20Dead%22%20date:1985-06-09*">Listen/Download</a>]
            </td>
          </tr>
          <tr>
            <td></td>
          </tr>
          <tr>
            <td>
              These shows were cancelled so that Lesh, Garcia, and Weir could attend performances of Wagner's "Ring of the Nibelung" in San Francisco. This gave rise to rumors that the Cal Expo shows were actually scraped so that the Dead could play a 20th anniversary free concert either in Golden Gate Park or at the Haight Street Fair. This did not occur, but free show rumors persisted through September.
            </td>
          </tr>
        </table>
      </div>
      <div>
        <table border="0" cellspacing="0" cellpadding="0">
          <tr>
            <td id="0614">
              <a href="/1985-06-14">6/14/1985 Greek Theatre, U. of California, Berkeley, CA</a> [<a href="http://www.archive.org/search.php?query=creator:%22Grateful%20Dead%22%20date:1985-06-14*">Listen/Download</a>]
            </td>
          </tr>
          <tr>
            <td>
              I: Dancin, West L. A., C. C. Rider, Peggy-O, Bucket
            </td>
          </tr>
          <tr>
            <td>
              II: Keep on Growing &gt; Stagger Lee &gt; Let It Grow &gt; Deal
            </td>
          </tr>
          <tr>
            <td>
              III: Morning Dew &gt; Playin &gt; China Doll &gt; Jam &gt; Drumz &gt; Truckin &gt; Smokestack &gt; Comes A Time &gt; Sugar Magnolia
            </td>
          </tr>
          <tr>
            <td>
              E: Day Job
            </td>
          </tr>
          <tr>
            <td>
              Previous ''Comes A Time'' 10/2/1980 [331 shows]
            </td>
          </tr>
          <tr>
            <td>
              "Jam" is Brent and percussion.
            </td>
          </tr>
        </table>
      </div>
      <div>
        <table border="0" cellspacing="0" cellpadding="0">
          <tr>
            <td id="0615">
              <a href="/1985-06-15">6/15/1985 Greek Theatre, U. of California, Berkeley, CA</a> [<a href="http://www.archive.org/search.php?query=creator:%22Grateful%20Dead%22%20date:1985-06-15*">Listen/Download</a>]
            </td>
          </tr>
          <tr>
            <td>
              I: Touch, Minglewood, FOTD, Cassidy &gt; Dupree's, Me and My Uncle &gt; Big River &gt; Might As Well
            </td>
          </tr>
          <tr>
            <td>
              II: China Cat &gt; I Know You Rider &gt; Sailor &gt; Saint &gt; Terrapin &gt; Drumz &gt; Wheel &gt; Gimme Some Lovin &gt; Throwing Stones &gt; NFA
            </td>
          </tr>
          <tr>
            <td>
              E1: She Belongs To Me
            </td>
          </tr>
          <tr>
            <td>
              E2: U. S. Blues
            </td>
          </tr>
        </table>
      </div>
      <div>
        <table border="0" cellspacing="0" cellpadding="0">
          <tr>
            <td id="0616">
              <a href="/1985-06-16">6/16/1985 Greek Theatre, U. of California, Berkeley, CA</a> [<a href="http://www.archive.org/search.php?query=creator:%22Grateful%20Dead%22%20date:1985-06-16*">Listen/Download</a>]
            </td>
          </tr>
          <tr>
            <td>
              I: Midnight Hour &gt; Bertha, Walking Blues, Tennessee Jed, Esau, Big RxR Blues &gt; L. L. Rain &gt; Half Step &gt; Promised
            </td>
          </tr>
          <tr>
            <td>
              II: Scarlet &gt; Fire &gt; Samson, Cryptical &gt; Other One &gt; Cryptical &gt; Drumz &gt; GDTRFB &gt; Miracle &gt; Wharf Rat &gt; Lovelight
            </td>
          </tr>
          <tr>
            <td>
              E: Brokedown
            </td>
          </tr>
          <tr>
            <td>
              Previous ''Cryptical'' 9/23/1972 [791 shows]; Previous ''Walking Blues'' 5/28/1982 [195 shows]
            </td>
          </tr>
        </table>
      </div>
      <div>
        <table border="0" cellspacing="0" cellpadding="0">
          <tr>
            <td id="0621">
              <a href="/1985-06-21">6/21/1985 Alpine Valley Music Theatre, East Troy, WI</a> [<a href="http://www.archive.org/search.php?query=creator:%22Grateful%20Dead%22%20date:1985-06-21*">Listen/Download</a>]
            </td>
          </tr>
          <tr>
            <td>
              I: Cold Rain &gt; Superstitious &gt; Bottom, Stagger Lee, Mama Tried &gt; Mexicali, Bird Song &gt; L. L. Rain &gt; Day Job
            </td>
          </tr>
          <tr>
            <td>
              II: Woman Smarter &gt; GDTRFB &gt; Estimated &gt; Eyes &gt; Drumz &gt; Truckin &gt; Black Peter &gt; Around &gt; Sugar Magnolia
            </td>
          </tr>
          <tr>
            <td>
              E: Baby Blue
            </td>
          </tr>
          <tr>
            <td>
              Previous ''Stagger Lee'' 8/10/1982 [182 shows]
            </td>
          </tr>
          <tr>
            <td>
              "Twilight Zone Theme" tuning before "Woman Smarter."
            </td>
          </tr>
        </table>
      </div>
      <div>
        <table border="0" cellspacing="0" cellpadding="0">
          <tr>
            <td id="0622">
              <a href="/1985-06-22">6/22/1985 Alpine Valley Music Theatre, East Troy, WI</a> [<a href="http://www.archive.org/search.php?query=creator:%22Grateful%20Dead%22%20date:1985-06-22*">Listen/Download</a>]
            </td>
          </tr>
          <tr>
            <td>
              I: Bucket &gt; Sugaree, Walking Blues &gt; Candyman &gt; All Over Now, Althea, Cassidy, B. E. Women, Saturday Night
            </td>
          </tr>
          <tr>
            <td>
              II: Keep On Growing &gt; Half Step &gt; Sailor &gt; Saint &gt; Drumz &gt; Mr. Fantasy &gt; Miracle &gt; Stella Blue &gt; Throwing Stones &gt; NFA
            </td>
          </tr>
          <tr>
            <td>
              E: Brokedown
            </td>
          </tr>
          <tr>
            <td>
              First ''Keep On Growing''
            </td>
          </tr>
        </table>
      </div>
      <div>
        <table border="0" cellspacing="0" cellpadding="0">
          <tr>
            <td id="0624">
              <a href="/1985-06-24">6/24/1985 River Bend Music Center, Cincinnati, OH</a> [<a href="http://www.archive.org/search.php?query=creator:%22Grateful%20Dead%22%20date:1985-06-24*">Listen/Download</a>]
            </td>
          </tr>
          <tr>
            <td>
              I: Alabama &gt; Greatest, TLEO, Minglewood, Tennessee Jed, Esau, Loser, Let It Grow
            </td>
          </tr>
          <tr>
            <td>
              II: Iko Iko &gt; Samson &gt; He's Gone &gt; Smokestack &gt; Cryptical &gt; Drumz &gt; Comes A Time &gt; Other One &gt; Cryptical &gt; Wharf Rat &gt; Around &gt; Good Lovin
            </td>
          </tr>
          <tr>
            <td>
              E: U. S. Blues
            </td>
          </tr>
        </table>
      </div>
      <div>
        <table border="0" cellspacing="0" cellpadding="0">
          <tr>
            <td id="0625">
              <a href="/1985-06-25">6/25/1985 Blossom Music Center, Cuyahoga Falls, OH</a> [<a href="http://www.archive.org/search.php?query=creator:%22Grateful%20Dead%22%20date:1985-06-25*">Listen/Download</a>]
            </td>
          </tr>
          <tr>
            <td>
              I: Day Tripper &gt; West L. A. &gt; C. C. Rider, Dire Wolf, BIODTL &gt; Row Jimmy, Me and My Uncle &gt; Big River, Big RxR Blues, Jack Straw &gt; Might As Well
            </td>
          </tr>
          <tr>
            <td>
              II: Gimme Some Lovin &gt; China Cat &gt; I Know You Rider &gt; Playin &gt; Drumz &gt; Wheel &gt; Playin &gt; China Doll &gt; Sugar Magnolia
            </td>
          </tr>
          <tr>
            <td>
              E: Touch
            </td>
          </tr>
        </table>
      </div>
      <div>
        <table border="0" cellspacing="0" cellpadding="0">
          <tr>
            <td id="0627">
              <a href="/1985-06-27">6/27/1985 Saratoga Performing Arts Center, Saratoga, NY</a> [<a href="http://www.archive.org/search.php?query=creator:%22Grateful%20Dead%22%20date:1985-06-27*">Listen/Download</a>]
            </td>
          </tr>
          <tr>
            <td>
              I: Midnight Hour &gt; Bertha &gt; Rooster, Stagger Lee &gt; El Paso &gt; Crazy Fingers &gt; Supplication Jam &gt; High Time, Bucket &gt; Don't Ease
            </td>
          </tr>
          <tr>
            <td>
              II: Stranger &gt; Eyes &gt; GDTRFB &gt; Woman Smarter &gt; Drumz &gt; Truckin &gt; Spoonful &gt; Black Peter &gt; Lovelight
            </td>
          </tr>
          <tr>
            <td>
              E: Johnny B. Goode &gt; Baby Blue
            </td>
          </tr>
        </table>
      </div>
      <div>
        <table border="0" cellspacing="0" cellpadding="0">
          <tr>
            <td id="0628">
              <a href="/1985-06-28">6/28/1985 Hershey Park Stadium, Hershey, PA</a> [<a href="http://www.archive.org/search.php?query=creator:%22Grateful%20Dead%22%20date:1985-06-28*">Listen/Download</a>]
            </td>
          </tr>
          <tr>
            <td>
              I: Cold Rain &gt; Promised, Ramble On, Superstitious &gt; Bottom, Bird Song &gt; Comes A Time &gt; Deal
            </td>
          </tr>
          <tr>
            <td>
              II: Music &gt; Tom Thumb Blues, Estimated &gt; Terrapin &gt; Drumz &gt; Miracle &gt; Morning Dew &gt; Throwing Stones &gt; NFA
            </td>
          </tr>
          <tr>
            <td>
              E: Day Job
            </td>
          </tr>
          <tr>
            <td>
              Final ''Bottom''; Final ''Superstitious''
            </td>
          </tr>
        </table>
      </div>
      <div>
        <table border="0" cellspacing="0" cellpadding="0">
          <tr>
            <td id="0630">
              <a href="/1985-06-30">6/30/1985 Merriweather Post Pavilion, Columbia, MD</a> [<a href="http://www.archive.org/search.php?query=creator:%22Grateful%20Dead%22%20date:1985-06-30*">Listen/Download</a>]
            </td>
          </tr>
          <tr>
            <td>
              I: Half Step &gt; C. C. Rider &gt; B. E. Women, Mama Tried &gt; Mexicali, Keep On Growing &gt; Big RxR Blues &gt; L. L. Rain &gt; Don't Ease
            </td>
          </tr>
          <tr>
            <td>
              II: Shakedown &gt; Samson, Gimme Some Lovin &gt; He's Gone &gt; Cryptical &gt; Drumz &gt; Other One &gt; Stella Blue &gt; Around &gt; Sugar Magnolia
            </td>
          </tr>
          <tr>
            <td>
              E: U. S. Blues
            </td>
          </tr>
        </table>
      </div>
      <div>
        <table border="0" cellspacing="0" cellpadding="0">
          <tr>
            <td id="0701">
              <a href="/1985-07-01">7/1/1985 Merriweather Post Pavilion, Columbia, MD</a> [<a href="http://www.archive.org/search.php?query=creator:%22Grateful%20Dead%22%20date:1985-07-01*">Listen/Download</a>]
            </td>
          </tr>
          <tr>
            <td>
              I: Dancin, Dupree's, Walking Blues, Jack A Roe, Esau, Stagger Lee, Let It Grow &gt; Day Job
            </td>
          </tr>
          <tr>
            <td>
              II: Scarlet &gt; Fire, Playin &gt; Uncle John &gt; Drumz &gt; Mr. Fantasy &gt; GDTRFB &gt; Good Lovin
            </td>
          </tr>
          <tr>
            <td>
              E: Satisfaction &gt; Baby Blue
            </td>
          </tr>
          <tr>
            <td>
              Previous ''Jack A Roe'' 10/12/1984 [50 shows]
            </td>
          </tr>
        </table>
      </div>
      <div>
        <table border="0" cellspacing="0" cellpadding="0">
          <tr>
            <td id="0702">
              <a href="/1985-07-02">7/2/1985 Pittsburgh Civic Arena, Pittsburgh, PA</a> [<a href="http://www.archive.org/search.php?query=creator:%22Grateful%20Dead%22%20date:1985-07-02*">Listen/Download</a>]
            </td>
          </tr>
          <tr>
            <td>
              I: Jack Straw &gt; Roses, Minglewood, FOTD, Cassidy, Big RxR Blues, Promised
            </td>
          </tr>
          <tr>
            <td>
              II: Woman Smarter &gt; Crazy Fingers &gt; Sailor &gt; Saint &gt; Terrapin &gt; Drumz &gt; Wharf Rat &gt; Throwing Stones &gt; Lovelight
            </td>
          </tr>
          <tr>
            <td>
              E: Revolution &gt; Brokedown
            </td>
          </tr>
        </table>
      </div>
      <div>
        <table border="0" cellspacing="0" cellpadding="0">
          <tr>
            <td id="0713">
              <a href="/1985-07-13">7/13/1985 County Fairgrounds, Ventura, CA</a> [<a href="http://www.archive.org/search.php?query=creator:%22Grateful%20Dead%22%20date:1985-07-13*">Listen/Download</a>]
            </td>
          </tr>
          <tr>
            <td>
              I: Saturday Night &gt; Fire, Walking Blues, Dupree's, Mama Tried &gt; Big River, Bird Song, Music
            </td>
          </tr>
          <tr>
            <td>
              II: Touch &gt; Woman Smarter &gt; Terrapin &gt; Drumz &gt; Wheel &gt; Cryptical &gt; Other One &gt; Comes A Time &gt; Around &gt; Sugar Magnolia
            </td>
          </tr>
          <tr>
            <td>
              E: U. S. Blues
            </td>
          </tr>
          <tr>
            <td>
              Next ''Walking Blues'' 1/28/1987 [80 shows]
            </td>
          </tr>
        </table>
      </div>
      <div>
        <table border="0" cellspacing="0" cellpadding="0">
          <tr>
            <td id="0714">
              <a href="/1985-07-14">7/14/1985 County Fairgrounds, Ventura, CA</a> [<a href="http://www.archive.org/search.php?query=creator:%22Grateful%20Dead%22%20date:1985-07-14*">Listen/Download</a>]
            </td>
          </tr>
          <tr>
            <td>
              I: Bucket, TLEO, Esau, Althea, Cassidy, Big RxR Blues &gt; L. L. Rain &gt; Might As Well
            </td>
          </tr>
          <tr>
            <td>
              II: China Cat &gt; I Know You Rider, Samson &gt; Ship Of Fools, Estimated &gt; Eyes &gt; Drumz &gt; Truckin &gt; Smokestack &gt; Black Peter &gt; Throwing Stones &gt; NFA
            </td>
          </tr>
          <tr>
            <td>
              E: Day Job
            </td>
          </tr>
        </table>
      </div>
      <div>
        <table border="0" cellspacing="0" cellpadding="0">
          <tr>
            <td id="0824">
              <a href="/1985-08-24">8/24/1985 Boreal Ridge Ski Resort, Donner's Summit, CA</a> [<a href="http://www.archive.org/search.php?query=creator:%22Grateful%20Dead%22%20date:1985-08-24*">Listen/Download</a>]
            </td>
          </tr>
          <tr>
            <td>
              I: Alabama &gt; Greatest, West L. A., Minglewood, FOTD, Bucket &gt; Don't Ease
            </td>
          </tr>
          <tr>
            <td>
              II: Stranger &gt; China Cat &gt; I Know You Rider, He's Gone &gt; Drumz &gt; Truckin &gt; Black Peter &gt; Around &gt; Lovelight
            </td>
          </tr>
          <tr>
            <td>
              E: Day Tripper
            </td>
          </tr>
          <tr>
            <td>
              Final ''Day Tripper''
            </td>
          </tr>
          <tr>
            <td>
              "Summit Conference." Equipment break between "Minglewood" and "FOTD."
            </td>
          </tr>
        </table>
      </div>
      <div>
        <table border="0" cellspacing="0" cellpadding="0">
          <tr>
            <td id="0830">
              <a href="/1985-08-30">8/30/1985 Southern Star Amphitheatre, Houston, TX</a> [<a href="http://www.archive.org/search.php?query=creator:%22Grateful%20Dead%22%20date:1985-08-30*">Listen/Download</a>]
            </td>
          </tr>
          <tr>
            <td>
              I: Jack Straw, Row Jimmy, C. C. Rider, Bird Song &gt; L. L. Rain &gt; Deal
            </td>
          </tr>
          <tr>
            <td>
              II: Scarlet &gt; Touch, Samson &gt; Drumz &gt; Gimme Some Lovin &gt; Wheel &gt; Other One &gt; Morning Dew
            </td>
          </tr>
          <tr>
            <td>
              E: Sugar Magnolia
            </td>
          </tr>
        </table>
      </div>
      <div>
        <table border="0" cellspacing="0" cellpadding="0">
          <tr>
            <td id="0831">
              <a href="/1985-08-31">8/31/1985 Manor Downs, Austin, TX</a> [<a href="http://www.archive.org/search.php?query=creator:%22Grateful%20Dead%22%20date:1985-08-31*">Listen/Download</a>]
            </td>
          </tr>
          <tr>
            <td>
              I: Half Step &gt; El Paso, Dupree's, Mexicali &gt; Big River, Althea, Esau, Jack A Roe, Let It Grow
            </td>
          </tr>
          <tr>
            <td>
              II: Terrapin &gt; Estimated &gt; Drumz &gt; GDTRFB &gt; Stella Blue &gt; Throwing Stones &gt; NFA
            </td>
          </tr>
          <tr>
            <td>
              E1: She Belongs To Me
            </td>
          </tr>
          <tr>
            <td>
              E2: Saturday Night
            </td>
          </tr>
          <tr>
            <td>
              Next ''Jack A Roe'' 12/9/1988 [235 shows]
            </td>
          </tr>
        </table>
      </div>
      <div>
        <table border="0" cellspacing="0" cellpadding="0">
          <tr>
            <td id="0902">
              <a href="/1985-09-02">9/2/1985 Zoo Amphitheatre, Oklahoma City, OK</a> [<a href="http://www.archive.org/search.php?query=creator:%22Grateful%20Dead%22%20date:1985-09-02*">Listen/Download</a>]
            </td>
          </tr>
          <tr>
            <td>
              I: Bertha &gt; Greatest, West L. A., Mama Tried &gt; Me and My Uncle, Stagger Lee &gt; Iko Iko, Minglewood, Ramble On, Bucket
            </td>
          </tr>
          <tr>
            <td>
              II: China Cat &gt; I Know You Rider &gt; Woman Smarter, Ship Of Fools, Playin &gt; Drumz &gt; Miracle &gt; China Doll &gt; Around &gt; Good Lovin
            </td>
          </tr>
          <tr>
            <td>
              E: Day Job
            </td>
          </tr>
        </table>
      </div>
      <div>
        <table border="0" cellspacing="0" cellpadding="0">
          <tr>
            <td id="0903">
              <a href="/1985-09-03">9/3/1985 Starlight Theatre, Kansas City, MO</a> [<a href="http://www.archive.org/search.php?query=creator:%22Grateful%20Dead%22%20date:1985-09-03*">Listen/Download</a>]
            </td>
          </tr>
          <tr>
            <td>
              I: Stranger &gt; TLEO, Rooster, Dire Wolf, Cassidy, Big RxR Blues, Music &gt; Don't Ease
            </td>
          </tr>
          <tr>
            <td>
              II: Cryptical &gt; Other One &gt; Cryptical &gt; Eyes &gt; Don't Need Love &gt; Drumz &gt; Nobody's Fault &gt; Truckin &gt; Smokestack &gt; Comes A Time &gt; Lovelight
            </td>
          </tr>
          <tr>
            <td>
              E: Baby Blue
            </td>
          </tr>
          <tr>
            <td>
              Next ''Nobody's Fault'' 9/22/1991 [450 shows]; Final ''Cryptical''
            </td>
          </tr>
        </table>
      </div>
      <div>
        <table border="0" cellspacing="0" cellpadding="0">
          <tr>
            <td id="0905">
              <a href="/1985-09-05">9/5/1985 Red Rocks Amphitheatre, Morrison, CO</a> [<a href="http://www.archive.org/search.php?query=creator:%22Grateful%20Dead%22%20date:1985-09-05*">Listen/Download</a>]
            </td>
          </tr>
          <tr>
            <td>
              I: Cold Rain, C. C. Rider, Candyman, BIODTL, Stagger Lee, Me and My Uncle &gt; Big River, Peggy-O, Let It Grow
            </td>
          </tr>
          <tr>
            <td>
              II: Scarlet &gt; Fire, Estimated &gt; Eyes &gt; Drumz &gt; Gimme Some Lovin &gt; Wharf Rat &gt; Sugar Magnolia
            </td>
          </tr>
          <tr>
            <td>
              E: Brokedown
            </td>
          </tr>
          <tr>
            <td>
              False start for "Brokedown."
            </td>
          </tr>
        </table>
      </div>
      <div>
        <table border="0" cellspacing="0" cellpadding="0">
          <tr>
            <td id="0906">
              <a href="/1985-09-06">9/6/1985 Red Rocks Amphitheatre, Morrison, CO</a> [<a href="http://www.archive.org/search.php?query=creator:%22Grateful%20Dead%22%20date:1985-09-06*">Listen/Download</a>]
            </td>
          </tr>
          <tr>
            <td>
              I: Bucket &gt; Sugaree, All Over Now, Bird Song, El Paso, Don't Ease
            </td>
          </tr>
          <tr>
            <td>
              II: Iko Iko, L. L. Rain, He's Gone &gt; Spoonful* &gt; Drumz &gt; Wheel &gt; Black Peter &gt; Throwing Stones &gt; NFA
            </td>
          </tr>
          <tr>
            <td>
              E: U. S. Blues
            </td>
          </tr>
          <tr>
            <td>
              *without Jerry.
            </td>
          </tr>
        </table>
      </div>
      <div>
        <table border="0" cellspacing="0" cellpadding="0">
          <tr>
            <td id="0907">
              <a href="/1985-09-07">9/7/1985 Red Rocks Amphitheatre, Morrison, CO</a> [<a href="http://www.archive.org/search.php?query=creator:%22Grateful%20Dead%22%20date:1985-09-07*">Listen/Download</a>]
            </td>
          </tr>
          <tr>
            <td>
              I: Frozen Logger, Half Step &gt; Minglewood, B. E. Women, Esau, Loser, Dupree's, Saturday Night
            </td>
          </tr>
          <tr>
            <td>
              II: Shakedown &gt; Crazy Fingers &gt; Samson, Uncle John &gt; Playin &gt; Drumz &gt; Mr. Fantasy &gt; Hey Jude Finale &gt; Mr. Fantasy &gt; Truckin &gt; Comes A Time &gt; Lovelight
            </td>
          </tr>
          <tr>
            <td>
              E: Johnny B. Goode &gt; Baby Blue
            </td>
          </tr>
          <tr>
            <td>
              First ''Hey Jude Finale''; Next ''Hey Jude Finale'' 3/17/1988 [161 shows]
            </td>
          </tr>
          <tr>
            <td>
              "Star Spangled Banner" tuning before "Half Step."
            </td>
          </tr>
        </table>
      </div>
      <div>
        <table border="0" cellspacing="0" cellpadding="0">
          <tr>
            <td id="0910">
              <a href="/1985-09-10">9/10/1985 Henry J. Kaiser Convention Center, Oakland, CA</a> [<a href="http://www.archive.org/search.php?query=creator:%22Grateful%20Dead%22%20date:1985-09-10*">Listen/Download</a>]
            </td>
          </tr>
          <tr>
            <td>
              I: Jack Straw &gt; Peggy-O, Rooster, Stagger Lee, Me and My Uncle &gt; Mexicali &gt; Ramble On, Cassidy &gt; Don't Ease
            </td>
          </tr>
          <tr>
            <td>
              II: China Cat &gt; I Know You Rider &gt; Estimated &gt; Eyes &gt; Good Times* &gt; Drumz &gt; China Doll &gt; GDTRFB &gt; Around &gt; Sugar Magnolia
            </td>
          </tr>
          <tr>
            <td>
              E: Day Job
            </td>
          </tr>
          <tr>
            <td>
              Previous ''Good Times'' 6/21/1984 [84 shows]
            </td>
          </tr>
          <tr>
            <td>
              *without Jerry.
            </td>
          </tr>
        </table>
      </div>
      <div>
        <table border="0" cellspacing="0" cellpadding="0">
          <tr>
            <td id="0911">
              <a href="/1985-09-11">9/11/1985 Henry J. Kaiser Convention Center, Oakland, CA</a> [<a href="http://www.archive.org/search.php?query=creator:%22Grateful%20Dead%22%20date:1985-09-11*">Listen/Download</a>]
            </td>
          </tr>
          <tr>
            <td>
              I: Half Step &gt; Minglewood, FOTD, BIODTL &gt; Promised &gt; Tennessee Jed &gt; Let It Grow &gt; Deal
            </td>
          </tr>
          <tr>
            <td>
              II: Touch, Bucket &gt; Terrapin &gt; Woman Smarter &gt; Drumz &gt; Gimme Some Lovin &gt; Stella Blue &gt; Good Lovin
            </td>
          </tr>
          <tr>
            <td>
              E: U. S. Blues
            </td>
          </tr>
          <tr>
            <td>
              Mickey Hart's 42nd birthday. 42 beat "BIODTL."
            </td>
          </tr>
        </table>
      </div>
      <div>
        <table border="0" cellspacing="0" cellpadding="0">
          <tr>
            <td id="0912">
              <a href="/1985-09-12">9/12/1985 Henry J. Kaiser Convention Center, Oakland, CA</a> [<a href="http://www.archive.org/search.php?query=creator:%22Grateful%20Dead%22%20date:1985-09-12*">Listen/Download</a>]
            </td>
          </tr>
          <tr>
            <td>
              I: Greatest &gt; Bertha, All Over Now, Row Jimmy, Esau &gt; Big RxR Blues &gt; L. L. Rain &gt; Might As Well
            </td>
          </tr>
          <tr>
            <td>
              II: Help &gt; Slipknot &gt; Franklin's &gt; Playin &gt; Drumz &gt; Other One &gt; Black Peter &gt; Throwing Stones &gt; NFA
            </td>
          </tr>
          <tr>
            <td>
              E: NFA &gt; Brokedown
            </td>
          </tr>
          <tr>
            <td>
              Next ''Slipknot'' 10/8/1989 [284 shows]
            </td>
          </tr>
        </table>
      </div>
      <div>
        <table border="0" cellspacing="0" cellpadding="0">
          <tr>
            <td id="0915">
              <a href="/1985-09-15">9/15/1985 Devore Field, Southwestern Col., Chula Vista, CA</a> [<a href="http://www.archive.org/search.php?query=creator:%22Grateful%20Dead%22%20date:1985-09-15*">Listen/Download</a>]
            </td>
          </tr>
          <tr>
            <td>
              I: Alabama &gt; Promised, West L. A., Mama Tried &gt; Big River, Dupree's, Smokestack &gt; Deal
            </td>
          </tr>
          <tr>
            <td>
              II: Scarlet &gt; Fire, Samson, She Belongs To Me *, Truckin &gt; Comes A Time &gt; Around &gt; Drumz &gt; U. S. Blues &gt; Satisfaction
            </td>
          </tr>
          <tr>
            <td>
              E: Brokedown
            </td>
          </tr>
          <tr>
            <td>
              "Twilight Zone Theme" tuning before "Scarlet." *appears on "Postcards from the Hanging." Also, shows in Portland, Oregon and Tacoma, Washington were contemplated for sometime in the fall.
            </td>
          </tr>
        </table>
      </div>
      <div>
        <table border="0" cellspacing="0" cellpadding="0">
          <tr>
            <td id="1025">
              <a href="/1985-10-25">10/25/1985 Sportatorium, Pembroke Pines, FL</a> [<a href="http://www.archive.org/search.php?query=creator:%22Grateful%20Dead%22%20date:1985-10-25*">Listen/Download</a>]
            </td>
          </tr>
          <tr>
            <td>
              I: Deal, Rooster, Iko Iko, El Paso, Dire Wolf, All Over Now, Loser, Let It Grow
            </td>
          </tr>
          <tr>
            <td>
              II: Morning Dew, Estimated &gt; Eyes &gt; Drumz &gt; Miracle &gt; Black Peter &gt; Sugar Magnolia
            </td>
          </tr>
          <tr>
            <td>
              E: Baby Blue
            </td>
          </tr>
        </table>
      </div>
      <div>
        <table border="0" cellspacing="0" cellpadding="0">
          <tr>
            <td id="1026">
              <a href="/1985-10-26">10/26/1985 Sun Dome, University of South Florida, Tampa, FL</a> [<a href="http://www.archive.org/search.php?query=creator:%22Grateful%20Dead%22%20date:1985-10-26*">Listen/Download</a>]
            </td>
          </tr>
          <tr>
            <td>
              I: Gimme Some Lovin &gt; Greatest, Dupree's, C. C. Rider, Stagger Lee, Me and My Uncle &gt; Big River, Big RxR Blues, L. L. Rain &gt; Don't Ease
            </td>
          </tr>
          <tr>
            <td>
              II: China Cat &gt; I Know You Rider, Woman Smarter, He's Gone &gt; Don't Need Love* &gt; Drumz &gt; Comes A Time &gt; Throwing Stones &gt; GDTRFB &gt; Saturday Night
            </td>
          </tr>
          <tr>
            <td>
              E: Midnight Hour
            </td>
          </tr>
          <tr>
            <td>
              *without Jerry.
            </td>
          </tr>
        </table>
      </div>
      <div>
        <table border="0" cellspacing="0" cellpadding="0">
          <tr>
            <td id="1028">
              <a href="/1985-10-28">10/28/1985 Fox Theatre, Atlanta, GA</a> [<a href="http://www.archive.org/search.php?query=creator:%22Grateful%20Dead%22%20date:1985-10-28*">Listen/Download</a>]
            </td>
          </tr>
          <tr>
            <td>
              I: Sugaree, Kansas City, Peggy-O, Esau, Ramble On, Cassidy, Row Jimmy, Promised
            </td>
          </tr>
          <tr>
            <td>
              II: Scarlet &gt; Touch, Woman Smarter &gt; Terrapin &gt; Drumz &gt; Truckin &gt; Smokestack &gt; Stella Blue &gt; Around &gt; Good Lovin
            </td>
          </tr>
          <tr>
            <td>
              E: Day Job
            </td>
          </tr>
          <tr>
            <td>
              First ''Kansas City''
            </td>
          </tr>
        </table>
      </div>
      <div>
        <table border="0" cellspacing="0" cellpadding="0">
          <tr>
            <td id="1029">
              <a href="/1985-10-29">10/29/1985 Fox Theatre, Atlanta, GA</a> [<a href="http://www.archive.org/search.php?query=creator:%22Grateful%20Dead%22%20date:1985-10-29*">Listen/Download</a>]
            </td>
          </tr>
          <tr>
            <td>
              I: Stranger, FOTD, Minglewood, Bird Song, Bucket &gt; Deal
            </td>
          </tr>
          <tr>
            <td>
              II: Half Step &gt; Franklin's &gt; Sailor &gt; Saint &gt; Crazy Fingers &gt; Drumz &gt; Wheel &gt; Other One &gt; Wharf Rat &gt; Johnny B. Goode
            </td>
          </tr>
          <tr>
            <td>
              E: Brokedown
            </td>
          </tr>
        </table>
      </div>
      <div>
        <table border="0" cellspacing="0" cellpadding="0">
          <tr>
            <td id="1031">
              <a href="/1985-10-31">10/31/1985 Carolina Coliseum Arena, U. of S.C., Columbia, SC</a> [<a href="http://www.archive.org/search.php?query=creator:%22Grateful%20Dead%22%20date:1985-10-31*">Listen/Download</a>]
            </td>
          </tr>
          <tr>
            <td>
              I: Space &gt; Werewolves &gt; Music, West L. A., Mama Tried &gt; Mexicali, Tennessee Jed, L. L. Rain &gt; Might As Well
            </td>
          </tr>
          <tr>
            <td>
              II: Shakedown &gt; Playin &gt; Ship Of Fools &gt; Playin &gt; Drumz &gt; Mr. Fantasy &gt; NFA
            </td>
          </tr>
          <tr>
            <td>
              E: U. S. Blues
            </td>
          </tr>
          <tr>
            <td>
              Next ''Werewolves'' 10/31/1990 [361 shows]
            </td>
          </tr>
          <tr>
            <td>
              "Funiculi Funicula" segues into first set opening. "Teddy Bear's Picnic" tuning before "West L. A."
            </td>
          </tr>
        </table>
      </div>
      <div>
        <table border="0" cellspacing="0" cellpadding="0">
          <tr>
            <td id="1101">
              <a href="/1985-11-01">11/1/1985 Richmond Coliseum, Richmond, VA</a> [<a href="http://www.archive.org/search.php?query=creator:%22Grateful%20Dead%22%20date:1985-11-01*">Listen/Download</a>]
            </td>
          </tr>
          <tr>
            <td>
              I: Dancin &gt; Cold Rain, Rooster, Stagger Lee, Me and My Uncle &gt; Big River, B. E. Women, Jack Straw &gt; Don't Ease
            </td>
          </tr>
          <tr>
            <td>
              II: Samson, High Time, He's Gone &gt; Spoonful &gt; Comes A Time &gt; Sailor &gt; Drumz &gt; Saint &gt; Gimme Some Lovin &gt; She Belongs To Me &gt; Gloria
            </td>
          </tr>
          <tr>
            <td>
              E: Day Job
            </td>
          </tr>
          <tr>
            <td>
              Next ''Gloria'' 3/23/1992 [468 shows]
            </td>
          </tr>
          <tr>
            <td>
              Entire show appears on "Dicks Picks Volume 21."
            </td>
          </tr>
        </table>
      </div>
      <div>
        <table border="0" cellspacing="0" cellpadding="0">
          <tr>
            <td id="1102">
              <a href="/1985-11-02">11/2/1985 Richmond Coliseum, Richmond, VA</a> [<a href="http://www.archive.org/search.php?query=creator:%22Grateful%20Dead%22%20date:1985-11-02*">Listen/Download</a>]
            </td>
          </tr>
          <tr>
            <td>
              I: Bertha &gt; Greatest, Dupree's, C. C. Rider &gt; Althea, Esau, Candyman, Let It Grow
            </td>
          </tr>
          <tr>
            <td>
              II: Iko Iko, Estimated &gt; Uncle John &gt; China Doll &gt; Drumz &gt; Morning Dew &gt; Throwing Stones &gt; Lovelight
            </td>
          </tr>
          <tr>
            <td>
              E: Baby Blue
            </td>
          </tr>
        </table>
      </div>
      <div>
        <table border="0" cellspacing="0" cellpadding="0">
          <tr>
            <td id="1104">
              <a href="/1985-11-04">11/4/1985 The Centrum, Worcester, MA</a> [<a href="http://www.archive.org/search.php?query=creator:%22Grateful%20Dead%22%20date:1985-11-04*">Listen/Download</a>]
            </td>
          </tr>
          <tr>
            <td>
              I: Alabama &gt; Promised, Roses, El Paso, West L. A., Minglewood, Big RxR Blues, Music &gt; Might As Well
            </td>
          </tr>
          <tr>
            <td>
              II: China Cat &gt; I Know You Rider &gt; Playin &gt; Terrapin &gt; Drumz &gt; Wheel &gt; Truckin &gt; Wharf Rat &gt; Sugar Magnolia
            </td>
          </tr>
          <tr>
            <td>
              E: U. S. Blues
            </td>
          </tr>
        </table>
      </div>
      <div>
        <table border="0" cellspacing="0" cellpadding="0">
          <tr>
            <td id="1105">
              <a href="/1985-11-05">11/5/1985 The Centrum, Worcester, MA</a> [<a href="http://www.archive.org/search.php?query=creator:%22Grateful%20Dead%22%20date:1985-11-05*">Listen/Download</a>]
            </td>
          </tr>
          <tr>
            <td>
              I: Bucket, TLEO, Kansas City, Tennessee Jed &gt; All Over Now, Bird Song &gt; L. L. Rain &gt; Don't Ease
            </td>
          </tr>
          <tr>
            <td>
              II: Shakedown, Woman Smarter, Ship Of Fools, Supplication Jam &gt; Playin Jam &gt; Don't Need Love &gt; Drumz &gt; Tom Thumb Blues &gt; GDTRFB &gt; Black Peter &gt; Around &gt; Good Lovin
            </td>
          </tr>
          <tr>
            <td>
              E: Brokedown
            </td>
          </tr>
          <tr>
            <td>
              Final ''Kansas City''
            </td>
          </tr>
          <tr>
            <td>
              "Happy Birthday" for Bill Walton before "Shakedown."
            </td>
          </tr>
        </table>
      </div>
      <div>
        <table border="0" cellspacing="0" cellpadding="0">
          <tr>
            <td id="1107">
              <a href="/1985-11-07">11/7/1985 Community War Memorial, Rochester, NY</a> [<a href="http://www.archive.org/search.php?query=creator:%22Grateful%20Dead%22%20date:1985-11-07*">Listen/Download</a>]
            </td>
          </tr>
          <tr>
            <td>
              I: Dancin &gt; Dire Wolf, C. C. Rider &gt; Loser, Mama Tried &gt; Mexicali &gt; Cumberland &gt; BIODTL &gt; Deal
            </td>
          </tr>
          <tr>
            <td>
              II: Touch &gt; Samson, High Time, Let It Grow &gt; Drumz &gt; Gimme Some Lovin &gt; Stella Blue &gt; Throwing Stones &gt; NFA
            </td>
          </tr>
          <tr>
            <td>
              E: Midnight Hour
            </td>
          </tr>
        </table>
      </div>
      <div>
        <table border="0" cellspacing="0" cellpadding="0">
          <tr>
            <td id="1108">
              <a href="/1985-11-08">11/8/1985 Community War Memorial, Rochester, NY</a> [<a href="http://www.archive.org/search.php?query=creator:%22Grateful%20Dead%22%20date:1985-11-08*">Listen/Download</a>]
            </td>
          </tr>
          <tr>
            <td>
              I: Iko Iko &gt; Rooster &gt; Peggy-O, Esau, B. E. Women, Baby What You Want &gt; Jack Straw &gt; Might As Well
            </td>
          </tr>
          <tr>
            <td>
              II: Revolution, Estimated &gt; Eyes &gt; Drumz &gt; Other One &gt; Miracle &gt; She Belongs To Me &gt; Sugar Magnolia
            </td>
          </tr>
          <tr>
            <td>
              E: Satisfaction
            </td>
          </tr>
          <tr>
            <td>
              Next ''Revolution'' 3/15/1990 [298 shows]; Final ''Baby What You Want''
            </td>
          </tr>
        </table>
      </div>
      <div>
        <table border="0" cellspacing="0" cellpadding="0">
          <tr>
            <td id="1110">
              <a href="/1985-11-10">11/10/1985 Meadowlands Arena, East Rutherford, NJ</a> [<a href="http://www.archive.org/search.php?query=creator:%22Grateful%20Dead%22%20date:1985-11-10*">Listen/Download</a>]
            </td>
          </tr>
          <tr>
            <td>
              I: Touch &gt; Bucket &gt; Sugaree, Cassidy, Stagger Lee, All Over Now &gt; Row Jimmy &gt; Stranger
            </td>
          </tr>
          <tr>
            <td>
              II: Half Step &gt; I Know You Rider &gt; Playin &gt; Uncle John &gt; Supplication Jam &gt; Drumz &gt; Truckin &gt; Comes A Time &gt; Around &gt; Good Lovin
            </td>
          </tr>
          <tr>
            <td>
              E: Baby Blue
            </td>
          </tr>
        </table>
      </div>
      <div>
        <table border="0" cellspacing="0" cellpadding="0">
          <tr>
            <td id="1111">
              <a href="/1985-11-11">11/11/1985 Meadowlands Arena, East Rutherford, NJ</a> [<a href="http://www.archive.org/search.php?query=creator:%22Grateful%20Dead%22%20date:1985-11-11*">Listen/Download</a>]
            </td>
          </tr>
          <tr>
            <td>
              I: Walking The Dog &gt; Deal, Minglewood, Althea, Me and My Uncle &gt; Big River, Bird Song &gt; L. L. Rain &gt; Don't Ease
            </td>
          </tr>
          <tr>
            <td>
              II: Scarlet &gt; Fire &gt; Estimated &gt; Eyes &gt; Drumz &gt; Mr. Fantasy &gt; GDTRFB &gt; Throwing Stones &gt; Lovelight
            </td>
          </tr>
          <tr>
            <td>
              E: Brokedown
            </td>
          </tr>
        </table>
      </div>
      <div>
        <table border="0" cellspacing="0" cellpadding="0">
          <tr>
            <td id="1116">
              <a href="/1985-11-16">11/16/1985 Long Beach Arena, Long Beach, CA</a> [<a href="http://www.archive.org/search.php?query=creator:%22Grateful%20Dead%22%20date:1985-11-16*">Listen/Download</a>]
            </td>
          </tr>
          <tr>
            <td>
              I: Bucket &gt; Sugaree &gt; El Paso, Dupree's, Rooster, West L. A., Let It Grow
            </td>
          </tr>
          <tr>
            <td>
              II: Tennessee Jed, Cumberland, Miracle &gt; Crazy Fingers &gt; Drumz &gt; Comes A Time &gt; Gimme Some Lovin &gt; Truckin &gt; Black Peter &gt; Good Lovin
            </td>
          </tr>
          <tr>
            <td>
              E: Day Job
            </td>
          </tr>
        </table>
      </div>
      <div>
        <table border="0" cellspacing="0" cellpadding="0">
          <tr>
            <td id="1117">
              <a href="/1985-11-17">11/17/1985 Long Beach Arena, Long Beach, CA</a> [<a href="http://www.archive.org/search.php?query=creator:%22Grateful%20Dead%22%20date:1985-11-17*">Listen/Download</a>]
            </td>
          </tr>
          <tr>
            <td>
              I: Half Step, Minglewood, Stagger Lee, All Over Now &gt; FOTD, Cassidy, Big RxR Blues, L. L. Rain &gt; Might As Well
            </td>
          </tr>
          <tr>
            <td>
              II: China Cat &gt; I Know You Rider, Samson &gt; He's Gone &gt; Spoonful &gt; Good Times* &gt; Drumz &gt; Wheel &gt; Throwing Stones &gt; NFA
            </td>
          </tr>
          <tr>
            <td>
              E: Baby Blue
            </td>
          </tr>
          <tr>
            <td>
              *without Jerry.
            </td>
          </tr>
        </table>
      </div>
      <div>
        <table border="0" cellspacing="0" cellpadding="0">
          <tr>
            <td id="1120">
              <a href="/1985-11-20">11/20/1985 Henry J. Kaiser Convention Center, Oakland, CA</a> [<a href="http://www.archive.org/search.php?query=creator:%22Grateful%20Dead%22%20date:1985-11-20*">Listen/Download</a>]
            </td>
          </tr>
          <tr>
            <td>
              I: Jack Straw &gt; Peggy-O, C. C. Rider, Stagger Lee, Esau, High Time, BIODTL &gt; Promised &gt; Don't Ease
            </td>
          </tr>
          <tr>
            <td>
              II: Iko Iko &gt; Sailor &gt; Saint &gt; Terrapin &gt; Don't Need Love &gt; Drumz &gt; Stella Blue &gt; Sugar Magnolia
            </td>
          </tr>
          <tr>
            <td>
              E: U. S. Blues
            </td>
          </tr>
        </table>
      </div>
      <div>
        <table border="0" cellspacing="0" cellpadding="0">
          <tr>
            <td id="1121">
              <a href="/1985-11-21">11/21/1985 Henry J. Kaiser Convention Center, Oakland, CA</a> [<a href="http://www.archive.org/search.php?query=creator:%22Grateful%20Dead%22%20date:1985-11-21*">Listen/Download</a>]
            </td>
          </tr>
          <tr>
            <td>
              I: Big Boy Pete, Dire Wolf, Rooster, B. E. Women, Me and My Uncle &gt; Mexicali, Ramble On &gt; L. L. Rain &gt; Might As Well
            </td>
          </tr>
          <tr>
            <td>
              II: Shakedown &gt; Crazy Fingers &gt; Playin &gt; She Belongs To Me &gt; Drumz &gt; Other One &gt; Wharf Rat &gt; Playin &gt; Gimme Some Lovin &gt; Midnight Hour
            </td>
          </tr>
          <tr>
            <td>
              E: Walking The Dog
            </td>
          </tr>
          <tr>
            <td>
              Previous ''Big Boy Pete'' 9/20/1970 [1007 shows]; Final ''Big Boy Pete''; Final ''She Belongs To Me''; Final ''Walking The Dog''
            </td>
          </tr>
        </table>
      </div>
      <div>
        <table border="0" cellspacing="0" cellpadding="0">
          <tr>
            <td id="1122">
              <a href="/1985-11-22">11/22/1985 Henry J. Kaiser Convention Center, Oakland, CA</a> [<a href="http://www.archive.org/search.php?query=creator:%22Grateful%20Dead%22%20date:1985-11-22*">Listen/Download</a>]
            </td>
          </tr>
          <tr>
            <td>
              I: Bucket &gt; Sugaree, Minglewood &gt; Althea, Cassidy &gt; Dupree's &gt; Let It Grow
            </td>
          </tr>
          <tr>
            <td>
              II: Touch &gt; Estimated &gt; Eyes &gt; Drumz &gt; Morning Dew &gt; Throwing Stones &gt; Lovelight
            </td>
          </tr>
          <tr>
            <td>
              E: Brokedown
            </td>
          </tr>
        </table>
      </div>
      <div>
        <table border="0" cellspacing="0" cellpadding="0">
          <tr>
            <td id="1127">
              <a href="/1985-11-27">11/27/1985 Fillmore Auditorium, San Francisco, CA</a> [<a href="http://www.archive.org/search.php?query=creator:%22Grateful%20Dead%22%20date:1985-11-27*">Listen/Download</a>]
            </td>
          </tr>
          <tr>
            <td></td>
          </tr>
          <tr>
            <td>
              All members of the Grateful Dead were present at the Fillmore for Bill Graham's 20th anniversary party and equipment was brought for a set, but the band did not perform. One explanation making the rounds afterward claimed that the Dead wanted to play at 10PM but Graham had planned for them to close the evening.
            </td>
          </tr>
        </table>
      </div>
      <div>
        <table border="0" cellspacing="0" cellpadding="0">
          <tr>
            <td id="1229">
              <a href="/1985-12-29">12/29/1985 Oakland Coliseum Arena, Oakland, CA</a> [<a href="http://www.archive.org/search.php?query=creator:%22Grateful%20Dead%22%20date:1985-12-29*">Listen/Download</a>]
            </td>
          </tr>
          <tr>
            <td></td>
          </tr>
          <tr>
            <td>
              Tickets were actually printed for this show, which began circulating among the fans a few months later.
            </td>
          </tr>
        </table>
      </div>
      <div>
        <table border="0" cellspacing="0" cellpadding="0">
          <tr>
            <td id="1230">
              <a href="/1985-12-30">12/30/1985 Oakland Coliseum Arena, Oakland, CA</a> [<a href="http://www.archive.org/search.php?query=creator:%22Grateful%20Dead%22%20date:1985-12-30*">Listen/Download</a>]
            </td>
          </tr>
          <tr>
            <td>
              I: Gimme Some Lovin &gt; Greatest, West L. A., Esau &gt; Stagger Lee, Rooster, Tennessee Jed &gt; L. L. Rain &gt; Don't Ease
            </td>
          </tr>
          <tr>
            <td>
              II: Mighty Quinn + &gt; Samson, He's Gone &gt; Miracle &gt; Crazy Fingers &gt; Drumz &gt; Other One &gt; Wharf Rat &gt; Sugar Magnolia
            </td>
          </tr>
          <tr>
            <td>
              E: Baby Blue
            </td>
          </tr>
          <tr>
            <td>
              First ''Mighty Quinn''
            </td>
          </tr>
          <tr>
            <td>
              Soundcheck: "Mighty Quinn" (x3), "Watchtower" (x2))*. +appears on the "Postcards from the Hanging" bonus disc.
            </td>
          </tr>
        </table>
      </div>
      <div>
        <table border="0" cellspacing="0" cellpadding="0">
          <tr>
            <td id="1231">
              <a href="/1985-12-31">12/31/1985 Oakland Coliseum Arena, Oakland, CA</a> [<a href="http://www.archive.org/search.php?query=creator:%22Grateful%20Dead%22%20date:1985-12-31*">Listen/Download</a>]
            </td>
          </tr>
          <tr>
            <td>
              I: NFA &gt; Touch, Tons Of Steel, C. C. Rider, Dupree's, Cassidy &gt; B. E. Women, Let It Grow
            </td>
          </tr>
          <tr>
            <td>
              II: Midnight Hour &gt; Sugaree, Woman Smarter, Ship Of Fools, Playin &gt; Terrapin &gt; Drumz &gt; Truckin &gt; Black Peter &gt; Throwing Stones* &gt; NFA
            </td>
          </tr>
          <tr>
            <td>
              E1: NFA* &gt; Lovelight*
            </td>
          </tr>
          <tr>
            <td>
              E2: Brokedown
            </td>
          </tr>
          <tr>
            <td>
              Bill Graham rides in at midnight on a giant birthday cake. FM broadcast KFOG-San Francisco - national radio broadcast - national TV broadcast. The Neville Brothers, then Baba Olatunji opened. *with Baba Olatunji.
            </td>
          </tr>
        </table>
      </div>
    </div>
  </body>
</html>
