<!DOCTYPE HTML PUBLIC "-//W3C//DTD HTML 4.01 Transitional//EN"
"http://www.w3.org/TR/html4/loose.dtd">
<html>
  <head>
    <meta http-equiv="Content-Type" content="text/html; charset=utf-8">
    <title>
      1970 Setlists
    </title>
  </head>
  <body>
    <div id="main">
      <div>
        1970 Setlists
      </div><script language="Javascript" type="text/javascript">
<!--
      function showtab () {
      document.getElementById('hide').style.display = 'none';
      document.getElementById('show').style.display = 'block';
      }
      function hidetab () {
      document.getElementById('show').style.display = 'none';
      document.getElementById('hide').style.display = 'block';
      }
      -->
      </script>
      <p>
        January: <a href="#0102">2</a> <a href="#0102">2</a> <a href="#0103">3</a> <a href="#0103">3</a> <a href="#0110">10</a> <a href="#0116">16</a> <a href="#0117">17</a> <a href="#0118">18</a> <a href="#0122">22</a> <a href="#0123">23</a> <a href="#0124">24</a> <a href="#0125">25</a> <a href="#0126">26</a> <a href="#0130">30</a> <a href="#0131">31</a>
        <br>
        February: <a href="#0201">1</a> <a href="#0201">1</a> <a href="#0202">2</a> <a href="#0204">4</a> <a href="#0205">5</a> <a href="#0206">6</a> <a href="#0207">7</a> <a href="#0208">8</a> <a href="#0211">11</a> <a href="#0211">11</a> <a href="#0212">12</a> <a href="#0213">13</a> <a href="#0213">13</a> <a href="#0214">14</a> <a href="#0214">14</a> <a href="#0220">20</a> <a href="#0221">21</a> <a href="#0222">22</a> <a href="#0223">23</a> <a href="#0227">27</a> <a href="#0228">28</a> <a href="#02xx">xx</a> <a href="#02xx">xx</a>
        <br>
        March: <a href="#0301">1</a> <a href="#0307">7</a> <a href="#0308">8</a> <a href="#0316">16</a> <a href="#0317">17</a> <a href="#0318">18</a> <a href="#0320">20</a> <a href="#0320">20</a> <a href="#0321">21</a> <a href="#0321">21</a> <a href="#0324">24</a>
        <br>
        April: <a href="#0403">3</a> <a href="#0409">9</a> <a href="#0410">10</a> <a href="#0411">11</a> <a href="#0412">12</a> <a href="#0415">15</a> <a href="#0417">17</a> <a href="#0418">18</a> <a href="#0419">19</a> <a href="#0424">24</a> <a href="#0425">25</a> <a href="#0426">26</a> <a href="#04xx">xx</a>
        <br>
        May: <a href="#0501">1</a> <a href="#0502">2</a> <a href="#0503">3</a> <a href="#0506">6</a> <a href="#0507">7</a> <a href="#0508">8</a> <a href="#0509">9</a> <a href="#0510">10</a> <a href="#0514">14</a> <a href="#0515">15</a> <a href="#0515">15</a> <a href="#0516">16</a> <a href="#0517">17</a> <a href="#0519">19</a> <a href="#0521">21</a> <a href="#0524">24</a> <a href="#0525">25</a>
        <br>
        June: <a href="#0604">4</a> <a href="#0605">5</a> <a href="#0606">6</a> <a href="#0607">7</a> <a href="#0612">12</a> <a href="#0613">13</a> <a href="#0619">19</a> <a href="#0621">21</a> <a href="#0624">24</a> <a href="#0624">24</a> <a href="#0627">27</a> <a href="#0627">27</a> <a href="#0628">28</a>
        <br>
        July: <a href="#0701">1</a> <a href="#0703">3</a> <a href="#0708">8</a> <a href="#0709">9</a> <a href="#0710">10</a> <a href="#0711">11</a> <a href="#0712">12</a> <a href="#0714">14</a> <a href="#0716">16</a> <a href="#0730">30</a> <a href="#07xx">xx</a>
        <br>
        August: <a href="#0804">4</a> <a href="#0805">5</a> <a href="#0806">6</a> <a href="#0809">9</a> <a href="#0811">11</a> <a href="#0814">14</a> <a href="#0817">17</a> <a href="#0818">18</a> <a href="#0819">19</a> <a href="#0820">20</a> <a href="#0828">28</a> <a href="#0829">29</a> <a href="#0830">30</a> <a href="#08xx">xx</a>
        <br>
        September: <a href="#0917">17</a> <a href="#0918">18</a> <a href="#0919">19</a> <a href="#0920">20</a> <a href="#0925">25</a> <a href="#0926">26</a>
        <br>
        October: <a href="#1003">3</a> <a href="#1004">4</a> <a href="#1005">5</a> <a href="#1010">10</a> <a href="#1010">10</a> <a href="#1011">11</a> <a href="#1016">16</a> <a href="#1017">17</a> <a href="#1018">18</a> <a href="#1018">18</a> <a href="#1023">23</a> <a href="#1024">24</a> <a href="#1027">27</a> <a href="#1030">30</a> <a href="#1030">30</a> <a href="#1031">31</a> <a href="#1031">31</a>
        <br>
        November: <a href="#1105">5</a> <a href="#1106">6</a> <a href="#1107">7</a> <a href="#1108">8</a> <a href="#1109">9</a> <a href="#1110">10</a> <a href="#1111">11</a> <a href="#1112">12</a> <a href="#1113">13</a> <a href="#1114">14</a> <a href="#1115">15</a> <a href="#1116">16</a> <a href="#1120">20</a> <a href="#1121">21</a> <a href="#1121">21</a> <a href="#1122">22</a> <a href="#1123">23</a> <a href="#1127">27</a> <a href="#1129">29</a>
        <br>
        December: <a href="#1212">12</a> <a href="#1215">15</a> <a href="#1216">16</a> <a href="#1217">17</a> <a href="#1221">21</a> <a href="#1222">22</a> <a href="#1223">23</a> <a href="#1224">24</a> <a href="#1226">26</a> <a href="#1227">27</a> <a href="#1227">27</a> <a href="#1228">28</a> <a href="#1231">31</a>
      </p>
      <div>
        <table border="0" cellspacing="0" cellpadding="0">
          <tr>
            <td id="0102">
              <a href="/1970-01-02">1/2/1970 Fillmore East, New York, NY</a> [<a href="http://www.archive.org/search.php?query=creator:%22Grateful%20Dead%22%20date:1970-01-02*">Listen/Download</a>]
            </td>
          </tr>
          <tr>
            <td>
              Mason's Children *, Casey Jones, Black Peter, Mama Tried, Hard To Handle, Cumberland, Cryptical &gt; Drums &gt; Other One &gt; Cryptical &gt; Cosmic Charlie
            </td>
          </tr>
          <tr>
            <td>
              Early show. Billing: GD; Lighthouse; Cold Blood. "2001 Theme" was played over the PA before "Mason's Children." *appears on "Fallout From The Phil Zone"
            </td>
          </tr>
        </table>
      </div>
      <div>
        <table border="0" cellspacing="0" cellpadding="0">
          <tr>
            <td id="0102">
              <a href="/1970-01-02">1/2/1970 Fillmore East, New York, NY</a> [<a href="http://www.archive.org/search.php?query=creator:%22Grateful%20Dead%22%20date:1970-01-02*">Listen/Download</a>]
            </td>
          </tr>
          <tr>
            <td>
              Uncle John, High Time, Dire Wolf, Easy Wind, China Cat &gt; I Know You Rider, Good Lovin &gt; Drums &gt; Good Lovin, Cold Rain, Me and My Uncle, Monkey and Engineer, Dark Star &gt; St. Stephen &gt; The Eleven &gt; Lovelight
            </td>
          </tr>
          <tr>
            <td>
              Late show. Billing: GD; Lighthouse; Cold Blood. "2001 Theme" was played over the PA before "Uncle John."
            </td>
          </tr>
        </table>
      </div>
      <div>
        <table border="0" cellspacing="0" cellpadding="0">
          <tr>
            <td id="0103">
              <a href="/1970-01-03">1/3/1970 Fillmore East, New York, NY</a> [<a href="http://www.archive.org/search.php?query=creator:%22Grateful%20Dead%22%20date:1970-01-03*">Listen/Download</a>]
            </td>
          </tr>
          <tr>
            <td>
              Morning Dew, Me and My Uncle, Hard To Handle, Cumberland, Cold Rain, Alligator &gt; Drums &gt; Alligator &gt; Feedback
            </td>
          </tr>
          <tr>
            <td>
              E: Uncle John
            </td>
          </tr>
          <tr>
            <td>
              Early show. Billing: GD; Lighthouse; Cold Blood.
            </td>
          </tr>
        </table>
      </div>
      <div>
        <table border="0" cellspacing="0" cellpadding="0">
          <tr>
            <td id="0103">
              <a href="/1970-01-03">1/3/1970 Fillmore East, New York, NY</a> [<a href="http://www.archive.org/search.php?query=creator:%22Grateful%20Dead%22%20date:1970-01-03*">Listen/Download</a>]
            </td>
          </tr>
          <tr>
            <td>
              Casey Jones, Mama Tried, Big Boss Man, China Cat &gt; I Know You Rider, Mason's Children, Cryptical &gt; Drums &gt; Other One &gt; Cryptical &gt; Cosmic Charlie, Uncle John &gt; Black Peter, Dire Wolf, Good Lovin &gt; Drums &gt; Good Lovin, Dancin
            </td>
          </tr>
          <tr>
            <td>
              E: St. Stephen &gt; Midnight Hour
            </td>
          </tr>
          <tr>
            <td>
              Late show. Billing: GD; Lighthouse; Cold Blood.
            </td>
          </tr>
        </table>
      </div>
      <div>
        <table border="0" cellspacing="0" cellpadding="0">
          <tr>
            <td id="0110">
              <a href="/1970-01-10">1/10/1970 Golden Hall, Community Concourse, San Diego, CA</a> [<a href="http://www.archive.org/search.php?query=creator:%22Grateful%20Dead%22%20date:1970-01-10*">Listen/Download</a>]
            </td>
          </tr>
          <tr>
            <td>
              China Cat &gt; I Know You Rider, Me and My Uncle, Dire Wolf, Hard To Handle, Casey Jones, Mason's Children &gt; Black Peter *, Good Lovin &gt; Drums &gt; Good Lovin, Cold Rain, Lovelight
            </td>
          </tr>
          <tr>
            <td>
              Also: Savoy Brown; Aum. *appears as a "Workingman�s Dead" bonus track in "The Golden Road (1965-1973)." the 08-05-70 acoustic sets from the same vanue have sometimes been grafted onto the beginning of this recording.
            </td>
          </tr>
        </table>
      </div>
      <div>
        <table border="0" cellspacing="0" cellpadding="0">
          <tr>
            <td id="0116">
              <a href="/1970-01-16">1/16/1970 Springer's Inn, Portland, OR</a> [<a href="http://www.archive.org/search.php?query=creator:%22Grateful%20Dead%22%20date:1970-01-16*">Listen/Download</a>]
            </td>
          </tr>
          <tr>
            <td>
              I: Casey Jones, Mama Tried, Black Peter, Hard To Handle, China Cat &gt; I Know You Rider, High Time, Good Lovin &gt; Drums &gt; Good Lovin,
            </td>
          </tr>
          <tr>
            <td>
              II: Dancin, Alligator &gt; Drums &gt; The Eleven Jam &gt; Death Don't, Cumberland, Me and My Uncle &gt; Dire Wolf, Uncle John, Easy Wind *, Cryptical &gt; Drums &gt; Other One &gt; Cryptical &gt; Cosmic Charlie
            </td>
          </tr>
          <tr>
            <td>
              Also: River. *appears as a "Workingman�s Dead" bonus track in "The Golden Road (1965-1973.)"
            </td>
          </tr>
        </table>
      </div>
      <div>
        <table border="0" cellspacing="0" cellpadding="0">
          <tr>
            <td id="0117">
              <a href="/1970-01-17">1/17/1970 Oregon State University, Corvallis, OR</a> [<a href="http://www.archive.org/search.php?query=creator:%22Grateful%20Dead%22%20date:1970-01-17*">Listen/Download</a>]
            </td>
          </tr>
          <tr>
            <td>
              Dire Wolf, China Cat &gt; I Know You Rider, Hard To Handle, Cumberland *, Me and My Uncle, Black Peter, Good Lovin &gt; Drums &gt; Good Lovin, Mason's Children &gt; High Time, Dark Star &gt; St. Stephen &gt; The Eleven &gt; Lovelight
            </td>
          </tr>
          <tr>
            <td>
              Venue might be Gill Coliseum. *appears as a "Workingman�s Dead" bonus track in "The Golden Road (1965-1973)."
            </td>
          </tr>
        </table>
      </div>
      <div>
        <table border="0" cellspacing="0" cellpadding="0">
          <tr>
            <td id="0118">
              <a href="/1970-01-18">1/18/1970 Springer's Inn, Portland, OR</a> [<a href="http://www.archive.org/search.php?query=creator:%22Grateful%20Dead%22%20date:1970-01-18*">Listen/Download</a>]
            </td>
          </tr>
          <tr>
            <td>
              Mama Tried, Cold Rain, Big Boss Man, Mason's Children, Black Peter, Dancin, Me and My Uncle, Good Lovin &gt; Drums &gt; Good Lovin, China Cat &gt; I Know You Rider, Lovelight
            </td>
          </tr>
          <tr>
            <td>
              Entire show except "Mama Tried" and "Me and My Uncle" released as "Grateful Dead Download Series Volume 2."
            </td>
          </tr>
        </table>
      </div>
      <div>
        <table border="0" cellspacing="0" cellpadding="0">
          <tr>
            <td id="0122">
              <a href="/1970-01-22">1/22/1970 Honolulu Civic Auditorium, Honolulu, HI</a> [<a href="http://www.archive.org/search.php?query=creator:%22Grateful%20Dead%22%20date:1970-01-22*">Listen/Download</a>]
            </td>
          </tr>
          <tr>
            <td></td>
          </tr>
          <tr>
            <td>
              Also: Jefferson Airplane.
            </td>
          </tr>
        </table>
      </div>
      <div>
        <table border="0" cellspacing="0" cellpadding="0">
          <tr>
            <td id="0123">
              <a href="/1970-01-23">1/23/1970 Honolulu Civic Auditorium, Honolulu, HI</a> [<a href="http://www.archive.org/search.php?query=creator:%22Grateful%20Dead%22%20date:1970-01-23*">Listen/Download</a>]
            </td>
          </tr>
          <tr>
            <td>
              China Cat &gt; I Know You Rider &gt; Black Peter, Hard To Handle, Mama Tried, Dire Wolf, Good Lovin &gt; Drums &gt; Good Lovin, Cryptical &gt; Drums &gt; Other One &gt; Dark Star &gt; St. Stephen &gt; Lovelight
            </td>
          </tr>
          <tr>
            <td>
              Also: Jefferson Airplane.
            </td>
          </tr>
        </table>
      </div>
      <div>
        <table border="0" cellspacing="0" cellpadding="0">
          <tr>
            <td id="0124">
              <a href="/1970-01-24">1/24/1970 Honolulu Civic Auditorium, Honolulu, HI</a> [<a href="http://www.archive.org/search.php?query=creator:%22Grateful%20Dead%22%20date:1970-01-24*">Listen/Download</a>]
            </td>
          </tr>
          <tr>
            <td>
              Cumberland, Cold Rain, Me and My Uncle, King Bee, Mason's Children *, Black Peter, Good Lovin &gt; Drums &gt; Good Lovin, Dancin
            </td>
          </tr>
          <tr>
            <td>
              Also: Jefferson Airplane. *appears as a "Workingman�s Dead" bonus track in "The Golden Road (1965-1973)." ; The Grateful Dead's 500th Show; Jerry Garcia's 500th Show; Bob Weir's 500th Show; Ron McKernan's 500th Show; Tom Constanten's Last Show
            </td>
          </tr>
        </table>
      </div>
      <div>
        <table border="0" cellspacing="0" cellpadding="0">
          <tr>
            <td id="0125">
              <a href="/1970-01-25">1/25/1970 Honolulu Civic Auditorium, Honolulu, HI</a> [<a href="http://www.archive.org/search.php?query=creator:%22Grateful%20Dead%22%20date:1970-01-25*">Listen/Download</a>]
            </td>
          </tr>
          <tr>
            <td></td>
          </tr>
        </table>
      </div>
      <div>
        <table border="0" cellspacing="0" cellpadding="0">
          <tr>
            <td id="0126">
              <a href="/1970-01-26">1/26/1970 Honolulu Civic Auditorium, Honolulu, HI</a> [<a href="http://www.archive.org/search.php?query=creator:%22Grateful%20Dead%22%20date:1970-01-26*">Listen/Download</a>]
            </td>
          </tr>
          <tr>
            <td></td>
          </tr>
        </table>
      </div>
      <div>
        <table border="0" cellspacing="0" cellpadding="0">
          <tr>
            <td id="0130">
              <a href="/1970-01-30">1/30/1970 The Warehouse, New Orleans, LA</a> [<a href="http://www.archive.org/search.php?query=creator:%22Grateful%20Dead%22%20date:1970-01-30*">Listen/Download</a>]
            </td>
          </tr>
          <tr>
            <td>
              Casey Jones, Me and My Uncle, Black Peter, Hard To Handle, China Cat &gt; I Know You Rider &gt; High Time, Cumberland, Easy Wind, Mama Tried, Good Lovin &gt; Drums &gt; Good Lovin, Cryptical &gt; Drums &gt; Other One &gt; Cryptical &gt; Cosmic Charlie
            </td>
          </tr>
          <tr>
            <td>
              Also: The Flock; Fleetwood Mac. Tom Constanten's last show. ; Bill Kreutzmann's 500th Show
            </td>
          </tr>
        </table>
      </div>
      <div>
        <table border="0" cellspacing="0" cellpadding="0">
          <tr>
            <td id="0131">
              <a href="/1970-01-31">1/31/1970 The Warehouse, New Orleans, LA</a> [<a href="http://www.archive.org/search.php?query=creator:%22Grateful%20Dead%22%20date:1970-01-31*">Listen/Download</a>]
            </td>
          </tr>
          <tr>
            <td>
              I: Cold Rain, Mama Tried, Dire Wolf, Big Boss Man, Morning Dew, Mason's Children, Me and My Uncle, Hard To Handle
            </td>
          </tr>
          <tr>
            <td>
              II: Long Black Limousine@, Seasons@, Saw Mill@, Old Old House@, Race Is On@, Black Peter@, Sadie@, All Around This World@, Katie Mae@, Cumberland@
            </td>
          </tr>
          <tr>
            <td>
              Only ''Bound In Memories''; First ''Katie Mae''; First ''Saw Mill''
            </td>
          </tr>
          <tr>
            <td>
              Also: The Flock; Fleetwood Mac. Acoustic set prompted by equipment problems.
            </td>
          </tr>
        </table>
      </div>
      <div>
        <table border="0" cellspacing="0" cellpadding="0">
          <tr>
            <td id="0201">
              <a href="/1970-02-01">2/1/1970 The Warehouse, New Orleans, LA</a> [<a href="http://www.archive.org/search.php?query=creator:%22Grateful%20Dead%22%20date:1970-02-01*">Listen/Download</a>]
            </td>
          </tr>
          <tr>
            <td>
              BIODTL, China Cat &gt; I Know You Rider, Black Peter, Cumberland, Good Lovin &gt; Drums &gt; Good Lovin, Me and My Uncle, Cold Rain &gt; High Time, Dire Wolf, Cryptical &gt; Drums &gt; Other One &gt; Lovelight *
            </td>
          </tr>
          <tr>
            <td>
              Bust fund benefit. *with Peter Green.; Phil Lesh's 500th Show
            </td>
          </tr>
        </table>
      </div>
      <div>
        <table border="0" cellspacing="0" cellpadding="0">
          <tr>
            <td id="0201">
              <a href="/1970-02-01">2/1/1970 Fox Theatre, St. Louis, MO</a> [<a href="http://www.archive.org/search.php?query=creator:%22Grateful%20Dead%22%20date:1970-02-01*">Listen/Download</a>]
            </td>
          </tr>
          <tr>
            <td></td>
          </tr>
          <tr>
            <td>
              The Dead played a bust fund benefit at the Warehouse in New Orleans instead.
            </td>
          </tr>
        </table>
      </div>
      <div>
        <table border="0" cellspacing="0" cellpadding="0">
          <tr>
            <td id="0202">
              <a href="/1970-02-02">2/2/1970 Fox Theatre, St. Louis, MO</a> [<a href="http://www.archive.org/search.php?query=creator:%22Grateful%20Dead%22%20date:1970-02-02*">Listen/Download</a>]
            </td>
          </tr>
          <tr>
            <td>
              Cumberland, Dark Star &gt; St. Stephen &gt; Mason's Children, Lovelight
            </td>
          </tr>
          <tr>
            <td>
              09-20-70 has been known to circulate under this date.
            </td>
          </tr>
        </table>
      </div>
      <div>
        <table border="0" cellspacing="0" cellpadding="0">
          <tr>
            <td id="0204">
              <a href="/1970-02-04">2/4/1970 Family Dog at the Great Highway, San Francisco, CA</a> [<a href="http://www.archive.org/search.php?query=creator:%22Grateful%20Dead%22%20date:1970-02-04*">Listen/Download</a>]
            </td>
          </tr>
          <tr>
            <td>
              Cold Rain, Hard To Handle *, Black Peter, Me and My Uncle, China Cat * &gt; I Know You Rider *, St. Stephen &gt; NFA &gt; St. Stephen &gt; Midnight Hour
            </td>
          </tr>
          <tr>
            <td>
              *filmed for PBS, broadcast 12-13-70, and appears in the "Night at the Family Dog" DVD. Entire set except Cold Rain and Snow released as "Grateful Dead Download Series: Family Dog at the Great Highway."
            </td>
          </tr>
        </table>
      </div>
      <div>
        <table border="0" cellspacing="0" cellpadding="0">
          <tr>
            <td id="0205">
              <a href="/1970-02-05">2/5/1970 Fillmore West, San Francisco, CA</a> [<a href="http://www.archive.org/search.php?query=creator:%22Grateful%20Dead%22%20date:1970-02-05*">Listen/Download</a>]
            </td>
          </tr>
          <tr>
            <td>
              Seasons, Race is On, Big Boss Man *, Black Peter, Mason�s Children, The Eleven &gt; Jam &gt; Caution &gt; Not Fade Away &gt; Cumberland, Uncle John
            </td>
          </tr>
          <tr>
            <td>
              Billing: GD; Taj Mahal; Bigfoot. *appears as a "Bear�s Choice" bonus track in "The Golden Road (1965-1973)."
            </td>
          </tr>
        </table>
      </div>
      <div>
        <table border="0" cellspacing="0" cellpadding="0">
          <tr>
            <td id="0206">
              <a href="/1970-02-06">2/6/1970 Fillmore West, San Francisco, CA</a> [<a href="http://www.archive.org/search.php?query=creator:%22Grateful%20Dead%22%20date:1970-02-06*">Listen/Download</a>]
            </td>
          </tr>
          <tr>
            <td>
              Cumberland, Cold Rain, Dire Wolf, Me and My Uncle, Hard To Handle, Dancin, Casey Jones, Mama Tried, Good Lovin &gt; Drums &gt; Good Lovin &gt; High Time, Cryptical &gt; Drums &gt; Other One &gt; Cryptical &gt; Black Peter, Lovelight
            </td>
          </tr>
          <tr>
            <td>
              Billing: GD; Taj Mahal; Bigfoot.
            </td>
          </tr>
        </table>
      </div>
      <div>
        <table border="0" cellspacing="0" cellpadding="0">
          <tr>
            <td id="0207">
              <a href="/1970-02-07">2/7/1970 Fillmore West, San Francisco, CA</a> [<a href="http://www.archive.org/search.php?query=creator:%22Grateful%20Dead%22%20date:1970-02-07*">Listen/Download</a>]
            </td>
          </tr>
          <tr>
            <td>
              I: Green Green Grass *, Saw Mill *, Seasons*
            </td>
          </tr>
          <tr>
            <td>
              II: China Cat &gt; I Know You Rider &gt; High Time, Big Boss Man, Me and My Uncle, Hard To Handle, Cold Rain, Uncle John &gt; Black Peter, Good Lovin &gt; Drums &gt; Good Lovin
            </td>
          </tr>
          <tr>
            <td>
              Previous ''Green Green Grass'' 7/12/1969 [72 shows]; Final ''Green Green Grass''; Final ''Seasons''
            </td>
          </tr>
          <tr>
            <td>
              Billing: GD; Taj Mahal; Bigfoot. *with NRPS.
            </td>
          </tr>
        </table>
      </div>
      <div>
        <table border="0" cellspacing="0" cellpadding="0">
          <tr>
            <td id="0208">
              <a href="/1970-02-08">2/8/1970 Fillmore West, San Francisco, CA</a> [<a href="http://www.archive.org/search.php?query=creator:%22Grateful%20Dead%22%20date:1970-02-08*">Listen/Download</a>]
            </td>
          </tr>
          <tr>
            <td>
              I: Smokestack *, Morning Dew, Dire Wolf, Me and My Uncle, Top Of The World *, China Cat &gt; I Know You Rider, Hurts Me Too
            </td>
          </tr>
          <tr>
            <td>
              II: Dark Star &gt; St. Stephen &gt; NFA &gt; St. Stephen &gt; Lovelight
            </td>
          </tr>
          <tr>
            <td>
              Next ''Top Of The World'' 6/7/1970 [53 shows]
            </td>
          </tr>
          <tr>
            <td>
              Billing: GD; Taj Mahal; Bigfoot. *appears as "Bear�s Choice" bonus track in "The Golden Road (1965-1973)."
            </td>
          </tr>
        </table>
      </div>
      <div>
        <table border="0" cellspacing="0" cellpadding="0">
          <tr>
            <td id="0211">
              <a href="/1970-02-11">2/11/1970 Fillmore East, New York, NY</a> [<a href="http://www.archive.org/search.php?query=creator:%22Grateful%20Dead%22%20date:1970-02-11*">Listen/Download</a>]
            </td>
          </tr>
          <tr>
            <td>
              Uncle John, Cryptical &gt; Drums &gt; Other One &gt; Cryptical &gt; Dire Wolf, Casey Jones
            </td>
          </tr>
          <tr>
            <td>
              8:00 show. Billing: GD; Allman Brothers Band; Love.
            </td>
          </tr>
        </table>
      </div>
      <div>
        <table border="0" cellspacing="0" cellpadding="0">
          <tr>
            <td id="0211">
              <a href="/1970-02-11">2/11/1970 Fillmore East, New York, NY</a> [<a href="http://www.archive.org/search.php?query=creator:%22Grateful%20Dead%22%20date:1970-02-11*">Listen/Download</a>]
            </td>
          </tr>
          <tr>
            <td>
              NFA, Cumberland, Cold Rain, High Time, Me and My Uncle, Dark Star* &gt; Spanish Jam* &gt; Lovelight*
            </td>
          </tr>
          <tr>
            <td>
              E: Uncle John
            </td>
          </tr>
          <tr>
            <td>
              11:30 show. Billing: GD; Allman Brothers Band; Love. *with Duane and Gregg Allman, Peter Green, Mick Fleetwood, Danny Kirwan, and Butch Trucks.
            </td>
          </tr>
        </table>
      </div>
      <div>
        <table border="0" cellspacing="0" cellpadding="0">
          <tr>
            <td id="0212">
              <a href="/1970-02-12">2/12/1970 Ungano's Night Club, New York, NY</a> [<a href="http://www.archive.org/search.php?query=creator:%22Grateful%20Dead%22%20date:1970-02-12*">Listen/Download</a>]
            </td>
          </tr>
          <tr>
            <td></td>
          </tr>
          <tr>
            <td>
              Recordings of the 02-13-70 early show often circulate with this date.
            </td>
          </tr>
        </table>
      </div>
      <div>
        <table border="0" cellspacing="0" cellpadding="0">
          <tr>
            <td id="0213">
              <a href="/1970-02-13">2/13/1970 Fillmore East, New York, NY</a> [<a href="http://www.archive.org/search.php?query=creator:%22Grateful%20Dead%22%20date:1970-02-13*">Listen/Download</a>]
            </td>
          </tr>
          <tr>
            <td>
              Cold Rain, BIODTL, Good Lovin &gt; Drums &gt; Good Lovin *, Mama Tried &gt; Black Peter, Hard To Handle, St. Stephen &gt; NFA, Casey Jones
            </td>
          </tr>
          <tr>
            <td>
              8:00 show. Billing: GD; Allman Brothers Band; Love. *appears as a "Bear�s Choice" bonus track in "The Golden Road (1965-1973)." Recording often circulates as 02-12-70.
            </td>
          </tr>
        </table>
      </div>
      <div>
        <table border="0" cellspacing="0" cellpadding="0">
          <tr>
            <td id="0213">
              <a href="/1970-02-13">2/13/1970 Fillmore East, New York, NY</a> [<a href="http://www.archive.org/search.php?query=creator:%22Grateful%20Dead%22%20date:1970-02-13*">Listen/Download</a>]
            </td>
          </tr>
          <tr>
            <td>
              China Cat &gt; I Know You Rider, Me and My Uncle, Dire Wolf, Smokestack*, Monkey and Engineer@, Sadie@, Wake Up Little Susie*@ &gt; Black Peter*@, Uncle John@, Katie Mae*@, Dark Star+ &gt; Cryptical+ &gt; Drums+ &gt; Other One+ &gt; Cryptical+ &gt; Lovelight+
            </td>
          </tr>
          <tr>
            <td>
              E: We Bid You Goodnight
            </td>
          </tr>
          <tr>
            <td>
              First ''Wake Up Little Susie''; Next ''Smokestack'' 10/30/1970 [91 shows]
            </td>
          </tr>
          <tr>
            <td>
              11:30 show. Billing: GD; Allman Brothers Band; Love. *appears on "Bear's Choice." +appears on "Dick's Picks Vol 4." @acoustic.
            </td>
          </tr>
        </table>
      </div>
      <div>
        <table border="0" cellspacing="0" cellpadding="0">
          <tr>
            <td id="0214">
              <a href="/1970-02-14">2/14/1970 Fillmore East, New York, NY</a> [<a href="http://www.archive.org/search.php?query=creator:%22Grateful%20Dead%22%20date:1970-02-14*">Listen/Download</a>]
            </td>
          </tr>
          <tr>
            <td>
              Cold Rain, Dark Star &gt; St. Stephen &gt; The Eleven &gt; Lovelight
            </td>
          </tr>
          <tr>
            <td>
              8:00 show. Billing: GD; Allman Brothers Band; Love.
            </td>
          </tr>
        </table>
      </div>
      <div>
        <table border="0" cellspacing="0" cellpadding="0">
          <tr>
            <td id="0214">
              <a href="/1970-02-14">2/14/1970 Fillmore East, New York, NY</a> [<a href="http://www.archive.org/search.php?query=creator:%22Grateful%20Dead%22%20date:1970-02-14*">Listen/Download</a>]
            </td>
          </tr>
          <tr>
            <td>
              Casey Jones+, Mama Tried, Hard To Handle*, Monkey and Engineer@, Dark Hollow*@, All Around This World*@, Wake Up Little Susie@ &gt; Black Peter@, Uncle John@, Katie Mae@, Dancin+, China Cat+ &gt; I Know You Rider+ &gt; High Time+, Dire Wolf+, Alligator+ &gt; Drums+ &gt; Me and My Uncle+ &gt; NFA+ &gt; Mason's Children+ &gt; Caution+ &gt; Feedback+ &gt; We Bid You Goodnight+
            </td>
          </tr>
          <tr>
            <td>
              First ''Dark Hollow''; Next ''Dark Hollow'' 7/12/1970 [61 shows]
            </td>
          </tr>
          <tr>
            <td>
              11:30 show. Billing: GD; Allman Brothers Band; Love. *appears on "Bear's Choice." +appears on "Dick's Picks Vol 4." @acoustic.
            </td>
          </tr>
        </table>
      </div>
      <div>
        <table border="0" cellspacing="0" cellpadding="0">
          <tr>
            <td id="0220">
              <a href="/1970-02-20">2/20/1970 Panther Hall, Fort Worth, TX</a> [<a href="http://www.archive.org/search.php?query=creator:%22Grateful%20Dead%22%20date:1970-02-20*">Listen/Download</a>]
            </td>
          </tr>
          <tr>
            <td></td>
          </tr>
          <tr>
            <td>
              "War Over? Peace At Last." Also: QMS.
            </td>
          </tr>
        </table>
      </div>
      <div>
        <table border="0" cellspacing="0" cellpadding="0">
          <tr>
            <td id="0221">
              <a href="/1970-02-21">2/21/1970 San Antonio Civic Center Arena, San Antonio, TX</a> [<a href="http://www.archive.org/search.php?query=creator:%22Grateful%20Dead%22%20date:1970-02-21*">Listen/Download</a>]
            </td>
          </tr>
          <tr>
            <td></td>
          </tr>
        </table>
      </div>
      <div>
        <table border="0" cellspacing="0" cellpadding="0">
          <tr>
            <td id="0222">
              <a href="/1970-02-22">2/22/1970 Sam Houston Coliseum, Houston, TX</a> [<a href="http://www.archive.org/search.php?query=creator:%22Grateful%20Dead%22%20date:1970-02-22*">Listen/Download</a>]
            </td>
          </tr>
          <tr>
            <td>
              Lovelight
            </td>
          </tr>
        </table>
      </div>
      <div>
        <table border="0" cellspacing="0" cellpadding="0">
          <tr>
            <td id="0223">
              <a href="/1970-02-23">2/23/1970 The Auditorium, Austin, TX</a> [<a href="http://www.archive.org/search.php?query=creator:%22Grateful%20Dead%22%20date:1970-02-23*">Listen/Download</a>]
            </td>
          </tr>
          <tr>
            <td>
              China Cat &gt; I Know You Rider, High Time, Dire Wolf, Monkey & Engineer @, Little Sadie @, Me and My Uncle @, Black Peter @, Seasons @, Uncle John @, NFA, Mason�s Children
            </td>
          </tr>
          <tr>
            <td>
              @acoustic.
            </td>
          </tr>
        </table>
      </div>
      <div>
        <table border="0" cellspacing="0" cellpadding="0">
          <tr>
            <td id="0227">
              <a href="/1970-02-27">2/27/1970 Family Dog at the Great Highway, San Francisco, CA</a> [<a href="http://www.archive.org/search.php?query=creator:%22Grateful%20Dead%22%20date:1970-02-27*">Listen/Download</a>]
            </td>
          </tr>
          <tr>
            <td>
              Cold Rain, Mama Tried, Dancin, Easy Wind, Black Peter, Good Lovin &gt; Drums &gt; Good Lovin, China Cat &gt; I Know You Rider &gt; High Time, Hard To Handle, Casey Jones, Cumberland, NFA &gt; Lovelight
            </td>
          </tr>
          <tr>
            <td>
              Also: Commander Cody.
            </td>
          </tr>
        </table>
      </div>
      <div>
        <table border="0" cellspacing="0" cellpadding="0">
          <tr>
            <td id="0228">
              <a href="/1970-02-28">2/28/1970 Family Dog at the Great Highway, San Francisco, CA</a> [<a href="http://www.archive.org/search.php?query=creator:%22Grateful%20Dead%22%20date:1970-02-28*">Listen/Download</a>]
            </td>
          </tr>
          <tr>
            <td>
              Lovelight &gt; Me and My Uncle, Cumberland, Monkey & Engineer @, Little Sadie @ &gt; Black Peter @, China Cat &gt; I Know You Rider, High Time &gt; Dire Wolf, Good Lovin &gt; Drums &gt; Good Lovin, Big Boss Man, Casey Jones, Alligator &gt; drums &gt; Other One &gt; Mason�s Children &gt; Caution Jam &gt; Lovelight
            </td>
          </tr>
          <tr>
            <td>
              E: Uncle John�s Band
            </td>
          </tr>
          <tr>
            <td>
              Next ''Sadie'' 10/31/1980 [722 shows]; Final ''Mason's Children''
            </td>
          </tr>
          <tr>
            <td>
              Also: Commander Cody. @acoustic.
            </td>
          </tr>
        </table>
      </div>
      <div>
        <table border="0" cellspacing="0" cellpadding="0">
          <tr>
            <td id="02xx">
              <a href="/1970-02-xx">2/xx/1970 Pacific High Recording, San Francisco, CA</a> [<a href="http://www.archive.org/search.php?query=creator:%22Grateful%20Dead%22%20date:1970-02-xx*">Listen/Download</a>]
            </td>
          </tr>
          <tr>
            <td>
              Mason's Children *, Uncle John
            </td>
          </tr>
          <tr>
            <td>
              Recording sessions for "Workingman's Dead." *appears on "So Many Roads (1965-1995)." Some circulating copies of this recording include a "Tastebud" from 1966 or 1967, and a radio commercial for the album.
            </td>
          </tr>
        </table>
      </div>
      <div>
        <table border="0" cellspacing="0" cellpadding="0">
          <tr>
            <td id="02xx">
              <a href="/1970-02-xx">2/xx/1970 (unknown), (unknown), CA</a> [<a href="http://www.archive.org/search.php?query=creator:%22Grateful%20Dead%22%20date:1970-02-xx*">Listen/Download</a>]
            </td>
          </tr>
          <tr>
            <td>
              Playin x3, Bird Song x5, Greatest Story x3, Wharf Rat
            </td>
          </tr>
        </table>
      </div>
      <div>
        <table border="0" cellspacing="0" cellpadding="0">
          <tr>
            <td id="0301">
              <a href="/1970-03-01">3/1/1970 Family Dog at the Great Highway, San Francisco, CA</a> [<a href="http://www.archive.org/search.php?query=creator:%22Grateful%20Dead%22%20date:1970-03-01*">Listen/Download</a>]
            </td>
          </tr>
          <tr>
            <td>
              I: New Speedway Jam, Casey Jones, Big Boy Pete, Morning Dew, Hard To Handle, Me and My Uncle, Cryptical &gt; Drums &gt; Other One &gt; Cryptical &gt; Black Peter, BIODTL, Dire Wolf, Good Lovin &gt; Drums &gt; Good Lovin, Cumberland, King Bee, China Cat &gt; I Know You Rider
            </td>
          </tr>
          <tr>
            <td>
              II: Uncle John, Dancin, Baby Blue
            </td>
          </tr>
          <tr>
            <td>
              Next ''Big Boy Pete'' 9/20/1970 [68 shows]
            </td>
          </tr>
          <tr>
            <td>
              Also: Commander Cody.
            </td>
          </tr>
        </table>
      </div>
      <div>
        <table border="0" cellspacing="0" cellpadding="0">
          <tr>
            <td id="0307">
              <a href="/1970-03-07">3/7/1970 Santa Monica Civic Auditorium, Santa Monica, CA</a> [<a href="http://www.archive.org/search.php?query=creator:%22Grateful%20Dead%22%20date:1970-03-07*">Listen/Download</a>]
            </td>
          </tr>
          <tr>
            <td>
              Black Peter, China Cat &gt; I Know You Rider &gt;High Time, Dire Wolf, NFA &gt; Drums &gt; Good Lovin &gt; Other One &gt; NFA &gt; Lovelight
            </td>
          </tr>
          <tr>
            <td>
              KRLA Presents. Also: Cold Blood. Reserved tickets $5.50, $4.50, $3.50. This is the correct date for this setlist and venue.
            </td>
          </tr>
        </table>
      </div>
      <div>
        <table border="0" cellspacing="0" cellpadding="0">
          <tr>
            <td id="0308">
              <a href="/1970-03-08">3/8/1970 Star Theatre, Phoenix, AZ</a> [<a href="http://www.archive.org/search.php?query=creator:%22Grateful%20Dead%22%20date:1970-03-08*">Listen/Download</a>]
            </td>
          </tr>
          <tr>
            <td>
              Cold Rain, China Cat &gt; I Know You Rider, High Time, Dire Wolf, Hard To Handle, Monkey & Engineer @, All Around this World @, Me and My Uncle @, Black Peter @, Katie Mae @, Blues Jam *, NFA *&gt; Lovelight *.
            </td>
          </tr>
          <tr>
            <td>
              *with unknown vocalist and harmonica player. @acoustic.
            </td>
          </tr>
        </table>
      </div>
      <div>
        <table border="0" cellspacing="0" cellpadding="0">
          <tr>
            <td id="0316">
              <a href="/1970-03-16">3/16/1970 Kleinhans Music Hall, Buffalo, NY</a> [<a href="http://www.archive.org/search.php?query=creator:%22Grateful%20Dead%22%20date:1970-03-16*">Listen/Download</a>]
            </td>
          </tr>
          <tr>
            <td></td>
          </tr>
          <tr>
            <td>
              This show was rescheduled for the following night.
            </td>
          </tr>
        </table>
      </div>
      <div>
        <table border="0" cellspacing="0" cellpadding="0">
          <tr>
            <td id="0317">
              <a href="/1970-03-17">3/17/1970 Kleinhans Music Hall, Buffalo, NY</a> [<a href="http://www.archive.org/search.php?query=creator:%22Grateful%20Dead%22%20date:1970-03-17*">Listen/Download</a>]
            </td>
          </tr>
          <tr>
            <td>
              Dark Star &gt; Drums*, Lovelight
            </td>
          </tr>
          <tr>
            <td>
              Buffalo Philharmonic benefit. The Dead jammed on stage with the Buffalo Philharmonic Orchestra. *with Lynn Harbold.
            </td>
          </tr>
        </table>
      </div>
      <div>
        <table border="0" cellspacing="0" cellpadding="0">
          <tr>
            <td id="0318">
              <a href="/1970-03-18">3/18/1970 Capitol Theater, Port Chester, NY</a> [<a href="http://www.archive.org/search.php?query=creator:%22Grateful%20Dead%22%20date:1970-03-18*">Listen/Download</a>]
            </td>
          </tr>
          <tr>
            <td></td>
          </tr>
        </table>
      </div>
      <div>
        <table border="0" cellspacing="0" cellpadding="0">
          <tr>
            <td id="0320">
              <a href="/1970-03-20">3/20/1970 Capitol Theater, Port Chester, NY</a> [<a href="http://www.archive.org/search.php?query=creator:%22Grateful%20Dead%22%20date:1970-03-20*">Listen/Download</a>]
            </td>
          </tr>
          <tr>
            <td></td>
          </tr>
          <tr>
            <td>
              Previous ''Minglewood'' 8/21/1969 [86 shows]
            </td>
          </tr>
          <tr>
            <td>
              Early show. The recording long regarded as the early show of this date has been identified as the early show of 06-24-70, and the soundcheck as that of 11-06-70. No recording of the 03-20-70 early show is known to exist.
            </td>
          </tr>
        </table>
      </div>
      <div>
        <table border="0" cellspacing="0" cellpadding="0">
          <tr>
            <td id="0320">
              <a href="/1970-03-20">3/20/1970 Capitol Theater, Port Chester, NY</a> [<a href="http://www.archive.org/search.php?query=creator:%22Grateful%20Dead%22%20date:1970-03-20*">Listen/Download</a>]
            </td>
          </tr>
          <tr>
            <td>
              Casey Jones, Me and My Uncle, China Cat &gt; I Know You Rider, Hard To Handle, Deep Elem@, FOTD@, Don't Ease@, Black Peter@, Uncle John@, Katie Mae@, Good Lovin &gt; Drums &gt; NFA &gt; Drums &gt; Good Lovin, Viola Lee Blues, High Time, Lovelight
            </td>
          </tr>
          <tr>
            <td>
              E: We Bid You Goodnight
            </td>
          </tr>
          <tr>
            <td>
              First ''FOTD''; Previous ''Deep Elem'' 12/1/1966 [435 shows]; Previous ''Don't Ease'' 6/6/1967 [364 shows]; Previous ''Viola Lee Blues'' 4/26/1969 [132 shows]
            </td>
          </tr>
          <tr>
            <td>
              Late show. @acoustic.
            </td>
          </tr>
        </table>
      </div>
      <div>
        <table border="0" cellspacing="0" cellpadding="0">
          <tr>
            <td id="0321">
              <a href="/1970-03-21">3/21/1970 Capitol Theater, Port Chester, NY</a> [<a href="http://www.archive.org/search.php?query=creator:%22Grateful%20Dead%22%20date:1970-03-21*">Listen/Download</a>]
            </td>
          </tr>
          <tr>
            <td>
              Walking The Dog, Me and My Uncle, Death Don't, Good Lovin &gt; Drums &gt; Good Lovin, Dire Wolf, Big Boss Man, Just A Hand To Hold, Viola Lee Blues &gt; The Seven &gt; Cumberland
            </td>
          </tr>
          <tr>
            <td>
              First ''Walking The Dog''; Next ''Walking The Dog'' 11/9/1970 [83 shows]; Final ''He Was A Friend''; Final ''The Seven''
            </td>
          </tr>
          <tr>
            <td>
              Early show.
            </td>
          </tr>
        </table>
      </div>
      <div>
        <table border="0" cellspacing="0" cellpadding="0">
          <tr>
            <td id="0321">
              <a href="/1970-03-21">3/21/1970 Capitol Theater, Port Chester, NY</a> [<a href="http://www.archive.org/search.php?query=creator:%22Grateful%20Dead%22%20date:1970-03-21*">Listen/Download</a>]
            </td>
          </tr>
          <tr>
            <td>
              Casey Jones, Dancin, Easy Wind, FOTD@, Deep Elem@, Don't Ease@, Black Peter@, Wake Up Little Susie@, Uncle John@, Katie Mae@, Cosmic Charlie, St. Stephen &gt; NFA &gt; Jam &gt; NFA &gt; Midnight Hour &gt; Lovelight
            </td>
          </tr>
          <tr>
            <td>
              E: We Bid You Goodnight
            </td>
          </tr>
          <tr>
            <td>
              Late show. @acoustic.
            </td>
          </tr>
        </table>
      </div>
      <div>
        <table border="0" cellspacing="0" cellpadding="0">
          <tr>
            <td id="0324">
              <a href="/1970-03-24">3/24/1970 Pirates World, Dania, FL</a> [<a href="http://www.archive.org/search.php?query=creator:%22Grateful%20Dead%22%20date:1970-03-24*">Listen/Download</a>]
            </td>
          </tr>
          <tr>
            <td>
              Morning Dew, Mama Tried, Good Lovin &gt; Drums &gt; Good Lovin', Don't Ease, Cold Rain, High Time, Dark Star &gt; Other One &gt; St. Stephen &gt; Drums &gt; NFA &gt; Lovelight &gt; Me and My Uncle
            </td>
          </tr>
          <tr>
            <td>
              "Dark Star" is first verse only.
            </td>
          </tr>
        </table>
      </div>
      <div>
        <table border="0" cellspacing="0" cellpadding="0">
          <tr>
            <td id="0403">
              <a href="/1970-04-03">4/3/1970 Field House, U. of Cincinnati, Cincinnati, OH</a> [<a href="http://www.archive.org/search.php?query=creator:%22Grateful%20Dead%22%20date:1970-04-03*">Listen/Download</a>]
            </td>
          </tr>
          <tr>
            <td>
              Casey Jones, China Cat &gt; I Know You Rider, Hard To Handle, Dancin, Me and My Uncle, FOTD@, Deep Elem@, Candyman@, Wake Up Little Susie@ &gt; Black Peter@, Uncle John@, Katie Mae@, Good Lovin &gt; Drums &gt; Good Lovin, Cryptical &gt; Drums &gt; Other One &gt; Cryptical &gt; Cosmic Charlie, NFA &gt; Lovelight
            </td>
          </tr>
          <tr>
            <td>
              E: We Bid You Goodnight
            </td>
          </tr>
          <tr>
            <td>
              First ''Candyman''
            </td>
          </tr>
          <tr>
            <td>
              Also: Ken Kesey and the Merry Pranksters; The Lemon Pipers. Recording often circulated dated 04-30-70.
            </td>
          </tr>
        </table>
      </div>
      <div>
        <table border="0" cellspacing="0" cellpadding="0">
          <tr>
            <td id="0409">
              <a href="/1970-04-09">4/9/1970 Fillmore West, San Francisco, CA</a> [<a href="http://www.archive.org/search.php?query=creator:%22Grateful%20Dead%22%20date:1970-04-09*">Listen/Download</a>]
            </td>
          </tr>
          <tr>
            <td>
              Me and My Uncle, Casey Jones, It�s a Man�s World, FOTD @, Deep Elem @, Candyman @, Black Peter @, Uncle John @, Katie Mae @, Good Lovin &gt; Drums &gt; Good Lovin, Cowboy Song *, Cryptical &gt; Drums &gt; Other One &gt; Cryptical, NFA &gt; Lovelight
            </td>
          </tr>
          <tr>
            <td>
              Only ''Cowboy Song''; First ''It's A Man's World''; Previous ''Schoolgirl'' 12/10/1969 [55 shows]
            </td>
          </tr>
          <tr>
            <td>
              Billing: GD; Miles Davis Quintet (with Airto Moreira); Stone The Crows; Clouds. *with unidentified vocalist. @acoustic. Parts of 04-12-70 have mistakenly circulated under this date.
            </td>
          </tr>
        </table>
      </div>
      <div>
        <table border="0" cellspacing="0" cellpadding="0">
          <tr>
            <td id="0410">
              <a href="/1970-04-10">4/10/1970 Fillmore West, San Francisco, CA</a> [<a href="http://www.archive.org/search.php?query=creator:%22Grateful%20Dead%22%20date:1970-04-10*">Listen/Download</a>]
            </td>
          </tr>
          <tr>
            <td>
              Cold Rain, New Speedway, Mama Tried, China Cat &gt; I Know You Rider, Hard To Handle, Casey Jones, FOTD@, Deep Elem@, Candyman@, Wake Up Little Susie@ &gt; Black Peter@, Uncle John@, It's A Man's World, Dancin, High Time, Alligator &gt; Caution &gt; We Bid You Goodnight
            </td>
          </tr>
          <tr>
            <td>
              Next ''Caution'' 9/20/1970 [57 shows]
            </td>
          </tr>
          <tr>
            <td>
              Billing: GD; Miles Davis Quintet (with Airto Moreira); Stone The Crows; Clouds. @acoustic. "Drums" and a "Jam" likely come between "Alligator" and "Caution," and "Feedback" between "Caution" and "We Bid You Goodnight."
            </td>
          </tr>
        </table>
      </div>
      <div>
        <table border="0" cellspacing="0" cellpadding="0">
          <tr>
            <td id="0411">
              <a href="/1970-04-11">4/11/1970 Fillmore West, San Francisco, CA</a> [<a href="http://www.archive.org/search.php?query=creator:%22Grateful%20Dead%22%20date:1970-04-11*">Listen/Download</a>]
            </td>
          </tr>
          <tr>
            <td>
              I: Cold Rain, King Bee, BIODTL, Dire Wolf, It's A Man's World, Don't Ease@, New Speedway@, FOTD@, Me and My Uncle@, Deep Elem@, Candyman@, Black Peter@, Uncle John@, Dark Star &gt; St. Stephen &gt; NFA &gt; Lovelight
            </td>
          </tr>
          <tr>
            <td>
              II:
            </td>
          </tr>
          <tr>
            <td>
              Billing: GD; Miles Davis Quintet (with Airto Moreira); Stone The Crows; Clouds. @acoustic.
            </td>
          </tr>
        </table>
      </div>
      <div>
        <table border="0" cellspacing="0" cellpadding="0">
          <tr>
            <td id="0412">
              <a href="/1970-04-12">4/12/1970 Fillmore West, San Francisco, CA</a> [<a href="http://www.archive.org/search.php?query=creator:%22Grateful%20Dead%22%20date:1970-04-12*">Listen/Download</a>]
            </td>
          </tr>
          <tr>
            <td>
              Schoolgirl, Casey Jones, Mama Tried, China Cat &gt; I Know You Rider &gt; High Time, Good Lovin� &gt; Drums &gt; Good Lovin, Candyman, Deep Elem, Cumberland, Dire Wolf, Dancin *, Black Peter, Uncle John, It�s a Man�s World, Viola Lee Blues &gt; Feedback
            </td>
          </tr>
          <tr>
            <td>
              E: We Bid You Goodnight
            </td>
          </tr>
          <tr>
            <td>
              Billing: GD; Miles Davis Quintet (with Airto Moreira); Stone The Crows; Clouds. *appears on "Fallout from the Phil Zone." No tunes were played acoustically at this show. Parts of this recording have circulated either as 04-09-70, or 07-10-70, and the "Dancin" and "Viola Lee Blues" sometimes appear on audience recordings of 12-28-70.
            </td>
          </tr>
        </table>
      </div>
      <div>
        <table border="0" cellspacing="0" cellpadding="0">
          <tr>
            <td id="0415">
              <a href="/1970-04-15">4/15/1970 Winterland Arena, San Francisco, CA</a> [<a href="http://www.archive.org/search.php?query=creator:%22Grateful%20Dead%22%20date:1970-04-15*">Listen/Download</a>]
            </td>
          </tr>
          <tr>
            <td>
              Cold Rain, Mama Tried, It�s a Man�s World, Candyman *, Hard to Handle, Cumberland Blues, Cryptical &gt; Drums &gt; Jam + &gt; Drums &gt; Other One &gt; Cryptical &gt; Dire Wolf, Dancin, Lovelight &gt; NFA &gt; Lovelight
            </td>
          </tr>
          <tr>
            <td>
              Billing: Jefferson Airplane, Quicksilver Messenger Service, GD. *appears as "American Beauty" bonus track in "The Golden Road (1965-1973)." +with unidentified guitarist, conga player, and keyboard player (possibly Vince Guaraldi?).
            </td>
          </tr>
        </table>
      </div>
      <div>
        <table border="0" cellspacing="0" cellpadding="0">
          <tr>
            <td id="0417">
              <a href="/1970-04-17">4/17/1970 Family Dog at the Great Highway, San Francisco, CA</a> [<a href="http://www.archive.org/search.php?query=creator:%22Grateful%20Dead%22%20date:1970-04-17*">Listen/Download</a>]
            </td>
          </tr>
          <tr>
            <td>
              Don't Ease, Long Black Limousine, Monkey and Engineer, Deep Elem, Candyman &gt; Cumberland, Me and My Uncle, Mama Tried, Cathy's Clown, Wake Up Little Susie, New Speedway, FOTD, Black Peter, Uncle John
            </td>
          </tr>
          <tr>
            <td>
              Previous ''Cathy's Clown'' 6/11/1969 [121 shows]; Final ''Cathy's Clown''
            </td>
          </tr>
          <tr>
            <td>
              Mickey Hart And The Hartbeats - Bobby Ace And His Cards From The Bottom. Also: NRPS; Charlie Musselwhite. Setlist was provided by eyewitness Judy Dawson. No recording of this show has ever surfaced.
            </td>
          </tr>
        </table>
      </div>
      <div>
        <table border="0" cellspacing="0" cellpadding="0">
          <tr>
            <td id="0418">
              <a href="/1970-04-18">4/18/1970 Family Dog at the Great Highway, San Francisco, CA</a> [<a href="http://www.archive.org/search.php?query=creator:%22Grateful%20Dead%22%20date:1970-04-18*">Listen/Download</a>]
            </td>
          </tr>
          <tr>
            <td>
              Don't Ease, Silver Threads, FOTD, Deep Elem, Wake Up Little Susie, Candyman &gt; Cumberland, New Speedway, Me and My Uncle, Mama Tried, Katie Mae, The Rub, Roberta, Walk Down The Street, The Flood
            </td>
          </tr>
          <tr>
            <td>
              First ''Roberta''; Only ''The Flood''; First ''The Rub''; Only ''Walk Down The Street''; Previous ''Silver Threads'' 12/31/1969 [50 shows]
            </td>
          </tr>
          <tr>
            <td>
              Mickey Hart And The Hartbeats - Bobby Ace And His Cards From The Bottom. Also: NRPS; Charlie Musselwhite. Setlist was provided by eyewitness Judy Dawson. No recording of this show has ever surfaced.
            </td>
          </tr>
        </table>
      </div>
      <div>
        <table border="0" cellspacing="0" cellpadding="0">
          <tr>
            <td id="0419">
              <a href="/1970-04-19">4/19/1970 Family Dog at the Great Highway, San Francisco, CA</a> [<a href="http://www.archive.org/search.php?query=creator:%22Grateful%20Dead%22%20date:1970-04-19*">Listen/Download</a>]
            </td>
          </tr>
          <tr>
            <td>
              I Know You Rider, FOTD, Candyman, Saw Mill, Deep Elem, The Rub, Katie Mae, Roberta, Big Breasa, She's Mine, Cumberland, Wake Up Little Susie, Mama Tried, Me and My Uncle, Race Is On, Uncle John
            </td>
          </tr>
          <tr>
            <td>
              Only ''Big Breasa''; First ''She's Mine''; Final ''Roberta''; Final ''Saw Mill''
            </td>
          </tr>
          <tr>
            <td>
              Mickey Hart And The Hartbeats - Bobby Ace And His Cards From The Bottom. Also: NRPS; Charlie Musselwhite. Setlist was provided by eyewitness Judy Dawson. No recording of this show has ever surfaced.
            </td>
          </tr>
        </table>
      </div>
      <div>
        <table border="0" cellspacing="0" cellpadding="0">
          <tr>
            <td id="0424">
              <a href="/1970-04-24">4/24/1970 Mammoth Gardens, Denver, CO</a> [<a href="http://www.archive.org/search.php?query=creator:%22Grateful%20Dead%22%20date:1970-04-24*">Listen/Download</a>]
            </td>
          </tr>
          <tr>
            <td>
              I: I Know You Rider@, Monkey and Engineer@, FOTD@, Me and My Uncle@, Candyman@, Uncle John@
            </td>
          </tr>
          <tr>
            <td>
              II: Easy Wind, Cumberland, Dire Wolf, Dark Star &gt; St. Stephen &gt; The Eleven &gt; Drums &gt; Jam &gt; It's A Man's World
            </td>
          </tr>
          <tr>
            <td>
              @acoustic.
            </td>
          </tr>
        </table>
      </div>
      <div>
        <table border="0" cellspacing="0" cellpadding="0">
          <tr>
            <td id="0425">
              <a href="/1970-04-25">4/25/1970 Mammoth Gardens, Denver, CO</a> [<a href="http://www.archive.org/search.php?query=creator:%22Grateful%20Dead%22%20date:1970-04-25*">Listen/Download</a>]
            </td>
          </tr>
          <tr>
            <td></td>
          </tr>
          <tr>
            <td>
              Recording that sometimes circulates with this date appears to derive from 04-24-70 and other shows.
            </td>
          </tr>
        </table>
      </div>
      <div>
        <table border="0" cellspacing="0" cellpadding="0">
          <tr>
            <td id="0426">
              <a href="/1970-04-26">4/26/1970 York Farm, Poynette, WI</a> [<a href="http://www.archive.org/search.php?query=creator:%22Grateful%20Dead%22%20date:1970-04-26*">Listen/Download</a>]
            </td>
          </tr>
          <tr>
            <td>
              Cryptical &gt; Drums &gt; Other One, Dark Star &gt; St. Stephen &gt; The Eleven &gt; Lovelight, Death Don't, Alligator &gt; Feedback &gt; We Bid You Goodnight
            </td>
          </tr>
          <tr>
            <td>
              Next ''Death Don't'' 9/29/1989 [1318 shows]
            </td>
          </tr>
          <tr>
            <td>
              Sound Storm Festival. Setlist comes from an eyewitness and is likely incomplete and out of order. DeadLists has "Lovelight" opening the first set and "Dark Star" opening the third set, according to an eyewitness.
            </td>
          </tr>
        </table>
      </div>
      <div>
        <table border="0" cellspacing="0" cellpadding="0">
          <tr>
            <td id="04xx">
              <a href="/1970-04-xx">4/xx/1970 CBS Studios, San Francisco, CA</a> [<a href="http://www.archive.org/search.php?query=creator:%22Grateful%20Dead%22%20date:1970-04-xx*">Listen/Download</a>]
            </td>
          </tr>
          <tr>
            <td>
              Pride Of Cucamonga, Money Money, Unbroken Chain x3, Scarlet, Pride Of Cucamonga, Ship Of Fools, Money Money, Loose Lucy, U. S. Blues
            </td>
          </tr>
          <tr>
            <td>
              Studio sessions for "Mars Hotel." Some of the above dates from the "Wake of the Flood" sessions of August 1973.
            </td>
          </tr>
        </table>
      </div>
      <div>
        <table border="0" cellspacing="0" cellpadding="0">
          <tr>
            <td id="0501">
              <a href="/1970-05-01">5/1/1970 Alfred College, Alfred, NY</a> [<a href="http://www.archive.org/search.php?query=creator:%22Grateful%20Dead%22%20date:1970-05-01*">Listen/Download</a>]
            </td>
          </tr>
          <tr>
            <td>
              I: Deep Elem @, I Know You Rider @, Monkey & Engineer @&gt; Candyman @, Me and My Uncle @, Mama Tried @, Cumberland @, Race is On @, Wake Up Little Susie @, New Speedway Boogie @*, Cold Jordan @, Uncle John� @
            </td>
          </tr>
          <tr>
            <td>
              II: NFA, Hard To Handle, Cryptical &gt; Drums &gt; Other One &gt; Cryptical , High Time, Lovelight
            </td>
          </tr>
          <tr>
            <td>
              Next ''Race Is On'' 3/19/1973 [267 shows]
            </td>
          </tr>
          <tr>
            <td>
              Also: NRPS. @acoustic.
            </td>
          </tr>
        </table>
      </div>
      <div>
        <table border="0" cellspacing="0" cellpadding="0">
          <tr>
            <td id="0502">
              <a href="/1970-05-02">5/2/1970 Harpur College, S.U.N.Y., Binghamton, NY</a> [<a href="http://www.archive.org/search.php?query=creator:%22Grateful%20Dead%22%20date:1970-05-02*">Listen/Download</a>]
            </td>
          </tr>
          <tr>
            <td>
              I: Don't Ease@*, I Know You Rider@*, FOTD@*, Dire Wolf@*, BIODTL@* &gt; Black Peter@*, Candyman@* &gt; Cumberland@*, Deep Elem@*, Cold Jordan+@*, Uncle John@*
            </td>
          </tr>
          <tr>
            <td>
              II: St. Stephen* &gt; Cryptical* &gt; Drums* &gt; Other One* &gt; Cryptical* &gt; Cosmic Charlie*, Casey Jones*, Good Lovin* &gt; Drums * &gt; Good Lovin *, Cold Rain, It's A Man's World*, Dancin*
            </td>
          </tr>
          <tr>
            <td>
              III: Morning Dew*, Viola Lee Blues* &gt; Feedback* &gt; We Bid You Goodnight*
            </td>
          </tr>
          <tr>
            <td>
              Also: NRPS. *appears on "Dick's Picks Vol 8." +with members of NRPS. @acoustic.
            </td>
          </tr>
        </table>
      </div>
      <div>
        <table border="0" cellspacing="0" cellpadding="0">
          <tr>
            <td id="0503">
              <a href="/1970-05-03">5/3/1970 Field House, Wesleyan University, Middletown, CT</a> [<a href="http://www.archive.org/search.php?query=creator:%22Grateful%20Dead%22%20date:1970-05-03*">Listen/Download</a>]
            </td>
          </tr>
          <tr>
            <td>
              Me and My Uncle, New Speedway, Good Lovin &gt; Drums &gt; Good Lovin', Dire Wolf, Don't Ease, Lovelight &gt; The Main Ten &gt; Uncle John &gt; Lovelight
            </td>
          </tr>
          <tr>
            <td>
              Next ''The Main Ten'' 11/6/1970 [63 shows]
            </td>
          </tr>
          <tr>
            <td>
              Also: NRPS.
            </td>
          </tr>
        </table>
      </div>
      <div>
        <table border="0" cellspacing="0" cellpadding="0">
          <tr>
            <td id="0506">
              <a href="/1970-05-06">5/6/1970 Kresge Plaza, M.I.T., Cambridge, MA</a> [<a href="http://www.archive.org/search.php?query=creator:%22Grateful%20Dead%22%20date:1970-05-06*">Listen/Download</a>]
            </td>
          </tr>
          <tr>
            <td>
              Dancin, China Cat &gt; I Know You Rider, Next Time, Morning Dew, Good Lovin &gt; Drums &gt; Good Lovin, Casey Jones, St. Stephen &gt; NFA
            </td>
          </tr>
          <tr>
            <td>
              Previous ''Next Time'' 12/31/1969 [58 shows]
            </td>
          </tr>
          <tr>
            <td>
              Free concert as part of nationwide campus strikes to protest Kent State and Jackson State killings.
            </td>
          </tr>
        </table>
      </div>
      <div>
        <table border="0" cellspacing="0" cellpadding="0">
          <tr>
            <td id="0507">
              <a href="/1970-05-07">5/7/1970 Dupont Gymnasium, M.I.T., Cambridge, MA</a> [<a href="http://www.archive.org/search.php?query=creator:%22Grateful%20Dead%22%20date:1970-05-07*">Listen/Download</a>]
            </td>
          </tr>
          <tr>
            <td>
              I: Don't Ease@, I Know You Rider@, FOTD@, Me and My Uncle@, Deep Elem@, Candyman@, Cumberland@, New Speedway@, Black Peter@, Uncle John@
            </td>
          </tr>
          <tr>
            <td>
              II: Good Lovin &gt; Drums &gt; Good Lovin, Cold Rain, Dire Wolf, Easy Wind, BIODTL, High Time, Cryptical &gt; Drums &gt; Other One &gt; Cryptical &gt; Cosmic Charlie, Casey Jones, King Bee, NFA &gt; Lovelight &gt; Darkness Jam &gt; Lovelight
            </td>
          </tr>
          <tr>
            <td>
              Next ''King Bee'' 11/6/1970 [61 shows]
            </td>
          </tr>
          <tr>
            <td>
              Also: NRPS. Bill Kreutzmann's 24th birthday. @acoustic.
            </td>
          </tr>
        </table>
      </div>
      <div>
        <table border="0" cellspacing="0" cellpadding="0">
          <tr>
            <td id="0508">
              <a href="/1970-05-08">5/8/1970 Farrell Hall, S.U.C.N.Y., Delhi, NY</a> [<a href="http://www.archive.org/search.php?query=creator:%22Grateful%20Dead%22%20date:1970-05-08*">Listen/Download</a>]
            </td>
          </tr>
          <tr>
            <td>
              Dark Star &gt; Dancin, Good Lovin &gt; Drums &gt; Good Lovin, Uncle John
            </td>
          </tr>
          <tr>
            <td>
              Also: NRPS. Setlist incomplete.
            </td>
          </tr>
        </table>
      </div>
      <div>
        <table border="0" cellspacing="0" cellpadding="0">
          <tr>
            <td id="0509">
              <a href="/1970-05-09">5/9/1970 Worcester Polytechnic Institute, Worcester, MA</a> [<a href="http://www.archive.org/search.php?query=creator:%22Grateful%20Dead%22%20date:1970-05-09*">Listen/Download</a>]
            </td>
          </tr>
          <tr>
            <td>
              Deep Elem @, FOTD@, Silver Threads @, Black Peter @
            </td>
          </tr>
          <tr>
            <td>
              Also: NRPS. @acoustic.
            </td>
          </tr>
        </table>
      </div>
      <div>
        <table border="0" cellspacing="0" cellpadding="0">
          <tr>
            <td id="0510">
              <a href="/1970-05-10">5/10/1970 Atlanta Sports Arena, Atlanta, GA</a> [<a href="http://www.archive.org/search.php?query=creator:%22Grateful%20Dead%22%20date:1970-05-10*">Listen/Download</a>]
            </td>
          </tr>
          <tr>
            <td>
              Mama Tried, Circle Be Unbroken*
            </td>
          </tr>
          <tr>
            <td>
              Only ''Circle Be Unbroken''
            </td>
          </tr>
          <tr>
            <td>
              Also: Hampton Grease Band. *with Allman Brothers. Only "Circle Be Unbroken."
            </td>
          </tr>
        </table>
      </div>
      <div>
        <table border="0" cellspacing="0" cellpadding="0">
          <tr>
            <td id="0514">
              <a href="/1970-05-14">5/14/1970 Merramec Community College, Kirkwood, MO</a> [<a href="http://www.archive.org/search.php?query=creator:%22Grateful%20Dead%22%20date:1970-05-14*">Listen/Download</a>]
            </td>
          </tr>
          <tr>
            <td>
              I: Don't Ease@, FOTD@, Deep Elem@, Silver Threads@, Candyman@
            </td>
          </tr>
          <tr>
            <td>
              II: Casey Jones, China Cat &gt; I Know You Rider, Mama Tried &gt; High Time, Good Lovin &gt; Drums &gt; Good Lovin, Schoolgirl, Me and My Uncle, Dire Wolf, Cold Rain, Attics, Cumberland, New Speedway + &gt; Nobody's Jam + &gt; New Speedway + &gt; St. Stephen + &gt; NFA + &gt; Lovelight +
            </td>
          </tr>
          <tr>
            <td>
              E: Cold Jordan @*
            </td>
          </tr>
          <tr>
            <td>
              First ''Attics''
            </td>
          </tr>
          <tr>
            <td>
              Also: NRPS. *with members of NRPS. @acoustic. +appears on the "Road Trips Vol. 3 No. 3" bonus disc.
            </td>
          </tr>
        </table>
      </div>
      <div>
        <table border="0" cellspacing="0" cellpadding="0">
          <tr>
            <td id="0515">
              <a href="/1970-05-15">5/15/1970 Fillmore East, New York, NY</a> [<a href="http://www.archive.org/search.php?query=creator:%22Grateful%20Dead%22%20date:1970-05-15*">Listen/Download</a>]
            </td>
          </tr>
          <tr>
            <td>
              I: Don't Ease Me In @+, I Know You Rider @+, The Rub @+, Friend of the Devil @#, Long Black Limousine @+, Candyman @#, Cumberland Blues @#, New Speedway Boogie @+, Cold Jordan @#
            </td>
          </tr>
          <tr>
            <td>
              II: Casey Jones +, Easy Wind *#, Attics of My Life #, St. Stephen +&gt; Cryptical Envelopment +&gt; Drums +&gt; The Other One +&gt; Cryptical Envelopment +&gt; Cosmic Charlie +
            </td>
          </tr>
          <tr>
            <td>
              E: New New Minglewood Blues +
            </td>
          </tr>
          <tr>
            <td>
              Next ''Long Black Limousine'' 6/21/1971 [120 shows]
            </td>
          </tr>
          <tr>
            <td>
              Early show. Also: NRPS. *appears on "Fallout From The Phil Zone." +appears on "Road Trips Vol. 3 No. 3." #appears on the "Road Trips Vol.3 No. 3" bonus disc. @acoustic. Some of this recording has circulated as "Straight Theater 1969," 12-23-70, and other dates.
            </td>
          </tr>
        </table>
      </div>
      <div>
        <table border="0" cellspacing="0" cellpadding="0">
          <tr>
            <td id="0515">
              <a href="/1970-05-15">5/15/1970 Fillmore East, New York, NY</a> [<a href="http://www.archive.org/search.php?query=creator:%22Grateful%20Dead%22%20date:1970-05-15*">Listen/Download</a>]
            </td>
          </tr>
          <tr>
            <td>
              I: Deep Elem @+, Ballad Of Casey Jones@+, Silver Threads@+, Black Peter@+, FOTD@*+, Uncle John@+, Candyman@, She's Mine@+, Katie Mae@+, I Hear A Voice Callin%@+
            </td>
          </tr>
          <tr>
            <td>
              II: China Cat + &gt; I Know You Rider +, Cumberland +, Hard To Handle +, BIODTL #, Morning Dew +, Good Lovin + &gt; Drums + &gt; Good Lovin +, Dire Wolf +, Next Time #, Dark Star + &gt; St. Stephen + &gt; NFA + &gt; Lovelight +
            </td>
          </tr>
          <tr>
            <td>
              E: Cold Jordan %@+
            </td>
          </tr>
          <tr>
            <td>
              Only ''Ballad Of Casey Jones''; First ''I Hear A Voice Callin''
            </td>
          </tr>
          <tr>
            <td>
              Late show. Also: NRPS. %with David Nelson. *appears as an "American Beauty" bonus track in "The Golden Road (1965-1973)." +appears on "Road Trips Vol.3 No.3." #appears on the "Road Trips Vol.3 No.3" bonus disc. @acoustic.
            </td>
          </tr>
        </table>
      </div>
      <div>
        <table border="0" cellspacing="0" cellpadding="0">
          <tr>
            <td id="0516">
              <a href="/1970-05-16">5/16/1970 Temple University, Philadelphia, PA</a> [<a href="http://www.archive.org/search.php?query=creator:%22Grateful%20Dead%22%20date:1970-05-16*">Listen/Download</a>]
            </td>
          </tr>
          <tr>
            <td>
              Casey Jones, Mama Tried, Hard To Handle, China Cat &gt; I Know You Rider, New Speedway Boogie, Minglewood , Lovelight
            </td>
          </tr>
          <tr>
            <td>
              Afternoon concert. Lineup: Cactus; GD; Steve Miller; Jimi Hendrix.
            </td>
          </tr>
        </table>
      </div>
      <div>
        <table border="0" cellspacing="0" cellpadding="0">
          <tr>
            <td id="0517">
              <a href="/1970-05-17">5/17/1970 Fairfield University, Fairfield, CT</a> [<a href="http://www.archive.org/search.php?query=creator:%22Grateful%20Dead%22%20date:1970-05-17*">Listen/Download</a>]
            </td>
          </tr>
          <tr>
            <td></td>
          </tr>
          <tr>
            <td>
              According to the Lost Live Dead blog, the Dead may have actually played an off-campus event called the �Clam Jam.�
            </td>
          </tr>
        </table>
      </div>
      <div>
        <table border="0" cellspacing="0" cellpadding="0">
          <tr>
            <td id="0519">
              <a href="/1970-05-19">5/19/1970 Washington University, St. Louis, MO</a> [<a href="http://www.archive.org/search.php?query=creator:%22Grateful%20Dead%22%20date:1970-05-19*">Listen/Download</a>]
            </td>
          </tr>
          <tr>
            <td></td>
          </tr>
        </table>
      </div>
      <div>
        <table border="0" cellspacing="0" cellpadding="0">
          <tr>
            <td id="0521">
              <a href="/1970-05-21">5/21/1970 Euphoria Ballroom, San Rafael, CA</a> [<a href="http://www.archive.org/search.php?query=creator:%22Grateful%20Dead%22%20date:1970-05-21*">Listen/Download</a>]
            </td>
          </tr>
          <tr>
            <td></td>
          </tr>
          <tr>
            <td>
              This show did not take place. DeadLists has the Dead playing this date at this venue with Big Brother and Janis, and with Janis sitting in with the Dead during Lovelight. They seem to be confusing it with the 07-16-70 Euphoria Ballroom show and with a Hell's Angels party at the same venue at which both Janis and her band and Big Brother played. The Euphoria Ballroom became Pepperland in September of 1970.
            </td>
          </tr>
        </table>
      </div>
      <div>
        <table border="0" cellspacing="0" cellpadding="0">
          <tr>
            <td id="0524">
              <a href="/1970-05-24">5/24/1970 (unknown), Newcastle-Under-Lyme, England</a> [<a href="http://www.archive.org/search.php?query=creator:%22Grateful%20Dead%22%20date:1970-05-24*">Listen/Download</a>]
            </td>
          </tr>
          <tr>
            <td>
              Casey Jones, China Cat &gt; I Know You Rider, Hard To Handle, Me and My Uncle, Cryptical &gt; Drums &gt; Other One &gt; Cryptical &gt; Attics, Good Lovin &gt; Drums &gt; Good Lovin, Cold Rain, Dark Star &gt; St. Stephen &gt; NFA &gt; Lovelight
            </td>
          </tr>
          <tr>
            <td>
              Actual venue may have been Lower Finney Green Farm, Leycett. Hollywood Festival - first European performance - Saturday: Lord Sutch and Heavy Friends; Family; Titus Groan; Mike Cooper; Mungo Jerry; Airforce - Sunday: Demon Fuzz; Wildmouth; Black Sabbath; Quintessence; Colosseum - Grateful Dead; Free; Mungo Jerry; Jose Feliciano; Traffic.
            </td>
          </tr>
        </table>
      </div>
      <div>
        <table border="0" cellspacing="0" cellpadding="0">
          <tr>
            <td id="0525">
              <a href="/1970-05-25">5/25/1970 The Strand Lyceum, London, England</a> [<a href="http://www.archive.org/search.php?query=creator:%22Grateful%20Dead%22%20date:1970-05-25*">Listen/Download</a>]
            </td>
          </tr>
          <tr>
            <td></td>
          </tr>
          <tr>
            <td>
              Also: Fleetwood Mac. This gig was long thought to have been scheduled for May 28 and canceled, based on the fact that Garcia's passport was stamped for re-entry in Los Angeles on the 26th. However, in his autobiography Mick Fleetwood mentions playing with the Dead at the Lyceum on the 25th, and that it was Peter Green's last gig before leaving Fleetwood Mac.
            </td>
          </tr>
        </table>
      </div>
      <div>
        <table border="0" cellspacing="0" cellpadding="0">
          <tr>
            <td id="0604">
              <a href="/1970-06-04">6/4/1970 Fillmore West, San Francisco, CA</a> [<a href="http://www.archive.org/search.php?query=creator:%22Grateful%20Dead%22%20date:1970-06-04*">Listen/Download</a>]
            </td>
          </tr>
          <tr>
            <td>
              I: Monkey and Engineer @, Deep Elem@, Candyman@, Silver Threads@, FOTD@, Black Peter @, Cumberland@, Wake Up Little Susie@, Swing Low@, Uncle John@
            </td>
          </tr>
          <tr>
            <td>
              II: Casey Jones, Me and My Uncle, Hard To Handle, It's A Sin, China Cat &gt; I Know You Rider, Attics, It's A Man's World, Minglewood, Good Lovin' &gt; Drums &gt; Good Lovin', St. Stephen &gt; NFA &gt; Midnight Hour, Baby Blue
            </td>
          </tr>
          <tr>
            <td>
              First ''Swing Low''; Next ''Midnight Hour'' 12/27/1970 [70 shows]
            </td>
          </tr>
          <tr>
            <td>
              Billing: GD; NRPS; Southern Comfort. @acoustic.
            </td>
          </tr>
        </table>
      </div>
      <div>
        <table border="0" cellspacing="0" cellpadding="0">
          <tr>
            <td id="0605">
              <a href="/1970-06-05">6/5/1970 Fillmore West, San Francisco, CA</a> [<a href="http://www.archive.org/search.php?query=creator:%22Grateful%20Dead%22%20date:1970-06-05*">Listen/Download</a>]
            </td>
          </tr>
          <tr>
            <td>
              I: Dire Wolf@, I Know You Rider@, Silver Threads@, FOTD@, Me and My Uncle@, Black Peter@, New Speedway@
            </td>
          </tr>
          <tr>
            <td>
              II: Cold Rain, Easy Wind, Mama Tried, Cryptical &gt; Drums &gt; Other One &gt; Cryptical &gt; Attics, Hard To Handle, It's A Man's World, Uncle John
            </td>
          </tr>
          <tr>
            <td>
              E: St. Stephen &gt; Casey Jones
            </td>
          </tr>
          <tr>
            <td>
              Billing: GD; NRPS; Southern Comfort. @acoustic.
            </td>
          </tr>
        </table>
      </div>
      <div>
        <table border="0" cellspacing="0" cellpadding="0">
          <tr>
            <td id="0606">
              <a href="/1970-06-06">6/6/1970 Fillmore West, San Francisco, CA</a> [<a href="http://www.archive.org/search.php?query=creator:%22Grateful%20Dead%22%20date:1970-06-06*">Listen/Download</a>]
            </td>
          </tr>
          <tr>
            <td>
              I: Don't Ease@, Frozen Logger@, FOTD@, Candyman@, Deep Elem@, Cumberland@, Wake Up Little Susie@, New Speedway@
            </td>
          </tr>
          <tr>
            <td>
              II: Morning Dew, Me and My Uncle, Casey Jones, Dancin, Next Time, China Cat &gt; I Know You Rider, Good Lovin &gt; Drums &gt; New Orleans &gt; Good Lovin, Attics *, Dire Wolf &gt; Alligator &gt; Drums &gt; Jam &gt; Lovelight &gt; NFA &gt; Lovelight
            </td>
          </tr>
          <tr>
            <td>
              E: Uncle John
            </td>
          </tr>
          <tr>
            <td>
              First ''Frozen Logger''; Next ''New Orleans'' 11/8/1970 [50 shows]
            </td>
          </tr>
          <tr>
            <td>
              Billing: GD; NRPS; Southern Comfort. *appears as an "American Beauty" bonus track in "The Golden Road (1965-1973)." @acoustic.
            </td>
          </tr>
        </table>
      </div>
      <div>
        <table border="0" cellspacing="0" cellpadding="0">
          <tr>
            <td id="0607">
              <a href="/1970-06-07">6/7/1970 Fillmore West, San Francisco, CA</a> [<a href="http://www.archive.org/search.php?query=creator:%22Grateful%20Dead%22%20date:1970-06-07*">Listen/Download</a>]
            </td>
          </tr>
          <tr>
            <td>
              I: Don't Ease@, Silver Threads@, FOTD@, Candyman@, Cold Jordan@, Swing Low@, Cumberland@, Me and My Uncle@, New Speedway@
            </td>
          </tr>
          <tr>
            <td>
              II: Cryptical &gt; Drums &gt; Other One &gt; Cryptical &gt; Jam &gt; Drums &gt; The Main Ten &gt; Sugar Magnolia, Louie Louie Jam, It's A Man's World, Mama Tried, Top Of The World, Cosmic Charlie, Casey Jones, Good Lovin &gt; Drums &gt; Good Lovin, Frozen Logger
            </td>
          </tr>
          <tr>
            <td>
              First ''Sugar Magnolia''; Previous ''Top Of The World'' 2/8/1970 [53 shows]; Final ''The Eleven''
            </td>
          </tr>
          <tr>
            <td>
              Billing: GD; NRPS; Southern Comfort. Only "Louie Louie Jam," done by audience request according to an eyewitness. @acoustic.
            </td>
          </tr>
        </table>
      </div>
      <div>
        <table border="0" cellspacing="0" cellpadding="0">
          <tr>
            <td id="0612">
              <a href="/1970-06-12">6/12/1970 Honolulu Civic Auditorium, Honolulu, HI</a> [<a href="http://www.archive.org/search.php?query=creator:%22Grateful%20Dead%22%20date:1970-06-12*">Listen/Download</a>]
            </td>
          </tr>
          <tr>
            <td>
              Cryptical &gt; Drums &gt; Other One &gt; Cryptical
            </td>
          </tr>
          <tr>
            <td>
              Also: QMS; NRPS. Setlist incomplete. Here we will also emphasize that John Cipollina and Dino Valenti must have been mistaken when they told Mike Dolgushkin that Quicksilver played with the Dead at a Honolulu club called the Red Vest and at Diamond Head Crater, but not at Honolulu Civic (DeadLists still claims the erroneous venues).
            </td>
          </tr>
        </table>
      </div>
      <div>
        <table border="0" cellspacing="0" cellpadding="0">
          <tr>
            <td id="0613">
              <a href="/1970-06-13">6/13/1970 Honolulu Civic Auditorium, Honolulu, HI</a> [<a href="http://www.archive.org/search.php?query=creator:%22Grateful%20Dead%22%20date:1970-06-13*">Listen/Download</a>]
            </td>
          </tr>
          <tr>
            <td>
              Cold Rain, Easy Wind, Uncle John, Candyman, Me and My Uncle, Good Lovin* &gt; Drums * &gt; Good Lovin *, China Cat &gt; I Know You Rider, New Speedway &gt; Nobody's Jam &gt; New Speedway, Casey Jones, Lovelight*
            </td>
          </tr>
          <tr>
            <td>
              Also: QMS; The Steve Miller Band; NRPS - $3.50. *with Dino Valenti and Gary Duncan.
            </td>
          </tr>
        </table>
      </div>
      <div>
        <table border="0" cellspacing="0" cellpadding="0">
          <tr>
            <td id="0619">
              <a href="/1970-06-19">6/19/1970 Mid-South Coliseum, Memphis, TN</a> [<a href="http://www.archive.org/search.php?query=creator:%22Grateful%20Dead%22%20date:1970-06-19*">Listen/Download</a>]
            </td>
          </tr>
          <tr>
            <td>
              Casey Jones, China Cat &gt; I Know You Rider, Hard To Handle, Me and My Uncle, Attics, Candyman, Uncle John, Good Lovin
            </td>
          </tr>
          <tr>
            <td>
              Also: Country Joe McDonald; The Illusion. Setlist and order uncertain.
            </td>
          </tr>
        </table>
      </div>
      <div>
        <table border="0" cellspacing="0" cellpadding="0">
          <tr>
            <td id="0621">
              <a href="/1970-06-21">6/21/1970 Pauley Ballroom, U. of California, Berkeley, CA</a> [<a href="http://www.archive.org/search.php?query=creator:%22Grateful%20Dead%22%20date:1970-06-21*">Listen/Download</a>]
            </td>
          </tr>
          <tr>
            <td>
              Frozen Logger, Casey Jones, Cumberland, Easy Wind, Mama Tried, Candyman, NFA &gt; St. Stephen &gt; Drums &gt; Good Lovin &gt; Drums &gt; Good Lovin
            </td>
          </tr>
          <tr>
            <td>
              American Indian benefit.
            </td>
          </tr>
        </table>
      </div>
      <div>
        <table border="0" cellspacing="0" cellpadding="0">
          <tr>
            <td id="0624">
              <a href="/1970-06-24">6/24/1970 Capitol Theater, Port Chester, NY</a> [<a href="http://www.archive.org/search.php?query=creator:%22Grateful%20Dead%22%20date:1970-06-24*">Listen/Download</a>]
            </td>
          </tr>
          <tr>
            <td>
              Casey Jones, Black Peter, Good Lovin &gt; Drums &gt; Good Lovin, Mama Tried, High Time, Cryptical &gt; drums &gt; Other One &gt; Cryptical &gt; Cosmic Charlie
            </td>
          </tr>
          <tr>
            <td>
              E: Minglewood
            </td>
          </tr>
          <tr>
            <td>
              Early show. Also: NRPS. This recording commonly circulates as the 03-20-70 early show, however, Howard Stein can be heard welcoming the band back to the Capitol Theater, which he would not have done at their first performance there. The recording long dated either 06-25-70 or the 06-24-70 early show is actually Marty Weinberg�s master of 07-10-70 at the Fillmore East.
            </td>
          </tr>
        </table>
      </div>
      <div>
        <table border="0" cellspacing="0" cellpadding="0">
          <tr>
            <td id="0624">
              <a href="/1970-06-24">6/24/1970 Capitol Theater, Port Chester, NY</a> [<a href="http://www.archive.org/search.php?query=creator:%22Grateful%20Dead%22%20date:1970-06-24*">Listen/Download</a>]
            </td>
          </tr>
          <tr>
            <td>
              I: Big RxR Blues@, Deep Elem@, Monkey and Engineer@, The Rub@, Silver Threads@, FOTD@, Candyman@ &gt; Cumberland@, Cold Jordan @
            </td>
          </tr>
          <tr>
            <td>
              II: NFA &gt; Easy Wind, Dark Star &gt; Attics &gt; Dark Star &gt; Sugar Magnolia &gt; Dark Star &gt; St. Stephen &gt; China Cat &gt; I Know You Rider
            </td>
          </tr>
          <tr>
            <td>
              E: Uncle John, Swing Low @
            </td>
          </tr>
          <tr>
            <td>
              Previous ''Big RxR Blues'' 9/7/1969 [119 shows]
            </td>
          </tr>
          <tr>
            <td>
              Late show. Also: NRPS. @acoustic.
            </td>
          </tr>
        </table>
      </div>
      <div>
        <table border="0" cellspacing="0" cellpadding="0">
          <tr>
            <td id="0627">
              <a href="/1970-06-27">6/27/1970 Canadian National Exhibition Hall, Toronto, Canada</a> [<a href="http://www.archive.org/search.php?query=creator:%22Grateful%20Dead%22%20date:1970-06-27*">Listen/Download</a>]
            </td>
          </tr>
          <tr>
            <td>
              Don't Ease
            </td>
          </tr>
          <tr>
            <td>
              "Trans Continental Pop Festival" Saturday and Sunday - Noon to Midnight. Also: NRPS; The Band; Janis Joplin; Delaney and Bonnie; Mashmakan; Cat; Ten Years After; Traffic; James and The Good Bros.; Charlebois; Ian and Sylvia; Great Speckled Bird; Buddy Guy; Eric Andersen; Mountain; Tom Rush; Seatrain; Melanie. The above tune from this show appears in the movie and DVD of "Festival Express," but since it took place outdoors the name of the venue might be different
            </td>
          </tr>
        </table>
      </div>
      <div>
        <table border="0" cellspacing="0" cellpadding="0">
          <tr>
            <td id="0627">
              <a href="/1970-06-27">6/27/1970 Coronation Park, Toronto, Canada</a> [<a href="http://www.archive.org/search.php?query=creator:%22Grateful%20Dead%22%20date:1970-06-27*">Listen/Download</a>]
            </td>
          </tr>
          <tr>
            <td></td>
          </tr>
          <tr>
            <td>
              The Dead played an acoustic set at this park to appease the ticketless hordes clamoring for free admission to the regular festival. Footage of this appears in the movie and DVD of "Festival Express" accompanied by the studio recording of "Friend of the Devil."
            </td>
          </tr>
        </table>
      </div>
      <div>
        <table border="0" cellspacing="0" cellpadding="0">
          <tr>
            <td id="0628">
              <a href="/1970-06-28">6/28/1970 Coronation Park, Toronto, Canada</a> [<a href="http://www.archive.org/search.php?query=creator:%22Grateful%20Dead%22%20date:1970-06-28*">Listen/Download</a>]
            </td>
          </tr>
          <tr>
            <td></td>
          </tr>
          <tr>
            <td>
              DeadLists has an eyewitness claiming a Grateful Dead electric set at this venue on this date.
            </td>
          </tr>
        </table>
      </div>
      <div>
        <table border="0" cellspacing="0" cellpadding="0">
          <tr>
            <td id="0701">
              <a href="/1970-07-01">7/1/1970 Winnipeg Fairgrounds, Winnipeg, Canada</a> [<a href="http://www.archive.org/search.php?query=creator:%22Grateful%20Dead%22%20date:1970-07-01*">Listen/Download</a>]
            </td>
          </tr>
          <tr>
            <td>
              I: Candyman @, Dire Wolf @, Uncle John @
            </td>
          </tr>
          <tr>
            <td>
              II: Me and My Uncle, Easy Wind *, China Cat &gt; I Know You Rider, Lovelight
            </td>
          </tr>
          <tr>
            <td>
              "Red River Exhibition," "Trans Continental Pop Festival." Also: NRPS. *appears as a Festival Express DVD bonus song. Setlist is likely incomplete. This is a good place to point out that the "Festival Express" movie and DVD includes footage of Garcia, Weir, Rick Danko, Janis, and others performing "No More Cane on the Brazos" aboard the train itself, and a recording exists of Garcia, Weir, and others performing four jams (one of which is barely recognizable as �Honky Tonk Women�) and an instrumental "Sugar Magnolia," likewise aboard the train.
            </td>
          </tr>
        </table>
      </div>
      <div>
        <table border="0" cellspacing="0" cellpadding="0">
          <tr>
            <td id="0703">
              <a href="/1970-07-03">7/3/1970 McMahon Stadium, Calgary, Canada</a> [<a href="http://www.archive.org/search.php?query=creator:%22Grateful%20Dead%22%20date:1970-07-03*">Listen/Download</a>]
            </td>
          </tr>
          <tr>
            <td>
              Candyman, Hard to Handle +, New Speedway Boogie * &gt; Nobody�s jam * &gt; New Speedway Boogie *
            </td>
          </tr>
          <tr>
            <td>
              "Trans Continental Pop Festival." *appears in "Festival Express." +appears as a "Festival Express" DVD bonus song. "Candyman" is performed electric in this case (it is not 100% certain that it actually belongs here), and the setlist is likely incomplete.
            </td>
          </tr>
        </table>
      </div>
      <div>
        <table border="0" cellspacing="0" cellpadding="0">
          <tr>
            <td id="0708">
              <a href="/1970-07-08">7/8/1970 Mississippi River Festival, Edwardsville, IL</a> [<a href="http://www.archive.org/search.php?query=creator:%22Grateful%20Dead%22%20date:1970-07-08*">Listen/Download</a>]
            </td>
          </tr>
          <tr>
            <td>
              Good Lovin &gt; Drums &gt; Good Lovin
            </td>
          </tr>
          <tr>
            <td>
              The Dead played the above at this show according to a review in the July 9, 1970 Alton (IL) Evening Telegraph.
            </td>
          </tr>
        </table>
      </div>
      <div>
        <table border="0" cellspacing="0" cellpadding="0">
          <tr>
            <td id="0709">
              <a href="/1970-07-09">7/9/1970 Fillmore East, New York, NY</a> [<a href="http://www.archive.org/search.php?query=creator:%22Grateful%20Dead%22%20date:1970-07-09*">Listen/Download</a>]
            </td>
          </tr>
          <tr>
            <td>
              I: Silver Threads@, Cumberland@, Dire Wolf@, Swing Low@
            </td>
          </tr>
          <tr>
            <td>
              II: Easy Wind, Casey Jones, NFA &gt; Good Lovin, Viola Lee Blues, Morning Dew, Top Of The World, Uncle John
            </td>
          </tr>
          <tr>
            <td>
              Final ''Silver Threads''
            </td>
          </tr>
          <tr>
            <td>
              Midnight show. Billing: GD; NRPS.
            </td>
          </tr>
        </table>
      </div>
      <div>
        <table border="0" cellspacing="0" cellpadding="0">
          <tr>
            <td id="0710">
              <a href="/1970-07-10">7/10/1970 Fillmore East, New York, NY</a> [<a href="http://www.archive.org/search.php?query=creator:%22Grateful%20Dead%22%20date:1970-07-10*">Listen/Download</a>]
            </td>
          </tr>
          <tr>
            <td>
              I:
            </td>
          </tr>
          <tr>
            <td>
              II: Cold Rain, Me and My Uncle, Easy Wind, Minglewood, Alligator &gt; Drums &gt; Jam &gt; Other One &gt; Attics &gt; Other One &gt; Cryptical &gt; Cosmic Charlie, Good Lovin&gt; Drums &gt; China Cat &gt; I Know You Rider &gt; Good Lovin
            </td>
          </tr>
          <tr>
            <td>
              E: NFA
            </td>
          </tr>
          <tr>
            <td>
              Midnight show. Billing: GD; NRPS. This recording circulated for years as 6-25-70 at the Capitol Theater in Port Chester, New York, before being re-dated as the early show on the 06-24-70 after it became evident that no show took place at that venue on the 25th. This is actually legendary taper Marty Weinberg�s master of the 07-10-70 Fillmore East show (minus the acoustic set). Indeed, before the encore someone can be heard announcing right into the tape machine-�Yes, here we are at the scenic Fillmore Auditorium [sic] in the scenic East Village.� If this is not confusing enough, parts of 04-12-70 have circulated under this date.
            </td>
          </tr>
        </table>
      </div>
      <div>
        <table border="0" cellspacing="0" cellpadding="0">
          <tr>
            <td id="0711">
              <a href="/1970-07-11">7/11/1970 Fillmore East, New York, NY</a> [<a href="http://www.archive.org/search.php?query=creator:%22Grateful%20Dead%22%20date:1970-07-11*">Listen/Download</a>]
            </td>
          </tr>
          <tr>
            <td>
              I: Monkey & Engineer @, Don�t Ease @, All Around this World @, Dark Hollow @, Black Peter@, El Paso @, New Speedway @, So Sad @, Rosalie McFall @, I Hear a Voice Callin @, Cold Jordan @, Swing Low @
            </td>
          </tr>
          <tr>
            <td>
              II: Morning Dew, Top Of The World, Me and My Uncle, NFA, Casey Jones, Mama Tried, Good Lovin * &gt; Drums &gt; God Lovin *, High Time, Cumberland, China Cat &gt; I Know You Rider, Viola Lee Blues, Uncle John
            </td>
          </tr>
          <tr>
            <td>
              First ''Rosalie McFall''; Only ''So Sad''
            </td>
          </tr>
          <tr>
            <td>
              Midnight show. Billing: GD; NRPS. *with Weir on vocals. Only "So Sad." @acoustic. Several attendees of this show and the following have claimed that the performance long identified as 07-11-70 is actually 07-12, and vice-versa. While we will acknowledge this as a possibility, we will also point out that two audience master recordings (one of them Weinberg�s) exist of what has long been identified as 07-11, and both of them bear that date. Confusion may arise from the fact that these shows began at midnight: would one identify this as taking place the night of the 11th or the morning of the 12th?
            </td>
          </tr>
        </table>
      </div>
      <div>
        <table border="0" cellspacing="0" cellpadding="0">
          <tr>
            <td id="0712">
              <a href="/1970-07-12">7/12/1970 Fillmore East, New York, NY</a> [<a href="http://www.archive.org/search.php?query=creator:%22Grateful%20Dead%22%20date:1970-07-12*">Listen/Download</a>]
            </td>
          </tr>
          <tr>
            <td>
              I: Dire Wolf@, The Rub@, How Long Blues@, Dark Hollow@, FOTD@, Candyman@, Katie Mae@, Bring Me My Shotgun@ &gt; She's Mine@, Rosalie McFall@, Cocaine Blues@, Wake Up Little Susie@, Cumberland@
            </td>
          </tr>
          <tr>
            <td>
              II: Easy Wind, Mama Tried, Cold Rain, Attics, China Cat &gt; I Know You Rider, High Time, It's A Man's World, Cryptical &gt; Drums &gt; Other One &gt; Me and My Uncle &gt; Other One &gt; Dancin, Lovelight
            </td>
          </tr>
          <tr>
            <td>
              E: Uncle John
            </td>
          </tr>
          <tr>
            <td>
              Only ''Bring Me My Shotgun''; First ''Cocaine Blues''; First ''How Long Blues''; Next ''High Time'' 6/9/1976 [341 shows]; Final ''Katie Mae''; Final ''She's Mine''
            </td>
          </tr>
          <tr>
            <td>
              Midnight show. Billing: GD; NRPS. Only "Bring Me My Shotgun." @acoustic. Several attendees of this show and the following have claimed that the performance long identified as 07-11-70 is actually 07-12, and vice-versa. While we will acknowledge this as a possibility, we will also point out that two audience master recordings (one of them Weinberg�s) exist of what has long been identified as 07-11, and both of them bear that date. Confusion may arise from the fact that these shows began at midnight: would one identify the show before as taking place the night of the 11th or the morning of the 12th?
            </td>
          </tr>
        </table>
      </div>
      <div>
        <table border="0" cellspacing="0" cellpadding="0">
          <tr>
            <td id="0714">
              <a href="/1970-07-14">7/14/1970 Euphoria Ballroom, San Rafael, CA</a> [<a href="http://www.archive.org/search.php?query=creator:%22Grateful%20Dead%22%20date:1970-07-14*">Listen/Download</a>]
            </td>
          </tr>
          <tr>
            <td>
              I: Don't Ease@, FOTD@, Dire Wolf@, Dark Hollow@, Candyman@, Black Peter@, How Long Blues@, Deep Elem@, Cumberland*@, New Speedway*@
            </td>
          </tr>
          <tr>
            <td>
              II: Frozen Logger, Casey Jones, El Paso, China Cat &gt; I Know You Rider, Easy Wind, Me and My Uncle, Cryptical &gt; Drums &gt; Other One &gt; Cryptical &gt; Cosmic Charlie, Good Lovin &gt; Drums &gt; God Lovin, Uncle John
            </td>
          </tr>
          <tr>
            <td>
              First ''El Paso''; Next ''Frozen Logger'' 12/26/1970 [50 shows]
            </td>
          </tr>
          <tr>
            <td>
              Also: David Crosby; NRPS; Rubber Duck Company, with Tom Constanten. *with David Crosby
            </td>
          </tr>
        </table>
      </div>
      <div>
        <table border="0" cellspacing="0" cellpadding="0">
          <tr>
            <td id="0716">
              <a href="/1970-07-16">7/16/1970 Euphoria Ballroom, San Rafael, CA</a> [<a href="http://www.archive.org/search.php?query=creator:%22Grateful%20Dead%22%20date:1970-07-16*">Listen/Download</a>]
            </td>
          </tr>
          <tr>
            <td>
              I: Lovelight, Me and My Uncle, Cold Rain, China Cat &gt; I Know You Rider, Candyman, Lovelight*
            </td>
          </tr>
          <tr>
            <td>
              II: Casey Jones, Attics, Cumberland, NFA &gt; St. Stephen &gt; Uncle John
            </td>
          </tr>
          <tr>
            <td>
              Also: NRPS; Rubber Duck Company. *with Janis Joplin.
            </td>
          </tr>
        </table>
      </div>
      <div>
        <table border="0" cellspacing="0" cellpadding="0">
          <tr>
            <td id="0730">
              <a href="/1970-07-30">7/30/1970 The Matrix, San Francisco, CA</a> [<a href="http://www.archive.org/search.php?query=creator:%22Grateful%20Dead%22%20date:1970-07-30*">Listen/Download</a>]
            </td>
          </tr>
          <tr>
            <td>
              To Lay Me Down@, Dire Wolf@, Candyman@, Rosalie McFall@, I Hear A Voice Callin@, Swing Low@
            </td>
          </tr>
          <tr>
            <td>
              First ''To Lay Me Down''; Final ''I Hear A Voice Callin''
            </td>
          </tr>
          <tr>
            <td>
              NRPS. Also: The Grateful Dead. @acoustic.
            </td>
          </tr>
        </table>
      </div>
      <div>
        <table border="0" cellspacing="0" cellpadding="0">
          <tr>
            <td id="07xx">
              <a href="/1970-07-xx">7/xx/1970 (unknown), (unknown), NY</a> [<a href="http://www.archive.org/search.php?query=creator:%22Grateful%20Dead%22%20date:1970-07-xx*">Listen/Download</a>]
            </td>
          </tr>
          <tr>
            <td>
              Dire Wolf @, Don�t Ease @, Attics @, FOTD @, Let Me In @, Candyman @, Uncle John @
            </td>
          </tr>
          <tr>
            <td>
              This recording usually circulates dated either 06-24-70 or 08-17-70, and appears to be from a New York-area show in about July, not from KSAN studios as claimed in DeadLists. @acoustic.
            </td>
          </tr>
        </table>
      </div>
      <div>
        <table border="0" cellspacing="0" cellpadding="0">
          <tr>
            <td id="0804">
              <a href="/1970-08-04">8/4/1970 (unknown), Virginia City, NV</a> [<a href="http://www.archive.org/search.php?query=creator:%22Grateful%20Dead%22%20date:1970-08-04*">Listen/Download</a>]
            </td>
          </tr>
          <tr>
            <td></td>
          </tr>
          <tr>
            <td>
