<!DOCTYPE HTML PUBLIC "-//W3C//DTD HTML 4.01 Transitional//EN" "http://www.w3.org/TR/html4/loose.dtd">
<html>
<head>
<title>1978 Setlists</title>
</head>
<body>
<div align="center">
<div id="container">
<div><img src="/images/banner.jpg"></div>

<div id="nav"><!--START NAV-->
	<div class="link"><a href="/my">My DeadBase</a></div>
    <div class="link" onmouseover="showDrop('lists_60s');" onmouseout="hideDrop('lists_60s');"><ul id="lists_60s">
    	<li><a href="/1965/setlists">1965</a></li><li><a href="/1966/setlists">1966</a></li><li><a href="/1967/setlists">1967</a></li><li><a href="/1968/setlists">1968</a></li><li><a href="/1969/setlists">1969</a></li>    </ul><a href="/setlists">60s Setlists</a></div>
    <div class="link" onmouseover="showDrop('lists_70s');" onmouseout="hideDrop('lists_70s');"><a href="/setlists">70s Setlists</a><ul id="lists_70s">
    	<li><a href="/1970/setlists">1970</a></li><li><a href="/1971/setlists">1971</a></li><li><a href="/1972/setlists">1972</a></li><li><a href="/1973/setlists">1973</a></li><li><a href="/1974/setlists">1974</a></li><li><a href="/1975/setlists">1975</a></li><li><a href="/1976/setlists">1976</a></li><li><a href="/1977/setlists">1977</a></li><li><a href="/1978/setlists">1978</a></li><li><a href="/1979/setlists">1979</a></li>    </ul></div>
    <div class="link" onmouseover="showDrop('lists_80s');" onmouseout="hideDrop('lists_80s');"><a href="/setlists">80s Setlists</a><ul id="lists_80s">
    	<li><a href="/1980/setlists">1980</a></li><li><a href="/1981/setlists">1981</a></li><li><a href="/1982/setlists">1982</a></li><li><a href="/1983/setlists">1983</a></li><li><a href="/1984/setlists">1984</a></li><li><a href="/1985/setlists">1985</a></li><li><a href="/1986/setlists">1986</a></li><li><a href="/1987/setlists">1987</a></li><li><a href="/1988/setlists">1988</a></li><li><a href="/1989/setlists">1989</a></li>    </ul></div>
    <div class="link" onmouseover="showDrop('lists_90s');" onmouseout="hideDrop('lists_90s');"><a href="/setlists">90s Setlists</a><ul id="lists_90s">
    	<li><a href="/1990/setlists">1990</a></li><li><a href="/1991/setlists">1991</a></li><li><a href="/1992/setlists">1992</a></li><li><a href="/1993/setlists">1993</a></li><li><a href="/1994/setlists">1994</a></li><li><a href="/1995/setlists">1995</a></li>    </ul></div>
    <div class="link"><a href="/songs">Songbook</a></div>
    <div class="link"><a href="/stuff">Odds &amp; Ends</a></div>
    <div class="link"><a href="/community">Community</a></div>
    <div class="clear"></div>
</div>

<div id="logbar"><!--START LOGIN-->
You are logged in as Dave R [<a href="">Log Out</a>]<span class="space">|</span><a href="/my">My DeadBase Options and Shows</a><span class="space">|</span>Shows I own are currently highlighted. [<span onmouseover="document.getElementById('highoptions').style.display='block';" onmouseout="document.getElementById('highoptions').style.display='none'; return false;"><a href="#" onclick="return false;">Change</a><div id="highoptions" class="highoptions" style="display:none;">
		<a href="/1978/setlists&highlight=went">Shows I attended</a>
		<a href="/1978/setlists&highlight=own">Shows I own</a>
		<a href="/1978/setlists&highlight=looking">Shows I'm looking for</a>
		<a href="/1978/setlists&highlight=favorite">My favorite shows</a>
	</div></span>] 
</div>

<div><!--START main-->
<div id="mainc"><div id="main">
	<div class="page_title">1978 Setlists</div>

<script language="Javascript" type="text/javascript">
<!--
function showtab () {
document.getElementById('hide').style.display = 'none';
document.getElementById('show').style.display = 'block';
}
function hidetab () {
document.getElementById('show').style.display = 'none';
document.getElementById('hide').style.display = 'block';
}
-->
</script>
<p>January:  <a href="#0106">6</a> <a href="#0107">7</a> <a href="#0108">8</a> <a href="#0110">10</a> <a href="#0111">11</a> <a href="#0113">13</a> <a href="#0114">14</a> <a href="#0115">15</a> <a href="#0117">17</a> <a href="#0118">18</a> <a href="#0122">22</a> <a href="#0130">30</a> <a href="#0131">31</a><br>
February: <a href="#0201">1</a> <a href="#0203">3</a> <a href="#0204">4</a> <a href="#0205">5</a><br>
April: <a href="#0406">6</a> <a href="#0407">7</a> <a href="#0408">8</a> <a href="#0410">10</a> <a href="#0411">11</a> <a href="#0412">12</a> <a href="#0414">14</a> <a href="#0415">15</a> <a href="#0416">16</a> <a href="#0418">18</a> <a href="#0419">19</a> <a href="#0421">21</a> <a href="#0422">22</a> <a href="#0423">23</a> <a href="#0424">24</a><br>
May: <a href="#0503">3</a> <a href="#0503">3</a> <a href="#0505">5</a> <a href="#0506">6</a> <a href="#0507">7</a> <a href="#0507">7</a> <a href="#0509">9</a> <a href="#0510">10</a> <a href="#0511">11</a> <a href="#0513">13</a> <a href="#0514">14</a> <a href="#0516">16</a> <a href="#0517">17</a> <a href="#0518">18</a><br>
June: <a href="#0604">4</a> <a href="#0618">18</a> <a href="#0625">25</a><br>
July: <a href="#0701">1</a> <a href="#0702">2</a> <a href="#0703">3</a> <a href="#0705">5</a> <a href="#0707">7</a> <a href="#0708">8</a> <a href="#0728">28</a><br>
August: <a href="#0811">11</a> <a href="#0825">25</a> <a href="#0826">26</a> <a href="#0827">27</a> <a href="#0830">30</a> <a href="#0831">31</a> <a href="#0831">31</a> <a href="#08xx">xx</a><br>
September: <a href="#0902">2</a> <a href="#0904">4</a> <a href="#0914">14</a> <a href="#0915">15</a> <a href="#0916">16</a> <a href="#0929">29</a> <a href="#0930">30</a> <a href="#0930">30</a><br>
October: <a href="#1001">1</a> <a href="#1001">1</a> <a href="#1002">2</a> <a href="#1004">4</a> <a href="#1006">6</a> <a href="#1007">7</a> <a href="#1009">9</a> <a href="#1010">10</a> <a href="#1011">11</a> <a href="#1013">13</a> <a href="#1014">14</a> <a href="#1016">16</a> <a href="#1017">17</a> <a href="#1017">17</a> <a href="#1018">18</a> <a href="#1020">20</a> <a href="#1021">21</a> <a href="#1022">22</a><br>
November: <a href="#1111">11</a> <a href="#1113">13</a> <a href="#1114">14</a> <a href="#1116">16</a> <a href="#1117">17</a> <a href="#1117">17</a> <a href="#1118">18</a> <a href="#1120">20</a> <a href="#1121">21</a> <a href="#1123">23</a> <a href="#1124">24</a> <a href="#1125">25</a> <a href="#1127">27</a> <a href="#1128">28</a> <a href="#1130">30</a><br>
December: <a href="#1201">1</a> <a href="#1212">12</a> <a href="#1213">13</a> <a href="#1215">15</a> <a href="#1216">16</a> <a href="#1217">17</a> <a href="#1219">19</a> <a href="#1221">21</a> <a href="#1222">22</a> <a href="#1227">27</a> <a href="#1228">28</a> <a href="#1230">30</a> <a href="#1230">30</a> <a href="#1231">31</a></p>
<div class="setlist_table"><table border="0" cellspacing="0" cellpadding="0"><tr class="header"><td><span><a name="0106"></a><a href="/1978-01-06">1/6/1978 Swing Auditorium, San Bernardino, CA</a></span> [<a href="http://www.archive.org/search.php?query=creator:%22Grateful Dead%22%20date:1978-01-06*">Listen/Download</a>]<tr><td>I: Promised, Dire Wolf, Mama Tried > Big River, Loser, L. L. Rain, Tennessee Jed, Minglewood, Deal, Lazy Lightning > Supplication</td></tr>
<tr><td>II: Playin > Estimated > Drums > Other One > Truckin</td></tr>
<tr><td>E: Johnny B. Goode</td></tr>
<tr class="notes"><td>No Garcia vocals during the second set due to extreme laryngitis.</i></td></tr>
</table></div>
<div class="setlist_table"><table border="0" cellspacing="0" cellpadding="0"><tr class="header"><td><span><a name="0107"></a><a href="/1978-01-07">1/7/1978 Golden Hall, Community Concourse, San Diego, CA</a></span> [<a href="http://www.archive.org/search.php?query=creator:%22Grateful Dead%22%20date:1978-01-07*">Listen/Download</a>]<tr><td>I: Minglewood, Cassidy, Sunrise, Passenger, Mexicali > Me  and  My Uncle, L. L. Rain, El Paso > Let It Grow > Promised</td></tr>
<tr><td>II: Jack Straw, Dancin > Samson, Playin > Drums > NFA > Around</td></tr>
<tr><td>E: Saturday Night</td></tr>
<tr class="notes"><td>No Garcia vocals due to extreme laryngitis.</i></td></tr>
</table></div>
<div class="setlist_table"><table border="0" cellspacing="0" cellpadding="0"><tr class="header"><td><span><a name="0108"></a><a href="/1978-01-08">1/8/1978 Golden Hall, Community Concourse, San Diego, CA</a></span> [<a href="http://www.archive.org/search.php?query=creator:%22Grateful Dead%22%20date:1978-01-08*">Listen/Download</a>]<tr><td>I: Jack Straw, Mama Tried > Big River, Sunrise, All Over Now, L. L. Rain, Lazy Lightning > Supplication</td></tr>
<tr><td>II: Samson, Good Lovin, Estimated > Drums > Other One > Truckin > Sugar Magnolia</td></tr>
<tr><td>E: Johnny B. Goode</td></tr>
<tr class="notes"><td>No Garcia vocals due to extreme laryngitis.</i></td></tr>
</table></div>
<div class="setlist_table"><table border="0" cellspacing="0" cellpadding="0"><tr class="header"><td><span><a name="0110"></a><a href="/1978-01-10">1/10/1978 Shrine Auditorium, Los Angeles, CA</a></span> [<a href="http://www.archive.org/search.php?query=creator:%22Grateful Dead%22%20date:1978-01-10*">Listen/Download</a>]<tr><td>I: Bertha > Good Lovin, B. E. Women, Mexicali > Me  and  My Uncle, FOTD, Cassidy, Candyman, Passenger, Sunrise, Deal > Music</td></tr>
<tr><td>II: Jack Straw, Roses, Estimated > He's Gone > Drums > Other One > Wharf Rat > Franklin's > Around</td></tr>
<tr><td>E: U. S. Blues</td></tr>
</table></div>
<div class="setlist_table"><table border="0" cellspacing="0" cellpadding="0"><tr class="header"><td><span><a name="0111"></a><a href="/1978-01-11">1/11/1978 Shrine Auditorium, Los Angeles, CA</a></span> [<a href="http://www.archive.org/search.php?query=creator:%22Grateful Dead%22%20date:1978-01-11*">Listen/Download</a>]<tr><td>I: Minglewood, Dire Wolf, L. L. Rain, TLEO, Big River > El Paso, B. E. Women, Let It Grow</td></tr>
<tr><td>II: Samson, Sunrise, Terrapin > Playin > Drums And Bass > Jam > St. Stephen > NFA > Playin</td></tr>
<tr><td>E: Passenger</td></tr>
</table></div>
<div class="setlist_table"><table border="0" cellspacing="0" cellpadding="0"><tr class="header"><td><span><a name="0113"></a><a href="/1978-01-13">1/13/1978 Arlington Theater, Santa Barbara, CA</a></span> [<a href="http://www.archive.org/search.php?query=creator:%22Grateful Dead%22%20date:1978-01-13*">Listen/Download</a>]<tr><td>I: Half Step, Mexicali > Big River, Candyman, All Over Now, B. E. Women, BIODTL, FOTD, Lazy Lightning > Supplication</td></tr>
<tr><td>II: Bertha > Good Lovin, Sunrise, Dancin > Drums > Space > Wharf Rat > Truckin > Around</td></tr>
<tr><td>E: Sugar Magnolia</td></tr>
<tr class="notes"><td>Previous ''BIODTL'' 3/20/1977 [61 shows]</i></td></tr>
<tr class="notes"><td>Pacific Alliance benefit - "Stop Nuclear Power."</i></td></tr>
</table></div>
<div class="setlist_table"><table border="0" cellspacing="0" cellpadding="0"><tr class="header"><td><span><a name="0114"></a><a href="/1978-01-14">1/14/1978 Bakersfield Memorial Auditorium, Bakersfield, CA</a></span> [<a href="http://www.archive.org/search.php?query=creator:%22Grateful Dead%22%20date:1978-01-14*">Listen/Download</a>]<tr><td>I: Jack Straw, Dire Wolf, Cassidy, TLEO, Mama Tried > Me  and  My Uncle, Loser, L. L. Rain, Deal, Let It Grow</td></tr>
<tr><td>II: Samson, Candyman, Estimated > Eyes > Space > NFA > Saturday Night</td></tr>
</table></div>
<div class="setlist_table"><table border="0" cellspacing="0" cellpadding="0"><tr class="header"><td><span><a name="0115"></a><a href="/1978-01-15">1/15/1978 Selland Arena, Fresno, CA</a></span> [<a href="http://www.archive.org/search.php?query=creator:%22Grateful Dead%22%20date:1978-01-15*">Listen/Download</a>]<tr><td>I: Bertha > Good Lovin, Dire Wolf, Mexicali > Big River, Roses, Passenger, B. E. Women, Music</td></tr>
<tr><td>II: Samson, FOTD, Sunrise, Terrapin > Playin > Wharf Rat > Sugar Magnolia</td></tr>
</table></div>
<div class="setlist_table"><table border="0" cellspacing="0" cellpadding="0"><tr class="header"><td><span><a name="0117"></a><a href="/1978-01-17">1/17/1978 Sacramento Memorial Auditorium, Sacramento, CA</a></span> [<a href="http://www.archive.org/search.php?query=creator:%22Grateful Dead%22%20date:1978-01-17*">Listen/Download</a>]<tr><td>I: Promised, Dire Wolf, Cassidy, Loser, L. L. Rain, Row Jimmy, Minglewood, Roses, Music</td></tr>
<tr><td>II: Bertha > Good Lovin, Candyman, Estimated > He's Gone > Drums > Other One > Black Peter > Truckin > Around</td></tr>
<tr><td>E: U. S. Blues</td></tr>
<tr class="notes"><td>Keith remained onstage for most of "Drums."</i></td></tr>
</table></div>
<div class="setlist_table"><table border="0" cellspacing="0" cellpadding="0"><tr class="header"><td><span><a name="0118"></a><a href="/1978-01-18">1/18/1978 Stockton Civic Auditorium, Stockton, CA</a></span> [<a href="http://www.archive.org/search.php?query=creator:%22Grateful Dead%22%20date:1978-01-18*">Listen/Download</a>]<tr><td>I: Half Step, Mama Tried > Me  and  My Uncle, Peggy-O, Jack Straw, FOTD, All Over Now, Row Jimmy, Lazy Lightning > Supplication</td></tr>
<tr><td>II: Terrapin > Playin > Jam > Passenger > Space > Estimated > Stella Blue, Sugar Magnolia</td></tr>
<tr><td>E: Around</td></tr>
<tr class="notes"><td>Soundcheck: Iko Iko.</i></td></tr>
</table></div>
<div class="setlist_table"><table border="0" cellspacing="0" cellpadding="0"><tr class="header"><td><span><a name="0122"></a><a href="/1978-01-22">1/22/1978 McArthur Court, University of Oregon, Eugene, OR</a></span> [<a href="http://www.archive.org/search.php?query=creator:%22Grateful Dead%22%20date:1978-01-22*">Listen/Download</a>]<tr><td>I: Minglewood, Dire Wolf, Cassidy, Peggy-O, El Paso, Tennessee Jed, Jack Straw, Row Jimmy, Music</td></tr>
<tr><td>II: Bertha > Good Lovin, Ship Of Fools, Samson, Terrapin > Drums > Other One > Close Encounters > St. Stephen > NFA > Around</td></tr>
<tr><td>E: U. S. Blues</td></tr>
<tr class="notes"><td>Only ''Close Encounters''; Next ''St. Stephen'' 12/30/1978 [68 shows]</i></td></tr>
</table></div>
<div class="setlist_table"><table border="0" cellspacing="0" cellpadding="0"><tr class="header"><td><span><a name="0130"></a><a href="/1978-01-30">1/30/1978 Uptown Theatre, Chicago, IL</a></span> [<a href="http://www.archive.org/search.php?query=creator:%22Grateful Dead%22%20date:1978-01-30*">Listen/Download</a>]<tr><td>I: Promised, Dire Wolf, Mexicali > Big River, B. E. Women, L. L. Rain, Peggy-O, All Over Now, Deal, Lazy Lightning > Supplication</td></tr>
<tr><td>II: Bertha > Good Lovin, Ship Of Fools, Estimated > Eyes > Space > Stella Blue > Franklin's > Around</td></tr>
<tr><td>E: Johnny B. Goode</td></tr>
<tr class="notes"><td>Next ''Space'' 4/18/1982 [330 shows]</i></td></tr>
</table></div>
<div class="setlist_table"><table border="0" cellspacing="0" cellpadding="0"><tr class="header"><td><span><a name="0131"></a><a href="/1978-01-31">1/31/1978 Uptown Theatre, Chicago, IL</a></span> [<a href="http://www.archive.org/search.php?query=creator:%22Grateful Dead%22%20date:1978-01-31*">Listen/Download</a>]<tr><td>I: Half Step, Passenger, Tennessee Jed, El Paso, Candyman, Minglewood, TLEO, Let It Grow</td></tr>
<tr><td>II: Scarlet > Fire, Samson, Terrapin > Playin > Drums And Bass > Space > Black Peter > Truckin > Good Lovin</td></tr>
</table></div>
<div class="setlist_table"><table border="0" cellspacing="0" cellpadding="0"><tr class="header"><td><span><a name="0201"></a><a href="/1978-02-01">2/1/1978 Uptown Theatre, Chicago, IL</a></span> [<a href="http://www.archive.org/search.php?query=creator:%22Grateful Dead%22%20date:1978-02-01*">Listen/Download</a>]<tr><td>I: Jack Straw, FOTD, Mama Tried > Me  and  My Uncle, Ramble On, Cassidy, Sunrise, Sugaree</td></tr>
<tr><td>II: Samson, Roses, Estimated > He's Gone > Drums > Jam > Other One > Wharf Rat > Sugar Magnolia</td></tr>
<tr><td>E: Around</td></tr>
</table></div>
<div class="setlist_table"><table border="0" cellspacing="0" cellpadding="0"><tr class="header"><td><span><a name="0203"></a><a href="/1978-02-03">2/3/1978 Dane County Coliseum, Madison, WI</a></span> [<a href="http://www.archive.org/search.php?query=creator:%22Grateful Dead%22%20date:1978-02-03*">Listen/Download</a>]<tr><td>I: Cold Rain <span class="setlist_small">*</span>, Mexicali > Big River, TLEO <span class="setlist_small">*</span>, L. L. Rain <span class="setlist_small">*</span>, Loser, Passenger, B. E. Women <span class="setlist_small">*</span>, El Paso, Peggy-O, Music <span class="setlist_small">*</span></td></tr>
<tr><td>II: Good Lovin, Ship Of Fools, Estimated <span class="setlist_small">*</span> > Eyes <span class="setlist_small">*</span> > Playin <span class="setlist_small">*</span> > Wheel <span class="setlist_small">*</span> > Playin <span class="setlist_small">*</span></td></tr>
<tr><td>E: Johnny B. Goode <span class="setlist_small">*</span></td></tr>
<tr class="notes"><td>Next ''Wheel'' 2/17/1979 [85 shows]</i></td></tr>
<tr class="notes"><td>*appears on "Dick’s Picks Volume 18."</i></td></tr>
</table></div>
<div class="setlist_table"><table border="0" cellspacing="0" cellpadding="0"><tr class="header"><td><span><a name="0204"></a><a href="/1978-02-04">2/4/1978 Milwaukee Auditorium, Milwaukee, WI</a></span> [<a href="http://www.archive.org/search.php?query=creator:%22Grateful Dead%22%20date:1978-02-04*">Listen/Download</a>]<tr><td>I: Jack Straw, Tennessee Jed, Mama Tried > Me  and  My Uncle, Row Jimmy, BIODTL, Candyman, All Over Now <span class="setlist_small">*</span>, Deal</td></tr>
<tr><td>II: Samson, Dupree's <span class="setlist_small">*</span>, Dancin > Terrapin > Playin > Drums > NFA > Black Peter > Around</td></tr>
<tr><td>E: Saturday Night</td></tr>
<tr class="notes"><td>Soundcheck: Dupree's, Ripple x3. *appears on "Dick’s Picks Volume 18."</i></td></tr>
</table></div>
<div class="setlist_table"><table border="0" cellspacing="0" cellpadding="0"><tr class="header"><td><span><a name="0205"></a><a href="/1978-02-05">2/5/1978 Uni-Dome, U. of Northern Iowa, Cedar Falls, IA</a></span> [<a href="http://www.archive.org/search.php?query=creator:%22Grateful Dead%22%20date:1978-02-05*">Listen/Download</a>]<tr><td>I: Bertha <span class="setlist_small">*</span> > Good Lovin <span class="setlist_small">*</span>, B. E. Women, El Paso, Tennessee Jed, Sunrise, Minglewood <span class="setlist_small">*</span>, FOTD, Passenger <span class="setlist_small">*</span>, Deal <span class="setlist_small">*</span></td></tr>
<tr><td>II: Samson <span class="setlist_small">*</span>, Scarlet <span class="setlist_small">*</span> > Fire <span class="setlist_small">*</span>, Truckin <span class="setlist_small">*</span> > Drums <span class="setlist_small">*</span> > Other One <span class="setlist_small">*</span> > Wharf Rat <span class="setlist_small">*</span> > Around <span class="setlist_small">*</span></td></tr>
<tr><td>E: U. S. Blues</td></tr>
<tr class="notes"><td>Next ''Drums'' 6/12/1980 [163 shows]</i></td></tr>
<tr class="notes"><td>*appears on "Dick’s Picks Volume 18."</i></td></tr>
</table></div>
<div class="setlist_table"><table border="0" cellspacing="0" cellpadding="0"><tr class="header"><td><span><a name="0406"></a><a href="/1978-04-06">4/6/1978 Curtis Hixon Convention Hall, Tampa, FL</a></span> [<a href="http://www.archive.org/search.php?query=creator:%22Grateful Dead%22%20date:1978-04-06*">Listen/Download</a>]<tr><td>I: Bertha > Good Lovin, Dire Wolf, Me  and  My Uncle > Big River, FOTD, Passenger, Candyman, Lazy Lightning > Supplication</td></tr>
<tr><td>II: Samson, Roses, Estimated > He's Gone > Drumz > Other One > Wharf Rat > Around</td></tr>
<tr><td>E: U. S. Blues</td></tr>
<tr class="notes"><td>First ''Drumz''</i></td></tr>
<tr class="notes"><td>The soundboard recording of 04-10-78 that includes the soundcheck has circulated under this date.</i></td></tr>
</table></div>
<div class="setlist_table"><table border="0" cellspacing="0" cellpadding="0"><tr class="header"><td><span><a name="0407"></a><a href="/1978-04-07">4/7/1978 Sportatorium, Pembroke Pines, FL</a></span> [<a href="http://www.archive.org/search.php?query=creator:%22Grateful Dead%22%20date:1978-04-07*">Listen/Download</a>]<tr><td>I: Promised, Sugaree, Cassidy, Tennessee Jed, Mama Tried > Mexicali, Peggy-O, Minglewood, Loser, Music</td></tr>
<tr><td>II: Jack Straw, Ship Of Fools, Good Lovin, Terrapin > Playin > Drumz > NFA > Black Peter > Playin</td></tr>
<tr><td>E: Johnny B. Goode</td></tr>
<tr class="notes"><td>"Take A Step Back" before "Ship Of Fools."</i></td></tr>
</table></div>
<div class="setlist_table"><table border="0" cellspacing="0" cellpadding="0"><tr class="header"><td><span><a name="0408"></a><a href="/1978-04-08">4/8/1978 Veteran's Memorial Coliseum, Jacksonville, FL</a></span> [<a href="http://www.archive.org/search.php?query=creator:%22Grateful Dead%22%20date:1978-04-08*">Listen/Download</a>]<tr><td>I: Half Step, Me  and  My Uncle > Big River, TLEO, L. L. Rain, Deal, El Paso, Roses, Lazy Lightning > Supplication</td></tr>
<tr><td>II: Samson, Scarlet > Fire, Estimated > Eyes > Drumz > Sugar Magnolia</td></tr>
<tr><td>E: Saturday Night</td></tr>
</table></div>
<div class="setlist_table"><table border="0" cellspacing="0" cellpadding="0"><tr class="header"><td><span><a name="0410"></a><a href="/1978-04-10">4/10/1978 Fox Theatre, Atlanta, GA</a></span> [<a href="http://www.archive.org/search.php?query=creator:%22Grateful Dead%22%20date:1978-04-10*">Listen/Download</a>]<tr><td>I: Promised, B. E. Women, All Over Now, Peggy-O, Cassidy, Dire Wolf, El Paso, Row Jimmy, Passenger, Candyman, Music</td></tr>
<tr><td>II: Jack Straw, Ship Of Fools, Dancin > Drumz > Franklin's > Black Peter > Around</td></tr>
<tr><td>E: U. S. Blues</td></tr>
<tr class="notes"><td>Soundcheck: Salt Lake City. The soundboard recording that includes the soundcheck has circulated mislabeled as 04-06-78.</i></td></tr>
</table></div>
<div class="setlist_table"><table border="0" cellspacing="0" cellpadding="0"><tr class="header"><td><span><a name="0411"></a><a href="/1978-04-11">4/11/1978 Fox Theatre, Atlanta, GA</a></span> [<a href="http://www.archive.org/search.php?query=creator:%22Grateful Dead%22%20date:1978-04-11*">Listen/Download</a>]<tr><td>I: Bertha > Good Lovin, FOTD, Me  and  My Uncle > Big River, Tennessee Jed, L. L. Rain, B. E. Women, Minglewood, Deal</td></tr>
<tr><td>II: Samson, Scarlet > Fire, Sunrise > Terrapin > Drumz > Iko Iko > Sugar Magnolia</td></tr>
<tr><td>E: Johnny B. Goode</td></tr>
</table></div>
<div class="setlist_table"><table border="0" cellspacing="0" cellpadding="0"><tr class="header"><td><span><a name="0412"></a><a href="/1978-04-12">4/12/1978 Cameron Indoor Stadium, Duke U., Durham, NC</a></span> [<a href="http://www.archive.org/search.php?query=creator:%22Grateful Dead%22%20date:1978-04-12*">Listen/Download</a>]<tr><td>I: Jack Straw, Dire Wolf, BIODTL, Peggy-O, Mama Tried > Mexicali, Row Jimmy, Minglewood, Loser, Lazy Lightning > Supplication</td></tr>
<tr><td>II: Bertha > Good Lovin, Roses, Estimated > Eyes > Drumz > Truckin > Wharf Rat > Around</td></tr>
<tr><td>E: U. S. Blues</td></tr>
<tr class="notes"><td>"Funiculi Funicula" tuning before "Row Jimmy."</i></td></tr>
</table></div>
<div class="setlist_table"><table border="0" cellspacing="0" cellpadding="0"><tr class="header"><td><span><a name="0414"></a><a href="/1978-04-14">4/14/1978 Cassell Coliseum, Virginia Polytechnic, Blacksburg, VA</a></span> [<a href="http://www.archive.org/search.php?query=creator:%22Grateful Dead%22%20date:1978-04-14*">Listen/Download</a>]<tr><td>I: Promised, Tennessee Jed, Me  and  My Uncle > Big River, Peggy-O, L. L. Rain, Dire Wolf, All Over Now, Dupree's, Music</td></tr>
<tr><td>II: Samson, Ship Of Fools, Dancin > Drumz > Other One > Black Peter > Sugar Magnolia</td></tr>
<tr><td>E: Johnny B. Goode</td></tr>
<tr class="notes"><td>Next ''Dupree's'' 8/28/1982 [338 shows]</i></td></tr>
</table></div>
<div class="setlist_table"><table border="0" cellspacing="0" cellpadding="0"><tr class="header"><td><span><a name="0415"></a><a href="/1978-04-15">4/15/1978 College Of William and Mary, Williamsburg, VA</a></span> [<a href="http://www.archive.org/search.php?query=creator:%22Grateful Dead%22%20date:1978-04-15*">Listen/Download</a>]<tr><td>I: Half Step, Passenger, FOTD, El Paso, B. E. Women, Let It Grow, Deal</td></tr>
<tr><td>II: Bertha > Good Lovin, Candyman, Sunrise > Playin > Drumz > NFA > Morning Dew > Around</td></tr>
<tr><td>E: Saturday Night</td></tr>
<tr class="notes"><td>Next ''Morning Dew'' 11/8/1979 [110 shows]</i></td></tr>
</table></div>
<div class="setlist_table"><table border="0" cellspacing="0" cellpadding="0"><tr class="header"><td><span><a name="0416"></a><a href="/1978-04-16">4/16/1978 Huntington Civic Center, Huntington, WV</a></span> [<a href="http://www.archive.org/search.php?query=creator:%22Grateful Dead%22%20date:1978-04-16*">Listen/Download</a>]<tr><td>I: Jack Straw, Dire Wolf, Cassidy, Peggy-O, Mexicali > Mama Tried, TLEO, Minglewood, Scarlet > Fire</td></tr>
<tr><td>II: Samson, Ship Of Fools, Estimated > Eyes > Drumz > Iko Iko > Sugar Magnolia</td></tr>
<tr><td>E: U. S. Blues</td></tr>
</table></div>
<div class="setlist_table"><table border="0" cellspacing="0" cellpadding="0"><tr class="header"><td><span><a name="0418"></a><a href="/1978-04-18">4/18/1978 Pittsburgh Civic Arena, Pittsburgh, PA</a></span> [<a href="http://www.archive.org/search.php?query=creator:%22Grateful Dead%22%20date:1978-04-18*">Listen/Download</a>]<tr><td>I: Minglewood, Sugaree, L. L. Rain, Dire Wolf, BIODTL, Loser, El Paso, Tennessee Jed, Lazy Lightning > Supplication</td></tr>
<tr><td>II: Scarlet > Dancin > Drumz > Samson, Terrapin > Around</td></tr>
<tr><td>E: U. S. Blues</td></tr>
</table></div>
<div class="setlist_table"><table border="0" cellspacing="0" cellpadding="0"><tr class="header"><td><span><a name="0419"></a><a href="/1978-04-19">4/19/1978 Veterans Memorial Hall, Columbus, OH</a></span> [<a href="http://www.archive.org/search.php?query=creator:%22Grateful Dead%22%20date:1978-04-19*">Listen/Download</a>]<tr><td>I: Bertha > Good Lovin, FOTD, Passenger, Candyman, Cassidy, Peggy-O, Me  and  My Uncle > Big River, Deal</td></tr>
<tr><td>II: Samson, Roses, Estimated > He's Gone > Drumz > Other One > Wharf Rat > Around</td></tr>
<tr><td>E: Werewolves</td></tr>
<tr class="notes"><td>First ''Werewolves''</i></td></tr>
</table></div>
<div class="setlist_table"><table border="0" cellspacing="0" cellpadding="0"><tr class="header"><td><span><a name="0421"></a><a href="/1978-04-21">4/21/1978 Rupp Arena, Lexington, KY</a></span> [<a href="http://www.archive.org/search.php?query=creator:%22Grateful Dead%22%20date:1978-04-21*">Listen/Download</a>]<tr><td>I: Promised, Dire Wolf, Mama Tried > Mexicali, Ramble On, Passenger, Row Jimmy, All Over Now, B. E. Women, Music</td></tr>
<tr><td>II: Samson, Ship Of Fools, Playin > Drumz > Staying Alive Jam > Stella Blue > Truckin > Playin</td></tr>
<tr><td>E1: Werewolves</td></tr>
<tr><td>E2: U. S. Blues</td></tr>
<tr class="notes"><td>"Funiculi Funicula" tuning before "Passenger."</i></td></tr>
</table></div>
<div class="setlist_table"><table border="0" cellspacing="0" cellpadding="0"><tr class="header"><td><span><a name="0422"></a><a href="/1978-04-22">4/22/1978 Nashville Municipal Auditorium, Nashville, TN</a></span> [<a href="http://www.archive.org/search.php?query=creator:%22Grateful Dead%22%20date:1978-04-22*">Listen/Download</a>]<tr><td>I: Bertha > Good Lovin, Candyman, L. L. Rain, Tennessee Jed, Jack Straw, Peggy-O, Minglewood, Deal</td></tr>
<tr><td>II: Lazy Lightning > Supplication, Roses, Estimated > Eyes > Drumz > NFA > Wharf Rat > Sugar Magnolia</td></tr>
<tr><td>E: Saturday Night</td></tr>
</table></div>
<div class="setlist_table"><table border="0" cellspacing="0" cellpadding="0"><tr class="header"><td><span><a name="0423"></a><a href="/1978-04-23">4/23/1978 (unknown), Knoxville, TN</a></span> [<a href="http://www.archive.org/search.php?query=creator:%22Grateful Dead%22%20date:1978-04-23*">Listen/Download</a>]<tr><td></td></tr>
</table></div>
<div class="setlist_table"><table border="0" cellspacing="0" cellpadding="0"><tr class="header"><td><span><a name="0424"></a><a href="/1978-04-24">4/24/1978 Horton Field House, Il. U., Normal, IL</a></span> [<a href="http://www.archive.org/search.php?query=creator:%22Grateful Dead%22%20date:1978-04-24*">Listen/Download</a>]<tr><td>I: Promised, Ramble On, Me  and  My Uncle > Big River, FOTD, Cassidy, B. E. Women, Passenger, Roses, Music</td></tr>
<tr><td>II: Scarlet > Fire > Good Lovin, Terrapin > Drumz > NFA > Black Peter > Around</td></tr>
<tr><td>E: Werewolves</td></tr>
<tr class="notes"><td>"Staying Alive" tuning before "Me and My Uncle."</i></td></tr>
</table></div>
<div class="setlist_table"><table border="0" cellspacing="0" cellpadding="0"><tr class="header"><td><span><a name="0503"></a><a href="/1978-05-03">5/3/1978 (unknown), Portland, ME</a></span> [<a href="http://www.archive.org/search.php?query=creator:%22Grateful Dead%22%20date:1978-05-03*">Listen/Download</a>]<tr><td></td></tr>
</table></div>
<div class="setlist_table"><table border="0" cellspacing="0" cellpadding="0"><tr class="header"><td><span><a name="0503"></a><a href="/1978-05-03">5/3/1978 (unknown), New York, NY</a></span> [<a href="http://www.archive.org/search.php?query=creator:%22Grateful Dead%22%20date:1978-05-03*">Listen/Download</a>]<tr><td></td></tr>
</table></div>
<div class="setlist_table"><table border="0" cellspacing="0" cellpadding="0"><tr class="header"><td><span><a name="0505"></a><a href="/1978-05-05">5/5/1978 Thompson Arena, Dartmouth College, Hanover, NH</a></span> [<a href="http://www.archive.org/search.php?query=creator:%22Grateful Dead%22%20date:1978-05-05*">Listen/Download</a>]<tr><td>I: Promised, Dire Wolf, Cassidy, Candyman, El Paso, TLEO, Passenger, B. E. Women, Lazy Lightning > Supplication</td></tr>
<tr><td>II: Bertha > Good Lovin, Ship Of Fools, Estimated > Eyes > Drumz > NFA > Stella Blue > Around</td></tr>
<tr><td>E: Werewolves</td></tr>
</table></div>
<div class="setlist_table"><table border="0" cellspacing="0" cellpadding="0"><tr class="header"><td><span><a name="0506"></a><a href="/1978-05-06">5/6/1978 Patrick Gym, UVM, Burlington, VT</a></span> [<a href="http://www.archive.org/search.php?query=creator:%22Grateful Dead%22%20date:1978-05-06*">Listen/Download</a>]<tr><td>I: Sugaree, Minglewood, Peggy-O, BIODTL, Loser, L. L. Rain, Roses, Me  and  My Uncle > Big River, Deal</td></tr>
<tr><td>II: Samson, Sunrise, Terrapin > Playin > Drumz > Wharf Rat > Sugar Magnolia</td></tr>
<tr><td>E: Saturday Night</td></tr>
</table></div>
<div class="setlist_table"><table border="0" cellspacing="0" cellpadding="0"><tr class="header"><td><span><a name="0507"></a><a href="/1978-05-07">5/7/1978 Field House, Rensselaer Polytechnic, Troy, NY</a></span> [<a href="http://www.archive.org/search.php?query=creator:%22Grateful Dead%22%20date:1978-05-07*">Listen/Download</a>]<tr><td>I: Jack Straw, Dire Wolf, Mexicali > Mama Tried, Tennessee Jed, All Over Now, FOTD, Passenger, B. E. Women, Music</td></tr>
<tr><td>II: Scarlet > Fire, Estimated > He's Gone > Drumz > Iko Iko > Other One > Black Peter > Around</td></tr>
<tr><td>E: U. S. Blues</td></tr>
<tr class="notes"><td>"Funiculi Funicula" tuning before "Mexicali" - Bill Kreutzmann's 32nd birthday</i></td></tr>
</table></div>
<div class="setlist_table"><table border="0" cellspacing="0" cellpadding="0"><tr class="header"><td><span><a name="0507"></a><a href="/1978-05-07">5/7/1978 (unknown), Albany, NY</a></span> [<a href="http://www.archive.org/search.php?query=creator:%22Grateful Dead%22%20date:1978-05-07*">Listen/Download</a>]<tr><td></td></tr>
<tr class="notes"><td>Gig booked for Troy, NY instead.</i></td></tr>
</table></div>
<div class="setlist_table"><table border="0" cellspacing="0" cellpadding="0"><tr class="header"><td><span><a name="0509"></a><a href="/1978-05-09">5/9/1978 Onondaga County War Memorial, Syracuse, NY</a></span> [<a href="http://www.archive.org/search.php?query=creator:%22Grateful Dead%22%20date:1978-05-09*">Listen/Download</a>]<tr><td>I: Franklin's, Minglewood, Row Jimmy, L. L. Rain, FOTD, El Paso, Candyman, Passenger, Deal</td></tr>
<tr><td>II: Samson, Ship Of Fools, Dancin > Drumz > NFA > Black Peter > Around</td></tr>
<tr><td>E: Werewolves</td></tr>
</table></div>
<div class="setlist_table"><table border="0" cellspacing="0" cellpadding="0"><tr class="header"><td><span><a name="0510"></a><a href="/1978-05-10">5/10/1978 Veterans Memorial Coliseum, New Haven, CT</a></span> [<a href="http://www.archive.org/search.php?query=creator:%22Grateful Dead%22%20date:1978-05-10*">Listen/Download</a>]<tr><td>I: Jack Straw <span class="setlist_small">*</span>, TLEO <span class="setlist_small">*</span>, Cassidy <span class="setlist_small">*</span>, Ramble On <span class="setlist_small">*</span>, Me  and  My Uncle <span class="setlist_small">*</span> > Big River <span class="setlist_small">*</span>, Peggy-O <span class="setlist_small">*</span>, Let It Grow <span class="setlist_small">*</span> > Deal <span class="setlist_small">*</span></td></tr>
<tr><td>II: Bertha <span class="setlist_small">*</span> > Good Lovin <span class="setlist_small">*</span>, Roses, Estimated <span class="setlist_small">*</span> > Eyes <span class="setlist_small">*</span> > Drumz <span class="setlist_small">*</span> > Other One <span class="setlist_small">*</span> > Wharf Rat <span class="setlist_small">*</span> > Sugar Magnolia <span class="setlist_small">*</span></td></tr>
<tr><td>E: U. S. Blues</td></tr>
<tr class="notes"><td>*appears on "Dick’s Picks Volume 25."</i></td></tr>
</table></div>
<div class="setlist_table"><table border="0" cellspacing="0" cellpadding="0"><tr class="header"><td><span><a name="0511"></a><a href="/1978-05-11">5/11/1978 Springfield Civic Center Arena, Springfield, MA</a></span> [<a href="http://www.archive.org/search.php?query=creator:%22Grateful Dead%22%20date:1978-05-11*">Listen/Download</a>]<tr><td>I: Cold Rain <span class="setlist_small">*</span>, BIODTL <span class="setlist_small">*</span>, FOTD <span class="setlist_small">*</span>, L. L. Rain <span class="setlist_small">*</span>, Loser <span class="setlist_small">*</span>, Mexicali > Mama Tried, Tennessee Jed <span class="setlist_small">*</span>, Minglewood <span class="setlist_small">*</span>, Peggy-O, Lazy Lightning <span class="setlist_small">*</span> > Supplication <span class="setlist_small">*</span></td></tr>
<tr><td>II: Scarlet <span class="setlist_small">*</span> > Fire <span class="setlist_small">*</span>, Dancin <span class="setlist_small">*</span> > Drumz <span class="setlist_small">*</span> > NFA <span class="setlist_small">*</span> > Stella Blue <span class="setlist_small">*</span> > Around <span class="setlist_small">*</span></td></tr>
<tr><td>E1: Werewolves <span class="setlist_small">*</span></td></tr>
<tr><td>E2: Johnny B. Goode <span class="setlist_small">*</span></td></tr>
<tr class="notes"><td>*appears on "Dick’s Picks Volume 25."</i></td></tr>
</table></div>
<div class="setlist_table"><table border="0" cellspacing="0" cellpadding="0"><tr class="header"><td><span><a name="0513"></a><a href="/1978-05-13">5/13/1978 The Spectrum, Philadelphia, PA</a></span> [<a href="http://www.archive.org/search.php?query=creator:%22Grateful Dead%22%20date:1978-05-13*">Listen/Download</a>]<tr><td>I: Jack Straw, Dire Wolf, BIODTL, Peggy-O, El Paso, Row Jimmy, Minglewood, Candyman, Music</td></tr>
<tr><td>II: Bertha > Good Lovin, Terrapin > Playin > Drumz > Truckin > Black Peter > Sugar Magnolia</td></tr>
<tr><td>E: Saturday Night</td></tr>
</table></div>
<div class="setlist_table"><table border="0" cellspacing="0" cellpadding="0"><tr class="header"><td><span><a name="0514"></a><a href="/1978-05-14">5/14/1978 Providence Civic Center, Providence, RI</a></span> [<a href="http://www.archive.org/search.php?query=creator:%22Grateful Dead%22%20date:1978-05-14*">Listen/Download</a>]<tr><td>I: Half Step, Cassidy, TLEO, L. L. Rain, Roses, Me  and  My Uncle > Big River, B. E. Women, Let It Grow</td></tr>
<tr><td>II: Samson, Ship Of Fools, Estimated > Eyes > Drumz > NFA > GDTRFB > Around</td></tr>
<tr><td>E: U. S. Blues</td></tr>
<tr class="notes"><td>Next ''Let It Grow'' 9/2/1979 [82 shows]</i></td></tr>
</table></div>
<div class="setlist_table"><table border="0" cellspacing="0" cellpadding="0"><tr class="header"><td><span><a name="0516"></a><a href="/1978-05-16">5/16/1978 Uptown Theatre, Chicago, IL</a></span> [<a href="http://www.archive.org/search.php?query=creator:%22Grateful Dead%22%20date:1978-05-16*">Listen/Download</a>]<tr><td>I: Jack Straw, Dire Wolf, Mexicali > Mama Tried, Peggy-O, Cassidy, Row Jimmy, Passenger, B. E. Women, Music</td></tr>
<tr><td>II: Scarlet > Fire, El Paso, Ship Of Fools, Estimated > He's Gone > Drumz > Comes A Time > Sugar Magnolia</td></tr>
<tr><td>E: Johnny B. Goode</td></tr>
<tr class="notes"><td>Next ''Comes A Time'' 2/9/1979 [57 shows]</i></td></tr>
</table></div>
<div class="setlist_table"><table border="0" cellspacing="0" cellpadding="0"><tr class="header"><td><span><a name="0517"></a><a href="/1978-05-17">5/17/1978 Uptown Theatre, Chicago, IL</a></span> [<a href="http://www.archive.org/search.php?query=creator:%22Grateful Dead%22%20date:1978-05-17*">Listen/Download</a>]<tr><td>I: Half Step > Franklin's, Me  and  My Uncle > Big River, Roses, L. L. Rain, Tennessee Jed, Lazy Lightning > Supplication</td></tr>
<tr><td>II: Samson, FOTD, Dancin > Drumz > Terrapin > NFA > Around</td></tr>
<tr><td>E: Werewolves</td></tr>
<tr class="notes"><td>"Funiculi Funicula" tuning before "Lazy Lightning."</i></td></tr>
</table></div>
<div class="setlist_table"><table border="0" cellspacing="0" cellpadding="0"><tr class="header"><td><span><a name="0518"></a><a href="/1978-05-18">5/18/1978 Uptown Theatre, Chicago, IL</a></span> [<a href="http://www.archive.org/search.php?query=creator:%22Grateful Dead%22%20date:1978-05-18*">Listen/Download</a>]<tr><td></td></tr>
<tr class="notes"><td>At the time, the reason given for this cancellation was Kreutzmann's exhaustion, which spurred rumors that he was leaving the band.</i></td></tr>
</table></div>
<div class="setlist_table"><table border="0" cellspacing="0" cellpadding="0"><tr class="header"><td><span><a name="0604"></a><a href="/1978-06-04">6/4/1978 Campus Stadium, U.C.S.B., Santa Barbara, CA</a></span> [<a href="http://www.archive.org/search.php?query=creator:%22Grateful Dead%22%20date:1978-06-04*">Listen/Download</a>]<tr><td>I: Bertha > Good Lovin, Dire Wolf, Me  and  My Uncle > Big River, B. E. Women, L. L. Rain, Tennessee Jed, Jack Straw</td></tr>
<tr><td>II: Samson, Ship Of Fools, Estimated > Eyes > Drumz > NFA > Nobody's Jam > NFA > GDTRFB > Around</td></tr>
<tr><td>E1: U. S. Blues</td></tr>
<tr><td>E2: Sugar Magnolia</td></tr>
<tr class="notes"><td>Afternoon concert. Billing: GD; Warren Zevon; Elvin Bishop; Wah-Koo. The Dead did a sound check of "Iko Iko" the day before. Motorcycle during "Drumz."  </i></td></tr>
</table></div>
<div class="setlist_table"><table border="0" cellspacing="0" cellpadding="0"><tr class="header"><td><span><a name="0618"></a><a href="/1978-06-18">6/18/1978 Oakland Coliseum Stadium, Oakland, CA</a></span> [<a href="http://www.archive.org/search.php?query=creator:%22Grateful Dead%22%20date:1978-06-18*">Listen/Download</a>]<tr><td></td></tr>
<tr class="notes"><td>A Day on the Green with Steve Miller and Bob Seger. The show was cancelled, but Seger headlined the Oakland Coliseum Arena that night.</i></td></tr>
</table></div>
<div class="setlist_table"><table border="0" cellspacing="0" cellpadding="0"><tr class="header"><td><span><a name="0625"></a><a href="/1978-06-25">6/25/1978 Autzen Stadium, U. of Oregon, Eugene, OR</a></span> [<a href="http://www.archive.org/search.php?query=creator:%22Grateful Dead%22%20date:1978-06-25*">Listen/Download</a>]<tr><td>I: Promised, TLEO, Me  and  My Uncle > Big River, Candyman, Passenger, Peggy-O, Minglewood</td></tr>
<tr><td>II: Samson, FOTD, Estimated > Eyes > Drumz<span class="setlist_small">*</span> > NFA > GDTRFB > Around</td></tr>
<tr><td>E: U. S. Blues</td></tr>
<tr class="notes"><td>Billing: GD; Santana; The Outlaws; Eddie Money. *with Ken Babbs. </i></td></tr>
</table></div>
<div class="setlist_table"><table border="0" cellspacing="0" cellpadding="0"><tr class="header"><td><span><a name="0701"></a><a href="/1978-07-01">7/1/1978 Arrowhead Stadium, Kansas City, MO</a></span> [<a href="http://www.archive.org/search.php?query=creator:%22Grateful Dead%22%20date:1978-07-01*">Listen/Download</a>]<tr><td>Bertha > Good Lovin, Tennessee Jed, Jack Straw, FOTD, Me  and  My Uncle > Big River, Terrapin > Playin > Drumz > Estimated > Other One > Wharf Rat > Around</td></tr>
<tr><td>E: Johnny B. Goode</td></tr>
<tr class="notes"><td>also: Missouri; Waylon Jennings and Jesse Colter; Willie Nelson</i></td></tr>
</table></div>
<div class="setlist_table"><table border="0" cellspacing="0" cellpadding="0"><tr class="header"><td><span><a name="0702"></a><a href="/1978-07-02">7/2/1978 Summerfest Fairgrounds, Milwaukee, WI</a></span> [<a href="http://www.archive.org/search.php?query=creator:%22Grateful Dead%22%20date:1978-07-02*">Listen/Download</a>]<tr><td></td></tr>
<tr class="notes"><td>This show was rained out.</i></td></tr>
</table></div>
<div class="setlist_table"><table border="0" cellspacing="0" cellpadding="0"><tr class="header"><td><span><a name="0703"></a><a href="/1978-07-03">7/3/1978 St. Paul Civic Center Arena, St. Paul, MN</a></span> [<a href="http://www.archive.org/search.php?query=creator:%22Grateful Dead%22%20date:1978-07-03*">Listen/Download</a>]<tr><td>I: Minglewood, Loser, L. L. Rain, Ramble On, Mexicali > Mama Tried, Peggy-O, Cassidy, Deal > Music</td></tr>
<tr><td>II: Scarlet > Fire, Dancin > Drumz > NFA > Stella Blue > Sugar Magnolia</td></tr>
<tr><td>E: Werewolves</td></tr>
</table></div>
<div class="setlist_table"><table border="0" cellspacing="0" cellpadding="0"><tr class="header"><td><span><a name="0705"></a><a href="/1978-07-05">7/5/1978 Omaha Civic Auditorium, Omaha, NE</a></span> [<a href="http://www.archive.org/search.php?query=creator:%22Grateful Dead%22%20date:1978-07-05*">Listen/Download</a>]<tr><td>I: Sugaree, BIODTL, TLEO, L. L. Rain, Dire Wolf, All Over Now, Candyman, Lazy Lightning > Supplication</td></tr>
<tr><td>II: Deal, Samson, Ship Of Fools, Estimated > Eyes > Drumz > Wharf Rat > Truckin > Iko Iko > Around</td></tr>
</table></div>
<div class="setlist_table"><table border="0" cellspacing="0" cellpadding="0"><tr class="header"><td><span><a name="0707"></a><a href="/1978-07-07">7/7/1978 Red Rocks Amphitheatre, Morrison, CO</a></span> [<a href="http://www.archive.org/search.php?query=creator:%22Grateful Dead%22%20date:1978-07-07*">Listen/Download</a>]<tr><td>I: Jack Straw, Candyman, Me  and  My Uncle > Big River, FOTD, Cassidy, Tennessee Jed, Passenger, Peggy-O, Music</td></tr>
<tr><td>II: Cold Rain, BIODTL, Scarlet > Fire, Dancin > Drumz > NFA > Nobody's Jam > NFA > Black Peter > Around</td></tr>
<tr><td>E1: U. S. Blues</td></tr>
<tr><td>E2: Johnny B. Goode</td></tr>
</table></div>
<div class="setlist_table"><table border="0" cellspacing="0" cellpadding="0"><tr class="header"><td><span><a name="0708"></a><a href="/1978-07-08">7/8/1978 Red Rocks Amphitheatre, Morrison, CO</a></span> [<a href="http://www.archive.org/search.php?query=creator:%22Grateful Dead%22%20date:1978-07-08*">Listen/Download</a>]<tr><td>I: Bertha > Good Lovin, Dire Wolf, El Paso, Roses, Minglewood, Ramble On, Promised, Deal</td></tr>
<tr><td>II: Samson, Ship Of Fools, Estimated > Other One > Eyes > Drumz > Wharf Rat > Franklin's > Sugar Magnolia</td></tr>
<tr><td>E1: Terrapin > Saturday Night</td></tr>
<tr><td>E2: Werewolves</td></tr>
<tr class="notes"><td>Next ''Werewolves'' 10/31/1985 [522 shows]</i></td></tr>
</table></div>
<div class="setlist_table"><table border="0" cellspacing="0" cellpadding="0"><tr class="header"><td><span><a name="0728"></a><a href="/1978-07-28">7/28/1978 Le Club Front, San Rafael, CA</a></span> [<a href="http://www.archive.org/search.php?query=creator:%22Grateful Dead%22%20date:1978-07-28*">Listen/Download</a>]<tr><td>Good Lovin <span class="setlist_small">*</span></td></tr>
<tr class="notes"><td>*with Lowell George. Appears as a "Shakedown Street" bonus track in "Beyond Description (1973-1989)."</i></td></tr>
</table></div>
<div class="setlist_table"><table border="0" cellspacing="0" cellpadding="0"><tr class="header"><td><span><a name="0811"></a><a href="/1978-08-11">8/11/1978 Le Club Front, San Rafael, CA</a></span> [<a href="http://www.archive.org/search.php?query=creator:%22Grateful Dead%22%20date:1978-08-11*">Listen/Download</a>]<tr><td>Ollin Arageed, Nubian Tune</td></tr>
<tr class="notes"><td>Rehearsal with Hamza, Garcia, and Hart.</i></td></tr>
</table></div>
<div class="setlist_table"><table border="0" cellspacing="0" cellpadding="0"><tr class="header"><td><span><a name="0825"></a><a href="/1978-08-25">8/25/1978 Red Rocks Amphitheatre, Morrison, CO</a></span> [<a href="http://www.archive.org/search.php?query=creator:%22Grateful Dead%22%20date:1978-08-25*">Listen/Download</a>]<tr><td></td></tr>
<tr class="notes"><td>These three shows were rescheduled for August 30-31.</i></td></tr>
</table></div>
<div class="setlist_table"><table border="0" cellspacing="0" cellpadding="0"><tr class="header"><td><span><a name="0826"></a><a href="/1978-08-26">8/26/1978 Red Rocks Amphitheatre, Morrison, CO</a></span> [<a href="http://www.archive.org/search.php?query=creator:%22Grateful Dead%22%20date:1978-08-26*">Listen/Download</a>]<tr><td></td></tr>
<tr class="notes"><td>These three shows were rescheduled for August 30-31.</i></td></tr>
</table></div>
<div class="setlist_table"><table border="0" cellspacing="0" cellpadding="0"><tr class="header"><td><span><a name="0827"></a><a href="/1978-08-27">8/27/1978 Red Rocks Amphitheatre, Morrison, CO</a></span> [<a href="http://www.archive.org/search.php?query=creator:%22Grateful Dead%22%20date:1978-08-27*">Listen/Download</a>]<tr><td></td></tr>
<tr class="notes"><td>These three shows were rescheduled for August 30-31.</i></td></tr>
</table></div>
<div class="setlist_table"><table border="0" cellspacing="0" cellpadding="0"><tr class="header"><td><span><a name="0830"></a><a href="/1978-08-30">8/30/1978 Red Rocks Amphitheatre, Morrison, CO</a></span> [<a href="http://www.archive.org/search.php?query=creator:%22Grateful Dead%22%20date:1978-08-30*">Listen/Download</a>]<tr><td>I: Promised, Sugaree, Mexicali > Mama Tried, Stagger Lee, L. L. Rain, Deal</td></tr>
<tr><td>II: Miracle, B. E. Women, Estimated > Other One > Eyes > Drumz > World To Give > Iko Iko > Around</td></tr>
<tr><td>E: U. S. Blues</td></tr>
<tr class="notes"><td>First ''Miracle''; First ''Stagger Lee''; First ''World To Give''</i></td></tr>
</table></div>
<div class="setlist_table"><table border="0" cellspacing="0" cellpadding="0"><tr class="header"><td><span><a name="0831"></a><a href="/1978-08-31">8/31/1978 Red Rocks Amphitheatre, Morrison, CO</a></span> [<a href="http://www.archive.org/search.php?query=creator:%22Grateful Dead%22%20date:1978-08-31*">Listen/Download</a>]<tr><td>I: Half Step > El Paso, Peggy-O, Minglewood, Candyman, Heart Of Me, Jack Straw</td></tr>
<tr><td>II: Shakedown > Good Lovin, Ship Of Fools, Samson, Terrapin > Playin > Drumz > NFA > Nobody's Jam > NFA > Black Peter > Sugar Magnolia</td></tr>
<tr><td>E: Johnny B. Goode</td></tr>
<tr class="notes"><td>First ''Heart Of Me''; First ''Shakedown''</i></td></tr>
</table></div>
<div class="setlist_table"><table border="0" cellspacing="0" cellpadding="0"><tr class="header"><td><span><a name="0831"></a><a href="/1978-08-31">8/31/1978 (unknown), Vancouver, BC, Canada, </a></span> [<a href="http://www.archive.org/search.php?query=creator:%22Grateful Dead%22%20date:1978-08-31*">Listen/Download</a>]<tr><td></td></tr>
</table></div>
<div class="setlist_table"><table border="0" cellspacing="0" cellpadding="0"><tr class="header"><td><span><a name="08xx"></a><a href="/1978-08-xx">8/xx/1978 Le Club Front, San Rafael, CA</a></span> [<a href="http://www.archive.org/search.php?query=creator:%22Grateful Dead%22%20date:1978-08-xx*">Listen/Download</a>]<tr><td>Good Lovin, France, Fire, Stagger Lee x2, World to Give, Shakedown, Miracle, Saint</td></tr>
<tr class="notes"><td>Recording sessions for "Shakedown Street." This material probably ranges in date from July to September.</i></td></tr>
</table></div>
<div class="setlist_table"><table border="0" cellspacing="0" cellpadding="0"><tr class="header"><td><span><a name="0902"></a><a href="/1978-09-02">9/2/1978 Giants Stadium, East Rutherford, NJ</a></span> [<a href="http://www.archive.org/search.php?query=creator:%22Grateful Dead%22%20date:1978-09-02*">Listen/Download</a>]<tr><td>I: Jack Straw, FOTD, Minglewood, Dire Wolf, L. L. Rain, Stagger Lee, Miracle, Peggy-O, Lazy Lightning > Supplication</td></tr>
<tr><td>II: Good Lovin, Scarlet > Fire, Estimated > Eyes > Drumz > Sugar Magnolia</td></tr>
<tr><td>E: Saturday Night</td></tr>
<tr class="notes"><td>Also: NRPS; Willie Nelson.</i></td></tr>
</table></div>
<div class="setlist_table"><table border="0" cellspacing="0" cellpadding="0"><tr class="header"><td><span><a name="0904"></a><a href="/1978-09-04">9/4/1978 Cornell University, Ithaca, NY</a></span> [<a href="http://www.archive.org/search.php?query=creator:%22Grateful Dead%22%20date:1978-09-04*">Listen/Download</a>]<tr><td></td></tr>
<tr class="notes"><td>Backstage passes exist for this show.</i></td></tr>
</table></div>
<div class="setlist_table"><table border="0" cellspacing="0" cellpadding="0"><tr class="header"><td><span><a name="0914"></a><a href="/1978-09-14">9/14/1978 Gizah Sound and Light Theater, Cairo, Egypt</a></span> [<a href="http://www.archive.org/search.php?query=creator:%22Grateful Dead%22%20date:1978-09-14*">Listen/Download</a>]<tr><td>I: Ollin Arageed<span class="setlist_small">*</span> > NFA, Me  and  My Uncle, TLEO, Minglewood, Peggy-O, BIODTL, Deal</td></tr>
<tr><td>II: Sugaree, Samson, Scarlet > Fire, Truckin > Other One > Drumz > Black Peter > Around</td></tr>
<tr class="notes"><td>First ''Ollin Arageed''</i></td></tr>
<tr class="notes"><td>*with Hamza El-Din and others. Soundcheck the day before: Ollin Arageed*, Instrumental*</i></td></tr>
</table></div>
<div class="setlist_table"><table border="0" cellspacing="0" cellpadding="0"><tr class="header"><td><span><a name="0915"></a><a href="/1978-09-15">9/15/1978 Gizah Sound and Light Theater, Cairo, Egypt</a></span> [<a href="http://www.archive.org/search.php?query=creator:%22Grateful Dead%22%20date:1978-09-15*">Listen/Download</a>]<tr><td>I: Ollin Arageed<span class="setlist_small">*</span> > Promised, FOTD, Mama Tried > Big River, Loser, Miracle, Stagger Lee <span class="setlist_small">+#</span></td></tr>
<tr><td>II: Jack Straw <span class="setlist_small">#</span>, Ship Of Fools, Estimated <span class="setlist_small">%</span> > Eyes <span class="setlist_small">%</span> > Drumz<span class="setlist_small">*</span> > Terrapin <span class="setlist_small">%</span> > Sugar Magnolia <span class="setlist_small">%</span></td></tr>
<tr class="notes"><td>*with Hamza El-Din and others. +appears as a "Shakedown Street" bonus track in "Beyond Description (1973-1989)." #appears on "Rockin’ the Cradle: Egypt 1978." %appears on the "Rockin’ the Cradle: Egypt 1978" bonus disc.   </i></td></tr>
</table></div>
<div class="setlist_table"><table border="0" cellspacing="0" cellpadding="0"><tr class="header"><td><span><a name="0916"></a><a href="/1978-09-16">9/16/1978 Gizah Sound and Light Theater, Cairo, Egypt</a></span> [<a href="http://www.archive.org/search.php?query=creator:%22Grateful Dead%22%20date:1978-09-16*">Listen/Download</a>]<tr><td>I: Bertha <span class="setlist_small">%$</span> > Good Lovin <span class="setlist_small">%$</span>, Candyman <span class="setlist_small">#$</span>, L. L. Rain <span class="setlist_small">#$</span>, Row Jimmy <span class="setlist_small">#$</span>, El Paso <span class="setlist_small">%</span>, Ramble On <span class="setlist_small">%</span>, Minglewood <span class="setlist_small">#$</span>, Deal<span class="setlist_small">#$</span></td></tr>
<tr><td>II: Ollin Arageed<span class="setlist_small">*+#$</span> > Fire <span class="setlist_small">+#$</span> > Iko Iko <span class="setlist_small">#$</span>, Miracle <span class="setlist_small">#$</span> > All Over Now <span class="setlist_small">#$</span>, Sunrise, Shakedown <span class="setlist_small">#</span> > Drumz <span class="setlist_small">#</span> > Truckin <span class="setlist_small">#$</span> > Stella Blue <span class="setlist_small">#</span> > Around <span class="setlist_small">#</span></td></tr>
<tr><td>E: Saturday Night</td></tr>
<tr class="notes"><td>Final ''Sunrise''</i></td></tr>
<tr class="notes"><td>Lunar eclipse took place during the first set. *with Hamza El-Din and others. +appears as a "Shakedown Street" bonus track in "Beyond Description (1973-1989)." #appears on "Rockin’ the Cradle: Egypt 1978." %appears on the "Rockin’ the Cradle: Egypt 1978" bonus disc. $appears in the "Rockin’ the Cradle: Egypt 1978" DVD.       </i></td></tr>
</table></div>
<div class="setlist_table"><table border="0" cellspacing="0" cellpadding="0"><tr class="header"><td><span><a name="0929"></a><a href="/1978-09-29">9/29/1978 (unknown), London, England, </a></span> [<a href="http://www.archive.org/search.php?query=creator:%22Grateful Dead%22%20date:1978-09-29*">Listen/Download</a>]<tr><td></td></tr>
<tr class="notes"><td>Rescheduled for these dates after the Europe tour following the Egypt shows was cancelled.</i></td></tr>
</table></div>
<div class="setlist_table"><table border="0" cellspacing="0" cellpadding="0"><tr class="header"><td><span><a name="0930"></a><a href="/1978-09-30">9/30/1978 (unknown), London, England, </a></span> [<a href="http://www.archive.org/search.php?query=creator:%22Grateful Dead%22%20date:1978-09-30*">Listen/Download</a>]<tr><td></td></tr>
<tr class="notes"><td>Rescheduled for these dates after the Europe tour following the Egypt shows was cancelled.</i></td></tr>
</table></div>
<div class="setlist_table"><table border="0" cellspacing="0" cellpadding="0"><tr class="header"><td><span><a name="0930"></a><a href="/1978-09-30">9/30/1978 (unknown), Antwerp, Belgium, </a></span> [<a href="http://www.archive.org/search.php?query=creator:%22Grateful Dead%22%20date:1978-09-30*">Listen/Download</a>]<tr><td></td></tr>
</table></div>
<div class="setlist_table"><table border="0" cellspacing="0" cellpadding="0"><tr class="header"><td><span><a name="1001"></a><a href="/1978-10-01">10/1/1978 (unknown), London, England, </a></span> [<a href="http://www.archive.org/search.php?query=creator:%22Grateful Dead%22%20date:1978-10-01*">Listen/Download</a>]<tr><td></td></tr>
<tr class="notes"><td>Rescheduled for these dates after the Europe tour following the Egypt shows was cancelled.</i></td></tr>
</table></div>
<div class="setlist_table"><table border="0" cellspacing="0" cellpadding="0"><tr class="header"><td><span><a name="1001"></a><a href="/1978-10-01">10/1/1978 Greek Theatre, U. of California, Berkeley, CA</a></span> [<a href="http://www.archive.org/search.php?query=creator:%22Grateful Dead%22%20date:1978-10-01*">Listen/Download</a>]<tr><td></td></tr>
<tr class="notes"><td>Rumors circulated that the Dead would play Chet Helms' Tribal Stomp along with many of the other Avalon-era bands, but they did not. The next day, Phil Elwood reported in the San Francisco Examiner that Phil lesh had played bass with Lee Michaels, not realizing that this Lesh lookalike was actually playing guitar (in previous reviews Elwood referred to "Promised Land" as "High Over Albuquerque").</i></td></tr>
</table></div>
<div class="setlist_table"><table border="0" cellspacing="0" cellpadding="0"><tr class="header"><td><span><a name="1002"></a><a href="/1978-10-02">10/2/1978 (unknown), The Hague, The Netherlands, </a></span> [<a href="http://www.archive.org/search.php?query=creator:%22Grateful Dead%22%20date:1978-10-02*">Listen/Download</a>]<tr><td></td></tr>
</table></div>
<div class="setlist_table"><table border="0" cellspacing="0" cellpadding="0"><tr class="header"><td><span><a name="1004"></a><a href="/1978-10-04">10/4/1978 (unknown), Munich, West Germany, </a></span> [<a href="http://www.archive.org/search.php?query=creator:%22Grateful Dead%22%20date:1978-10-04*">Listen/Download</a>]<tr><td></td></tr>
</table></div>
<div class="setlist_table"><table border="0" cellspacing="0" cellpadding="0"><tr class="header"><td><span><a name="1006"></a><a href="/1978-10-06">10/6/1978 (unknown), Paris, France, </a></span> [<a href="http://www.archive.org/search.php?query=creator:%22Grateful Dead%22%20date:1978-10-06*">Listen/Download</a>]<tr><td></td></tr>
</table></div>
<div class="setlist_table"><table border="0" cellspacing="0" cellpadding="0"><tr class="header"><td><span><a name="1007"></a><a href="/1978-10-07">10/7/1978 (unknown), Paris, France, </a></span> [<a href="http://www.archive.org/search.php?query=creator:%22Grateful Dead%22%20date:1978-10-07*">Listen/Download</a>]<tr><td></td></tr>
</table></div>
<div class="setlist_table"><table border="0" cellspacing="0" cellpadding="0"><tr class="header"><td><span><a name="1009"></a><a href="/1978-10-09">10/9/1978 (unknown), Hamburg, West Germany, </a></span> [<a href="http://www.archive.org/search.php?query=creator:%22Grateful Dead%22%20date:1978-10-09*">Listen/Download</a>]<tr><td></td></tr>
</table></div>
<div class="setlist_table"><table border="0" cellspacing="0" cellpadding="0"><tr class="header"><td><span><a name="1010"></a><a href="/1978-10-10">10/10/1978 (unknown), Frankfurt, West Germany, </a></span> [<a href="http://www.archive.org/search.php?query=creator:%22Grateful Dead%22%20date:1978-10-10*">Listen/Download</a>]<tr><td></td></tr>
</table></div>
<div class="setlist_table"><table border="0" cellspacing="0" cellpadding="0"><tr class="header"><td><span><a name="1011"></a><a href="/1978-10-11">10/11/1978 (unknown), Essen, West Germany, </a></span> [<a href="http://www.archive.org/search.php?query=creator:%22Grateful Dead%22%20date:1978-10-11*">Listen/Download</a>]<tr><td></td></tr>
</table></div>
<div class="setlist_table"><table border="0" cellspacing="0" cellpadding="0"><tr class="header"><td><span><a name="1013"></a><a href="/1978-10-13">10/13/1978 (unknown), Glasgow, Scotland, </a></span> [<a href="http://www.archive.org/search.php?query=creator:%22Grateful Dead%22%20date:1978-10-13*">Listen/Download</a>]<tr><td></td></tr>
</table></div>
<div class="setlist_table"><table border="0" cellspacing="0" cellpadding="0"><tr class="header"><td><span><a name="1014"></a><a href="/1978-10-14">10/14/1978 (unknown), Stafford, England, </a></span> [<a href="http://www.archive.org/search.php?query=creator:%22Grateful Dead%22%20date:1978-10-14*">Listen/Download</a>]<tr><td></td></tr>
</table></div>
<div class="setlist_table"><table border="0" cellspacing="0" cellpadding="0"><tr class="header"><td><span><a name="1016"></a><a href="/1978-10-16">10/16/1978 (unknown), London, England, </a></span> [<a href="http://www.archive.org/search.php?query=creator:%22Grateful Dead%22%20date:1978-10-16*">Listen/Download</a>]<tr><td></td></tr>
</table></div>
<div class="setlist_table"><table border="0" cellspacing="0" cellpadding="0"><tr class="header"><td><span><a name="1017"></a><a href="/1978-10-17">10/17/1978 Winterland Arena, San Francisco, CA</a></span> [<a href="http://www.archive.org/search.php?query=creator:%22Grateful Dead%22%20date:1978-10-17*">Listen/Download</a>]<tr><td>I: Promised, FOTD, Mama Tried > Mexicali, Tennessee Jed, Miracle, Stagger Lee, Jack Straw</td></tr>
<tr><td>II: Scarlet > Fire, Estimated > Eyes > Drumz > World To Give <span class="setlist_small">+</span> > Around <span class="setlist_small">+</span></td></tr>
<tr><td>E: U. S. Blues</td></tr>
<tr class="notes"><td>"From Egypt With Love." +appears on the "Road Trips Vol. 1 No. 4" bonus disc.</i></td></tr>
</table></div>
<div class="setlist_table"><table border="0" cellspacing="0" cellpadding="0"><tr class="header"><td><span><a name="1017"></a><a href="/1978-10-17">10/17/1978 (unknown), London, England, </a></span> [<a href="http://www.archive.org/search.php?query=creator:%22Grateful Dead%22%20date:1978-10-17*">Listen/Download</a>]<tr><td></td></tr>
</table></div>
<div class="setlist_table"><table border="0" cellspacing="0" cellpadding="0"><tr class="header"><td><span><a name="1018"></a><a href="/1978-10-18">10/18/1978 Winterland Arena, San Francisco, CA</a></span> [<a href="http://www.archive.org/search.php?query=creator:%22Grateful Dead%22%20date:1978-10-18*">Listen/Download</a>]<tr><td>I: Sugaree, Me  and  My Uncle > Big River, Peggy-O, L. L. Rain, Stagger Lee, Minglewood, Candyman, Music</td></tr>
<tr><td>II: Bertha > Good Lovin, Heart Of Me, Ship Of Fools, Samson, Terrapin > Playin > Drumz<span class="setlist_small">*</span> > Mojo Jam > Wharf Rat > Truckin</td></tr>
<tr><td>E: Miracle</td></tr>
<tr class="notes"><td>"From Egypt With Love." *with Lee Oskar. "Mojo Jam" contains "Mind Left Body Jam" theme.</i></td></tr>
</table></div>
<div class="setlist_table"><table border="0" cellspacing="0" cellpadding="0"><tr class="header"><td><span><a name="1020"></a><a href="/1978-10-20">10/20/1978 Winterland Arena, San Francisco, CA</a></span> [<a href="http://www.archive.org/search.php?query=creator:%22Grateful Dead%22%20date:1978-10-20*">Listen/Download</a>]<tr><td>I: Minglewood, TLEO, Cassidy, Dire Wolf, El Paso, Tennessee Jed, All Over Now, Loser, Lazy Lightning > Supplication</td></tr>
<tr><td>II: Half Step > Franklin's, Dancin > Drumz > NFA > Black Peter > Around</td></tr>
<tr><td>E1: Johnny B. Goode</td></tr>
<tr><td>E2: Shakedown</td></tr>
<tr class="notes"><td>"From Egypt With Love."</i></td></tr>
</table></div>
<div class="setlist_table"><table border="0" cellspacing="0" cellpadding="0"><tr class="header"><td><span><a name="1021"></a><a href="/1978-10-21">10/21/1978 Winterland Arena, San Francisco, CA</a></span> [<a href="http://www.archive.org/search.php?query=creator:%22Grateful Dead%22%20date:1978-10-21*">Listen/Download</a>]<tr><td>I: Ollin Arageed<span class="setlist_small">*</span> > Promised, Sugaree <span class="setlist_small">#</span>, Passenger <span class="setlist_small">#</span>, Ramble On, L. L. Rain, Stagger Lee <span class="setlist_small">#</span>, Miracle <span class="setlist_small">#</span></td></tr>
<tr><td>II: Bertha <span class="setlist_small">%</span> > Good Lovin <span class="setlist_small">%</span>, Roses, Estimated <span class="setlist_small">%</span> > He's Gone <span class="setlist_small">%</span> > Drumz<span class="setlist_small">+</span> > Mojo<span class="setlist_small">+#</span> > Other One<span class="setlist_small">+#</span> > Stella Blue<span class="setlist_small">+#</span> > Sugar Magnolia <span class="setlist_small">#</span></td></tr>
<tr><td>E: U. S. Blues <span class="setlist_small">#</span></td></tr>
<tr class="notes"><td>Previous ''Mojo'' 4/22/1977 [112 shows]; Final ''Mojo''</i></td></tr>
<tr class="notes"><td>"From Egypt With Love." *with Hamza El-Din and members of the Sufi Choir. +with Lee Oskar.  #appears on "Road Trips Vol. 1 No. 4." %appears on the "Road Trips Vol. 1 No. 4" bonus disc. Hamza El-Din performed a couple of solo songs before "Ollin Arageed."  </i></td></tr>
</table></div>
<div class="setlist_table"><table border="0" cellspacing="0" cellpadding="0"><tr class="header"><td><span><a name="1022"></a><a href="/1978-10-22">10/22/1978 Winterland Arena, San Francisco, CA</a></span> [<a href="http://www.archive.org/search.php?query=creator:%22Grateful Dead%22%20date:1978-10-22*">Listen/Download</a>]<tr><td>I: Ollin Arageed<span class="setlist_small">*%</span> > Deal <span class="setlist_small">%</span>, Me  and  My Uncle > Big River, FOTD, Minglewood, Peggy-O <span class="setlist_small">%</span>, Jack Straw <span class="setlist_small">%</span></td></tr>
<tr><td>II: Scarlet <span class="setlist_small">%</span> > Fire <span class="setlist_small">%</span>, Samson, Heart Of Me, Miracle > Drumz<span class="setlist_small">+</span> > NFA<span class="setlist_small">#%</span> > Caution Jam<span class="setlist_small">#%</span> > Mojo Jam<span class="setlist_small">#%</span> > GDTRFB<span class="setlist_small">#%</span></td></tr>
<tr><td>E: Johnny B. Goode</td></tr>
<tr class="notes"><td>"From Egypt With Love." *with Hamza El-Din and members of the Sufi Choir.  +with Lee Oskar.  #with John Cipollina. %appears on "Road Trips Vol. 1 No. 4." Hamza El-Din performed a couple of solo songs before "Ollin Arageed."</i></td></tr>
</table></div>
<div class="setlist_table"><table border="0" cellspacing="0" cellpadding="0"><tr class="header"><td><span><a name="1111"></a><a href="/1978-11-11">11/11/1978 NBC Studios, New York, NY</a></span> [<a href="http://www.archive.org/search.php?query=creator:%22Grateful Dead%22%20date:1978-11-11*">Listen/Download</a>]<tr><td>I: Casey Jones</td></tr>
<tr><td>II: Miracle > Good Lovin</td></tr>
<tr class="notes"><td>"Saturday Night Live" TV broadcast. Entire set appears on "Saturday Night Live: The Complete Fourth Season" DVD.</i></td></tr>
</table></div>
<div class="setlist_table"><table border="0" cellspacing="0" cellpadding="0"><tr class="header"><td><span><a name="1113"></a><a href="/1978-11-13">11/13/1978 Boston Music Hall, Boston, MA</a></span> [<a href="http://www.archive.org/search.php?query=creator:%22Grateful Dead%22%20date:1978-11-13*">Listen/Download</a>]<tr><td>I: Promised, TLEO, Mama Tried > Mexicali, Peggy-O, Cassidy, Tennessee Jed, Minglewood, Stagger Lee, Jack Straw</td></tr>
<tr><td>II: Half Step > Franklin's, Samson, FOTD, Playin > Drumz > Black Peter > Playin > Around</td></tr>
<tr><td>E: U. S. Blues</td></tr>
</table></div>
<div class="setlist_table"><table border="0" cellspacing="0" cellpadding="0"><tr class="header"><td><span><a name="1114"></a><a href="/1978-11-14">11/14/1978 Boston Music Hall, Boston, MA</a></span> [<a href="http://www.archive.org/search.php?query=creator:%22Grateful Dead%22%20date:1978-11-14*">Listen/Download</a>]<tr><td>I: Sugaree, El Paso, Candyman, All Over Now, Loser, Passenger, Stagger Lee, Miracle</td></tr>
<tr><td>II: Bertha > Good Lovin, Heart Of Me, Ship Of Fools, Estimated > Eyes > Drumz > Wharf Rat > NFA > GDTRFB</td></tr>
<tr><td>E: Johnny B. Goode</td></tr>
</table></div>
<div class="setlist_table"><table border="0" cellspacing="0" cellpadding="0"><tr class="header"><td><span><a name="1116"></a><a href="/1978-11-16">11/16/1978 Uptown Theatre, Chicago, IL</a></span> [<a href="http://www.archive.org/search.php?query=creator:%22Grateful Dead%22%20date:1978-11-16*">Listen/Download</a>]<tr><td>I: Minglewood, Dire Wolf, Me  and  My Uncle > Big River, TLEO, L. L. Rain, B. E. Women, BIODTL, Stagger Lee, Dancin > Deal</td></tr>
<tr><td>II: Scarlet > Fire, Samson, He's Gone > Drumz > Black Peter > Truckin</td></tr>
<tr><td>E: U. S. Blues</td></tr>
</table></div>
<div class="setlist_table"><table border="0" cellspacing="0" cellpadding="0"><tr class="header"><td><span><a name="1117"></a><a href="/1978-11-17">11/17/1978 Uptown Theatre, Chicago, IL</a></span> [<a href="http://www.archive.org/search.php?query=creator:%22Grateful Dead%22%20date:1978-11-17*">Listen/Download</a>]<tr><td>I: Shakedown, Mama Tried > Mexicali, Peggy-O, Cassidy, Tennessee Jed, Passenger, FOTD, Miracle</td></tr>
<tr><td>II: Bertha > Good Lovin, Ship Of Fools, Estimated > Eyes > Drumz > Terrapin > Around</td></tr>
<tr><td>E: Casey Jones</td></tr>
<tr class="notes"><td>Previous ''Casey Jones'' 12/31/1977 [63 shows]</i></td></tr>
</table></div>
<div class="setlist_table"><table border="0" cellspacing="0" cellpadding="0"><tr class="header"><td><span><a name="1117"></a><a href="/1978-11-17">11/17/1978 Rambler Room, Loyola University, Chicago, IL</a></span> [<a href="http://www.archive.org/search.php?query=creator:%22Grateful Dead%22%20date:1978-11-17*">Listen/Download</a>]<tr><td>Winin' Boy Blues, Tom Dooley <span class="setlist_small">*</span>, This Time Forever, Deep Elem <span class="setlist_small">*</span>, K. C. Moan, heaven's Door, Big Boy Pete, Jack A Roe, Dark Hollow, Oh Boy </td></tr>
<tr class="notes"><td>Bob Weir & Friends: Weir, Garcia, Lesh, and Hart. Hunger Week Benefit. *appears as a "Reckoning" bonus tracks in "Beyond Description (1973-1989)."</i></td></tr>
</table></div>
<div class="setlist_table"><table border="0" cellspacing="0" cellpadding="0"><tr class="header"><td><span><a name="1118"></a><a href="/1978-11-18">11/18/1978 Uptown Theatre, Chicago, IL</a></span> [<a href="http://www.archive.org/search.php?query=creator:%22Grateful Dead%22%20date:1978-11-18*">Listen/Download</a>]<tr><td>I: Jack Straw, Candyman, Me  and  My Uncle > Big River, Sugaree, El Paso, Stagger Lee, All Over Now, Heart Of Me, Music</td></tr>
<tr><td>II: Scarlet > Fire, Miracle > He's Gone > Other One > Drumz > Wharf Rat > Sugar Magnolia</td></tr>
<tr><td>E: Saturday Night</td></tr>
</table></div>
<div class="setlist_table"><table border="0" cellspacing="0" cellpadding="0"><tr class="header"><td><span><a name="1120"></a><a href="/1978-11-20">11/20/1978 Cleveland Music Hall, Cleveland, OH</a></span> [<a href="http://www.archive.org/search.php?query=creator:%22Grateful Dead%22%20date:1978-11-20*">Listen/Download</a>]<tr><td>I: Half Step > Franklin's, Mama Tried > Mexicali, Roses, L. L. Rain, Stagger Lee, Passenger, Peggy-O, Lazy Lightning > Supplication</td></tr>
<tr><td>II: Jam > Drumz > Jam > Jack A Roe, Playin > Shakedown > World To Give > Playin > Around</td></tr>
<tr class="notes"><td>Previous ''Jack A Roe'' 6/8/1977 [91 shows]; Final ''World To Give''</i></td></tr>
</table></div>
<div class="setlist_table"><table border="0" cellspacing="0" cellpadding="0"><tr class="header"><td><span><a name="1121"></a><a href="/1978-11-21">11/21/1978 Community War Memorial, Rochester, NY</a></span> [<a href="http://www.archive.org/search.php?query=creator:%22Grateful Dead%22%20date:1978-11-21*">Listen/Download</a>]<tr><td>I: Promised, TLEO, Cassidy, Dire Wolf, Me  and  My Uncle > Big River, Row Jimmy, Minglewood, Loser, Jack Straw > Deal</td></tr>
<tr><td>II: Bertha > Good Lovin, Stagger Lee, Estimated > Eyes > Drumz > NFA > Black Peter > Truckin</td></tr>
<tr><td>E: Johnny B. Goode</td></tr>
<tr class="notes"><td>"Funiculi Funicula" tuning before "Me and My Uncle."</i></td></tr>
</table></div>
<div class="setlist_table"><table border="0" cellspacing="0" cellpadding="0"><tr class="header"><td><span><a name="1123"></a><a href="/1978-11-23">11/23/1978 Capital Centre, Landover, MD</a></span> [<a href="http://www.archive.org/search.php?query=creator:%22Grateful Dead%22%20date:1978-11-23*">Listen/Download</a>]<tr><td>I: Half Step > Franklin's > Minglewood, Stagger Lee, L. L. Rain, Tennessee Jed, Passenger, B. E. Women, Music</td></tr>
<tr><td>II: Samson, FOTD, Dancin > Terrapin > Playin > Drumz > Ollin Arrageed Jam > Shakedown > Playin > Around</td></tr>
<tr><td>E: U. S. Blues</td></tr>
<tr class="notes"><td>Only "Ollin Arrageed Jam."</i></td></tr>
</table></div>
<div class="setlist_table"><table border="0" cellspacing="0" cellpadding="0"><tr class="header"><td><span><a name="1124"></a><a href="/1978-11-24">11/24/1978 Capitol Theatre, Passaic, NJ</a></span> [<a href="http://www.archive.org/search.php?query=creator:%22Grateful Dead%22%20date:1978-11-24*">Listen/Download</a>]<tr><td>I: Jack Straw, Sugaree, Me  and  My Uncle > Big River, Stagger Lee, Passenger, Candyman, Minglewood <span class="setlist_small">+</span>, Heart Of Me, Loser, Promised</td></tr>
<tr><td>II: Miracle > Good Lovin, FOTD, Estimated <span class="setlist_small">#</span> > Shakedown > Drumz > Ollin Arageed<span class="setlist_small">*</span> > Fire > Sugar Magnolia</td></tr>
<tr><td>E: Johnny B. Goode</td></tr>
<tr class="notes"><td>Nationwide FM broadcast. *with Hamza El-Din. +appears as a Shakedown Street bonus track in "Beyond Decription (1973-1989)." #appears in the "Grateful Dead Through The Years" DVD included in the deluxe edition of the "Grateful Dead Scrapbook." Soundcheck: "Stagger Lee", "Miracle", "Good Lovin."</i></td></tr>
</table></div>
<div class="setlist_table"><table border="0" cellspacing="0" cellpadding="0"><tr class="header"><td><span><a name="1125"></a><a href="/1978-11-25">11/25/1978 New Haven Coliseum, New Haven, CT</a></span> [<a href="http://www.archive.org/search.php?query=creator:%22Grateful Dead%22%20date:1978-11-25*">Listen/Download</a>]<tr><td></td></tr>
<tr class="notes"><td>Cancelled due to garcia's throat condition.</i></td></tr>
</table></div>
<div class="setlist_table"><table border="0" cellspacing="0" cellpadding="0"><tr class="header"><td><span><a name="1127"></a><a href="/1978-11-27">11/27/1978 The Spectrum, Philadelphia, PA</a></span> [<a href="http://www.archive.org/search.php?query=creator:%22Grateful Dead%22%20date:1978-11-27*">Listen/Download</a>]<tr><td></td></tr>
<tr class="notes"><td>Rescheduled for 01-05-79 due to garcia's throat condition.</i></td></tr>
</table></div>
<div class="setlist_table"><table border="0" cellspacing="0" cellpadding="0"><tr class="header"><td><span><a name="1128"></a><a href="/1978-11-28">11/28/1978 The Spectrum, Philadelphia, PA</a></span> [<a href="http://www.archive.org/search.php?query=creator:%22Grateful Dead%22%20date:1978-11-28*">Listen/Download</a>]<tr><td></td></tr>
<tr class="notes"><td>Rescheduled for 01-12-79 due to Garcia's throat condition.</i></td></tr>
</table></div>
<div class="setlist_table"><table border="0" cellspacing="0" cellpadding="0"><tr class="header"><td><span><a name="1130"></a><a href="/1978-11-30">11/30/1978 Madison Square Garden, New York, NY</a></span> [<a href="http://www.archive.org/search.php?query=creator:%22Grateful Dead%22%20date:1978-11-30*">Listen/Download</a>]<tr><td></td></tr>
<tr class="notes"><td>Rescheduled for 01-07-79 due to Garcia's throat condition.</i></td></tr>
</table></div>
<div class="setlist_table"><table border="0" cellspacing="0" cellpadding="0"><tr class="header"><td><span><a name="1201"></a><a href="/1978-12-01">12/1/1978 Madison Square Garden, New York, NY</a></span> [<a href="http://www.archive.org/search.php?query=creator:%22Grateful Dead%22%20date:1978-12-01*">Listen/Download</a>]<tr><td></td></tr>
<tr class="notes"><td>Rescheduled for 01-08-79 due to Garcia's throat condition.</i></td></tr>
</table></div>
<div class="setlist_table"><table border="0" cellspacing="0" cellpadding="0"><tr class="header"><td><span><a name="1212"></a><a href="/1978-12-12">12/12/1978 Jai-Alai Fronton, Miami, FL</a></span> [<a href="http://www.archive.org/search.php?query=creator:%22Grateful Dead%22%20date:1978-12-12*">Listen/Download</a>]<tr><td>I: Half Step > Franklin's, L. L. Rain, Peggy-O, Me  and  My Uncle > Big River, Ramble On, Minglewood, Stagger Lee, Music</td></tr>
<tr><td>II: Bertha > Good Lovin, B. E. Women, Estimated > Eyes > Drumz > NFA > GDTRFB > Around</td></tr>
<tr><td>E: U. S. Blues</td></tr>
</table></div>
<div class="setlist_table"><table border="0" cellspacing="0" cellpadding="0"><tr class="header"><td><span><a name="1213"></a><a href="/1978-12-13">12/13/1978 Curtis Hixon Convention Hall, Tampa, FL</a></span> [<a href="http://www.archive.org/search.php?query=creator:%22Grateful Dead%22%20date:1978-12-13*">Listen/Download</a>]<tr><td>I: Passenger, TLEO, Mama Tried > Mexicali, Candyman, El Paso, Tennessee Jed, All Over Now, Loser, Jack Straw > Deal</td></tr>
<tr><td>II: Miracle, Ship Of Fools, Playin > Drumz > Shakedown > Black Peter > Playin > Sugar Magnolia</td></tr>
<tr><td>E: Johnny B. Goode</td></tr>
</table></div>
<div class="setlist_table"><table border="0" cellspacing="0" cellpadding="0"><tr class="header"><td><span><a name="1215"></a><a href="/1978-12-15">12/15/1978 Boutwell Auditorium, Birmingham, AL</a></span> [<a href="http://www.archive.org/search.php?query=creator:%22Grateful Dead%22%20date:1978-12-15*">Listen/Download</a>]<tr><td>I: Promised, Shakedown, Minglewood, FOTD, El Paso, Heart Of Me, B. E. Women, Cassidy, Deal</td></tr>
<tr><td>II: Miracle > Bertha > Good Lovin, Roses, Terrapin > Playin > Drumz > Stella Blue > Truckin > Playin</td></tr>
<tr><td>E: U. S. Blues</td></tr>
</table></div>
<div class="setlist_table"><table border="0" cellspacing="0" cellpadding="0"><tr class="header"><td><span><a name="1216"></a><a href="/1978-12-16">12/16/1978 Nashville Municipal Auditorium, Nashville, TN</a></span> [<a href="http://www.archive.org/search.php?query=creator:%22Grateful Dead%22%20date:1978-12-16*">Listen/Download</a>]<tr><td>I: Sugaree, BIODTL, Candyman, Me  and  My Uncle > Big River, Stagger Lee, L. L. Rain, Tennessee Jed, Lazy Lightning > Supplication</td></tr>
<tr><td>II: Scarlet > Fire, Samson, Heart Of Me, He's Gone > Drumz > Other One > Wharf Rat > Around</td></tr>
<tr><td>E: Saturday Night</td></tr>
</table></div>
<div class="setlist_table"><table border="0" cellspacing="0" cellpadding="0"><tr class="header"><td><span><a name="1217"></a><a href="/1978-12-17">12/17/1978 Fox Theatre, Atlanta, GA</a></span> [<a href="http://www.archive.org/search.php?query=creator:%22Grateful Dead%22%20date:1978-12-17*">Listen/Download</a>]<tr><td>I: Jack Straw, TLEO, Mama Tried > Mexicali, Peggy-O, Passenger, Stagger Lee, Minglewood, B. E. Women, Music</td></tr>
<tr><td>II: Miracle > Bertha > Good Lovin, Ramble On, Heart Of Me, Estimated > Eyes > Drumz > Shakedown > Sugar Magnolia</td></tr>
<tr><td>E: Johnny B. Goode</td></tr>
</table></div>
<div class="setlist_table"><table border="0" cellspacing="0" cellpadding="0"><tr class="header"><td><span><a name="1219"></a><a href="/1978-12-19">12/19/1978 Memorial Coliseum, State Fairgrounds, Jackson, MS</a></span> [<a href="http://www.archive.org/search.php?query=creator:%22Grateful Dead%22%20date:1978-12-19*">Listen/Download</a>]<tr><td>I: Half Step > Franklin's, Minglewood, TLEO, Me  and  My Uncle > Big River, Loser, El Paso, Row Jimmy, Lazy Lightning > Supplication</td></tr>
<tr><td>II: Scarlet > Fire, Promised, Stagger Lee, Truckin > Drumz > Other One > Stella Blue > NFA > Around</td></tr>
<tr><td>E: Casey Jones</td></tr>
<tr class="notes"><td>Post-Drumz is without Donna.</i></td></tr>
</table></div>
<div class="setlist_table"><table border="0" cellspacing="0" cellpadding="0"><tr class="header"><td><span><a name="1221"></a><a href="/1978-12-21">12/21/1978 The Summit, Houston, TX</a></span> [<a href="http://www.archive.org/search.php?query=creator:%22Grateful Dead%22%20date:1978-12-21*">Listen/Download</a>]<tr><td>I: Jack Straw, Dire Wolf, Cassidy, Stagger Lee, Mama Tried > Mexicali, FOTD, All Over Now, B. E. Women, Passenger, Peggy-O, Music</td></tr>
<tr><td>II: Miracle > Bertha > Good Lovin, Heart Of Me, Terrapin > Playin > Drumz > Black Peter > Playin > Sugar Magnolia</td></tr>
<tr><td>E: U.S. Blues</td></tr>
</table></div>
<div class="setlist_table"><table border="0" cellspacing="0" cellpadding="0"><tr class="header"><td><span><a name="1222"></a><a href="/1978-12-22">12/22/1978 Dallas Convention Center Arena, Dallas, TX</a></span> [<a href="http://www.archive.org/search.php?query=creator:%22Grateful Dead%22%20date:1978-12-22*">Listen/Download</a>]<tr><td>I: Shakedown, Me  and  My Uncle > Big River, Tennessee Jed, L. L. Rain, Stagger Lee, BIODTL, Candyman, Minglewood > Deal</td></tr>
<tr><td>II: Scarlet > Fire, Heart Of Me, Estimated > Eyes > Drumz > NFA > Wharf Rat</td></tr>
<tr class="notes"><td>It is not known for sure what comes after "Wharf Rat," as the only extant recording of the show cuts there. DeadLists has "Around and Around" ending the second set, but while likely, this appears to be conjecture on their part.</i></td></tr>
</table></div>
<div class="setlist_table"><table border="0" cellspacing="0" cellpadding="0"><tr class="header"><td><span><a name="1227"></a><a href="/1978-12-27">12/27/1978 Golden Hall, Community Concourse, San Diego, CA</a></span> [<a href="http://www.archive.org/search.php?query=creator:%22Grateful Dead%22%20date:1978-12-27*">Listen/Download</a>]<tr><td>I: Promised, FOTD, Cassidy, Peggy-O, Mama Tried > Mexicali, Half Step > Franklin's, Music</td></tr>
<tr><td>II: Bertha > Good Lovin, Ship Of Fools, Samson, Terrapin > Playin > Drumz > NFA > Black Peter > Around</td></tr>
<tr><td>E: U. S. Blues</td></tr>
</table></div>
<div class="setlist_table"><table border="0" cellspacing="0" cellpadding="0"><tr class="header"><td><span><a name="1228"></a><a href="/1978-12-28">12/28/1978 Golden Hall, Community Concourse, San Diego, CA</a></span> [<a href="http://www.archive.org/search.php?query=creator:%22Grateful Dead%22%20date:1978-12-28*">Listen/Download</a>]<tr><td>I: Sugaree, BIODTL, Dire Wolf, L. L. Rain, Stagger Lee, Me  and  My Uncle > Big River, Candyman, Minglewood, Tennessee Jed, Lazy Lightning > Supplication</td></tr>
<tr><td>II: Shakedown, Heart Of Me, Estimated > Eyes > Drumz > Truckin > Wharf Rat > Sugar Magnolia</td></tr>
<tr><td>E: Johnny B. Goode</td></tr>
<tr class="notes"><td>"Funiculi Funicula" tuning before "BIODTL."</i></td></tr>
</table></div>
<div class="setlist_table"><table border="0" cellspacing="0" cellpadding="0"><tr class="header"><td><span><a name="1230"></a><a href="/1978-12-30">12/30/1978 Pauley Pavilion, U.C.L.A., Los Angeles, CA</a></span> [<a href="http://www.archive.org/search.php?query=creator:%22Grateful Dead%22%20date:1978-12-30*">Listen/Download</a>]<tr><td>I: Jack Straw, TLEO, Mama Tried > Mexicali, Loser, L. L. Rain, Stagger Lee, Passenger, Tennessee Jed, Minglewood, Sugaree, Promised</td></tr>
<tr><td>II: Miracle > Bertha > Good Lovin, Scarlet > Fire, Playin > Shakedown > Drumz > Ollin Arageed<span class="setlist_small">*</span> > St. Stephen > NFA > GDTRFB > Around<span class="setlist_small">+</span></td></tr>
<tr><td>E: Saturday Night</td></tr>
<tr class="notes"><td>Previous ''St. Stephen'' 1/22/1978 [68 shows]</i></td></tr>
<tr class="notes"><td>*with Hamza El-Din.  +with Lee Oskar.</i></td></tr>
</table></div>
<div class="setlist_table"><table border="0" cellspacing="0" cellpadding="0"><tr class="header"><td><span><a name="1230"></a><a href="/1978-12-30">12/30/1978 (unknown), San Francisco, CA</a></span> [<a href="http://www.archive.org/search.php?query=creator:%22Grateful Dead%22%20date:1978-12-30*">Listen/Download</a>]<tr><td></td></tr>
<tr class="notes"><td>Dead booked that night for UCLA instead.</i></td></tr>
</table></div>
<div class="setlist_table"><table border="0" cellspacing="0" cellpadding="0"><tr class="header"><td><span><a name="1231"></a><a href="/1978-12-31">12/31/1978 Winterland Arena, San Francisco, CA</a></span> [<a href="http://www.archive.org/search.php?query=creator:%22Grateful Dead%22%20date:1978-12-31*">Listen/Download</a>]<tr><td>I: Sugar Magnolia > Scarlet > Fire, Me  and  My Uncle > Big River, FOTD, All Over Now, Stagger Lee, Heart Of Me > Sunshine Daydream</td></tr>
<tr><td>II: Samson, Ramble On, Miracle<span class="setlist_small">*</span> > Terrapin > Playin > Drumz<span class="setlist_small">+#%</span> > NFA<span class="setlist_small">*+%$</span> > Around<span class="setlist_small">*+%$</span></td></tr>
<tr><td>III: Dark Star > Other One > Dark Star > Wharf Rat > St. Stephen > Good Lovin</td></tr>
<tr><td>E1: Casey Jones > Johnny B. Goode</td></tr>
<tr><td>E2: We Bid You Goodnight</td></tr>
<tr class="notes"><td>Next ''We Bid You Goodnight'' 7/17/1989 [756 shows]</i></td></tr>
<tr class="notes"><td>"The Closing of Winterland." "Breakfast served at dawn." FM broadcast KSAN-San Francisco, TV broadcast KQED-San Francisco. Bill Graham flies in on a joint at midnight. Blues Brothers, then NRPS opened. *with Matt Kelly. +with Lee Oskar. #with Ken Kesey, Ken Babbs, The Merry Pranksters, and the Thunder Machine.  % with Greg Errico. $with John Cipollina. Entire show released as "The Closing of Winterland" on CD and DVD. </i></td></tr>
</table></div>

  </div>
 </div><!--END main-->

</div><!--END container -->
</div><!--END centering div-->
</body>
</html>