<!DOCTYPE HTML PUBLIC "-//W3C//DTD HTML 4.01 Transitional//EN"
"http://www.w3.org/TR/html4/loose.dtd">
<html>
  <head>
    <meta http-equiv="Content-Type" content="text/html; charset=utf-8">
    <title>
      1983 Setlists
    </title>
  </head>
  <body>
    <div id="main">
      <div>
        1983 Setlists
      </div><script language="Javascript" type="text/javascript">
<!--
      function showtab () {
      document.getElementById('hide').style.display = 'none';
      document.getElementById('show').style.display = 'block';
      }
      function hidetab () {
      document.getElementById('show').style.display = 'none';
      document.getElementById('hide').style.display = 'block';
      }
      -->
      </script>
      <p>
        January: <a href="#0124">24</a> <a href="#0131">31</a>
        <br>
        February: <a href="#0201">1</a> <a href="#0206">6</a>
        <br>
        March: <a href="#0302">2</a> <a href="#0314">14</a> <a href="#0325">25</a> <a href="#0326">26</a> <a href="#0327">27</a> <a href="#0329">29</a> <a href="#0330">30</a> <a href="#0331">31</a>
        <br>
        April: <a href="#0409">9</a> <a href="#0410">10</a> <a href="#0412">12</a> <a href="#0413">13</a> <a href="#0415">15</a> <a href="#0416">16</a> <a href="#0417">17</a> <a href="#0419">19</a> <a href="#0420">20</a> <a href="#0422">22</a> <a href="#0423">23</a> <a href="#0425">25</a> <a href="#0426">26</a>
        <br>
        May: <a href="#0511">11</a> <a href="#0513">13</a> <a href="#0514">14</a> <a href="#0515">15</a>
        <br>
        June: <a href="#0618">18</a> <a href="#0620">20</a> <a href="#0621">21</a> <a href="#0622">22</a> <a href="#0624">24</a> <a href="#0625">25</a> <a href="#0627">27</a> <a href="#0628">28</a>
        <br>
        July: <a href="#0730">30</a> <a href="#0731">31</a>
        <br>
        August: <a href="#0820">20</a> <a href="#0821">21</a> <a href="#0826">26</a> <a href="#0827">27</a> <a href="#0829">29</a> <a href="#0830">30</a> <a href="#0831">31</a>
        <br>
        September: <a href="#0902">2</a> <a href="#0904">4</a> <a href="#0906">6</a> <a href="#0907">7</a> <a href="#0908">8</a> <a href="#0910">10</a> <a href="#0911">11</a> <a href="#0913">13</a> <a href="#0918">18</a> <a href="#0924">24</a>
        <br>
        October: <a href="#1008">8</a> <a href="#1009">9</a> <a href="#1011">11</a> <a href="#1012">12</a> <a href="#1014">14</a> <a href="#1015">15</a> <a href="#1017">17</a> <a href="#1018">18</a> <a href="#1020">20</a> <a href="#1021">21</a> <a href="#1022">22</a> <a href="#1030">30</a> <a href="#1031">31</a>
        <br>
        December: <a href="#1227">27</a> <a href="#1228">28</a> <a href="#1230">30</a> <a href="#1231">31</a>
      </p>
      <div>
        <table border="0" cellspacing="0" cellpadding="0">
          <tr>
            <td id="0124">
              <a href="/1983-01-24">1/24/1983 Sun House Studio, (unknown), CA</a> [<a href="http://www.archive.org/search.php?query=creator:%22Grateful%20Dead%22%20date:1983-01-24*">Listen/Download</a>]
            </td>
          </tr>
          <tr>
            <td>
              Jam x13, Bucket x5
            </td>
          </tr>
          <tr>
            <td>
              Studio session.
            </td>
          </tr>
        </table>
      </div>
      <div>
        <table border="0" cellspacing="0" cellpadding="0">
          <tr>
            <td id="0131">
              <a href="/1983-01-31">1/31/1983 Sun House Studio, (unknown), CA</a> [<a href="http://www.archive.org/search.php?query=creator:%22Grateful%20Dead%22%20date:1983-01-31*">Listen/Download</a>]
            </td>
          </tr>
          <tr>
            <td>
              Molly Dee x16
            </td>
          </tr>
          <tr>
            <td>
              Studio session.
            </td>
          </tr>
        </table>
      </div>
      <div>
        <table border="0" cellspacing="0" cellpadding="0">
          <tr>
            <td id="0201">
              <a href="/1983-02-01">2/1/1983 Sun House Studio, (unknown), CA</a> [<a href="http://www.archive.org/search.php?query=creator:%22Grateful%20Dead%22%20date:1983-02-01*">Listen/Download</a>]
            </td>
          </tr>
          <tr>
            <td>
              North By Northeast, Northeast By West, UFO
            </td>
          </tr>
          <tr>
            <td>
              Studio session.
            </td>
          </tr>
        </table>
      </div>
      <div>
        <table border="0" cellspacing="0" cellpadding="0">
          <tr>
            <td id="0206">
              <a href="/1983-02-06">2/6/1983 Sun House Studio, (unknown), CA</a> [<a href="http://www.archive.org/search.php?query=creator:%22Grateful%20Dead%22%20date:1983-02-06*">Listen/Download</a>]
            </td>
          </tr>
          <tr>
            <td>
              Victory x9
            </td>
          </tr>
          <tr>
            <td>
              Studio session.
            </td>
          </tr>
        </table>
      </div>
      <div>
        <table border="0" cellspacing="0" cellpadding="0">
          <tr>
            <td id="0302">
              <a href="/1983-03-02">3/2/1983 San Francisco Civic Auditorium, San Francisco, CA</a> [<a href="http://www.archive.org/search.php?query=creator:%22Grateful%20Dead%22%20date:1983-03-02*">Listen/Download</a>]
            </td>
          </tr>
          <tr>
            <td>
              Wake Up Little Susie @ &gt; Deep Elem @, Mexicali @, Oh Boy @
            </td>
          </tr>
          <tr>
            <td>
              The Bay Area Music Awards (Bammies). Jerry Garcia & Bob Weir. FM broadcast KFOG-San Francisco.
            </td>
          </tr>
        </table>
      </div>
      <div>
        <table border="0" cellspacing="0" cellpadding="0">
          <tr>
            <td id="0314">
              <a href="/1983-03-14">3/14/1983 Le Club Front, San Rafael, CA</a> [<a href="http://www.archive.org/search.php?query=creator:%22Grateful%20Dead%22%20date:1983-03-14*">Listen/Download</a>]
            </td>
          </tr>
          <tr>
            <td>
              Help &gt; Slipknot &gt; Franklin's x15, Esau
            </td>
          </tr>
          <tr>
            <td>
              Rehearsal.
            </td>
          </tr>
        </table>
      </div>
      <div>
        <table border="0" cellspacing="0" cellpadding="0">
          <tr>
            <td id="0325">
              <a href="/1983-03-25">3/25/1983 Compton Terrace Amphitheatre, Tempe, AZ</a> [<a href="http://www.archive.org/search.php?query=creator:%22Grateful%20Dead%22%20date:1983-03-25*">Listen/Download</a>]
            </td>
          </tr>
          <tr>
            <td>
              I: Cold Rain, Minglewood, Dire Wolf, Esau, Big RxR Blues, Me and My Uncle &gt; Big River, Tennessee Jed &gt; Let It Grow
            </td>
          </tr>
          <tr>
            <td>
              II: Help &gt; Slipknot &gt; Franklin's &gt; Playin &gt; Drumz &gt; Throwing Stones &gt; NFA &gt; Black Peter &gt; Sugar Magnolia
            </td>
          </tr>
          <tr>
            <td>
              E: Don't Ease
            </td>
          </tr>
          <tr>
            <td>
              First ''Esau''; Previous ''Help'' 10/11/1977 [401 shows]; Previous ''Slipknot'' 10/11/1977 [401 shows]
            </td>
          </tr>
        </table>
      </div>
      <div>
        <table border="0" cellspacing="0" cellpadding="0">
          <tr>
            <td id="0326">
              <a href="/1983-03-26">3/26/1983 Aladdin Theatre, Las Vegas, NV</a> [<a href="http://www.archive.org/search.php?query=creator:%22Grateful%20Dead%22%20date:1983-03-26*">Listen/Download</a>]
            </td>
          </tr>
          <tr>
            <td>
              I: Jack Straw, FOTD, Rooster, B. E. Women, Mama Tried &gt; Mexicali, Althea, Esau, Deal &gt; Promised
            </td>
          </tr>
          <tr>
            <td>
              II: Scarlet &gt; Fire, Estimated &gt; Eyes &gt; Other One &gt; Drumz &gt; Other One &gt; Stella Blue &gt; Around &gt; Saturday Night
            </td>
          </tr>
          <tr>
            <td>
              E: Touch
            </td>
          </tr>
        </table>
      </div>
      <div>
        <table border="0" cellspacing="0" cellpadding="0">
          <tr>
            <td id="0327">
              <a href="/1983-03-27">3/27/1983 Irvine Meadows Amphitheatre, Irvine, CA</a> [<a href="http://www.archive.org/search.php?query=creator:%22Grateful%20Dead%22%20date:1983-03-27*">Listen/Download</a>]
            </td>
          </tr>
          <tr>
            <td>
              I: Shakedown, Minglewood &gt; TLEO, Cassidy, Loser, Esau &gt; Deal
            </td>
          </tr>
          <tr>
            <td>
              II: China Cat &gt; I Know You Rider &gt; Samson, He's Gone &gt; Truckin &gt; Drumz &gt; Throwing Stones &gt; Wharf Rat &gt; Good Lovin
            </td>
          </tr>
          <tr>
            <td>
              E: U. S. Blues
            </td>
          </tr>
        </table>
      </div>
      <div>
        <table border="0" cellspacing="0" cellpadding="0">
          <tr>
            <td id="0329">
              <a href="/1983-03-29">3/29/1983 Warfield Theater, San Francisco, CA</a> [<a href="http://www.archive.org/search.php?query=creator:%22Grateful%20Dead%22%20date:1983-03-29*">Listen/Download</a>]
            </td>
          </tr>
          <tr>
            <td>
              I: Jack Straw, Bird Song, Rooster, Ramble On, All Over Now, Candyman, Esau, Big RxR Blues &gt; Greatest
            </td>
          </tr>
          <tr>
            <td>
              II: Help &gt; Slipknot &gt; Franklin's &gt; Estimated &gt; Drumz &gt; Wheel &gt; Throwing Stones &gt; NFA &gt; GDTRFB &gt; Johnny B. Goode
            </td>
          </tr>
          <tr>
            <td>
              E: Baby Blue
            </td>
          </tr>
          <tr>
            <td>
              Benefit concert. Soundcheck: Comes A Time, China Doll (2x).
            </td>
          </tr>
        </table>
      </div>
      <div>
        <table border="0" cellspacing="0" cellpadding="0">
          <tr>
            <td id="0330">
              <a href="/1983-03-30">3/30/1983 Warfield Theater, San Francisco, CA</a> [<a href="http://www.archive.org/search.php?query=creator:%22Grateful%20Dead%22%20date:1983-03-30*">Listen/Download</a>]
            </td>
          </tr>
          <tr>
            <td>
              I: Bertha &gt; Promised, Dire Wolf, Cassidy, Peggy-O, Mama Tried &gt; Mexicali, Roses, Minglewood, China Cat &gt; I Know You Rider
            </td>
          </tr>
          <tr>
            <td>
              II: Touch, Esau, Might As Well, Playin &gt; Drumz &gt; Woman Smarter &gt; China Doll &gt; Playin &gt; Sugar Magnolia
            </td>
          </tr>
          <tr>
            <td>
              E: U. S. Blues
            </td>
          </tr>
          <tr>
            <td>
              Previous ''China Doll'' 7/10/1981 [110 shows]
            </td>
          </tr>
          <tr>
            <td>
              Benefit concert.
            </td>
          </tr>
        </table>
      </div>
      <div>
        <table border="0" cellspacing="0" cellpadding="0">
          <tr>
            <td id="0331">
              <a href="/1983-03-31">3/31/1983 Warfield Theater, San Francisco, CA</a> [<a href="http://www.archive.org/search.php?query=creator:%22Grateful%20Dead%22%20date:1983-03-31*">Listen/Download</a>]
            </td>
          </tr>
          <tr>
            <td>
              I: Stranger, FOTD &gt; Rooster, Dupree's, Me and My Uncle &gt; Big River, West L. A., Esau, Don't Ease
            </td>
          </tr>
          <tr>
            <td>
              II: Sailor &gt; Saint &gt; Far From Me, Terrapin &gt; Drumz &gt; Other One &gt; Throwing Stones &gt; Wharf Rat &gt; Around &gt; Good Lovin
            </td>
          </tr>
          <tr>
            <td>
              E: Brokedown
            </td>
          </tr>
          <tr>
            <td>
              Benefit concert.
            </td>
          </tr>
        </table>
      </div>
      <div>
        <table border="0" cellspacing="0" cellpadding="0">
          <tr>
            <td id="0409">
              <a href="/1983-04-09">4/9/1983 Hampton Coliseum, Hampton, VA</a> [<a href="http://www.archive.org/search.php?query=creator:%22Grateful%20Dead%22%20date:1983-04-09*">Listen/Download</a>]
            </td>
          </tr>
          <tr>
            <td>
              I: Bertha &gt; Promised, West L. A., Esau, Candyman, Minglewood, B. E. Women, L. L. Rain, China Cat &gt; I Know You Rider
            </td>
          </tr>
          <tr>
            <td>
              II: Help &gt; Slipknot &gt; Franklin's &gt; Truckin &gt; Smokestack Jam &gt; Drumz &gt; Throwing Stones &gt; Black Peter &gt; GDTRFB &gt; Saturday Night
            </td>
          </tr>
          <tr>
            <td>
              E: Satisfaction
            </td>
          </tr>
          <tr>
            <td>
              Only "Smokestack Jam."
            </td>
          </tr>
        </table>
      </div>
      <div>
        <table border="0" cellspacing="0" cellpadding="0">
          <tr>
            <td id="0410">
              <a href="/1983-04-10">4/10/1983 Coliseum, W.V. University, Morgantown, WV</a> [<a href="http://www.archive.org/search.php?query=creator:%22Grateful%20Dead%22%20date:1983-04-10*">Listen/Download</a>]
            </td>
          </tr>
          <tr>
            <td>
              I: Samson, FOTD, Me and My Uncle &gt; Mexicali, Althea, Rooster, Tennessee Jed, Esau, Might As Well
            </td>
          </tr>
          <tr>
            <td>
              II: Touch &gt; Woman Smarter, Uncle John &gt; Playin &gt; Drumz &gt; Wheel &gt; Playin &gt; China Doll &gt; Sugar Magnolia
            </td>
          </tr>
          <tr>
            <td>
              E: U. S. Blues
            </td>
          </tr>
        </table>
      </div>
      <div>
        <table border="0" cellspacing="0" cellpadding="0">
          <tr>
            <td id="0412">
              <a href="/1983-04-12">4/12/1983 Broome County Arena, Binghamton, NY</a> [<a href="http://www.archive.org/search.php?query=creator:%22Grateful%20Dead%22%20date:1983-04-12*">Listen/Download</a>]
            </td>
          </tr>
          <tr>
            <td>
              I: Alabama &gt; Greatest, Bird Song, Minglewood, Peggy-O, Cassidy, Loser, All Over Now, Dupree's, Let It Grow
            </td>
          </tr>
          <tr>
            <td>
              II: Help &gt; Slipknot &gt; Franklin's &gt; Sailor &gt; Saint &gt; Terrapin &gt; Drumz &gt; Other One &gt; Wharf Rat &gt; NFA
            </td>
          </tr>
          <tr>
            <td>
              E: NFA &gt; Baby Blue
            </td>
          </tr>
        </table>
      </div>
      <div>
        <table border="0" cellspacing="0" cellpadding="0">
          <tr>
            <td id="0413">
              <a href="/1983-04-13">4/13/1983 Patrick Gym, UVM, Burlington, VT</a> [<a href="http://www.archive.org/search.php?query=creator:%22Grateful%20Dead%22%20date:1983-04-13*">Listen/Download</a>]
            </td>
          </tr>
          <tr>
            <td>
              I: Jack Straw, TLEO, BIODTL, West L. A., Mama Tried &gt; Cumberland, Ramble On, Far From Me, Esau &gt; Might As Well
            </td>
          </tr>
          <tr>
            <td>
              II: Scarlet &gt; Fire, Estimated &gt; Eyes &gt; Maybe You Know* &gt; Drumz &gt; Morning Dew &gt; Throwing Stones &gt; Good Lovin
            </td>
          </tr>
          <tr>
            <td>
              E: Touch
            </td>
          </tr>
          <tr>
            <td>
              First ''Maybe You Know''
            </td>
          </tr>
          <tr>
            <td>
              *without Bobby, Jerry, and Phil.
            </td>
          </tr>
        </table>
      </div>
      <div>
        <table border="0" cellspacing="0" cellpadding="0">
          <tr>
            <td id="0415">
              <a href="/1983-04-15">4/15/1983 Community War Memorial, Rochester, NY</a> [<a href="http://www.archive.org/search.php?query=creator:%22Grateful%20Dead%22%20date:1983-04-15*">Listen/Download</a>]
            </td>
          </tr>
          <tr>
            <td>
              I: Shakedown, Esau, B. E. Women, Rooster, Dire Wolf, Lazy Lightning &gt; Supplication &gt; Deal
            </td>
          </tr>
          <tr>
            <td>
              II: Stranger, Samson, Ship Of Fools, Maybe You Know, He's Gone &gt; Bob Star &gt; Drumz &gt; Throwing Stones &gt; NFA &gt; GDTRFB &gt; Around &gt; Johnny B. Goode
            </td>
          </tr>
          <tr>
            <td>
              E: Baby Blue
            </td>
          </tr>
          <tr>
            <td>
              First ''Bob Star''
            </td>
          </tr>
        </table>
      </div>
      <div>
        <table border="0" cellspacing="0" cellpadding="0">
          <tr>
            <td id="0416">
              <a href="/1983-04-16">4/16/1983 Meadowlands Arena, East Rutherford, NJ</a> [<a href="http://www.archive.org/search.php?query=creator:%22Grateful%20Dead%22%20date:1983-04-16*">Listen/Download</a>]
            </td>
          </tr>
          <tr>
            <td>
              I: Minglewood, Tennessee Jed, Me and My Uncle &gt; Mexicali, Bird Song, Esau, West L. A., Maybe You Know, L. L. Rain &gt; Touch
            </td>
          </tr>
          <tr>
            <td>
              II: China Cat &gt; I Know You Rider, Uncle John &gt; Truckin &gt; Drumz &gt; Black Queen* &gt; Iko Iko* &gt; Bob Star &gt; Other One &gt; Black Peter &gt; Saturday Night*
            </td>
          </tr>
          <tr>
            <td>
              E: Johnny B. Goode*
            </td>
          </tr>
          <tr>
            <td>
              Previous ''Black Queen'' 12/10/1969 [934 shows]; Final ''Black Queen''
            </td>
          </tr>
          <tr>
            <td>
              *with Stephen Stills.
            </td>
          </tr>
        </table>
      </div>
      <div>
        <table border="0" cellspacing="0" cellpadding="0">
          <tr>
            <td id="0417">
              <a href="/1983-04-17">4/17/1983 Meadowlands Arena, East Rutherford, NJ</a> [<a href="http://www.archive.org/search.php?query=creator:%22Grateful%20Dead%22%20date:1983-04-17*">Listen/Download</a>]
            </td>
          </tr>
          <tr>
            <td>
              I: Touch &gt; Rooster, Dupree's &gt; BIODTL, Roses, Cassidy, Big RxR Blues, Esau, Peggy-O &gt; Let It Grow, Might As Well
            </td>
          </tr>
          <tr>
            <td>
              II: Help &gt; Slipknot &gt; Franklin's &gt; Woman Smarter, Playin &gt; Drumz &gt; Love The One You're With* &gt; Wheel &gt; Playin &gt; Throwing Stones &gt; NFA*
            </td>
          </tr>
          <tr>
            <td>
              E: Brokedown
            </td>
          </tr>
          <tr>
            <td>
              Only ''Love The One You're With''
            </td>
          </tr>
          <tr>
            <td>
              *with Stephen Stills. Only "Love The One You're With."
            </td>
          </tr>
        </table>
      </div>
      <div>
        <table border="0" cellspacing="0" cellpadding="0">
          <tr>
            <td id="0419">
              <a href="/1983-04-19">4/19/1983 Alfond Arena, U. of Maine, Orono, ME</a> [<a href="http://www.archive.org/search.php?query=creator:%22Grateful%20Dead%22%20date:1983-04-19*">Listen/Download</a>]
            </td>
          </tr>
          <tr>
            <td>
              I: Jack Straw, FOTD &gt; All Over Now, Dire Wolf &gt; Big River, Dupree's, On The Road Again, West L. A., Lazy Lightning &gt; Supplication &gt; Might As Well
            </td>
          </tr>
          <tr>
            <td>
              II: Sugaree &gt; Samson, He's Gone &gt; Drumz &gt; Spanish Jam &gt; Truckin &gt; Wharf Rat &gt; Around &gt; Good Lovin
            </td>
          </tr>
          <tr>
            <td>
              E: U. S. Blues
            </td>
          </tr>
          <tr>
            <td>
              Next ''On The Road Again'' 10/12/1984 [102 shows]
            </td>
          </tr>
        </table>
      </div>
      <div>
        <table border="0" cellspacing="0" cellpadding="0">
          <tr>
            <td id="0420">
              <a href="/1983-04-20">4/20/1983 Providence Civic Center, Providence, RI</a> [<a href="http://www.archive.org/search.php?query=creator:%22Grateful%20Dead%22%20date:1983-04-20*">Listen/Download</a>]
            </td>
          </tr>
          <tr>
            <td>
              I: Touch &gt; Promised, Loser, Minglewood, Ramble On, Me and My Uncle &gt; Cumberland, L. L. Rain, China Cat &gt; I Know You Rider
            </td>
          </tr>
          <tr>
            <td>
              II: Esau &gt; Maybe You Know, Bertha &gt; Estimated &gt; Eyes &gt; Drumz &gt; Throwing Stones &gt; Morning Dew &gt; Sugar Magnolia
            </td>
          </tr>
          <tr>
            <td>
              E: Don't Ease
            </td>
          </tr>
        </table>
      </div>
      <div>
        <table border="0" cellspacing="0" cellpadding="0">
          <tr>
            <td id="0422">
              <a href="/1983-04-22">4/22/1983 Veterans Memorial Coliseum, New Haven, CT</a> [<a href="http://www.archive.org/search.php?query=creator:%22Grateful%20Dead%22%20date:1983-04-22*">Listen/Download</a>]
            </td>
          </tr>
          <tr>
            <td>
              I: Stranger, Bird Song &gt; C. C. Rider, Row Jimmy, Mama Tried &gt; Mexicali, Cold Rain, Esau &gt; Deal
            </td>
          </tr>
          <tr>
            <td>
              II: Help &gt; Slipknot &gt; Franklin's &gt; Samson, Ship Of Fools &gt; Woman Smarter &gt; Drumz &gt; Truckin &gt; Spoonful &gt; Stella Blue &gt; Around &gt; Good Lovin
            </td>
          </tr>
          <tr>
            <td>
              E: Baby Blue
            </td>
          </tr>
          <tr>
            <td>
              Previous ''Spoonful'' 10/15/1981 [94 shows]
            </td>
          </tr>
          <tr>
            <td>
              "Funiculi Funicula" and "Beer Barrel Polka" tunings before "Stranger."
            </td>
          </tr>
        </table>
      </div>
      <div>
        <table border="0" cellspacing="0" cellpadding="0">
          <tr>
            <td id="0423">
              <a href="/1983-04-23">4/23/1983 Veterans Memorial Coliseum, New Haven, CT</a> [<a href="http://www.archive.org/search.php?query=creator:%22Grateful%20Dead%22%20date:1983-04-23*">Listen/Download</a>]
            </td>
          </tr>
          <tr>
            <td>
              I: Alabama &gt; Greatest, Candyman, Minglewood, Tennessee Jed, Lazy Lightning &gt; Supplication, Peggy-O, Far From Me &gt; Music
            </td>
          </tr>
          <tr>
            <td>
              II: Scarlet &gt; Fire, Sailor &gt; Saint &gt; Drumz &gt; Other One &gt; Wharf Rat &gt; Throwing Stones &gt; NFA
            </td>
          </tr>
          <tr>
            <td>
              E: Saturday Night &gt; Brokedown
            </td>
          </tr>
          <tr>
            <td>
              "Funiculi Funicula" tuning before "Candyman."
            </td>
          </tr>
        </table>
      </div>
      <div>
        <table border="0" cellspacing="0" cellpadding="0">
          <tr>
            <td id="0425">
              <a href="/1983-04-25">4/25/1983 The Spectrum, Philadelphia, PA</a> [<a href="http://www.archive.org/search.php?query=creator:%22Grateful%20Dead%22%20date:1983-04-25*">Listen/Download</a>]
            </td>
          </tr>
          <tr>
            <td>
              I: Jack Straw, FOTD, Rooster, B. E. Women, Cassidy, Loser, Esau, China Cat &gt; I Know You Rider
            </td>
          </tr>
          <tr>
            <td>
              II: Touch, Playin &gt; Terrapin &gt; Drumz &gt; Wheel &gt; Playin &gt; GDTRFB &gt; Sugar Magnolia
            </td>
          </tr>
          <tr>
            <td>
              E: Satisfaction
            </td>
          </tr>
        </table>
      </div>
      <div>
        <table border="0" cellspacing="0" cellpadding="0">
          <tr>
            <td id="0426">
              <a href="/1983-04-26">4/26/1983 The Spectrum, Philadelphia, PA</a> [<a href="http://www.archive.org/search.php?query=creator:%22Grateful%20Dead%22%20date:1983-04-26*">Listen/Download</a>]
            </td>
          </tr>
          <tr>
            <td>
              I: Shakedown &gt; Minglewood, TLEO, Me and My Uncle &gt; Mexicali, Maybe You Know, West L. A., Esau, Roses, Let It Grow
            </td>
          </tr>
          <tr>
            <td>
              II: Help &gt; Slipknot &gt; Franklin's, Woman Smarter &gt; Drumz &gt; Jam &gt; Truckin &gt; Nobody's Jam &gt; Morning Dew &gt; Throwing Stones &gt; NFA
            </td>
          </tr>
          <tr>
            <td>
              E: U. S. Blues
            </td>
          </tr>
          <tr>
            <td>
              Next ''Maybe You Know'' 4/21/1986 [205 shows]
            </td>
          </tr>
        </table>
      </div>
      <div>
        <table border="0" cellspacing="0" cellpadding="0">
          <tr>
            <td id="0511">
              <a href="/1983-05-11">5/11/1983 (unknown), Reno, NV</a> [<a href="http://www.archive.org/search.php?query=creator:%22Grateful%20Dead%22%20date:1983-05-11*">Listen/Download</a>]
            </td>
          </tr>
          <tr>
            <td></td>
          </tr>
        </table>
      </div>
      <div>
        <table border="0" cellspacing="0" cellpadding="0">
          <tr>
            <td id="0513">
              <a href="/1983-05-13">5/13/1983 Greek Theatre, U. of California, Berkeley, CA</a> [<a href="http://www.archive.org/search.php?query=creator:%22Grateful%20Dead%22%20date:1983-05-13*">Listen/Download</a>]
            </td>
          </tr>
          <tr>
            <td>
              I: Cold Rain, Greatest, West L. A., Bucket, Loser, Rooster, Bird Song, Let It Grow
            </td>
          </tr>
          <tr>
            <td>
              II: China Cat &gt; I Know You Rider &gt; Estimated &gt; Eyes &gt; Drumz &gt; Throwing Stones &gt; Other One &gt; Wharf Rat &gt; Around &gt; Good Lovin
            </td>
          </tr>
          <tr>
            <td>
              First ''Bucket''
            </td>
          </tr>
        </table>
      </div>
      <div>
        <table border="0" cellspacing="0" cellpadding="0">
          <tr>
            <td id="0514">
              <a href="/1983-05-14">5/14/1983 Greek Theatre, U. of California, Berkeley, CA</a> [<a href="http://www.archive.org/search.php?query=creator:%22Grateful%20Dead%22%20date:1983-05-14*">Listen/Download</a>]
            </td>
          </tr>
          <tr>
            <td>
              I: Stranger, FOTD, Me and My Uncle &gt; Mexicali, Tennessee Jed, Esau &gt; Bertha
            </td>
          </tr>
          <tr>
            <td>
              II: Shakedown, Playin &gt; China Doll &gt; Jam &gt; Drumz &gt; Wheel &gt; Playin &gt; Morning Dew &gt; Sugar Magnolia
            </td>
          </tr>
          <tr>
            <td>
              E: Saturday Night
            </td>
          </tr>
        </table>
      </div>
      <div>
        <table border="0" cellspacing="0" cellpadding="0">
          <tr>
            <td id="0515">
              <a href="/1983-05-15">5/15/1983 Greek Theatre, U. of California, Berkeley, CA</a> [<a href="http://www.archive.org/search.php?query=creator:%22Grateful%20Dead%22%20date:1983-05-15*">Listen/Download</a>]
            </td>
          </tr>
          <tr>
            <td>
              I: Touch, Minglewood, Ramble On, Cassidy, B. E. Women, Bucket, Althea, L. L. Rain &gt; Deal
            </td>
          </tr>
          <tr>
            <td>
              II: Help* &gt; Slipknot* &gt; Franklin's* &gt; Samson*, He's Gone &gt; Drumz+ &gt; Truckin &gt; Stella Blue &gt; Throwing Stones &gt; NFA#
            </td>
          </tr>
          <tr>
            <td>
              E: Baby Blue
            </td>
          </tr>
          <tr>
            <td>
              *with Airto Moreira. +with Flora Purim, Airto Moreira and Billy Cobham. #with John Cipollina. "Happy Birthday" for Dan Healy. before "Help"
            </td>
          </tr>
        </table>
      </div>
      <div>
        <table border="0" cellspacing="0" cellpadding="0">
          <tr>
            <td id="0618">
              <a href="/1983-06-18">6/18/1983 Saratoga Performing Arts Center, Saratoga, NY</a> [<a href="http://www.archive.org/search.php?query=creator:%22Grateful%20Dead%22%20date:1983-06-18*">Listen/Download</a>]
            </td>
          </tr>
          <tr>
            <td>
              I: Bertha &gt; Jack Straw, Bird Song, Mexicali &gt; Big River, Althea, Bucket &gt; Deal
            </td>
          </tr>
          <tr>
            <td>
              II: Scarlet &gt; Fire, Playin &gt; Drumz &gt; Wheel &gt; Playin &gt; Morning Dew, Throwing Stones &gt; NFA &gt; Touch
            </td>
          </tr>
          <tr>
            <td>
              E: Don't Ease &gt; Saturday Night
            </td>
          </tr>
        </table>
      </div>
      <div>
        <table border="0" cellspacing="0" cellpadding="0">
          <tr>
            <td id="0620">
              <a href="/1983-06-20">6/20/1983 Merriweather Post Pavilion, Columbia, MD</a> [<a href="http://www.archive.org/search.php?query=creator:%22Grateful%20Dead%22%20date:1983-06-20*">Listen/Download</a>]
            </td>
          </tr>
          <tr>
            <td>
              I: Minglewood, TLEO, Rooster, Peggy-O, Esau, Tennessee Jed, Bucket, West L. A., Music
            </td>
          </tr>
          <tr>
            <td>
              II: China Cat &gt; I Know You Rider, Samson, He's Gone &gt; Truckin &gt; Drumz &gt; Bob Star &gt; Other One &gt; Wharf Rat &gt; Sugar Magnolia
            </td>
          </tr>
          <tr>
            <td>
              E: Baby Blue
            </td>
          </tr>
          <tr>
            <td>
              Final ''Bob Star''
            </td>
          </tr>
          <tr>
            <td>
              "Aborigine dream" rap during "Sugar Magnolia."
            </td>
          </tr>
        </table>
      </div>
      <div>
        <table border="0" cellspacing="0" cellpadding="0">
          <tr>
            <td id="0621">
              <a href="/1983-06-21">6/21/1983 Merriweather Post Pavilion, Columbia, MD</a> [<a href="http://www.archive.org/search.php?query=creator:%22Grateful%20Dead%22%20date:1983-06-21*">Listen/Download</a>]
            </td>
          </tr>
          <tr>
            <td>
              I: Alabama &gt; Greatest, Dire Wolf, Me and My Uncle &gt; Cumberland, Cassidy, Big RxR Blues, All Over Now, Loser, L. L. Rain &gt; Might As Well
            </td>
          </tr>
          <tr>
            <td>
              II: Touch &gt; Woman Smarter, Terrapin &gt; Estimated &gt; Eyes &gt; Drumz &gt; Throwing Stones &gt; Black Peter &gt; Around &gt; Good Lovin
            </td>
          </tr>
          <tr>
            <td>
              E: U. S. Blues
            </td>
          </tr>
        </table>
      </div>
      <div>
        <table border="0" cellspacing="0" cellpadding="0">
          <tr>
            <td id="0622">
              <a href="/1983-06-22">6/22/1983 City Island, Harrisburg, PA</a> [<a href="http://www.archive.org/search.php?query=creator:%22Grateful%20Dead%22%20date:1983-06-22*">Listen/Download</a>]
            </td>
          </tr>
          <tr>
            <td>
              I: Stranger, FOTD, C. C. Rider, Ramble On, Esau &gt; Deal
            </td>
          </tr>
          <tr>
            <td>
              II: Bucket, China Cat &gt; I Know You Rider &gt; Playin &gt; Drumz &gt; Spanish Jam &gt; Miracle &gt; Stella Blue &gt; GDTRFB &gt; NFA
            </td>
          </tr>
          <tr>
            <td>
              E: Brokedown
            </td>
          </tr>
        </table>
      </div>
      <div>
        <table border="0" cellspacing="0" cellpadding="0">
          <tr>
            <td id="0624">
              <a href="/1983-06-24">6/24/1983 Dane County Coliseum, Madison, WI</a> [<a href="http://www.archive.org/search.php?query=creator:%22Grateful%20Dead%22%20date:1983-06-24*">Listen/Download</a>]
            </td>
          </tr>
          <tr>
            <td>
              I: Shakedown, Far From Me, Candyman &gt; Rooster, B. E. Women, Mama Tried &gt; Mexicali, Althea, Bucket &gt; Deal
            </td>
          </tr>
          <tr>
            <td>
              II: Help &gt; Slipknot &gt; Franklin's &gt; Sailor &gt; Saint &gt; Drumz &gt; Truckin &gt; Morning Dew &gt; Around &gt; Johnny B. Goode
            </td>
          </tr>
          <tr>
            <td>
              E: Don't Ease
            </td>
          </tr>
          <tr>
            <td>
              "Take A Step Back" before "Help."
            </td>
          </tr>
        </table>
      </div>
      <div>
        <table border="0" cellspacing="0" cellpadding="0">
          <tr>
            <td id="0625">
              <a href="/1983-06-25">6/25/1983 St. Paul Civic Center Arena, St. Paul, MN</a> [<a href="http://www.archive.org/search.php?query=creator:%22Grateful%20Dead%22%20date:1983-06-25*">Listen/Download</a>]
            </td>
          </tr>
          <tr>
            <td>
              I: Jack Straw, TLEO, Cassidy, West L. A., Esau, Big RxR Blues, Lazy Lightning &gt; Supplication &gt; Might As Well
            </td>
          </tr>
          <tr>
            <td>
              II: Touch &gt; Samson, Ship Of Fools, Woman Smarter, Uncle John &gt; Drumz &gt; Throwing Stones &gt; Black Peter &gt; GDTRFB &gt; Saturday Night
            </td>
          </tr>
          <tr>
            <td>
              E: Baby Blue
            </td>
          </tr>
        </table>
      </div>
      <div>
        <table border="0" cellspacing="0" cellpadding="0">
          <tr>
            <td id="0627">
              <a href="/1983-06-27">6/27/1983 Poplar Creek Music Theatre, Hoffman Estates, IL</a> [<a href="http://www.archive.org/search.php?query=creator:%22Grateful%20Dead%22%20date:1983-06-27*">Listen/Download</a>]
            </td>
          </tr>
          <tr>
            <td>
              I: Bertha &gt; Promised, Dupree's, Minglewood, Bird Song, Me and My Uncle &gt; Mexicali, Cold Rain &gt; Bucket &gt; Sugaree
            </td>
          </tr>
          <tr>
            <td>
              II: Scarlet &gt; Fire &gt; Estimated &gt; Truckin &gt; Drumz &gt; Other One &gt; Wheel &gt; Good Lovin
            </td>
          </tr>
          <tr>
            <td>
              E: U. S. Blues
            </td>
          </tr>
        </table>
      </div>
      <div>
        <table border="0" cellspacing="0" cellpadding="0">
          <tr>
            <td id="0628">
              <a href="/1983-06-28">6/28/1983 Poplar Creek Music Theatre, Hoffman Estates, IL</a> [<a href="http://www.archive.org/search.php?query=creator:%22Grateful%20Dead%22%20date:1983-06-28*">Listen/Download</a>]
            </td>
          </tr>
          <tr>
            <td>
              I: Stranger, Dire Wolf, All Over Now, B. E. Women, Rooster, Tennessee Jed, L. L. Rain &gt; Deal
            </td>
          </tr>
          <tr>
            <td>
              II: Help &gt; Slipknot &gt; Franklin's &gt; Woman Smarter, He's Gone &gt; Drumz &gt; Throwing Stones &gt; NFA &gt; Stella Blue &gt; Sugar Magnolia
            </td>
          </tr>
          <tr>
            <td>
              E: Iko Iko
            </td>
          </tr>
        </table>
      </div>
      <div>
        <table border="0" cellspacing="0" cellpadding="0">
          <tr>
            <td id="0730">
              <a href="/1983-07-30">7/30/1983 County Fairgrounds, Ventura, CA</a> [<a href="http://www.archive.org/search.php?query=creator:%22Grateful%20Dead%22%20date:1983-07-30*">Listen/Download</a>]
            </td>
          </tr>
          <tr>
            <td>
              I: China Cat &gt; I Know You Rider, All Over Now, B. E. Women, Esau, Big RxR Blues, Cassidy, Loser, Music
            </td>
          </tr>
          <tr>
            <td>
              II: Sugaree, Playin &gt; China Doll &gt; Jam &gt; Drumz &gt; Truckin &gt; Black Peter &gt; Sugar Magnolia
            </td>
          </tr>
          <tr>
            <td>
              E: U. S. Blues
            </td>
          </tr>
        </table>
      </div>
      <div>
        <table border="0" cellspacing="0" cellpadding="0">
          <tr>
            <td id="0731">
              <a href="/1983-07-31">7/31/1983 County Fairgrounds, Ventura, CA</a> [<a href="http://www.archive.org/search.php?query=creator:%22Grateful%20Dead%22%20date:1983-07-31*">Listen/Download</a>]
            </td>
          </tr>
          <tr>
            <td>
              I: Jack Straw, FOTD, Me and My Uncle &gt; Mexicali, West L. A., Rooster, Tennessee Jed, L. L. Rain &gt; Deal
            </td>
          </tr>
          <tr>
            <td>
              II: Bucket &gt; Scarlet &gt; Fire &gt; Drumz &gt; Other One &gt; Wharf Rat &gt; Throwing Stones &gt; NFA
            </td>
          </tr>
          <tr>
            <td>
              E: Touch &gt; Saturday Night
            </td>
          </tr>
        </table>
      </div>
      <div>
        <table border="0" cellspacing="0" cellpadding="0">
          <tr>
            <td id="0820">
              <a href="/1983-08-20">8/20/1983 Frost Amphitheatre, Stanford U., Palo Alto, CA</a> [<a href="http://www.archive.org/search.php?query=creator:%22Grateful%20Dead%22%20date:1983-08-20*">Listen/Download</a>]
            </td>
          </tr>
          <tr>
            <td>
              I: Alabama &gt; Greatest, TLEO, Minglewood, Bird Song, L. L. Rain, Tennessee Jed, Esau, Deal
            </td>
          </tr>
          <tr>
            <td>
              II: Shakedown, Woman Smarter, Ship Of Fools &gt; Estimated &gt; Eyes &gt; Drumz &gt; Other One &gt; Black Peter &gt; Good Lovin
            </td>
          </tr>
          <tr>
            <td>
              E: Saturday Night
            </td>
          </tr>
        </table>
      </div>
      <div>
        <table border="0" cellspacing="0" cellpadding="0">
          <tr>
            <td id="0821">
              <a href="/1983-08-21">8/21/1983 Frost Amphitheatre, Stanford U., Palo Alto, CA</a> [<a href="http://www.archive.org/search.php?query=creator:%22Grateful%20Dead%22%20date:1983-08-21*">Listen/Download</a>]
            </td>
          </tr>
          <tr>
            <td>
              I: Cassidy &gt; Dire Wolf, Me and My Uncle &gt; Big River, Althea, Rooster, Big RxR Blues, Let It Grow
            </td>
          </tr>
          <tr>
            <td>
              II: Samson &gt; China Cat &gt; I Know You Rider, Playin &gt; Drumz &gt; Wheel &gt; Throwing Stones &gt; NFA, Baby Blue
            </td>
          </tr>
          <tr>
            <td>
              E: Johnny B. Goode
            </td>
          </tr>
          <tr>
            <td>
              The band did not leave the stage between "Not Fade Away" and "It�s All Over Now, Baby Blue," therefore the latter tune cannot be considered an encore as described in Deadlists and The Grateful Dead Taping Compendium.
            </td>
          </tr>
        </table>
      </div>
      <div>
        <table border="0" cellspacing="0" cellpadding="0">
          <tr>
            <td id="0826">
              <a href="/1983-08-26">8/26/1983 Portland Memorial Coliseum, Portland, OR</a> [<a href="http://www.archive.org/search.php?query=creator:%22Grateful%20Dead%22%20date:1983-08-26*">Listen/Download</a>]
            </td>
          </tr>
          <tr>
            <td>
              I: Bertha &gt; Promised, Peggy-O, Me and My Uncle &gt; Big River, West L. A., Minglewood, Loser &gt; Let It Grow
            </td>
          </tr>
          <tr>
            <td>
              II: Scarlet &gt; Fire, Woman Smarter, He's Gone &gt; Drumz &gt; Truckin &gt; Wang Dang Doodle &gt; Stella Blue &gt; Sugar Magnolia
            </td>
          </tr>
          <tr>
            <td>
              E: U. S. Blues
            </td>
          </tr>
          <tr>
            <td>
              First ''Wang Dang Doodle''
            </td>
          </tr>
        </table>
      </div>
      <div>
        <table border="0" cellspacing="0" cellpadding="0">
          <tr>
            <td id="0827">
              <a href="/1983-08-27">8/27/1983 Seattle Center Memorial Coliseum, Seattle, WA</a> [<a href="http://www.archive.org/search.php?query=creator:%22Grateful%20Dead%22%20date:1983-08-27*">Listen/Download</a>]
            </td>
          </tr>
          <tr>
            <td>
              I: Jack Straw, Deep Elem &gt; Esau, B. E. Women, Rooster, Ramble On, L. L. Rain &gt; Deal
            </td>
          </tr>
          <tr>
            <td>
              II: Touch &gt; Playin &gt; Uncle John &gt; Drumz &gt; Throwing Stones &gt; Black Peter &gt; Saturday Night
            </td>
          </tr>
          <tr>
            <td>
              E: Baby Blue
            </td>
          </tr>
          <tr>
            <td>
              Previous ''Deep Elem'' 4/14/1982 [81 shows]
            </td>
          </tr>
        </table>
      </div>
      <div>
        <table border="0" cellspacing="0" cellpadding="0">
          <tr>
            <td id="0829">
              <a href="/1983-08-29">8/29/1983 Silva Hall, Hult Center, Eugene, OR</a> [<a href="http://www.archive.org/search.php?query=creator:%22Grateful%20Dead%22%20date:1983-08-29*">Listen/Download</a>]
            </td>
          </tr>
          <tr>
            <td>
              I: Shakedown, Minglewood, FOTD, Bucket, Bird Song, All Over Now, Might As Well
            </td>
          </tr>
          <tr>
            <td>
              II: China Cat &gt; I Know You Rider, Estimated &gt; Eyes &gt; Drumz &gt; Wheel &gt; Other One &gt; GDTRFB &gt; Johnny B. Goode
            </td>
          </tr>
          <tr>
            <td>
              E: U. S. Blues
            </td>
          </tr>
        </table>
      </div>
      <div>
        <table border="0" cellspacing="0" cellpadding="0">
          <tr>
            <td id="0830">
              <a href="/1983-08-30">8/30/1983 Silva Hall, Hult Center, Eugene, OR</a> [<a href="http://www.archive.org/search.php?query=creator:%22Grateful%20Dead%22%20date:1983-08-30*">Listen/Download</a>]
            </td>
          </tr>
          <tr>
            <td>
              I: Stranger, Candyman, Esau, Dire Wolf, Rooster, Tennessee Jed, Lazy Lightning &gt; Supplication &gt; Deal
            </td>
          </tr>
          <tr>
            <td>
              II: Touch &gt; Samson, Terrapin &gt; Drumz &gt; Throwing Stones &gt; NFA &gt; Wharf Rat &gt; Sugar Magnolia
            </td>
          </tr>
          <tr>
            <td>
              E: Brokedown
            </td>
          </tr>
        </table>
      </div>
      <div>
        <table border="0" cellspacing="0" cellpadding="0">
          <tr>
            <td id="0831">
              <a href="/1983-08-31">8/31/1983 Silva Hall, Hult Center, Eugene, OR</a> [<a href="http://www.archive.org/search.php?query=creator:%22Grateful%20Dead%22%20date:1983-08-31*">Listen/Download</a>]
            </td>
          </tr>
          <tr>
            <td>
              I: Alabama &gt; Greatest, Dupree's, Me and My Uncle &gt; Mexicali, West L. A., Bucket, Althea, Cassidy &gt; Don't Ease
            </td>
          </tr>
          <tr>
            <td>
              II: Cold Rain, Playin &gt; China Doll &gt; Playin Jam &gt; Drumz &gt; Truckin &gt; Stella Blue &gt; Around &gt; Good Lovin
            </td>
          </tr>
          <tr>
            <td>
              E1: U. S. Blues
            </td>
          </tr>
          <tr>
            <td>
              E2: Satisfaction
            </td>
          </tr>
          <tr>
            <td>
              Next ''Satisfaction'' 6/24/1984 [57 shows]
            </td>
          </tr>
        </table>
      </div>
      <div>
        <table border="0" cellspacing="0" cellpadding="0">
          <tr>
            <td id="0902">
              <a href="/1983-09-02">9/2/1983 BSU Pavilion, Boise State University, Boise, ID</a> [<a href="http://www.archive.org/search.php?query=creator:%22Grateful%20Dead%22%20date:1983-09-02*">Listen/Download</a>]
            </td>
          </tr>
          <tr>
            <td>
              I: Wang Dang Doodle &gt; Jack Straw, TLEO, Mama Tried &gt; Big River, B. E. Women, Minglewood, Big RxR Blues, L. L. Rain &gt; Deal
            </td>
          </tr>
          <tr>
            <td>
              II: Help &gt; Slipknot &gt; Franklin's, Estimated &gt; Eyes &gt; Drumz &gt; Throwing Stones &gt; GDTRFB &gt; Black Peter &gt; Sugar Magnolia
            </td>
          </tr>
          <tr>
            <td>
              E: Baby Blue
            </td>
          </tr>
        </table>
      </div>
      <div>
        <table border="0" cellspacing="0" cellpadding="0">
          <tr>
            <td id="0904">
              <a href="/1983-09-04">9/4/1983 Park West Ski Resort, Park West, UT</a> [<a href="http://www.archive.org/search.php?query=creator:%22Grateful%20Dead%22%20date:1983-09-04*">Listen/Download</a>]
            </td>
          </tr>
          <tr>
            <td>
              I: Bertha &gt; Promised, FOTD, Rooster, Tennessee Jed &gt; Esau, Althea &gt; Bucket, China Cat &gt; I Know You Rider
            </td>
          </tr>
          <tr>
            <td>
              II: Scarlet &gt; Fire, Woman Smarter &gt; Drumz &gt; Spanish Jam &gt; Wheel &gt; Other One &gt; Wharf Rat &gt; Around &gt; Saturday Night*
            </td>
          </tr>
          <tr>
            <td>
              E: U. S. Blues
            </td>
          </tr>
          <tr>
            <td>
              *"One more Labor Day night."
            </td>
          </tr>
        </table>
      </div>
      <div>
        <table border="0" cellspacing="0" cellpadding="0">
          <tr>
            <td id="0906">
              <a href="/1983-09-06">9/6/1983 Red Rocks Amphitheatre, Morrison, CO</a> [<a href="http://www.archive.org/search.php?query=creator:%22Grateful%20Dead%22%20date:1983-09-06*">Listen/Download</a>]
            </td>
          </tr>
          <tr>
            <td>
              I: Alabama &gt; Greatest, Peggy-O, Bucket, Dupree's, Minglewood, Bird Song, Lazy Lightning &gt; Supplication &gt; Might As Well
            </td>
          </tr>
          <tr>
            <td>
              II: Help &gt; Slipknot &gt; Franklin's &gt; Playin &gt; Drumz &gt; Uncle John &gt; Playin &gt; Throwing Stones &gt; NFA
            </td>
          </tr>
          <tr>
            <td>
              E: Brokedown
            </td>
          </tr>
        </table>
      </div>
      <div>
        <table border="0" cellspacing="0" cellpadding="0">
          <tr>
            <td id="0907">
              <a href="/1983-09-07">9/7/1983 Red Rocks Amphitheatre, Morrison, CO</a> [<a href="http://www.archive.org/search.php?query=creator:%22Grateful%20Dead%22%20date:1983-09-07*">Listen/Download</a>]
            </td>
          </tr>
          <tr>
            <td>
              I: Jack Straw &gt; Candyman, Rooster, Loser, Esau, West L. A., Cassidy, China Cat &gt; I Know You Rider
            </td>
          </tr>
          <tr>
            <td>
              II: Miracle &gt; Bertha &gt; Samson, He's Gone &gt; Drumz &gt; Truckin &gt; Stella Blue &gt; Sugar Magnolia
            </td>
          </tr>
          <tr>
            <td>
              E: U. S. Blues
            </td>
          </tr>
        </table>
      </div>
      <div>
        <table border="0" cellspacing="0" cellpadding="0">
          <tr>
            <td id="0908">
              <a href="/1983-09-08">9/8/1983 Red Rocks Amphitheatre, Morrison, CO</a> [<a href="http://www.archive.org/search.php?query=creator:%22Grateful%20Dead%22%20date:1983-09-08*">Listen/Download</a>]
            </td>
          </tr>
          <tr>
            <td>
              I: Shakedown &gt; Mama Tried &gt; Big River, Ramble On, Bucket, B. E. Women, L. L. Rain, Deal
            </td>
          </tr>
          <tr>
            <td>
              II: Scarlet &gt; Fire, Estimated &gt; Terrapin &gt; Drumz &gt; Other One Jam &gt; Throwing Stones &gt; Black Peter &gt; Around &gt; Good Lovin
            </td>
          </tr>
          <tr>
            <td>
              E: Baby Blue
            </td>
          </tr>
        </table>
      </div>
      <div>
        <table border="0" cellspacing="0" cellpadding="0">
          <tr>
            <td id="0910">
              <a href="/1983-09-10">9/10/1983 Downs of Santa Fe, Santa Fe, NM</a> [<a href="http://www.archive.org/search.php?query=creator:%22Grateful%20Dead%22%20date:1983-09-10*">Listen/Download</a>]
            </td>
          </tr>
          <tr>
            <td>
              I: Music, TLEO, Esau, Big RxR Blues &gt; BIODTL, Tennessee Jed, Minglewood &gt; China Cat &gt; I Know You Rider
            </td>
          </tr>
          <tr>
            <td>
              II: Woman Smarter, Cumberland, Playin &gt; China Doll &gt; Jam &gt; Drumz &gt; Jam &gt; Other One &gt; GDTRFB &gt; Saturday Night
            </td>
          </tr>
          <tr>
            <td>
              E: Cold Rain
            </td>
          </tr>
        </table>
      </div>
      <div>
        <table border="0" cellspacing="0" cellpadding="0">
          <tr>
            <td id="0911">
              <a href="/1983-09-11">9/11/1983 Downs of Santa Fe, Santa Fe, NM</a> [<a href="http://www.archive.org/search.php?query=creator:%22Grateful%20Dead%22%20date:1983-09-11*">Listen/Download</a>]
            </td>
          </tr>
          <tr>
            <td>
              I: Alabama &gt; Greatest, Dire Wolf, Bucket, West L. A., Me and My Uncle &gt; Mexicali, Althea, C. C. Rider &gt; Might As Well
            </td>
          </tr>
          <tr>
            <td>
              II: Help &gt; Slipknot &gt; Franklin's &gt; Let It Grow, He's Gone &gt; Drumz &gt; Truckin &gt; Wang Dang Doodle &gt; Morning Dew &gt; Around &gt; Sugar Magnolia
            </td>
          </tr>
          <tr>
            <td>
              E: U. S. Blues
            </td>
          </tr>
          <tr>
            <td>
              Mickey Hart's 40th birthday.
            </td>
          </tr>
        </table>
      </div>
      <div>
        <table border="0" cellspacing="0" cellpadding="0">
          <tr>
            <td id="0913">
              <a href="/1983-09-13">9/13/1983 Manor Downs, Austin, TX</a> [<a href="http://www.archive.org/search.php?query=creator:%22Grateful%20Dead%22%20date:1983-09-13*">Listen/Download</a>]
            </td>
          </tr>
          <tr>
            <td>
              I: Bertha, Rooster, Loser, Cassidy, Don't Ease, Esau, B. E. Women &gt; Music &gt; Might As Well
            </td>
          </tr>
          <tr>
            <td>
              II: Scarlet &gt; Fire, Truckin &gt; Drumz &gt; Spanish Jam &gt; Wheel &gt; Throwing Stones &gt; NFA
            </td>
          </tr>
          <tr>
            <td>
              E: Brokedown
            </td>
          </tr>
        </table>
      </div>
      <div>
        <table border="0" cellspacing="0" cellpadding="0">
          <tr>
            <td id="0918">
              <a href="/1983-09-18">9/18/1983 Nevada County Fairgrounds, Grass Valley, CA</a> [<a href="http://www.archive.org/search.php?query=creator:%22Grateful%20Dead%22%20date:1983-09-18*">Listen/Download</a>]
            </td>
          </tr>
          <tr>
            <td>
              I: Jack Straw, TLEO, Minglewood, FOTD, Bucket, Ramble On, Let It Grow
            </td>
          </tr>
          <tr>
            <td>
              II: Touch &gt; Samson, Terrapin &gt; Drumz &gt; Other One &gt; Wharf Rat &gt; Around &gt; Sugar Magnolia
            </td>
          </tr>
          <tr>
            <td>
              E: Baby Blue
            </td>
          </tr>
        </table>
      </div>
      <div>
        <table border="0" cellspacing="0" cellpadding="0">
          <tr>
            <td id="0924">
              <a href="/1983-09-24">9/24/1983 Santa Cruz County Fairgrounds, Watsonville, CA</a> [<a href="http://www.archive.org/search.php?query=creator:%22Grateful%20Dead%22%20date:1983-09-24*">Listen/Download</a>]
            </td>
          </tr>
          <tr>
            <td>
              I: Alabama &gt; Promised, TLEO, Me and My Uncle &gt; Mexicali, Bird Song, Bucket, Deep Elem &gt; L. L. Rain &gt; Day Job
            </td>
          </tr>
          <tr>
            <td>
              II: China Cat &gt; I Know You Rider, Woman Smarter, Ship Of Fools, Truckin &gt; Drumz &gt; Uncle John &gt; Throwing Stones &gt; NFA, Brokedown
            </td>
          </tr>
          <tr>
            <td>
              E: Saturday Night
            </td>
          </tr>
          <tr>
            <td>
              Final ''Deep Elem''
            </td>
          </tr>
          <tr>
            <td>
              "Funiculi Funicula" tuning into "Saturday Night." The band did not leave the stage between "Not Fade Away" and "Brokedown Palace," therefore the latter tune cannot be considered an encore as described in Deadlists and The Grateful Dead Taping Compendium.
            </td>
          </tr>
        </table>
      </div>
      <div>
        <table border="0" cellspacing="0" cellpadding="0">
          <tr>
            <td id="1008">
              <a href="/1983-10-08">10/8/1983 Richmond Coliseum, Richmond, VA</a> [<a href="http://www.archive.org/search.php?query=creator:%22Grateful%20Dead%22%20date:1983-10-08*">Listen/Download</a>]
            </td>
          </tr>
          <tr>
            <td>
              I: Stranger, FOTD, Minglewood, B. E. Women, Cassidy, West L. A., Bucket &gt; Deal
            </td>
          </tr>
          <tr>
            <td>
              II: Day Job, Playin &gt; Crazy Fingers &gt; Drumz &gt; Truckin &gt; Spoonful &gt; Wharf Rat &gt; Good Lovin
            </td>
          </tr>
          <tr>
            <td>
              E: U. S. Blues
            </td>
          </tr>
          <tr>
            <td>
              Next ''Crazy Fingers'' 4/4/1985 [98 shows]
            </td>
          </tr>
          <tr>
            <td>
              "Sugar Magnolia" intro before "Good Lovin."
            </td>
          </tr>
        </table>
      </div>
      <div>
        <table border="0" cellspacing="0" cellpadding="0">
          <tr>
            <td id="1009">
              <a href="/1983-10-09">10/9/1983 Greensboro Coliseum, Greensboro, NC</a> [<a href="http://www.archive.org/search.php?query=creator:%22Grateful%20Dead%22%20date:1983-10-09*">Listen/Download</a>]
            </td>
          </tr>
          <tr>
            <td>
              I: Shakedown &gt; Samson, Peggy-O, Rooster, Candyman, Esau, Big RxR Blues, Let It Grow
            </td>
          </tr>
          <tr>
            <td>
              II: Touch &gt; Estimated &gt; Eyes &gt; Woman Smarter &gt; Drumz &gt; NFA &gt; Sugar Magnolia
            </td>
          </tr>
          <tr>
            <td>
              E: Baby Blue
            </td>
          </tr>
          <tr>
            <td>
              Soundcheck: St. Stephen (3x))*
            </td>
          </tr>
        </table>
      </div>
      <div>
        <table border="0" cellspacing="0" cellpadding="0">
          <tr>
            <td id="1011">
              <a href="/1983-10-11">10/11/1983 Madison Square Garden, New York, NY</a> [<a href="http://www.archive.org/search.php?query=creator:%22Grateful%20Dead%22%20date:1983-10-11*">Listen/Download</a>]
            </td>
          </tr>
          <tr>
            <td>
              I: Wang Dang Doodle, Jack Straw, Loser, Me and My Uncle &gt; Mexicali, Bird Song, Bucket &gt; Day Job
            </td>
          </tr>
          <tr>
            <td>
              II: China Cat &gt; I Know You Rider, Miracle &gt; Bertha &gt; Jam &gt; China Doll &gt; Drumz &gt; St. Stephen &gt; Throwing Stones &gt; Touch
            </td>
          </tr>
          <tr>
            <td>
              E: Johnny B. Goode
            </td>
          </tr>
          <tr>
            <td>
              Previous ''St. Stephen'' 1/10/1979 [352 shows]
            </td>
          </tr>
          <tr>
            <td>
              "Sugar Magnolia" tease before "Touch."
            </td>
          </tr>
        </table>
      </div>
      <div>
        <table border="0" cellspacing="0" cellpadding="0">
          <tr>
            <td id="1012">
              <a href="/1983-10-12">10/12/1983 Madison Square Garden, New York, NY</a> [<a href="http://www.archive.org/search.php?query=creator:%22Grateful%20Dead%22%20date:1983-10-12*">Listen/Download</a>]
            </td>
          </tr>
          <tr>
            <td>
              I: Cold Rain, Minglewood, Ramble On, Esau, Roses, Cassidy, Cumberland, L. L. Rain &gt; Might As Well
            </td>
          </tr>
          <tr>
            <td>
              II: Help &gt; Slipknot &gt; Franklin's, Woman Smarter, He's Gone &gt; Drumz &gt; Truckin &gt; Black Peter &gt; NFA
            </td>
          </tr>
          <tr>
            <td>
              E: Revolution
            </td>
          </tr>
          <tr>
            <td>
              First ''Revolution''
            </td>
          </tr>
        </table>
      </div>
      <div>
        <table border="0" cellspacing="0" cellpadding="0">
          <tr>
            <td id="1014">
              <a href="/1983-10-14">10/14/1983 Hartford Civic Center, Hartford, CT</a> [<a href="http://www.archive.org/search.php?query=creator:%22Grateful%20Dead%22%20date:1983-10-14*">Listen/Download</a>]
            </td>
          </tr>
          <tr>
            <td>
              I: Alabama &gt; Greatest, TLEO, Mama Tried &gt; Big River, Althea &gt; C. C. Rider, Tennessee Jed, Bucket &gt; Day Job
            </td>
          </tr>
          <tr>
            <td>
              II: Scarlet &gt; Fire, Estimated &gt; Eyes &gt; Drumz &gt; Spanish Jam &gt; Other One &gt; Stella Blue &gt; Sugar Magnolia
            </td>
          </tr>
          <tr>
            <td>
              E: U. S. Blues
            </td>
          </tr>
          <tr>
            <td>
              Entire show released as "Dick's Picks Vol 6."
            </td>
          </tr>
        </table>
      </div>
      <div>
        <table border="0" cellspacing="0" cellpadding="0">
          <tr>
            <td id="1015">
              <a href="/1983-10-15">10/15/1983 Hartford Civic Center, Hartford, CT</a> [<a href="http://www.archive.org/search.php?query=creator:%22Grateful%20Dead%22%20date:1983-10-15*">Listen/Download</a>]
            </td>
          </tr>
          <tr>
            <td>
              I: Stranger, Dire Wolf, Minglewood, B. E. Women, Wang Dang Doodle, Big RxR Blues, Let It Grow &gt; Day Job
            </td>
          </tr>
          <tr>
            <td>
              II: China Cat &gt; I Know You Rider, Playin &gt; China Doll &gt; Drumz &gt; St. Stephen &gt; Throwing Stones &gt; Saturday Night
            </td>
          </tr>
          <tr>
            <td>
              E: Brokedown
            </td>
          </tr>
        </table>
      </div>
      <div>
        <table border="0" cellspacing="0" cellpadding="0">
          <tr>
            <td id="1017">
              <a href="/1983-10-17">10/17/1983 Olympic Center, Lake Placid, NY</a> [<a href="http://www.archive.org/search.php?query=creator:%22Grateful%20Dead%22%20date:1983-10-17*">Listen/Download</a>]
            </td>
          </tr>
          <tr>
            <td>
              I: Sugaree &gt; Rooster, FOTD, Esau, Bird Song, Bucket &gt; Deal
            </td>
          </tr>
          <tr>
            <td>
              II: Touch &gt; Samson, To Lay Me Down, Woman Smarter, Terrapin &gt; Drumz &gt; Wheel &gt; Miracle &gt; GDTRFB &gt; Good Lovin
            </td>
          </tr>
          <tr>
            <td>
              E: Revolution
            </td>
          </tr>
          <tr>
            <td>
              Next ''To Lay Me Down'' 3/27/1988 [286 shows]
            </td>
          </tr>
          <tr>
            <td>
              "2001 Theme" tuning before "Touch."
            </td>
          </tr>
        </table>
      </div>
      <div>
        <table border="0" cellspacing="0" cellpadding="0">
          <tr>
            <td id="1018">
              <a href="/1983-10-18">10/18/1983 Cumberland County Civic Center, Portland, ME</a> [<a href="http://www.archive.org/search.php?query=creator:%22Grateful%20Dead%22%20date:1983-10-18*">Listen/Download</a>]
            </td>
          </tr>
          <tr>
            <td>
              I: Jack Straw, TLEO, Me and My Uncle &gt; Mexicali, Dupree's, C. C. Rider, Althea, Lazy Lightning &gt; Supplication &gt; Might As Well
            </td>
          </tr>
          <tr>
            <td>
              II: China Cat &gt; I Know You Rider, Estimated &gt; He's Gone &gt; Drumz &gt; NFA &gt; Black Peter &gt; Around &gt; Sugar Magnolia
            </td>
          </tr>
          <tr>
            <td>
              E: U. S. Blues
            </td>
          </tr>
        </table>
      </div>
      <div>
        <table border="0" cellspacing="0" cellpadding="0">
          <tr>
            <td id="1020">
              <a href="/1983-10-20">10/20/1983 The Centrum, Worcester, MA</a> [<a href="http://www.archive.org/search.php?query=creator:%22Grateful%20Dead%22%20date:1983-10-20*">Listen/Download</a>]
            </td>
          </tr>
          <tr>
            <td>
              I: Bertha &gt; Greatest, West L. A., Minglewood, Tennessee Jed, Bucket, Row Jimmy, L. L. Rain &gt; Deal
            </td>
          </tr>
          <tr>
            <td>
              II: Help &gt; Slipknot &gt; Franklin's &gt; Samson &gt; Eyes &gt; Drumz &gt; Spanish Jam &gt; Other One &gt; Stella Blue &gt; Around &gt; Good Lovin
            </td>
          </tr>
          <tr>
            <td>
              E: Day Job
            </td>
          </tr>
        </table>
      </div>
      <div>
        <table border="0" cellspacing="0" cellpadding="0">
          <tr>
            <td id="1021">
              <a href="/1983-10-21">10/21/1983 The Centrum, Worcester, MA</a> [<a href="http://www.archive.org/search.php?query=creator:%22Grateful%20Dead%22%20date:1983-10-21*">Listen/Download</a>]
            </td>
          </tr>
          <tr>
            <td>
              I: Music, Loser, C. C. Rider, Cumberland, Cassidy, Ramble On, Esau, Big RxR Blues &gt; Promised
            </td>
          </tr>
          <tr>
            <td>
              II: Scarlet &gt; Fire, Uncle John &gt; Playin &gt; Drumz &gt; Truckin &gt; Wharf Rat &gt; Miracle &gt; Touch
            </td>
          </tr>
          <tr>
            <td>
              E: Johnny B. Goode
            </td>
          </tr>
          <tr>
            <td>
              Brent Mydland's 31st birthday. "Sage and Spirit" theme during "Drumz."
            </td>
          </tr>
        </table>
      </div>
      <div>
        <table border="0" cellspacing="0" cellpadding="0">
          <tr>
            <td id="1022">
              <a href="/1983-10-22">10/22/1983 Carrier Dome, Syracuse University, Syracuse, NY</a> [<a href="http://www.archive.org/search.php?query=creator:%22Grateful%20Dead%22%20date:1983-10-22*">Listen/Download</a>]
            </td>
          </tr>
          <tr>
            <td>
              I: Shakedown, Wang Dang Doodle, Candyman, Minglewood, Bird Song, Bucket &gt; Day Job
            </td>
          </tr>
          <tr>
            <td>
              II: China Cat &gt; I Know You Rider, Woman Smarter, Terrapin &gt; Drumz &gt; Wheel &gt; Throwing Stones &gt; NFA &gt; Saturday Night
            </td>
          </tr>
          <tr>
            <td>
              E: Revolution
            </td>
          </tr>
          <tr>
            <td>
              The Band, without Robertson, with The Cate Brothers opened. Soundcheck: H. C. Sunshine.
            </td>
          </tr>
        </table>
      </div>
      <div>
        <table border="0" cellspacing="0" cellpadding="0">
          <tr>
            <td id="1030">
              <a href="/1983-10-30">10/30/1983 Marin County Veterans Auditorium, San Rafael, CA</a> [<a href="http://www.archive.org/search.php?query=creator:%22Grateful%20Dead%22%20date:1983-10-30*">Listen/Download</a>]
            </td>
          </tr>
          <tr>
            <td>
              I: Alabama &gt; Greatest, FOTD, Minglewood, Tennessee Jed, Cassidy, West L. A., Bucket &gt; Might As Well
            </td>
          </tr>
          <tr>
            <td>
              II: Bertha &gt; Samson, Ship Of Fools, Playin &gt; Drumz &gt; Truckin &gt; Spoonful &gt; Black Peter &gt; Sugar Magnolia
            </td>
          </tr>
          <tr>
            <td>
              E: Day Job
            </td>
          </tr>
        </table>
      </div>
      <div>
        <table border="0" cellspacing="0" cellpadding="0">
          <tr>
            <td id="1031">
              <a href="/1983-10-31">10/31/1983 Marin County Veterans Auditorium, San Rafael, CA</a> [<a href="http://www.archive.org/search.php?query=creator:%22Grateful%20Dead%22%20date:1983-10-31*">Listen/Download</a>]
            </td>
          </tr>
          <tr>
            <td>
              I: Wang Dang Doodle &gt; Esau, Peggy-O, Rooster, B. E. Women, Sailor &gt; Saint &gt; Deal
            </td>
          </tr>
          <tr>
            <td>
              II: Help &gt; Slipknot &gt; Franklin's, Estimated &gt; Eyes &gt; Drumz &gt; Jam &gt; St. Stephen &gt; Throwing Stones &gt; NFA
            </td>
          </tr>
          <tr>
            <td>
              E: Revolution
            </td>
          </tr>
          <tr>
            <td>
              Next ''Revolution'' 10/9/1984 [52 shows]; Final ''St. Stephen''
            </td>
          </tr>
          <tr>
            <td>
              With Airto Moreira.
            </td>
          </tr>
        </table>
      </div>
      <div>
        <table border="0" cellspacing="0" cellpadding="0">
          <tr>
            <td id="1227">
              <a href="/1983-12-27">12/27/1983 San Francisco Civic Auditorium, San Francisco, CA</a> [<a href="http://www.archive.org/search.php?query=creator:%22Grateful%20Dead%22%20date:1983-12-27*">Listen/Download</a>]
            </td>
          </tr>
          <tr>
            <td>
              I: Cold Rain, C. C. Rider, TLEO, BIODTL, Althea &gt; Cassidy, West L. A., Bucket &gt; Might As Well
            </td>
          </tr>
          <tr>
            <td>
              II: Scarlet * &gt; Fire * &gt; Samson, He's Gone &gt; Drumz &gt; Throwing Stones &gt; Black Peter &gt; Sugar Magnolia
            </td>
          </tr>
          <tr>
            <td>
              E: U. S. Blues
            </td>
          </tr>
          <tr>
            <td>
              *appears in the DVD included with the deluxe edition of the "Grateful Dead Scrapbook."
            </td>
          </tr>
        </table>
      </div>
      <div>
        <table border="0" cellspacing="0" cellpadding="0">
          <tr>
            <td id="1228">
              <a href="/1983-12-28">12/28/1983 San Francisco Civic Auditorium, San Francisco, CA</a> [<a href="http://www.archive.org/search.php?query=creator:%22Grateful%20Dead%22%20date:1983-12-28*">Listen/Download</a>]
            </td>
          </tr>
          <tr>
            <td>
              I: Stranger, Dire Wolf, Mama Tried &gt; Mexicali, Loser, Minglewood, Bird Song
            </td>
          </tr>
          <tr>
            <td>
              II: China Cat &gt; I Know You Rider, Playin &gt; Drumz &gt; Wheel &gt; Playin &gt; Other One &gt; Stella Blue &gt; Around &gt; Johnny B. Goode
            </td>
          </tr>
          <tr>
            <td>
              E: Baby Blue
            </td>
          </tr>
        </table>
      </div>
      <div>
        <table border="0" cellspacing="0" cellpadding="0">
          <tr>
            <td id="1230">
              <a href="/1983-12-30">12/30/1983 San Francisco Civic Auditorium, San Francisco, CA</a> [<a href="http://www.archive.org/search.php?query=creator:%22Grateful%20Dead%22%20date:1983-12-30*">Listen/Download</a>]
            </td>
          </tr>
          <tr>
            <td>
              I: Bertha &gt; Greatest, FOTD, Me and My Uncle &gt; Big River, Ramble On, Rooster, B. E. Women &gt; L. L. Rain &gt; Deal
            </td>
          </tr>
          <tr>
            <td>
              II: Shakedown, Woman Smarter, Terrapin &gt; Drumz &gt; Mind Left Body Jam &gt; Truckin &gt; Wharf Rat &gt; Good Lovin
            </td>
          </tr>
          <tr>
            <td>
              E: Day Job
            </td>
          </tr>
          <tr>
            <td>
              Next ''Mind Left Body Jam'' 3/24/1990 [431 shows]
            </td>
          </tr>
          <tr>
            <td>
              sound check: Shakedown
            </td>
          </tr>
        </table>
      </div>
      <div>
        <table border="0" cellspacing="0" cellpadding="0">
          <tr>
            <td id="1231">
              <a href="/1983-12-31">12/31/1983 San Francisco Civic Auditorium, San Francisco, CA</a> [<a href="http://www.archive.org/search.php?query=creator:%22Grateful%20Dead%22%20date:1983-12-31*">Listen/Download</a>]
            </td>
          </tr>
          <tr>
            <td>
              I: Jack Straw, Peggy-O, Minglewood, Candyman, Esau, Tennessee Jed, Bucket &gt; Don't Ease
            </td>
          </tr>
          <tr>
            <td>
              II: Sugar Magnolia &gt; Touch, Estimated &gt; Eyes &gt; Drumz &gt; Throwing Stones &gt; NFA
            </td>
          </tr>
          <tr>
            <td>
              III: Big Boss Man &gt; Iko Iko, Midnight Hour, Goodnight Irene*
            </td>
          </tr>
          <tr>
            <td>
              E: Brokedown
            </td>
          </tr>
          <tr>
            <td>
              Only ''Goodnight Irene''; Previous ''Big Boss Man'' 12/26/1981 [131 shows]; Previous ''Midnight Hour'' 12/31/1982 [66 shows]
            </td>
          </tr>
          <tr>
            <td>
              Bill Graham appears at midnight out of a globe. Also: The Band; Mike Henderson. FM broadcast KFOG-San Francisco - national radio broadcast. *with John Cipollina. Third set with Rick Danko and Maria Muldaur. Only "Goodnight Irene." "Brokedown Palace" was most definitely an encore performed between the second and third sets and did not close the second set as described in Deadlists.
            </td>
          </tr>
        </table>
      </div>
    </div>
  </body>
</html>
