<!DOCTYPE HTML PUBLIC "-//W3C//DTD HTML 4.01 Transitional//EN" "http://www.w3.org/TR/html4/loose.dtd">
<html>
<head>
<title>1977 Setlists</title>
</head>
<body>
<div id="main">
	<div class="page_title">1977 Setlists</div>

<script language="Javascript" type="text/javascript">
<!--
function showtab () {
document.getElementById('hide').style.display = 'none';
document.getElementById('show').style.display = 'block';
}
function hidetab () {
document.getElementById('show').style.display = 'none';
document.getElementById('hide').style.display = 'block';
}
-->
</script>
<p>February:  <a href="#0217">17</a> <a href="#0226">26</a> <a href="#0227">27</a><br>
March: <a href="#0318">18</a> <a href="#0319">19</a> <a href="#0320">20</a><br>
April: <a href="#0422">22</a> <a href="#0423">23</a> <a href="#0425">25</a> <a href="#0426">26</a> <a href="#0427">27</a> <a href="#0429">29</a> <a href="#0430">30</a><br>
May: <a href="#0501">1</a> <a href="#0503">3</a> <a href="#0504">4</a> <a href="#0505">5</a> <a href="#0507">7</a> <a href="#0508">8</a> <a href="#0509">9</a> <a href="#0511">11</a> <a href="#0512">12</a> <a href="#0513">13</a> <a href="#0515">15</a> <a href="#0517">17</a> <a href="#0518">18</a> <a href="#0519">19</a> <a href="#0521">21</a> <a href="#0522">22</a> <a href="#0525">25</a> <a href="#0526">26</a> <a href="#0528">28</a><br>
June: <a href="#0604">4</a> <a href="#0607">7</a> <a href="#0608">8</a> <a href="#0609">9</a><br>
September: <a href="#0903">3</a> <a href="#0928">28</a> <a href="#0929">29</a><br>
October: <a href="#1001">1</a> <a href="#1002">2</a> <a href="#1006">6</a> <a href="#1007">7</a> <a href="#1009">9</a> <a href="#1011">11</a> <a href="#1012">12</a> <a href="#1014">14</a> <a href="#1015">15</a> <a href="#1016">16</a> <a href="#1028">28</a> <a href="#1029">29</a> <a href="#1030">30</a><br>
November: <a href="#1101">1</a> <a href="#1102">2</a> <a href="#1104">4</a> <a href="#1105">5</a> <a href="#1106">6</a><br>
December: <a href="#1227">27</a> <a href="#1229">29</a> <a href="#1230">30</a> <a href="#1231">31</a></p>
<div class="setlist_table"><table border="0" cellspacing="0" cellpadding="0"><tr class="header"><td><span><a name="0217"></a><a href="/1977-02-17">2/17/1977 (unknown), (unknown), CA</a></span> [<a href="http://www.archive.org/search.php?query=creator:%22Grateful Dead%22%20date:1977-02-17*">Listen/Download</a>]<tr><td>Samson, Dancin, Sunrise, Passenger, Estimated, Fire*, Equinox*, Terrapin</td></tr>
<tr class="notes"><td>*appears as a "Terrapin Station" bonus track in "Beyond Description (1973-1989)." These "Terrapin Station" studio outtakes also circulate dated 02-20-77. They were not all recorded on the same day, and probably range in recording date from about November of 1976 through April of 1977.</i></td></tr>
</table></div>
<div class="setlist_table"><table border="0" cellspacing="0" cellpadding="0"><tr class="header"><td><span><a name="0226"></a><a href="/1977-02-26">2/26/1977 Swing Auditorium, San Bernardino, CA</a></span> [<a href="http://www.archive.org/search.php?query=creator:%22Grateful Dead%22%20date:1977-02-26*">Listen/Download</a>]<tr><td>I: Terrapin, Minglewood, TLEO, Estimated, Sugaree, Mama Tried, Deal, Playin > Wheel > Playin</td></tr>
<tr><td>II: Samson, Tennessee Jed, Music, Help > Slipknot > Franklin's, Promised, Eyes > Dancin > Around</td></tr>
<tr><td>E: U. S. Blues</td></tr>
<tr class="notes"><td>First ''Estimated''; First ''Terrapin''</i></td></tr>
</table></div>
<div class="setlist_table"><table border="0" cellspacing="0" cellpadding="0"><tr class="header"><td><span><a name="0227"></a><a href="/1977-02-27">2/27/1977 Robertson Gym, U.C.S.B., Santa Barbara, CA</a></span> [<a href="http://www.archive.org/search.php?query=creator:%22Grateful Dead%22%20date:1977-02-27*">Listen/Download</a>]<tr><td>I: Minglewood, Loser, El Paso, Ramble On, Estimated, Peggy-O, Good Lovin, Half Step, Music, Scarlet</td></tr>
<tr><td>II: Samson, St. Stephen > NFA > Drums > Terrapin > Morning Dew, Sugar Magnolia</td></tr>
<tr><td>E: Johnny B. Goode</td></tr>
</table></div>
<div class="setlist_table"><table border="0" cellspacing="0" cellpadding="0"><tr class="header"><td><span><a name="0318"></a><a href="/1977-03-18">3/18/1977 Winterland Arena, San Francisco, CA</a></span> [<a href="http://www.archive.org/search.php?query=creator:%22Grateful Dead%22%20date:1977-03-18*">Listen/Download</a>]<tr><td>I: Promised, Half Step, All Over Now, Sugaree, Minglewood, Peggy-O, Cassidy, Scarlet > Fire</td></tr>
<tr><td>II: Samson, B. E. Women, Good Lovin, Ship Of Fools, Estimated, Terrapin > Alhambra > Drums > NFA > St. Stephen > Around</td></tr>
<tr><td>E: Uncle John</td></tr>
<tr class="notes"><td>Only ''Alhambra''; First ''Fire''</i></td></tr>
<tr class="notes"><td>Only "Alhambra."</i></td></tr>
</table></div>
<div class="setlist_table"><table border="0" cellspacing="0" cellpadding="0"><tr class="header"><td><span><a name="0319"></a><a href="/1977-03-19">3/19/1977 Winterland Arena, San Francisco, CA</a></span> [<a href="http://www.archive.org/search.php?query=creator:%22Grateful Dead%22%20date:1977-03-19*">Listen/Download</a>]<tr><td>I: Bertha, Mama Tried, Loser, Big River, TLEO, L. L. Rain, Tennessee Jed, Estimated, Terrapin > Playin > Samson > Playin</td></tr>
<tr><td>II: Eyes > Dancin > Wharf Rat > Franklin's > Sugar Magnolia</td></tr>
<tr><td>E1: Saturday Night</td></tr>
<tr><td>E2: Uncle John</td></tr>
</table></div>
<div class="setlist_table"><table border="0" cellspacing="0" cellpadding="0"><tr class="header"><td><span><a name="0320"></a><a href="/1977-03-20">3/20/1977 Winterland Arena, San Francisco, CA</a></span> [<a href="http://www.archive.org/search.php?query=creator:%22Grateful Dead%22%20date:1977-03-20*">Listen/Download</a>]<tr><td>I: Minglewood, Ramble On, El Paso, Deal, Cassidy, Peggy-O, BIODTL, B. E. Women, Estimated, Scarlet</td></tr>
<tr><td>II: Samson, Row Jimmy, Promised, St. Stephen > Other One > Stella Blue, Around</td></tr>
<tr><td>E1: U. S. Blues</td></tr>
<tr><td>E2: Terrapin<span class="setlist_small">*</span></td></tr>
<tr class="notes"><td>Next ''BIODTL'' 1/13/1978 [61 shows]</i></td></tr>
<tr class="notes"><td>*broadcast on King Biscuit Flour Hour.</i></td></tr>
</table></div>
<div class="setlist_table"><table border="0" cellspacing="0" cellpadding="0"><tr class="header"><td><span><a name="0422"></a><a href="/1977-04-22">4/22/1977 The Spectrum, Philadelphia, PA</a></span> [<a href="http://www.archive.org/search.php?query=creator:%22Grateful Dead%22%20date:1977-04-22*">Listen/Download</a>]<tr><td>I: Promised, Half Step, L. L. Rain, Deal, El Paso, Tennessee Jed, Estimated, Peggy-O, Playin</td></tr>
<tr><td>II: Scarlet > Fire, Samson, Roses, Dancin > Mojo > Dancin > Wheel > Terrapin</td></tr>
<tr class="notes"><td>First ''Mojo''; Next ''Mojo'' 10/21/1978 [112 shows]</i></td></tr>
</table></div>
<div class="setlist_table"><table border="0" cellspacing="0" cellpadding="0"><tr class="header"><td><span><a name="0423"></a><a href="/1977-04-23">4/23/1977 Springfield Civic Center Arena, Springfield, MA</a></span> [<a href="http://www.archive.org/search.php?query=creator:%22Grateful Dead%22%20date:1977-04-23*">Listen/Download</a>]<tr><td>I: Sugaree, Cassidy, Loser, Minglewood, Ramble On, Me  and  My Uncle, Row Jimmy, All Over Now, Scarlet > Fire</td></tr>
<tr><td>II: Estimated, Bertha, Music, Help > Slipknot > Franklin's > Around > GDTRFB > NFA</td></tr>
<tr><td>E: Saturday Night</td></tr>
<tr class="notes"><td>Previous ''Me  and  My Uncle'' 6/17/1975 [50 shows]</i></td></tr>
</table></div>
<div class="setlist_table"><table border="0" cellspacing="0" cellpadding="0"><tr class="header"><td><span><a name="0425"></a><a href="/1977-04-25">4/25/1977 Capitol Theatre, Passaic, NJ</a></span> [<a href="http://www.archive.org/search.php?query=creator:%22Grateful Dead%22%20date:1977-04-25*">Listen/Download</a>]<tr><td>I: Minglewood, Deal, Mama Tried, TLEO, L. L. Rain, Peggy-O, Lazy Lightning > Supplication, Ship Of Fools, Estimated, B. E. Women, Music</td></tr>
<tr><td>II: Scarlet > Fire, Samson, Terrapin > Playin > Drums > Wharf Rat > Playin</td></tr>
<tr><td>E: U. S. Blues</td></tr>
</table></div>
<div class="setlist_table"><table border="0" cellspacing="0" cellpadding="0"><tr class="header"><td><span><a name="0426"></a><a href="/1977-04-26">4/26/1977 Capitol Theatre, Passaic, NJ</a></span> [<a href="http://www.archive.org/search.php?query=creator:%22Grateful Dead%22%20date:1977-04-26*">Listen/Download</a>]<tr><td>I: Bertha, Me  and  My Uncle, Roses, Cassidy, Tennessee Jed, Big River, FOTD, Estimated, Deal</td></tr>
<tr><td>II: Good Lovin, Half Step, Dancin > Drums > Eyes > Samson, Stella Blue, Sugar Magnolia</td></tr>
</table></div>
<div class="setlist_table"><table border="0" cellspacing="0" cellpadding="0"><tr class="header"><td><span><a name="0427"></a><a href="/1977-04-27">4/27/1977 Capitol Theatre, Passaic, NJ</a></span> [<a href="http://www.archive.org/search.php?query=creator:%22Grateful Dead%22%20date:1977-04-27*">Listen/Download</a>]<tr><td>I: Promised, Half Step, L. L. Rain, Sugaree, El Paso, Row Jimmy, Minglewood, Loser, Music</td></tr>
<tr><td>II: Estimated, Scarlet > Fire > Good Lovin, Ramble On, Samson, Terrapin > Morning Dew</td></tr>
<tr><td>E: Johnny B. Goode</td></tr>
<tr class="notes"><td>FM broadcast WNEW-New York.</i></td></tr>
</table></div>
<div class="setlist_table"><table border="0" cellspacing="0" cellpadding="0"><tr class="header"><td><span><a name="0429"></a><a href="/1977-04-29">4/29/1977 The Palladium, New York, NY</a></span> [<a href="http://www.archive.org/search.php?query=creator:%22Grateful Dead%22%20date:1977-04-29*">Listen/Download</a>]<tr><td>I: Help > Slipknot > Franklin's, Minglewood, Tennessee Jed, Cassidy, TLEO, Big River, Loser, Music</td></tr>
<tr><td>II: Samson, Sugaree > El Paso, B. E. Women, Estimated, Scarlet > GDTRFB > NFA Jam > Drums > Wheel > Wharf Rat > Around</td></tr>
<tr><td>E: Uncle John</td></tr>
<tr class="notes"><td>Venue used to be called "Academy Of Music." *appears on "Grateful Dead Download Series Volume 1."</i></td></tr>
</table></div>
<div class="setlist_table"><table border="0" cellspacing="0" cellpadding="0"><tr class="header"><td><span><a name="0430"></a><a href="/1977-04-30">4/30/1977 The Palladium, New York, NY</a></span> [<a href="http://www.archive.org/search.php?query=creator:%22Grateful Dead%22%20date:1977-04-30*">Listen/Download</a>]<tr><td>I: Music, Bertha, All Over Now, Deal, Mama Tried > Me  and  My Uncle, Peggy-O, L. L. Rain, Half Step, Promised</td></tr>
<tr><td>II: Scarlet > Fire > Good Lovin, FOTD, Estimated, St. Stephen > NFA > Stella Blue > St. Stephen > Saturday Night</td></tr>
<tr><td>E: Terrapin</td></tr>
<tr class="notes"><td>Entire show appears on "Grateful Dead Download Series Volume 1."</i></td></tr>
</table></div>
<div class="setlist_table"><table border="0" cellspacing="0" cellpadding="0"><tr class="header"><td><span><a name="0501"></a><a href="/1977-05-01">5/1/1977 The Palladium, New York, NY</a></span> [<a href="http://www.archive.org/search.php?query=creator:%22Grateful Dead%22%20date:1977-05-01*">Listen/Download</a>]<tr><td>I: Might As Well, El Paso, Ramble On, Cassidy, TLEO, Lazy Lightning > Supplication, Roses, Estimated, Tennessee Jed, Sunrise, Samson</td></tr>
<tr><td>II: Dancin > B. E. Women, Playin > Drums > Other One > Comes A Time > Playin</td></tr>
<tr><td>E: Brokedown</td></tr>
<tr class="notes"><td>First ''Sunrise''; Previous ''Brokedown'' 10/20/1974 [58 shows]</i></td></tr>
<tr class="notes"><td>"Beer Barrel Polka" tuning before "Playin."; Donna Jean Godchaux's 250th Show</i></td></tr>
</table></div>
<div class="setlist_table"><table border="0" cellspacing="0" cellpadding="0"><tr class="header"><td><span><a name="0503"></a><a href="/1977-05-03">5/3/1977 The Palladium, New York, NY</a></span> [<a href="http://www.archive.org/search.php?query=creator:%22Grateful Dead%22%20date:1977-05-03*">Listen/Download</a>]<tr><td>I: Promised, Bertha, Me  and  My Uncle, Peggy-O, Jack Straw, Row Jimmy, Lazy Lightning > Supplication, Deal, Good Lovin, Ship Of Fools, Music</td></tr>
<tr><td>II: Might As Well, Estimated, Sugaree, Samson, FOTD, Eyes > Space > Wharf Rat > Drums > NFA > Around</td></tr>
<tr><td>E: Uncle John</td></tr>
<tr class="notes"><td>Previous ''Jack Straw'' 10/20/1974 [59 shows]</i></td></tr>
</table></div>
<div class="setlist_table"><table border="0" cellspacing="0" cellpadding="0"><tr class="header"><td><span><a name="0504"></a><a href="/1977-05-04">5/4/1977 The Palladium, New York, NY</a></span> [<a href="http://www.archive.org/search.php?query=creator:%22Grateful Dead%22%20date:1977-05-04*">Listen/Download</a>]<tr><td>I: Half Step > Big River, TLEO, Minglewood, Roses, Cassidy, Deal, L. L. Rain, B. E. Women, Dancin</td></tr>
<tr><td>II: Estimated, Scarlet > Fire, Terrapin > Playin > Comes A Time > Playin</td></tr>
<tr class="notes"><td>Rumors circulated at this time that the Dead would play a free show in Central Park, predicted for immediately after the end of the tour, or for numerous free dates during it.</i></td></tr>
</table></div>
<div class="setlist_table"><table border="0" cellspacing="0" cellpadding="0"><tr class="header"><td><span><a name="0505"></a><a href="/1977-05-05">5/5/1977 Veterans Memorial Coliseum, New Haven, CT</a></span> [<a href="http://www.archive.org/search.php?query=creator:%22Grateful Dead%22%20date:1977-05-05*">Listen/Download</a>]<tr><td>I: Promised, Sugaree, Mama Tried > El Paso, Tennessee Jed, L. L. Rain, Deal, Lazy Lightning > Supplication, Peggy-O, Music</td></tr>
<tr><td>II: Bertha, Estimated, Scarlet > Fire > Good Lovin, St. Stephen > Sugar Magnolia</td></tr>
<tr><td>E: Johnny B. Goode</td></tr>
</table></div>
<div class="setlist_table"><table border="0" cellspacing="0" cellpadding="0"><tr class="header"><td><span><a name="0507"></a><a href="/1977-05-07">5/7/1977 Boston Garden, Boston, MA</a></span> [<a href="http://www.archive.org/search.php?query=creator:%22Grateful Dead%22%20date:1977-05-07*">Listen/Download</a>]<tr><td>I: Bertha, Cassidy, Deal, Jack Straw, Peggy-O, Minglewood, Half Step > Big River, Tennessee Jed, Music</td></tr>
<tr><td>II: Terrapin > Samson, FOTD, Estimated, Eyes > Drums > Wheel > Wharf Rat > Around</td></tr>
<tr><td>E: U. S. Blues</td></tr>
<tr class="notes"><td>Bill Kreutzmann's 31st birthday</i></td></tr>
</table></div>
<div class="setlist_table"><table border="0" cellspacing="0" cellpadding="0"><tr class="header"><td><span><a name="0508"></a><a href="/1977-05-08">5/8/1977 Barton Hall, Cornell University, Ithaca, NY</a></span> [<a href="http://www.archive.org/search.php?query=creator:%22Grateful Dead%22%20date:1977-05-08*">Listen/Download</a>]<tr><td>I: Minglewood, Loser, El Paso, TLEO, Jack Straw, Deal, Lazy Lightning > Supplication, B. E. Women, Mama Tried, Row Jimmy, Dancin <span class="setlist_small">*</span></td></tr>
<tr><td>II: Scarlet > Fire, Estimated, St. Stephen > NFA > St. Stephen > Morning Dew</td></tr>
<tr><td>E: Saturday Night</td></tr>
<tr class="notes"><td>General Admission: $7.50. *appears as a "Terrapin Station" bonus track in "Beyond Description (1973-1989)." </i></td></tr>
</table></div>
<div class="setlist_table"><table border="0" cellspacing="0" cellpadding="0"><tr class="header"><td><span><a name="0509"></a><a href="/1977-05-09">5/9/1977 War Memorial Auditorium, Buffalo, NY</a></span> [<a href="http://www.archive.org/search.php?query=creator:%22Grateful Dead%22%20date:1977-05-09*">Listen/Download</a>]<tr><td>I: Help > Slipknot > Franklin's, Cassidy, B. E. Women, Mexicali, Tennessee Jed, Big River, Peggy-O, Sunrise, Music</td></tr>
<tr><td>II: Bertha > Good Lovin, Ship Of Fools, Estimated > Other One > Drums > NFA > Comes A Time > Sugar Magnolia</td></tr>
<tr><td>E: Uncle John</td></tr>
<tr class="notes"><td>Previous ''Mexicali'' 10/19/1974 [65 shows]</i></td></tr>
</table></div>
<div class="setlist_table"><table border="0" cellspacing="0" cellpadding="0"><tr class="header"><td><span><a name="0511"></a><a href="/1977-05-11">5/11/1977 St. Paul Civic Center Arena, St. Paul, MN</a></span> [<a href="http://www.archive.org/search.php?query=creator:%22Grateful Dead%22%20date:1977-05-11*">Listen/Download</a>]<tr><td>I: Promised, TLEO, Big River, Loser, L. L. Rain, Ramble On, Jack Straw, Peggy-O, El Paso, Deal, Lazy Lightning > Supplication, Sugaree</td></tr>
<tr><td>II: Samson, B. E. Women, Estimated, Scarlet > Fire > Good Lovin, Uncle John > Space > Wharf Rat > Around</td></tr>
<tr><td>E: Brokedown</td></tr>
</table></div>
<div class="setlist_table"><table border="0" cellspacing="0" cellpadding="0"><tr class="header"><td><span><a name="0512"></a><a href="/1977-05-12">5/12/1977 Auditorium Theater, Chicago, IL</a></span> [<a href="http://www.archive.org/search.php?query=creator:%22Grateful Dead%22%20date:1977-05-12*">Listen/Download</a>]<tr><td>I: Bertha, Me  and  My Uncle, Tennessee Jed, Cassidy, Peggy-O, Jack Straw, TLEO, Minglewood, Half Step <span class="setlist_small">*</span> > Dancin <span class="setlist_small">*</span></td></tr>
<tr><td>II: Samson, B. E. Women, Estimated, Sunrise, Terrapin <span class="setlist_small">*</span> > Playin <span class="setlist_small">*</span> > Drums <span class="setlist_small">*</span> > NFA <span class="setlist_small">*</span> > Comes A Time <span class="setlist_small">*</span> > Playin <span class="setlist_small">*</span></td></tr>
<tr><td>E: Johnny B. Goode</td></tr>
<tr class="notes"><td>*appears on the "Winterland June 1977: The Complete Recordings" bonus disc.</i></td></tr>
</table></div>
<div class="setlist_table"><table border="0" cellspacing="0" cellpadding="0"><tr class="header"><td><span><a name="0513"></a><a href="/1977-05-13">5/13/1977 Auditorium Theater, Chicago, IL</a></span> [<a href="http://www.archive.org/search.php?query=creator:%22Grateful Dead%22%20date:1977-05-13*">Listen/Download</a>]<tr><td>I: Music, Ramble On, Cassidy, B. E. Women, Minglewood, FOTD, El Paso, Jack A Roe, L. L. Rain, Scarlet > Fire</td></tr>
<tr><td>II: Samson > Bertha, Estimated > Drums > Other One > Stella Blue > GDTRFB > Saturday Night</td></tr>
<tr><td>E: U. S. Blues</td></tr>
<tr class="notes"><td>First ''Jack A Roe''</i></td></tr>
<tr class="notes"><td>FM broadcast.</i></td></tr>
</table></div>
<div class="setlist_table"><table border="0" cellspacing="0" cellpadding="0"><tr class="header"><td><span><a name="0515"></a><a href="/1977-05-15">5/15/1977 St. Louis Arena, St. Louis, MO</a></span> [<a href="http://www.archive.org/search.php?query=creator:%22Grateful Dead%22%20date:1977-05-15*">Listen/Download</a>]<tr><td>I: Bertha > Good Lovin, Row Jimmy, Minglewood, Tennessee Jed, Lazy Lightning > Supplication, Jack A Roe, Passenger, B. E. Women, Dancin</td></tr>
<tr><td>II: Estimated > Eyes > Drums > Samson, Ship Of Fools, St. Stephen > Iko Iko > NFA > Sugar Magnolia</td></tr>
<tr><td>E: Uncle John</td></tr>
<tr class="notes"><td>First ''Iko Iko''; First ''Passenger''</i></td></tr>
<tr class="notes"><td>"Funiculi Funicula" tuning before "B. E. Women."</i></td></tr>
</table></div>
<div class="setlist_table"><table border="0" cellspacing="0" cellpadding="0"><tr class="header"><td><span><a name="0517"></a><a href="/1977-05-17">5/17/1977 Memorial Coliseum, U. of Alabama, Tuscaloosa, AL</a></span> [<a href="http://www.archive.org/search.php?query=creator:%22Grateful Dead%22%20date:1977-05-17*">Listen/Download</a>]<tr><td>I: Minglewood, Half Step > El Paso, TLEO, Jack Straw, Jack A Roe <span class="setlist_small">*</span>, L. L. Rain, Tennessee Jed, Passenger, High Time, Big River, Sunrise, Scarlet > Fire</td></tr>
<tr><td>II: Samson > Bertha > Good Lovin, B. E. Women, Estimated, Terrapin > Playin > Drums > Wharf Rat > Playin</td></tr>
<tr><td>E: Sugar Magnolia</td></tr>
<tr class="notes"><td>*appears on "Fallout From The Phil Zone."</i></td></tr>
</table></div>
<div class="setlist_table"><table border="0" cellspacing="0" cellpadding="0"><tr class="header"><td><span><a name="0518"></a><a href="/1977-05-18">5/18/1977 Fox Theatre, Atlanta, GA</a></span> [<a href="http://www.archive.org/search.php?query=creator:%22Grateful Dead%22%20date:1977-05-18*">Listen/Download</a>]<tr><td>I: Deal, Cassidy, Jack A Roe, Mexicali, FOTD, Minglewood, Roses, Lazy Lightning > Supplication, High Time, Music</td></tr>
<tr><td>II: Jack Straw, Ship Of Fools, Estimated > Eyes > Drums > Other One > Stella Blue > Around</td></tr>
<tr><td>E: Brokedown</td></tr>
</table></div>
<div class="setlist_table"><table border="0" cellspacing="0" cellpadding="0"><tr class="header"><td><span><a name="0519"></a><a href="/1977-05-19">5/19/1977 Fox Theatre, Atlanta, GA</a></span> [<a href="http://www.archive.org/search.php?query=creator:%22Grateful Dead%22%20date:1977-05-19*">Listen/Download</a>]<tr><td>I: Promised, Sugaree > El Paso, Peggy-O, L. L. Rain, Row Jimmy, Passenger, Loser, Dancin</td></tr>
<tr><td>II: Samson, Ramble On, Estimated, Terrapin > Playin > Uncle John > Drums > Wheel > China Doll > Playin</td></tr>
<tr class="notes"><td>Previous ''China Doll'' 10/19/1974 [72 shows]</i></td></tr>
<tr class="notes"><td>Entire show appears on "Dick’s Picks Volume 29."</i></td></tr>
</table></div>
<div class="setlist_table"><table border="0" cellspacing="0" cellpadding="0"><tr class="header"><td><span><a name="0521"></a><a href="/1977-05-21">5/21/1977 Lakeland Civic Center Arena, Lakeland, FL</a></span> [<a href="http://www.archive.org/search.php?query=creator:%22Grateful Dead%22%20date:1977-05-21*">Listen/Download</a>]<tr><td>I: Bertha, Me  and  My Uncle, TLEO, Cassidy, Jack A Roe, Jack Straw, Tennessee Jed, Minglewood, Row Jimmy, Passenger, Scarlet > Fire</td></tr>
<tr><td>II: Samson, B. E. Women, Estimated > He's Gone > Drums > Other One > Comes A Time > St. Stephen > NFA > St. Stephen > Saturday Night</td></tr>
<tr><td>E: U. S. Blues</td></tr>
<tr class="notes"><td>Next ''Comes A Time'' 5/16/1978 [73 shows]</i></td></tr>
<tr class="notes"><td>Entire show except encore appears on "Dick’s Picks Volume 29."</i></td></tr>
</table></div>
<div class="setlist_table"><table border="0" cellspacing="0" cellpadding="0"><tr class="header"><td><span><a name="0522"></a><a href="/1977-05-22">5/22/1977 Sportatorium, Pembroke Pines, FL</a></span> [<a href="http://www.archive.org/search.php?query=creator:%22Grateful Dead%22%20date:1977-05-22*">Listen/Download</a>]<tr><td>I: Music<span class="setlist_small">*</span>, Sugaree<span class="setlist_small">*</span>, El Paso, Peggy-O, Minglewood, FOTD, Lazy Lightning<span class="setlist_small">*</span> > Supplication<span class="setlist_small">*</span>, Ramble On, Dancin<span class="setlist_small">*</span></td></tr>
<tr><td>II: Help<span class="setlist_small">*</span> > Slipknot<span class="setlist_small">*</span> > Franklin's<span class="setlist_small">*</span>, Samson<span class="setlist_small">*</span>, B. E. Women, Good Lovin, Sunrise<span class="setlist_small">*</span>, Estimated<span class="setlist_small">*</span> > Eyes<span class="setlist_small">*</span> > Wharf Rat<span class="setlist_small">*</span> > Terrapin<span class="setlist_small">*</span> > Morning Dew<span class="setlist_small">*</span></td></tr>
<tr><td>E: Sugar Magnolia</td></tr>
<tr class="notes"><td>"Funiculi Funicula" tuning before "Music." "Terrapin" does not include "Lady With A Fan." *appears on "Dick's Picks Vol 3."</i></td></tr>
</table></div>
<div class="setlist_table"><table border="0" cellspacing="0" cellpadding="0"><tr class="header"><td><span><a name="0525"></a><a href="/1977-05-25">5/25/1977 The Mosque, Richmond, VA</a></span> [<a href="http://www.archive.org/search.php?query=creator:%22Grateful Dead%22%20date:1977-05-25*">Listen/Download</a>]<tr><td>I: Half Step, Jack Straw, TLEO, Mexicali, Peggy-O, Cassidy, Loser, Lazy Lightning > Supplication, B. E. Women, Promised</td></tr>
<tr><td>II: Scarlet > Fire, Estimated > He's Gone > Drums > Other One > Wharf Rat > Other One > Wheel > Around</td></tr>
<tr><td>E: Johnny B. Goode</td></tr>
<tr class="notes"><td>Entire show released as "Dave's Picks Volume 1."; Mickey Hart's 500th Show</i></td></tr>
</table></div>
<div class="setlist_table"><table border="0" cellspacing="0" cellpadding="0"><tr class="header"><td><span><a name="0526"></a><a href="/1977-05-26">5/26/1977 Baltimore Civic Center, Baltimore, MD</a></span> [<a href="http://www.archive.org/search.php?query=creator:%22Grateful Dead%22%20date:1977-05-26*">Listen/Download</a>]<tr><td>I: Music, Sugaree, Mama Tried, Sunrise, Deal, Passenger, B. E. Women, L. L. Rain, Jack A Roe, Minglewood, Bertha</td></tr>
<tr><td>II: Samson, High Time, Big River, Terrapin > Estimated > Eyes > NFA > GDTRFB > Around</td></tr>
<tr><td>E: Uncle John</td></tr>
<tr class="notes"><td>Next ''High Time'' 2/17/1979 [130 shows]</i></td></tr>
</table></div>
<div class="setlist_table"><table border="0" cellspacing="0" cellpadding="0"><tr class="header"><td><span><a name="0528"></a><a href="/1977-05-28">5/28/1977 Hartford Civic Center, Hartford, CT</a></span> [<a href="http://www.archive.org/search.php?query=creator:%22Grateful Dead%22%20date:1977-05-28*">Listen/Download</a>]<tr><td>I: Bertha > Good Lovin > Sugaree, Jack Straw, Row Jimmy, Minglewood, Candyman, Passenger, B. E. Women, Promised</td></tr>
<tr><td>II: Samson, Tennessee Jed, Estimated > Playin > Terrapin > Drums > NFA > Wharf Rat > Playin, Saturday Night</td></tr>
<tr><td>E: U. S. Blues</td></tr>
<tr class="notes"><td>Entire show released as "To Terrapin: Hartford ’77."</i></td></tr>
</table></div>
<div class="setlist_table"><table border="0" cellspacing="0" cellpadding="0"><tr class="header"><td><span><a name="0604"></a><a href="/1977-06-04">6/4/1977 The Forum, Inglewood, CA</a></span> [<a href="http://www.archive.org/search.php?query=creator:%22Grateful Dead%22%20date:1977-06-04*">Listen/Download</a>]<tr><td>I: Promised, Tennessee Jed, El Paso, Peggy-O, Jack Straw, FOTD, Lazy Lightning > Supplication, Candyman, Minglewood, B. E. Women, Music</td></tr>
<tr><td>II: Samson, Ship Of Fools, Estimated > Eyes > Drums > Good Lovin, Terrapin > Playin > Franklin's > Space > China Doll > NFA > Playin</td></tr>
<tr><td>E: Saturday Night</td></tr>
<tr class="notes"><td>Soundcheck: "Jack Straw."</i></td></tr>
</table></div>
<div class="setlist_table"><table border="0" cellspacing="0" cellpadding="0"><tr class="header"><td><span><a name="0607"></a><a href="/1977-06-07">6/7/1977 Winterland Arena, San Francisco, CA</a></span> [<a href="http://www.archive.org/search.php?query=creator:%22Grateful Dead%22%20date:1977-06-07*">Listen/Download</a>]<tr><td>I: Bertha, Jack Straw, Tennessee Jed, L. L. Rain, Peggy-O, El Paso, FOTD, Music</td></tr>
<tr><td>II: Scarlet > Fire > Good Lovin, Candyman, Estimated > He's Gone > Drums > Samson, Terrapin > Morning Dew > Around</td></tr>
<tr><td>E1: Uncle John</td></tr>
<tr><td>E2: U. S. Blues</td></tr>
<tr class="notes"><td>Next ''Morning Dew'' 4/15/1978 [52 shows]</i></td></tr>
<tr class="notes"><td>"Funiculi Funicula" tuning before "El Paso." "Jingle Bells" tuning before "Scarlet." Entire show appears on "Winterland June 1977: The Complete Recordings." </i></td></tr>
</table></div>
<div class="setlist_table"><table border="0" cellspacing="0" cellpadding="0"><tr class="header"><td><span><a name="0608"></a><a href="/1977-06-08">6/8/1977 Winterland Arena, San Francisco, CA</a></span> [<a href="http://www.archive.org/search.php?query=creator:%22Grateful Dead%22%20date:1977-06-08*">Listen/Download</a>]<tr><td>I: Minglewood, Sugaree, Mexicali, Row Jimmy, Passenger, Sunrise, B. E. Women, All Over Now, Jack A Roe, Lazy Lightning > Supplication</td></tr>
<tr><td>II: Bertha > Good Lovin, Ramble On, Estimated > Eyes > Drums > Other One > Wharf Rat > NFA > GDTRFB > Johnny B. Goode</td></tr>
<tr><td>E: Brokedown</td></tr>
<tr class="notes"><td>Next ''Jack A Roe'' 11/20/1978 [91 shows]</i></td></tr>
<tr class="notes"><td>Entire show appears on "Winterland June 1977: The Complete Recordings."</i></td></tr>
</table></div>
<div class="setlist_table"><table border="0" cellspacing="0" cellpadding="0"><tr class="header"><td><span><a name="0609"></a><a href="/1977-06-09">6/9/1977 Winterland Arena, San Francisco, CA</a></span> [<a href="http://www.archive.org/search.php?query=creator:%22Grateful Dead%22%20date:1977-06-09*">Listen/Download</a>]<tr><td>I: Half Step, Jack Straw, TLEO, Cassidy, Sunrise, Deal, L. L. Rain, Loser, Music</td></tr>
<tr><td>II: Samson, Help > Slipknot > Franklin's, Estimated > St. Stephen > NFA > Drums > St. Stephen > Terrapin > Sugar Magnolia</td></tr>
<tr><td>E1: U. S. Blues</td></tr>
<tr><td>E2: Saturday Night</td></tr>
<tr class="notes"><td>"Funiculi Funicula" tuning before "Help." Entire show appears on "Winterland June 1977: The Complete Recordings."</i></td></tr>
</table></div>
<div class="setlist_table"><table border="0" cellspacing="0" cellpadding="0"><tr class="header"><td><span><a name="0903"></a><a href="/1977-09-03">9/3/1977 Raceway Park, Englishtown, NJ</a></span> [<a href="http://www.archive.org/search.php?query=creator:%22Grateful Dead%22%20date:1977-09-03*">Listen/Download</a>]<tr><td>I: Promised, TLEO, Me  and  My Uncle, Half Step, L. L. Rain, Peggy-O, Minglewood, FOTD, Music</td></tr>
<tr><td>II: Bertha > Good Lovin, Loser, Estimated > Eyes, Samson </td></tr>
<tr><td>III: He's Gone > NFA > Truckin</td></tr>
<tr><td>E: Terrapin</td></tr>
<tr class="notes"><td>Previous ''Truckin'' 9/28/1975 [77 shows]</i></td></tr>
<tr class="notes"><td>FM broadcast WNEW-New York. Also: Marshall Tucker; NRPS. "Take a Step Back" before "Half Step." Entire show released as "Dick’s Picks Volume 15." </i></td></tr>
</table></div>
<div class="setlist_table"><table border="0" cellspacing="0" cellpadding="0"><tr class="header"><td><span><a name="0928"></a><a href="/1977-09-28">9/28/1977 Paramount Northwest Theatre, Seattle, WA</a></span> [<a href="http://www.archive.org/search.php?query=creator:%22Grateful Dead%22%20date:1977-09-28*">Listen/Download</a>]<tr><td>I: Minglewood, TLEO, Cassidy, Loser, Jack Straw, Tennessee Jed, Passenger, Peggy-O, Me  and  My Uncle, FOTD, Music</td></tr>
<tr><td>II: Bertha > Good Lovin, Dire Wolf, Estimated > Eyes > Drums > NFA > Wharf Rat > Around</td></tr>
<tr><td>E: U. S. Blues</td></tr>
<tr class="notes"><td>Previous ''Dire Wolf'' 10/19/1974 [83 shows]</i></td></tr>
</table></div>
<div class="setlist_table"><table border="0" cellspacing="0" cellpadding="0"><tr class="header"><td><span><a name="0929"></a><a href="/1977-09-29">9/29/1977 Paramount Northwest Theatre, Seattle, WA</a></span> [<a href="http://www.archive.org/search.php?query=creator:%22Grateful Dead%22%20date:1977-09-29*">Listen/Download</a>]<tr><td>I: Half Step, Mama Tried, Deal, L. L. Rain, Ramble On, El Paso, Sugaree, Let It Grow, Franklin's</td></tr>
<tr><td>II: Samson, Ship Of Fools, Estimated > He's Gone > Drums > Truckin > Stella Blue > GDTRFB > Johnny B. Goode</td></tr>
<tr><td>E: Uncle John</td></tr>
</table></div>
<div class="setlist_table"><table border="0" cellspacing="0" cellpadding="0"><tr class="header"><td><span><a name="1001"></a><a href="/1977-10-01">10/1/1977 Paramount Theater, Portland, OR</a></span> [<a href="http://www.archive.org/search.php?query=creator:%22Grateful Dead%22%20date:1977-10-01*">Listen/Download</a>]<tr><td>I: Promised, TLEO, Mexicali, Dire Wolf, Cassidy, Deal, Passenger, Tennessee Jed, Minglewood, Peggy-O, Music</td></tr>
<tr><td>II: Bertha > Good Lovin, Roses, Estimated > Eyes > Dancin > Drums > NFA > Black Peter > Around</td></tr>
<tr class="notes"><td>Previous ''Black Peter'' 10/19/1974 [85 shows]</i></td></tr>
</table></div>
<div class="setlist_table"><table border="0" cellspacing="0" cellpadding="0"><tr class="header"><td><span><a name="1002"></a><a href="/1977-10-02">10/2/1977 Paramount Theater, Portland, OR</a></span> [<a href="http://www.archive.org/search.php?query=creator:%22Grateful Dead%22%20date:1977-10-02*">Listen/Download</a>]<tr><td>I: Casey Jones, Jack Straw, Sunrise, B. E. Women, El Paso, Dupree's, Let It Grow, Deal</td></tr>
<tr><td>II: Samson, Scarlet > Fire, Playin > Drums > Wheel > Truckin > Other One > Wharf Rat > Sugar Magnolia</td></tr>
<tr><td>E: Johnny B. Goode</td></tr>
<tr class="notes"><td>Previous ''Casey Jones'' 10/17/1974 [88 shows]; Previous ''Dupree's'' 7/11/1969 [561 shows]</i></td></tr>
<tr class="notes"><td>"Funiculi Funicula" tuning before "Playin."</i></td></tr>
</table></div>
<div class="setlist_table"><table border="0" cellspacing="0" cellpadding="0"><tr class="header"><td><span><a name="1006"></a><a href="/1977-10-06">10/6/1977 Activity Center, A. S. U., Tempe, AZ</a></span> [<a href="http://www.archive.org/search.php?query=creator:%22Grateful Dead%22%20date:1977-10-06*">Listen/Download</a>]<tr><td>I: Promised<span class="setlist_small">*</span>, Tennessee Jed<span class="setlist_small">*</span>, Jack Straw, Dire Wolf, L. L. Rain<span class="setlist_small">*</span>, Loser, Minglewood, TLEO, Music</td></tr>
<tr><td>II: Bertha > Good Lovin, FOTD, Estimated<span class="setlist_small">*</span> > Eyes > Drums > NFA<span class="setlist_small">*</span> > Black Peter<span class="setlist_small">*</span> > NFA<span class="setlist_small">*</span> > Around<span class="setlist_small">*</span></td></tr>
<tr><td>E: Uncle John</td></tr>
<tr class="notes"><td>Next ''Uncle John'' 12/26/1979 [170 shows]</i></td></tr>
<tr class="notes"><td>*broadcast on King Biscuit Flour Hour.</i></td></tr>
</table></div>
<div class="setlist_table"><table border="0" cellspacing="0" cellpadding="0"><tr class="header"><td><span><a name="1007"></a><a href="/1977-10-07">10/7/1977 University of New Mexico, Albuquerque, NM</a></span> [<a href="http://www.archive.org/search.php?query=creator:%22Grateful Dead%22%20date:1977-10-07*">Listen/Download</a>]<tr><td>I: Half Step, Jack Straw, Peggy-O, El Paso, TLEO, Big River, Dupree's, Let It Grow, Deal</td></tr>
<tr><td>II: Samson, Sunrise, Ramble On, Passenger, Terrapin > Playin > Drums > Iko Iko <span class="setlist_small">*</span> > Wheel <span class="setlist_small">*</span> > Wharf Rat <span class="setlist_small">*</span> > Sugar Magnolia <span class="setlist_small">*</span></td></tr>
<tr><td>E: Saturday Night</td></tr>
<tr class="notes"><td>*appears on the "Road Trips Vol. 1 No. 2" bonus disc.</i></td></tr>
</table></div>
<div class="setlist_table"><table border="0" cellspacing="0" cellpadding="0"><tr class="header"><td><span><a name="1009"></a><a href="/1977-10-09">10/9/1977 McNichols Sports Arena, Denver, CO</a></span> [<a href="http://www.archive.org/search.php?query=creator:%22Grateful Dead%22%20date:1977-10-09*">Listen/Download</a>]<tr><td>I: Minglewood, TLEO, Cassidy, Dire Wolf, L. L. Rain, B. E. Women, Lazy Lightning > Supplication, Sugaree, Music</td></tr>
<tr><td>II: Samson, Scarlet > Fire, Estimated > He's Gone > Truckin > Drums > Terrapin > Around</td></tr>
<tr><td>E: Casey Jones</td></tr>
</table></div>
<div class="setlist_table"><table border="0" cellspacing="0" cellpadding="0"><tr class="header"><td><span><a name="1011"></a><a href="/1977-10-11">10/11/1977 Lloyd Noble Center, U. of Oklahoma, Norman, OK</a></span> [<a href="http://www.archive.org/search.php?query=creator:%22Grateful Dead%22%20date:1977-10-11*">Listen/Download</a>]<tr><td>I: Help <span class="setlist_small">+</span> > Slipknot <span class="setlist_small">+</span> > Franklin's <span class="setlist_small">+</span>, Jack Straw, Peggy-O, El Paso, Sunrise <span class="setlist_small">#</span>, Deal, Let It Grow <span class="setlist_small">+</span></td></tr>
<tr><td>II: Dancin <span class="setlist_small">*</span> > Dire Wolf <span class="setlist_small">*</span>, Estimated > Eyes > Drums > NFA <span class="setlist_small">*</span> > Wharf Rat <span class="setlist_small">*</span> > Around <span class="setlist_small">*</span></td></tr>
<tr class="notes"><td>Next ''Slipknot'' 3/25/1983 [401 shows]</i></td></tr>
<tr class="notes"><td>Soundcheck: "Candyman." *appears as a hidden track on "Dick’s Picks Volume 29." +appears on "Road Trips Vol. 1 No. 2." #appears on the "Road Trips Vol. 1 No. 2" bonus disc.  ; The Grateful Dead's 1000th Show; Jerry Garcia's 1000th Show; Bob Weir's 1000th Show</i></td></tr>
</table></div>
<div class="setlist_table"><table border="0" cellspacing="0" cellpadding="0"><tr class="header"><td><span><a name="1012"></a><a href="/1977-10-12">10/12/1977 Manor Downs, Austin, TX</a></span> [<a href="http://www.archive.org/search.php?query=creator:%22Grateful Dead%22%20date:1977-10-12*">Listen/Download</a>]<tr><td>I: Promised, TLEO, Me  and  My Uncle, Candyman, Passenger, B. E. Women, El Paso, FOTD, Lazy Lightning > Supplication, Deal</td></tr>
<tr><td>II: Samson, Tennessee Jed, Estimated > He's Gone > Drums > Other One > Black Peter > Truckin > Nobody's Fault > Iko Iko > Sugar Magnolia</td></tr>
<tr><td>E: Johnny B. Goode</td></tr>
<tr class="notes"><td>Next ''Nobody's Fault'' 1/5/1979 [96 shows]</i></td></tr>
<tr class="notes"><td>Bill Kreutzmann's 1000th Show</i></td></tr>
</table></div>
<div class="setlist_table"><table border="0" cellspacing="0" cellpadding="0"><tr class="header"><td><span><a name="1014"></a><a href="/1977-10-14">10/14/1977 Hofheinz Pavilion, Houston, TX</a></span> [<a href="http://www.archive.org/search.php?query=creator:%22Grateful Dead%22%20date:1977-10-14*">Listen/Download</a>]<tr><td>I: Jack Straw, Half Step <span class="setlist_small">*</span> > El Paso <span class="setlist_small">*</span>, B. E. Women, Minglewood, Loser <span class="setlist_small">+</span>, Passenger, FOTD, Me  and  My Uncle, Tennessee Jed, Music</td></tr>
<tr><td>II: Bertha > Good Lovin, Candyman, Playin <span class="setlist_small">*</span> > Drums > Wheel > Wharf Rat > Around</td></tr>
<tr><td>E: Brokedown <span class="setlist_small">*</span> > Playin <span class="setlist_small">*</span></td></tr>
<tr class="notes"><td>Next ''Brokedown'' 12/26/1979 [165 shows]</i></td></tr>
<tr class="notes"><td>*appears on "Road Trips Vol. 1 No. 2." +appears on the "Road Trips Vol. 1 No. 2" bonus disc. </i></td></tr>
</table></div>
<div class="setlist_table"><table border="0" cellspacing="0" cellpadding="0"><tr class="header"><td><span><a name="1015"></a><a href="/1977-10-15">10/15/1977 Moody Coliseum, S.M.U., Dallas, TX</a></span> [<a href="http://www.archive.org/search.php?query=creator:%22Grateful Dead%22%20date:1977-10-15*">Listen/Download</a>]<tr><td>I: Bertha > Good Lovin, TLEO, Mama Tried > Big River, Ramble On, L. L. Rain, Peggy-O, Let It Grow</td></tr>
<tr><td>II: Samson, Sunrise, Terrapin > St. Stephen > NFA > Stella Blue > Sugar Magnolia</td></tr>
<tr><td>E: Truckin > Saturday Night</td></tr>
<tr class="notes"><td>Phil Lesh's 1000th Show</i></td></tr>
</table></div>
<div class="setlist_table"><table border="0" cellspacing="0" cellpadding="0"><tr class="header"><td><span><a name="1016"></a><a href="/1977-10-16">10/16/1977 Assembly Center, La. State U., Baton Rouge, LA</a></span> [<a href="http://www.archive.org/search.php?query=creator:%22Grateful Dead%22%20date:1977-10-16*">Listen/Download</a>]<tr><td>I: Promised, Sugaree <span class="setlist_small">*</span>, Cassidy, Loser, Minglewood, FOTD, Sunrise, Dire Wolf, Music <span class="setlist_small">*</span></td></tr>
<tr><td>II: Scarlet <span class="setlist_small">+</span> > Fire <span class="setlist_small">+</span>, Estimated <span class="setlist_small">+</span> > Drums <span class="setlist_small">*</span> > Other One <span class="setlist_small">*</span> > Good Lovin <span class="setlist_small">*</span> > Terrapin <span class="setlist_small">*</span> > Black Peter <span class="setlist_small">*</span> > Around <span class="setlist_small">*</span></td></tr>
<tr><td>E: U. S. Blues</td></tr>
<tr class="notes"><td>Bob Weir's 30th birthday. *appears on "Road Trips Vol. 1 No. 2." +appears on the "Road Trips Vol. 1 No. 2" bonus disc.  </i></td></tr>
</table></div>
<div class="setlist_table"><table border="0" cellspacing="0" cellpadding="0"><tr class="header"><td><span><a name="1028"></a><a href="/1977-10-28">10/28/1977 Soldiers  and  Sailors Memorial Hall, Kansas City, KS</a></span> [<a href="http://www.archive.org/search.php?query=creator:%22Grateful Dead%22%20date:1977-10-28*">Listen/Download</a>]<tr><td>I: Promised, TLEO, Cassidy, Tennessee Jed, Mexicali > Big River, B. E. Women, Lazy Lightning > Supplication, Deal</td></tr>
<tr><td>II: Samson, Candyman, Sunrise, Passenger, He's Gone > Drums > NFA > Space > Stella Blue > GDTRFB > Around</td></tr>
<tr><td>E: Casey Jones</td></tr>
<tr class="notes"><td>Next ''GDTRFB'' 5/14/1978 [50 shows]</i></td></tr>
</table></div>
<div class="setlist_table"><table border="0" cellspacing="0" cellpadding="0"><tr class="header"><td><span><a name="1029"></a><a href="/1977-10-29">10/29/1977 Evans Field House, Northern Illinois U., DeKalb, IL</a></span> [<a href="http://www.archive.org/search.php?query=creator:%22Grateful Dead%22%20date:1977-10-29*">Listen/Download</a>]<tr><td>I: Might As Well, Jack Straw, Dire Wolf, L. L. Rain, Loser, El Paso, Ramble On, Minglewood, Roses, Let It Grow</td></tr>
<tr><td>II: Bertha > Good Lovin, FOTD, Estimated > Eyes > Space > St. Stephen > Drums > NFA > Black Peter > Sugar Magnolia</td></tr>
<tr><td>E: Saturday Night</td></tr>
</table></div>
<div class="setlist_table"><table border="0" cellspacing="0" cellpadding="0"><tr class="header"><td><span><a name="1030"></a><a href="/1977-10-30">10/30/1977 Assembly Hall, Indiana U., Bloomington, IN</a></span> [<a href="http://www.archive.org/search.php?query=creator:%22Grateful Dead%22%20date:1977-10-30*">Listen/Download</a>]<tr><td>I: Minglewood, TLEO, Mama Tried > Me  and  My Uncle, Tennessee Jed, Passenger, Candyman, Lazy Lightning > Supplication, Deal</td></tr>
<tr><td>II: Samson, Peggy-O, Playin > Other One > Drums > Wheel > Wharf Rat > Playin</td></tr>
<tr><td>E: Johnny B. Goode</td></tr>
</table></div>
<div class="setlist_table"><table border="0" cellspacing="0" cellpadding="0"><tr class="header"><td><span><a name="1101"></a><a href="/1977-11-01">11/1/1977 Cobo Arena, Detroit, MI</a></span> [<a href="http://www.archive.org/search.php?query=creator:%22Grateful Dead%22%20date:1977-11-01*">Listen/Download</a>]<tr><td>I: Might As Well, Jack Straw, Tennessee Jed, El Paso, FOTD, L. L. Rain, Dire Wolf, Passenger, Peggy-O, Music</td></tr>
<tr><td>II: Terrapin > Estimated > Other One > Drums > Wharf Rat > Truckin > Around</td></tr>
<tr><td>E: U. S. Blues</td></tr>
</table></div>
<div class="setlist_table"><table border="0" cellspacing="0" cellpadding="0"><tr class="header"><td><span><a name="1102"></a><a href="/1977-11-02">11/2/1977 Field House, Seneca College, Toronto, Canada</a></span> [<a href="http://www.archive.org/search.php?query=creator:%22Grateful Dead%22%20date:1977-11-02*">Listen/Download</a>]<tr><td>I: Promised, TLEO, Me  and  My Uncle > Big River, Candyman, L. L. Rain, Ramble On, Lazy Lightning <span class="setlist_small">*</span> > Supplication <span class="setlist_small">*</span>, Might As Well <span class="setlist_small">*</span></td></tr>
<tr><td>II: Samson, Ship Of Fools, Good Lovin, Sunrise, Scarlet > Fire, Estimated <span class="setlist_small">*</span> > St. Stephen <span class="setlist_small">*</span> > Truckin <span class="setlist_small">*</span> > Around <span class="setlist_small">*</span></td></tr>
<tr><td>E: Terrapin</td></tr>
<tr class="notes"><td>Next ''Might As Well'' 2/11/1979 [106 shows]</i></td></tr>
<tr class="notes"><td>*appears on Dick’s Picks Volume 34.</i></td></tr>
</table></div>
<div class="setlist_table"><table border="0" cellspacing="0" cellpadding="0"><tr class="header"><td><span><a name="1104"></a><a href="/1977-11-04">11/4/1977 Cotterell Gym, Colgate University, Hamilton, NY</a></span> [<a href="http://www.archive.org/search.php?query=creator:%22Grateful Dead%22%20date:1977-11-04*">Listen/Download</a>]<tr><td>I: Bertha > Good Lovin, B. E. Women, Cassidy, Roses, Sunrise, Minglewood, Dupree's, Let It Grow</td></tr>
<tr><td>II: Samson > Cold Rain, Playin > Eyes > Estimated > Other One > Drums > Iko Iko > Stella Blue > Playin</td></tr>
<tr><td>E: Johnny B. Goode</td></tr>
<tr class="notes"><td>Previous ''Cold Rain'' 9/28/1976 [63 shows]</i></td></tr>
</table></div>
<div class="setlist_table"><table border="0" cellspacing="0" cellpadding="0"><tr class="header"><td><span><a name="1105"></a><a href="/1977-11-05">11/5/1977 Community War Memorial, Rochester, NY</a></span> [<a href="http://www.archive.org/search.php?query=creator:%22Grateful Dead%22%20date:1977-11-05*">Listen/Download</a>]<tr><td>I: Minglewood, Half Step, L. L. Rain, Dire Wolf, Mama Tried > Big River, Candyman, Jack Straw, Deal</td></tr>
<tr><td>II: Eyes > Samson, Roses, Estimated > He's Gone > Drums > Other One > Black Peter > Sugar Magnolia</td></tr>
<tr><td>E: Saturday Night</td></tr>
<tr class="notes"><td>Phil solo and "Take a step back" to open second set. Entire show appears on "Dick’s Picks Volume 34." </i></td></tr>
</table></div>
<div class="setlist_table"><table border="0" cellspacing="0" cellpadding="0"><tr class="header"><td><span><a name="1106"></a><a href="/1977-11-06">11/6/1977 Broome County Arena, Binghamton, NY</a></span> [<a href="http://www.archive.org/search.php?query=creator:%22Grateful Dead%22%20date:1977-11-06*">Listen/Download</a>]<tr><td>I: Half Step, Jack Straw, Tennessee Jed, Mexicali > Me  and  My Uncle, FOTD, Minglewood, Dupree's, Passenger, Dire Wolf, Music</td></tr>
<tr><td>II: Samson, Sunrise, Scarlet > Fire > Good Lovin, St. Stephen > Drums > NFA > Wharf Rat > St. Stephen > Truckin</td></tr>
<tr><td>E: Johnny B. Goode</td></tr>
<tr class="notes"><td>"Take A Step Back" before "Tennessee Jed"</i></td></tr>
</table></div>
<div class="setlist_table"><table border="0" cellspacing="0" cellpadding="0"><tr class="header"><td><span><a name="1227"></a><a href="/1977-12-27">12/27/1977 Winterland Arena, San Francisco, CA</a></span> [<a href="http://www.archive.org/search.php?query=creator:%22Grateful Dead%22%20date:1977-12-27*">Listen/Download</a>]<tr><td>I: Bertha > Good Lovin, B. E. Women, Cassidy, Peggy-O, L. L. Rain, Dire Wolf, Passenger, Candyman, El Paso, FOTD, Music</td></tr>
<tr><td>II: Cold Rain, Lazy Lightning > Supplication, Scarlet > Fire, Estimated > He's Gone, Truckin > Wharf Rat > Around</td></tr>
<tr><td>E: Samson</td></tr>
<tr class="notes"><td>Soundcheck: "Iko Iko."</i></td></tr>
</table></div>
<div class="setlist_table"><table border="0" cellspacing="0" cellpadding="0"><tr class="header"><td><span><a name="1229"></a><a href="/1977-12-29">12/29/1977 Winterland Arena, San Francisco, CA</a></span> [<a href="http://www.archive.org/search.php?query=creator:%22Grateful Dead%22%20date:1977-12-29*">Listen/Download</a>]<tr><td>I: Jack Straw<span class="setlist_small">*</span>, TLEO<span class="setlist_small">*</span>, Mama Tried<span class="setlist_small">*</span>, Loser<span class="setlist_small">*</span>, L. L. Rain<span class="setlist_small">*</span>, Tennessee Jed<span class="setlist_small">*</span>, Minglewood<span class="setlist_small">*</span>, Sugaree<span class="setlist_small">*</span>, Promised<span class="setlist_small">*</span></td></tr>
<tr><td>II: Bertha<span class="setlist_small">*</span> > Good Lovin<span class="setlist_small">*</span>, Roses, Sunrise, Playin<span class="setlist_small">*</span> > China Cat<span class="setlist_small">*</span> > I Know You Rider<span class="setlist_small">*</span> > China Doll<span class="setlist_small">*</span> > Playin<span class="setlist_small">*</span> > Drums<span class="setlist_small">*</span> > NFA<span class="setlist_small">*</span> > Playin<span class="setlist_small">*</span></td></tr>
<tr><td>E1: Terrapin<span class="setlist_small">*</span></td></tr>
<tr><td>E2: Johnny B. Goode<span class="setlist_small">*</span></td></tr>
<tr class="notes"><td>Next ''I Know You Rider'' 2/3/1979 [95 shows]</i></td></tr>
<tr class="notes"><td>Soundcheck: "China Cat" > "I Know You Rider." *appears on "Dick's Picks Vol 10."  </i></td></tr>
</table></div>
<div class="setlist_table"><table border="0" cellspacing="0" cellpadding="0"><tr class="header"><td><span><a name="1230"></a><a href="/1977-12-30">12/30/1977 Winterland Arena, San Francisco, CA</a></span> [<a href="http://www.archive.org/search.php?query=creator:%22Grateful Dead%22%20date:1977-12-30*">Listen/Download</a>]<tr><td>I: Half Step, Me  and  My Uncle, Dire Wolf, L. L. Rain, Row Jimmy, Big River, Peggy-O, Passenger, Ramble On, Let It Grow</td></tr>
<tr><td>II: Samson, Ship Of Fools, Estimated<span class="setlist_small">*</span> > Eyes<span class="setlist_small">*</span> > St. Stephen<span class="setlist_small">*</span> > Sugar Magnolia<span class="setlist_small">*</span></td></tr>
<tr><td>E1: U. S. Blues</td></tr>
<tr><td>E2: Good Lovin</td></tr>
<tr class="notes"><td>*appears on "Dick's Picks Vol 10."</i></td></tr>
</table></div>
<div class="setlist_table"><table border="0" cellspacing="0" cellpadding="0"><tr class="header"><td><span><a name="1231"></a><a href="/1977-12-31">12/31/1977 Winterland Arena, San Francisco, CA</a></span> [<a href="http://www.archive.org/search.php?query=creator:%22Grateful Dead%22%20date:1977-12-31*">Listen/Download</a>]<tr><td>I: Music, Tennessee Jed, Me  and  My Uncle, Loser, Jack Straw, FOTD, Lazy Lightning <span class="setlist_small">*</span> > Supplication <span class="setlist_small">*</span></td></tr>
<tr><td>II: Sugar Magnolia <span class="setlist_small">*</span> > Scarlet <span class="setlist_small">*</span> > Fire <span class="setlist_small">*</span>, Truckin > Jam > Wharf Rat > Drums > NFA > Around</td></tr>
<tr><td>E: Saturday Night > Casey Jones</td></tr>
<tr class="notes"><td>Next ''Casey Jones'' 11/17/1978 [63 shows]</i></td></tr>
<tr class="notes"><td>Bill Graham flew in on a motorcycle at 12:30. Also: NRPS. "Funiculi Funicula" tuning before "Me  and  My Uncle." *appears on the "New Year’s Eves at Winterland" bonus disc for "The Closing of Winterland."</i></td></tr>
</table></div>

</div></div>
</div>
</body>
</html>