<!DOCTYPE HTML PUBLIC "-//W3C//DTD HTML 4.01 Transitional//EN"
"http://www.w3.org/TR/html4/loose.dtd">
<html>
  <head>
    <meta http-equiv="Content-Type" content="text/html; charset=utf-8">
    <title>
      1980 Setlists
    </title>
  </head>
  <body>
    <div id="main">
      <div>
        1980 Setlists
      </div><script language="Javascript" type="text/javascript">
<!--
      function showtab () {
      document.getElementById('hide').style.display = 'none';
      document.getElementById('show').style.display = 'block';
      }
      function hidetab () {
      document.getElementById('show').style.display = 'none';
      document.getElementById('hide').style.display = 'block';
      }
      -->
      </script>
      <p>
        January: <a href="#0113">13</a>
        <br>
        March: <a href="#0329">29</a> <a href="#0330">30</a> <a href="#0331">31</a>
        <br>
        April: <a href="#0401">1</a> <a href="#0402">2</a> <a href="#0405">5</a> <a href="#0406">6</a> <a href="#0407">7</a> <a href="#0428">28</a> <a href="#0429">29</a>
        <br>
        May: <a href="#0501">1</a> <a href="#0502">2</a> <a href="#0504">4</a> <a href="#0506">6</a> <a href="#0507">7</a> <a href="#0508">8</a> <a href="#0510">10</a> <a href="#0511">11</a> <a href="#0512">12</a> <a href="#0514">14</a> <a href="#0515">15</a> <a href="#0516">16</a> <a href="#0529">29</a> <a href="#0530">30</a> <a href="#0531">31</a>
        <br>
        June: <a href="#0605">5</a> <a href="#0607">7</a> <a href="#0608">8</a> <a href="#0612">12</a> <a href="#0613">13</a> <a href="#0614">14</a> <a href="#0619">19</a> <a href="#0620">20</a> <a href="#0621">21</a> <a href="#0629">29</a>
        <br>
        July: <a href="#0701">1</a>
        <br>
        August: <a href="#0816">16</a> <a href="#0817">17</a> <a href="#0819">19</a> <a href="#0820">20</a> <a href="#0821">21</a> <a href="#0823">23</a> <a href="#0824">24</a> <a href="#0826">26</a> <a href="#0827">27</a> <a href="#0829">29</a> <a href="#0830">30</a> <a href="#0831">31</a>
        <br>
        September: <a href="#0902">2</a> <a href="#0903">3</a> <a href="#0904">4</a> <a href="#0906">6</a> <a href="#0914">14</a> <a href="#0925">25</a> <a href="#0926">26</a> <a href="#0927">27</a> <a href="#0929">29</a> <a href="#0930">30</a>
        <br>
        October: <a href="#1002">2</a> <a href="#1003">3</a> <a href="#1004">4</a> <a href="#1006">6</a> <a href="#1007">7</a> <a href="#1009">9</a> <a href="#1010">10</a> <a href="#1011">11</a> <a href="#1013">13</a> <a href="#1014">14</a> <a href="#1018">18</a> <a href="#1019">19</a> <a href="#1022">22</a> <a href="#1023">23</a> <a href="#1025">25</a> <a href="#1026">26</a> <a href="#1027">27</a> <a href="#1029">29</a> <a href="#1030">30</a> <a href="#1031">31</a>
        <br>
        November: <a href="#1126">26</a> <a href="#1128">28</a> <a href="#1129">29</a> <a href="#1130">30</a>
        <br>
        December: <a href="#1206">6</a> <a href="#1212">12</a> <a href="#1213">13</a> <a href="#1214">14</a> <a href="#1226">26</a> <a href="#1227">27</a> <a href="#1228">28</a> <a href="#1230">30</a> <a href="#1231">31</a>
      </p>
      <div>
        <table border="0" cellspacing="0" cellpadding="0">
          <tr>
            <td id="0113">
              <a href="/1980-01-13">1/13/1980 Oakland Coliseum Arena, Oakland, CA</a> [<a href="http://www.archive.org/search.php?query=creator:%22Grateful%20Dead%22%20date:1980-01-13*">Listen/Download</a>]
            </td>
          </tr>
          <tr>
            <td>
              Jack Straw &gt; Franklin's, Minglewood, Tennessee Jed &gt; L. L. Rain &gt; Don't Ease, Playin &gt; Drumz &gt; NFA* &gt; Sugar Magnolia*
            </td>
          </tr>
          <tr>
            <td>
              E: U. S. Blues+
            </td>
          </tr>
          <tr>
            <td>
              Cambodian refugee benefit. FM broadcast KSAN-San Francisco. Also: Jefferson Starship; Joan Baez; Beach Boys; Santana solo. *with John Cipollina and Carlos Santana. +with Greg Errico. "Amazing Grace" with Joan Baez, GD and the Beach Boys followed "U. S. Blues."
            </td>
          </tr>
        </table>
      </div>
      <div>
        <table border="0" cellspacing="0" cellpadding="0">
          <tr>
            <td id="0329">
              <a href="/1980-03-29">3/29/1980 Boston Garden, Boston, MA</a> [<a href="http://www.archive.org/search.php?query=creator:%22Grateful%20Dead%22%20date:1980-03-29*">Listen/Download</a>]
            </td>
          </tr>
          <tr>
            <td></td>
          </tr>
        </table>
      </div>
      <div>
        <table border="0" cellspacing="0" cellpadding="0">
          <tr>
            <td id="0330">
              <a href="/1980-03-30">3/30/1980 Capitol Theatre, Passaic, NJ</a> [<a href="http://www.archive.org/search.php?query=creator:%22Grateful%20Dead%22%20date:1980-03-30*">Listen/Download</a>]
            </td>
          </tr>
          <tr>
            <td>
              I: Alabama &gt; Promised, Peggy-O, Cassidy, Loser &gt; El Paso, Far From Me, Tennessee Jed, Minglewood, Althea, Sailor &gt; Saint
            </td>
          </tr>
          <tr>
            <td>
              II: Scarlet &gt; Fire, Estimated &gt; Eyes &gt; Drumz &gt; Black Peter &gt; Sugar Magnolia
            </td>
          </tr>
          <tr>
            <td>
              E: U. S. Blues*
            </td>
          </tr>
          <tr>
            <td>
              First ''Far From Me''
            </td>
          </tr>
          <tr>
            <td>
              *with John Belushi on vocals and cartwheels.
            </td>
          </tr>
        </table>
      </div>
      <div>
        <table border="0" cellspacing="0" cellpadding="0">
          <tr>
            <td id="0331">
              <a href="/1980-03-31">3/31/1980 Capitol Theatre, Passaic, NJ</a> [<a href="http://www.archive.org/search.php?query=creator:%22Grateful%20Dead%22%20date:1980-03-31*">Listen/Download</a>]
            </td>
          </tr>
          <tr>
            <td>
              I: Jack Straw, TLEO, Mama Tried &gt; Mexicali, B. E. Women, Stranger, Far From Me, Althea, Sailor &gt; Saint
            </td>
          </tr>
          <tr>
            <td>
              II: Don't Ease, Samson, Terrapin &gt; Playin &gt; Drumz &gt; Wharf Rat &gt; Good Lovin
            </td>
          </tr>
          <tr>
            <td>
              E: Johnny B. Goode
            </td>
          </tr>
          <tr>
            <td>
              First ''Stranger''
            </td>
          </tr>
        </table>
      </div>
      <div>
        <table border="0" cellspacing="0" cellpadding="0">
          <tr>
            <td id="0401">
              <a href="/1980-04-01">4/1/1980 Capitol Theatre, Passaic, NJ</a> [<a href="http://www.archive.org/search.php?query=creator:%22Grateful%20Dead%22%20date:1980-04-01*">Listen/Download</a>]
            </td>
          </tr>
          <tr>
            <td>
              I: Promised*, Promised, Candyman, Me and My Uncle &gt; Big River, FOTD, All Over Now, Don't Ease, L. L. Rain &gt; Deal
            </td>
          </tr>
          <tr>
            <td>
              II: Stranger, China Cat &gt; I Know You Rider, Estimated &gt; He's Gone &gt; Other One &gt; Drumz &gt; Stella Blue &gt; Around
            </td>
          </tr>
          <tr>
            <td>
              E: Shakedown
            </td>
          </tr>
          <tr>
            <td>
              *April Fool's Promised: Bobby on keyboards, Brent and Jerry on drums, Billy on bass, Mickey on rhythm guitar and vocals, and Phil on lead guitar.
            </td>
          </tr>
        </table>
      </div>
      <div>
        <table border="0" cellspacing="0" cellpadding="0">
          <tr>
            <td id="0402">
              <a href="/1980-04-02">4/2/1980 Capitol Theatre, Passaic, NJ</a> [<a href="http://www.archive.org/search.php?query=creator:%22Grateful%20Dead%22%20date:1980-04-02*">Listen/Download</a>]
            </td>
          </tr>
          <tr>
            <td></td>
          </tr>
          <tr>
            <td>
              This run was originally scheduled for April 1 & 2.
            </td>
          </tr>
        </table>
      </div>
      <div>
        <table border="0" cellspacing="0" cellpadding="0">
          <tr>
            <td id="0405">
              <a href="/1980-04-05">4/5/1980 NBC Studios, New York, NY</a> [<a href="http://www.archive.org/search.php?query=creator:%22Grateful%20Dead%22%20date:1980-04-05*">Listen/Download</a>]
            </td>
          </tr>
          <tr>
            <td>
              I: Alabama
            </td>
          </tr>
          <tr>
            <td>
              II: Saint
            </td>
          </tr>
          <tr>
            <td>
              "Saturday Night Live" TV broadcast. Appears on the "Saturday Night Live: The Fifth Season" DVD.
            </td>
          </tr>
        </table>
      </div>
      <div>
        <table border="0" cellspacing="0" cellpadding="0">
          <tr>
            <td id="0406">
              <a href="/1980-04-06">4/6/1980 Nassau Veterans Memorial Coliseum, Uniondale, NY</a> [<a href="http://www.archive.org/search.php?query=creator:%22Grateful%20Dead%22%20date:1980-04-06*">Listen/Download</a>]
            </td>
          </tr>
          <tr>
            <td></td>
          </tr>
        </table>
      </div>
      <div>
        <table border="0" cellspacing="0" cellpadding="0">
          <tr>
            <td id="0407">
              <a href="/1980-04-07">4/7/1980 Nassau Veterans Memorial Coliseum, Uniondale, NY</a> [<a href="http://www.archive.org/search.php?query=creator:%22Grateful%20Dead%22%20date:1980-04-07*">Listen/Download</a>]
            </td>
          </tr>
          <tr>
            <td></td>
          </tr>
        </table>
      </div>
      <div>
        <table border="0" cellspacing="0" cellpadding="0">
          <tr>
            <td id="0428">
              <a href="/1980-04-28">4/28/1980 Boutwell Auditorium, Birmingham, AL</a> [<a href="http://www.archive.org/search.php?query=creator:%22Grateful%20Dead%22%20date:1980-04-28*">Listen/Download</a>]
            </td>
          </tr>
          <tr>
            <td>
              I: Alabama &gt; Promised, TLEO, El Paso, Althea, L. L. Rain, Tennessee Jed, Far From Me, Stranger, Deal
            </td>
          </tr>
          <tr>
            <td>
              II: China Cat &gt; I Know You Rider, Samson, He's Gone &gt; Other One &gt; Drumz &gt; Black Peter &gt; Sugar Magnolia
            </td>
          </tr>
          <tr>
            <td>
              E: GDTRFB
            </td>
          </tr>
          <tr>
            <td>
              Previous ''GDTRFB'' 1/12/1979 [74 shows]
            </td>
          </tr>
        </table>
      </div>
      <div>
        <table border="0" cellspacing="0" cellpadding="0">
          <tr>
            <td id="0429">
              <a href="/1980-04-29">4/29/1980 Fox Theatre, Atlanta, GA</a> [<a href="http://www.archive.org/search.php?query=creator:%22Grateful%20Dead%22%20date:1980-04-29*">Listen/Download</a>]
            </td>
          </tr>
          <tr>
            <td>
              I: Jack Straw, FOTD, Mama Tried &gt; Mexicali, Peggy-O, Passenger, B. E. Women, Far From Me, Music
            </td>
          </tr>
          <tr>
            <td>
              II: Don't Ease, Minglewood, Ramble On, Sailor &gt; Saint &gt; Terrapin &gt; Drumz &gt; Miracle &gt; Bertha &gt; Good Lovin
            </td>
          </tr>
          <tr>
            <td>
              E: U. S. Blues
            </td>
          </tr>
        </table>
      </div>
      <div>
        <table border="0" cellspacing="0" cellpadding="0">
          <tr>
            <td id="0501">
              <a href="/1980-05-01">5/1/1980 Greensboro Coliseum, Greensboro, NC</a> [<a href="http://www.archive.org/search.php?query=creator:%22Grateful%20Dead%22%20date:1980-05-01*">Listen/Download</a>]
            </td>
          </tr>
          <tr>
            <td>
              I: Alabama &gt; Promised, Candyman, Me and My Uncle &gt; Big River, Althea, Easy To Love You, Minglewood, Sugaree, Sailor &gt; Saint &gt; Deal
            </td>
          </tr>
          <tr>
            <td>
              II: Stranger, Don't Ease, Estimated &gt; Uncle John &gt; Drumz &gt; Wharf Rat &gt; Around &gt; Johnny B. Goode
            </td>
          </tr>
          <tr>
            <td>
              E: Brokedown
            </td>
          </tr>
        </table>
      </div>
      <div>
        <table border="0" cellspacing="0" cellpadding="0">
          <tr>
            <td id="0502">
              <a href="/1980-05-02">5/2/1980 Hampton Coliseum, Hampton, VA</a> [<a href="http://www.archive.org/search.php?query=creator:%22Grateful%20Dead%22%20date:1980-05-02*">Listen/Download</a>]
            </td>
          </tr>
          <tr>
            <td>
              I: Minglewood, Loser, Mama Tried &gt; Mexicali, FOTD, Far From Me, L. L. Rain, Althea, Music
            </td>
          </tr>
          <tr>
            <td>
              II: Alabama &gt; Space &gt; Stranger &gt; Eyes &gt; Drumz &gt; NFA &gt; Stella Blue &gt; Miracle &gt; Bertha &gt; Good Lovin
            </td>
          </tr>
          <tr>
            <td>
              E: Johnny B. Goode
            </td>
          </tr>
          <tr>
            <td>
              Soundcheck: "Morning Dew."
            </td>
          </tr>
        </table>
      </div>
      <div>
        <table border="0" cellspacing="0" cellpadding="0">
          <tr>
            <td id="0504">
              <a href="/1980-05-04">5/4/1980 Baltimore Civic Center, Baltimore, MD</a> [<a href="http://www.archive.org/search.php?query=creator:%22Grateful%20Dead%22%20date:1980-05-04*">Listen/Download</a>]
            </td>
          </tr>
          <tr>
            <td>
              I: Half Step &gt; Franklin's &gt; Stranger, Althea, El Paso, Easy To Love You, B. E. Women, All Over Now, Don't Ease, Promised
            </td>
          </tr>
          <tr>
            <td>
              II: Scarlet &gt; Fire, Samson, Ship Of Fools, Playin &gt; Drumz &gt; Black Peter &gt; Sugar Magnolia
            </td>
          </tr>
          <tr>
            <td>
              E: U. S. Blues
            </td>
          </tr>
        </table>
      </div>
      <div>
        <table border="0" cellspacing="0" cellpadding="0">
          <tr>
            <td id="0506">
              <a href="/1980-05-06">5/6/1980 Recreation Hall, Penn. State U., State College, PA</a> [<a href="http://www.archive.org/search.php?query=creator:%22Grateful%20Dead%22%20date:1980-05-06*">Listen/Download</a>]
            </td>
          </tr>
          <tr>
            <td>
              I: Alabama &gt; Greatest, Peggy-O *, Me and My Uncle * &gt; Big River *, Loser *, Far From Me, Lazy Lightning * &gt; Supplication *, Althea *, Sailor * &gt; Saint *
            </td>
          </tr>
          <tr>
            <td>
              II: China Cat * &gt; I Know You Rider *, Stranger * &gt; He's Gone * &gt; Other One * &gt; Drumz * &gt; Wharf Rat * &gt; Around * &gt; Johnny B. Goode *
            </td>
          </tr>
          <tr>
            <td>
              E: Brokedown
            </td>
          </tr>
          <tr>
            <td>
              *appears on "Road Trips Vol. 3 No. 4."
            </td>
          </tr>
        </table>
      </div>
      <div>
        <table border="0" cellspacing="0" cellpadding="0">
          <tr>
            <td id="0507">
              <a href="/1980-05-07">5/7/1980 Barton Hall, Cornell University, Ithaca, NY</a> [<a href="http://www.archive.org/search.php?query=creator:%22Grateful%20Dead%22%20date:1980-05-07*">Listen/Download</a>]
            </td>
          </tr>
          <tr>
            <td>
              I: Jack Straw *, Tennessee Jed, Cassidy *, Row Jimmy * &gt; El Paso, Easy To Love You, Althea, Stranger, Don't Ease
            </td>
          </tr>
          <tr>
            <td>
              II: Shakedown * &gt; Bertha * &gt; Playin * &gt; Terrapin * &gt; Drumz * &gt; Saint * &gt; Black Peter * &gt; Playin * &gt; Good Lovin *
            </td>
          </tr>
          <tr>
            <td>
              E: Alabama
            </td>
          </tr>
          <tr>
            <td>
              Bill Kreutzmann's 34th birthday. *appears on "Road Trips Vol. 3 No. 4." "Take A Step Back," and "Far Above Cayuga's Waters" (Cornell's alma mater) tuning before "Tennessee Jed."
            </td>
          </tr>
        </table>
      </div>
      <div>
        <table border="0" cellspacing="0" cellpadding="0">
          <tr>
            <td id="0508">
              <a href="/1980-05-08">5/8/1980 Glens Falls Civic Center, Glens Falls, NY</a> [<a href="http://www.archive.org/search.php?query=creator:%22Grateful%20Dead%22%20date:1980-05-08*">Listen/Download</a>]
            </td>
          </tr>
          <tr>
            <td>
              I: Alabama &gt; Promised, FOTD, Mama Tried &gt; Mexicali, High Time, Lazy Lightning &gt; Supplication, Ramble On, Sailor &gt; Saint
            </td>
          </tr>
          <tr>
            <td>
              II: Uncle John &gt; Estimated &gt; Eyes &gt; Drumz &gt; Truckin &gt; Stella Blue &gt; Around &gt; Johnny B. Goode
            </td>
          </tr>
          <tr>
            <td>
              E: U. S. Blues
            </td>
          </tr>
        </table>
      </div>
      <div>
        <table border="0" cellspacing="0" cellpadding="0">
          <tr>
            <td id="0510">
              <a href="/1980-05-10">5/10/1980 Hartford Civic Center, Hartford, CT</a> [<a href="http://www.archive.org/search.php?query=creator:%22Grateful%20Dead%22%20date:1980-05-10*">Listen/Download</a>]
            </td>
          </tr>
          <tr>
            <td>
              I: Minglewood, Peggy-O, Mexicali &gt; El Paso, Althea, Passenger, Far From Me, Sailor &gt; Saint &gt; Deal
            </td>
          </tr>
          <tr>
            <td>
              II: China Cat &gt; I Know You Rider, Stranger &gt; Comes A Time &gt; Estimated &gt; He's Gone &gt; Uncle John &gt; Drumz &gt; NFA &gt; Sugar Magnolia
            </td>
          </tr>
          <tr>
            <td>
              E: Alabama &gt; Saturday Night
            </td>
          </tr>
          <tr>
            <td>
              Previous ''Comes A Time'' 2/9/1979 [71 shows]
            </td>
          </tr>
        </table>
      </div>
      <div>
        <table border="0" cellspacing="0" cellpadding="0">
          <tr>
            <td id="0511">
              <a href="/1980-05-11">5/11/1980 Cumberland County Civic Center, Portland, ME</a> [<a href="http://www.archive.org/search.php?query=creator:%22Grateful%20Dead%22%20date:1980-05-11*">Listen/Download</a>]
            </td>
          </tr>
          <tr>
            <td>
              I: Alabama &gt; Promised, TLEO, Cassidy, Loser, All Over Now, Easy To Love You, Big RxR Blues, L. L. Rain, Don't Ease &gt; Music
            </td>
          </tr>
          <tr>
            <td>
              II: Scarlet &gt; Fire, Stranger &gt; Terrapin &gt; Playin &gt; Drumz &gt; Black Peter &gt; GDTRFB &gt; Around &gt; Johnny B. Goode
            </td>
          </tr>
          <tr>
            <td>
              E: Brokedown
            </td>
          </tr>
        </table>
      </div>
      <div>
        <table border="0" cellspacing="0" cellpadding="0">
          <tr>
            <td id="0512">
              <a href="/1980-05-12">5/12/1980 Boston Garden, Boston, MA</a> [<a href="http://www.archive.org/search.php?query=creator:%22Grateful%20Dead%22%20date:1980-05-12*">Listen/Download</a>]
            </td>
          </tr>
          <tr>
            <td>
              I: Jack Straw &gt; Alabama &gt; El Paso, Althea, Lazy Lightning &gt; Supplication, Far From Me &gt; Minglewood, China Cat &gt; I Know You Rider
            </td>
          </tr>
          <tr>
            <td>
              II: Stranger, Ship Of Fools, Estimated &gt; He's Gone &gt; Drumz &gt; Saint &gt; Wharf Rat &gt; Sugar Magnolia
            </td>
          </tr>
          <tr>
            <td>
              E: U. S. Blues
            </td>
          </tr>
        </table>
      </div>
      <div>
        <table border="0" cellspacing="0" cellpadding="0">
          <tr>
            <td id="0514">
              <a href="/1980-05-14">5/14/1980 Nassau Veterans Memorial Coliseum, Uniondale, NY</a> [<a href="http://www.archive.org/search.php?query=creator:%22Grateful%20Dead%22%20date:1980-05-14*">Listen/Download</a>]
            </td>
          </tr>
          <tr>
            <td>
              I: Alabama &gt; Promised, Candyman, Mexicali &gt; El Paso, Tennessee Jed, Let It Grow &gt; Althea, Easy To Love You &gt; Music
            </td>
          </tr>
          <tr>
            <td>
              II: Stranger &gt; Sugaree &gt; Sailor &gt; Saint &gt; Comes A Time &gt; Other One &gt; Drumz &gt; Black Peter &gt; Around &gt; Johnny B. Goode
            </td>
          </tr>
          <tr>
            <td>
              E: Don't Ease
            </td>
          </tr>
        </table>
      </div>
      <div>
        <table border="0" cellspacing="0" cellpadding="0">
          <tr>
            <td id="0515">
              <a href="/1980-05-15">5/15/1980 Nassau Veterans Memorial Coliseum, Uniondale, NY</a> [<a href="http://www.archive.org/search.php?query=creator:%22Grateful%20Dead%22%20date:1980-05-15*">Listen/Download</a>]
            </td>
          </tr>
          <tr>
            <td>
              I: Jack Straw * &gt; Franklin's *, Cassidy, TLEO, Lazy Lightning * &gt; Supplication *, Peggy-O *, Far From Me *, Stranger &gt; Deal
            </td>
          </tr>
          <tr>
            <td>
              II: Althea, Sailor &gt; Saint &gt; Terrapin &gt; Playin * &gt; Uncle John * &gt; Drumz * &gt; NFA * &gt; GDTRFB * &gt; Good Lovin *
            </td>
          </tr>
          <tr>
            <td>
              E: Alabama *
            </td>
          </tr>
          <tr>
            <td>
              *appears on "Go to Nassau."
            </td>
          </tr>
        </table>
      </div>
      <div>
        <table border="0" cellspacing="0" cellpadding="0">
          <tr>
            <td id="0516">
              <a href="/1980-05-16">5/16/1980 Nassau Veterans Memorial Coliseum, Uniondale, NY</a> [<a href="http://www.archive.org/search.php?query=creator:%22Grateful%20Dead%22%20date:1980-05-16*">Listen/Download</a>]
            </td>
          </tr>
          <tr>
            <td>
              I: Alabama &gt; Promised, High Time *, Me and My Uncle &gt; Big River, Row Jimmy, Minglewood *, Ramble On &gt; L. L. Rain *, China Cat * &gt; I Know You Rider*
            </td>
          </tr>
          <tr>
            <td>
              II: Stranger * &gt; Althea * &gt; Sailor * &gt; Saint * &gt; Eyes &gt; Drumz &gt; Truckin &gt; Morning Dew &gt; Around &gt; Johnny B. Goode
            </td>
          </tr>
          <tr>
            <td>
              E: Brokedown
            </td>
          </tr>
          <tr>
            <td>
              *appears on "Go to Nassau."
            </td>
          </tr>
        </table>
      </div>
      <div>
        <table border="0" cellspacing="0" cellpadding="0">
          <tr>
            <td id="0529">
              <a href="/1980-05-29">5/29/1980 Des Moines Civic Center, Des Moines, IA</a> [<a href="http://www.archive.org/search.php?query=creator:%22Grateful%20Dead%22%20date:1980-05-29*">Listen/Download</a>]
            </td>
          </tr>
          <tr>
            <td>
              I: Alabama &gt; Promised, TLEO, El Paso &gt; Mexicali, Candyman, Minglewood, Althea, Far From Me, Let It Grow &gt; Deal
            </td>
          </tr>
          <tr>
            <td>
              II: Stranger, Ship Of Fools, Estimated &gt; Eyes &gt; Drumz &gt; Sailor &gt; Saint &gt; Comes A Time &gt; Around &gt; Johnny B. Goode
            </td>
          </tr>
          <tr>
            <td>
              E: U. S. Blues
            </td>
          </tr>
        </table>
      </div>
      <div>
        <table border="0" cellspacing="0" cellpadding="0">
          <tr>
            <td id="0530">
              <a href="/1980-05-30">5/30/1980 Milwaukee Auditorium, Milwaukee, WI</a> [<a href="http://www.archive.org/search.php?query=creator:%22Grateful%20Dead%22%20date:1980-05-30*">Listen/Download</a>]
            </td>
          </tr>
          <tr>
            <td>
              I: Jack Straw &gt; Franklin's, Me and My Uncle &gt; Big River, FOTD, Passenger, Easy To Love You, Althea, Music
            </td>
          </tr>
          <tr>
            <td>
              II: Scarlet &gt; Fire &gt; Playin &gt; Drumz &gt; NFA &gt; Black Peter &gt; GDTRFB &gt; Good Lovin
            </td>
          </tr>
          <tr>
            <td>
              E: Alabama
            </td>
          </tr>
        </table>
      </div>
      <div>
        <table border="0" cellspacing="0" cellpadding="0">
          <tr>
            <td id="0531">
              <a href="/1980-05-31">5/31/1980 Metropolitan Center, Minneapolis, MN</a> [<a href="http://www.archive.org/search.php?query=creator:%22Grateful%20Dead%22%20date:1980-05-31*">Listen/Download</a>]
            </td>
          </tr>
          <tr>
            <td>
              I: Alabama &gt; Promised, Peggy-O, Cassidy, Loser, Minglewood, Far From Me, Althea &gt; L. L. Rain &gt; Deal
            </td>
          </tr>
          <tr>
            <td>
              II: Stranger, Ship Of Fools, Sailor &gt; Saint &gt; Jam &gt; Wharf Rat &gt; Other One &gt; Drumz &gt; Miracle &gt; Bertha &gt; Sugar Magnolia
            </td>
          </tr>
          <tr>
            <td>
              E1: U. S. Blues
            </td>
          </tr>
          <tr>
            <td>
              E2: Brokedown
            </td>
          </tr>
        </table>
      </div>
      <div>
        <table border="0" cellspacing="0" cellpadding="0">
          <tr>
            <td id="0605">
              <a href="/1980-06-05">6/5/1980 Compton Terrace Amphitheatre, Tempe, AZ</a> [<a href="http://www.archive.org/search.php?query=creator:%22Grateful%20Dead%22%20date:1980-06-05*">Listen/Download</a>]
            </td>
          </tr>
          <tr>
            <td>
              I: Alabama &gt; Promised, TLEO, Mexicali &gt; El Paso, Tennessee Jed &gt; Minglewood, Don't Ease, L. L. Rain, Easy To Love You &gt; Althea, Stranger
            </td>
          </tr>
          <tr>
            <td>
              II: China Cat &gt; I Know You Rider &gt; Sailor &gt; Saint &gt; Terrapin &gt; Drumz &gt; Truckin &gt; Black Peter &gt; Around &gt; Johnny B. Goode
            </td>
          </tr>
          <tr>
            <td>
              E: U. S. Blues
            </td>
          </tr>
          <tr>
            <td>
              also: Warren Zevon
            </td>
          </tr>
        </table>
      </div>
      <div>
        <table border="0" cellspacing="0" cellpadding="0">
          <tr>
            <td id="0607">
              <a href="/1980-06-07">6/7/1980 Folsom Field, University of Colorado, Boulder, CO</a> [<a href="http://www.archive.org/search.php?query=creator:%22Grateful%20Dead%22%20date:1980-06-07*">Listen/Download</a>]
            </td>
          </tr>
          <tr>
            <td>
              I: Jack Straw, FOTD &gt; El Paso &gt; Mama Tried, Ramble On, Passenger, Far From Me, Minglewood, Loser, Stranger, Deal
            </td>
          </tr>
          <tr>
            <td>
              II: Bertha &gt; Greatest, Althea, Sailor &gt; Saint &gt; Jam &gt; Drumz &gt; NFA &gt; Wharf Rat &gt; Good Lovin
            </td>
          </tr>
          <tr>
            <td>
              E1: Alabama &gt; Saturday Night
            </td>
          </tr>
          <tr>
            <td>
              E2: U. S. Blues
            </td>
          </tr>
          <tr>
            <td>
              official 15th anniversary celebration - also: Warren Zevon
            </td>
          </tr>
        </table>
      </div>
      <div>
        <table border="0" cellspacing="0" cellpadding="0">
          <tr>
            <td id="0608">
              <a href="/1980-06-08">6/8/1980 Folsom Field, University of Colorado, Boulder, CO</a> [<a href="http://www.archive.org/search.php?query=creator:%22Grateful%20Dead%22%20date:1980-06-08*">Listen/Download</a>]
            </td>
          </tr>
          <tr>
            <td>
              I: Uncle John &gt; Playin &gt; Uncle John, Me and My Uncle &gt; Mexicali, Tennessee Jed, Samson, Easy To Love You &gt; Althea &gt; L. L. Rain &gt; Deal
            </td>
          </tr>
          <tr>
            <td>
              II: Stranger, Ship Of Fools, Estimated &gt; Eyes &gt; Drumz &gt; Saint &gt; Black Peter &gt; Sugar Magnolia
            </td>
          </tr>
          <tr>
            <td>
              E: Alabama &gt; Brokedown
            </td>
          </tr>
          <tr>
            <td>
              official 15th anniversary celebration - also: Warren Zevon
            </td>
          </tr>
        </table>
      </div>
      <div>
        <table border="0" cellspacing="0" cellpadding="0">
          <tr>
            <td id="0612">
              <a href="/1980-06-12">6/12/1980 Portland Memorial Coliseum, Portland, OR</a> [<a href="http://www.archive.org/search.php?query=creator:%22Grateful%20Dead%22%20date:1980-06-12*">Listen/Download</a>]
            </td>
          </tr>
          <tr>
            <td>
              I: Alabama &gt; Promised, Peggy-O &gt; El Paso, B. E. Women, Cassidy, Far From Me, Althea &gt; Sailor &gt; Saint &gt; Deal
            </td>
          </tr>
          <tr>
            <td>
              II: Drums &gt; Scarlet &gt; Fire, Estimated &gt; Drumz &gt; NFA &gt; Black Peter &gt; Around &gt; Good Lovin
            </td>
          </tr>
          <tr>
            <td>
              E: Johnny B. Goode
            </td>
          </tr>
          <tr>
            <td>
              Previous ''Drums'' 2/5/1978 [163 shows]
            </td>
          </tr>
          <tr>
            <td>
              Mt. St. Helens erupted during "Fire On The Mountain."
            </td>
          </tr>
        </table>
      </div>
      <div>
        <table border="0" cellspacing="0" cellpadding="0">
          <tr>
            <td id="0613">
              <a href="/1980-06-13">6/13/1980 Seattle Center Arena, Seattle, WA</a> [<a href="http://www.archive.org/search.php?query=creator:%22Grateful%20Dead%22%20date:1980-06-13*">Listen/Download</a>]
            </td>
          </tr>
          <tr>
            <td>
              I: Minglewood, Sugaree, Mama Tried &gt; Mexicali, Candyman, Passenger, Althea &gt; Sailor &gt; Saint &gt; Deal
            </td>
          </tr>
          <tr>
            <td>
              II: Don't Ease, Let It Grow &gt; China Cat &gt; I Know You Rider &gt; C. C. Rider, Terrapin &gt; Drumz &gt; Other One &gt; Wharf Rat &gt; Sugar Magnolia
            </td>
          </tr>
          <tr>
            <td>
              E: Alabama
            </td>
          </tr>
        </table>
      </div>
      <div>
        <table border="0" cellspacing="0" cellpadding="0">
          <tr>
            <td id="0614">
              <a href="/1980-06-14">6/14/1980 Spokane Coliseum, Spokane, WA</a> [<a href="http://www.archive.org/search.php?query=creator:%22Grateful%20Dead%22%20date:1980-06-14*">Listen/Download</a>]
            </td>
          </tr>
          <tr>
            <td>
              I: Alabama &gt; Promised, FOTD &gt; El Paso, B. E. Women, Me and My Uncle &gt; Big River, Far From Me, Big RxR Blues, L. L. Rain, Don't Ease
            </td>
          </tr>
          <tr>
            <td>
              II: Stranger, Ship Of Fools &gt; Estimated &gt; Eyes &gt; Drumz &gt; Sailor &gt; Saint &gt; Stella Blue &gt; GDTRFB &gt; Good Lovin
            </td>
          </tr>
          <tr>
            <td>
              E: Saturday Night
            </td>
          </tr>
        </table>
      </div>
      <div>
        <table border="0" cellspacing="0" cellpadding="0">
          <tr>
            <td id="0619">
              <a href="/1980-06-19">6/19/1980 West High Auditorium, Anchorage, AK</a> [<a href="http://www.archive.org/search.php?query=creator:%22Grateful%20Dead%22%20date:1980-06-19*">Listen/Download</a>]
            </td>
          </tr>
          <tr>
            <td>
              I: Alabama &gt; Promised, TLEO &gt; El Paso, Tennessee Jed, Cassidy, Althea &gt; L. L. Rain, Far From Me, Music
            </td>
          </tr>
          <tr>
            <td>
              II: China Cat &gt; I Know You Rider &gt; C. C. Rider, Peggy-O, Sailor &gt; Saint &gt; Drumz &gt; Wharf Rat &gt; Miracle &gt; Bertha &gt; Good Lovin
            </td>
          </tr>
          <tr>
            <td>
              E: U. S. Blues
            </td>
          </tr>
        </table>
      </div>
      <div>
        <table border="0" cellspacing="0" cellpadding="0">
          <tr>
            <td id="0620">
              <a href="/1980-06-20">6/20/1980 West High Auditorium, Anchorage, AK</a> [<a href="http://www.archive.org/search.php?query=creator:%22Grateful%20Dead%22%20date:1980-06-20*">Listen/Download</a>]
            </td>
          </tr>
          <tr>
            <td>
              I: Jack Straw &gt; Franklin's &gt; Mama Tried &gt; Mexicali, FOTD, Let It Grow &gt; Althea, Easy To Love You, Sailor &gt; Saint &gt; Deal
            </td>
          </tr>
          <tr>
            <td>
              II: Alabama &gt; Greatest, Ship Of Fools, Estimated &gt; Other One &gt; Drumz &gt; NFA &gt; Black Peter &gt; Around &gt; Johnny B. Goode
            </td>
          </tr>
          <tr>
            <td>
              E: Don't Ease
            </td>
          </tr>
        </table>
      </div>
      <div>
        <table border="0" cellspacing="0" cellpadding="0">
          <tr>
            <td id="0621">
              <a href="/1980-06-21">6/21/1980 West High Auditorium, Anchorage, AK</a> [<a href="http://www.archive.org/search.php?query=creator:%22Grateful%20Dead%22%20date:1980-06-21*">Listen/Download</a>]
            </td>
          </tr>
          <tr>
            <td>
              I: Sugaree &gt; Minglewood, Candyman, Me and My Uncle &gt; Big River, Loser, Lazy Lightning &gt; Supplication, Far From Me, Ramble On, Stranger
            </td>
          </tr>
          <tr>
            <td>
              II: Big RxR Blues, Samson, Terrapin &gt; Playin &gt; Drumz &gt; Truckin &gt; Stella Blue &gt; Sugar Magnolia
            </td>
          </tr>
          <tr>
            <td>
              E: Saturday Night &gt; Brokedown
            </td>
          </tr>
        </table>
      </div>
      <div>
        <table border="0" cellspacing="0" cellpadding="0">
          <tr>
            <td id="0629">
              <a href="/1980-06-29">6/29/1980 Pauley Pavilion, U.C.L.A., Los Angeles, CA</a> [<a href="http://www.archive.org/search.php?query=creator:%22Grateful%20Dead%22%20date:1980-06-29*">Listen/Download</a>]
            </td>
          </tr>
          <tr>
            <td>
              I: Alabama &gt; Promised, Loser, Minglewood, Althea, L. L. Rain, Easy To Love You, Big RxR Blues &gt; Sailor &gt; Saint &gt; Deal
            </td>
          </tr>
          <tr>
            <td>
              II: Stranger, Don't Ease, Estimated &gt; Scarlet &gt; Fire &gt; Drumz* &gt; Other One* &gt; Black Peter* &gt; Sugar Magnolia*
            </td>
          </tr>
          <tr>
            <td>
              E: U. S. Blues
            </td>
          </tr>
          <tr>
            <td>
              *with Lee Oskar
            </td>
          </tr>
        </table>
      </div>
      <div>
        <table border="0" cellspacing="0" cellpadding="0">
          <tr>
            <td id="0701">
              <a href="/1980-07-01">7/1/1980 San Diego Sports Arena, San Diego, CA</a> [<a href="http://www.archive.org/search.php?query=creator:%22Grateful%20Dead%22%20date:1980-07-01*">Listen/Download</a>]
            </td>
          </tr>
          <tr>
            <td>
              I: Jack Straw &gt; Franklin's &gt; El Paso, Tennessee Jed, Lazy Lightning &gt; Supplication, Althea &gt; Sailor &gt; Saint
            </td>
          </tr>
          <tr>
            <td>
              II: China Cat &gt; I Know You Rider &gt; C. C. Rider, Peggy-O, Far From Me, Uncle John &gt; Playin &gt; Drumz &gt; Truckin &gt; Wharf Rat &gt; Around &gt; Good Lovin
            </td>
          </tr>
          <tr>
            <td>
              E: Alabama &gt; Johnny B. Goode
            </td>
          </tr>
        </table>
      </div>
      <div>
        <table border="0" cellspacing="0" cellpadding="0">
          <tr>
            <td id="0816">
              <a href="/1980-08-16">8/16/1980 Mississippi River Festival, Edwardsville, IL</a> [<a href="http://www.archive.org/search.php?query=creator:%22Grateful%20Dead%22%20date:1980-08-16*">Listen/Download</a>]
            </td>
          </tr>
          <tr>
            <td>
              I: Alabama &gt; Promised, TLEO, Me and My Uncle &gt; El Paso, Althea &gt; L. L. Rain, Tennessee Jed, Easy To Love You, Minglewood, Deal
            </td>
          </tr>
          <tr>
            <td>
              II: C. C. Rider &gt; China Cat &gt; I Know You Rider, Ship Of Fools, Estimated &gt; He's Gone &gt; Drumz &gt; Other One &gt; Black Peter &gt; Sugar Magnolia
            </td>
          </tr>
          <tr>
            <td>
              E: Iko Iko, Saturday Night
            </td>
          </tr>
          <tr>
            <td>
              Previous ''Iko Iko'' 2/4/1979 [94 shows]
            </td>
          </tr>
        </table>
      </div>
      <div>
        <table border="0" cellspacing="0" cellpadding="0">
          <tr>
            <td id="0817">
              <a href="/1980-08-17">8/17/1980 Kansas City Municipal Auditorium Arena, Kansas City, MO</a> [<a href="http://www.archive.org/search.php?query=creator:%22Grateful%20Dead%22%20date:1980-08-17*">Listen/Download</a>]
            </td>
          </tr>
          <tr>
            <td>
              I: Jack Straw &gt; Sugaree, Mama Tried &gt; Mexicali, Peggy-O, Minglewood, FOTD, Far From Me &gt; Sailor &gt; Saint
            </td>
          </tr>
          <tr>
            <td>
              II: Don't Ease, Samson, Scarlet &gt; Fire &gt; Drumz &gt; Wheel &gt; Truckin &gt; Wharf Rat &gt; Good Lovin
            </td>
          </tr>
          <tr>
            <td>
              E: U. S. Blues
            </td>
          </tr>
          <tr>
            <td>
              Previous ''Wheel'' 2/17/1979 [89 shows]
            </td>
          </tr>
        </table>
      </div>
      <div>
        <table border="0" cellspacing="0" cellpadding="0">
          <tr>
            <td id="0819">
              <a href="/1980-08-19">8/19/1980 Uptown Theatre, Chicago, IL</a> [<a href="http://www.archive.org/search.php?query=creator:%22Grateful%20Dead%22%20date:1980-08-19*">Listen/Download</a>]
            </td>
          </tr>
          <tr>
            <td>
              I: Half Step &gt; Franklin's &gt; Minglewood, Dire Wolf, Cassidy, Row Jimmy, Me and My Uncle &gt; Big River, Althea, Easy To Love You, Stranger
            </td>
          </tr>
          <tr>
            <td>
              II: Rooster &gt; China Cat &gt; I Know You Rider &gt; Estimated &gt; Eyes &gt; Drumz &gt; Playin &gt; Comes A Time &gt; Playin &gt; Around &gt; Alabama
            </td>
          </tr>
          <tr>
            <td>
              E: Johnny B. Goode
            </td>
          </tr>
          <tr>
            <td>
              First ''Rooster''
            </td>
          </tr>
        </table>
      </div>
      <div>
        <table border="0" cellspacing="0" cellpadding="0">
          <tr>
            <td id="0820">
              <a href="/1980-08-20">8/20/1980 Uptown Theatre, Chicago, IL</a> [<a href="http://www.archive.org/search.php?query=creator:%22Grateful%20Dead%22%20date:1980-08-20*">Listen/Download</a>]
            </td>
          </tr>
          <tr>
            <td>
              I: Jack Straw, Loser, BIODTL, Ramble On &gt; El Paso, Big RxR Blues &gt; L. L. Rain, Far From Me, Let It Grow &gt; Deal
            </td>
          </tr>
          <tr>
            <td>
              II: Greatest &gt; Althea &gt; Sailor &gt; Saint &gt; Terrapin &gt; Drumz &gt; NFA &gt; Morning Dew &gt; Good Lovin
            </td>
          </tr>
          <tr>
            <td>
              E: U. S. Blues
            </td>
          </tr>
        </table>
      </div>
      <div>
        <table border="0" cellspacing="0" cellpadding="0">
          <tr>
            <td id="0821">
              <a href="/1980-08-21">8/21/1980 Uptown Theatre, Chicago, IL</a> [<a href="http://www.archive.org/search.php?query=creator:%22Grateful%20Dead%22%20date:1980-08-21*">Listen/Download</a>]
            </td>
          </tr>
          <tr>
            <td>
              I: Cold Rain, Minglewood, High Time, Mama Tried &gt; Mexicali, Peggy-O, All Over Now, Easy To Love You, Shakedown &gt; Promised
            </td>
          </tr>
          <tr>
            <td>
              II: Drums &gt; Uncle John &gt; Truckin &gt; Other One &gt; Drumz &gt; Wheel &gt; Uncle John &gt; Sugar Magnolia
            </td>
          </tr>
          <tr>
            <td>
              E: Alabama
            </td>
          </tr>
        </table>
      </div>
      <div>
        <table border="0" cellspacing="0" cellpadding="0">
          <tr>
            <td id="0823">
              <a href="/1980-08-23">8/23/1980 Alpine Valley Music Theatre, East Troy, WI</a> [<a href="http://www.archive.org/search.php?query=creator:%22Grateful%20Dead%22%20date:1980-08-23*">Listen/Download</a>]
            </td>
          </tr>
          <tr>
            <td>
              I: Alabama &gt; Promised, Candyman, Me and My Uncle &gt; Big River, Tennessee Jed, Lazy Lightning &gt; Supplication, Althea, Music
            </td>
          </tr>
          <tr>
            <td>
              II: Don't Ease, Sailor &gt; Saint &gt; He's Gone &gt; Drumz &gt; Wharf Rat &gt; Around &gt; Good Lovin
            </td>
          </tr>
          <tr>
            <td>
              E: Saturday Night
            </td>
          </tr>
        </table>
      </div>
      <div>
        <table border="0" cellspacing="0" cellpadding="0">
          <tr>
            <td id="0824">
              <a href="/1980-08-24">8/24/1980 Grand Center, Grand Rapids, MI</a> [<a href="http://www.archive.org/search.php?query=creator:%22Grateful%20Dead%22%20date:1980-08-24*">Listen/Download</a>]
            </td>
          </tr>
          <tr>
            <td>
              I: Jack Straw, TLEO, Cassidy, B. E. Women, Passenger, Peggy-O, L. L. Rain, Althea, Let It Grow &gt; Deal
            </td>
          </tr>
          <tr>
            <td>
              II: Samson, Ship Of Fools, Stranger, China Cat &gt; I Know You Rider &gt; Drumz &gt; NFA &gt; Black Peter &gt; Sugar Magnolia
            </td>
          </tr>
          <tr>
            <td>
              E: Don't Ease
            </td>
          </tr>
        </table>
      </div>
      <div>
        <table border="0" cellspacing="0" cellpadding="0">
          <tr>
            <td id="0826">
              <a href="/1980-08-26">8/26/1980 Cleveland Public Hall, Cleveland, OH</a> [<a href="http://www.archive.org/search.php?query=creator:%22Grateful%20Dead%22%20date:1980-08-26*">Listen/Download</a>]
            </td>
          </tr>
          <tr>
            <td>
              I: Sugaree &gt; El Paso, Loser, BIODTL, Althea, Lazy Lightning &gt; Supplication, Deal
            </td>
          </tr>
          <tr>
            <td>
              II: Don't Ease, Rooster, Far From Me, Uncle John &gt; Playin &gt; Drumz &gt; Comes A Time &gt; Sailor &gt; Saint &gt; Casey Jones
            </td>
          </tr>
          <tr>
            <td>
              E: Johnny B. Goode
            </td>
          </tr>
        </table>
      </div>
      <div>
        <table border="0" cellspacing="0" cellpadding="0">
          <tr>
            <td id="0827">
              <a href="/1980-08-27">8/27/1980 Pine Knob Music Theatre, Clarkston, MI</a> [<a href="http://www.archive.org/search.php?query=creator:%22Grateful%20Dead%22%20date:1980-08-27*">Listen/Download</a>]
            </td>
          </tr>
          <tr>
            <td>
              I: Promised, TLEO, Mama Tried &gt; Mexicali, Tennessee Jed, Minglewood, Althea, L. L. Rain, Big RxR Blues, Stranger
            </td>
          </tr>
          <tr>
            <td>
              II: China Cat &gt; I Know You Rider, C. C. Rider, High Time, Estimated &gt; Eyes &gt; Drumz &gt; NFA &gt; Stella Blue &gt; Miracle &gt; Bertha &gt; Good Lovin
            </td>
          </tr>
          <tr>
            <td>
              E: U. S. Blues
            </td>
          </tr>
        </table>
      </div>
      <div>
        <table border="0" cellspacing="0" cellpadding="0">
          <tr>
            <td id="0829">
              <a href="/1980-08-29">8/29/1980 The Spectrum, Philadelphia, PA</a> [<a href="http://www.archive.org/search.php?query=creator:%22Grateful%20Dead%22%20date:1980-08-29*">Listen/Download</a>]
            </td>
          </tr>
          <tr>
            <td>
              I: Alabama &gt; Promised, Candyman, Me and My Uncle &gt; Big River, Row Jimmy &gt; Rooster, B. E. Women, Far From Me, Sailor &gt; Saint &gt; Deal
            </td>
          </tr>
          <tr>
            <td>
              II: Greatest &gt; Althea, Let It Grow &gt; He's Gone &gt; Other One &gt; Drumz &gt; Wharf Rat &gt; GDTRFB &gt; Around &gt; Johnny B. Goode
            </td>
          </tr>
          <tr>
            <td>
              E: U. S. Blues
            </td>
          </tr>
        </table>
      </div>
      <div>
        <table border="0" cellspacing="0" cellpadding="0">
          <tr>
            <td id="0830">
              <a href="/1980-08-30">8/30/1980 The Spectrum, Philadelphia, PA</a> [<a href="http://www.archive.org/search.php?query=creator:%22Grateful%20Dead%22%20date:1980-08-30*">Listen/Download</a>]
            </td>
          </tr>
          <tr>
            <td>
              I: Stranger, Peggy-O, Cassidy, FOTD, Minglewood, Cold Rain &gt; L. L. Rain, Easy To Love You, Althea, Jack Straw
            </td>
          </tr>
          <tr>
            <td>
              II: Scarlet &gt; Fire, C. C. Rider, Ramble On, Estimated &gt; Eyes &gt; Drumz &gt; NFA &gt; Black Peter &gt; Sugar Magnolia
            </td>
          </tr>
          <tr>
            <td>
              E: Saturday Night
            </td>
          </tr>
        </table>
      </div>
      <div>
        <table border="0" cellspacing="0" cellpadding="0">
          <tr>
            <td id="0831">
              <a href="/1980-08-31">8/31/1980 Capital Centre, Landover, MD</a> [<a href="http://www.archive.org/search.php?query=creator:%22Grateful%20Dead%22%20date:1980-08-31*">Listen/Download</a>]
            </td>
          </tr>
          <tr>
            <td>
              I: Alabama &gt; Promised, TLEO, Mama Tried &gt; Mexicali, Althea, Rooster, Tennessee Jed, Far From Me *, Lazy Lightning &gt; Supplication, Deal
            </td>
          </tr>
          <tr>
            <td>
              II: Greatest &gt; Uncle John &gt; Sailor &gt; Saint &gt; Comes A Time &gt; Truckin &gt; Drumz &gt; Other One &gt; Stella Blue &gt; Miracle &gt; Good Lovin
            </td>
          </tr>
          <tr>
            <td>
              E: Brokedown
            </td>
          </tr>
          <tr>
            <td>
              *appears on the "Beyond Description (1973-1989)" bonus disc.
            </td>
          </tr>
        </table>
      </div>
      <div>
        <table border="0" cellspacing="0" cellpadding="0">
          <tr>
            <td id="0902">
              <a href="/1980-09-02">9/2/1980 Community War Memorial, Rochester, NY</a> [<a href="http://www.archive.org/search.php?query=creator:%22Grateful%20Dead%22%20date:1980-09-02*">Listen/Download</a>]
            </td>
          </tr>
          <tr>
            <td>
              I: Minglewood, Sugaree &gt; El Paso, FOTD, All Over Now, China Cat &gt; I Know You Rider &gt; Sailor &gt; Saint &gt; Don't Ease
            </td>
          </tr>
          <tr>
            <td>
              II: Althea, C. C. Rider, Ship Of Fools, Estimated &gt; Terrapin &gt; Playin &gt; Drumz * &gt; Iko Iko * &gt; Morning Dew * &gt; Sugar Magnolia
            </td>
          </tr>
          <tr>
            <td>
              E: Alabama
            </td>
          </tr>
          <tr>
            <td>
              *appears on "Dick�s Picks Volume 21."; Brent Mydland's 100th Show
            </td>
          </tr>
        </table>
      </div>
      <div>
        <table border="0" cellspacing="0" cellpadding="0">
          <tr>
            <td id="0903">
              <a href="/1980-09-03">9/3/1980 Springfield Civic Center Arena, Springfield, MA</a> [<a href="http://www.archive.org/search.php?query=creator:%22Grateful%20Dead%22%20date:1980-09-03*">Listen/Download</a>]
            </td>
          </tr>
          <tr>
            <td>
              I: Half Step &gt; Franklin's &gt; Mama Tried &gt; Mexicali, Althea &gt; Rooster, Candyman, Easy To Love You, Let It Grow &gt; Deal
            </td>
          </tr>
          <tr>
            <td>
              II: Stranger, High Time, Sailor &gt; Saint &gt; Drumz &gt; He's Gone &gt; Truckin &gt; Black Peter &gt; Around &gt; Johnny B. Goode
            </td>
          </tr>
          <tr>
            <td>
              E: Brokedown
            </td>
          </tr>
          <tr>
            <td>
              Next ''Easy To Love You'' 3/15/1990 [673 shows]
            </td>
          </tr>
          <tr>
            <td>
              Entire show appears on "Grateful Dead Download Series Volume 7."
            </td>
          </tr>
        </table>
      </div>
      <div>
        <table border="0" cellspacing="0" cellpadding="0">
          <tr>
            <td id="0904">
              <a href="/1980-09-04">9/4/1980 Providence Civic Center, Providence, RI</a> [<a href="http://www.archive.org/search.php?query=creator:%22Grateful%20Dead%22%20date:1980-09-04*">Listen/Download</a>]
            </td>
          </tr>
          <tr>
            <td>
              I: Stranger, Peggy-O, Cassidy, Dire Wolf, Minglewood, Althea, L. L. Rain, Far From Me, China Cat &gt; I Know You Rider
            </td>
          </tr>
          <tr>
            <td>
              II: Samson, Ramble On, Supplication Jam * &gt; Estimated * &gt; Eyes * &gt; Drumz * &gt; Other One * &gt; Wharf Rat * &gt; GDTRFB * &gt; Good Lovin *
            </td>
          </tr>
          <tr>
            <td>
              E: U. S. Blues *
            </td>
          </tr>
          <tr>
            <td>
              appears on "Grateful Dead Download Series Volume 7."
            </td>
          </tr>
        </table>
      </div>
      <div>
        <table border="0" cellspacing="0" cellpadding="0">
          <tr>
            <td id="0906">
              <a href="/1980-09-06">9/6/1980 State Fairgrounds, Lewiston, ME</a> [<a href="http://www.archive.org/search.php?query=creator:%22Grateful%20Dead%22%20date:1980-09-06*">Listen/Download</a>]
            </td>
          </tr>
          <tr>
            <td>
              I: Alabama &gt; Greatest, Sugaree, Me and My Uncle &gt; Mexicali, Tennessee Jed, Stranger, FOTD, Far From Me &gt; Rooster, China Cat &gt; I Know You Rider &gt; Promised
            </td>
          </tr>
          <tr>
            <td>
              II: Shakedown, Sailor &gt; Saint, Althea, Playin &gt; Uncle John &gt; Drumz &gt; NFA &gt; Wheel &gt; Uncle John &gt; Playin &gt; Sugar Magnolia
            </td>
          </tr>
          <tr>
            <td>
              E: Saturday Night &gt; Brokedown
            </td>
          </tr>
          <tr>
            <td>
              Next ''Far From Me'' 10/15/1981 [103 shows]
            </td>
          </tr>
          <tr>
            <td>
              Roy Buchanan, then The Cate Brothers and Levon Helm opened.
            </td>
          </tr>
        </table>
      </div>
      <div>
        <table border="0" cellspacing="0" cellpadding="0">
          <tr>
            <td id="0914">
              <a href="/1980-09-14">9/14/1980 Le Club Front, San Rafael, CA</a> [<a href="http://www.archive.org/search.php?query=creator:%22Grateful%20Dead%22%20date:1980-09-14*">Listen/Download</a>]
            </td>
          </tr>
          <tr>
            <td>
              To Lay Me Down
            </td>
          </tr>
          <tr>
            <td>
              Rehearsal. Appears as a "Reckoning" bonus track in "Beyond Description (1973-1989)."
            </td>
          </tr>
        </table>
      </div>
      <div>
        <table border="0" cellspacing="0" cellpadding="0">
          <tr>
            <td id="0925">
              <a href="/1980-09-25">9/25/1980 Warfield Theater, San Francisco, CA</a> [<a href="http://www.archive.org/search.php?query=creator:%22Grateful%20Dead%22%20date:1980-09-25*">Listen/Download</a>]
            </td>
          </tr>
          <tr>
            <td>
              I: Bird Song@, All Around This World@, Dark Hollow@, Rosalie McFall@*, Monkey and Engineer@, Roses@, Jack A Roe@, Ain't No Lie@ &gt; Ripple@*
            </td>
          </tr>
          <tr>
            <td>
              II: Alabama &gt; Greatest, FOTD, Mama Tried &gt; Mexicali, Loser, Rooster, Althea, Jack Straw, Deal
            </td>
          </tr>
          <tr>
            <td>
              III: China Cat &gt; I Know You Rider, Samson, Ship Of Fools, Playin &gt; Drumz &gt; Wharf Rat &gt; Around &gt; Good Lovin
            </td>
          </tr>
          <tr>
            <td>
              E: U. S. Blues
            </td>
          </tr>
          <tr>
            <td>
              First ''Ain't No Lie''; Previous ''All Around This World'' 2/14/1970 [704 shows]; Previous ''Bird Song'' 9/15/1973 [382 shows]; Previous ''Dark Hollow'' 4/29/1971 [550 shows]; Previous ''Jack A Roe'' 12/3/1979 [60 shows]; Previous ''Monkey and Engineer'' 12/31/1970 [589 shows]; Previous ''Ripple'' 4/29/1971 [550 shows]; Previous ''Rosalie McFall'' 11/8/1970 [609 shows]; Previous ''Roses'' 1/12/1979 [118 shows]
            </td>
          </tr>
          <tr>
            <td>
              *appears on "Reckoning."
            </td>
          </tr>
        </table>
      </div>
      <div>
        <table border="0" cellspacing="0" cellpadding="0">
          <tr>
            <td id="0926">
              <a href="/1980-09-26">9/26/1980 Warfield Theater, San Francisco, CA</a> [<a href="http://www.archive.org/search.php?query=creator:%22Grateful%20Dead%22%20date:1980-09-26*">Listen/Download</a>]
            </td>
          </tr>
          <tr>
            <td>
              I: To Lay Me Down@, On The Road Again@, All Around This World@, Dark Hollow@, Rosalie McFall@, Bird Song@, Cassidy@, China Doll@ &gt; Ripple@
            </td>
          </tr>
          <tr>
            <td>
              II: Stranger, Sugaree, Me and My Uncle &gt; Big River, Peggy-O, Minglewood, Candyman, L. L. Rain, Tennessee Jed &gt; Sailor &gt; Saint
            </td>
          </tr>
          <tr>
            <td>
              III: Scarlet &gt; Fire, Estimated &gt; Eyes &gt; Drumz &gt; NFA &gt; Black Peter &gt; Sugar Magnolia
            </td>
          </tr>
          <tr>
            <td>
              E: Brokedown
            </td>
          </tr>
          <tr>
            <td>
              Previous ''China Doll'' 5/8/1979 [99 shows]; Previous ''On The Road Again'' 12/1/1966 [1128 shows]; Previous ''To Lay Me Down'' 10/19/1974 [311 shows]
            </td>
          </tr>
        </table>
      </div>
      <div>
        <table border="0" cellspacing="0" cellpadding="0">
          <tr>
            <td id="0927">
              <a href="/1980-09-27">9/27/1980 Warfield Theater, San Francisco, CA</a> [<a href="http://www.archive.org/search.php?query=creator:%22Grateful%20Dead%22%20date:1980-09-27*">Listen/Download</a>]
            </td>
          </tr>
          <tr>
            <td>
              I: Dire Wolf@, Race Is On@, Jack A Roe@, Monkey and Engineer@, Roses@, Dark Hollow@, Bird Song@, To Lay Me Down@, On The Road Again@, Ain't No Lie@ &gt; Ripple@
            </td>
          </tr>
          <tr>
            <td>
              II: Half Step &gt; Franklin's, Mama Tried &gt; Mexicali, Row Jimmy, Rooster, Althea &gt; Let It Grow, Deal
            </td>
          </tr>
          <tr>
            <td>
              III: Cold Rain &gt; C. C. Rider, Ramble On, He's Gone &gt; Other One &gt; Drumz &gt; Stella Blue &gt; Miracle &gt; GDTRFB &gt; Johnny B. Goode
            </td>
          </tr>
          <tr>
            <td>
              E: Saturday Night
            </td>
          </tr>
          <tr>
            <td>
              Previous ''Race Is On'' 10/19/1974 [312 shows]
            </td>
          </tr>
        </table>
      </div>
      <div>
        <table border="0" cellspacing="0" cellpadding="0">
          <tr>
            <td id="0929">
              <a href="/1980-09-29">9/29/1980 Warfield Theater, San Francisco, CA</a> [<a href="http://www.archive.org/search.php?query=creator:%22Grateful%20Dead%22%20date:1980-09-29*">Listen/Download</a>]
            </td>
          </tr>
          <tr>
            <td>
              I: Dire Wolf@, On The Road Again@, Bird Song@, Cassidy@, All Around This World@, Heaven Help The Fool@, To Lay Me Down@, Dark Hollow@, Ain't No Lie@ &gt; Ripple@
            </td>
          </tr>
          <tr>
            <td>
              II: Jack Straw, TLEO, El Paso, B. E. Women, All Over Now, Candyman, Minglewood, China Cat &gt; I Know You Rider
            </td>
          </tr>
          <tr>
            <td>
              III: Althea, Sailor &gt; Saint &gt; Terrapin &gt; Drumz &gt; Truckin &gt; Wharf Rat &gt; Around &gt; Johnny B. Goode
            </td>
          </tr>
          <tr>
            <td>
              E: U. S. Blues
            </td>
          </tr>
          <tr>
            <td>
              First ''Heaven Help The Fool''
            </td>
          </tr>
        </table>
      </div>
      <div>
        <table border="0" cellspacing="0" cellpadding="0">
          <tr>
            <td id="0930">
              <a href="/1980-09-30">9/30/1980 Warfield Theater, San Francisco, CA</a> [<a href="http://www.archive.org/search.php?query=creator:%22Grateful%20Dead%22%20date:1980-09-30*">Listen/Download</a>]
            </td>
          </tr>
          <tr>
            <td>
              I: On The Road Again@, Jack A Roe@, Monkey and Engineer@, Bird Song@, Dark Hollow@, Rosalie McFall@, Heaven Help The Fool@, China Doll@, Ain't No Lie@* &gt; Ripple@
            </td>
          </tr>
          <tr>
            <td>
              II: Alabama &gt; Promised, Peggy-O, BIODTL, FOTD, Lazy Lightning &gt; Supplication, Loser, Rooster, Big RxR Blues
            </td>
          </tr>
          <tr>
            <td>
              III: Stranger &gt; Franklin's, Samson, He's Gone &gt; Estimated &gt; Drumz &gt; Other One &gt; Black Peter &gt; Good Lovin
            </td>
          </tr>
          <tr>
            <td>
              E: Brokedown
            </td>
          </tr>
          <tr>
            <td>
              *appears on "Reckoning."
            </td>
          </tr>
        </table>
      </div>
      <div>
        <table border="0" cellspacing="0" cellpadding="0">
          <tr>
            <td id="1002">
              <a href="/1980-10-02">10/2/1980 Warfield Theater, San Francisco, CA</a> [<a href="http://www.archive.org/search.php?query=creator:%22Grateful%20Dead%22%20date:1980-10-02*">Listen/Download</a>]
            </td>
          </tr>
          <tr>
            <td>
              I: Dark Hollow@, Iko Iko@, Race Is On@*, To Lay Me Down@, Cassidy@, Jack A Roe@, On The Road Again@, Bird Song@ &gt; Ripple@
            </td>
          </tr>
          <tr>
            <td>
              II: Bertha &gt; Greatest, Peggy-O, Mama Tried &gt; Mexicali, Roses, All Over Now, Loser, L. L. Rain, China Cat &gt; I Know You Rider
            </td>
          </tr>
          <tr>
            <td>
              III: Drums &gt; Comes A Time &gt; Sailor &gt; Saint &gt; Terrapin &gt; Playin &gt; Drumz &gt; Stella Blue &gt; Sugar Magnolia
            </td>
          </tr>
          <tr>
            <td>
              E: Alabama
            </td>
          </tr>
          <tr>
            <td>
              Next ''Drums'' 2/11/1986 [379 shows]
            </td>
          </tr>
          <tr>
            <td>
              *appears on "Reckoning."
            </td>
          </tr>
        </table>
      </div>
      <div>
        <table border="0" cellspacing="0" cellpadding="0">
          <tr>
            <td id="1003">
              <a href="/1980-10-03">10/3/1980 Warfield Theater, San Francisco, CA</a> [<a href="http://www.archive.org/search.php?query=creator:%22Grateful%20Dead%22%20date:1980-10-03*">Listen/Download</a>]
            </td>
          </tr>
          <tr>
            <td>
              I: Dire Wolf@, Monkey and Engineer@, All Around This World@, Dark Hollow@, Jack A Roe@, Heaven Help The Fool@, China Doll@, On The Road Again@, Bird Song@ &gt; Ripple@
            </td>
          </tr>
          <tr>
            <td>
              II: Jack Straw, Sugaree, Me and My Uncle &gt; Big River, Row Jimmy, Minglewood, Tennessee Jed, Music
            </td>
          </tr>
          <tr>
            <td>
              III: Scarlet &gt; Fire, Samson, Ship Of Fools, Playin &gt; Drumz &gt; Wheel &gt; Playin &gt; Black Peter &gt; Good Lovin
            </td>
          </tr>
          <tr>
            <td>
              E: Brokedown *
            </td>
          </tr>
          <tr>
            <td>
              *appears on "Dead Set."
            </td>
          </tr>
        </table>
      </div>
      <div>
        <table border="0" cellspacing="0" cellpadding="0">
          <tr>
            <td id="1004">
              <a href="/1980-10-04">10/4/1980 Warfield Theater, San Francisco, CA</a> [<a href="http://www.archive.org/search.php?query=creator:%22Grateful%20Dead%22%20date:1980-10-04*">Listen/Download</a>]
            </td>
          </tr>
          <tr>
            <td>
              I: Deep Elem@, Race Is On@, Roses@, Monkey and Engineer@, Rosalie McFall@, Dark Hollow@, To Lay Me Down@, On The Road Again@, Ain't No Lie@ &gt; Ripple@
            </td>
          </tr>
          <tr>
            <td>
              II: Alabama &gt; Greatest, Candyman, Mama Tried &gt; Mexicali, High Time, Passenger, Althea, Rooster, Ramble On, Let It Grow &gt; Deal *
            </td>
          </tr>
          <tr>
            <td>
              III: Stranger * &gt; Franklin's &gt; Estimated &gt; Eyes &gt; Drumz &gt; NFA + &gt; Wharf Rat &gt; Miracle &gt; Johnny B. Goode
            </td>
          </tr>
          <tr>
            <td>
              E: Uncle John &gt; Saturday Night
            </td>
          </tr>
          <tr>
            <td>
              Previous ''Deep Elem'' 12/28/1970 [597 shows]
            </td>
          </tr>
          <tr>
            <td>
              *appears on "Dead Set." +appears as a "Dead Set" bonus track in "Beyond Description (1973-1989)."
            </td>
          </tr>
        </table>
      </div>
      <div>
        <table border="0" cellspacing="0" cellpadding="0">
          <tr>
            <td id="1006">
              <a href="/1980-10-06">10/6/1980 Warfield Theater, San Francisco, CA</a> [<a href="http://www.archive.org/search.php?query=creator:%22Grateful%20Dead%22%20date:1980-10-06*">Listen/Download</a>]
            </td>
          </tr>
          <tr>
            <td>
              I: Dire Wolf@, Cassidy@, Jack A Roe@, Monkey and Engineer@, All Around This World@, Heaven Help The Fool@, China Doll@, On The Road Again@, Bird Song@ &gt; Ripple@
            </td>
          </tr>
          <tr>
            <td>
              II: China Cat &gt; I Know You Rider &gt; Minglewood, TLEO, BIODTL, Peggy-O, Lazy Lightning &gt; Supplication, B. E. Women, L. L. Rain, Deal
            </td>
          </tr>
          <tr>
            <td>
              III: Samson, Roses, Sailor &gt; Saint &gt; Terrapin &gt; Drumz &gt; Truckin &gt; Other One &gt; Black Peter &gt; Sugar Magnolia &gt; Johnny B. Goode
            </td>
          </tr>
          <tr>
            <td>
              E: U. S. Blues
            </td>
          </tr>
        </table>
      </div>
      <div>
        <table border="0" cellspacing="0" cellpadding="0">
          <tr>
            <td id="1007">
              <a href="/1980-10-07">10/7/1980 Warfield Theater, San Francisco, CA</a> [<a href="http://www.archive.org/search.php?query=creator:%22Grateful%20Dead%22%20date:1980-10-07*">Listen/Download</a>]
            </td>
          </tr>
          <tr>
            <td>
              I: Iko Iko@+, Dark Hollow@*, Rosalie McFall@, Monkey and Engineer@, To Lay Me Down@, Heaven Help The Fool@, Deep Elem@, El Paso@ &gt; Ripple@
            </td>
          </tr>
          <tr>
            <td>
              II: Cold Rain &gt; Minglewood, Loser, Me and My Uncle &gt; Big River, Althea, Rooster, Don't Ease, Let It Grow &gt; Deal
            </td>
          </tr>
          <tr>
            <td>
              III: Shakedown #, Estimated &gt; He's Gone &gt; Drumz &gt; Wheel &gt; Stella Blue &gt; Miracle &gt; Good Lovin
            </td>
          </tr>
          <tr>
            <td>
              E: Alabama
            </td>
          </tr>
          <tr>
            <td>
              *appears on "Reckoning." +appears as a "Reckoning" bonus track in "Beyond Description (1973-1989)." #appears as a "Dead Set" bonus track in "Beyond Description (1973-1989)."
            </td>
          </tr>
        </table>
      </div>
      <div>
        <table border="0" cellspacing="0" cellpadding="0">
          <tr>
            <td id="1009">
              <a href="/1980-10-09">10/9/1980 Warfield Theater, San Francisco, CA</a> [<a href="http://www.archive.org/search.php?query=creator:%22Grateful%20Dead%22%20date:1980-10-09*">Listen/Download</a>]
            </td>
          </tr>
          <tr>
            <td>
              I: Dire Wolf@, Dark Hollow@, All Around This World@, Cassidy@, China Doll@, On The Road Again@, Bird Song@, Race Is On@, Ain't No Lie@ &gt; Ripple@
            </td>
          </tr>
          <tr>
            <td>
              II: Stranger, FOTD, Mama Tried &gt; Mexicali, Peggy-O, Rooster, B. E. Women, L. L. Rain, Tennessee Jed, Music
            </td>
          </tr>
          <tr>
            <td>
              III: Alabama &gt; Greatest *, High Time, Sailor &gt; Saint &gt; Terrapin &gt; Drumz &gt; NFA &gt; Wharf Rat &gt; Sugar Magnolia
            </td>
          </tr>
          <tr>
            <td>
              E: Casey Jones
            </td>
          </tr>
          <tr>
            <td>
              *appears on "Dead Set."
            </td>
          </tr>
        </table>
      </div>
      <div>
        <table border="0" cellspacing="0" cellpadding="0">
          <tr>
            <td id="1010">
              <a href="/1980-10-10">10/10/1980 Warfield Theater, San Francisco, CA</a> [<a href="http://www.archive.org/search.php?query=creator:%22Grateful%20Dead%22%20date:1980-10-10*">Listen/Download</a>]
            </td>
          </tr>
          <tr>
            <td>
              I: On The Road Again@, Roses@, Monkey and Engineer@, Jack A Roe@*, Dark Hollow@, To Lay Me Down@, Heaven Help The Fool@, Bird Song@ &gt; Ripple@
            </td>
          </tr>
          <tr>
            <td>
              II: Half Step &gt; Franklin's, Me and My Uncle &gt; Big River, Candyman, BIODTL, Row Jimmy #, Minglewood +, Althea, Jack Straw #
            </td>
          </tr>
          <tr>
            <td>
              III: Scarlet &gt; Fire, Samson +, Big RxR Blues, Estimated % &gt; Eyes &gt; Drumz &gt; Truckin &gt; Nobody's Jam &gt; Black Peter &gt; Around &gt; Promised
            </td>
          </tr>
          <tr>
            <td>
              E: U. S. Blues
            </td>
          </tr>
          <tr>
            <td>
              *appears on "Reckoning." +appears on "Dead Set." #appears as a "Dead Set" bonus track in "Beyond Description (1973-1989)." %appears on the "Beyond Description (1973-1989)" bonus disc.
            </td>
          </tr>
        </table>
      </div>
      <div>
        <table border="0" cellspacing="0" cellpadding="0">
          <tr>
            <td id="1011">
              <a href="/1980-10-11">10/11/1980 Warfield Theater, San Francisco, CA</a> [<a href="http://www.archive.org/search.php?query=creator:%22Grateful%20Dead%22%20date:1980-10-11*">Listen/Download</a>]
            </td>
          </tr>
          <tr>
            <td>
              I: Dire Wolf@+, Dark Hollow@, Rosalie McFall@, Cassidy@, Deep Elem@+, Monkey and Engineer@, China Doll@, Heaven Help The Fool@, Ain't No Lie@ &gt; Ripple@
            </td>
          </tr>
          <tr>
            <td>
              II: Stranger, TLEO, Mama Tried &gt; Mexicali, Loser #, Passenger #, Ramble On, L. L. Rain, Althea &gt; Sailor &gt; Saint
            </td>
          </tr>
          <tr>
            <td>
              III: China Cat &gt; I Know You Rider, Let It Grow &gt; Drumz &gt; NFA* &gt; Wharf Rat* &gt; GDTRFB* &gt; Saturday Night*
            </td>
          </tr>
          <tr>
            <td>
              E: Brokedown
            </td>
          </tr>
          <tr>
            <td>
              *with John Cipollina. +appears on "Reckoning." #appears on "Dead Set."
            </td>
          </tr>
        </table>
      </div>
      <div>
        <table border="0" cellspacing="0" cellpadding="0">
          <tr>
            <td id="1013">
              <a href="/1980-10-13">10/13/1980 Warfield Theater, San Francisco, CA</a> [<a href="http://www.archive.org/search.php?query=creator:%22Grateful%20Dead%22%20date:1980-10-13*">Listen/Download</a>]
            </td>
          </tr>
          <tr>
            <td>
              I: On The Road Again@, Bird Song@, El Paso@*, To Lay Me Down@, Heaven Help The Fool@, Jack A Roe@, Race Is On@, Deep Elem@ &gt; Ripple@
            </td>
          </tr>
          <tr>
            <td>
              II: Sugaree &gt; Minglewood, Peggy-O, C. C. Rider +, Big RxR Blues, Lazy Lightning + &gt; Supplication +, Deal
            </td>
          </tr>
          <tr>
            <td>
              III: Cold Rain, Samson, Ship Of Fools, Sailor &gt; Saint &gt; Drumz &gt; He's Gone &gt; Other One &gt; Stella Blue &gt; Around &gt; Johnny B. Goode
            </td>
          </tr>
          <tr>
            <td>
              E: Casey Jones
            </td>
          </tr>
          <tr>
            <td>
              *appears as a "Reckoning" bonus track in "Beyond Description (1973-1989)." +appears as a "Dead Set" bonus track in "Beyond Description (1973-1989)."
            </td>
          </tr>
        </table>
      </div>
      <div>
        <table border="0" cellspacing="0" cellpadding="0">
          <tr>
            <td id="1014">
              <a href="/1980-10-14">10/14/1980 Warfield Theater, San Francisco, CA</a> [<a href="http://www.archive.org/search.php?query=creator:%22Grateful%20Dead%22%20date:1980-10-14*">Listen/Download</a>]
            </td>
          </tr>
          <tr>
            <td>
              I: Dire Wolf@, Dark Hollow@, Roses@, Cassidy@*, All Around This World@*, Monkey and Engineer@, China Doll@, Heaven Help The Fool@, Bird Song@* &gt; Ripple@
            </td>
          </tr>
          <tr>
            <td>
              II: Alabama &gt; Greatest, FOTD, Me and My Uncle &gt; Mexicali, Candyman, Rooster, Tennessee Jed &gt; Let It Grow &gt; Wheel &gt; Music +
            </td>
          </tr>
          <tr>
            <td>
              III: Scarlet &gt; Fire, Estimated &gt; Terrapin &gt; Playin &gt; Drumz &gt; Miracle &gt; Uncle John &gt; Morning Dew &gt; Playin &gt; Good Lovin
            </td>
          </tr>
          <tr>
            <td>
              E: U. S. Blues, Brokedown
            </td>
          </tr>
          <tr>
            <td>
              Next ''Morning Dew'' 8/12/1981 [65 shows]
            </td>
          </tr>
          <tr>
            <td>
              *appears on "Reckoning." +appears on "So Many Roads (1965-1995)."
            </td>
          </tr>
        </table>
      </div>
      <div>
        <table border="0" cellspacing="0" cellpadding="0">
          <tr>
            <td id="1018">
              <a href="/1980-10-18">10/18/1980 Saenger Performing Arts Center, New Orleans, LA</a> [<a href="http://www.archive.org/search.php?query=creator:%22Grateful%20Dead%22%20date:1980-10-18*">Listen/Download</a>]
            </td>
          </tr>
          <tr>
            <td>
              I: Dire Wolf@, On The Road Again@, Roses@, Monkey and Engineer@, All Around This World@, Heaven Help The Fool@, To Lay Me Down@, Ripple@
            </td>
          </tr>
          <tr>
            <td>
              II: Alabama &gt; Greatest, FOTD, Me and My Uncle &gt; Big River, Loser, Minglewood, Althea &gt; Sailor &gt; Saint &gt; Deal
            </td>
          </tr>
          <tr>
            <td>
              III: China Cat &gt; I Know You Rider, Stranger, Ship Of Fools, Estimated &gt; Eyes &gt; Drumz &gt; NFA &gt; Black Peter &gt; Around &gt; Johnny B. Goode
            </td>
          </tr>
          <tr>
            <td>
              E: Saturday Night
            </td>
          </tr>
        </table>
      </div>
      <div>
        <table border="0" cellspacing="0" cellpadding="0">
          <tr>
            <td id="1019">
              <a href="/1980-10-19">10/19/1980 Saenger Performing Arts Center, New Orleans, LA</a> [<a href="http://www.archive.org/search.php?query=creator:%22Grateful%20Dead%22%20date:1980-10-19*">Listen/Download</a>]
            </td>
          </tr>
          <tr>
            <td>
              I: On The Road Again@, Jack A Roe@, Dark Hollow@, Rosalie McFall@, Cassidy@, Bird Song@, Heaven Help The Fool@, Ain't No Lie@ &gt; Ripple@
            </td>
          </tr>
          <tr>
            <td>
              II: Jack Straw, TLEO, Mama Tried &gt; Mexicali, Candyman, Passenger, Row Jimmy &gt; L. L. Rain, Tennessee Jed &gt; Promised
            </td>
          </tr>
          <tr>
            <td>
              III: Scarlet &gt; Fire, Samson, Terrapin &gt; Drumz &gt; Truckin &gt; Wharf Rat &gt; Sugar Magnolia &gt; Good Lovin
            </td>
          </tr>
          <tr>
            <td>
              E: Brokedown
            </td>
          </tr>
        </table>
      </div>
      <div>
        <table border="0" cellspacing="0" cellpadding="0">
          <tr>
            <td id="1022">
              <a href="/1980-10-22">10/22/1980 Radio City Music Hall, New York, NY</a> [<a href="http://www.archive.org/search.php?query=creator:%22Grateful%20Dead%22%20date:1980-10-22*">Listen/Download</a>]
            </td>
          </tr>
          <tr>
            <td>
              I: Dire Wolf@, On The Road Again@, All Around This World@, Monkey and Engineer@, To Lay Me Down@, Heaven Help The Fool@, Bird Song@ &gt; Ripple@
            </td>
          </tr>
          <tr>
            <td>
              II: Alabama &gt; Greatest, FOTD, Me and My Uncle &gt; Big River, Peggy-O, Minglewood, China Cat &gt; I Know You Rider
            </td>
          </tr>
          <tr>
            <td>
              III: Scarlet &gt; Fire &gt; Sailor &gt; Saint &gt; Drumz &gt; NFA &gt; GDTRFB &gt; Good Lovin
            </td>
          </tr>
          <tr>
            <td>
              E: U. S. Blues
            </td>
          </tr>
        </table>
      </div>
      <div>
        <table border="0" cellspacing="0" cellpadding="0">
          <tr>
            <td id="1023">
              <a href="/1980-10-23">10/23/1980 Radio City Music Hall, New York, NY</a> [<a href="http://www.archive.org/search.php?query=creator:%22Grateful%20Dead%22%20date:1980-10-23*">Listen/Download</a>]
            </td>
          </tr>
          <tr>
            <td>
              I: On The Road Again@, Roses@*, Dark Hollow@*, Jack A Roe@*, Cassidy@*, China Doll@*, Monkey and Engineer@*, Ain't No Lie@* &gt; Ripple@*
            </td>
          </tr>
          <tr>
            <td>
              II: Stranger, Tennessee Jed, Mama Tried &gt; Mexicali, Althea +, Rooster, Big RxR Blues, Music
            </td>
          </tr>
          <tr>
            <td>
              III: Samson, Ship Of Fools, Estimated &gt; Terrapin &gt; Drumz &gt; Wheel &gt; Truckin &gt; Wharf Rat &gt; Sugar Magnolia
            </td>
          </tr>
          <tr>
            <td>
              E: Casey Jones
            </td>
          </tr>
          <tr>
            <td>
              *appears as a "Reckoning" bonus track in "Beyond Description (1973-1989)." +appears as a "Go to Heaven" bonus track in "Beyond Description (1973-1989)."
            </td>
          </tr>
        </table>
      </div>
      <div>
        <table border="0" cellspacing="0" cellpadding="0">
          <tr>
            <td id="1025">
              <a href="/1980-10-25">10/25/1980 Radio City Music Hall, New York, NY</a> [<a href="http://www.archive.org/search.php?query=creator:%22Grateful%20Dead%22%20date:1980-10-25*">Listen/Download</a>]
            </td>
          </tr>
          <tr>
            <td>
              I: Deep Elem@, Race Is On@, All Around This World@, Monkey and Engineer@, To Lay Me Down@* &gt; El Paso@, Bird Song@, Heaven Help The Fool@%, Dire Wolf@ &gt; Ripple@
            </td>
          </tr>
          <tr>
            <td>
              II: Half Step &gt; Franklin's +, Me and My Uncle &gt; Big River, High Time $, Minglewood, Ramble On &gt; L. L. Rain, Deal
            </td>
          </tr>
          <tr>
            <td>
              III: Cold Rain &gt; Sailor # &gt; Saint # &gt; Uncle John &gt; Playin &gt; Drumz &gt; Other One &gt; Black Peter &gt; Around &gt; Saturday Night
            </td>
          </tr>
          <tr>
            <td>
              E: U. S. Blues
            </td>
          </tr>
          <tr>
            <td>
              *appears on "Reckoning." +appears on "Dead Set." #appears as a "Go to Heaven" bonus track in "Beyond Description (1973-1989).# %appears as a "Reckoning" bonus track in "Beyond Description (1973-1989)." $appears as a "Dead Set" bonus track in "Beyond Description (1973-1989)."
            </td>
          </tr>
        </table>
      </div>
      <div>
        <table border="0" cellspacing="0" cellpadding="0">
          <tr>
            <td id="1026">
              <a href="/1980-10-26">10/26/1980 Radio City Music Hall, New York, NY</a> [<a href="http://www.archive.org/search.php?query=creator:%22Grateful%20Dead%22%20date:1980-10-26*">Listen/Download</a>]
            </td>
          </tr>
          <tr>
            <td>
              I: Iko Iko@, Dark Hollow@, Roses@*, On The Road Again@, Jack A Roe@, Cassidy@, China Doll@* &gt; Ripple@
            </td>
          </tr>
          <tr>
            <td>
              II: Jack Straw &gt; Sugaree +, Rooster, B. E. Women, Let It Grow + &gt; Don't Ease
            </td>
          </tr>
          <tr>
            <td>
              III: Jam &gt; Samson, Althea, Estimated &gt; He's Gone &gt; Drumz &gt; NFA &gt; Stella Blue &gt; Good Lovin
            </td>
          </tr>
          <tr>
            <td>
              E: Brokedown
            </td>
          </tr>
          <tr>
            <td>
              False start for "Estimated." *appears on "Reckoning." +appear as a "Dead Set" bonus track in "Beyond Description (1973-1989)."
            </td>
          </tr>
        </table>
      </div>
      <div>
        <table border="0" cellspacing="0" cellpadding="0">
          <tr>
            <td id="1027">
              <a href="/1980-10-27">10/27/1980 Radio City Music Hall, New York, NY</a> [<a href="http://www.archive.org/search.php?query=creator:%22Grateful%20Dead%22%20date:1980-10-27*">Listen/Download</a>]
            </td>
          </tr>
          <tr>
            <td>
              I: Race Is On@, All Around This World@, Monkey and Engineer@*, To Lay Me Down@, Heaven Help The Fool@, Rosalie McFall@, On The Road Again@, Bird Song@ &gt; Ripple@
            </td>
          </tr>
          <tr>
            <td>
              II: Alabama &gt; Greatest, FOTD +, Minglewood, Peggy-O, Passenger, Row Jimmy, Sailor &gt; Saint &gt; Deal
            </td>
          </tr>
          <tr>
            <td>
              III: Truckin &gt; Scarlet &gt; Fire &gt; Drumz &gt; Wharf Rat &gt; Miracle &gt; Bertha &gt; Johnny B. Goode
            </td>
          </tr>
          <tr>
            <td>
              E: Casey Jones
            </td>
          </tr>
          <tr>
            <td>
              Final ''Rosalie McFall''
            </td>
          </tr>
          <tr>
            <td>
              *appears on "Reckoning." +appears on "Dead Set."
            </td>
          </tr>
        </table>
      </div>
      <div>
        <table border="0" cellspacing="0" cellpadding="0">
          <tr>
            <td id="1029">
              <a href="/1980-10-29">10/29/1980 Radio City Music Hall, New York, NY</a> [<a href="http://www.archive.org/search.php?query=creator:%22Grateful%20Dead%22%20date:1980-10-29*">Listen/Download</a>]
            </td>
          </tr>
          <tr>
            <td>
              I: Dire Wolf@, On The Road Again@, Roses@, Race Is On@, Bird Song@, Heaven Help The Fool@, Ain't No Lie@ &gt; Ripple@
            </td>
          </tr>
          <tr>
            <td>
              II: Stranger &gt; Franklin's, Me and My Uncle &gt; Big River, Candyman * &gt; Rooster *, Tennessee Jed, L. L. Rain, Althea &gt; Music
            </td>
          </tr>
          <tr>
            <td>
              III: China Cat + &gt; I Know You Rider + &gt; Estimated &gt; Terrapin &gt; Drumz &gt; Wheel &gt; Saint &gt; Black Peter &gt; Sugar Magnolia
            </td>
          </tr>
          <tr>
            <td>
              E: U. S. Blues
            </td>
          </tr>
          <tr>
            <td>
              *appears on "Dead Set." +appears in the DVD included with the deluxe edition of the "Grateful Dead Scrapbook."
            </td>
          </tr>
        </table>
      </div>
      <div>
        <table border="0" cellspacing="0" cellpadding="0">
          <tr>
            <td id="1030">
              <a href="/1980-10-30">10/30/1980 Radio City Music Hall, New York, NY</a> [<a href="http://www.archive.org/search.php?query=creator:%22Grateful%20Dead%22%20date:1980-10-30*">Listen/Download</a>]
            </td>
          </tr>
          <tr>
            <td>
              I: Deep Elem@, Dark Hollow@, All Around This World@, On The Road Again@+#, To Lay Me Down@#, Heaven Help The Fool@%, Ripple@
            </td>
          </tr>
          <tr>
            <td>
              II: Alabama &gt; Promised, Peggy-O, Mama Tried &gt; Mexicali, Loser, Minglewood, Althea &gt; Sailor &gt; Saint
            </td>
          </tr>
          <tr>
            <td>
              III: Shakedown %, Samson %, He's Gone % &gt; Truckin % &gt; Drumz* &gt; Other One &gt; Wharf Rat &gt; Good Lovin
            </td>
          </tr>
          <tr>
            <td>
              E: Johnny B. Goode
            </td>
          </tr>
          <tr>
            <td>
              Final ''Dark Hollow''
            </td>
          </tr>
          <tr>
            <td>
              *with Billy Cobham. +appears on Reckoning. #appears in the "Dead Ahead" video. %appears as a "Dead Ahead" video bonus song.
            </td>
          </tr>
        </table>
      </div>
      <div>
        <table border="0" cellspacing="0" cellpadding="0">
          <tr>
            <td id="1031">
              <a href="/1980-10-31">10/31/1980 Radio City Music Hall, New York, NY</a> [<a href="http://www.archive.org/search.php?query=creator:%22Grateful%20Dead%22%20date:1980-10-31*">Listen/Download</a>]
            </td>
          </tr>
          <tr>
            <td>
              I: Heaven Help The Fool@, Sage And Spirit@#, Sadie@#, Monkey and Engineer@, Roses@, Cassidy@, Bird Song@* &gt; Ripple@*
            </td>
          </tr>
          <tr>
            <td>
              II: Jack Straw, Cold Rain, Me and My Uncle * &gt; Mexicali *, Ramble On * &gt; Rooster *, B. E. Women &gt; L. L. Rain &gt; Deal
            </td>
          </tr>
          <tr>
            <td>
              III: Don't Ease * &gt; Sailor * &gt; Saint * &gt; Franklin's * &gt; Drumz *+ &gt; Fire *+ &gt; NFA * &gt; Stella Blue &gt; GDTRFB &gt; Good Lovin *
            </td>
          </tr>
          <tr>
            <td>
              E: Uncle John *
            </td>
          </tr>
          <tr>
            <td>
              Previous ''Sadie'' 2/28/1970 [722 shows]; Previous ''Sage And Spirit'' 8/13/1975 [330 shows]; Final ''Heaven Help The Fool''; Final ''Sadie''; Final ''Sage And Spirit''
            </td>
          </tr>
          <tr>
            <td>
              Closed circuit TV on the East Coast. FM broadcast. No Phil until "Roses" due to technical problems. *appears in the "Dead Ahead" video. +appears on "Dead Set." #appears as a "Reckoning" bonus track in "Beyond Description (1973-1989)."
            </td>
          </tr>
        </table>
      </div>
      <div>
        <table border="0" cellspacing="0" cellpadding="0">
          <tr>
            <td id="1126">
              <a href="/1980-11-26">11/26/1980 Sportatorium, Pembroke Pines, FL</a> [<a href="http://www.archive.org/search.php?query=creator:%22Grateful%20Dead%22%20date:1980-11-26*">Listen/Download</a>]
            </td>
          </tr>
          <tr>
            <td>
              I: Alabama &gt; Greatest, FOTD, On The Road Again, Jack A Roe, Minglewood, Roses, Race Is On, Althea &gt; Sailor &gt; Saint &gt; Deal
            </td>
          </tr>
          <tr>
            <td>
              II: Cold Rain, Samson, China Cat &gt; I Know You Rider &gt; Estimated &gt; Eyes &gt; Drumz &gt; Wharf Rat &gt; Around &gt; Good Lovin
            </td>
          </tr>
          <tr>
            <td>
              E: Satisfaction
            </td>
          </tr>
          <tr>
            <td>
              First ''Satisfaction''
            </td>
          </tr>
        </table>
      </div>
      <div>
        <table border="0" cellspacing="0" cellpadding="0">
          <tr>
            <td id="1128">
              <a href="/1980-11-28">11/28/1980 Lakeland Civic Center Arena, Lakeland, FL</a> [<a href="http://www.archive.org/search.php?query=creator:%22Grateful%20Dead%22%20date:1980-11-28*">Listen/Download</a>]
            </td>
          </tr>
          <tr>
            <td>
              I: Jack Straw, Peggy-O, Rooster, Tennessee Jed, Passenger, Deep Elem, L. L. Rain, Deal
            </td>
          </tr>
          <tr>
            <td>
              II: Stranger, To Lay Me Down &gt; Let It Grow &gt; Terrapin &gt; Drumz &gt; NFA &gt; Black Peter &gt; Sugar Magnolia
            </td>
          </tr>
          <tr>
            <td>
              E: U. S. Blues
            </td>
          </tr>
        </table>
      </div>
      <div>
        <table border="0" cellspacing="0" cellpadding="0">
          <tr>
            <td id="1129">
              <a href="/1980-11-29">11/29/1980 Alligator Alley Gym, U. of Fl., Gainesville, FL</a> [<a href="http://www.archive.org/search.php?query=creator:%22Grateful%20Dead%22%20date:1980-11-29*">Listen/Download</a>]
            </td>
          </tr>
          <tr>
            <td>
              I: Alabama &gt; Promised, Candyman, Minglewood, Row Jimmy, Mama Tried &gt; Mexicali, Althea &gt; Sailor &gt; Saint &gt; Don't Ease
            </td>
          </tr>
          <tr>
            <td>
              II: Shakedown &gt; Franklin's &gt; Estimated &gt; He's Gone &gt; Truckin &gt; Drumz &gt; Other One &gt; Stella Blue &gt; Good Lovin
            </td>
          </tr>
          <tr>
            <td>
              E: Casey Jones
            </td>
          </tr>
        </table>
      </div>
      <div>
        <table border="0" cellspacing="0" cellpadding="0">
          <tr>
            <td id="1130">
              <a href="/1980-11-30">11/30/1980 Fox Theatre, Atlanta, GA</a> [<a href="http://www.archive.org/search.php?query=creator:%22Grateful%20Dead%22%20date:1980-11-30*">Listen/Download</a>]
            </td>
          </tr>
          <tr>
            <td>
              I: Stranger, Loser, Cassidy, Ramble On, Rooster, Bird Song, Me and My Uncle &gt; Big River, Roses, Sailor &gt; Saint &gt; Deal
            </td>
          </tr>
          <tr>
            <td>
              II: Scarlet &gt; Fire, Samson, Ship Of Fools, Playin &gt; Drumz &gt; Wheel &gt; China Doll &gt; Around &gt; Johnny B. Goode
            </td>
          </tr>
          <tr>
            <td>
              E: Uncle John
            </td>
          </tr>
          <tr>
            <td>
              Last electric "Bird Song": 09-15-73 [410].
            </td>
          </tr>
        </table>
      </div>
      <div>
        <table border="0" cellspacing="0" cellpadding="0">
          <tr>
            <td id="1206">
              <a href="/1980-12-06">12/6/1980 Recreation Center, Mill Valley, CA</a> [<a href="http://www.archive.org/search.php?query=creator:%22Grateful%20Dead%22%20date:1980-12-06*">Listen/Download</a>]
            </td>
          </tr>
          <tr>
            <td>
              Dire Wolf@, On The Road Again@, All Around This World@, Monkey and Engineer@, Jack A Roe@, Cassidy@, Bird Song@, Ain't No Lie@, Ripple@
            </td>
          </tr>
          <tr>
            <td>
              Next ''Ain't No Lie'' 10/16/1981 [74 shows]
            </td>
          </tr>
        </table>
      </div>
      <div>
        <table border="0" cellspacing="0" cellpadding="0">
          <tr>
            <td id="1212">
              <a href="/1980-12-12">12/12/1980 Swing Auditorium, San Bernardino, CA</a> [<a href="http://www.archive.org/search.php?query=creator:%22Grateful%20Dead%22%20date:1980-12-12*">Listen/Download</a>]
            </td>
          </tr>
          <tr>
            <td>
              I: Alabama &gt; Greatest, FOTD, Mama Tried &gt; Mexicali, Althea &gt; Rooster, Peggy-O &gt; L. L. Rain &gt; Tennessee Jed &gt; Promised
            </td>
          </tr>
          <tr>
            <td>
              II: China Cat &gt; I Know You Rider &gt; Estimated &gt; He's Gone &gt; Eyes &gt; Drumz &gt; Truckin &gt; Wharf Rat &gt; Around &gt; Good Lovin
            </td>
          </tr>
          <tr>
            <td>
              E: Don't Ease
            </td>
          </tr>
        </table>
      </div>
      <div>
        <table border="0" cellspacing="0" cellpadding="0">
          <tr>
            <td id="1213">
              <a href="/1980-12-13">12/13/1980 Long Beach Arena, Long Beach, CA</a> [<a href="http://www.archive.org/search.php?query=creator:%22Grateful%20Dead%22%20date:1980-12-13*">Listen/Download</a>]
            </td>
          </tr>
          <tr>
            <td>
              I: Stranger &gt; Sugaree &gt; C. C. Rider, To Lay Me Down &gt; Minglewood, Ramble On, Sailor &gt; Saint &gt; Deal
            </td>
          </tr>
          <tr>
            <td>
              II: Scarlet &gt; Fire, Playin &gt; Drumz* &gt; NFA &gt; Black Peter &gt; Sugar Magnolia
            </td>
          </tr>
          <tr>
            <td>
              E: Saturday Night
            </td>
          </tr>
          <tr>
            <td>
              *with Flora Purim and Airto Moreira.
            </td>
          </tr>
        </table>
      </div>
      <div>
        <table border="0" cellspacing="0" cellpadding="0">
          <tr>
            <td id="1214">
              <a href="/1980-12-14">12/14/1980 Long Beach Arena, Long Beach, CA</a> [<a href="http://www.archive.org/search.php?query=creator:%22Grateful%20Dead%22%20date:1980-12-14*">Listen/Download</a>]
            </td>
          </tr>
          <tr>
            <td>
              I: Bertha &gt; Greatest, Althea &gt; Rooster*, Loser, Me and My Uncle &gt; Big River, Bird Song, Passenger, Candyman &gt; L. L. Rain, Don't Ease
            </td>
          </tr>
          <tr>
            <td>
              II: Cold Rain &gt; Samson, Roses, Estimated &gt; Wheel &gt; Drumz+ &gt; Other One &gt; Stella Blue &gt; Around* &gt; Good Lovin
            </td>
          </tr>
          <tr>
            <td>
              E: Brokedown
            </td>
          </tr>
          <tr>
            <td>
              *with Matt Kelly. +with Flora Purim and Airto Moreira.
            </td>
          </tr>
        </table>
      </div>
      <div>
        <table border="0" cellspacing="0" cellpadding="0">
          <tr>
            <td id="1226">
              <a href="/1980-12-26">12/26/1980 Oakland Auditorium Arena, Oakland, CA</a> [<a href="http://www.archive.org/search.php?query=creator:%22Grateful%20Dead%22%20date:1980-12-26*">Listen/Download</a>]
            </td>
          </tr>
          <tr>
            <td>
              I: Alabama &gt; Promised, TLEO, C. C. Rider, Althea, Cassidy, Peggy-O, Sailor &gt; Saint &gt; Deal
            </td>
          </tr>
          <tr>
            <td>
              II: Scarlet &gt; Fire, Samson, Ship Of Fools, Playin &gt; Drumz &gt; NFA &gt; Black Peter &gt; Around &gt; Good Lovin
            </td>
          </tr>
          <tr>
            <td>
              E: U. S. Blues
            </td>
          </tr>
          <tr>
            <td>
              SEVA benefit.
            </td>
          </tr>
        </table>
      </div>
      <div>
        <table border="0" cellspacing="0" cellpadding="0">
          <tr>
            <td id="1227">
              <a href="/1980-12-27">12/27/1980 Oakland Auditorium Arena, Oakland, CA</a> [<a href="http://www.archive.org/search.php?query=creator:%22Grateful%20Dead%22%20date:1980-12-27*">Listen/Download</a>]
            </td>
          </tr>
          <tr>
            <td>
              I: Stranger, Sugaree &gt; Minglewood, Loser, L. L. Rain, Tennessee Jed, Passenger, Roses, Music
            </td>
          </tr>
          <tr>
            <td>
              II: China Cat &gt; I Know You Rider &gt; Estimated &gt; Eyes &gt; Drumz &gt; Wheel &gt; Truckin &gt; Wharf Rat &gt; GDTRFB &gt; Saturday Night
            </td>
          </tr>
          <tr>
            <td>
              E: Johnny B. Goode
            </td>
          </tr>
        </table>
      </div>
      <div>
        <table border="0" cellspacing="0" cellpadding="0">
          <tr>
            <td id="1228">
              <a href="/1980-12-28">12/28/1980 Oakland Auditorium Arena, Oakland, CA</a> [<a href="http://www.archive.org/search.php?query=creator:%22Grateful%20Dead%22%20date:1980-12-28*">Listen/Download</a>]
            </td>
          </tr>
          <tr>
            <td>
              I: Half Step &gt; Franklin's, Me and My Uncle &gt; Big River, Bird Song, Rooster, Althea, Jack Straw
            </td>
          </tr>
          <tr>
            <td>
              II: Don't Ease, Sailor &gt; Saint &gt; Terrapin &gt; Drumz &gt; Other One &gt; Stella Blue &gt; Sugar Magnolia
            </td>
          </tr>
          <tr>
            <td>
              E: Casey Jones
            </td>
          </tr>
        </table>
      </div>
      <div>
        <table border="0" cellspacing="0" cellpadding="0">
          <tr>
            <td id="1230">
              <a href="/1980-12-30">12/30/1980 Oakland Auditorium Arena, Oakland, CA</a> [<a href="http://www.archive.org/search.php?query=creator:%22Grateful%20Dead%22%20date:1980-12-30*">Listen/Download</a>]
            </td>
          </tr>
          <tr>
            <td>
              I: Minglewood, FOTD, Mama Tried &gt; Mexicali, B. E. Women, BIODTL, Althea, Let It Grow &gt; Deal
            </td>
          </tr>
          <tr>
            <td>
              II: Shakedown, Samson, He's Gone &gt; Truckin &gt; Drumz &gt; NFA &gt; China Doll &gt; Around &gt; Good Lovin
            </td>
          </tr>
          <tr>
            <td>
              E: U. S. Blues
            </td>
          </tr>
          <tr>
            <td>
              Soundcheck: Baby Blue, To Lay Me Down, Youngblood, Searchin.
            </td>
          </tr>
        </table>
      </div>
      <div>
        <table border="0" cellspacing="0" cellpadding="0">
          <tr>
            <td id="1231">
              <a href="/1980-12-31">12/31/1980 Oakland Auditorium Arena, Oakland, CA</a> [<a href="http://www.archive.org/search.php?query=creator:%22Grateful%20Dead%22%20date:1980-12-31*">Listen/Download</a>]
            </td>
          </tr>
          <tr>
            <td>
              I: Dire Wolf@, On The Road Again@, To Lay Me Down@, Monkey and Engineer@, Jack A Roe@, Cassidy@, All Around This World@, Race Is On@, Bird Song@ &gt; Ripple@
            </td>
          </tr>
          <tr>
            <td>
              II: Alabama &gt; Greatest, TLEO, Rooster*, China Cat &gt; I Know You Rider, L. L. Rain, Althea &gt; Sailor &gt; Saint &gt; Deal
            </td>
          </tr>
          <tr>
            <td>
              III: Sugar Magnolia &gt; Scarlet &gt; Fire+, Estimated &gt; Drumz &gt; Other One &gt; Wharf Rat+ &gt; Around+ &gt; Sunshine Daydream+
            </td>
          </tr>
          <tr>
            <td>
              E: Satisfaction &gt; Brokedown
            </td>
          </tr>
          <tr>
            <td>
              Next ''Sunshine Daydream'' 9/25/1981 [53 shows]; Final ''All Around This World''
            </td>
          </tr>
          <tr>
            <td>
              Bill Graham rides in at midnight on top of a giant skull. *with Matt Kelly. +with John Cipollina.
            </td>
          </tr>
        </table>
      </div>
    </div>
  </body>
</html>
